id,hotel_id,url_id,language,description,created_at,updated_at
d4e9deec-ef2e-4a33-98c8-2b32113b5932,ad2f57f5-38e7-436d-823c-b0e7ba494640,8b5d5415-8683-4bc7-a6b3-21068db90f5f,en,"Situated in the famous Getreidegasse in Salzburg’s Old Town, Hotel Goldener Hirsch - a Luxury Collection Hotel, Salzburg is directly opposite the Festival Hall and only a few steps away from Mozart’s Birthplace. It offers free WiFi in the entire property.

This traditional luxury hotel occupies a historic building from the 15th century. The rooms are furnished in a classic Austrian style and equipped with many antiques and handmade furniture. The entire hotel is non-smoking.

Restaurant Goldener Hirsch serves Austrian and international cuisine, and traditional Salzburg dishes are served in the Restaurant Herzl.

Bar Goldener Hirsch serves a wide range of drinks and is a popular meeting place with an elegant ambience. Guests can also make use of the library and a computer free of charge.

The cathedral, Hohensalzburg Fortress, and all major sights of Salzburg are only a short walk away from Hotel Goldener Hirsch.",2026-06-12 03:03:57.654106+01,2026-06-12 03:03:57.655106+01
5af51a22-c69d-49ea-bd75-ae606e0bae59,5a4d26c2-6fda-451b-993e-3f81eec1b936,55b8d331-485d-4f57-bb60-e9c66ad3a753,de,"Das 1866 eröffnete Hotel Sacher Salzburg in Privatbesitz ist ein großartiges, historisches Hotel, das zeitlose Eleganz und Tradition mit höchstem Servicestandard verbindet. Es liegt zentral am Ufer der Salzach mit herrlichem und einzigartigem Blick auf die historische Altstadt sowie die Festung Hohensalzburg. WLAN steht Ihnen im gesamten Hotel kostenlos zur Verfügung.

Alle Zimmer und Suiten sind individuell eingerichtet und bieten hochmoderne Einrichtungen. Zur Ausstattung gehören Originalgemälde und Seidentapeten. Alle Zimmer bieten Klimaanlage, eine Minibar und Bademäntel.

Bei Feinschmeckern erfreut sich das Restaurant Zirbelzimmer mit seiner Holzvertäfelung und den kunstvoll geschnitzten Decken, die in Salzburg einzigartig sind, großer Beliebtheit. Das Restaurant Roter Salon befindet sich am Fußweg entlang der Salzach und bietet einen herrlichen Blick auf die Altstadt. Das Restaurant Salzachgrill serviert Grillspezialitäten.

Im berühmten Café Sacher Salzburg genießen Sie die Original Sachertorte im typischen Ambiente eines eleganten österreichischen Kaffeehauses. Die Sacher Bar serviert eine große Auswahl an Getränken bei Live-Klaviermusik.",2026-06-12 02:58:33.662212+01,2026-06-12 02:58:33.66321+01
dc277d7f-12ad-4501-afa3-cbf59e84027c,857aa3d7-ec3d-45c5-b679-de331404b278,55b8d331-485d-4f57-bb60-e9c66ad3a753,it,"Opened in 1866, the privately owned Hotel Sacher Salzburg is a grand, historic hotel which combines timeless elegance and tradition with highest standard of service. It is centrally located on the banks of the Salzach River with magnificent and unique views of the historic old town and Hohensalzburg Fortress. Free Wi-Fi is available in the entire hotel.

All rooms and suites are furnished in an individual fashion and offer state-of-the-art facilities. Furnishings include original paintings and silk wallpapers. All rooms offer air conditioning, a minibar, and bathrobes.

The restaurant Zirbelzimmer, whose wooden panelling and elaborately carved ceilings are unique in Salzburg, is a popular meeting place for gourmets. Restaurant Roter Salon is located on the footpath along the Salzach River and offers beautiful views of the old town and restaurant Salzachgrill serves barbecue specialties.

The famous Café Sacher Salzburg serves the original Sacher cake in a typical Austrian coffee house ambience with an elegant touch. Sacher Bar serves a wide range of drinks accompanied by live piano music.",2026-06-12 02:59:29.351495+01,2026-06-12 02:59:29.351495+01
5a0b1e71-20fb-442a-8896-60751c1ebdf8,b15c26fe-1a5b-48ee-938d-8a0f681a5ccd,457eec00-a928-4198-b58b-ae91af8b1cfb,fr,"L'Hotel Bristol vous accueille au cœur de Salzbourg, à seulement quelques pas du palais Mirabell et du grand palais des festivals. Géré par la même famille depuis 3 générations, cet hôtel 5 étoiles historique propose un restaurant primé et une connexion Wi-Fi gratuite dans l’ensemble de ses locaux.

Spacieuses, élégantes et climatisées, les chambres non-fumeurs sont toutes aménagées différemment. Offrant une vue sur la ville, les hébergements sont dotés d'une télévision par satellite à écran plat, d'un minibar et d'un coffre-fort. Toutes les boissons sans alcool du minibar sont gratuites.

Décoré d’antiquités, de tableaux et d’objets de collection, l’Hotel Bristol Salzburg assure des services de concierge et de voiturier. Vous pourrez vous détendre dans la bibliothèque. Sur demande préalable, vous pourrez également profiter de massages en chambre.

Un copieux petit-déjeuner buffet est servi dans la salle Crystal, dotée de magnifiques lustres en cristal. Le restaurant primé de l’hôtel, le Polo Lounge, propose des spécialités internationales et autrichiennes. Le bar-salon Sketch organise régulièrement des soirées avec concert de piano.

La rue commerçante Getreidegasse ainsi que de nombreux autres sites culturels se trouvent à proximité et sont facilement accessibles à pied. L’Hotel Bristol est situé juste à côté de l’arrêt de bus Makartplatz et d’une station de taxis.",2026-06-12 03:01:02.549913+01,2026-06-12 03:01:02.550559+01
90909c85-cdc0-4411-a8d4-4c78bee1419c,a4dfc924-cc9b-4e73-89be-764857f9cb2d,457eec00-a928-4198-b58b-ae91af8b1cfb,pt,"Hotel Bristol is situated in the heart of Salzburg, only a few steps away from Mirabell Palace and the Festival Houses. Family-run for 3 generations, this historic 5-star hotel offers an award-winning restaurant and free WiFi throughout the hotel.

The spacious and elegant non-smoking rooms are air-conditioned and individually furnished. They overlook the city and feature a flat-screen satellite TV, a minibar, and a safe.  All non-alcoholic drinks in minibar are provided for free.

Decorated with antiquities, paintings, and collectibles, Hotel Bristol Salzburg offers a concierge service and valet parking. Guests can relax in the library. Further, we may book massages in your room, which needs to be requested in advance.

Guests can enjoy the rich breakfast buffet in the Crystal Room, which is decorated with impressive crystal chandeliers. The hotel’s award-winning restaurant Polo Lounge serves international and Austrian specialties. The Sketch Bar and Lounge hosts regular piano evenings.

The Getreidegasse shopping street and many other cultural attractions are nearby and can be easily reached on foot. The Makartplatz Bus Stop and a taxi stand are right next to Hotel Bristol.",2026-06-12 03:01:23.955072+01,2026-06-12 03:01:23.955585+01
6f48a4de-c319-433c-8084-2e08cd4a3b83,e0f30796-ea1b-4219-8266-3843fbe17e72,1eb66b2a-ecae-46f1-9103-9e993fe0b064,en,"This 5-star superior hotel enjoys a unique location on top of the Mönchsberg, a hill in the centre of Salzburg. It is surrounded by a large park and offers panoramic city views, an outdoor infinity pool, and an outdoor hot tub. on-site private parking and free WiFi is available as well.

The exclusive rooms and suites are all individually and luxuriously furnished. They feature priceless antiques and marble bathrooms, as well as modern amenities such as air conditioning. Upon arrival, guests receive a welcome drink, a complementary fruit basket and a home made Guglhupf cake.

300 m² spa area with heated outdoor infinity pool (seasonal May - October), outdoor whirlpool, Finnish sauna, steam bath, relaxation areas and sun terrace. Modern fitness room with Technogym equipment. Massages available.

Awarded 4 toques by Gault Millau and 1 Michelin star, the gourmet restaurant THE GLASS GARDEN serves traditional Austrian cuisine, international dishes and a wide selection of fine wines. For events, the hotel additionally offers the Mönchstein Saal, a festivity hall.

Hotel Schloss Mönchstein is only a 7-minute walk away from the Old Town, which can be reached by car or on foot via a lift built into the mountain. Guests staying at the hotel will receive free tickets for this lift. E-refueling station available (for electro cars)",2026-06-12 03:02:57.074738+01,2026-06-12 03:02:57.075245+01
88afdcf3-56e1-4a35-bfd0-50f4b18a9eca,56d3be19-d93c-490d-90b9-de37441ca4f4,457eec00-a928-4198-b58b-ae91af8b1cfb,es,"El Hotel Bristol está ubicado en pleno centro de Salzburgo, a solo unos pasos del Palacio de Mirabell y del auditorio Großes Festspielhaus. Este histórico hotel de 5 estrellas, de gestión familiar durante 3 generaciones, alberga un restaurante galardonado. Hay WiFi gratuita en todo el hotel.

Las habitaciones, amplias y elegantes, son para no fumadores. Disponen de aire acondicionado y presentan una decoración individual. Tienen vistas a la ciudad, TV de pantalla plana con canales vía satélite, minibar y caja fuerte. Todas las bebidas sin alcohol del minibar son gratuitas.

El Hotel Bristol Salzburg luce una decoración con antigüedades, lienzos y artículos de colección. Hay servicio de conserjería y de aparcacoches. Alberga una biblioteca. El servicio de masajes en la habitación puede reservarse con antelación.

Se sirve un desayuno buffet abundante en el salón Crystal, decorado con impresionantes lámparas de araña hechas de cristal. El restaurante galardonado del hotel, el Polo Lounge, propone platos internacionales y especialidades austriacas. El bar salón Sketch suele organizar veladas con música de piano a menudo.

La calle comercial Getreidegasse y otros lugares de interés cultural quedan cerca y se puede ir fácilmente a pie. La parada de autobús Makartplatz y una parada de taxis están justo al lado del Hotel Bristol.",2026-06-12 02:58:43.366264+01,2026-06-12 02:58:43.367264+01
eea3c526-72d1-429c-a4a4-fd5f91a0d306,f05c5f1e-9abd-4140-ac4d-d338a82709a5,457eec00-a928-4198-b58b-ae91af8b1cfb,it,"L'Hotel Bristol sorge nel cuore di Salisburgo, a pochi passi dal Castello di Mirabell e dalle Case del Festival. A conduzione familiare da 3 generazioni, questo storico hotel a 5 stelle offre un ristorante premiato e la connessione WiFi gratuita in tutta la struttura.

Spaziose ed eleganti, le camere sono non fumatori e dotate di aria condizionata e arredi personalizzati. Si affacciano sulla città e dispongono di TV satellitare a schermo piatto, minibar e cassetta di sicurezza. Tutte le bevande analcoliche del minibar sono gratuite.

Decorato con pezzi d’antiquariato, dipinti e oggetti da collezione, l’Hotel Bristol Salzburg vanta un servizio concierge e un servizio di parcheggio e riconsegna auto. Potrete rilassarvi nella biblioteca. Inoltre, potrete prenotare massaggi in camera, che devono essere richiesti in anticipo.

Al mattino vi attende un ricco buffet per la colazione presso la Crystal Room, impreziosita da maestosi lampadari pendenti di cristallo Il premiato ristorante Polo Lounge serve specialità internazionali e austriache. Lo Sketch Bar and Lounge ospita regolarmente serate di pianoforte.

Potrete raggiungere facilmente a piedi la via dello shopping Getreidegasse e molte attrazioni culturali nelle immediate vicinanze. La fermata dell&#39;autobus Makartplatz e la stazione dei taxi si trovano proprio accanto all&#39;Hotel Bristol.",2026-06-12 02:59:48.877029+01,2026-06-12 02:59:48.877558+01
9f02d308-dc1e-4f97-9213-a0d62b0cd14b,4dff162b-2460-4fae-87e1-518250f640f2,55b8d331-485d-4f57-bb60-e9c66ad3a753,pt,"Opened in 1866, the privately owned Hotel Sacher Salzburg is a grand, historic hotel which combines timeless elegance and tradition with highest standard of service. It is centrally located on the banks of the Salzach River with magnificent and unique views of the historic old town and Hohensalzburg Fortress. Free Wi-Fi is available in the entire hotel.

All rooms and suites are furnished in an individual fashion and offer state-of-the-art facilities. Furnishings include original paintings and silk wallpapers. All rooms offer air conditioning, a minibar, and bathrobes.

The restaurant Zirbelzimmer, whose wooden panelling and elaborately carved ceilings are unique in Salzburg, is a popular meeting place for gourmets. Restaurant Roter Salon is located on the footpath along the Salzach River and offers beautiful views of the old town and restaurant Salzachgrill serves barbecue specialties.

The famous Café Sacher Salzburg serves the original Sacher cake in a typical Austrian coffee house ambience with an elegant touch. Sacher Bar serves a wide range of drinks accompanied by live piano music.",2026-06-12 03:01:05.297281+01,2026-06-12 03:01:05.298281+01
e42ff9cf-6f97-4765-bbb7-18dc38ac11c6,096ce86b-e1fc-4d81-817b-6ff4119bf101,0f40c6e5-0e10-494f-a41b-9202e6c9bc1c,en,"Comfortable Accommodations:Hotel Spirodom in Admont offers rooms with balconies, private bathrooms, and modern amenities. Each room includes a work desk, TV, and free WiFi, ensuring a pleasant stay.Wellness and Leisure:Guests can enjoy spa facilities, a sauna, fitness centre, indoor swimming pool, and sun terrace. Additional amenities include a steam room, hammam, and electric vehicle charging station.Dining Experience:The modern, family-friendly restaurant serves Austrian cuisine with vegetarian, vegan, and gluten-free options. A buffet breakfast is provided each morning, highly praised by guests.Prime Location:Located a 2-minute walk from Admont Abbey, the hotel is 107 km from Linz Airport. Nearby attractions include Hochtor (12 km) and Trautenfels Castle (35 km). Guests appreciate the convenient location and excellent service.",2026-06-12 03:13:57.529866+01,2026-06-12 03:13:57.530865+01
4b6ae672-2c01-42b7-8dcc-2b38d6cd29c4,a0e818de-2c53-4031-959c-a62b74c683e6,0115d190-a11c-419b-8b15-ff7ce86f13c7,en,"Hotel Seevilla is located on the shore of the beautiful Lake Altaussee. It features a spacious terrace and an indoor pool with panoramic windows and views of the lake.

The Seevilla’s spa area boasts a sauna and a steam bath. Beauty and body treatments are offered as well. Guests can swim in the pool or use the hotel’s private beach area at the lake.

This 4-star hotel offers spacious and bright rooms with free access to Wi-Fi, a satellite flat-screen TV and a balcony. Each room has a seating area and a modern bathroom equipped with bathrobes, slippers and toiletries.

A bar and a restaurant are on site. Guests can enjoy regional and international cuisine in the elegant dining room or on the terrace.

Hotel Seevilla offers free bicycles for rent in nice weather. Guests also enjoy free access to a tennis centre located next to the hotel.

A ski storage room is also at guests’ disposal. Loser Mountain Cable Car can be reached within a 10-minute drive. Tauplitz ski area is a 40-minute drive away. The hotel provides a free shuttle service to the ski areas and cross country ski tracks.",2026-06-12 03:25:06.280703+01,2026-06-12 03:25:06.281743+01
3a8ffc4d-96ca-48a2-8963-95ccc7a08681,a7ff9888-18e9-4809-a8bd-8b6ca1a3404b,5bec1a5d-93ec-488d-b808-c4496b9bc14b,en,"Located in the heart of Styria’s Thermal Region, Rogner Bad Blumau is not only a spa hotel, but a “Gesamtkunstwerk” (“complete artwork”), designed by the famous Austrian architect Friedensreich Hundertwasser.

Rogner Bad Blumau is a voyage of discovery. Leafy roofs, round shapes, colourful façades and golden domes, surrounded by fields and meadows, create a living work of art. The unique Vulkania mineral spring is of volcanic origin and is collected in the Vulkania healing lake, featuring underwater music. When bathing in this spring, the water feels like silk.

In addition to 2,400 different windows and 330 columns, hotel features include a pool and thermal landscape with 11 different indoor and outdoor pools, hot tubs, wave and children’s basins, the Melchior mineral spring and a sauna landscape with various saunas and a relaxation room.",2026-06-12 03:36:01.012486+01,2026-06-12 03:36:01.014521+01
b2e9e42e-8876-43d1-a97b-c5ea39e7b52c,49e4f6f0-0b84-441b-873e-5edea7898824,acca1db3-0adb-42fa-b830-5809799f377c,en,"Surrounded by the scenic mountains of the Dachstein Tauern Region in Upper Styria, JUFA Hotel Donnersbachwald is located at the edge of the forest, only a 5-minute walk away from the village centre of Donnersbachwald. In winter, it is right next to the slopes of the Riesneralm Ski Area, and in summer, hiking trails start at the doorstep.

JUFA Donnersbachwald features a café, a sun terrace, a fireplace lounge, a beechwood-fired sauna, seminar rooms, a ski shelter, a bicycle room, internet terminals, a children's playroom with a bouldering wall, and an outdoor play area.",2026-06-12 04:42:23.320718+01,2026-06-12 04:42:23.322718+01
e2cb3fbc-d051-4094-ac7e-66caa9656e89,4c5bbc09-0db4-49aa-8a00-fa68723e479d,186ecabc-a0ec-461e-9b56-7e9591aebdcf,en,"Comfortable Accommodations:JUFA Hotel Deutschlandsberg in Deutschlandsberg offers family rooms with private bathrooms, garden views, and modern amenities. Each room includes air-conditioning, a balcony, and free WiFi.Wellness and Leisure:Guests can enjoy spa facilities, a sauna, fitness centre, sun terrace, and garden. Additional amenities include a steam room, indoor and outdoor play areas, and bicycle parking.Dining Experience:The hotel serves international cuisine with local specialities, fresh pastries, and a variety of breakfast options including continental, buffet, vegetarian, and gluten-free.Convenient Location:Located 40 km from Graz Airport, the hotel is near attractions such as Graz Central Station (43 km) and Eggenberg Palace (44 km). Free on-site private parking is available.",2026-06-12 04:43:25.73399+01,2026-06-12 04:43:25.734991+01
9e062d05-4d55-4f74-b879-bdda56b7586b,7bd31c2b-9e21-49d2-958f-108add4cfa6a,acca1db3-0adb-42fa-b830-5809799f377c,es,"El JUFA Hotel Donnersbachwald está rodeado por las pintorescas montañas de la región de Dachstein Tauern, en la Alta Estiria, junto al bosque y a solo 5 minutos a pie del centro de la localidad de Donnersbachwald. En invierno, está justo al lado de las pistas de la estación de esquí de Riesneralm. En verano, hay rutas de senderismo que comienzan junto al establecimiento.

El JUFA Donnersbachwald cuenta con cafetería, solárium, salón con chimenea, sauna de madera de haya, salas de reuniones, guardaesquíes, sala para bicicletas, terminales con conexión a internet, sala de juegos para niños con pared de escalada y zona de juegos al aire libre.",2026-06-12 04:43:35.774879+01,2026-06-12 04:43:35.775876+01
1a0d4969-6401-4a14-849f-b206aaf3558f,8b90716d-58c4-4768-82b0-2b9f453b0447,acca1db3-0adb-42fa-b830-5809799f377c,it,"Circondato dalle pittoresche montagne della regione Dachstein Tauern, nell'Alta Stiria, lo JUFA Hotel Donnersbachwald sorge ai margini della foresta, a soli 5 minuti a piedi dal centro del paese di Donnersbachwald. In inverno, si trova proprio accanto alle piste del comprensorio sciistico di Riesneralm, mentre in estate partono alcuni sentieri escursionistici.

Lo JUFA Donnersbachwald ospita una caffetteria, una terrazza solarium, un salone con camino, una sauna a legna, sale per seminari, un deposito sci, una sala per le biciclette, postazioni internet, una sala giochi per bambini con parete per arrampicata e un'area giochi all'aperto.",2026-06-12 04:44:53.668102+01,2026-06-12 04:44:53.668749+01
84fd6ca0-00a1-4377-9ae0-c33c73042eb6,69809b5e-c632-459f-b263-c7b5533b390c,acca1db3-0adb-42fa-b830-5809799f377c,pt,"Rodeado pelas cénicas montanhas da região de Dachstein Tauern, na Alta Estíria, o JUFA Hotel Donnersbachwald está localizado na orla da floresta, apenas a 5 minutos a pé do centro da aldeia de Donnersbachwald. No Inverno, está ao lado das pistas da Área de Esqui de Riesneralm e no Verão existem trilhos para caminhadas que começam à porta.

O JUFA Donnersbachwald apresenta um café, um terraço para banhos de sol, um salão com lareira, uma sauna a lenha de faia, salas de seminários, uma sala de armazenamento de equipamento de esqui, uma sala de armazenamento de equipamento de esqui, uma sala de bicicletas, um parque infantil com uma parede em pedra e uma área de lazer ao ar livre.",2026-06-12 04:45:53.757105+01,2026-06-12 04:45:53.757105+01
35f19fba-6937-48d4-ba21-1fdd10c21fc5,fe4fd3cf-a8ae-4b07-b03b-16a9da68636d,186ecabc-a0ec-461e-9b56-7e9591aebdcf,fr,"L’établissement JUFA Hotel Deutschlandsberg se situe à Deutschlandsberg, à 43 km de ce lieu d’intérêt : Gare centrale de Graz. Il possède une salle de sport, un jardin, une terrasse et un parking privé gratuit. Il propose un restaurant, un bar, un sauna et un spa. Une connexion Wi-Fi gratuite et un service de garde d'enfants sont disponibles.

Tous les hébergements comportent une armoire. Certains hébergements sont dotés d’un balcon. Tous comportent une salle de bains privative avec une douche et un sèche-cheveux. Vous profiterez d'une télévision à écran plat avec les chaînes du satellite et d’un coffre-fort.

Un petit-déjeuner buffet, continental ou végétarien est servi sur place.

Cet établissement dispose d’une aire de jeux pour enfants. La région est prisée des amateurs de ski et de vélo, et cet hôtel 3 étoiles assure un service de location de vélos.

Vous séjournerez à respectivement 43 km et 44 km de ces lieux d’intérêt : Casino de Graz et Château Eggenberg. L'aéroport le plus proche (Aéroport de Graz) est à 40 km.",2026-06-12 04:47:42.768183+01,2026-06-12 04:47:42.769178+01
71bef042-efed-4c34-ad65-99d0d1317915,cceca13b-a71c-448a-9b17-f9a066be9165,2185c9f0-b27c-4c47-b925-d2a708252faa,es,"El Georgi Schloss - Boutique Hotel, situado junto al río Mur en Ehrenhausen, es un palacio del siglo XIX construido en estilo Tudor. Ofrece suites en diferentes edificios.

Las suites del Georgi Schloss son amplias y elegantes. Todas incluyen suelo de madera, TV vía satélite de pantalla plana, minibar y baño elegante con secador de pelo.

Hay conexión Wi-Fi gratuita en las zonas comunes. Todas las mañanas se sirve un desayuno bufé que incluye especialidades locales y platos de huevos recién preparados. A poca distancia a pie hay varios restaurantes tradicionales.

Hay aparcamiento privado gratuito. Las bicicletas eléctricas se pueden alquilar por EUR 39 al día. Ehrenhausen es el punto de partida de la ruta del vino del sur de Estiria y está cerca de muchos restaurantes y tabernas de vino. El establecimiento ofrece descuentos en servicios de traslado a varios viticultores de los alrededores.",2026-06-12 04:52:39.481446+01,2026-06-12 04:52:39.482447+01
8fa4ecb0-7c11-40ba-bdfe-7433d42bcf82,1fb42dfa-79b6-4a24-bfdd-81a590b2395c,acca1db3-0adb-42fa-b830-5809799f377c,de,"Das JUFA Hotel Donnersbachwald ist von der malerischen Bergwelt der Region Dachstein Tauern in der Obersteiermark umgeben. Es liegt am Waldrand, nur 5 Gehminuten vom Dorfzentrum von Donnersbachwald entfernt. Die Unterkunft befindet sich direkt an den Pisten des Skigebiets Riesneralm. Wanderwege beginnen im Sommer vor der Haustür.

Das JUFA Donnersbachwald verfügt über ein Café, eine Sonnenterrasse, eine Lounge mit einem Kamin, eine Buchenholzofensauna, Seminarräume, eine Skiaufbewahrung, einen Fahrradraum, Internetterminals, ein Spielzimmer für Kinder mit einer Kletterwand sowie einen Spielbereich im Freien.",2026-06-12 04:44:28.365331+01,2026-06-12 04:44:28.366332+01
3db5a624-f56c-402f-bf6d-90b8d7f5eccc,5679a64a-141d-4f35-ba1a-f6a24b6881ea,186ecabc-a0ec-461e-9b56-7e9591aebdcf,es,"JUFA Hotel Deutschlandsberg está en Deutschlandsberg, a 43 km de Estación de tren Graz Central, y dispone de alojamiento con centro de fitness, parking privado gratis, jardín y terraza. El alojamiento ofrece restaurante y también tiene bar, sauna y centro de spa. Hay wifi gratis y servicio de guardería.

En el hotel, las habitaciones están equipadas con armario. JUFA Hotel Deutschlandsberg ofrece algunas unidades con balcón, y todas tienen baño privado con ducha y secador de pelo. Las unidades del alojamiento están equipadas con TV de pantalla plana con canales vía satélite y caja fuerte.

El desayuno está disponible e incluye opciones buffet, continentales o vegetarianas.

El alojamiento ofrece zona de juegos infantil. La zona es ideal para practicar esquí y ciclismo, y hay alquiler de bicicletas eneste hotel de 3 estrellas.

Casino Graz está a 43 km del alojamiento, y Palacio Eggenberg está a 44 km. El aeropuerto (Aeropuerto de Graz) está a 40 km.",2026-06-12 04:44:35.349992+01,2026-06-12 04:44:35.350987+01
a00fd857-4a91-4122-ada2-6adce4c00af4,ae275f4f-4a46-449b-8502-8d78ea673061,acca1db3-0adb-42fa-b830-5809799f377c,fr,"Entouré par les montagnes pittoresques de la région du Dachstein Tauern en Haute-Styrie, le JUFA Hotel Donnersbachwald est situé à la lisière de la forêt, à seulement 5 minutes à pied du centre du village de Donnersbachwald. En hiver, il se trouve juste à côté des pistes du domaine skiable de Riesneralm. En été, des sentiers de randonnée commencent juste devant l'établissement.

Le JUFA Donnersbachwald dispose d'un café, d'une terrasse bien exposée, d'un salon avec une cheminée, d'un sauna au feu de hêtre, de salles de séminaires, d'un abri à skis, de bornes Internet, d'une salle de jeux pour enfants avec un mur de pétanque et d'une aire de jeux extérieure.",2026-06-12 04:45:30.138504+01,2026-06-12 04:45:30.138504+01
