id,hotel_id,url_id,language,fp,created_at,updated_at
9476883a-9353-4144-b522-b768d8e23e0f,b642d0b8-8cf7-445b-bd33-e682fbc503ee,87be0e54-1e4d-4073-9e3d-547b0a2e1707,en,"<p>The property can be reached by a private and a shared speedboat.</p><p>Private Speedboat Transfers: </p><p>From July 1, 2025 to July 31, 2026 the charges are as follows:</p><p>- Adult: USD 2252.30 per boat per way, with a maximum of 8 people.</p><p>- Child: USD 2252.30 per boat per way, with a maximum of 8 people. This rate is not included in the booking price and will be charged additionally.</p><p>Shared Speedboat Transfers: </p><p>From July 1, 2025 to December 31, 2026 the charges are as follows:</p><p>- Adult (12 years and above): USD 353 per person.</p><p>- Child (2–11 years): USD 176.51 per child. This rate is not included in the booking price and will be charged additionally.</p><p>The Green Tax of USD 12 per person per day will be collected directly from the guests during their stay. Children under 2 years are exempt from this Green Tax under the updated regulation. </p><p>Additional Mandatory Gala Dinner fees for Christmas Eve and or New Year's Eve will be applicable to every adult and every child. Guests will be asked to pay the following charges at the property</p><p>Christmas Eve Gala dinner </p><p>On breakfast meal plan: USD 445 per adult  USD 200 per child age 6-11.99 yrs</p><p>On other meal plans: USD 300 per adult USD 120 per child age 6-11.99 yrs</p><p>New Years Eve Gala dinner </p><p>On breakfast meal plan: USD 725 per adult USD 300 per child age 6-11.99 yrs</p><p>On other meal plans: USD 550 per adult USD 250 per child age 6-11.99 yrs</p><p>This property will not accommodate hen, stag or similar parties.</p>",2026-04-06 15:19:03.228821+01,2026-04-06 15:19:03.228821+01
9a0e05c6-e866-4c3a-832e-d6ac3da6094c,1234223b-23fd-4e1d-b2cd-fbeb0f6e559e,781cdfd1-9175-4f66-96fe-79f2b3c76754,en,"<p>Guests are required to show a photo identification and credit card upon check-in. Please note that all Special Requests are subject to availability and additional charges may apply.</p><p>Please inform Villa Dvor in advance of your expected arrival time. You can use the Special Requests box when booking, or contact the property directly with the contact details provided in your confirmation.</p><p>This property will not accommodate hen, stag or similar parties.</p><p>Quiet hours are between 22:00:00 and 08:00:00.</p><p>In response to Coronavirus (COVID-19), additional safety and sanitation measures are in effect at this property.</p><p>Food &amp; beverage services at this property may be limited or unavailable due to Coronavirus (COVID-19).</p><p>Due to Coronavirus (COVID-19), this property is taking steps to help protect the safety of guests and staff. Certain services and amenities may be reduced or unavailable as a result.</p><p>Due to Coronavirus (COVID-19), this property has reduced reception and service operating hours.</p>",2026-04-06 15:19:18.297218+01,2026-04-06 15:19:18.297218+01
e0f0b1d9-e03e-46a2-a468-1d67833404e7,580150e1-7628-49e5-819e-bda441d2e670,87be0e54-1e4d-4073-9e3d-547b0a2e1707,es,"<p>Se puede llegar al alojamiento en lancha rápida privada y compartida.</p><p>Traslado en lancha rápida privada: </p><p>Del 1 de julio de 2025 al 31 de julio de 2026, los cargos son los siguientes:</p><p>- Adultos: 2252,30 USD por barco y trayecto, con un máximo de 8 personas.</p><p>- Niños: 2252,30 USD por barco y trayecto, con un máximo de 8 personas. Esta tarifa no está incluida en el precio de la reserva y se cobrará por separado.</p><p>Traslado en lancha rápida compartida: </p><p>Del 1 de julio de 2025 al 31 de diciembre de 2026, los cargos son los siguientes:</p><p>- Adultos (a partir de 12 años): 353 USD por persona</p><p>- Niños (de 2 a 11 años): 176,51 USD por niño. Esta tarifa no está incluida en el precio de la reserva y se cobrará por separado.</p><p>Durante la estancia, se cobrará el impuesto ecológico de 12 USD por persona y día directamente a los huéspedes. Los niños menores de 2 años están exentos de este impuesto ecológico según la normativa actualizada. </p><p>Se aplicarán tarifas adicionales obligatorias para la cena de gala de Nochebuena y/o Nochevieja a todos los adultos y niños. Se deben abonar los siguientes suplementos:</p><p>Cena de gala de Nochebuena </p><p>Régimen de desayuno: 445 USD por adulto, 200 USD por niño de 6 a 11 años</p><p>Otros regímenes de comidas: 300 USD por adulto, 120 USD por niño de 6 a 11 años</p><p>Cena de gala de Nochevieja </p><p>Régimen de desayuno: 725 USD por adulto, 300 USD por niño de 6 a 11 años</p><p>Otros regímenes de comidas: 550 USD por adulto, 250 USD por niño de 6 a 11 años</p><p>En este alojamiento no se pueden celebrar despedidas de soltero o soltera ni fiestas similares.</p>",2026-04-06 15:20:07.940471+01,2026-04-06 15:20:07.940471+01
aea65ec6-bb31-4e93-ae5d-9cc68f7b44e8,38713c70-5729-4e61-86c8-cb3da56d322e,781cdfd1-9175-4f66-96fe-79f2b3c76754,es,"<p>Los huéspedes deberán mostrar un documento de identidad válido y una tarjeta de crédito al realizar el registro de entrada. Ten en cuenta que todas las peticiones especiales están sujetas a disponibilidad y pueden comportar suplementos.</p><p>Informa a Villa Dvor con antelación de tu hora prevista de llegada. Para ello, puedes utilizar el apartado de peticiones especiales al hacer la reserva o ponerte en contacto directamente con el alojamiento. Los datos de contacto aparecen en la confirmación de la reserva.</p><p>En este alojamiento no se pueden celebrar despedidas de soltero o soltera ni fiestas similares.</p><p>No se puede hacer ruido de 22:00:00 a 08:00:00.</p><p>En respuesta al coronavirus (COVID-19), el alojamiento aplica medidas sanitarias y de seguridad adicionales en estos momentos.</p><p>Los servicios de comida y bebida de este alojamiento pueden verse limitados o no estar disponibles a causa del coronavirus (COVID-19).</p><p>A causa del coronavirus (COVID-19), este alojamiento está tomando medidas para garantizar la seguridad de los clientes y el personal. Por este motivo, algunos servicios e instalaciones pueden verse limitados o no estar disponibles.</p><p>A causa del coronavirus (COVID-19), este alojamiento ha reducido el horario de recepción y otros servicios.</p>",2026-04-06 15:20:22.027363+01,2026-04-06 15:20:22.027363+01
97887a52-409b-42cd-9dc1-e761dea1ff4c,04862bed-e371-4476-a76c-f5655f7a06d1,87be0e54-1e4d-4073-9e3d-547b0a2e1707,de,"<p>The property can be reached by a private and a shared speedboat.</p><p>Private Speedboat Transfers: </p><p>From July 1, 2025 to July 31, 2026 the charges are as follows:</p><p>- Adult: USD 2252.30 per boat per way, with a maximum of 8 people.</p><p>- Child: USD 2252.30 per boat per way, with a maximum of 8 people. This rate is not included in the booking price and will be charged additionally.</p><p>Shared Speedboat Transfers: </p><p>From July 1, 2025 to December 31, 2026 the charges are as follows:</p><p>- Adult (12 years and above): USD 353 per person.</p><p>- Child (2–11 years): USD 176.51 per child. This rate is not included in the booking price and will be charged additionally.</p><p>The Green Tax of USD 12 per person per day will be collected directly from the guests during their stay. Children under 2 years are exempt from this Green Tax under the updated regulation. </p><p>Additional Mandatory Gala Dinner fees for Christmas Eve and or New Year's Eve will be applicable to every adult and every child. Guests will be asked to pay the following charges at the property</p><p>Christmas Eve Gala dinner </p><p>On breakfast meal plan: USD 445 per adult  USD 200 per child age 6-11.99 yrs</p><p>On other meal plans: USD 300 per adult USD 120 per child age 6-11.99 yrs</p><p>New Years Eve Gala dinner </p><p>On breakfast meal plan: USD 725 per adult USD 300 per child age 6-11.99 yrs</p><p>On other meal plans: USD 550 per adult USD 250 per child age 6-11.99 yrs</p><p>In dieser Unterkunft sind weder Junggesellen-/Junggesellinnenabschiede noch ähnliche Feiern erlaubt. </p>",2026-04-06 15:20:38.731897+01,2026-04-06 15:20:38.731897+01
59f9b4df-c8d0-46dd-8080-4d1351844898,151acab1-d0b7-4916-a52d-4911a32b9019,abdfd305-40fa-4e37-9f96-ab7cd973a49e,es,<p>En este alojamiento no se pueden celebrar despedidas de soltero o soltera ni fiestas similares.</p><p>Se pedirá un depósito por daños de US$200 a la llegada. Se efectuará en efectivo. Se te devolverá al hacer el check-out. El depósito se devolverá por completo en efectivo una vez revisado el alojamiento.</p>,2026-04-06 15:36:30.742215+01,2026-04-06 15:36:30.742215+01
c78e4e0c-8940-4369-a8f5-821a9ff2368d,e52276fb-dce0-4169-87a7-0a58a0b6752d,781cdfd1-9175-4f66-96fe-79f2b3c76754,de,"<p>Beim Check-in müssen Sie einen Lichtbildausweis sowie eine Kreditkarte vorlegen. Sonderwünsche unterliegen der Verfügbarkeit und sind gegebenenfalls mit einem Aufpreis verbunden.</p><p>Bitte teilen Sie der Unterkunft Villa Dvor Ihre voraussichtliche Ankunftszeit im Voraus mit. Nutzen Sie hierfür bei der Buchung das Feld für besondere Anfragen oder kontaktieren Sie die Unterkunft direkt.</p><p>In dieser Unterkunft sind weder Junggesellen-/Junggesellinnenabschiede noch ähnliche Feiern erlaubt. </p><p>Ruhezeit zwischen 22:00:00 Uhr und 08:00:00 Uhr.</p><p>Wegen des Coronavirus (COVID-19) wurden in dieser Unterkunft zusätzliche Sicherheits- und Hygienemaßnahmen unternommen.</p><p>Wegen des Coronavirus (COVID-19) könnten Essens- und Getränkeangebote in dieser Unterkunft begrenzt oder überhaupt nicht verfügbar sein. </p><p>Wegen des Coronavirus (COVID-19) hat diese Unterkunft Maßnahmen unternommen, um die Sicherheit der Gäste und des Personals zu gewährleisten. Bestimmte Services und Einrichtungen könnten daher nicht oder nur eingeschränkt zur Verfügung stehen. </p><p>Wegen des Coronavirus (COVID-19) hat diese Unterkunft seine Service- und Rezeptionszeiten verringert.</p>",2026-04-06 15:21:13.388577+01,2026-04-06 15:21:13.388577+01
71ffc0d6-566b-4387-979b-8f83d9c76a9b,9bf9cae5-f885-4570-addc-d111469c48f6,87be0e54-1e4d-4073-9e3d-547b0a2e1707,it,"<p>The property can be reached by a private and a shared speedboat.</p><p>Private Speedboat Transfers: </p><p>From July 1, 2025 to July 31, 2026 the charges are as follows:</p><p>- Adult: USD 2252.30 per boat per way, with a maximum of 8 people.</p><p>- Child: USD 2252.30 per boat per way, with a maximum of 8 people. This rate is not included in the booking price and will be charged additionally.</p><p>Shared Speedboat Transfers: </p><p>From July 1, 2025 to December 31, 2026 the charges are as follows:</p><p>- Adult (12 years and above): USD 353 per person.</p><p>- Child (2–11 years): USD 176.51 per child. This rate is not included in the booking price and will be charged additionally.</p><p>The Green Tax of USD 12 per person per day will be collected directly from the guests during their stay. Children under 2 years are exempt from this Green Tax under the updated regulation. </p><p>Additional Mandatory Gala Dinner fees for Christmas Eve and or New Year's Eve will be applicable to every adult and every child. Guests will be asked to pay the following charges at the property</p><p>Christmas Eve Gala dinner </p><p>On breakfast meal plan: USD 445 per adult  USD 200 per child age 6-11.99 yrs</p><p>On other meal plans: USD 300 per adult USD 120 per child age 6-11.99 yrs</p><p>New Years Eve Gala dinner </p><p>On breakfast meal plan: USD 725 per adult USD 300 per child age 6-11.99 yrs</p><p>On other meal plans: USD 550 per adult USD 250 per child age 6-11.99 yrs</p><p>La struttura non è disponibile per feste di addio al nubilato/celibato o simili.</p>",2026-04-06 15:21:28.461794+01,2026-04-06 15:21:28.461794+01
e014a601-5273-4e53-8a11-60ab01b9b66a,96430c99-756d-4235-a868-f4d9f0131d02,781cdfd1-9175-4f66-96fe-79f2b3c76754,it,"<p>Al check-in gli ospiti devono esibire un documento d'identità con foto e una carta di credito. Siete pregati di notare che le Richieste Speciali sono soggette a disponibilità, e potrebbero comportare l'addebito di un supplemento.</p><p>Siete pregati di comunicare in anticipo a Villa Dvor l'orario in cui prevedete di arrivare. Potrete inserire questa informazione nella sezione Richieste Speciali al momento della prenotazione, o contattare la struttura utilizzando i recapiti riportati nella conferma della prenotazione.</p><p>La struttura non è disponibile per feste di addio al nubilato/celibato o simili.</p><p>La fascia oraria del silenzio è dalle 22:00:00 alle 08:00:00.</p><p>In risposta al Coronavirus (COVID-19) questa struttura ha adottato misure extra di sicurezza e igiene.</p><p>I servizi di ristorazione e somministrazione di bevande in questa struttura potrebbero essere limitati o sospesi a causa del Coronavirus (COVID-19).</p><p>A causa del Coronavirus (COVID-19) questa struttura sta adottando misure per proteggere la salute degli ospiti e dello staff. Pertanto, alcuni servizi potrebbero essere ridotti o non disponibili, così come le dotazioni.</p><p>A causa del Coronavirus (COVID-19) questa struttura ha ridotto gli orari di servizio e reception.</p>",2026-04-06 15:21:51.644871+01,2026-04-06 15:21:51.644871+01
c3d379fe-3e3b-470e-8109-f91ba08085f8,6110d70d-fb0a-43c2-8bf1-ad9680d0c745,87be0e54-1e4d-4073-9e3d-547b0a2e1707,fr,"<p>L’établissement est accessible en hors-bord privé et en hors-bord commun.</p><p>Transferts privés en hors-bord : </p><p>Du 1er juillet 2025 au 31 juillet 2026, les frais sont les suivants :</p><p>- Adultes : 2 252,30 USD par bateau et par trajet, avec un maximum de 8 personnes.</p><p>- Enfants : 2252,30 USD par bateau et par trajet, avec un maximum de 8 personnes. Ces frais ne sont pas inclus dans le tarif de votre réservation et seront facturés en supplément.</p><p>Transferts en hors-bord commun : </p><p>Du 1er juillet 2025 au 31 décembre 2026, les tarifs sont les suivants :</p><p>- Adulte (13 ans et plus) : 353 USD</p><p>- Enfant (de 6 à 12 ans) : 176,51 USD par enfant. Ces frais ne sont pas inclus dans le tarif de votre réservation et seront facturés en supplément.</p><p>Veuillez noter qu’une écotaxe de 12 USD par personne et par jour vous sera demandée pendant votre séjour. Les enfants de moins de 2 ans sont exemptés de cette écotaxe en vertu de la réglementation mise à jour. </p><p>Des frais supplémentaires obligatoires pour les dîners du réveillon de Noël et du Nouvel An seront applicables à chaque adulte et chaque enfant. Les frais suivants doivent être réglés sur place :</p><p>Dîner de réveillon de Noël </p><p>Pour la formule petit-déjeuner : 445 USD par adulte et 200 USD par enfant (de 6 à 11 ans).</p><p>Pour les autres formules repas : 300 USD par adulte et 120 USD par enfant (de 6 à 11 ans).</p><p>Dîner de réveillon du Nouvel An </p><p>Pour la formule petit-déjeuner : 725 USD par adulte et 300 USD par enfant (de 6 à 11 ans).</p><p>Pour les autres formules repas : 550 USD par adulte et 250 USD par enfant (de 6 à 11,99 ans).</p><p>Les enterrements de vie de célibataire et autres fêtes de ce type sont interdits dans cet établissement.</p>",2026-04-06 15:22:21.450107+01,2026-04-06 15:22:21.450107+01
1d239c45-aa9f-4ffa-8e9a-ad9f033cf4fc,04f07df3-353e-4cd5-aa60-36f4585e2df2,781cdfd1-9175-4f66-96fe-79f2b3c76754,fr,"<p>Vous devrez présenter une pièce d'identité avec photo et une carte de crédit lors de l'enregistrement. Veuillez noter que toutes les demandes spéciales seront satisfaites sous réserve de disponibilité et pourront entraîner des frais supplémentaires.</p><p>Veuillez informer l'établissement Villa Dvor à l'avance de l'heure à laquelle vous prévoyez d'arriver. Vous pouvez indiquer cette information dans la rubrique « Demandes spéciales » lors de la réservation ou contacter directement l'établissement. Ses coordonnées figurent sur votre confirmation de réservation.</p><p>Les enterrements de vie de célibataire et autres fêtes de ce type sont interdits dans cet établissement.</p><p>Les clients doivent éviter de faire du bruit entre 22:00:00 et 08:00:00.</p><p>Dans le cadre de la pandémie de coronavirus (COVID-19), cet établissement applique actuellement des mesures sanitaires supplémentaires.</p><p>Il est possible que les services de restauration de cet établissement soient réduits ou indisponibles en raison de la pandémie de coronavirus (COVID-19).</p><p>En raison de la pandémie de coronavirus (COVID-19), cet établissement prend des mesures pour assurer la sécurité de ses clients et de son personnel. Certains services et équipements peuvent donc être réduits ou indisponibles.</p><p>En raison de la pandémie de coronavirus (COVID-19), cet établissement a réduit les horaires de sa réception et de ses services.</p>",2026-04-06 15:22:52.615758+01,2026-04-06 15:22:52.615758+01
720cb43c-dd7e-4d95-9d91-2bffca9f125b,bf39d547-e4c5-4a0c-93a1-9fc1ca83b540,87be0e54-1e4d-4073-9e3d-547b0a2e1707,pt,"<p>The property can be reached by a private and a shared speedboat.</p><p>Private Speedboat Transfers: </p><p>From July 1, 2025 to July 31, 2026 the charges are as follows:</p><p>- Adult: USD 2252.30 per boat per way, with a maximum of 8 people.</p><p>- Child: USD 2252.30 per boat per way, with a maximum of 8 people. This rate is not included in the booking price and will be charged additionally.</p><p>Shared Speedboat Transfers: </p><p>From July 1, 2025 to December 31, 2026 the charges are as follows:</p><p>- Adult (12 years and above): USD 353 per person.</p><p>- Child (2–11 years): USD 176.51 per child. This rate is not included in the booking price and will be charged additionally.</p><p>The Green Tax of USD 12 per person per day will be collected directly from the guests during their stay. Children under 2 years are exempt from this Green Tax under the updated regulation. </p><p>Additional Mandatory Gala Dinner fees for Christmas Eve and or New Year's Eve will be applicable to every adult and every child. Guests will be asked to pay the following charges at the property</p><p>Christmas Eve Gala dinner </p><p>On breakfast meal plan: USD 445 per adult  USD 200 per child age 6-11.99 yrs</p><p>On other meal plans: USD 300 per adult USD 120 per child age 6-11.99 yrs</p><p>New Years Eve Gala dinner </p><p>On breakfast meal plan: USD 725 per adult USD 300 per child age 6-11.99 yrs</p><p>On other meal plans: USD 550 per adult USD 250 per child age 6-11.99 yrs</p><p>Esta propriedade não permite a realização de festas de despedida de solteiros(as) e festas semelhantes.</p>",2026-04-06 15:23:02.229099+01,2026-04-06 15:23:02.229099+01
32516138-6824-4427-9a3b-162bc5299ff3,0c7da9ec-51c3-4076-b1dc-917bee69749a,781cdfd1-9175-4f66-96fe-79f2b3c76754,pt,"<p>No momento do check-in, os hóspedes deverão apresentar um documento de identificação com fotografia e um cartão de crédito.  Por favor, observe que todos os Pedidos Especiais estão sujeitos à disponibilidade e que poderão acarretar custos adicionais.</p><p>Por favor, informe Villa Dvor antecipadamente sobre o seu horário de chegada. Para isso poderá utilizar a caixa de Pedidos Especiais durante o processo da reserva ou contactar a propriedade diretamente através dos dados para contacto providenciados na sua confirmação.</p><p>Esta propriedade não permite a realização de festas de despedida de solteiros(as) e festas semelhantes.</p><p>O período de repouso é entre as 22:00:00 e as 08:00:00.</p><p>Em resposta ao Coronavírus (COVID-19), este alojamento está a tomar medidas de segurança e higienização adicionais.</p><p>Os serviços de comida e bebidas deste alojamento poderão estar limitados ou indisponíveis devido ao Coronavírus (COVID-19).</p><p>Devido ao Coronavírus (COVID-19), este alojamento está a tomar precauções adicionais para proteger os seus hóspedes e funcionários. Consequentemente, alguns serviços e comodidades poderão estar reduzidos ou indisponíveis.</p><p>Devido ao Coronavírus (COVID-19), este alojamento reduziu o horário de funcionamento da receção e dos serviços.</p>",2026-04-06 15:23:19.793439+01,2026-04-06 15:23:19.793439+01
f02bcd64-c934-45d7-a1aa-5a0009889e54,ec51d209-b9d8-4f8a-a467-3505e14c30ad,2c312f00-9e66-462a-aa75-50be8cca96c9,en,"<p>The property can be reached by seaplanes and domestic flights.</p><p>Seaplane transfer takes 45 minutes from Male International Airport.</p><p>Standard Transfer Times: Daylight hours.</p><p>Domestic flight transfer takes 25 minutes from Male International Airport, followed by a 5-minute speedboat transfer from Dhaalu Airport to the resort.</p><p>Children eat for free based on the rules and meal plan accompanied by an adult, excluding alcoholic beverages from the special set kids menu only.</p><p>Additional child in the room is charged at USD 61 per night and is added to the total cost separately.</p><p>Daily dinner is based on a three-course meal per person, excluding beverages, at selected restaurants. Supplementary charges may apply to special items on the menu.</p><p>Transfer options:</p><p>Seaplane transfer</p><p>From now to 31 December 2027</p><p>- Adult: USD 780</p><p>- Child (2-11): USD 390</p><p>Domestic flight transfer</p><p>From now to 31 December 2027</p><p>- Adult: USD 550</p><p>- Child (2-11): USD 275</p><p>Guests are required to show a photo identification and credit card upon check-in. Please note that all Special Requests are subject to availability and additional charges may apply.</p><p>Please inform Niyama Private Islands Maldives in advance of your expected arrival time. You can use the Special Requests box when booking, or contact the property directly with the contact details provided in your confirmation.</p>",2026-04-06 15:24:36.599632+01,2026-04-06 15:24:36.599632+01
a58fc588-8f5f-4da5-bdcb-fcd41622e820,ce4ab0ef-014e-4dd6-9ed1-3aa7b2837908,2c312f00-9e66-462a-aa75-50be8cca96c9,pt,"<p>The property can be reached by seaplanes and domestic flights.</p><p>Seaplane transfer takes 45 minutes from Male International Airport.</p><p>Standard Transfer Times: Daylight hours.</p><p>Domestic flight transfer takes 25 minutes from Male International Airport, followed by a 5-minute speedboat transfer from Dhaalu Airport to the resort.</p><p>Children eat for free based on the rules and meal plan accompanied by an adult, excluding alcoholic beverages from the special set kids menu only.</p><p>Additional child in the room is charged at USD 61 per night and is added to the total cost separately.</p><p>Daily dinner is based on a three-course meal per person, excluding beverages, at selected restaurants. Supplementary charges may apply to special items on the menu.</p><p>Transfer options:</p><p>Seaplane transfer</p><p>From now to 31 December 2027</p><p>- Adult: USD 780</p><p>- Child (2-11): USD 390</p><p>Domestic flight transfer</p><p>From now to 31 December 2027</p><p>- Adult: USD 550</p><p>- Child (2-11): USD 275</p><p>No momento do check-in, os hóspedes deverão apresentar um documento de identificação com fotografia e um cartão de crédito.  Por favor, observe que todos os Pedidos Especiais estão sujeitos à disponibilidade e que poderão acarretar custos adicionais.</p><p>Por favor, informe Niyama Private Islands Maldives antecipadamente sobre o seu horário de chegada. Para isso poderá utilizar a caixa de Pedidos Especiais durante o processo da reserva ou contactar a propriedade diretamente através dos dados para contacto providenciados na sua confirmação.</p>",2026-04-06 15:28:36.588633+01,2026-04-06 15:28:36.588633+01
5099da9e-d207-47af-9e3b-07ebdaa01299,bd3d0d67-39da-405b-94d4-7dfa98eea59e,94a215cc-e236-4b99-9efd-7fa5e0f41b18,en,"<p>Guests are required to show a photo identification and credit card upon check-in. Please note that all Special Requests are subject to availability and additional charges may apply.</p><p>Please inform Grace Bay Club in advance of your expected arrival time. You can use the Special Requests box when booking, or contact the property directly with the contact details provided in your confirmation.</p><p>In response to Coronavirus (COVID-19), additional safety and sanitation measures are in effect at this property.</p>",2026-04-06 15:29:28.338702+01,2026-04-06 15:29:28.338702+01
3116e6e3-4a45-4ae1-b892-bd8ea9b4e3b0,1c136f59-2841-415b-8d32-d12897110512,c858fd3a-2959-4d3a-b1e2-57bfc3f2bc1f,en,"<p>Guests are required to show a photo identification and credit card upon check-in. Please note that all Special Requests are subject to availability and additional charges may apply.</p><p>Please inform South Bank in advance of your expected arrival time. You can use the Special Requests box when booking, or contact the property directly with the contact details provided in your confirmation.</p><p>This property will not accommodate hen, stag or similar parties.</p>",2026-04-06 15:29:59.94016+01,2026-04-06 15:29:59.94016+01
3e4924ba-93f3-40f5-93d6-26a1b938dd75,599f5810-92ac-4d2c-811d-c0bece752e9f,abdfd305-40fa-4e37-9f96-ab7cd973a49e,en,"<p>This property will not accommodate hen, stag or similar parties.</p><p>A damage deposit of US$200 is required on arrival. This will be collected as a cash payment. You should be reimbursed on check-out. Your deposit will be refunded in full in cash, subject to an inspection of the property.</p>",2026-04-06 15:35:39.193934+01,2026-04-06 15:35:39.193934+01
