id,hotel_id,url_id,language,ask,answer,created_at
458,0a947b7e-f06e-4959-8b05-a720c5c30e2a,a4985057-31a5-4a72-b226-0b62e6ff5370,fr,Quel est le tarif d'un séjour à l'établissement Cheval Blanc Seychelles ?,"Les tarifs fixés par l'établissement Cheval Blanc Seychelles peuvent varier en fonction de votre séjour (par ex. les dates que vous avez sélectionnées, les conditions de l'hôtel, etc.). Indiquez vos dates pour voir les tarifs.",2026-04-09 07:53:46.496638+01
459,0a947b7e-f06e-4959-8b05-a720c5c30e2a,a4985057-31a5-4a72-b226-0b62e6ff5370,fr,L'établissement Cheval Blanc Seychelles dispose-t-il un restaurant sur place ?,L'établissement Cheval Blanc Seychelles propose 5 restaurant : Mizumi Le 1947 Le White Vivamento Sula Beach Club,2026-04-09 07:53:46.496638+01
460,0a947b7e-f06e-4959-8b05-a720c5c30e2a,a4985057-31a5-4a72-b226-0b62e6ff5370,fr,Quelles activités l'établissement Cheval Blanc Seychelles propose-t-il ?,L'établissement Cheval Blanc Seychelles propose les activités et les services suivants (des frais peuvent s'appliquer) : Spa et centre de bien-être Centre de remise en forme Sauna Massages Randonnée Billard Plongée avec tuba Tennis de table Plongée sous-marine Court de tennis Pêche Canoë-kayak Club pour enfants Concerts/Spectacles Coach sportif personnel Spa Installations de sports nautiques sur place Cours de yoga Dîners à thème Piscine Vestiaires salle de sport/spa Fitness Soirées film Plage Matériel de tennis Coin spa/relaxation Cours de cuisine Bain à vapeur Forfaits spa/bien-être,2026-04-09 07:53:46.496638+01
461,0a947b7e-f06e-4959-8b05-a720c5c30e2a,a4985057-31a5-4a72-b226-0b62e6ff5370,fr,L'établissement Cheval Blanc Seychelles est-il proche du centre (Mahé) ?,L'établissement Cheval Blanc Seychelles se trouve à 11 km du centre (Mahé).,2026-04-09 07:53:46.496638+01
462,0a947b7e-f06e-4959-8b05-a720c5c30e2a,a4985057-31a5-4a72-b226-0b62e6ff5370,fr,L'établissement Cheval Blanc Seychelles est-il populaire auprès des familles ?,L'établissement Cheval Blanc Seychelles est très bien noté pour les séjours en famille ().,2026-04-09 07:53:46.496638+01
463,204befed-3472-4949-8ad7-bbcd170a2b89,c694025a-8a7f-4c32-918e-d035bdc7748b,pt,Que tipo de pequeno-almoço é servido em Gardens Hill Resort & Spa?,"Os hóspedes em Gardens Hill Resort & Spa podem desfrutar de um pequeno-almoço com boa pontuação durante a sua estadia (pontuação de comentários: 8,4). As opções de pequeno-almoço incluem: Continental Vegetariano Vegan Buffet Pequeno-almoço para levar",2026-04-09 07:53:55.867848+01
464,204befed-3472-4949-8ad7-bbcd170a2b89,c694025a-8a7f-4c32-918e-d035bdc7748b,pt,Gardens Hill Resort & Spa tem piscina?,"Sim, este hotel tem uma piscina. Veja mais informações sobre a piscina e outras comodidades nesta página.",2026-04-09 07:53:55.867848+01
465,204befed-3472-4949-8ad7-bbcd170a2b89,c694025a-8a7f-4c32-918e-d035bdc7748b,pt,Que tipo de quarto posso reservar em Gardens Hill Resort & Spa?,As opções de quarto em Gardens Hill Resort & Spa incluem: Familiar Villa,2026-04-09 07:53:55.867848+01
466,204befed-3472-4949-8ad7-bbcd170a2b89,c694025a-8a7f-4c32-918e-d035bdc7748b,pt,Quais são os horários de check-in e check-out em Gardens Hill Resort & Spa?,"Em Gardens Hill Resort & Spa, o check-in é a partir das 15:00 e o check-out até às 11:00.",2026-04-09 07:53:55.867848+01
467,204befed-3472-4949-8ad7-bbcd170a2b89,c694025a-8a7f-4c32-918e-d035bdc7748b,pt,Quanto custa hospedar-me em Gardens Hill Resort & Spa?,"Os preços em Gardens Hill Resort & Spa podem variar de acordo com os parâmetros da sua estadia (ex.: as datas que seleciona, as condições do hotel, entre outros). Insira as suas datas e consulte os preços.",2026-04-09 07:53:55.867848+01
468,204befed-3472-4949-8ad7-bbcd170a2b89,c694025a-8a7f-4c32-918e-d035bdc7748b,pt,Gardens Hill Resort & Spa tem um restaurante no local?,Gardens Hill Resort & Spa tem 1 restaurantes: Ресторан #1,2026-04-09 07:53:55.867848+01
469,204befed-3472-4949-8ad7-bbcd170a2b89,c694025a-8a7f-4c32-918e-d035bdc7748b,pt,Que atividades há em Gardens Hill Resort & Spa?,Gardens Hill Resort & Spa disponibiliza as seguintes atividades/serviços (podem-se aplicar custos): Spa e centro de bem-estar Centro de fitness Clube infantil Banho de vapor Praia Comodidades de spa Piscina Fitness,2026-04-09 07:53:55.867848+01
470,204befed-3472-4949-8ad7-bbcd170a2b89,c694025a-8a7f-4c32-918e-d035bdc7748b,pt,A que distância fica Gardens Hill Resort & Spa do centro de Beau Vallon?,Gardens Hill Resort & Spa fica a 500 m do centro de Beau Vallon.,2026-04-09 07:53:55.867848+01
471,204befed-3472-4949-8ad7-bbcd170a2b89,c694025a-8a7f-4c32-918e-d035bdc7748b,pt,A que distância da praia fica Gardens Hill Resort & Spa?,A praia mais próxima fica apenas a 300 m de Gardens Hill Resort & Spa.,2026-04-09 07:53:55.867848+01
472,9467cb8e-ef4a-4f83-a4bf-52f2bd3a9c3d,a4985057-31a5-4a72-b226-0b62e6ff5370,pt,Que tipo de pequeno-almoço é servido em Cheval Blanc Seychelles?,Os hóspedes em Cheval Blanc Seychelles podem desfrutar de um pequeno-almoço com boa pontuação durante a sua estadia (pontuação de comentários: 10). As opções de pequeno-almoço incluem: Buffet À carta,2026-04-09 07:54:11.487903+01
473,9467cb8e-ef4a-4f83-a4bf-52f2bd3a9c3d,a4985057-31a5-4a72-b226-0b62e6ff5370,pt,Cheval Blanc Seychelles tem piscina?,"Sim, este hotel tem uma piscina. Veja mais informações sobre a piscina e outras comodidades nesta página.",2026-04-09 07:54:11.487903+01
474,9467cb8e-ef4a-4f83-a4bf-52f2bd3a9c3d,a4985057-31a5-4a72-b226-0b62e6ff5370,pt,Que tipo de quarto posso reservar em Cheval Blanc Seychelles?,As opções de quarto em Cheval Blanc Seychelles incluem: Suite,2026-04-09 07:54:11.487903+01
475,9467cb8e-ef4a-4f83-a4bf-52f2bd3a9c3d,a4985057-31a5-4a72-b226-0b62e6ff5370,pt,Quais são os horários de check-in e check-out em Cheval Blanc Seychelles?,"Em Cheval Blanc Seychelles, o check-in é a partir das 14:00 e o check-out até às 12:00.",2026-04-09 07:54:11.487903+01
476,9467cb8e-ef4a-4f83-a4bf-52f2bd3a9c3d,a4985057-31a5-4a72-b226-0b62e6ff5370,pt,Quanto custa hospedar-me em Cheval Blanc Seychelles?,"Os preços em Cheval Blanc Seychelles podem variar de acordo com os parâmetros da sua estadia (ex.: as datas que seleciona, as condições do hotel, entre outros). Insira as suas datas e consulte os preços.",2026-04-09 07:54:11.487903+01
477,9467cb8e-ef4a-4f83-a4bf-52f2bd3a9c3d,a4985057-31a5-4a72-b226-0b62e6ff5370,pt,Cheval Blanc Seychelles tem um restaurante no local?,Cheval Blanc Seychelles tem 5 restaurantes: Mizumi Le 1947 Le White Vivamento Sula Beach Club,2026-04-09 07:54:11.487903+01
478,9467cb8e-ef4a-4f83-a4bf-52f2bd3a9c3d,a4985057-31a5-4a72-b226-0b62e6ff5370,pt,Que atividades há em Cheval Blanc Seychelles?,Cheval Blanc Seychelles disponibiliza as seguintes atividades/serviços (podem-se aplicar custos): Spa e centro de bem-estar Centro de fitness Sauna Massagem Caminhadas Bilhar Snorkelling Ténis de mesa Mergulho Campo de Ténis Pesca Canoagem Clube infantil Atuações/música ao vivo Personal trainer Comodidades de spa Comodidades para desportos aquáticos no local Aulas de ioga Jantares temáticos Piscina Salas de cacifos do spa/centro de fitness Fitness Noites de cinema Praia Equipamento de ténis Sala de spa/área de relaxamento Aulas de culinária Banho de vapor Pacotes de spa/bem-estar,2026-04-09 07:54:11.487903+01
479,9467cb8e-ef4a-4f83-a4bf-52f2bd3a9c3d,a4985057-31a5-4a72-b226-0b62e6ff5370,pt,A que distância fica Cheval Blanc Seychelles do centro de Mahé?,Cheval Blanc Seychelles fica a 11 km do centro de Mahé.,2026-04-09 07:54:11.487903+01
480,9467cb8e-ef4a-4f83-a4bf-52f2bd3a9c3d,a4985057-31a5-4a72-b226-0b62e6ff5370,pt,Cheval Blanc Seychelles é popular entre as famílias?,"Sim, Cheval Blanc Seychelles é popular entre os hóspedes que reservam estadias com a família.",2026-04-09 07:54:11.487903+01
481,6e0b67ff-c2b3-4ef2-aa21-8800a20541ac,ed4e0188-af4a-48ce-ab20-bbb7ead2b963,en,What kind of breakfast is served at Golden Beach Resort & Spa?,Guests staying at Golden Beach Resort & Spa can enjoy a highly-rated breakfast during their stay (guest review score: 9). Breakfast option(s) include: Continental Buffet,2026-04-09 07:55:02.63698+01
482,6e0b67ff-c2b3-4ef2-aa21-8800a20541ac,ed4e0188-af4a-48ce-ab20-bbb7ead2b963,en,Does Golden Beach Resort & Spa have a pool?,"Yes, this hotel has a pool. Find out the details about the pool and other facilities on this page.",2026-04-09 07:55:02.63698+01
483,6e0b67ff-c2b3-4ef2-aa21-8800a20541ac,ed4e0188-af4a-48ce-ab20-bbb7ead2b963,en,What type of room can I book at Golden Beach Resort & Spa?,Room options at Golden Beach Resort & Spa include: Double Suite,2026-04-09 07:55:02.63698+01
484,6e0b67ff-c2b3-4ef2-aa21-8800a20541ac,ed4e0188-af4a-48ce-ab20-bbb7ead2b963,en,What are the check-in and check-out times at Golden Beach Resort & Spa?,"Check-in at Golden Beach Resort & Spa is from 15:00, and check-out is until 12:00.",2026-04-09 07:55:02.63698+01
485,6e0b67ff-c2b3-4ef2-aa21-8800a20541ac,ed4e0188-af4a-48ce-ab20-bbb7ead2b963,en,How much does it cost to stay at Golden Beach Resort & Spa?,"The prices at Golden Beach Resort & Spa may vary depending on your stay (e.g. dates you select, hotel's policy etc.). See the prices by entering your dates.",2026-04-09 07:55:02.63698+01
486,6e0b67ff-c2b3-4ef2-aa21-8800a20541ac,ed4e0188-af4a-48ce-ab20-bbb7ead2b963,en,What is there to do at Golden Beach Resort & Spa?,Golden Beach Resort & Spa offers the following activities / services (charges may apply): Massage Children's playground Billiards Games room Table tennis Golf course (within 3 km) Solarium Bicycle rental Tour or class about local culture Swimming pool Beach,2026-04-09 07:55:02.63698+01
487,6e0b67ff-c2b3-4ef2-aa21-8800a20541ac,ed4e0188-af4a-48ce-ab20-bbb7ead2b963,en,How far is Golden Beach Resort & Spa from the centre of Punta del Este?,Golden Beach Resort & Spa is 100 m from the centre of Punta del Este.,2026-04-09 07:55:02.63698+01
488,6e0b67ff-c2b3-4ef2-aa21-8800a20541ac,ed4e0188-af4a-48ce-ab20-bbb7ead2b963,en,How close to the beach is Golden Beach Resort & Spa?,The nearest beach is just 100 m from Golden Beach Resort & Spa.,2026-04-09 07:55:02.63698+01
489,6e0b67ff-c2b3-4ef2-aa21-8800a20541ac,ed4e0188-af4a-48ce-ab20-bbb7ead2b963,en,Is Golden Beach Resort & Spa popular with families?,"Yes, Golden Beach Resort & Spa is popular with guests booking family stays.",2026-04-09 07:55:02.63698+01
490,36d8dee2-f5aa-4257-b2db-97b1cf679ccd,5cb20c8a-569f-4349-bcc1-7b12ce52dd30,en,What kind of breakfast is served at Hotel Atlântico Rio?,Guests staying at Hotel Atlântico Rio can enjoy a highly-rated breakfast during their stay (guest review score: 7). Breakfast option(s) include: Continental Buffet,2026-04-09 07:55:20.473641+01
491,36d8dee2-f5aa-4257-b2db-97b1cf679ccd,5cb20c8a-569f-4349-bcc1-7b12ce52dd30,en,Does Hotel Atlântico Rio have a pool?,"Yes, this hotel has a pool. Find out the details about the pool and other facilities on this page.",2026-04-09 07:55:20.473641+01
492,36d8dee2-f5aa-4257-b2db-97b1cf679ccd,5cb20c8a-569f-4349-bcc1-7b12ce52dd30,en,What type of room can I book at Hotel Atlântico Rio?,Room options at Hotel Atlântico Rio include: Twin Double Triple Single Quadruple,2026-04-09 07:55:20.473641+01
493,36d8dee2-f5aa-4257-b2db-97b1cf679ccd,5cb20c8a-569f-4349-bcc1-7b12ce52dd30,en,What are the check-in and check-out times at Hotel Atlântico Rio?,"Check-in at Hotel Atlântico Rio is from 14:00, and check-out is until 12:00.",2026-04-09 07:55:20.473641+01
641,06c2836c-e705-40a2-b5b9-6f4ffaf55108,2e030120-838b-48aa-a2c9-34c36d2d8c70,it,Manaus Hotéis Millennium dispone di una piscina?,Sì. Trovi maggiori informazioni sulla piscina e sugli altri servizi in questa pagina.,2026-04-09 08:03:25.971927+01
494,36d8dee2-f5aa-4257-b2db-97b1cf679ccd,5cb20c8a-569f-4349-bcc1-7b12ce52dd30,en,How much does it cost to stay at Hotel Atlântico Rio?,"The prices at Hotel Atlântico Rio may vary depending on your stay (e.g. dates you select, hotel's policy etc.). See the prices by entering your dates.",2026-04-09 07:55:20.473641+01
495,36d8dee2-f5aa-4257-b2db-97b1cf679ccd,5cb20c8a-569f-4349-bcc1-7b12ce52dd30,en,Does Hotel Atlântico Rio have a restaurant on site?,Hotel Atlântico Rio has 1 restaurants: Restaurante #1,2026-04-09 07:55:20.473641+01
496,36d8dee2-f5aa-4257-b2db-97b1cf679ccd,5cb20c8a-569f-4349-bcc1-7b12ce52dd30,en,What is there to do at Hotel Atlântico Rio?,Hotel Atlântico Rio offers the following activities / services (charges may apply): Live sport events (broadcast) Swimming pool Beach,2026-04-09 07:55:20.473641+01
497,36d8dee2-f5aa-4257-b2db-97b1cf679ccd,5cb20c8a-569f-4349-bcc1-7b12ce52dd30,en,How far is Hotel Atlântico Rio from the centre of Rio de Janeiro?,Hotel Atlântico Rio is 8 km from the centre of Rio de Janeiro.,2026-04-09 07:55:20.473641+01
498,36d8dee2-f5aa-4257-b2db-97b1cf679ccd,5cb20c8a-569f-4349-bcc1-7b12ce52dd30,en,How close to the beach is Hotel Atlântico Rio?,The nearest beach is just 500 m from Hotel Atlântico Rio.,2026-04-09 07:55:20.473641+01
499,ee9cf041-5c8b-4681-94aa-24b8dbfd7b2d,ed4e0188-af4a-48ce-ab20-bbb7ead2b963,es,¿Qué tipo de desayuno se sirve en Golden Beach Resort & Spa?,Los clientes de Golden Beach Resort & Spa podrán disfrutar durante su estancia de un desayuno con muy buena puntuación (9) Las opciones del desayuno son: Continental Buffet,2026-04-09 07:56:20.78681+01
500,ee9cf041-5c8b-4681-94aa-24b8dbfd7b2d,ed4e0188-af4a-48ce-ab20-bbb7ead2b963,es,¿Hay piscina en Golden Beach Resort & Spa?,"Sí, el hotel tiene piscina. En esta página encontrarás más info sobre la piscina y otras instalaciones.",2026-04-09 07:56:20.78681+01
501,ee9cf041-5c8b-4681-94aa-24b8dbfd7b2d,ed4e0188-af4a-48ce-ab20-bbb7ead2b963,es,¿Qué tipo de habitación puedo reservar en Golden Beach Resort & Spa?,Las opciones de habitación en Golden Beach Resort & Spa son: Doble Suite,2026-04-09 07:56:20.78681+01
502,ee9cf041-5c8b-4681-94aa-24b8dbfd7b2d,ed4e0188-af4a-48ce-ab20-bbb7ead2b963,es,¿Cuál es el horario de entrada y salida de Golden Beach Resort & Spa?,Podrás hacer el check-in en Golden Beach Resort & Spa a partir de las 15:00 y el check-out hasta las 12:00.,2026-04-09 07:56:20.78681+01
503,ee9cf041-5c8b-4681-94aa-24b8dbfd7b2d,ed4e0188-af4a-48ce-ab20-bbb7ead2b963,es,¿Cuánto cuesta alojarse en Golden Beach Resort & Spa?,"Los precios en Golden Beach Resort & Spa pueden variar en función de la estancia (fechas, condiciones del hotel, etc.). Elige tus fechas para ver el precio.",2026-04-09 07:56:20.78681+01
504,ee9cf041-5c8b-4681-94aa-24b8dbfd7b2d,ed4e0188-af4a-48ce-ab20-bbb7ead2b963,es,¿Qué se puede hacer en Golden Beach Resort & Spa?,Golden Beach Resort & Spa ofrece las siguientes actividades y servicios (se pueden aplicar cargos): Masajes Zona de juegos para niños Billar Sala de juegos Ping pong Campo de golf (a menos de 3 km) Solárium Alquiler de bicicletas Tour o clase sobre cultura local Piscina Playa,2026-04-09 07:56:20.78681+01
505,ee9cf041-5c8b-4681-94aa-24b8dbfd7b2d,ed4e0188-af4a-48ce-ab20-bbb7ead2b963,es,¿A qué distancia está Golden Beach Resort & Spa del centro de Punta del Este?,Golden Beach Resort & Spa está a 100 m del centro de Punta del Este.,2026-04-09 07:56:20.78681+01
506,ee9cf041-5c8b-4681-94aa-24b8dbfd7b2d,ed4e0188-af4a-48ce-ab20-bbb7ead2b963,es,¿A qué distancia está Golden Beach Resort & Spa de la playa?,La playa más cercana está a solo 100 m de Golden Beach Resort & Spa.,2026-04-09 07:56:20.78681+01
507,ee9cf041-5c8b-4681-94aa-24b8dbfd7b2d,ed4e0188-af4a-48ce-ab20-bbb7ead2b963,es,¿Golden Beach Resort & Spa gusta a las familias?,"Sí, Golden Beach Resort & Spa suele gustar a las familias.",2026-04-09 07:56:20.78681+01
508,6405424f-f1e4-4f69-8fe5-7ef5dcb05aa2,5cb20c8a-569f-4349-bcc1-7b12ce52dd30,es,¿Qué tipo de desayuno se sirve en Hotel Atlântico Rio?,Los clientes de Hotel Atlântico Rio podrán disfrutar durante su estancia de un desayuno con muy buena puntuación (7) Las opciones del desayuno son: Continental Buffet,2026-04-09 07:56:42.743589+01
509,6405424f-f1e4-4f69-8fe5-7ef5dcb05aa2,5cb20c8a-569f-4349-bcc1-7b12ce52dd30,es,¿Hay piscina en Hotel Atlântico Rio?,"Sí, el hotel tiene piscina. En esta página encontrarás más info sobre la piscina y otras instalaciones.",2026-04-09 07:56:42.743589+01
510,6405424f-f1e4-4f69-8fe5-7ef5dcb05aa2,5cb20c8a-569f-4349-bcc1-7b12ce52dd30,es,¿Qué tipo de habitación puedo reservar en Hotel Atlântico Rio?,Las opciones de habitación en Hotel Atlântico Rio son: Doble - 2 camas Doble Triple Individual Cuádruple,2026-04-09 07:56:42.743589+01
511,6405424f-f1e4-4f69-8fe5-7ef5dcb05aa2,5cb20c8a-569f-4349-bcc1-7b12ce52dd30,es,¿Cuál es el horario de entrada y salida de Hotel Atlântico Rio?,Podrás hacer el check-in en Hotel Atlântico Rio a partir de las 14:00 y el check-out hasta las 12:00.,2026-04-09 07:56:42.743589+01
512,6405424f-f1e4-4f69-8fe5-7ef5dcb05aa2,5cb20c8a-569f-4349-bcc1-7b12ce52dd30,es,¿Cuánto cuesta alojarse en Hotel Atlântico Rio?,"Los precios en Hotel Atlântico Rio pueden variar en función de la estancia (fechas, condiciones del hotel, etc.). Elige tus fechas para ver el precio.",2026-04-09 07:56:42.743589+01
513,6405424f-f1e4-4f69-8fe5-7ef5dcb05aa2,5cb20c8a-569f-4349-bcc1-7b12ce52dd30,es,¿Hay restaurante dentro de Hotel Atlântico Rio?,Hotel Atlântico Rio tiene 1 restaurantes: Restaurante #1,2026-04-09 07:56:42.743589+01
514,6405424f-f1e4-4f69-8fe5-7ef5dcb05aa2,5cb20c8a-569f-4349-bcc1-7b12ce52dd30,es,¿Qué se puede hacer en Hotel Atlântico Rio?,Hotel Atlântico Rio ofrece las siguientes actividades y servicios (se pueden aplicar cargos): Eventos deportivos en directo (emisión) Piscina Playa,2026-04-09 07:56:42.743589+01
515,6405424f-f1e4-4f69-8fe5-7ef5dcb05aa2,5cb20c8a-569f-4349-bcc1-7b12ce52dd30,es,¿A qué distancia está Hotel Atlântico Rio del centro de Río de Janeiro?,Hotel Atlântico Rio está a 8 km del centro de Río de Janeiro.,2026-04-09 07:56:42.743589+01
516,6405424f-f1e4-4f69-8fe5-7ef5dcb05aa2,5cb20c8a-569f-4349-bcc1-7b12ce52dd30,es,¿A qué distancia está Hotel Atlântico Rio de la playa?,La playa más cercana está a solo 500 m de Hotel Atlântico Rio.,2026-04-09 07:56:42.743589+01
517,f97aa0f1-807c-4191-92c3-da373041ed88,ed4e0188-af4a-48ce-ab20-bbb7ead2b963,de,Welche Art von Frühstück wird in der Unterkunft Golden Beach Resort & Spa serviert?,"Gäste, die in der Unterkunft Golden Beach Resort & Spa übernachten, können während ihres Aufenthaltes ein gut bewertetes Frühstück genießen (Gästebewertungsergebnis: 9). Verfügbare Frühstücksoption(en): Kontinental Buffet",2026-04-09 07:56:48.895617+01
518,f97aa0f1-807c-4191-92c3-da373041ed88,ed4e0188-af4a-48ce-ab20-bbb7ead2b963,de,Hat die Unterkunft Golden Beach Resort & Spa einen Pool?,"Ja, dieses Hotel hat einen Pool. Erfahren Sie Einzelheiten zum Pool und anderen Ausstattungen auf dieser Seite.",2026-04-09 07:56:48.895617+01
519,f97aa0f1-807c-4191-92c3-da373041ed88,ed4e0188-af4a-48ce-ab20-bbb7ead2b963,de,Welche Art von Zimmer kann ich in der Unterkunft Golden Beach Resort & Spa buchen?,Zimmeroptionen der Unterkunft Golden Beach Resort & Spa zählen: Doppelzimmer Suite,2026-04-09 07:56:48.895617+01
520,f97aa0f1-807c-4191-92c3-da373041ed88,ed4e0188-af4a-48ce-ab20-bbb7ead2b963,de,Wie lauten die Check-in- und Check-out-Zeiten in der Unterkunft Golden Beach Resort & Spa?,"Der Check-in in der Unterkunft Golden Beach Resort & Spa ist ab 15:00, und der Check-out ist bis 12:00.",2026-04-09 07:56:48.895617+01
521,f97aa0f1-807c-4191-92c3-da373041ed88,ed4e0188-af4a-48ce-ab20-bbb7ead2b963,de,Wieviel kostet der Aufenthalt in der Unterkunft Golden Beach Resort & Spa?,"Die Preise an der Unterkunft Golden Beach Resort & Spa könnten je nach Aufenthalt variieren (z.B. gewählter Zeitraum, Hotelrichtlinie usw.). Wenn Sie Ihre Daten eingeben, können Sie die Preise sehen.",2026-04-09 07:56:48.895617+01
522,f97aa0f1-807c-4191-92c3-da373041ed88,ed4e0188-af4a-48ce-ab20-bbb7ead2b963,de,Welche Aktivitäten bietet die Unterkunft Golden Beach Resort & Spa?,Die Unterkunft Golden Beach Resort & Spa bietet folgende Aktivitäten/Services (es könnten Gebühren anfallen): Massage Kinderspielplatz Billard Spielzimmer Tischtennis Golfplatz (max. 3 km entfernt) Solarium Fahrradverleih Tour oder Kurs über die örtliche Kultur Pool Strand,2026-04-09 07:56:48.895617+01
523,f97aa0f1-807c-4191-92c3-da373041ed88,ed4e0188-af4a-48ce-ab20-bbb7ead2b963,de,Wie weit ist die Unterkunft Golden Beach Resort & Spa vom Zentrum von Punta del Este entfernt?,Die Unterkunft Golden Beach Resort & Spa ist 100 m vom Zentrum von Punta del Este entfernt.,2026-04-09 07:56:48.895617+01
524,f97aa0f1-807c-4191-92c3-da373041ed88,ed4e0188-af4a-48ce-ab20-bbb7ead2b963,de,Wie weit ist der Strand von der Unterkunft Golden Beach Resort & Spa?,Der nächste Strand ist nur 100 m von der Unterkunft Golden Beach Resort & Spa entfernt.,2026-04-09 07:56:48.895617+01
525,f97aa0f1-807c-4191-92c3-da373041ed88,ed4e0188-af4a-48ce-ab20-bbb7ead2b963,de,Ist die Unterkunft Golden Beach Resort & Spa bei Familien beliebt?,"Ja, die Unterkunft Golden Beach Resort & Spa ist bei Gästen beliebt, die Familienaufenthalte buchen.",2026-04-09 07:56:48.895617+01
526,78e78bd9-6903-4925-86a1-dd9beecb7f76,5cb20c8a-569f-4349-bcc1-7b12ce52dd30,de,Welche Art von Frühstück wird in der Unterkunft Hotel Atlântico Rio serviert?,"Gäste, die in der Unterkunft Hotel Atlântico Rio übernachten, können während ihres Aufenthaltes ein gut bewertetes Frühstück genießen (Gästebewertungsergebnis: 7). Verfügbare Frühstücksoption(en): Kontinental Buffet",2026-04-09 07:57:32.969239+01
527,78e78bd9-6903-4925-86a1-dd9beecb7f76,5cb20c8a-569f-4349-bcc1-7b12ce52dd30,de,Hat die Unterkunft Hotel Atlântico Rio einen Pool?,"Ja, dieses Hotel hat einen Pool. Erfahren Sie Einzelheiten zum Pool und anderen Ausstattungen auf dieser Seite.",2026-04-09 07:57:32.969239+01
528,78e78bd9-6903-4925-86a1-dd9beecb7f76,5cb20c8a-569f-4349-bcc1-7b12ce52dd30,de,Welche Art von Zimmer kann ich in der Unterkunft Hotel Atlântico Rio buchen?,Zimmeroptionen der Unterkunft Hotel Atlântico Rio zählen: Zweibettzimmer Doppelzimmer Dreibettzimmer Einzelzimmer Vierbettzimmer,2026-04-09 07:57:32.969239+01
529,78e78bd9-6903-4925-86a1-dd9beecb7f76,5cb20c8a-569f-4349-bcc1-7b12ce52dd30,de,Wie lauten die Check-in- und Check-out-Zeiten in der Unterkunft Hotel Atlântico Rio?,"Der Check-in in der Unterkunft Hotel Atlântico Rio ist ab 14:00, und der Check-out ist bis 12:00.",2026-04-09 07:57:32.969239+01
530,78e78bd9-6903-4925-86a1-dd9beecb7f76,5cb20c8a-569f-4349-bcc1-7b12ce52dd30,de,Wieviel kostet der Aufenthalt in der Unterkunft Hotel Atlântico Rio?,"Die Preise an der Unterkunft Hotel Atlântico Rio könnten je nach Aufenthalt variieren (z.B. gewählter Zeitraum, Hotelrichtlinie usw.). Wenn Sie Ihre Daten eingeben, können Sie die Preise sehen.",2026-04-09 07:57:32.969239+01
531,78e78bd9-6903-4925-86a1-dd9beecb7f76,5cb20c8a-569f-4349-bcc1-7b12ce52dd30,de,Hat die Unterkunft Hotel Atlântico Rio ein Restaurant vor Ort?,Die Unterkunft Hotel Atlântico Rio hat 1 Restaurants: Restaurante #1,2026-04-09 07:57:32.969239+01
532,78e78bd9-6903-4925-86a1-dd9beecb7f76,5cb20c8a-569f-4349-bcc1-7b12ce52dd30,de,Welche Aktivitäten bietet die Unterkunft Hotel Atlântico Rio?,Die Unterkunft Hotel Atlântico Rio bietet folgende Aktivitäten/Services (es könnten Gebühren anfallen): Live-Sportveranstaltung (Übertragung) Pool Strand,2026-04-09 07:57:32.969239+01
533,78e78bd9-6903-4925-86a1-dd9beecb7f76,5cb20c8a-569f-4349-bcc1-7b12ce52dd30,de,Wie weit ist die Unterkunft Hotel Atlântico Rio vom Zentrum von Rio de Janeiro entfernt?,Die Unterkunft Hotel Atlântico Rio ist 8 km vom Zentrum von Rio de Janeiro entfernt.,2026-04-09 07:57:32.969239+01
534,78e78bd9-6903-4925-86a1-dd9beecb7f76,5cb20c8a-569f-4349-bcc1-7b12ce52dd30,de,Wie weit ist der Strand von der Unterkunft Hotel Atlântico Rio?,Der nächste Strand ist nur 500 m von der Unterkunft Hotel Atlântico Rio entfernt.,2026-04-09 07:57:32.969239+01
535,348e5f35-9a3c-4108-bf28-c85664cddc20,ed4e0188-af4a-48ce-ab20-bbb7ead2b963,it,Che tipo di colazione offre Golden Beach Resort & Spa?,"Durante il soggiorno, Golden Beach Resort & Spa propone una colazione molto apprezzata dagli ospiti (punteggio recensioni: 9). Colazione disponibile: continentale a buffet",2026-04-09 07:57:49.934482+01
536,348e5f35-9a3c-4108-bf28-c85664cddc20,ed4e0188-af4a-48ce-ab20-bbb7ead2b963,it,Golden Beach Resort & Spa dispone di una piscina?,Sì. Trovi maggiori informazioni sulla piscina e sugli altri servizi in questa pagina.,2026-04-09 07:57:49.934482+01
537,348e5f35-9a3c-4108-bf28-c85664cddc20,ed4e0188-af4a-48ce-ab20-bbb7ead2b963,it,Che tipo di camere posso prenotare presso Golden Beach Resort & Spa?,Golden Beach Resort & Spa offre: Matrimoniale Suite,2026-04-09 07:57:49.934482+01
538,348e5f35-9a3c-4108-bf28-c85664cddc20,ed4e0188-af4a-48ce-ab20-bbb7ead2b963,it,Che orari di check-in e check-out sono previsti presso Golden Beach Resort & Spa?,"Presso Golden Beach Resort & Spa, il check-in può essere effettuato dalle 15:00, mentre il check-out è fino alle 12:00.",2026-04-09 07:57:49.934482+01
539,348e5f35-9a3c-4108-bf28-c85664cddc20,ed4e0188-af4a-48ce-ab20-bbb7ead2b963,it,Quanto costa soggiornare presso Golden Beach Resort & Spa?,"I prezzi di Golden Beach Resort & Spa possono variare in base a vari fattori (per es. date, condizioni dell'hotel, ecc). Per vedere i prezzi, inserisci le date del soggiorno.",2026-04-09 07:57:49.934482+01
