id,id_photo,hotel_id,orientation,photo_width,photo_height,alt,created_at_photo,created_at
43d31cb4-2d8d-4da3-87f4-7b32b797ea91,91683454,dec4aeb3-0e72-44a2-81d1-554ff6ec08a1,landscape,3264,2448,a bed in a wooden cabin with a window at Hotel-Gasthof Restaurant Murblick in Judenburg,2017-03-09 20:49:00+00,2026-04-13 00:19:14.392981+01
d47052c1-51db-49a4-896a-57a9de076147,91683453,dec4aeb3-0e72-44a2-81d1-554ff6ec08a1,landscape,3264,2448,a bathroom with a shower and a toilet and a sink at Hotel-Gasthof Restaurant Murblick in Judenburg,2017-03-09 20:48:58+00,2026-04-13 00:19:14.395036+01
3625c232-cc10-4eb7-9e53-4550deda7d80,707032892,07d8352f-4f23-4f9d-bb00-eaa9d58d1c7c,landscape,2000,2000,Gallery image of Hotel Feichtinger Graz in Graz,2025-07-02 11:02:29+01,2026-04-13 00:19:16.632713+01
37db1f19-9f44-414f-8cd5-bc13a5de6684,91683423,dec4aeb3-0e72-44a2-81d1-554ff6ec08a1,landscape,3264,2448,a tv on a wall with a wooden table with a wooden tableablish at Hotel-Gasthof Restaurant Murblick in Judenburg,2017-03-09 20:48:26+00,2026-04-13 00:19:14.398217+01
f3fe9098-0edd-4ab2-841f-deb7f364ab18,34734926,dec4aeb3-0e72-44a2-81d1-554ff6ec08a1,portrait,1600,2400,a group of bikes parked in a parking lot at Hotel-Gasthof Restaurant Murblick in Judenburg,2014-08-21 12:29:58+01,2026-04-13 00:19:14.402547+01
9020b5b0-0b6d-4164-b34a-edad922e8e7d,91683425,dec4aeb3-0e72-44a2-81d1-554ff6ec08a1,landscape,3264,2448,a view of a town with trees and a river at Hotel-Gasthof Restaurant Murblick in Judenburg,2017-03-09 20:48:28+00,2026-04-13 00:19:14.406188+01
94b4ba9f-4835-45af-b1e1-3c10c8745161,34735667,dec4aeb3-0e72-44a2-81d1-554ff6ec08a1,landscape,2400,1600,a basket full ofasted bread at Hotel-Gasthof Restaurant Murblick in Judenburg,2014-08-21 12:43:22+01,2026-04-13 00:19:14.408497+01
5622aa18-50c1-4592-97b0-d4ac05fc94e1,34734924,dec4aeb3-0e72-44a2-81d1-554ff6ec08a1,landscape,2133,1600,a pile of peppers and corn with a green leaf at Hotel-Gasthof Restaurant Murblick in Judenburg,2014-08-21 12:29:57+01,2026-04-13 00:19:14.410167+01
54c928f6-6217-4d87-8ede-f84bbd10ecad,34735664,dec4aeb3-0e72-44a2-81d1-554ff6ec08a1,landscape,2400,1600,a white bowl filled with red beans with a spoon at Hotel-Gasthof Restaurant Murblick in Judenburg,2014-08-21 12:43:20+01,2026-04-13 00:19:14.416678+01
3cc0ccd9-7894-46fb-991d-b8a97d4c646d,34735898,dec4aeb3-0e72-44a2-81d1-554ff6ec08a1,landscape,2400,1600,a basket full of fried chicken in a machine at Hotel-Gasthof Restaurant Murblick in Judenburg,2014-08-21 12:48:09+01,2026-04-13 00:19:14.42244+01
5bf59eac-86d3-4374-acfe-14e6531b176e,34734947,dec4aeb3-0e72-44a2-81d1-554ff6ec08a1,landscape,2400,1600,a living room with a blue couch and a bed at Hotel-Gasthof Restaurant Murblick in Judenburg,2014-08-21 12:30:37+01,2026-04-13 00:19:14.424309+01
90d05b4d-516d-465c-9f03-151d7b546b66,6954118,dec4aeb3-0e72-44a2-81d1-554ff6ec08a1,landscape,3648,2736,a yellow building with a black roof at Hotel-Gasthof Restaurant Murblick in Judenburg,2012-01-31 12:54:25+00,2026-04-13 00:19:14.425732+01
4e58a9df-f76e-4f93-93b5-f47e277a583a,34734936,dec4aeb3-0e72-44a2-81d1-554ff6ec08a1,portrait,1600,2400,a candle and flowers in a vase with a candle at Hotel-Gasthof Restaurant Murblick in Judenburg,2014-08-21 12:30:07+01,2026-04-13 00:19:14.427291+01
aaa1b32b-d7a7-4b96-bb11-8e9c493f5a0c,34734938,dec4aeb3-0e72-44a2-81d1-554ff6ec08a1,portrait,1600,2400,a bathroom with a tub and a toilet and a sink at Hotel-Gasthof Restaurant Murblick in Judenburg,2014-08-21 12:30:12+01,2026-04-13 00:19:14.429742+01
eada1025-d701-4974-a297-51f9bcb122aa,34734946,dec4aeb3-0e72-44a2-81d1-554ff6ec08a1,portrait,1600,2400,a bathroom with a sink and a mirror at Hotel-Gasthof Restaurant Murblick in Judenburg,2014-08-21 12:30:33+01,2026-04-13 00:19:14.432322+01
5cf51d08-d3c2-47c1-8779-5283ca4f2dd6,34735030,dec4aeb3-0e72-44a2-81d1-554ff6ec08a1,portrait,1600,2400,a white dog with its tongue out at Hotel-Gasthof Restaurant Murblick in Judenburg,2014-08-21 12:31:25+01,2026-04-13 00:19:14.434077+01
f6c9fb10-3562-453c-b3d7-e5e603bbadeb,34735576,dec4aeb3-0e72-44a2-81d1-554ff6ec08a1,portrait,1600,2400,a vending machine with food and drinks in it at Hotel-Gasthof Restaurant Murblick in Judenburg,2014-08-21 12:41:34+01,2026-04-13 00:19:14.435896+01
32cec495-0ca4-452d-9ea0-70eae7d42db8,34735693,dec4aeb3-0e72-44a2-81d1-554ff6ec08a1,landscape,2400,1600,a man and woman standing in a crowd of people at Hotel-Gasthof Restaurant Murblick in Judenburg,2014-08-21 12:44:08+01,2026-04-13 00:19:14.437741+01
932338a0-71bd-4cd1-8b3c-e23455c86865,408280753,dec4aeb3-0e72-44a2-81d1-554ff6ec08a1,landscape,4032,3024,a white house on the side of a street at Hotel-Gasthof Restaurant Murblick in Judenburg,2022-11-19 20:49:48+00,2026-04-13 00:19:14.439837+01
f1ba6ba2-5fb5-404d-8254-caff21602eb0,408120325,dec4aeb3-0e72-44a2-81d1-554ff6ec08a1,landscape,4000,3000,a collage of photos of a hotel room at Hotel-Gasthof Restaurant Murblick in Judenburg,2022-11-18 21:55:38+00,2026-04-13 00:19:14.442858+01
6656e3f3-035e-4893-b324-dcabcd567e6c,408182646,dec4aeb3-0e72-44a2-81d1-554ff6ec08a1,landscape,4000,3000,a collage of photos of a kitchen and a living room at Hotel-Gasthof Restaurant Murblick in Judenburg,2022-11-19 07:56:59+00,2026-04-13 00:19:14.446832+01
97f01527-2ba3-4ca8-b871-37bd640b92bf,408232978,dec4aeb3-0e72-44a2-81d1-554ff6ec08a1,landscape,4000,3000,a collage of four pictures of a room at Hotel-Gasthof Restaurant Murblick in Judenburg,2022-11-19 14:56:04+00,2026-04-13 00:19:14.451456+01
fd4015cb-7b56-4c71-a0ce-12813a3ca5a2,408280777,dec4aeb3-0e72-44a2-81d1-554ff6ec08a1,landscape,4032,3024,an empty street in a small town with houses at Hotel-Gasthof Restaurant Murblick in Judenburg,2022-11-19 20:50:15+00,2026-04-13 00:19:14.460981+01
de1c0d93-72d9-4dd2-b4fb-7aac5c55fcca,408182573,dec4aeb3-0e72-44a2-81d1-554ff6ec08a1,portrait,1000,1500,a kitchen with wooden cabinets and a dining room with a table at Hotel-Gasthof Restaurant Murblick in Judenburg,2022-11-19 07:55:16+00,2026-04-13 00:19:14.466489+01
6925907f-03fc-420a-a8af-17722f9f29da,408182582,dec4aeb3-0e72-44a2-81d1-554ff6ec08a1,landscape,1500,1000,a bedroom with two white beds and a window at Hotel-Gasthof Restaurant Murblick in Judenburg,2022-11-19 07:55:34+00,2026-04-13 00:19:14.468791+01
4fc3fb39-bf94-48f7-89b0-6d3b155a5610,408182589,dec4aeb3-0e72-44a2-81d1-554ff6ec08a1,landscape,1500,1000,a living room with a couch and a flat screen tv at Hotel-Gasthof Restaurant Murblick in Judenburg,2022-11-19 07:55:52+00,2026-04-13 00:19:14.47071+01
226fd083-c3a3-46cb-a9d6-fc8e196fa08d,408252647,dec4aeb3-0e72-44a2-81d1-554ff6ec08a1,,,,,,2026-04-13 00:19:14.47245+01
c1e2e01c-d59a-43d2-a168-8989c0e17122,408249358,dec4aeb3-0e72-44a2-81d1-554ff6ec08a1,,,,,,2026-04-13 00:19:14.474977+01
188e820a-8a53-4845-8ffe-2aa4ecdce508,408241897,dec4aeb3-0e72-44a2-81d1-554ff6ec08a1,,,,,,2026-04-13 00:19:14.479146+01
bac40a58-0f25-4e7e-84e2-c8068c787858,408234701,dec4aeb3-0e72-44a2-81d1-554ff6ec08a1,,,,,,2026-04-13 00:19:14.482941+01
e44234f8-8697-42cd-a5d9-23f7b562130f,408242284,dec4aeb3-0e72-44a2-81d1-554ff6ec08a1,,,,,,2026-04-13 00:19:14.48551+01
fefa161f-84dc-47ea-8a1e-16f5b4edd7db,408232667,dec4aeb3-0e72-44a2-81d1-554ff6ec08a1,,,,,,2026-04-13 00:19:14.487261+01
e5979f19-0b5d-46a0-aa0c-0010a411948b,408242053,dec4aeb3-0e72-44a2-81d1-554ff6ec08a1,,,,,,2026-04-13 00:19:14.489214+01
0c4f5184-b8a6-487c-85ae-2c6f9a825184,6953438,dec4aeb3-0e72-44a2-81d1-554ff6ec08a1,,,,,,2026-04-13 00:19:14.490669+01
176c38f2-011f-437c-9050-b7bbc3ee1355,408257990,dec4aeb3-0e72-44a2-81d1-554ff6ec08a1,,,,,,2026-04-13 00:19:14.491982+01
1fc482cb-993a-4240-a428-a222818a6646,408246828,dec4aeb3-0e72-44a2-81d1-554ff6ec08a1,,,,,,2026-04-13 00:19:14.495607+01
22a82a2e-9aae-421d-86ce-12e738b06bc3,34735355,dec4aeb3-0e72-44a2-81d1-554ff6ec08a1,,,,,,2026-04-13 00:19:14.502343+01
75814424-bda6-4609-890f-2a754e8f4d8d,408242161,dec4aeb3-0e72-44a2-81d1-554ff6ec08a1,,,,,,2026-04-13 00:19:14.506262+01
9526084e-a5af-47e0-b7ca-c41237586e29,408249589,dec4aeb3-0e72-44a2-81d1-554ff6ec08a1,,,,,,2026-04-13 00:19:14.510229+01
a27307bb-9e62-4f82-bffe-7a355481155a,34734953,dec4aeb3-0e72-44a2-81d1-554ff6ec08a1,,,,,,2026-04-13 00:19:14.514576+01
0b923f78-5c46-4115-a183-988fefcfafe7,408249298,dec4aeb3-0e72-44a2-81d1-554ff6ec08a1,,,,,,2026-04-13 00:19:14.517498+01
abc822d1-9443-457f-b795-c35682b0529a,408232596,dec4aeb3-0e72-44a2-81d1-554ff6ec08a1,,,,,,2026-04-13 00:19:14.518909+01
232282bd-61b4-4ba3-8e71-6dcba9933802,408183800,dec4aeb3-0e72-44a2-81d1-554ff6ec08a1,,,,,,2026-04-13 00:19:14.51992+01
4995f7ce-6289-402c-87d2-32bf890e215f,34735231,dec4aeb3-0e72-44a2-81d1-554ff6ec08a1,,,,,,2026-04-13 00:19:14.520923+01
f1808f51-56d1-456a-9b70-e4ec842a374b,408242128,dec4aeb3-0e72-44a2-81d1-554ff6ec08a1,,,,,,2026-04-13 00:19:14.522566+01
83b24c76-407a-4535-859e-ff82a5e4115c,34735354,dec4aeb3-0e72-44a2-81d1-554ff6ec08a1,,,,,,2026-04-13 00:19:14.524251+01
2618c9bf-c36d-49f3-aff4-fd7f9b533ceb,408236517,dec4aeb3-0e72-44a2-81d1-554ff6ec08a1,,,,,,2026-04-13 00:19:14.526303+01
bac5962a-8f91-4ee8-83b4-b31614943325,408244515,dec4aeb3-0e72-44a2-81d1-554ff6ec08a1,,,,,,2026-04-13 00:19:14.527707+01
86cb494b-5fdf-4eb6-804d-32142917ffcf,408238569,dec4aeb3-0e72-44a2-81d1-554ff6ec08a1,,,,,,2026-04-13 00:19:14.528846+01
2b2de43a-8eb2-44ca-b580-f133e1216f5d,408232709,dec4aeb3-0e72-44a2-81d1-554ff6ec08a1,,,,,,2026-04-13 00:19:14.530819+01
f2df42fa-b1f1-4a26-b300-bc646924ef43,34735434,dec4aeb3-0e72-44a2-81d1-554ff6ec08a1,,,,,,2026-04-13 00:19:14.532874+01
71d7857f-f0a0-4081-9308-7ddfebba08b6,408251177,dec4aeb3-0e72-44a2-81d1-554ff6ec08a1,,,,,,2026-04-13 00:19:14.53415+01
41b23935-5794-41cd-b098-2851e24e10bc,408182598,dec4aeb3-0e72-44a2-81d1-554ff6ec08a1,,,,,,2026-04-13 00:19:14.535223+01
1a3c859f-b219-4c1b-b296-4d6566374594,6953377,dec4aeb3-0e72-44a2-81d1-554ff6ec08a1,,,,,,2026-04-13 00:19:14.536241+01
cd2b31c4-35e1-4e07-b309-504942a08360,34735356,dec4aeb3-0e72-44a2-81d1-554ff6ec08a1,,,,,,2026-04-13 00:19:14.537146+01
14fb9743-8002-411c-b832-c19ee5a321e2,408232523,dec4aeb3-0e72-44a2-81d1-554ff6ec08a1,,,,,,2026-04-13 00:19:14.538181+01
df7f5d9b-1adc-4faf-8ab8-fd475457e54f,6953392,dec4aeb3-0e72-44a2-81d1-554ff6ec08a1,,,,,,2026-04-13 00:19:14.539722+01
8110ad03-dc2c-4a7c-b3b2-a681f4484a34,34735357,dec4aeb3-0e72-44a2-81d1-554ff6ec08a1,,,,,,2026-04-13 00:19:14.541141+01
971c3b77-5b42-43d7-abcd-04416518a62c,584098514,07d8352f-4f23-4f9d-bb00-eaa9d58d1c7c,landscape,3000,2001,Gallery image of Hotel Feichtinger Graz in Graz,2024-07-25 17:00:45+01,2026-04-13 00:19:16.637815+01
4f2b541b-a663-4ee5-8829-23a9dafcb81e,584102045,07d8352f-4f23-4f9d-bb00-eaa9d58d1c7c,landscape,3000,2001,Gallery image of Hotel Feichtinger Graz in Graz,2024-07-25 17:13:10+01,2026-04-13 00:19:16.639887+01
83406a29-939a-4653-bf09-e6318d4cd14e,583317440,07d8352f-4f23-4f9d-bb00-eaa9d58d1c7c,landscape,3000,2001,Gallery image of Hotel Feichtinger Graz in Graz,2024-07-23 12:01:46+01,2026-04-13 00:19:16.642405+01
fb66660f-ea3e-4a76-83c1-8ae3bded3293,583317480,07d8352f-4f23-4f9d-bb00-eaa9d58d1c7c,landscape,3000,2001,Gallery image of Hotel Feichtinger Graz in Graz,2024-07-23 12:01:58+01,2026-04-13 00:19:16.646572+01
4ffc31f6-e20d-4611-9a46-b1feca44f7a2,585112056,07d8352f-4f23-4f9d-bb00-eaa9d58d1c7c,landscape,3000,2001,Gallery image of Hotel Feichtinger Graz in Graz,2024-07-29 18:44:12+01,2026-04-13 00:19:16.649505+01
ffbe4f72-35c2-415c-a63c-4f875c88a6c4,308578910,07d8352f-4f23-4f9d-bb00-eaa9d58d1c7c,landscape,3335,1878,Gallery image of Hotel Feichtinger Graz in Graz,2021-07-07 14:48:43+01,2026-04-13 00:19:16.651216+01
2fd588b8-7e25-4b85-b3c3-ab12c3861525,585111921,07d8352f-4f23-4f9d-bb00-eaa9d58d1c7c,landscape,3000,2001,Gallery image of Hotel Feichtinger Graz in Graz,2024-07-29 18:43:57+01,2026-04-13 00:19:16.652933+01
8d087b7c-6c11-4c7e-922e-105e6e04cfa9,584108816,07d8352f-4f23-4f9d-bb00-eaa9d58d1c7c,landscape,3000,2001,Gallery image of Hotel Feichtinger Graz in Graz,2024-07-25 17:36:45+01,2026-04-13 00:19:16.654703+01
30760cc8-4502-4ffc-aae5-eb02bd147b52,584107714,07d8352f-4f23-4f9d-bb00-eaa9d58d1c7c,portrait,2001,3000,Gallery image of Hotel Feichtinger Graz in Graz,2024-07-25 17:33:00+01,2026-04-13 00:19:16.657154+01
adc2aae7-c0d3-4b49-bb41-3daa63a20192,584106587,07d8352f-4f23-4f9d-bb00-eaa9d58d1c7c,portrait,2001,3000,Gallery image of Hotel Feichtinger Graz in Graz,2024-07-25 17:29:28+01,2026-04-13 00:19:16.659182+01
e71267e2-d5fa-4b4a-8e72-d4e9ffd3ba4d,584106623,07d8352f-4f23-4f9d-bb00-eaa9d58d1c7c,landscape,3000,2001,Gallery image of Hotel Feichtinger Graz in Graz,2024-07-25 17:29:39+01,2026-04-13 00:19:16.661336+01
4dccb4a0-72cb-41d6-a3d5-3a1dd3c7a90b,584104185,07d8352f-4f23-4f9d-bb00-eaa9d58d1c7c,portrait,2001,3000,Gallery image of Hotel Feichtinger Graz in Graz,2024-07-25 17:20:45+01,2026-04-13 00:19:16.663292+01
79d4aad6-b5ff-4b52-ab37-7ee668ade54a,584104818,07d8352f-4f23-4f9d-bb00-eaa9d58d1c7c,landscape,3000,2001,Gallery image of Hotel Feichtinger Graz in Graz,2024-07-25 17:23:34+01,2026-04-13 00:19:16.665507+01
5cadb09b-1145-42e9-a97b-29d1a9618012,584104887,07d8352f-4f23-4f9d-bb00-eaa9d58d1c7c,landscape,3000,2001,Gallery image of Hotel Feichtinger Graz in Graz,2024-07-25 17:23:51+01,2026-04-13 00:19:16.668473+01
a9c9b4ab-dd9d-4798-a4f7-eccf586e8d71,584104130,07d8352f-4f23-4f9d-bb00-eaa9d58d1c7c,landscape,3000,2001,Gallery image of Hotel Feichtinger Graz in Graz,2024-07-25 17:20:33+01,2026-04-13 00:19:16.670755+01
a7243f19-a783-4e4b-a399-8ec4c227ce16,583317409,07d8352f-4f23-4f9d-bb00-eaa9d58d1c7c,portrait,2001,3000,Gallery image of Hotel Feichtinger Graz in Graz,2024-07-23 12:01:41+01,2026-04-13 00:19:16.672793+01
fab234cc-83d3-4847-807c-8e9fb6098ee4,584111293,07d8352f-4f23-4f9d-bb00-eaa9d58d1c7c,landscape,3000,2001,Gallery image of Hotel Feichtinger Graz in Graz,2024-07-25 17:46:08+01,2026-04-13 00:19:16.675308+01
51d6cf0c-bafa-443a-aeda-32cd76a3bc1c,584111330,07d8352f-4f23-4f9d-bb00-eaa9d58d1c7c,landscape,3000,2001,Gallery image of Hotel Feichtinger Graz in Graz,2024-07-25 17:46:18+01,2026-04-13 00:19:16.677134+01
83923f36-c417-4e49-9ec6-910464217e2f,584115081,07d8352f-4f23-4f9d-bb00-eaa9d58d1c7c,landscape,3000,2001,Gallery image of Hotel Feichtinger Graz in Graz,2024-07-25 18:00:07+01,2026-04-13 00:19:16.678745+01
2e32232a-238f-4e00-877c-324f7046c957,390649202,bae17b2f-06d3-4be0-a0d6-7388203ef858,landscape,3541,2362,a view of the courtyard of a hotel at Der Trattner - Hotel Trattnerhof &amp; Hotel Schöcklblick in Semriach,2022-09-13 17:23:11+01,2026-04-13 00:25:52.744277+01
04bd15c2-0c40-40fa-a9fe-d17b337643b3,265300508,bae17b2f-06d3-4be0-a0d6-7388203ef858,landscape,3543,2123,a hotel room with a bed and a table with a bowl of fruit at Der Trattner - Hotel Trattnerhof &amp; Hotel Schöcklblick in Semriach,2020-08-10 19:20:16+01,2026-04-13 00:25:52.757232+01
24da76a5-5724-43dd-a9c1-0f2c61bb5be2,265300781,bae17b2f-06d3-4be0-a0d6-7388203ef858,landscape,3543,2362,a bathroom with a sink and towels on a counter at Der Trattner - Hotel Trattnerhof &amp; Hotel Schöcklblick in Semriach,2020-08-10 19:22:53+01,2026-04-13 00:25:52.758909+01
bcfbffb2-4089-4268-8b0f-e16ceef2722c,401567860,bae17b2f-06d3-4be0-a0d6-7388203ef858,landscape,2124,1417,a pool in a gym with a swimming pool at Der Trattner - Hotel Trattnerhof &amp; Hotel Schöcklblick in Semriach,2022-10-14 16:49:50+01,2026-04-13 00:25:52.760241+01
cd597079-5325-45dc-afa6-ef252557da2a,265295556,bae17b2f-06d3-4be0-a0d6-7388203ef858,landscape,3543,2362,a dining room with white tables and chairs at Der Trattner - Hotel Trattnerhof &amp; Hotel Schöcklblick in Semriach,2020-08-10 18:33:57+01,2026-04-13 00:25:52.761605+01
c2f5b11d-b4cf-4d37-ba5b-159911f88292,590938958,bae17b2f-06d3-4be0-a0d6-7388203ef858,landscape,2040,1530,a group of people playing tennis in a tennis court at Der Trattner - Hotel Trattnerhof &amp; Hotel Schöcklblick in Semriach,2024-08-21 15:50:52+01,2026-04-13 00:25:52.763941+01
67a81e77-2cc8-4955-a18c-b985bd43ee7f,165700913,bae17b2f-06d3-4be0-a0d6-7388203ef858,landscape,5184,3456,a banquet hall with white tables and white chairs at Der Trattner - Hotel Trattnerhof &amp; Hotel Schöcklblick in Semriach,2018-10-21 10:55:32+01,2026-04-13 00:25:52.767306+01
77d22396-57a7-44f2-a5fd-446bba53d0dc,401580968,bae17b2f-06d3-4be0-a0d6-7388203ef858,landscape,3543,2360,an aerial view of a resort in the mountains at Der Trattner - Hotel Trattnerhof &amp; Hotel Schöcklblick in Semriach,2022-10-14 17:28:41+01,2026-04-13 00:25:52.769839+01
c1366ba6-e246-4e05-9699-b102fcd655a2,265301352,bae17b2f-06d3-4be0-a0d6-7388203ef858,landscape,3543,2362,a hotel room with a bed and a bowl of fruit on a table at Der Trattner - Hotel Trattnerhof &amp; Hotel Schöcklblick in Semriach,2020-08-10 19:27:50+01,2026-04-13 00:25:52.772328+01
8aab0e5d-04c2-4004-90c8-0c0add975a4b,225551604,bae17b2f-06d3-4be0-a0d6-7388203ef858,landscape,5184,3456,a kitchen counter with meat and other foods on it at Der Trattner - Hotel Trattnerhof &amp; Hotel Schöcklblick in Semriach,2019-10-29 11:32:06+00,2026-04-13 00:25:52.775337+01
72af46ae-4bf2-42ae-8b79-b6c912f1e61e,265300915,bae17b2f-06d3-4be0-a0d6-7388203ef858,landscape,3543,2362,a living room with a couch and a table at Der Trattner - Hotel Trattnerhof &amp; Hotel Schöcklblick in Semriach,2020-08-10 19:23:55+01,2026-04-13 00:25:52.779927+01
fb124470-7570-417b-9713-caa7a01d8c52,401567876,bae17b2f-06d3-4be0-a0d6-7388203ef858,landscape,2124,1417,a waiting room with chairs and a couch at Der Trattner - Hotel Trattnerhof &amp; Hotel Schöcklblick in Semriach,2022-10-14 16:49:51+01,2026-04-13 00:25:52.784354+01
f00eb89d-6308-454c-b734-4192e852432c,390649165,bae17b2f-06d3-4be0-a0d6-7388203ef858,landscape,3541,2362,a room filled with lots of bottles of wine at Der Trattner - Hotel Trattnerhof &amp; Hotel Schöcklblick in Semriach,2022-09-13 17:23:01+01,2026-04-13 00:25:52.791346+01
570b0289-ede9-455a-97f9-12a38eb33f5c,399329963,bae17b2f-06d3-4be0-a0d6-7388203ef858,landscape,5078,3385,a hotel room with a bed and a living room at Der Trattner - Hotel Trattnerhof &amp; Hotel Schöcklblick in Semriach,2022-10-04 15:11:26+01,2026-04-13 00:25:52.79401+01
ee9b65d4-4aa1-458a-bfbf-f853f5bca1a7,401580917,bae17b2f-06d3-4be0-a0d6-7388203ef858,landscape,3814,2860,a group of signs in a field with animals at Der Trattner - Hotel Trattnerhof &amp; Hotel Schöcklblick in Semriach,2022-10-14 17:28:24+01,2026-04-13 00:25:52.798347+01
3e9727f8-4139-4eec-8d42-7739ea5e425e,390649169,bae17b2f-06d3-4be0-a0d6-7388203ef858,landscape,3541,2362,an indoor swimming pool with a wood paneled wall at Der Trattner - Hotel Trattnerhof &amp; Hotel Schöcklblick in Semriach,2022-09-13 17:23:03+01,2026-04-13 00:25:52.802029+01
81662779-7c21-4541-be6a-fc97f404e323,390649218,bae17b2f-06d3-4be0-a0d6-7388203ef858,landscape,3541,2362,two hammocks in the grass in front of a hotel at Der Trattner - Hotel Trattnerhof &amp; Hotel Schöcklblick in Semriach,2022-09-13 17:23:14+01,2026-04-13 00:25:52.806131+01
7e3f9790-819d-496b-a608-869718b5f248,265385782,bae17b2f-06d3-4be0-a0d6-7388203ef858,landscape,3543,2090,a counter with two plates of fruits and vegetables on it at Der Trattner - Hotel Trattnerhof &amp; Hotel Schöcklblick in Semriach,2020-08-11 15:14:07+01,2026-04-13 00:25:52.808189+01
086f0bbf-e845-4de7-854c-8e38ea80710e,401567890,bae17b2f-06d3-4be0-a0d6-7388203ef858,landscape,2126,1416,an aerial view of a resort with mountains in the background at Der Trattner - Hotel Trattnerhof &amp; Hotel Schöcklblick in Semriach,2022-10-14 16:49:57+01,2026-04-13 00:25:52.809999+01
0f273407-fdfb-452b-9e66-98875dda9c57,265297781,bae17b2f-06d3-4be0-a0d6-7388203ef858,landscape,3543,2362,a table with bowls of food on a shelf at Der Trattner - Hotel Trattnerhof &amp; Hotel Schöcklblick in Semriach,2020-08-10 18:53:29+01,2026-04-13 00:25:52.812441+01
6174d5a0-53ef-48c4-beee-2e5fcc13d7ac,265387690,bae17b2f-06d3-4be0-a0d6-7388203ef858,landscape,3543,2362,a kitchen counter with bowls of food and drinks at Der Trattner - Hotel Trattnerhof &amp; Hotel Schöcklblick in Semriach,2020-08-11 15:30:13+01,2026-04-13 00:25:52.818106+01
25218085-3938-4145-825e-3dfef9ace3df,265301418,bae17b2f-06d3-4be0-a0d6-7388203ef858,landscape,3543,2362,a balcony with a table and chairs and a green field at Der Trattner - Hotel Trattnerhof &amp; Hotel Schöcklblick in Semriach,2020-08-10 19:28:48+01,2026-04-13 00:25:52.824336+01
f55bce9c-174a-443e-9aaa-d7650078a493,265394831,bae17b2f-06d3-4be0-a0d6-7388203ef858,,,,,,2026-04-13 00:25:52.916054+01
64529e72-87d8-4fda-bd4a-a22049420647,265294028,bae17b2f-06d3-4be0-a0d6-7388203ef858,landscape,3543,2104,a kitchen with wooden cabinets and a coffee shop at Der Trattner - Hotel Trattnerhof &amp; Hotel Schöcklblick in Semriach,2020-08-10 18:22:01+01,2026-04-13 00:25:52.827849+01
116afc79-79a4-4299-b7b8-3290700c035d,401567891,bae17b2f-06d3-4be0-a0d6-7388203ef858,landscape,2124,1417,a building with flower boxes on the balconies at Der Trattner - Hotel Trattnerhof &amp; Hotel Schöcklblick in Semriach,2022-10-14 16:49:57+01,2026-04-13 00:25:52.830568+01
48d47f2e-7cb3-432e-ad20-042af3b340bd,265294573,bae17b2f-06d3-4be0-a0d6-7388203ef858,landscape,3543,2362,a display case with a bunch of books on a table at Der Trattner - Hotel Trattnerhof &amp; Hotel Schöcklblick in Semriach,2020-08-10 18:26:57+01,2026-04-13 00:25:52.833398+01
0ee32319-5784-4b97-be71-01808b73d88f,390649198,bae17b2f-06d3-4be0-a0d6-7388203ef858,landscape,3541,2362,a park with a bench in a field with mountains at Der Trattner - Hotel Trattnerhof &amp; Hotel Schöcklblick in Semriach,2022-09-13 17:23:11+01,2026-04-13 00:25:52.835174+01
2ca3a38a-db8c-4910-8d2d-338f5c9a1a99,225551642,bae17b2f-06d3-4be0-a0d6-7388203ef858,landscape,5184,3456,a kitchen counter with plates and bowls of food at Der Trattner - Hotel Trattnerhof &amp; Hotel Schöcklblick in Semriach,2019-10-29 11:32:24+00,2026-04-13 00:25:52.837137+01
5ea3f3ff-e5ee-4d9b-8026-1a22d71d4bc0,401567892,bae17b2f-06d3-4be0-a0d6-7388203ef858,landscape,2126,1416,an aerial view of a resort with mountains in the background at Der Trattner - Hotel Trattnerhof &amp; Hotel Schöcklblick in Semriach,2022-10-14 16:49:57+01,2026-04-13 00:25:52.838696+01
50096e4d-b9b3-459d-a270-e96c4d5bb029,225551614,bae17b2f-06d3-4be0-a0d6-7388203ef858,landscape,5184,3456,a buffet with bowls of food on a counter at Der Trattner - Hotel Trattnerhof &amp; Hotel Schöcklblick in Semriach,2019-10-29 11:32:12+00,2026-04-13 00:25:52.840485+01
fd0cbef7-2869-4243-8ce4-ba7b3ad2ed4c,265298061,bae17b2f-06d3-4be0-a0d6-7388203ef858,landscape,3543,2362,a loaf of bread sitting on top of a table at Der Trattner - Hotel Trattnerhof &amp; Hotel Schöcklblick in Semriach,2020-08-10 18:57:10+01,2026-04-13 00:25:52.842222+01
2d945f4c-158a-4a76-b9b2-446fbf5cad59,265384593,bae17b2f-06d3-4be0-a0d6-7388203ef858,landscape,3543,2362,a large room with tables and chairs and a whiteboard at Der Trattner - Hotel Trattnerhof &amp; Hotel Schöcklblick in Semriach,2020-08-11 15:04:24+01,2026-04-13 00:25:52.843901+01
95b02a9f-c606-40ae-b24a-05cc4d71f75a,401567888,bae17b2f-06d3-4be0-a0d6-7388203ef858,landscape,2126,1092,a village with houses and a grassy field at Der Trattner - Hotel Trattnerhof &amp; Hotel Schöcklblick in Semriach,2022-10-14 16:49:56+01,2026-04-13 00:25:52.846689+01
ebce001b-e934-4489-845e-d2e857cde887,114894948,bae17b2f-06d3-4be0-a0d6-7388203ef858,landscape,6016,4016,a bathroom with a sink and a mirror at Der Trattner - Hotel Trattnerhof &amp; Hotel Schöcklblick in Semriach,2017-10-01 10:44:39+01,2026-04-13 00:25:52.849692+01
0560539b-8830-4760-b689-81cbc7fbabbc,265293045,bae17b2f-06d3-4be0-a0d6-7388203ef858,landscape,3543,2362,a building with a garden in front of it at Der Trattner - Hotel Trattnerhof &amp; Hotel Schöcklblick in Semriach,2020-08-10 18:12:26+01,2026-04-13 00:25:52.854558+01
b3c3207e-b386-42e3-b07c-bea21f1eed59,401567896,bae17b2f-06d3-4be0-a0d6-7388203ef858,landscape,2126,1416,a view of a resort with mountains in the background at Der Trattner - Hotel Trattnerhof &amp; Hotel Schöcklblick in Semriach,2022-10-14 16:49:59+01,2026-04-13 00:25:52.857617+01
80aab635-6d4a-4605-9bfb-4054d147c681,104152050,bae17b2f-06d3-4be0-a0d6-7388203ef858,landscape,6000,4000,a house with a balcony with flowers on it at Der Trattner - Hotel Trattnerhof &amp; Hotel Schöcklblick in Semriach,2017-06-29 14:37:56+01,2026-04-13 00:25:52.860094+01
283d4438-fb4d-45a0-84a0-91020aefe79e,401567905,bae17b2f-06d3-4be0-a0d6-7388203ef858,landscape,2124,1417,a large building with a playground in front of it at Der Trattner - Hotel Trattnerhof &amp; Hotel Schöcklblick in Semriach,2022-10-14 16:50:00+01,2026-04-13 00:25:52.86339+01
71f561c6-35b6-4fc2-83a4-c6aee1461339,265302026,bae17b2f-06d3-4be0-a0d6-7388203ef858,landscape,3543,2362,a hotel room with two beds and a desk at Der Trattner - Hotel Trattnerhof &amp; Hotel Schöcklblick in Semriach,2020-08-10 19:36:31+01,2026-04-13 00:25:52.865981+01
46fffea3-ed07-4235-ada5-838a669d3e91,60727449,bae17b2f-06d3-4be0-a0d6-7388203ef858,landscape,6000,4000,a waiting room with white couches and tables at Der Trattner - Hotel Trattnerhof &amp; Hotel Schöcklblick in Semriach,2016-01-06 11:52:06+00,2026-04-13 00:25:52.867918+01
f95b2c7a-2d88-43cd-bd31-94ccb78c434c,165700945,bae17b2f-06d3-4be0-a0d6-7388203ef858,landscape,5184,3456,a table with silverware and napkins on a table at Der Trattner - Hotel Trattnerhof &amp; Hotel Schöcklblick in Semriach,2018-10-21 10:55:48+01,2026-04-13 00:25:52.869344+01
41717848-0f1b-4b33-9649-e00de18cd149,401567906,bae17b2f-06d3-4be0-a0d6-7388203ef858,landscape,2124,1417,a park with two benches and a stone fountain at Der Trattner - Hotel Trattnerhof &amp; Hotel Schöcklblick in Semriach,2022-10-14 16:50:00+01,2026-04-13 00:25:52.870846+01
