id,hotel_id,url_id,language,ask,answer,created_at
232,693ecb38-9440-489d-8462-6bce9e650990,bc83f055-60f0-4255-8761-f8b72a87abb2,pt,Quanto custa hospedar-me em Hotel Aton?,"Os preços em Hotel Aton podem variar de acordo com os parâmetros da sua estadia (ex.: as datas que seleciona, as condições do hotel, entre outros). Insira as suas datas e consulte os preços.",2026-04-12 23:05:31.490587+01
233,693ecb38-9440-489d-8462-6bce9e650990,bc83f055-60f0-4255-8761-f8b72a87abb2,pt,Que atividades há em Hotel Aton?,Hotel Aton disponibiliza as seguintes atividades/serviços (podem-se aplicar custos): Ciclismo,2026-04-12 23:05:31.490587+01
234,693ecb38-9440-489d-8462-6bce9e650990,bc83f055-60f0-4255-8761-f8b72a87abb2,pt,A que distância fica Hotel Aton do centro de Graz?,Hotel Aton fica a 1 000 m do centro de Graz.,2026-04-12 23:05:31.490587+01
235,baf89afb-c0d7-4234-b874-4fcafb5ccffb,9cf5f544-048f-41b0-be2a-fe4c91ddb4c1,pt,Que tipo de pequeno-almoço é servido em PLAZA INN Graz Messe?,"Os hóspedes em PLAZA INN Graz Messe podem desfrutar de um pequeno-almoço com boa pontuação durante a sua estadia (pontuação de comentários: 8,5). As opções de pequeno-almoço incluem: Continental Vegetariano Vegan Sem glúten Buffet",2026-04-12 23:05:50.583321+01
236,baf89afb-c0d7-4234-b874-4fcafb5ccffb,9cf5f544-048f-41b0-be2a-fe4c91ddb4c1,pt,Que tipo de quarto posso reservar em PLAZA INN Graz Messe?,As opções de quarto em PLAZA INN Graz Messe incluem: Duplo Familiar Triplo Apartamento Individual,2026-04-12 23:05:50.583321+01
237,baf89afb-c0d7-4234-b874-4fcafb5ccffb,9cf5f544-048f-41b0-be2a-fe4c91ddb4c1,pt,Quais são os horários de check-in e check-out em PLAZA INN Graz Messe?,"Em PLAZA INN Graz Messe, o check-in é a partir das 15:00 e o check-out até às 11:00.",2026-04-12 23:05:50.583321+01
238,baf89afb-c0d7-4234-b874-4fcafb5ccffb,9cf5f544-048f-41b0-be2a-fe4c91ddb4c1,pt,Quanto custa hospedar-me em PLAZA INN Graz Messe?,"Os preços em PLAZA INN Graz Messe podem variar de acordo com os parâmetros da sua estadia (ex.: as datas que seleciona, as condições do hotel, entre outros). Insira as suas datas e consulte os preços.",2026-04-12 23:05:50.583321+01
239,baf89afb-c0d7-4234-b874-4fcafb5ccffb,9cf5f544-048f-41b0-be2a-fe4c91ddb4c1,pt,Que atividades há em PLAZA INN Graz Messe?,PLAZA INN Graz Messe disponibiliza as seguintes atividades/serviços (podem-se aplicar custos): Ciclismo Caminhadas Campo de golfe (a menos de 3 km),2026-04-12 23:05:50.583321+01
240,baf89afb-c0d7-4234-b874-4fcafb5ccffb,9cf5f544-048f-41b0-be2a-fe4c91ddb4c1,pt,A que distância fica PLAZA INN Graz Messe do centro de Graz?,"PLAZA INN Graz Messe fica a 1,8 km do centro de Graz.",2026-04-12 23:05:50.583321+01
241,55aa6d82-f9e4-404f-b552-2a4b9c10180b,bf100ed5-8cd4-481a-84c1-c05cbfb2a9df,en,What kind of breakfast is served at A-ROSA Ifen Hotel Kleinwalsertal?,Guests staying at A-ROSA Ifen Hotel Kleinwalsertal can enjoy a highly-rated breakfast during their stay (guest review score: 9.4). Breakfast option(s) include: Buffet,2026-04-12 23:06:34.622304+01
242,55aa6d82-f9e4-404f-b552-2a4b9c10180b,bf100ed5-8cd4-481a-84c1-c05cbfb2a9df,en,Does A-ROSA Ifen Hotel Kleinwalsertal have a pool?,"Yes, this hotel has a pool. Find out the details about the pool and other facilities on this page.",2026-04-12 23:06:34.622304+01
243,55aa6d82-f9e4-404f-b552-2a4b9c10180b,bf100ed5-8cd4-481a-84c1-c05cbfb2a9df,en,What type of room can I book at A-ROSA Ifen Hotel Kleinwalsertal?,Room options at A-ROSA Ifen Hotel Kleinwalsertal include: Double Suite,2026-04-12 23:06:34.622304+01
244,55aa6d82-f9e4-404f-b552-2a4b9c10180b,bf100ed5-8cd4-481a-84c1-c05cbfb2a9df,en,What are the check-in and check-out times at A-ROSA Ifen Hotel Kleinwalsertal?,"Check-in at A-ROSA Ifen Hotel Kleinwalsertal is from 15:00, and check-out is until 11:00.",2026-04-12 23:06:34.622304+01
245,55aa6d82-f9e4-404f-b552-2a4b9c10180b,bf100ed5-8cd4-481a-84c1-c05cbfb2a9df,en,How much does it cost to stay at A-ROSA Ifen Hotel Kleinwalsertal?,"The prices at A-ROSA Ifen Hotel Kleinwalsertal may vary depending on your stay (e.g. dates you select, hotel's policy etc.). See the prices by entering your dates.",2026-04-12 23:06:34.622304+01
246,55aa6d82-f9e4-404f-b552-2a4b9c10180b,bf100ed5-8cd4-481a-84c1-c05cbfb2a9df,en,Does A-ROSA Ifen Hotel Kleinwalsertal have a restaurant on site?,A-ROSA Ifen Hotel Kleinwalsertal has 3 restaurants: Theo's Carnozet Kilian Stuba,2026-04-12 23:06:34.622304+01
247,55aa6d82-f9e4-404f-b552-2a4b9c10180b,bf100ed5-8cd4-481a-84c1-c05cbfb2a9df,en,What is there to do at A-ROSA Ifen Hotel Kleinwalsertal?,A-ROSA Ifen Hotel Kleinwalsertal offers the following activities / services (charges may apply): Spa and wellness centre Fitness centre Sauna Massage Cycling Hiking Games room Table tennis Evening entertainment Walking tours Swimming pool Fitness/spa locker rooms Beauty Services Cooking class Facial treatments Bike tours Waxing services Live music/performance Make up services Manicure Pedicure Body treatments Body scrub Body wrap Spa facilities Steam room Spa lounge/relaxation area Foot bath Spa/wellness packages Back massage Neck massage Foot massage Couples massage Head massage Hand massage Full body massage Fitness Yoga classes,2026-04-12 23:06:34.622304+01
248,55aa6d82-f9e4-404f-b552-2a4b9c10180b,bf100ed5-8cd4-481a-84c1-c05cbfb2a9df,en,How far is A-ROSA Ifen Hotel Kleinwalsertal from the centre of Hirschegg?,"A-ROSA Ifen Hotel Kleinwalsertal is 2,600 ft from the centre of Hirschegg.",2026-04-12 23:06:34.622304+01
249,9c58a9ac-1282-4d84-8b92-24c76c2f863d,64d2123c-6aab-4349-b97b-5adfff4c178d,en,What kind of breakfast is served at Hotel Mercure Graz City?,Guests staying at Hotel Mercure Graz City can enjoy a highly-rated breakfast during their stay (guest review score: 8.5). Breakfast option(s) include: Continental Vegetarian Gluten-free Buffet,2026-04-12 23:06:54.322426+01
250,9c58a9ac-1282-4d84-8b92-24c76c2f863d,64d2123c-6aab-4349-b97b-5adfff4c178d,en,What type of room can I book at Hotel Mercure Graz City?,Room options at Hotel Mercure Graz City include: Double Triple Suite,2026-04-12 23:06:54.322426+01
251,9c58a9ac-1282-4d84-8b92-24c76c2f863d,64d2123c-6aab-4349-b97b-5adfff4c178d,en,What are the check-in and check-out times at Hotel Mercure Graz City?,"Check-in at Hotel Mercure Graz City is from 15:00, and check-out is until 12:00.",2026-04-12 23:06:54.322426+01
252,9c58a9ac-1282-4d84-8b92-24c76c2f863d,64d2123c-6aab-4349-b97b-5adfff4c178d,en,How much does it cost to stay at Hotel Mercure Graz City?,"The prices at Hotel Mercure Graz City may vary depending on your stay (e.g. dates you select, hotel's policy etc.). See the prices by entering your dates.",2026-04-12 23:06:54.322426+01
253,9c58a9ac-1282-4d84-8b92-24c76c2f863d,64d2123c-6aab-4349-b97b-5adfff4c178d,en,What is there to do at Hotel Mercure Graz City?,Hotel Mercure Graz City offers the following activities / services (charges may apply): Fitness centre Sauna Fitness/spa locker rooms Fitness,2026-04-12 23:06:54.322426+01
254,9c58a9ac-1282-4d84-8b92-24c76c2f863d,64d2123c-6aab-4349-b97b-5adfff4c178d,en,How far is Hotel Mercure Graz City from the centre of Graz?,"Hotel Mercure Graz City is 2,950 ft from the centre of Graz.",2026-04-12 23:06:54.322426+01
255,750e416f-0652-4568-9efa-bb8bc38f3835,bf100ed5-8cd4-481a-84c1-c05cbfb2a9df,es,¿Qué tipo de desayuno se sirve en A-ROSA Ifen Hotel Kleinwalsertal?,"Los clientes de A-ROSA Ifen Hotel Kleinwalsertal podrán disfrutar durante su estancia de un desayuno con muy buena puntuación (9,4) Las opciones del desayuno son: Buffet",2026-04-12 23:08:10.016499+01
256,750e416f-0652-4568-9efa-bb8bc38f3835,bf100ed5-8cd4-481a-84c1-c05cbfb2a9df,es,¿Hay piscina en A-ROSA Ifen Hotel Kleinwalsertal?,"Sí, el hotel tiene piscina. En esta página encontrarás más info sobre la piscina y otras instalaciones.",2026-04-12 23:08:10.016499+01
257,750e416f-0652-4568-9efa-bb8bc38f3835,bf100ed5-8cd4-481a-84c1-c05cbfb2a9df,es,¿Qué tipo de habitación puedo reservar en A-ROSA Ifen Hotel Kleinwalsertal?,Las opciones de habitación en A-ROSA Ifen Hotel Kleinwalsertal son: Doble Suite,2026-04-12 23:08:10.016499+01
258,750e416f-0652-4568-9efa-bb8bc38f3835,bf100ed5-8cd4-481a-84c1-c05cbfb2a9df,es,¿Cuál es el horario de entrada y salida de A-ROSA Ifen Hotel Kleinwalsertal?,Podrás hacer el check-in en A-ROSA Ifen Hotel Kleinwalsertal a partir de las 15:00 y el check-out hasta las 11:00.,2026-04-12 23:08:10.016499+01
259,750e416f-0652-4568-9efa-bb8bc38f3835,bf100ed5-8cd4-481a-84c1-c05cbfb2a9df,es,¿Cuánto cuesta alojarse en A-ROSA Ifen Hotel Kleinwalsertal?,"Los precios en A-ROSA Ifen Hotel Kleinwalsertal pueden variar en función de la estancia (fechas, condiciones del hotel, etc.). Elige tus fechas para ver el precio.",2026-04-12 23:08:10.016499+01
260,750e416f-0652-4568-9efa-bb8bc38f3835,bf100ed5-8cd4-481a-84c1-c05cbfb2a9df,es,¿Hay restaurante dentro de A-ROSA Ifen Hotel Kleinwalsertal?,A-ROSA Ifen Hotel Kleinwalsertal tiene 3 restaurantes: Theo's Carnozet Kilian Stuba,2026-04-12 23:08:10.016499+01
261,750e416f-0652-4568-9efa-bb8bc38f3835,bf100ed5-8cd4-481a-84c1-c05cbfb2a9df,es,¿Qué se puede hacer en A-ROSA Ifen Hotel Kleinwalsertal?,A-ROSA Ifen Hotel Kleinwalsertal ofrece las siguientes actividades y servicios (se pueden aplicar cargos): Spa y centro de bienestar Gimnasio Sauna Masajes Ciclismo Senderismo Sala de juegos Ping pong Entretenimiento nocturno Tours a pie Piscina Taquillas en el gimnasio / spa Servicios de belleza Clases de cocina Tratamientos faciales Tours en bici Servicios de depilación Música / espectáculos en directo Servicios de maquillaje Manicura Pedicura Tratamientos corporales Exfoliación corporal Envoltura corporal Instalaciones de spa Baño de vapor Zona de spa / relajación Pediluvio Paquetes de spa / bienestar Masaje de espalda Masaje de cuello Masaje de pies Masaje en pareja Masaje de cabeza Masaje de manos Masaje corporal completo Gimnasio Clases de yoga,2026-04-12 23:08:10.016499+01
262,750e416f-0652-4568-9efa-bb8bc38f3835,bf100ed5-8cd4-481a-84c1-c05cbfb2a9df,es,¿A qué distancia está A-ROSA Ifen Hotel Kleinwalsertal del centro de Hirschegg?,A-ROSA Ifen Hotel Kleinwalsertal está a 800 m del centro de Hirschegg.,2026-04-12 23:08:10.016499+01
263,db8d23ac-ab1f-48a8-809e-fdae3333b788,64d2123c-6aab-4349-b97b-5adfff4c178d,es,¿Qué tipo de desayuno se sirve en Hotel Mercure Graz City?,"Los clientes de Hotel Mercure Graz City podrán disfrutar durante su estancia de un desayuno con muy buena puntuación (8,5) Las opciones del desayuno son: Continental Vegetariano Sin gluten Buffet",2026-04-12 23:08:30.689787+01
264,db8d23ac-ab1f-48a8-809e-fdae3333b788,64d2123c-6aab-4349-b97b-5adfff4c178d,es,¿Qué tipo de habitación puedo reservar en Hotel Mercure Graz City?,Las opciones de habitación en Hotel Mercure Graz City son: Doble Triple Suite,2026-04-12 23:08:30.689787+01
265,db8d23ac-ab1f-48a8-809e-fdae3333b788,64d2123c-6aab-4349-b97b-5adfff4c178d,es,¿Cuál es el horario de entrada y salida de Hotel Mercure Graz City?,Podrás hacer el check-in en Hotel Mercure Graz City a partir de las 15:00 y el check-out hasta las 12:00.,2026-04-12 23:08:30.689787+01
266,db8d23ac-ab1f-48a8-809e-fdae3333b788,64d2123c-6aab-4349-b97b-5adfff4c178d,es,¿Cuánto cuesta alojarse en Hotel Mercure Graz City?,"Los precios en Hotel Mercure Graz City pueden variar en función de la estancia (fechas, condiciones del hotel, etc.). Elige tus fechas para ver el precio.",2026-04-12 23:08:30.689787+01
267,db8d23ac-ab1f-48a8-809e-fdae3333b788,64d2123c-6aab-4349-b97b-5adfff4c178d,es,¿Qué se puede hacer en Hotel Mercure Graz City?,Hotel Mercure Graz City ofrece las siguientes actividades y servicios (se pueden aplicar cargos): Gimnasio Sauna Taquillas en el gimnasio / spa Gimnasio,2026-04-12 23:08:30.689787+01
268,db8d23ac-ab1f-48a8-809e-fdae3333b788,64d2123c-6aab-4349-b97b-5adfff4c178d,es,¿A qué distancia está Hotel Mercure Graz City del centro de Graz?,Hotel Mercure Graz City está a 900 m del centro de Graz.,2026-04-12 23:08:30.689787+01
269,0335ac11-fde5-41a2-8d17-fa5d3df72b7f,bf100ed5-8cd4-481a-84c1-c05cbfb2a9df,de,Welche Art von Frühstück wird in der Unterkunft A-ROSA Ifen Hotel Kleinwalsertal serviert?,"Gäste, die in der Unterkunft A-ROSA Ifen Hotel Kleinwalsertal übernachten, können während ihres Aufenthaltes ein gut bewertetes Frühstück genießen (Gästebewertungsergebnis: 9,4). Verfügbare Frühstücksoption(en): Buffet",2026-04-12 23:08:48.165168+01
270,0335ac11-fde5-41a2-8d17-fa5d3df72b7f,bf100ed5-8cd4-481a-84c1-c05cbfb2a9df,de,Hat die Unterkunft A-ROSA Ifen Hotel Kleinwalsertal einen Pool?,"Ja, dieses Hotel hat einen Pool. Erfahren Sie Einzelheiten zum Pool und anderen Ausstattungen auf dieser Seite.",2026-04-12 23:08:48.165168+01
271,0335ac11-fde5-41a2-8d17-fa5d3df72b7f,bf100ed5-8cd4-481a-84c1-c05cbfb2a9df,de,Welche Art von Zimmer kann ich in der Unterkunft A-ROSA Ifen Hotel Kleinwalsertal buchen?,Zimmeroptionen der Unterkunft A-ROSA Ifen Hotel Kleinwalsertal zählen: Doppelzimmer Suite,2026-04-12 23:08:48.165168+01
272,0335ac11-fde5-41a2-8d17-fa5d3df72b7f,bf100ed5-8cd4-481a-84c1-c05cbfb2a9df,de,Wie lauten die Check-in- und Check-out-Zeiten in der Unterkunft A-ROSA Ifen Hotel Kleinwalsertal?,"Der Check-in in der Unterkunft A-ROSA Ifen Hotel Kleinwalsertal ist ab 15:00, und der Check-out ist bis 11:00.",2026-04-12 23:08:48.165168+01
273,0335ac11-fde5-41a2-8d17-fa5d3df72b7f,bf100ed5-8cd4-481a-84c1-c05cbfb2a9df,de,Wieviel kostet der Aufenthalt in der Unterkunft A-ROSA Ifen Hotel Kleinwalsertal?,"Die Preise an der Unterkunft A-ROSA Ifen Hotel Kleinwalsertal könnten je nach Aufenthalt variieren (z.B. gewählter Zeitraum, Hotelrichtlinie usw.). Wenn Sie Ihre Daten eingeben, können Sie die Preise sehen.",2026-04-12 23:08:48.165168+01
274,0335ac11-fde5-41a2-8d17-fa5d3df72b7f,bf100ed5-8cd4-481a-84c1-c05cbfb2a9df,de,Hat die Unterkunft A-ROSA Ifen Hotel Kleinwalsertal ein Restaurant vor Ort?,Die Unterkunft A-ROSA Ifen Hotel Kleinwalsertal hat 3 Restaurants: Theo's Carnozet Kilian Stuba,2026-04-12 23:08:48.165168+01
275,0335ac11-fde5-41a2-8d17-fa5d3df72b7f,bf100ed5-8cd4-481a-84c1-c05cbfb2a9df,de,Welche Aktivitäten bietet die Unterkunft A-ROSA Ifen Hotel Kleinwalsertal?,Die Unterkunft A-ROSA Ifen Hotel Kleinwalsertal bietet folgende Aktivitäten/Services (es könnten Gebühren anfallen): Spa & Wellnesscenter Fitnesscenter Sauna Massage Radfahren Wandern Spielzimmer Tischtennis Abendunterhaltung Touren zu Fuß Pool Umkleideraum für Fitness/Wellness Schönheitsangebote Kochkurs Gesichtsbehandlungen Fahrradtouren Haarentfernung mit Wachs Live-Musik/Performance Make-up-Service Maniküre Pediküre Körperanwendungen Körperpeeling Ganzkörperpackung Wellness Dampfbad Wellnesslounge/Ruhebereich Fußbad Wellnessangebote Rückenmassage Nackenmassage Fußmassage Paarmassage Kopfmassage Handmassage Ganzkörpermassage Fitness Yogaunterricht,2026-04-12 23:08:48.165168+01
276,0335ac11-fde5-41a2-8d17-fa5d3df72b7f,bf100ed5-8cd4-481a-84c1-c05cbfb2a9df,de,Wie weit ist die Unterkunft A-ROSA Ifen Hotel Kleinwalsertal vom Zentrum von Hirschegg entfernt?,Die Unterkunft A-ROSA Ifen Hotel Kleinwalsertal ist 800 m vom Zentrum von Hirschegg entfernt.,2026-04-12 23:08:48.165168+01
277,13652341-4bd9-432b-bce7-885a093ad0a3,64d2123c-6aab-4349-b97b-5adfff4c178d,de,Welche Art von Frühstück wird in der Unterkunft Hotel Mercure Graz City serviert?,"Gäste, die in der Unterkunft Hotel Mercure Graz City übernachten, können während ihres Aufenthaltes ein gut bewertetes Frühstück genießen (Gästebewertungsergebnis: 8,5). Verfügbare Frühstücksoption(en): Kontinental Vegetarisch Glutenfrei Buffet",2026-04-12 23:09:39.60992+01
278,13652341-4bd9-432b-bce7-885a093ad0a3,64d2123c-6aab-4349-b97b-5adfff4c178d,de,Welche Art von Zimmer kann ich in der Unterkunft Hotel Mercure Graz City buchen?,Zimmeroptionen der Unterkunft Hotel Mercure Graz City zählen: Doppelzimmer Dreibettzimmer Suite,2026-04-12 23:09:39.60992+01
279,13652341-4bd9-432b-bce7-885a093ad0a3,64d2123c-6aab-4349-b97b-5adfff4c178d,de,Wie lauten die Check-in- und Check-out-Zeiten in der Unterkunft Hotel Mercure Graz City?,"Der Check-in in der Unterkunft Hotel Mercure Graz City ist ab 15:00, und der Check-out ist bis 12:00.",2026-04-12 23:09:39.60992+01
280,13652341-4bd9-432b-bce7-885a093ad0a3,64d2123c-6aab-4349-b97b-5adfff4c178d,de,Wieviel kostet der Aufenthalt in der Unterkunft Hotel Mercure Graz City?,"Die Preise an der Unterkunft Hotel Mercure Graz City könnten je nach Aufenthalt variieren (z.B. gewählter Zeitraum, Hotelrichtlinie usw.). Wenn Sie Ihre Daten eingeben, können Sie die Preise sehen.",2026-04-12 23:09:39.60992+01
281,13652341-4bd9-432b-bce7-885a093ad0a3,64d2123c-6aab-4349-b97b-5adfff4c178d,de,Welche Aktivitäten bietet die Unterkunft Hotel Mercure Graz City?,Die Unterkunft Hotel Mercure Graz City bietet folgende Aktivitäten/Services (es könnten Gebühren anfallen): Fitnesscenter Sauna Umkleideraum für Fitness/Wellness Fitness,2026-04-12 23:09:39.60992+01
282,13652341-4bd9-432b-bce7-885a093ad0a3,64d2123c-6aab-4349-b97b-5adfff4c178d,de,Wie weit ist die Unterkunft Hotel Mercure Graz City vom Zentrum von Graz entfernt?,Die Unterkunft Hotel Mercure Graz City ist 900 m vom Zentrum von Graz entfernt.,2026-04-12 23:09:39.60992+01
283,713f5eec-be13-409a-977a-0621b66474a3,bf100ed5-8cd4-481a-84c1-c05cbfb2a9df,it,Che tipo di colazione offre A-ROSA Ifen Hotel Kleinwalsertal?,"Durante il soggiorno, A-ROSA Ifen Hotel Kleinwalsertal propone una colazione molto apprezzata dagli ospiti (punteggio recensioni: 9,4). Colazione disponibile: a buffet",2026-04-12 23:10:14.828025+01
284,713f5eec-be13-409a-977a-0621b66474a3,bf100ed5-8cd4-481a-84c1-c05cbfb2a9df,it,A-ROSA Ifen Hotel Kleinwalsertal dispone di una piscina?,Sì. Trovi maggiori informazioni sulla piscina e sugli altri servizi in questa pagina.,2026-04-12 23:10:14.828025+01
285,713f5eec-be13-409a-977a-0621b66474a3,bf100ed5-8cd4-481a-84c1-c05cbfb2a9df,it,Che tipo di camere posso prenotare presso A-ROSA Ifen Hotel Kleinwalsertal?,A-ROSA Ifen Hotel Kleinwalsertal offre: Matrimoniale Suite,2026-04-12 23:10:14.828025+01
286,713f5eec-be13-409a-977a-0621b66474a3,bf100ed5-8cd4-481a-84c1-c05cbfb2a9df,it,Che orari di check-in e check-out sono previsti presso A-ROSA Ifen Hotel Kleinwalsertal?,"Presso A-ROSA Ifen Hotel Kleinwalsertal, il check-in può essere effettuato dalle 15:00, mentre il check-out è fino alle 11:00.",2026-04-12 23:10:14.828025+01
287,713f5eec-be13-409a-977a-0621b66474a3,bf100ed5-8cd4-481a-84c1-c05cbfb2a9df,it,Quanto costa soggiornare presso A-ROSA Ifen Hotel Kleinwalsertal?,"I prezzi di A-ROSA Ifen Hotel Kleinwalsertal possono variare in base a vari fattori (per es. date, condizioni dell'hotel, ecc). Per vedere i prezzi, inserisci le date del soggiorno.",2026-04-12 23:10:14.828025+01
288,713f5eec-be13-409a-977a-0621b66474a3,bf100ed5-8cd4-481a-84c1-c05cbfb2a9df,it,A-ROSA Ifen Hotel Kleinwalsertal dispone di un ristorante in loco?,A-ROSA Ifen Hotel Kleinwalsertal offre 3 ristoranti: Theo's Carnozet Kilian Stuba,2026-04-12 23:10:14.828025+01
289,713f5eec-be13-409a-977a-0621b66474a3,bf100ed5-8cd4-481a-84c1-c05cbfb2a9df,it,Quali servizi/attività sono disponibili presso A-ROSA Ifen Hotel Kleinwalsertal?,A-ROSA Ifen Hotel Kleinwalsertal offre i seguenti servizi/attività (alcuni a pagamento): Spa & centro benessere Palestra Sauna Massaggi Escursioni in bicicletta Escursionismo Sala giochi Ping-pong Intrattenimento serale Tour a piedi Piscina Armadietti per fitness/spa Servizi di bellezza Lezioni di cucina Trattamenti viso Tour in bicicletta Depilazione con ceretta Spettacolo/musica dal vivo Servizi di make up Manicure Pedicure Trattamenti corpo Scrub corpo Bendaggi corpo Servizi spa Bagno turco Sala spa/area relax Pediluvio Pacchetti spa/benessere Massaggi schiena Massaggi collo Massaggi piedi Massaggi di coppia Massaggi testa Massaggi mani Massaggi corpo Fitness Lezioni di yoga,2026-04-12 23:10:14.828025+01
290,713f5eec-be13-409a-977a-0621b66474a3,bf100ed5-8cd4-481a-84c1-c05cbfb2a9df,it,Quanto dista A-ROSA Ifen Hotel Kleinwalsertal dal centro di Hirschegg?,A-ROSA Ifen Hotel Kleinwalsertal si trova a 800 m dal centro di Hirschegg.,2026-04-12 23:10:14.828025+01
291,3e44f738-ae11-461a-87bc-fcf1b7a1d6ee,64d2123c-6aab-4349-b97b-5adfff4c178d,it,Che tipo di colazione offre Hotel Mercure Graz City?,"Durante il soggiorno, Hotel Mercure Graz City propone una colazione molto apprezzata dagli ospiti (punteggio recensioni: 8,5). Colazione disponibile: continentale vegetariana senza glutine a buffet",2026-04-12 23:10:59.447599+01
292,3e44f738-ae11-461a-87bc-fcf1b7a1d6ee,64d2123c-6aab-4349-b97b-5adfff4c178d,it,Che tipo di camere posso prenotare presso Hotel Mercure Graz City?,Hotel Mercure Graz City offre: Matrimoniale Tripla Suite,2026-04-12 23:10:59.447599+01
293,3e44f738-ae11-461a-87bc-fcf1b7a1d6ee,64d2123c-6aab-4349-b97b-5adfff4c178d,it,Che orari di check-in e check-out sono previsti presso Hotel Mercure Graz City?,"Presso Hotel Mercure Graz City, il check-in può essere effettuato dalle 15:00, mentre il check-out è fino alle 12:00.",2026-04-12 23:10:59.447599+01
294,3e44f738-ae11-461a-87bc-fcf1b7a1d6ee,64d2123c-6aab-4349-b97b-5adfff4c178d,it,Quanto costa soggiornare presso Hotel Mercure Graz City?,"I prezzi di Hotel Mercure Graz City possono variare in base a vari fattori (per es. date, condizioni dell'hotel, ecc). Per vedere i prezzi, inserisci le date del soggiorno.",2026-04-12 23:10:59.447599+01
295,3e44f738-ae11-461a-87bc-fcf1b7a1d6ee,64d2123c-6aab-4349-b97b-5adfff4c178d,it,Quali servizi/attività sono disponibili presso Hotel Mercure Graz City?,Hotel Mercure Graz City offre i seguenti servizi/attività (alcuni a pagamento): Palestra Sauna Armadietti per fitness/spa Fitness,2026-04-12 23:10:59.447599+01
296,3e44f738-ae11-461a-87bc-fcf1b7a1d6ee,64d2123c-6aab-4349-b97b-5adfff4c178d,it,Quanto dista Hotel Mercure Graz City dal centro di Graz?,Hotel Mercure Graz City si trova a 900 m dal centro di Graz.,2026-04-12 23:10:59.447599+01
297,043f5f34-c25b-455d-8b0a-05c5ddfc6e16,bf100ed5-8cd4-481a-84c1-c05cbfb2a9df,fr,Quel type de petit-déjeuner l'établissement A-ROSA Ifen Hotel Kleinwalsertal sert-il ?,"Les clients ayant déjà séjourné à l'établissement A-ROSA Ifen Hotel Kleinwalsertal ont attribué une très bonne note à son petit-déjeuner : 9,4. L'établissement sert les types de petit-déjeuner suivants : Buffet",2026-04-12 23:11:36.726003+01
298,043f5f34-c25b-455d-8b0a-05c5ddfc6e16,bf100ed5-8cd4-481a-84c1-c05cbfb2a9df,fr,L'établissement A-ROSA Ifen Hotel Kleinwalsertal dispose-t-il d'une piscine ?,"Oui, cet hôtel propose une piscine. Vous trouverez plus de détails sur la piscine et les autres équipements de l'établissement sur cette page.",2026-04-12 23:11:36.726003+01
299,043f5f34-c25b-455d-8b0a-05c5ddfc6e16,bf100ed5-8cd4-481a-84c1-c05cbfb2a9df,fr,Quel type d'hébergement puis-je réserver à l'établissement A-ROSA Ifen Hotel Kleinwalsertal ?,L'établissement A-ROSA Ifen Hotel Kleinwalsertal propose les options d'hébergement suivantes : Double Suite,2026-04-12 23:11:36.726003+01
300,043f5f34-c25b-455d-8b0a-05c5ddfc6e16,bf100ed5-8cd4-481a-84c1-c05cbfb2a9df,fr,Quels sont les horaires d'arrivée et de départ à l'établissement A-ROSA Ifen Hotel Kleinwalsertal ?,L'enregistrement à l'établissement A-ROSA Ifen Hotel Kleinwalsertal se fait à partir de 15:00 et le départ est possible jusqu'à 11:00.,2026-04-12 23:11:36.726003+01
301,043f5f34-c25b-455d-8b0a-05c5ddfc6e16,bf100ed5-8cd4-481a-84c1-c05cbfb2a9df,fr,Quel est le tarif d'un séjour à l'établissement A-ROSA Ifen Hotel Kleinwalsertal ?,"Les tarifs fixés par l'établissement A-ROSA Ifen Hotel Kleinwalsertal peuvent varier en fonction de votre séjour (par ex. les dates que vous avez sélectionnées, les conditions de l'hôtel, etc.). Indiquez vos dates pour voir les tarifs.",2026-04-12 23:11:36.726003+01
302,043f5f34-c25b-455d-8b0a-05c5ddfc6e16,bf100ed5-8cd4-481a-84c1-c05cbfb2a9df,fr,L'établissement A-ROSA Ifen Hotel Kleinwalsertal dispose-t-il un restaurant sur place ?,L'établissement A-ROSA Ifen Hotel Kleinwalsertal propose 3 restaurant : Theo's Carnozet Kilian Stuba,2026-04-12 23:11:36.726003+01
303,043f5f34-c25b-455d-8b0a-05c5ddfc6e16,bf100ed5-8cd4-481a-84c1-c05cbfb2a9df,fr,Quelles activités l'établissement A-ROSA Ifen Hotel Kleinwalsertal propose-t-il ?,L'établissement A-ROSA Ifen Hotel Kleinwalsertal propose les activités et les services suivants (des frais peuvent s'appliquer) : Spa et centre de bien-être Centre de remise en forme Sauna Massages Cyclisme Randonnée Salle de jeux Tennis de table Animations en soirée Balades à pied Piscine Vestiaires salle de sport/spa Services beauté Cours de cuisine Soins du visage Visites à vélo Épilation Concerts/Spectacles Maquillage Manucure Pédicure Soins corporels Gommage corporel Enveloppement corporel Spa Bain à vapeur Coin spa/relaxation Bain de pieds Forfaits spa/bien-être Massage du dos Massage du cou Massage des pieds Massage en couple Massage crânien Massage des mains Massage corporel Fitness Cours de yoga,2026-04-12 23:11:36.726003+01
304,043f5f34-c25b-455d-8b0a-05c5ddfc6e16,bf100ed5-8cd4-481a-84c1-c05cbfb2a9df,fr,L'établissement A-ROSA Ifen Hotel Kleinwalsertal est-il proche du centre (Hirschegg) ?,L'établissement A-ROSA Ifen Hotel Kleinwalsertal se trouve à 800 m du centre (Hirschegg).,2026-04-12 23:11:36.726003+01
305,d4ca60e8-57cd-4fa5-8600-4b2138805816,64d2123c-6aab-4349-b97b-5adfff4c178d,fr,Quel type de petit-déjeuner l'établissement Hotel Mercure Graz City sert-il ?,"Les clients ayant déjà séjourné à l'établissement Hotel Mercure Graz City ont attribué une très bonne note à son petit-déjeuner : 8,5. L'établissement sert les types de petit-déjeuner suivants : Continental Végétarien Sans gluten Buffet",2026-04-12 23:12:03.317958+01
