id,hotel_id,url_id,language,policy_name,policy_details,created_at
312,6e383021-bd01-41f9-8fcc-1864d5efec17,25ecc254-0198-4c8b-83b6-f853893ff89f,es,Cancelación /  prepago,Las condiciones de cancelación y de pago por adelantado pueden variar según el tipo de alojamiento. Introduce las fechas de tu estancia y consulta las condiciones de la opción que quieres reservar.,2026-04-08 07:43:54.767674+01
313,6e383021-bd01-41f9-8fcc-1864d5efec17,25ecc254-0198-4c8b-83b6-f853893ff89f,es,Depósito por daños reembolsable,Se pedirá un depósito por daños de US$100 a la llegada. Equivale a € 86 aprox. Se efectuará en efectivo. Se te devolverá al hacer el check-out. El depósito se devolverá por completo en efectivo una vez revisado el alojamiento.,2026-04-08 07:43:54.770196+01
314,6e383021-bd01-41f9-8fcc-1864d5efec17,25ecc254-0198-4c8b-83b6-f853893ff89f,es,Camas para niños,"Condiciones para estancias con niños Se pueden alojar niños de cualquier edad. Para ver la información correcta sobre precios y ocupación, añade a la búsqueda el número de niños con los que viajas y sus edades. Condiciones sobre cunas y camas supletorias En este alojamiento no hay cunas ni camas supletorias. Condiciones para estancias con niños Condiciones sobre cunas y camas supletorias Se pueden alojar niños de cualquier edad. Para ver la información correcta sobre precios y ocupación, añade a la búsqueda el número de niños con los que viajas y sus edades. En este alojamiento no hay cunas ni camas supletorias.",2026-04-08 07:43:54.772849+01
315,6e383021-bd01-41f9-8fcc-1864d5efec17,25ecc254-0198-4c8b-83b6-f853893ff89f,es,No hay restricción por edad,No hay edad mínima para el check-in,2026-04-08 07:43:54.776213+01
316,6e383021-bd01-41f9-8fcc-1864d5efec17,25ecc254-0198-4c8b-83b6-f853893ff89f,es,Mascotas,No se admiten.,2026-04-08 07:43:54.779158+01
317,6e383021-bd01-41f9-8fcc-1864d5efec17,25ecc254-0198-4c8b-83b6-f853893ff89f,es,Métodos de pago aceptados,Efectivo,2026-04-08 07:43:54.781681+01
318,6e383021-bd01-41f9-8fcc-1864d5efec17,25ecc254-0198-4c8b-83b6-f853893ff89f,es,Fiestas,No se pueden celebrar fiestas/eventos,2026-04-08 07:43:54.783657+01
337,39c464f7-c27d-4be7-92c9-79ce9296bf0b,25ecc254-0198-4c8b-83b6-f853893ff89f,it,Arrivo,Dalle 15:00 alle 18:00 Al check-in gli ospiti devono esibire un documento di riconoscimento con foto e una carta di credito.,2026-04-08 07:45:04.266362+01
338,39c464f7-c27d-4be7-92c9-79ce9296bf0b,25ecc254-0198-4c8b-83b6-f853893ff89f,it,Partenza,Dalle 08:00 alle 11:00,2026-04-08 07:45:04.268403+01
339,39c464f7-c27d-4be7-92c9-79ce9296bf0b,25ecc254-0198-4c8b-83b6-f853893ff89f,it,Cancellazione / Pagamento anticipato,Le condizioni relative alla cancellazione e al pagamento anticipato variano a seconda della tipologia di alloggio. Inserisci le date del soggiorno e verifica le condizioni dell'opzione scelta.,2026-04-08 07:45:04.270264+01
340,39c464f7-c27d-4be7-92c9-79ce9296bf0b,25ecc254-0198-4c8b-83b6-f853893ff89f,it,Deposito cauzionale rimborsabile,È richiesto un deposito cauzionale di US$100 all'arrivo. L'importo corrisponde a circa SEK 952. Dovrai pagarlo in contanti. Dovresti ricevere il rimborso al momento del check-out. Il deposito ti sarà rimborsato per intero in contanti dopo una verifica dello stato dell'alloggio.,2026-04-08 07:45:04.271691+01
341,39c464f7-c27d-4be7-92c9-79ce9296bf0b,25ecc254-0198-4c8b-83b6-f853893ff89f,it,Bambini e letti,"Condizioni per i bambini I bambini di tutte le età sono i benvenuti. Per vedere informazioni corrette relativamente a prezzi e occupazione, aggiungi alla ricerca il numero e l'età dei bambini che soggiorneranno. Condizioni per culle e letti aggiuntivi In questa struttura non c'è disponibilità di culle e letti supplementari. Condizioni per i bambini Condizioni per culle e letti aggiuntivi I bambini di tutte le età sono i benvenuti. Per vedere informazioni corrette relativamente a prezzi e occupazione, aggiungi alla ricerca il numero e l'età dei bambini che soggiorneranno. In questa struttura non c'è disponibilità di culle e letti supplementari.",2026-04-08 07:45:04.27281+01
342,39c464f7-c27d-4be7-92c9-79ce9296bf0b,25ecc254-0198-4c8b-83b6-f853893ff89f,it,Nessuna età minima,Non è richiesta un'età minima per fare il check-in.,2026-04-08 07:45:04.273852+01
343,39c464f7-c27d-4be7-92c9-79ce9296bf0b,25ecc254-0198-4c8b-83b6-f853893ff89f,it,Animali,Animali non ammessi.,2026-04-08 07:45:04.275395+01
344,39c464f7-c27d-4be7-92c9-79ce9296bf0b,25ecc254-0198-4c8b-83b6-f853893ff89f,it,Metodi di pagamento accettati,Contanti,2026-04-08 07:45:04.27666+01
345,39c464f7-c27d-4be7-92c9-79ce9296bf0b,25ecc254-0198-4c8b-83b6-f853893ff89f,it,Feste,Non è permesso organizzare feste/eventi.,2026-04-08 07:45:04.277896+01
346,be182e21-ef52-419f-87fb-cc1276496db9,764b06c7-c121-416b-af81-2571c51bce28,it,Arrivo,Dalle 16:00 alle 23:00,2026-04-08 07:45:22.285394+01
347,be182e21-ef52-419f-87fb-cc1276496db9,764b06c7-c121-416b-af81-2571c51bce28,it,Partenza,Dalle 07:00 alle 12:00,2026-04-08 07:45:22.287428+01
348,be182e21-ef52-419f-87fb-cc1276496db9,764b06c7-c121-416b-af81-2571c51bce28,it,Cancellazione / Pagamento anticipato,Le condizioni relative alla cancellazione e al pagamento anticipato variano a seconda della tipologia di alloggio. Inserisci le date del soggiorno e verifica le condizioni dell'opzione scelta.,2026-04-08 07:45:22.289338+01
374,4013741f-daa8-4f0f-829b-8c664daf12c7,25ecc254-0198-4c8b-83b6-f853893ff89f,pt,Check-out,Das 08:00 às 11:00,2026-04-08 07:46:27.166818+01
319,88366908-fe7f-4391-b673-9b33030f5b9a,764b06c7-c121-416b-af81-2571c51bce28,de,Anreise,Von 16:00 bis 23:00 Uhr,2026-04-08 07:44:08.874862+01
320,88366908-fe7f-4391-b673-9b33030f5b9a,764b06c7-c121-416b-af81-2571c51bce28,de,Abreise,Von 07:00 bis 12:00 Uhr,2026-04-08 07:44:08.876478+01
321,88366908-fe7f-4391-b673-9b33030f5b9a,764b06c7-c121-416b-af81-2571c51bce28,de,Stornierung/ Vorauszahlung,Die Stornierungs- und Vorauszahlungsrichtlinien ändern sich je nach Unterkunftskategorie. Bitte geben Sie Ihre Reisedaten ein und überprüfen Sie die Bedingungen Ihrer gewählten Option.,2026-04-08 07:44:08.878033+01
322,88366908-fe7f-4391-b673-9b33030f5b9a,764b06c7-c121-416b-af81-2571c51bce28,de,Erstattungsfähige Schadenskaution,"Bei der Ankunft ist eine Schadenskaution von US$200 erforderlich. Das sind ungefähr € 172. Diese wird in bar hinterlegt. Sie erhalten die Erstattung in der Regel bei Abreise. Die Schadenskaution wird Ihnen in voller Höhe in bar erstattet, nachdem die Unterkunft überprüft wurde und keine Schäden festgestellt wurden.",2026-04-08 07:44:08.879537+01
323,88366908-fe7f-4391-b673-9b33030f5b9a,764b06c7-c121-416b-af81-2571c51bce28,de,Kinder und Betten,"Richtlinien für Kinder Kinder jeden Alters sind willkommen. Kinder im Alter von 18 Jahren oder älter zahlen in dieser Unterkunft den Erwachsenenpreis. Fügen Sie Ihrer Suche bitte die Anzahl der Kinder in Ihrer Gruppe und deren Alter hinzu, um die korrekten Preise und Belegungsinformationen zu sehen. Richtlinien zu Baby- und Zustellbetten Die Anzahl an Zustellbetten ist von der von Ihnen gewählten Option abhängig. Bitte prüfen Sie Ihre ausgewählte Option für mehr Informationen. Babybetten sind in dieser Unterkunft nicht verfügbar. Alle Zustellbetten unterliegen der Verfügbarkeit. Richtlinien für Kinder Richtlinien zu Baby- und Zustellbetten Kinder jeden Alters sind willkommen. Kinder im Alter von 18 Jahren oder älter zahlen in dieser Unterkunft den Erwachsenenpreis. Fügen Sie Ihrer Suche bitte die Anzahl der Kinder in Ihrer Gruppe und deren Alter hinzu, um die korrekten Preise und Belegungsinformationen zu sehen. Die Anzahl an Zustellbetten ist von der von Ihnen gewählten Option abhängig. Bitte prüfen Sie Ihre ausgewählte Option für mehr Informationen. Babybetten sind in dieser Unterkunft nicht verfügbar. Alle Zustellbetten unterliegen der Verfügbarkeit.",2026-04-08 07:44:08.881103+01
324,88366908-fe7f-4391-b673-9b33030f5b9a,764b06c7-c121-416b-af81-2571c51bce28,de,Keine Altersbeschränkung,Es gibt keine Altersbeschränkung für den Check-in.,2026-04-08 07:44:08.882621+01
325,88366908-fe7f-4391-b673-9b33030f5b9a,764b06c7-c121-416b-af81-2571c51bce28,de,Haustiere,Haustiere sind nicht gestattet.,2026-04-08 07:44:08.884134+01
326,88366908-fe7f-4391-b673-9b33030f5b9a,764b06c7-c121-416b-af81-2571c51bce28,de,In diesem Hotel werden folgende Karten akzeptiert,Barzahlung nicht akzeptiert,2026-04-08 07:44:08.885647+01
327,88366908-fe7f-4391-b673-9b33030f5b9a,764b06c7-c121-416b-af81-2571c51bce28,de,Partys,Partys/Veranstaltungen sind nicht erlaubt.,2026-04-08 07:44:08.887163+01
328,65497cc6-233d-4be8-8e35-10d62a934ea8,25ecc254-0198-4c8b-83b6-f853893ff89f,de,Anreise,Von 15:00 bis 18:00 Uhr Gäste müssen einen Lichtbildausweis und eine Kreditkarte beim Check-in vorlegen,2026-04-08 07:44:20.815576+01
329,65497cc6-233d-4be8-8e35-10d62a934ea8,25ecc254-0198-4c8b-83b6-f853893ff89f,de,Abreise,Von 08:00 bis 11:00 Uhr,2026-04-08 07:44:20.81734+01
330,65497cc6-233d-4be8-8e35-10d62a934ea8,25ecc254-0198-4c8b-83b6-f853893ff89f,de,Stornierung/ Vorauszahlung,Die Stornierungs- und Vorauszahlungsrichtlinien ändern sich je nach Unterkunftskategorie. Bitte geben Sie Ihre Reisedaten ein und überprüfen Sie die Bedingungen Ihrer gewählten Option.,2026-04-08 07:44:20.818884+01
331,65497cc6-233d-4be8-8e35-10d62a934ea8,25ecc254-0198-4c8b-83b6-f853893ff89f,de,Erstattungsfähige Schadenskaution,"Bei der Ankunft ist eine Schadenskaution von US$100 erforderlich. Das sind ungefähr € 86. Diese wird in bar hinterlegt. Sie erhalten die Erstattung in der Regel bei Abreise. Die Schadenskaution wird Ihnen in voller Höhe in bar erstattet, nachdem die Unterkunft überprüft wurde und keine Schäden festgestellt wurden.",2026-04-08 07:44:20.820728+01
332,65497cc6-233d-4be8-8e35-10d62a934ea8,25ecc254-0198-4c8b-83b6-f853893ff89f,de,Kinder und Betten,"Richtlinien für Kinder Kinder jeden Alters sind willkommen. Fügen Sie Ihrer Suche bitte die Anzahl der Kinder in Ihrer Gruppe und deren Alter hinzu, um die korrekten Preise und Belegungsinformationen zu sehen. Richtlinien zu Baby- und Zustellbetten Baby- und Zustellbetten sind in dieser Unterkunft nicht verfügbar. Richtlinien für Kinder Richtlinien zu Baby- und Zustellbetten Kinder jeden Alters sind willkommen. Fügen Sie Ihrer Suche bitte die Anzahl der Kinder in Ihrer Gruppe und deren Alter hinzu, um die korrekten Preise und Belegungsinformationen zu sehen. Baby- und Zustellbetten sind in dieser Unterkunft nicht verfügbar.",2026-04-08 07:44:20.822403+01
333,65497cc6-233d-4be8-8e35-10d62a934ea8,25ecc254-0198-4c8b-83b6-f853893ff89f,de,Keine Altersbeschränkung,Es gibt keine Altersbeschränkung für den Check-in.,2026-04-08 07:44:20.823973+01
334,65497cc6-233d-4be8-8e35-10d62a934ea8,25ecc254-0198-4c8b-83b6-f853893ff89f,de,Haustiere,Haustiere sind nicht gestattet.,2026-04-08 07:44:20.825462+01
335,65497cc6-233d-4be8-8e35-10d62a934ea8,25ecc254-0198-4c8b-83b6-f853893ff89f,de,Akzeptierte Zahlungsmethoden,Barzahlung,2026-04-08 07:44:20.827014+01
336,65497cc6-233d-4be8-8e35-10d62a934ea8,25ecc254-0198-4c8b-83b6-f853893ff89f,de,Partys,Partys/Veranstaltungen sind nicht erlaubt.,2026-04-08 07:44:20.828521+01
349,be182e21-ef52-419f-87fb-cc1276496db9,764b06c7-c121-416b-af81-2571c51bce28,it,Deposito cauzionale rimborsabile,È richiesto un deposito cauzionale di US$200 all'arrivo. L'importo corrisponde a circa SEK 1.905. Dovrai pagarlo in contanti. Dovresti ricevere il rimborso al momento del check-out. Il deposito ti sarà rimborsato per intero in contanti dopo una verifica dello stato dell'alloggio.,2026-04-08 07:45:22.291086+01
350,be182e21-ef52-419f-87fb-cc1276496db9,764b06c7-c121-416b-af81-2571c51bce28,it,Bambini e letti,"Condizioni per i bambini I bambini di tutte le età sono i benvenuti. I bambini di 18 anni o più pagheranno quanto gli adulti presso questa struttura. Per vedere informazioni corrette relativamente a prezzi e occupazione, aggiungi alla ricerca il numero e l'età dei bambini che soggiorneranno. Condizioni per culle e letti aggiuntivi Il numero di letti supplementari ammessi dipende dall'opzione che scegli. Controlla quella che hai selezionato per maggiori informazioni. In questa struttura non c'è disponibilità di culle. I letti supplementari sono soggetti a disponibilità. Condizioni per i bambini Condizioni per culle e letti aggiuntivi I bambini di tutte le età sono i benvenuti. I bambini di 18 anni o più pagheranno quanto gli adulti presso questa struttura. Per vedere informazioni corrette relativamente a prezzi e occupazione, aggiungi alla ricerca il numero e l'età dei bambini che soggiorneranno. Il numero di letti supplementari ammessi dipende dall'opzione che scegli. Controlla quella che hai selezionato per maggiori informazioni. In questa struttura non c'è disponibilità di culle. I letti supplementari sono soggetti a disponibilità.",2026-04-08 07:45:22.293128+01
351,be182e21-ef52-419f-87fb-cc1276496db9,764b06c7-c121-416b-af81-2571c51bce28,it,Nessuna età minima,Non è richiesta un'età minima per fare il check-in.,2026-04-08 07:45:22.296324+01
352,be182e21-ef52-419f-87fb-cc1276496db9,764b06c7-c121-416b-af81-2571c51bce28,it,Animali,Animali non ammessi.,2026-04-08 07:45:22.298892+01
353,be182e21-ef52-419f-87fb-cc1276496db9,764b06c7-c121-416b-af81-2571c51bce28,it,Carte di credito accettate presso questo hotel,Non si accettano contanti,2026-04-08 07:45:22.300673+01
354,be182e21-ef52-419f-87fb-cc1276496db9,764b06c7-c121-416b-af81-2571c51bce28,it,Feste,Non è permesso organizzare feste/eventi.,2026-04-08 07:45:22.302368+01
355,918bd1ca-9bfb-4f1f-ae1e-a8effb84819f,25ecc254-0198-4c8b-83b6-f853893ff89f,fr,Arrivée,De 15:00 à 18:00 Vous devrez présenter une pièce d'identité avec photo et une carte de crédit lors de l'enregistrement.,2026-04-08 07:45:38.380971+01
356,918bd1ca-9bfb-4f1f-ae1e-a8effb84819f,25ecc254-0198-4c8b-83b6-f853893ff89f,fr,Départ,De 08:00 à 11:00,2026-04-08 07:45:38.382884+01
357,918bd1ca-9bfb-4f1f-ae1e-a8effb84819f,25ecc254-0198-4c8b-83b6-f853893ff89f,fr,Annulation / Prépaiement,Les conditions d'annulation et de prépaiement varient en fonction du type d'hébergement. Veuillez saisir les dates de votre séjour et consulter les conditions de l'option choisie.,2026-04-08 07:45:38.384173+01
358,918bd1ca-9bfb-4f1f-ae1e-a8effb84819f,25ecc254-0198-4c8b-83b6-f853893ff89f,fr,Dépôt de garantie remboursable,"Un dépôt de garantie d'un montant de US$100 est demandé à l'arrivée. Cette somme équivaut à SEK 952. Il devra être payé en espèces. Le remboursement devrait être effectué le jour de votre départ. Le dépôt de garantie vous sera entièrement remboursé en espèces, si aucun dommage n'a été constaté par l'établissement.",2026-04-08 07:45:38.385508+01
359,918bd1ca-9bfb-4f1f-ae1e-a8effb84819f,25ecc254-0198-4c8b-83b6-f853893ff89f,fr,Enfants et lits,"Conditions relatives aux enfants Tous les enfants sont les bienvenus. Pour voir les tarifs et les informations associés à la taille de votre groupe, veuillez ajouter à votre recherche le nombre d'enfants avec qui vous voyagez ainsi que leur âge. Conditions relatives aux lits bébé et aux lits d'appoint Aucun lit d'appoint/bébé n'est disponible dans cet établissement. Conditions relatives aux enfants Conditions relatives aux lits bébé et aux lits d'appoint Tous les enfants sont les bienvenus. Pour voir les tarifs et les informations associés à la taille de votre groupe, veuillez ajouter à votre recherche le nombre d'enfants avec qui vous voyagez ainsi que leur âge. Aucun lit d'appoint/bébé n'est disponible dans cet établissement.",2026-04-08 07:45:38.386627+01
360,918bd1ca-9bfb-4f1f-ae1e-a8effb84819f,25ecc254-0198-4c8b-83b6-f853893ff89f,fr,Aucune restriction d'âge,Aucune restriction relative à l'âge ne s'applique pour l'enregistrement.,2026-04-08 07:45:38.38779+01
361,918bd1ca-9bfb-4f1f-ae1e-a8effb84819f,25ecc254-0198-4c8b-83b6-f853893ff89f,fr,Animaux domestiques,Les animaux de compagnie ne sont pas admis au sein de l'établissement.,2026-04-08 07:45:38.3889+01
362,918bd1ca-9bfb-4f1f-ae1e-a8effb84819f,25ecc254-0198-4c8b-83b6-f853893ff89f,fr,Moyens de paiement acceptés,Espèces,2026-04-08 07:45:38.39031+01
363,918bd1ca-9bfb-4f1f-ae1e-a8effb84819f,25ecc254-0198-4c8b-83b6-f853893ff89f,fr,Fêtes,Les fêtes/événements ne sont pas autorisés.,2026-04-08 07:45:38.391573+01
364,144b6ef4-6f32-406f-a1e4-c6532ea77b58,764b06c7-c121-416b-af81-2571c51bce28,fr,Arrivée,De 16:00 à 23:00,2026-04-08 07:46:13.393461+01
365,144b6ef4-6f32-406f-a1e4-c6532ea77b58,764b06c7-c121-416b-af81-2571c51bce28,fr,Départ,De 07:00 à 12:00,2026-04-08 07:46:13.399182+01
366,144b6ef4-6f32-406f-a1e4-c6532ea77b58,764b06c7-c121-416b-af81-2571c51bce28,fr,Annulation / Prépaiement,Les conditions d'annulation et de prépaiement varient en fonction du type d'hébergement. Veuillez saisir les dates de votre séjour et consulter les conditions de l'option choisie.,2026-04-08 07:46:13.40229+01
367,144b6ef4-6f32-406f-a1e4-c6532ea77b58,764b06c7-c121-416b-af81-2571c51bce28,fr,Dépôt de garantie remboursable,"Un dépôt de garantie d'un montant de US$200 est demandé à l'arrivée. Cette somme équivaut à € 172. Il devra être payé en espèces. Le remboursement devrait être effectué le jour de votre départ. Le dépôt de garantie vous sera entièrement remboursé en espèces, si aucun dommage n'a été constaté par l'établissement.",2026-04-08 07:46:13.405593+01
368,144b6ef4-6f32-406f-a1e4-c6532ea77b58,764b06c7-c121-416b-af81-2571c51bce28,fr,Enfants et lits,"Conditions relatives aux enfants Tous les enfants sont les bienvenus. Les enfants âgés de plus de 18 ans seront facturés au tarif adulte dans cet établissement. Pour voir les tarifs et les informations associés à la taille de votre groupe, veuillez ajouter à votre recherche le nombre d'enfants avec qui vous voyagez ainsi que leur âge. Conditions relatives aux lits bébé et aux lits d'appoint Le nombre de lits d'appoint disponibles dépend de l'option que vous choisissez. Veuillez consulter l'option sélectionnée pour obtenir plus d'informations. Cet établissement ne propose pas de lits bébé. Tous les lits d'appoint sont soumis à disponibilité. Conditions relatives aux enfants Conditions relatives aux lits bébé et aux lits d'appoint Tous les enfants sont les bienvenus. Les enfants âgés de plus de 18 ans seront facturés au tarif adulte dans cet établissement. Pour voir les tarifs et les informations associés à la taille de votre groupe, veuillez ajouter à votre recherche le nombre d'enfants avec qui vous voyagez ainsi que leur âge. Le nombre de lits d'appoint disponibles dépend de l'option que vous choisissez. Veuillez consulter l'option sélectionnée pour obtenir plus d'informations. Cet établissement ne propose pas de lits bébé. Tous les lits d'appoint sont soumis à disponibilité.",2026-04-08 07:46:13.410494+01
369,144b6ef4-6f32-406f-a1e4-c6532ea77b58,764b06c7-c121-416b-af81-2571c51bce28,fr,Aucune restriction d'âge,Aucune restriction relative à l'âge ne s'applique pour l'enregistrement.,2026-04-08 07:46:13.413988+01
370,144b6ef4-6f32-406f-a1e4-c6532ea77b58,764b06c7-c121-416b-af81-2571c51bce28,fr,Animaux domestiques,Les animaux de compagnie ne sont pas admis au sein de l'établissement.,2026-04-08 07:46:13.417096+01
371,144b6ef4-6f32-406f-a1e4-c6532ea77b58,764b06c7-c121-416b-af81-2571c51bce28,fr,Cartes acceptées par cet hôtel,Les espèces ne sont pas acceptées,2026-04-08 07:46:13.420112+01
372,144b6ef4-6f32-406f-a1e4-c6532ea77b58,764b06c7-c121-416b-af81-2571c51bce28,fr,Fêtes,Les fêtes/événements ne sont pas autorisés.,2026-04-08 07:46:13.423266+01
373,4013741f-daa8-4f0f-829b-8c664daf12c7,25ecc254-0198-4c8b-83b6-f853893ff89f,pt,Check-in,"Das 15:00 às 18:00 No momento do check-in, os hóspedes têm de apresentar um documento de identificação com fotografia e um cartão de crédito",2026-04-08 07:46:27.153988+01
375,4013741f-daa8-4f0f-829b-8c664daf12c7,25ecc254-0198-4c8b-83b6-f853893ff89f,pt,Cancelamento/ pré-pagamento,"As condições de cancelamento e de pré-pagamento variam consoante o tipo de alojamento. Por favor, insira as datas da sua estadia e verifique as condições da opção que selecionou.",2026-04-08 07:46:27.16919+01
376,4013741f-daa8-4f0f-829b-8c664daf12c7,25ecc254-0198-4c8b-83b6-f853893ff89f,pt,Caução reembolsável,"É exigida uma caução de US$100 no momento da chegada. Cerca de € 86. A caução será cobrada como um pagamento em numerário. O reembolso deverá ser feito durante o check-out. A sua caução será reembolsada na totalidade em numerário, após uma inspeção ao alojamento.",2026-04-08 07:46:27.17164+01
377,4013741f-daa8-4f0f-829b-8c664daf12c7,25ecc254-0198-4c8b-83b6-f853893ff89f,pt,Crianças e camas,"Condições de crianças Todas as crianças são bem-vindas. Para ver os preços corretos e a informação sobre a ocupação, por favor, adicione à sua pesquisa o número de crianças no seu grupo e as respetivas idades. Condições de berços e camas extra Os berços e camas extra não estão disponíveis nesta propriedade. Condições de crianças Condições de berços e camas extra Todas as crianças são bem-vindas. Para ver os preços corretos e a informação sobre a ocupação, por favor, adicione à sua pesquisa o número de crianças no seu grupo e as respetivas idades. Os berços e camas extra não estão disponíveis nesta propriedade.",2026-04-08 07:46:27.173712+01
378,4013741f-daa8-4f0f-829b-8c664daf12c7,25ecc254-0198-4c8b-83b6-f853893ff89f,pt,Sem restrições de idade,Não há restrições de idade para fazer check-in,2026-04-08 07:46:27.176074+01
379,4013741f-daa8-4f0f-829b-8c664daf12c7,25ecc254-0198-4c8b-83b6-f853893ff89f,pt,Animais de estimação,Animais de estimação: não admitidos.,2026-04-08 07:46:27.178085+01
380,4013741f-daa8-4f0f-829b-8c664daf12c7,25ecc254-0198-4c8b-83b6-f853893ff89f,pt,Métodos de pagamento aceites,Dinheiro,2026-04-08 07:46:27.180161+01
381,4013741f-daa8-4f0f-829b-8c664daf12c7,25ecc254-0198-4c8b-83b6-f853893ff89f,pt,Festas,Não é permitido realizar festas/eventos,2026-04-08 07:46:27.183161+01
382,8e013b23-2b18-4983-af3c-44b28cf7aa07,764b06c7-c121-416b-af81-2571c51bce28,pt,Check-in,Das 16:00 às 23:00,2026-04-08 07:46:41.322786+01
383,8e013b23-2b18-4983-af3c-44b28cf7aa07,764b06c7-c121-416b-af81-2571c51bce28,pt,Check-out,Das 07:00 às 12:00,2026-04-08 07:46:41.324106+01
384,8e013b23-2b18-4983-af3c-44b28cf7aa07,764b06c7-c121-416b-af81-2571c51bce28,pt,Cancelamento/ pré-pagamento,"As condições de cancelamento e de pré-pagamento variam consoante o tipo de alojamento. Por favor, insira as datas da sua estadia e verifique as condições da opção que selecionou.",2026-04-08 07:46:41.325676+01
385,8e013b23-2b18-4983-af3c-44b28cf7aa07,764b06c7-c121-416b-af81-2571c51bce28,pt,Caução reembolsável,"É exigida uma caução de US$200 no momento da chegada. Cerca de € 172. A caução será cobrada como um pagamento em numerário. O reembolso deverá ser feito durante o check-out. A sua caução será reembolsada na totalidade em numerário, após uma inspeção ao alojamento.",2026-04-08 07:46:41.327245+01
386,8e013b23-2b18-4983-af3c-44b28cf7aa07,764b06c7-c121-416b-af81-2571c51bce28,pt,Crianças e camas,"Condições de crianças Todas as crianças são bem-vindas. As crianças com 18 ou mais anos terão de pagar as tarifas de adulto neste alojamento. Para ver os preços corretos e a informação sobre a ocupação, por favor, adicione à sua pesquisa o número de crianças no seu grupo e as respetivas idades. Condições de berços e camas extra O número permitido de camas extra está dependente da opção que escolher. Por favor, verifique a sua opção selecionada para mais informações. Não existem berços disponíveis nesta propriedade. Todas as camas extra estão sujeitas a disponibilidade. Condições de crianças Condições de berços e camas extra Todas as crianças são bem-vindas. As crianças com 18 ou mais anos terão de pagar as tarifas de adulto neste alojamento. Para ver os preços corretos e a informação sobre a ocupação, por favor, adicione à sua pesquisa o número de crianças no seu grupo e as respetivas idades. O número permitido de camas extra está dependente da opção que escolher. Por favor, verifique a sua opção selecionada para mais informações. Não existem berços disponíveis nesta propriedade. Todas as camas extra estão sujeitas a disponibilidade.",2026-04-08 07:46:41.32887+01
387,8e013b23-2b18-4983-af3c-44b28cf7aa07,764b06c7-c121-416b-af81-2571c51bce28,pt,Sem restrições de idade,Não há restrições de idade para fazer check-in,2026-04-08 07:46:41.330959+01
388,8e013b23-2b18-4983-af3c-44b28cf7aa07,764b06c7-c121-416b-af81-2571c51bce28,pt,Animais de estimação,Animais de estimação: não admitidos.,2026-04-08 07:46:41.333126+01
389,8e013b23-2b18-4983-af3c-44b28cf7aa07,764b06c7-c121-416b-af81-2571c51bce28,pt,Cartões aceites pelo hotel,Não aceita dinheiro,2026-04-08 07:46:41.335767+01
390,8e013b23-2b18-4983-af3c-44b28cf7aa07,764b06c7-c121-416b-af81-2571c51bce28,pt,Festas,Não é permitido realizar festas/eventos,2026-04-08 07:46:41.337666+01
391,1c1860de-597a-42d3-b154-0fd46735c19a,c1c45a0d-d962-4976-b2ca-8d22009dba1b,en,Check-in,From 15:00 to 00:00,2026-04-08 07:47:27.66949+01
392,1c1860de-597a-42d3-b154-0fd46735c19a,c1c45a0d-d962-4976-b2ca-8d22009dba1b,en,Check-out,From 04:00 to 11:00,2026-04-08 07:47:27.672826+01
393,1c1860de-597a-42d3-b154-0fd46735c19a,c1c45a0d-d962-4976-b2ca-8d22009dba1b,en,Cancellation/ prepayment,Cancellation and prepayment policies vary according to accommodation type. Please enter the dates of your stay and check the conditions of your required option.,2026-04-08 07:47:27.674762+01
