"id","hotel_id","url_id","language","policy_name","policy_details","created_at"
"33","fde270d6-c5fb-4bb0-b09b-35a7de7da301","b134f561-ad2c-40b6-b858-9b9ad18f13e2","it","Regole della struttura","Gardens Hill Resort & Spa accetta le richieste speciali. Aggiungile nel prossimo passaggio! Vedi disponibilità Arrivo Dalle 15:00 alle 00:00 Partenza Dalle 04:00 alle 11:00 Cancellazione / Pagamento anticipato Le condizioni relative alla cancellazione e al pagamento anticipato variano a seconda della tipologia di alloggio. Inserisci le date del soggiorno e verifica le condizioni dell'opzione scelta. Deposito cauzionale rimborsabile È richiesto un deposito cauzionale di € 100 all'arrivo. L'importo corrisponde a circa SEK 1.080. Dovrai pagarlo in contanti. Dovresti ricevere il rimborso al momento del check-out. Il deposito ti sarà rimborsato per intero in contanti dopo una verifica dello stato dell'alloggio. Bambini e letti Condizioni per i bambini I bambini di tutte le età sono i benvenuti. Per vedere informazioni corrette relativamente a prezzi e occupazione, aggiungi alla ricerca il numero e l'età dei bambini che soggiorneranno. Condizioni per culle e letti aggiuntivi 0 - 3 anni Culla su richiesta Gratis 4 - 11 anni Letto supplementare su richiesta € 38,65 per bambino, a notte 12 anni e oltre Letto supplementare su richiesta € 77,29 per persona, a notte Il prezzo delle culle e dei letti supplementari non è incluso nell'importo totale e dovrà essere pagato separatamente durante il soggiorno. Il numero di culle e letti supplementari ammessi dipende dall'opzione che scegli. Controlla quella che hai selezionato per maggiori informazioni. Le culle e i letti supplementari sono soggetti a disponibilità. Nessuna età minima Non è richiesta un'età minima per fare il check-in. Animali Animali non ammessi. Carte di credito accettate presso la struttura Non si accettano contanti Feste Non è permesso organizzare feste/eventi.","2026-03-23 03:37:42.568827+00"
"38","3a7300f3-c74e-4a9b-afeb-ff695b56c03b","78b1b319-2fbf-4d1e-a4b3-81aa324836d8","de","Hausregeln","Die Unterkunft Golden Beach Resort & Spa nimmt besondere Anfragen an – im nächsten Schritt hinzufügen! Verfügbarkeit anzeigen Anreise Ab 15:00 Abreise Bis 12:00 Stornierung/ Vorauszahlung Die Stornierungs- und Vorauszahlungsrichtlinien ändern sich je nach Unterkunftskategorie. Bitte geben Sie Ihre Reisedaten ein und überprüfen Sie die Bedingungen Ihrer gewählten Option. Kinder und Betten Richtlinien für Kinder Kinder jeden Alters sind willkommen. Kinder im Alter von 18 Jahren oder älter zahlen in dieser Unterkunft den Erwachsenenpreis. Fügen Sie Ihrer Suche bitte die Anzahl der Kinder in Ihrer Gruppe und deren Alter hinzu, um die korrekten Preise und Belegungsinformationen zu sehen. Richtlinien zu Baby- und Zustellbetten 0 - 3 Jahre Babybett auf Anfrage Kostenfrei Die Anzahl an Babybetten ist von der von Ihnen gewählten Option abhängig. Bitte prüfen Sie Ihre ausgewählte Option für mehr Informationen. Zustellbetten sind in dieser Unterkunft nicht verfügbar. Alle Babybetten unterliegen der Verfügbarkeit. Keine Altersbeschränkung Es gibt keine Altersbeschränkung für den Check-in. Haustiere Haustiere sind auf Anfrage gestattet. Möglicherweise fallen Gebühren an. Akzeptierte Zahlungsmethoden Barzahlung","2026-03-23 03:47:42.430828+00"
"39","60e3bde4-7d23-4842-a992-13cef7a790e4","3016cdeb-d26c-480f-8190-94db410648a6","de","Hausregeln","Die Unterkunft Hotel Atlântico Rio nimmt besondere Anfragen an – im nächsten Schritt hinzufügen! Verfügbarkeit anzeigen Anreise Ab 14:00 Gäste müssen einen Lichtbildausweis und eine Kreditkarte beim Check-in vorlegen Abreise Bis 12:00 Stornierung/ Vorauszahlung Die Stornierungs- und Vorauszahlungsrichtlinien ändern sich je nach Unterkunftskategorie. Bitte geben Sie Ihre Reisedaten ein und überprüfen Sie die Bedingungen Ihrer gewählten Option. Kinder und Betten Richtlinien für Kinder Kinder jeden Alters sind willkommen. Kinder im Alter von 9 Jahren oder älter zahlen in dieser Unterkunft den Erwachsenenpreis. Fügen Sie Ihrer Suche bitte die Anzahl der Kinder in Ihrer Gruppe und deren Alter hinzu, um die korrekten Preise und Belegungsinformationen zu sehen. Richtlinien zu Baby- und Zustellbetten Baby- und Zustellbetten sind in dieser Unterkunft nicht verfügbar. Altersbeschränkung Das Mindestalter für den Check-in beträgt 18 Jahre Haustiere Haustiere sind nicht gestattet. Gruppen Bei einer Buchung von mehr als 5 Zimmern können abweichende Richtlinien und zusätzliche Aufpreise gelten. Akzeptierte Zahlungsmethoden Barzahlung","2026-03-23 03:49:03.717209+00"
"40","80eb1a9d-d298-4c14-8513-5844fcbd1a5b","78b1b319-2fbf-4d1e-a4b3-81aa324836d8","it","Regole della struttura","Golden Beach Resort & Spa accetta le richieste speciali. Aggiungile nel prossimo passaggio! Vedi disponibilità Arrivo Dalle 15:00 Partenza Alle 12:00 Cancellazione / Pagamento anticipato Le condizioni relative alla cancellazione e al pagamento anticipato variano a seconda della tipologia di alloggio. Inserisci le date del soggiorno e verifica le condizioni dell'opzione scelta. Bambini e letti Condizioni per i bambini I bambini di tutte le età sono i benvenuti. I bambini di 18 anni o più pagheranno quanto gli adulti presso questa struttura. Per vedere informazioni corrette relativamente a prezzi e occupazione, aggiungi alla ricerca il numero e l'età dei bambini che soggiorneranno. Condizioni per culle e letti aggiuntivi 0 - 3 anni Culla su richiesta Gratis Il numero di culle ammesse dipende dall'opzione che scegli. Controlla quella che hai selezionato per maggiori informazioni. In questa struttura non c'è disponibilità di letti supplementari. Le culle sono soggette a disponibilità. Nessuna età minima Non è richiesta un'età minima per fare il check-in. Animali Animali ammessi su richiesta. Potrebbe essere richiesto un supplemento. Metodi di pagamento accettati Contanti","2026-03-23 03:50:32.661939+00"
"41","01da75d2-7278-43f0-b033-3d3b5a9a58fb","3016cdeb-d26c-480f-8190-94db410648a6","it","Regole della struttura","Hotel Atlântico Rio accetta le richieste speciali. Aggiungile nel prossimo passaggio! Vedi disponibilità Arrivo Dalle 14:00 Al check-in gli ospiti devono esibire un documento di riconoscimento con foto e una carta di credito. Partenza Alle 12:00 Cancellazione / Pagamento anticipato Le condizioni relative alla cancellazione e al pagamento anticipato variano a seconda della tipologia di alloggio. Inserisci le date del soggiorno e verifica le condizioni dell'opzione scelta. Bambini e letti Condizioni per i bambini I bambini di tutte le età sono i benvenuti. I bambini di 9 anni o più pagheranno quanto gli adulti presso questa struttura. Per vedere informazioni corrette relativamente a prezzi e occupazione, aggiungi alla ricerca il numero e l'età dei bambini che soggiorneranno. Condizioni per culle e letti aggiuntivi In questa struttura non c'è disponibilità di culle e letti supplementari. Età minima L'età minima per fare il check-in è 18 anni. Animali Animali non ammessi. Gruppi Alle prenotazioni di oltre 5 camere, la struttura potrebbe applicare differenti condizioni e supplementi. Metodi di pagamento accettati Contanti","2026-03-23 03:51:51.987279+00"
"45","3218c499-3bd2-4020-8b0b-13411739bb4f","23a78c52-eeb7-4cf9-9cea-1f0faa1fb4a9","en","House rules","Manaus Hotéis Millennium takes special requests - add in the next step! See availability Check-in From 15:00 You'll need to let the property know in advance what time you'll arrive. Check-out Until 12:00 Cancellation/ prepayment Cancellation and prepayment policies vary according to accommodation type. Please enter the dates of your stay and check the conditions of your required option. Children and beds Child policies Children of any age are welcome. Children 8 years and above will be charged as adults at this property. To see correct prices and occupancy information, please add the number of children in your group and their ages to your search. Cot and extra bed policies 0 - 2 years Cot upon request Free The number of cots allowed is dependent on the option you choose. Please check your selected option for more information. There are no extra beds available at this property. All cots are subject to availability. No age restriction There is no age requirement for check-in Pets Pets are not allowed. Groups When booking more than 4 rooms, different policies and additional supplements may apply. Accepted payment methods Cash","2026-03-23 04:00:26.333952+00"
"49","ab7f71c3-8597-4f3d-bb76-574050c67b6a","23a78c52-eeb7-4cf9-9cea-1f0faa1fb4a9","it","Regole della struttura","Manaus Hotéis Millennium accetta le richieste speciali. Aggiungile nel prossimo passaggio! Vedi disponibilità Arrivo Dalle 15:00 Dovrai comunicare in anticipo alla struttura il tuo orario di arrivo. Partenza Alle 12:00 Cancellazione / Pagamento anticipato Le condizioni relative alla cancellazione e al pagamento anticipato variano a seconda della tipologia di alloggio. Inserisci le date del soggiorno e verifica le condizioni dell'opzione scelta. Bambini e letti Condizioni per i bambini I bambini di tutte le età sono i benvenuti. I bambini di 8 anni o più pagheranno quanto gli adulti presso questa struttura. Per vedere informazioni corrette relativamente a prezzi e occupazione, aggiungi alla ricerca il numero e l'età dei bambini che soggiorneranno. Condizioni per culle e letti aggiuntivi 0 - 2 anni Culla su richiesta Gratis Il numero di culle ammesse dipende dall'opzione che scegli. Controlla quella che hai selezionato per maggiori informazioni. In questa struttura non c'è disponibilità di letti supplementari. Le culle sono soggette a disponibilità. Nessuna età minima Non è richiesta un'età minima per fare il check-in. Animali Animali non ammessi. Gruppi Alle prenotazioni di oltre 4 camere, la struttura potrebbe applicare differenti condizioni e supplementi. Metodi di pagamento accettati Contanti","2026-03-23 04:05:53.024595+00"
"42","d6c73a63-12a9-4eb0-85aa-60766bcce300","70306a8a-fa56-49d0-a20e-6e2b382707c3","es","Normas de la casa","Colonna Park Hotel acepta peticiones especiales. ¡Añádelas en el siguiente paso! Ver disponibilidad Entrada De las 14:00 a las 23:30 Salida De las 0:00 a las 12:00 Cancelación /  prepago Las condiciones de cancelación y de pago por adelantado pueden variar según el tipo de alojamiento. Introduce las fechas de tu estancia y consulta las condiciones de la opción que quieres reservar. Camas para niños Condiciones para estancias con niños Se pueden alojar niños de cualquier edad. Los niños a partir de 5 años pagan como adultos en este alojamiento. Para ver la información correcta sobre precios y ocupación, añade a la búsqueda el número de niños con los que viajas y sus edades. Condiciones sobre cunas y camas supletorias 0 - 3 años Cuna a petición Gratis El número de cunas permitido depende de la opción que escojas. Consulta la opción que has escogido para saber más. No hay camas supletorias disponibles en este alojamiento. Todas las cunas están sujetas a disponibilidad. No hay restricción por edad No hay edad mínima para el check-in Mascotas No se admiten. Grupos Al reservar más de 4 habitaciones, podrán aplicarse condiciones especiales y suplementos. Métodos de pago aceptados Efectivo","2026-03-23 03:53:10.782704+00"
"43","d1f47de4-3143-40a3-a774-8d082a664272","23a78c52-eeb7-4cf9-9cea-1f0faa1fb4a9","es","Normas de la casa","Manaus Hotéis Millennium acepta peticiones especiales. ¡Añádelas en el siguiente paso! Ver disponibilidad Entrada Desde las 15:00 Tienes que decirle al alojamiento con antelación a qué hora vas a llegar. Salida Hasta las 12:00 Cancelación /  prepago Las condiciones de cancelación y de pago por adelantado pueden variar según el tipo de alojamiento. Introduce las fechas de tu estancia y consulta las condiciones de la opción que quieres reservar. Camas para niños Condiciones para estancias con niños Se pueden alojar niños de cualquier edad. Los niños a partir de 8 años pagan como adultos en este alojamiento. Para ver la información correcta sobre precios y ocupación, añade a la búsqueda el número de niños con los que viajas y sus edades. Condiciones sobre cunas y camas supletorias 0 - 2 años Cuna a petición Gratis El número de cunas permitido depende de la opción que escojas. Consulta la opción que has escogido para saber más. No hay camas supletorias disponibles en este alojamiento. Todas las cunas están sujetas a disponibilidad. No hay restricción por edad No hay edad mínima para el check-in Mascotas No se admiten. Grupos Al reservar más de 4 habitaciones, podrán aplicarse condiciones especiales y suplementos. Métodos de pago aceptados Efectivo","2026-03-23 03:54:41.362993+00"
"44","cc1d44a7-35d8-491d-8c7f-c484fcd917c9","70306a8a-fa56-49d0-a20e-6e2b382707c3","en","House rules","Colonna Park Hotel takes special requests - add in the next step! See availability Check-in From 14:00 to 23:30 Check-out From 00:00 to 12:00 Cancellation/ prepayment Cancellation and prepayment policies vary according to accommodation type. Please enter the dates of your stay and check the conditions of your required option. Children and beds Child policies Children of any age are welcome. Children 5 years and above will be charged as adults at this property. To see correct prices and occupancy information, please add the number of children in your group and their ages to your search. Cot and extra bed policies 0 - 3 years Cot upon request Free The number of cots allowed is dependent on the option you choose. Please check your selected option for more information. There are no extra beds available at this property. All cots are subject to availability. No age restriction There is no age requirement for check-in Pets Pets are not allowed. Groups When booking more than 4 rooms, different policies and additional supplements may apply. Accepted payment methods Cash","2026-03-23 03:57:34.893273+00"
"46","ad09b0ba-f746-4bcc-b31f-d4edf0a3c63f","70306a8a-fa56-49d0-a20e-6e2b382707c3","de","Hausregeln","Die Unterkunft Colonna Park Hotel nimmt besondere Anfragen an – im nächsten Schritt hinzufügen! Verfügbarkeit anzeigen Anreise Von 14:00 bis 23:30 Uhr Abreise Von 00:00 bis 12:00 Uhr Stornierung/ Vorauszahlung Die Stornierungs- und Vorauszahlungsrichtlinien ändern sich je nach Unterkunftskategorie. Bitte geben Sie Ihre Reisedaten ein und überprüfen Sie die Bedingungen Ihrer gewählten Option. Kinder und Betten Richtlinien für Kinder Kinder jeden Alters sind willkommen. Kinder im Alter von 5 Jahren oder älter zahlen in dieser Unterkunft den Erwachsenenpreis. Fügen Sie Ihrer Suche bitte die Anzahl der Kinder in Ihrer Gruppe und deren Alter hinzu, um die korrekten Preise und Belegungsinformationen zu sehen. Richtlinien zu Baby- und Zustellbetten 0 - 3 Jahre Babybett auf Anfrage Kostenfrei Die Anzahl an Babybetten ist von der von Ihnen gewählten Option abhängig. Bitte prüfen Sie Ihre ausgewählte Option für mehr Informationen. Zustellbetten sind in dieser Unterkunft nicht verfügbar. Alle Babybetten unterliegen der Verfügbarkeit. Keine Altersbeschränkung Es gibt keine Altersbeschränkung für den Check-in. Haustiere Haustiere sind nicht gestattet. Gruppen Bei einer Buchung von mehr als 4 Zimmern können abweichende Richtlinien und zusätzliche Aufpreise gelten. Akzeptierte Zahlungsmethoden Barzahlung","2026-03-23 04:01:46.289087+00"
"47","8c8ccd37-eb79-4862-b801-7545c89caaed","23a78c52-eeb7-4cf9-9cea-1f0faa1fb4a9","de","Hausregeln","Die Unterkunft Manaus Hotéis Millennium nimmt besondere Anfragen an – im nächsten Schritt hinzufügen! Verfügbarkeit anzeigen Anreise Ab 15:00 Bitte informieren Sie die Unterkunft im Voraus über Ihre Ankunftszeit. Abreise Bis 12:00 Stornierung/ Vorauszahlung Die Stornierungs- und Vorauszahlungsrichtlinien ändern sich je nach Unterkunftskategorie. Bitte geben Sie Ihre Reisedaten ein und überprüfen Sie die Bedingungen Ihrer gewählten Option. Kinder und Betten Richtlinien für Kinder Kinder jeden Alters sind willkommen. Kinder im Alter von 8 Jahren oder älter zahlen in dieser Unterkunft den Erwachsenenpreis. Fügen Sie Ihrer Suche bitte die Anzahl der Kinder in Ihrer Gruppe und deren Alter hinzu, um die korrekten Preise und Belegungsinformationen zu sehen. Richtlinien zu Baby- und Zustellbetten 0 - 2 Jahre Babybett auf Anfrage Kostenfrei Die Anzahl an Babybetten ist von der von Ihnen gewählten Option abhängig. Bitte prüfen Sie Ihre ausgewählte Option für mehr Informationen. Zustellbetten sind in dieser Unterkunft nicht verfügbar. Alle Babybetten unterliegen der Verfügbarkeit. Keine Altersbeschränkung Es gibt keine Altersbeschränkung für den Check-in. Haustiere Haustiere sind nicht gestattet. Gruppen Bei einer Buchung von mehr als 4 Zimmern können abweichende Richtlinien und zusätzliche Aufpreise gelten. Akzeptierte Zahlungsmethoden Barzahlung","2026-03-23 04:03:05.274116+00"
"48","6af9cb0c-a788-4fe0-a597-202f5f3c1af8","70306a8a-fa56-49d0-a20e-6e2b382707c3","it","Regole della struttura","Colonna Park Hotel accetta le richieste speciali. Aggiungile nel prossimo passaggio! Vedi disponibilità Arrivo Dalle 14:00 alle 23:30 Partenza Dalle 00:00 alle 12:00 Cancellazione / Pagamento anticipato Le condizioni relative alla cancellazione e al pagamento anticipato variano a seconda della tipologia di alloggio. Inserisci le date del soggiorno e verifica le condizioni dell'opzione scelta. Bambini e letti Condizioni per i bambini I bambini di tutte le età sono i benvenuti. I bambini di 5 anni o più pagheranno quanto gli adulti presso questa struttura. Per vedere informazioni corrette relativamente a prezzi e occupazione, aggiungi alla ricerca il numero e l'età dei bambini che soggiorneranno. Condizioni per culle e letti aggiuntivi 0 - 3 anni Culla su richiesta Gratis Il numero di culle ammesse dipende dall'opzione che scegli. Controlla quella che hai selezionato per maggiori informazioni. In questa struttura non c'è disponibilità di letti supplementari. Le culle sono soggette a disponibilità. Nessuna età minima Non è richiesta un'età minima per fare il check-in. Animali Animali non ammessi. Gruppi Alle prenotazioni di oltre 4 camere, la struttura potrebbe applicare differenti condizioni e supplementi. Metodi di pagamento accettati Contanti","2026-03-23 04:04:22.535478+00"
