id,hotel_id,url_id,language,fp,created_at,updated_at
5993ccaa-ed8c-4625-9e54-a492d96c216f,6dfb4f67-e80b-48a9-8460-c3fc2a37608e,a841a127-1fe5-4099-8035-72732a5272e1,en,"<p>Please note that private parking is only available for cars, not buses.</p><p>Please note that the property only offers smoking rooms.</p><p>An extra Sofa bed for the Double or Twin Room are available upon request [for an additional charge of EUR 20 per sofa bed, per stay.]</p><p>Guests are required to show a photo identification and credit card upon check-in. Please note that all Special Requests are subject to availability and additional charges may apply.</p><p>Please inform Hotel Wasserpalast - breakfast for free!!! in advance of your expected arrival time. You can use the Special Requests box when booking, or contact the property directly with the contact details provided in your confirmation.</p><p>In response to Coronavirus (COVID-19), additional safety and sanitation measures are in effect at this property.</p><p>Food &amp; beverage services at this property may be limited or unavailable due to Coronavirus (COVID-19).</p><p>Due to Coronavirus (COVID-19), this property has reduced reception and service operating hours.</p>",2026-05-03 01:24:30.512787+01,2026-05-03 01:24:30.512787+01
b9463fc7-3d5c-41db-9f7e-6aff9d6fe2e8,47ea0092-f317-4acb-ae95-e3590f43711f,a841a127-1fe5-4099-8035-72732a5272e1,es,"<p>Please note that private parking is only available for cars, not buses.</p><p>Please note that the property only offers smoking rooms.</p><p>An extra Sofa bed for the Double or Twin Room are available upon request [for an additional charge of EUR 20 per sofa bed, per stay.]</p><p>Los huéspedes deberán mostrar un documento de identidad válido y una tarjeta de crédito al realizar el registro de entrada. Ten en cuenta que todas las peticiones especiales están sujetas a disponibilidad y pueden comportar suplementos.</p><p>Informa a Hotel Wasserpalast - breakfast for free!!! con antelación de tu hora prevista de llegada. Para ello, puedes utilizar el apartado de peticiones especiales al hacer la reserva o ponerte en contacto directamente con el alojamiento. Los datos de contacto aparecen en la confirmación de la reserva.</p><p>En respuesta al coronavirus (COVID-19), el alojamiento aplica medidas sanitarias y de seguridad adicionales en estos momentos.</p><p>Los servicios de comida y bebida de este alojamiento pueden verse limitados o no estar disponibles a causa del coronavirus (COVID-19).</p><p>A causa del coronavirus (COVID-19), este alojamiento ha reducido el horario de recepción y otros servicios.</p>",2026-05-03 01:25:50.357685+01,2026-05-03 01:25:50.357685+01
f2b22364-1d17-4673-af30-73fd9cf94138,12fe0385-b770-438b-915f-beab2b604b0b,a841a127-1fe5-4099-8035-72732a5272e1,de,"<p>Please note that private parking is only available for cars, not buses.</p><p>Please note that the property only offers smoking rooms.</p><p>An extra Sofa bed for the Double or Twin Room are available upon request [for an additional charge of EUR 20 per sofa bed, per stay.]</p><p>Beim Check-in müssen Sie einen Lichtbildausweis sowie eine Kreditkarte vorlegen. Sonderwünsche unterliegen der Verfügbarkeit und sind gegebenenfalls mit einem Aufpreis verbunden.</p><p>Bitte teilen Sie der Unterkunft Hotel Wasserpalast - breakfast for free!!! Ihre voraussichtliche Ankunftszeit im Voraus mit. Nutzen Sie hierfür bei der Buchung das Feld für besondere Anfragen oder kontaktieren Sie die Unterkunft direkt.</p><p>Wegen des Coronavirus (COVID-19) wurden in dieser Unterkunft zusätzliche Sicherheits- und Hygienemaßnahmen unternommen.</p><p>Wegen des Coronavirus (COVID-19) könnten Essens- und Getränkeangebote in dieser Unterkunft begrenzt oder überhaupt nicht verfügbar sein. </p><p>Wegen des Coronavirus (COVID-19) hat diese Unterkunft seine Service- und Rezeptionszeiten verringert.</p>",2026-05-03 01:27:10.538413+01,2026-05-03 01:27:10.538413+01
c764bb0f-907d-4b7b-ad00-802e04804eb0,17e82973-ccf9-4a12-8b93-f37de5751665,a841a127-1fe5-4099-8035-72732a5272e1,it,"<p>Please note that private parking is only available for cars, not buses.</p><p>Please note that the property only offers smoking rooms.</p><p>An extra Sofa bed for the Double or Twin Room are available upon request [for an additional charge of EUR 20 per sofa bed, per stay.]</p><p>Al check-in gli ospiti devono esibire un documento d'identità con foto e una carta di credito. Siete pregati di notare che le Richieste Speciali sono soggette a disponibilità, e potrebbero comportare l'addebito di un supplemento.</p><p>Siete pregati di comunicare in anticipo a Hotel Wasserpalast - breakfast for free!!! l'orario in cui prevedete di arrivare. Potrete inserire questa informazione nella sezione Richieste Speciali al momento della prenotazione, o contattare la struttura utilizzando i recapiti riportati nella conferma della prenotazione.</p><p>In risposta al Coronavirus (COVID-19) questa struttura ha adottato misure extra di sicurezza e igiene.</p><p>I servizi di ristorazione e somministrazione di bevande in questa struttura potrebbero essere limitati o sospesi a causa del Coronavirus (COVID-19).</p><p>A causa del Coronavirus (COVID-19) questa struttura ha ridotto gli orari di servizio e reception.</p>",2026-05-03 01:28:36.558134+01,2026-05-03 01:28:36.558134+01
74297eb5-207a-4780-a89d-7ff66314efd3,e1513593-f996-4620-8b0a-e5021d5a9b6d,a841a127-1fe5-4099-8035-72732a5272e1,fr,"<p>Please note that private parking is only available for cars, not buses.</p><p>Please note that the property only offers smoking rooms.</p><p>An extra Sofa bed for the Double or Twin Room are available upon request [for an additional charge of EUR 20 per sofa bed, per stay.]</p><p>Vous devrez présenter une pièce d'identité avec photo et une carte de crédit lors de l'enregistrement. Veuillez noter que toutes les demandes spéciales seront satisfaites sous réserve de disponibilité et pourront entraîner des frais supplémentaires.</p><p>Veuillez informer l'établissement Hotel Wasserpalast - breakfast for free!!! à l'avance de l'heure à laquelle vous prévoyez d'arriver. Vous pouvez indiquer cette information dans la rubrique « Demandes spéciales » lors de la réservation ou contacter directement l'établissement. Ses coordonnées figurent sur votre confirmation de réservation.</p><p>Dans le cadre de la pandémie de coronavirus (COVID-19), cet établissement applique actuellement des mesures sanitaires supplémentaires.</p><p>Il est possible que les services de restauration de cet établissement soient réduits ou indisponibles en raison de la pandémie de coronavirus (COVID-19).</p><p>En raison de la pandémie de coronavirus (COVID-19), cet établissement a réduit les horaires de sa réception et de ses services.</p>",2026-05-03 01:29:59.689579+01,2026-05-03 01:29:59.689579+01
d177057d-66c3-41a9-9add-78a7944baa46,16b7290e-93f2-4de0-9529-9bb566fe5587,a841a127-1fe5-4099-8035-72732a5272e1,pt,"<p>Please note that private parking is only available for cars, not buses.</p><p>Please note that the property only offers smoking rooms.</p><p>An extra Sofa bed for the Double or Twin Room are available upon request [for an additional charge of EUR 20 per sofa bed, per stay.]</p><p>No momento do check-in, os hóspedes deverão apresentar um documento de identificação com fotografia e um cartão de crédito.  Por favor, observe que todos os Pedidos Especiais estão sujeitos à disponibilidade e que poderão acarretar custos adicionais.</p><p>Por favor, informe Hotel Wasserpalast - breakfast for free!!! antecipadamente sobre o seu horário de chegada. Para isso poderá utilizar a caixa de Pedidos Especiais durante o processo da reserva ou contactar a propriedade diretamente através dos dados para contacto providenciados na sua confirmação.</p><p>Em resposta ao Coronavírus (COVID-19), este alojamento está a tomar medidas de segurança e higienização adicionais.</p><p>Os serviços de comida e bebidas deste alojamento poderão estar limitados ou indisponíveis devido ao Coronavírus (COVID-19).</p><p>Devido ao Coronavírus (COVID-19), este alojamento reduziu o horário de funcionamento da receção e dos serviços.</p>",2026-05-03 01:31:20.948873+01,2026-05-03 01:31:20.948873+01
13d511a0-a6b8-473f-a1cc-7893253d2f65,f04d93d6-9bdc-4233-99fb-efd79fe9ab81,6ef9193c-c9dd-47a1-b2c9-fdc42472976b,en,,2026-05-03 02:08:35.881304+01,2026-05-03 02:08:35.881304+01
b6891cb2-577f-46c1-b125-45789255d75e,f48fcff2-77da-4dcb-b8a3-b40736c837fd,6ef9193c-c9dd-47a1-b2c9-fdc42472976b,es,,2026-05-03 02:10:07.749801+01,2026-05-03 02:10:07.749801+01
1fd7f73d-e796-45b9-9e18-8a799c15adf6,ceff39fa-7ab7-4101-acb2-f455926e496d,eb036672-1991-4e3c-9362-a6df00481418,es,,2026-05-03 02:10:32.147903+01,2026-05-03 02:10:32.147903+01
64509139-1fe3-4a96-9842-e6a797ca721a,a06885d9-cb1a-4c93-afe4-b3a333794e2a,a3b98323-17a9-47bf-90b3-8665920f095b,en,"<p>Please inform Art Hotel Spielberg in advance of your expected arrival time. You can use the Special Requests box when booking, or contact the property directly with the contact details provided in your confirmation.</p><p>In response to Coronavirus (COVID-19), additional safety and sanitation measures are in effect at this property.</p><p>Food &amp; beverage services at this property may be limited or unavailable due to Coronavirus (COVID-19).</p><p>In accordance with government guidelines to minimise transmission of the Coronavirus (COVID-19), this property can only accept bookings from essential workers/permitted travellers, during dates where such guidelines exist. Reasonable evidence must be provided on arrival. If it isn't provided, your booking will be cancelled on arrival.</p><p>Due to Coronavirus (COVID-19), this property is taking steps to help protect the safety of guests and staff. Certain services and amenities may be reduced or unavailable as a result.</p><p>Due to Coronavirus (COVID-19), this property has reduced reception and service operating hours.</p><p>In accordance with government guidelines to minimise transmission of the Coronavirus (COVID-19), this property may request additional documentation from guests to validate identity, travel itinerary and other relevant information, during dates where such guidelines exist.</p><p>Due to Coronavirus (COVID-19), this property adheres to strict physical distancing measures.</p><p>Due to Coronavirus (COVID-19), wearing a face mask is mandatory in all indoor common areas.</p>",2026-05-03 02:01:34.520386+01,2026-05-03 02:01:34.520386+01
cda633a5-67d1-4b72-89da-13d04cd5c3e0,7be1ef91-3475-405f-9a32-550be1ea9ec1,146d48b0-6a47-4ee0-85fc-5635c5c1f7a0,en,"<p>Guests are required to show a photo identification and credit card upon check-in. Please note that all Special Requests are subject to availability and additional charges may apply.</p><p>Please inform Villa Dvor in advance of your expected arrival time. You can use the Special Requests box when booking, or contact the property directly with the contact details provided in your confirmation.</p><p>This property will not accommodate hen, stag or similar parties.</p><p>Quiet hours are between 22:00:00 and 08:00:00.</p><p>In response to Coronavirus (COVID-19), additional safety and sanitation measures are in effect at this property.</p><p>Food &amp; beverage services at this property may be limited or unavailable due to Coronavirus (COVID-19).</p><p>Due to Coronavirus (COVID-19), this property is taking steps to help protect the safety of guests and staff. Certain services and amenities may be reduced or unavailable as a result.</p><p>Due to Coronavirus (COVID-19), this property has reduced reception and service operating hours.</p>",2026-05-03 02:01:50.616815+01,2026-05-03 02:01:50.616815+01
e3a5f1d2-01cc-4663-a0fb-181701772536,20ccb924-c8d3-4ec0-b573-eb390df59759,a3b98323-17a9-47bf-90b3-8665920f095b,pt,"<p>Por favor, informe Art Hotel Spielberg antecipadamente sobre o seu horário de chegada. Para isso poderá utilizar a caixa de Pedidos Especiais durante o processo da reserva ou contactar a propriedade diretamente através dos dados para contacto providenciados na sua confirmação.</p><p>Em resposta ao Coronavírus (COVID-19), este alojamento está a tomar medidas de segurança e higienização adicionais.</p><p>Os serviços de comida e bebidas deste alojamento poderão estar limitados ou indisponíveis devido ao Coronavírus (COVID-19).</p><p>De acordo com as diretrizes governamentais para minimizar a transmissão do Coronavírus (COVID-19), este alojamento só pode aceitar reservas de trabalhadores de atividades essenciais/viajantes autorizados, durante as datas em que tais diretrizes existam. Os viajantes terão de apresentar provas adequadas à chegada. Caso não sejam apresentadas, a reserva será cancelada à chegada.</p><p>Devido ao Coronavírus (COVID-19), este alojamento está a tomar precauções adicionais para proteger os seus hóspedes e funcionários. Consequentemente, alguns serviços e comodidades poderão estar reduzidos ou indisponíveis.</p><p>Devido ao Coronavírus (COVID-19), este alojamento reduziu o horário de funcionamento da receção e dos serviços.</p><p>De acordo com as diretrizes governamentais para minimizar a transmissão do Coronavírus (COVID-19), este alojamento poderá pedir documentação adicional aos seus hóspedes, para validar a identidade, o itinerário de viagem e outra informação relevante, durante as datas em que tais diretrizes existam. </p><p>Devido ao Coronavírus (COVID-19), este alojamento segue medidas rigorosas de distanciamento físico.</p><p>Devido ao Coronavírus (COVID-19), o uso de máscara é obrigatório em todas as áreas comuns interiores.</p>",2026-05-03 02:07:37.077855+01,2026-05-03 02:07:37.077855+01
768da690-8a0b-42d7-a0ff-a939e7018e50,3bc998fe-c38a-43ba-a2e6-fe04a23b1f55,4ada0ffb-2cbb-4c4d-b137-c843df35a2b3,en,"<p>Please inform Hotel Feichtinger Graz in advance of your expected arrival time. You can use the Special Requests box when booking, or contact the property directly with the contact details provided in your confirmation.</p><p>In response to Coronavirus (COVID-19), additional safety and sanitation measures are in effect at this property.</p><p>Due to Coronavirus (COVID-19), this property is taking steps to help protect the safety of guests and staff. Certain services and amenities may be reduced or unavailable as a result.</p><p>Due to Coronavirus (COVID-19), this property has reduced reception and service operating hours.</p>",2026-05-03 02:15:09.349566+01,2026-05-03 02:15:09.349566+01
8121bf49-d50d-4eca-b806-48a47e62c399,1f2a8584-f079-41ca-94d0-f9f6752cb780,92e66217-cdb4-4282-8907-32accc9b452f,en,"<p>When booking 10 rooms or more, different policies and additional supplements may apply.</p><p>Guests are required to show a photo identification and credit card upon check-in. Please note that all Special Requests are subject to availability and additional charges may apply.</p><p>In response to Coronavirus (COVID-19), additional safety and sanitation measures are in effect at this property.</p><p>Food &amp; beverage services at this property may be limited or unavailable due to Coronavirus (COVID-19).</p>",2026-05-03 02:15:41.386868+01,2026-05-03 02:15:41.386868+01
615e9959-1db5-48e5-be4c-038fb6ef8ccc,25057a68-9a4c-4b23-a0c7-e3cd7a8c4fb1,503e1eef-9200-4915-9006-3853073487a3,en,<p>Guests are required to show a photo identification and credit card upon check-in. Please note that all Special Requests are subject to availability and additional charges may apply.</p>,2026-05-03 02:21:54.792206+01,2026-05-03 02:21:54.792206+01
3ff9a634-00ad-4b7e-8795-c0f584ad4e24,2918cf3f-772d-4e47-8e4f-adc78a166e6d,8ded3c2e-db0b-49e0-a83e-8bd01f11d1eb,en,,2026-05-03 02:22:23.369591+01,2026-05-03 02:22:23.369591+01
34566bb9-66f8-4abd-91ed-346610485d09,30d478d4-ef7d-463b-9fa9-c568ea7a712f,a3b98323-17a9-47bf-90b3-8665920f095b,es,"<p>Informa a Art Hotel Spielberg con antelación de tu hora prevista de llegada. Para ello, puedes utilizar el apartado de peticiones especiales al hacer la reserva o ponerte en contacto directamente con el alojamiento. Los datos de contacto aparecen en la confirmación de la reserva.</p><p>En respuesta al coronavirus (COVID-19), el alojamiento aplica medidas sanitarias y de seguridad adicionales en estos momentos.</p><p>Los servicios de comida y bebida de este alojamiento pueden verse limitados o no estar disponibles a causa del coronavirus (COVID-19).</p><p>Según las indicaciones del Gobierno para minimizar el contagio del coronavirus (COVID-19) y mientras sigan vigentes dichas indicaciones, este alojamiento solo aceptará reservas de personas que tengan permiso para viajar o que trabajen en servicios esenciales. Se deben proporcionar pruebas que lo demuestren al llegar. En caso de no hacerlo, la reserva se cancelará al llegar al alojamiento.</p><p>A causa del coronavirus (COVID-19), este alojamiento está tomando medidas para garantizar la seguridad de los clientes y el personal. Por este motivo, algunos servicios e instalaciones pueden verse limitados o no estar disponibles.</p><p>A causa del coronavirus (COVID-19), este alojamiento ha reducido el horario de recepción y otros servicios.</p><p>Según las indicaciones del Gobierno para minimizar el contagio del coronavirus (COVID-19),  es posible que este alojamiento solicite documentación adicional a los clientes para comprobar su identidad, itinerario de viaje y otros datos relevantes mientras sigan vigentes dichas indicaciones.</p><p>Debido al coronavirus (COVID-19), este alojamiento ha adoptado medidas de distanciamiento físico estrictas.</p><p>Debido al coronavirus (COVID-19), es obligatorio llevar mascarilla en todas las zonas comunes interiores.</p>",2026-05-03 02:02:18.484954+01,2026-05-03 02:02:18.484954+01
810e610d-4ff6-48ee-8430-4abd3c996e59,4d361f69-5602-460a-8a10-2c9fd4558c87,a3b98323-17a9-47bf-90b3-8665920f095b,de,"<p>Bitte teilen Sie der Unterkunft Art Hotel Spielberg Ihre voraussichtliche Ankunftszeit im Voraus mit. Nutzen Sie hierfür bei der Buchung das Feld für besondere Anfragen oder kontaktieren Sie die Unterkunft direkt.</p><p>Wegen des Coronavirus (COVID-19) wurden in dieser Unterkunft zusätzliche Sicherheits- und Hygienemaßnahmen unternommen.</p><p>Wegen des Coronavirus (COVID-19) könnten Essens- und Getränkeangebote in dieser Unterkunft begrenzt oder überhaupt nicht verfügbar sein. </p><p>Gemäß den Richtlinien der Regierung zur Eindämmung des Coronavirus (COVID-19) kann diese Unterkunft während des Zeitraums, für den diese Richtlinien gelten, nur Buchungen von systemrelevanten Arbeitskräften/Reisenden mit Reiseerlaubnis annehmen. Bei Ankunft muss ein entsprechender Nachweis vorgelegt werden. Wenn kein entsprechender Nachweis erbracht wird, wird Ihre Buchung bei der Ankunft storniert.</p><p>Wegen des Coronavirus (COVID-19) hat diese Unterkunft Maßnahmen unternommen, um die Sicherheit der Gäste und des Personals zu gewährleisten. Bestimmte Services und Einrichtungen könnten daher nicht oder nur eingeschränkt zur Verfügung stehen. </p><p>Wegen des Coronavirus (COVID-19) hat diese Unterkunft seine Service- und Rezeptionszeiten verringert.</p><p>Gemäß den Richtlinien der Regierung zur Eindämmung des Coronavirus (COVID-19) könnte diese Unterkunft während des Zeitraums, für den diese Richtlinien gelten, zusätzliche Dokumente der Gäste verlangen, um deren Identität, Reiseroute und andere relevante Informationen zu prüfen. </p><p>Wegen des Coronavirus (COVID-19) schreibt diese Unterkunft strenge Abstandsregeln vor.</p><p>Aufgrund des Coronavirus (COVID-19) ist das Tragen einer Gesichtsmaske in allen Aufenthaltsbereichen in Innenräumen verpflichtend.</p>",2026-05-03 02:03:29.069691+01,2026-05-03 02:03:29.069691+01
9a0ddc93-bd10-413e-8657-be3ac11668ba,b3025b62-66b2-41be-a79b-4d854c77fa7d,146d48b0-6a47-4ee0-85fc-5635c5c1f7a0,es,"<p>Los huéspedes deberán mostrar un documento de identidad válido y una tarjeta de crédito al realizar el registro de entrada. Ten en cuenta que todas las peticiones especiales están sujetas a disponibilidad y pueden comportar suplementos.</p><p>Informa a Villa Dvor con antelación de tu hora prevista de llegada. Para ello, puedes utilizar el apartado de peticiones especiales al hacer la reserva o ponerte en contacto directamente con el alojamiento. Los datos de contacto aparecen en la confirmación de la reserva.</p><p>En este alojamiento no se pueden celebrar despedidas de soltero o soltera ni fiestas similares.</p><p>No se puede hacer ruido de 22:00:00 a 08:00:00.</p><p>En respuesta al coronavirus (COVID-19), el alojamiento aplica medidas sanitarias y de seguridad adicionales en estos momentos.</p><p>Los servicios de comida y bebida de este alojamiento pueden verse limitados o no estar disponibles a causa del coronavirus (COVID-19).</p><p>A causa del coronavirus (COVID-19), este alojamiento está tomando medidas para garantizar la seguridad de los clientes y el personal. Por este motivo, algunos servicios e instalaciones pueden verse limitados o no estar disponibles.</p><p>A causa del coronavirus (COVID-19), este alojamiento ha reducido el horario de recepción y otros servicios.</p>",2026-05-03 02:03:54.257791+01,2026-05-03 02:03:54.257791+01
8ec49539-2caa-479d-b2bd-8359520ac1df,81efe271-d20d-45f3-8f7f-4978cf46d537,146d48b0-6a47-4ee0-85fc-5635c5c1f7a0,de,"<p>Beim Check-in müssen Sie einen Lichtbildausweis sowie eine Kreditkarte vorlegen. Sonderwünsche unterliegen der Verfügbarkeit und sind gegebenenfalls mit einem Aufpreis verbunden.</p><p>Bitte teilen Sie der Unterkunft Villa Dvor Ihre voraussichtliche Ankunftszeit im Voraus mit. Nutzen Sie hierfür bei der Buchung das Feld für besondere Anfragen oder kontaktieren Sie die Unterkunft direkt.</p><p>In dieser Unterkunft sind weder Junggesellen-/Junggesellinnenabschiede noch ähnliche Feiern erlaubt. </p><p>Ruhezeit zwischen 22:00:00 Uhr und 08:00:00 Uhr.</p><p>Wegen des Coronavirus (COVID-19) wurden in dieser Unterkunft zusätzliche Sicherheits- und Hygienemaßnahmen unternommen.</p><p>Wegen des Coronavirus (COVID-19) könnten Essens- und Getränkeangebote in dieser Unterkunft begrenzt oder überhaupt nicht verfügbar sein. </p><p>Wegen des Coronavirus (COVID-19) hat diese Unterkunft Maßnahmen unternommen, um die Sicherheit der Gäste und des Personals zu gewährleisten. Bestimmte Services und Einrichtungen könnten daher nicht oder nur eingeschränkt zur Verfügung stehen. </p><p>Wegen des Coronavirus (COVID-19) hat diese Unterkunft seine Service- und Rezeptionszeiten verringert.</p>",2026-05-03 02:04:41.05392+01,2026-05-03 02:04:41.05392+01
cfc6d09f-0b20-4eda-82f4-5e97c7d90462,5580520b-9301-4e1f-8805-5256e567344a,6ef9193c-c9dd-47a1-b2c9-fdc42472976b,de,,2026-05-03 02:11:05.455262+01,2026-05-03 02:11:05.455262+01
b7c85e03-8b2b-44c1-8b94-55fa3a9be135,96b4783f-c380-4dee-a544-3faef033985f,eb036672-1991-4e3c-9362-a6df00481418,de,,2026-05-03 02:11:24.696528+01,2026-05-03 02:11:24.696528+01
c95d39b0-8dd6-49e7-971b-b96f200b41e7,cfb8ab17-ebf8-4923-a9de-9d858dd5a624,6ef9193c-c9dd-47a1-b2c9-fdc42472976b,it,,2026-05-03 02:11:47.670496+01,2026-05-03 02:11:47.670496+01
a1ac512e-d28f-47f1-b4a5-550d40aed468,b9644de6-05ca-498a-a007-67bda116b8c1,6ef9193c-c9dd-47a1-b2c9-fdc42472976b,fr,,2026-05-03 02:12:29.252213+01,2026-05-03 02:12:29.252213+01
916e1891-e7ae-4681-aa48-341abe616a36,44dba782-0f79-40ec-a9d0-98a6c5b8293f,eb036672-1991-4e3c-9362-a6df00481418,it,,2026-05-03 02:12:46.051618+01,2026-05-03 02:12:46.051618+01
6f257f66-3b3b-4bdb-9a4a-39ed3ccf45fb,e43ece70-4e7a-47d3-b569-18ed2d802e88,6ef9193c-c9dd-47a1-b2c9-fdc42472976b,pt,,2026-05-03 02:13:01.902277+01,2026-05-03 02:13:01.902277+01
512ef830-164d-4f5b-b52e-cc47daa22cf2,bba5bc9b-8aa4-4d7d-823b-30c73858fca0,4ada0ffb-2cbb-4c4d-b137-c843df35a2b3,es,"<p>Informa a Hotel Feichtinger Graz con antelación de tu hora prevista de llegada. Para ello, puedes utilizar el apartado de peticiones especiales al hacer la reserva o ponerte en contacto directamente con el alojamiento. Los datos de contacto aparecen en la confirmación de la reserva.</p><p>En respuesta al coronavirus (COVID-19), el alojamiento aplica medidas sanitarias y de seguridad adicionales en estos momentos.</p><p>A causa del coronavirus (COVID-19), este alojamiento está tomando medidas para garantizar la seguridad de los clientes y el personal. Por este motivo, algunos servicios e instalaciones pueden verse limitados o no estar disponibles.</p><p>A causa del coronavirus (COVID-19), este alojamiento ha reducido el horario de recepción y otros servicios.</p>",2026-05-03 02:15:58.762579+01,2026-05-03 02:15:58.762579+01
2f3607a8-43df-4f10-9847-b952c0b6bf7f,dc1f73b6-84b5-45f5-9ded-d5e3a8f9f46a,664a35b1-26a0-4fb0-8092-df587879d8f7,de,,2026-05-03 03:48:10.687452+01,2026-05-03 03:48:10.687452+01
