id,hotel_id,url_id,language,policy_name,policy_details,created_at
1705,683a0834-8d48-41fa-86d4-9d9261f5af3c,97f417be-163f-46db-96ce-bf48f19fecb1,pt,Check-in,Das 15:00,2026-06-02 01:31:46.5241+01
460,7a281208-fc67-4b8a-a5a6-e79f9e92c64a,8fd63294-00c7-4090-bc5c-17c9bf1a3b41,pt,Crianças e camas,"Condições de crianças Todas as crianças são bem-vindas. As crianças com 12 ou mais anos terão de pagar as tarifas de adulto neste alojamento. Para ver os preços corretos e a informação sobre a ocupação, por favor, adicione à sua pesquisa o número de crianças no seu grupo e as respetivas idades. Condições de berços e camas extra 0 - 2 anos Berço mediante pedido Gratuito Mais de 3 anos Cama extra mediante pedido Gratuito O número permitido de camas extra e de berços está dependente da opção que escolher. Por favor, verifique a sua opção selecionada para mais informações. Todos os berços e camas extra estão sujeitos a disponibilidade. Condições de crianças Condições de berços e camas extra Todas as crianças são bem-vindas. As crianças com 12 ou mais anos terão de pagar as tarifas de adulto neste alojamento. Para ver os preços corretos e a informação sobre a ocupação, por favor, adicione à sua pesquisa o número de crianças no seu grupo e as respetivas idades. O número permitido de camas extra e de berços está dependente da opção que escolher. Por favor, verifique a sua opção selecionada para mais informações. Todos os berços e camas extra estão sujeitos a disponibilidade.",2026-06-01 23:51:30.977097+01
461,7a281208-fc67-4b8a-a5a6-e79f9e92c64a,8fd63294-00c7-4090-bc5c-17c9bf1a3b41,pt,Restrição de idade,A idade mínima para fazer o check-in é de 18,2026-06-01 23:51:30.978622+01
462,7a281208-fc67-4b8a-a5a6-e79f9e92c64a,8fd63294-00c7-4090-bc5c-17c9bf1a3b41,pt,Animais de estimação,Animais de estimação: admitidos. Poderão aplicar-se custos adicionais.,2026-06-01 23:51:30.980252+01
463,7a281208-fc67-4b8a-a5a6-e79f9e92c64a,8fd63294-00c7-4090-bc5c-17c9bf1a3b41,pt,Grupos,"Ao reservar mais de 9 quartos, poderão aplicar-se condições diferentes e custos adicionais.",2026-06-01 23:51:30.981772+01
464,7a281208-fc67-4b8a-a5a6-e79f9e92c64a,8fd63294-00c7-4090-bc5c-17c9bf1a3b41,pt,Métodos de pagamento aceites,Dinheiro,2026-06-01 23:51:30.983119+01
473,e01bffa1-289b-473e-916d-33c3778bd754,1cfaca69-2d64-413a-8140-35766bf7ef67,pt,Check-in,"Das 15:00 No momento do check-in, os hóspedes têm de apresentar um documento de identificação com fotografia e um cartão de crédito Terá de informar a sua hora de chegada com antecedência ao alojamento.",2026-06-01 23:52:31.954881+01
474,e01bffa1-289b-473e-916d-33c3778bd754,1cfaca69-2d64-413a-8140-35766bf7ef67,pt,Check-out,Às 11:00,2026-06-01 23:52:31.956543+01
475,e01bffa1-289b-473e-916d-33c3778bd754,1cfaca69-2d64-413a-8140-35766bf7ef67,pt,Cancelamento/ pré-pagamento,"As condições de cancelamento e de pré-pagamento variam consoante o tipo de alojamento. Por favor, insira as datas da sua estadia e verifique as condições da opção que selecionou.",2026-06-01 23:52:31.958+01
476,e01bffa1-289b-473e-916d-33c3778bd754,1cfaca69-2d64-413a-8140-35766bf7ef67,pt,Crianças e camas,"Condições de crianças Todas as crianças são bem-vindas. As crianças com 17 ou mais anos terão de pagar as tarifas de adulto neste alojamento. Para ver os preços corretos e a informação sobre a ocupação, por favor, adicione à sua pesquisa o número de crianças no seu grupo e as respetivas idades. Condições de berços e camas extra 0 - 5 anos Berço mediante pedido Gratuito 6 anos Berço mediante pedido Gratuito Cama extra mediante pedido € 55 por criança, por noite 7 - 15 anos Cama extra mediante pedido € 55 por criança, por noite Mais de 16 anos Cama extra mediante pedido € 90 por pessoa, por noite Os preços para berços e camas extra não estão incluídos no preço total e têm se ser pagos separadamente durante a sua estadia. O número permitido de camas extra e de berços está dependente da opção que escolher. Por favor, verifique a sua opção selecionada para mais informações. Todos os berços e camas extra estão sujeitos a disponibilidade. Condições de crianças Condições de berços e camas extra Todas as crianças são bem-vindas. As crianças com 17 ou mais anos terão de pagar as tarifas de adulto neste alojamento. Para ver os preços corretos e a informação sobre a ocupação, por favor, adicione à sua pesquisa o número de crianças no seu grupo e as respetivas idades. Os preços para berços e camas extra não estão incluídos no preço total e têm se ser pagos separadamente durante a sua estadia. O número permitido de camas extra e de berços está dependente da opção que escolher. Por favor, verifique a sua opção selecionada para mais informações. Todos os berços e camas extra estão sujeitos a disponibilidade.",2026-06-01 23:52:31.959468+01
477,e01bffa1-289b-473e-916d-33c3778bd754,1cfaca69-2d64-413a-8140-35766bf7ef67,pt,Restrição de idade,A idade mínima para fazer o check-in é de 18,2026-06-01 23:52:31.961218+01
478,e01bffa1-289b-473e-916d-33c3778bd754,1cfaca69-2d64-413a-8140-35766bf7ef67,pt,Animais de estimação,Animais de estimação: admitidos. Poderão aplicar-se custos adicionais.,2026-06-01 23:52:31.964052+01
479,e01bffa1-289b-473e-916d-33c3778bd754,1cfaca69-2d64-413a-8140-35766bf7ef67,pt,Grupos,"Ao reservar mais de 3 quartos, poderão aplicar-se condições diferentes e custos adicionais.",2026-06-01 23:52:31.966368+01
480,e01bffa1-289b-473e-916d-33c3778bd754,1cfaca69-2d64-413a-8140-35766bf7ef67,pt,Métodos de pagamento aceites,Dinheiro,2026-06-01 23:52:31.968414+01
481,48319ab5-1183-4905-934c-2d0d299a63cf,60db4ac8-9647-4717-a3a7-fa0b0bf774d6,en,Check-in,From 15:00 You'll need to let the property know in advance what time you'll arrive.,2026-06-01 23:54:03.379923+01
482,48319ab5-1183-4905-934c-2d0d299a63cf,60db4ac8-9647-4717-a3a7-fa0b0bf774d6,en,Check-out,Until 12:00,2026-06-01 23:54:03.383389+01
483,48319ab5-1183-4905-934c-2d0d299a63cf,60db4ac8-9647-4717-a3a7-fa0b0bf774d6,en,Cancellation/ prepayment,Cancellation and prepayment policies vary according to accommodation type. Please enter the dates of your stay and check the conditions of your required option.,2026-06-01 23:54:03.387217+01
484,48319ab5-1183-4905-934c-2d0d299a63cf,60db4ac8-9647-4717-a3a7-fa0b0bf774d6,en,Children and beds,"Child policies Children of any age are welcome. Children 12 years and above will be charged as adults at this property. To see correct prices and occupancy information, please add the number of children in your group and their ages to your search. Cot and extra bed policies 0 - 2 years Cot upon request Free The number of cots allowed is dependent on the option you choose. Please check your selected option for more information. There are no extra beds available at this property. All cots are subject to availability. Child policies Cot and extra bed policies Children of any age are welcome. Children 12 years and above will be charged as adults at this property. To see correct prices and occupancy information, please add the number of children in your group and their ages to your search. The number of cots allowed is dependent on the option you choose. Please check your selected option for more information. There are no extra beds available at this property. All cots are subject to availability.",2026-06-01 23:54:03.390702+01
485,48319ab5-1183-4905-934c-2d0d299a63cf,60db4ac8-9647-4717-a3a7-fa0b0bf774d6,en,No age restriction,There is no age requirement for check-in,2026-06-01 23:54:03.392911+01
486,48319ab5-1183-4905-934c-2d0d299a63cf,60db4ac8-9647-4717-a3a7-fa0b0bf774d6,en,Pets,Pets are allowed on request. Charges may be applicable.,2026-06-01 23:54:03.395799+01
487,48319ab5-1183-4905-934c-2d0d299a63cf,60db4ac8-9647-4717-a3a7-fa0b0bf774d6,en,Groups,"When booking more than 4 rooms, different policies and additional supplements may apply.",2026-06-01 23:54:03.399396+01
488,48319ab5-1183-4905-934c-2d0d299a63cf,60db4ac8-9647-4717-a3a7-fa0b0bf774d6,en,Accepted payment methods,Cash,2026-06-01 23:54:03.403186+01
513,52d9a9a8-66b7-4d15-8f1a-4c1131389a5d,60db4ac8-9647-4717-a3a7-fa0b0bf774d6,de,Anreise,Ab 15:00 Bitte informieren Sie die Unterkunft im Voraus über Ihre Ankunftszeit.,2026-06-01 23:56:27.470602+01
514,52d9a9a8-66b7-4d15-8f1a-4c1131389a5d,60db4ac8-9647-4717-a3a7-fa0b0bf774d6,de,Abreise,Bis 12:00,2026-06-01 23:56:27.473552+01
515,52d9a9a8-66b7-4d15-8f1a-4c1131389a5d,60db4ac8-9647-4717-a3a7-fa0b0bf774d6,de,Stornierung/ Vorauszahlung,Die Stornierungs- und Vorauszahlungsrichtlinien ändern sich je nach Unterkunftskategorie. Bitte geben Sie Ihre Reisedaten ein und überprüfen Sie die Bedingungen Ihrer gewählten Option.,2026-06-01 23:56:27.476037+01
863,1b9f2f55-fd06-451f-811c-b7c26f225fed,e6cc7ec2-7cd7-47b9-86fb-7f326b383a60,pt,Grupos,"Ao reservar mais de 9 quartos, poderão aplicar-se condições diferentes e custos adicionais.",2026-06-02 00:21:55.740767+01
468,c91024b0-e3c7-4194-b01a-b7d48965df12,1cfaca69-2d64-413a-8140-35766bf7ef67,fr,Enfants et lits,"Conditions relatives aux enfants Tous les enfants sont les bienvenus. Les enfants âgés de plus de 17 ans seront facturés au tarif adulte dans cet établissement. Pour voir les tarifs et les informations associés à la taille de votre groupe, veuillez ajouter à votre recherche le nombre d'enfants avec qui vous voyagez ainsi que leur âge. Conditions relatives aux lits bébé et aux lits d'appoint 0 - 5 ans Lit bébé sur demande Gratuit 6 ans Lit bébé sur demande Gratuit Lit d'appoint sur demande € 55 par enfant et par nuit 7 - 15 ans Lit d'appoint sur demande € 55 par enfant et par nuit Plus de 16 ans Lit d'appoint sur demande € 90 par personne et par nuit Les frais supplémentaires associés aux lits bébé et aux lits d'appoint ne sont pas inclus dans le montant total et devront être payés séparément pendant votre séjour. Le nombre de lits bébé et de lits d'appoint disponibles dépend de l'option que vous choisissez. Veuillez consulter l'option sélectionnée pour obtenir plus d'informations. Tous les lits bébé et les lits d'appoint sont soumis à disponibilité. Conditions relatives aux enfants Conditions relatives aux lits bébé et aux lits d'appoint Tous les enfants sont les bienvenus. Les enfants âgés de plus de 17 ans seront facturés au tarif adulte dans cet établissement. Pour voir les tarifs et les informations associés à la taille de votre groupe, veuillez ajouter à votre recherche le nombre d'enfants avec qui vous voyagez ainsi que leur âge. Les frais supplémentaires associés aux lits bébé et aux lits d'appoint ne sont pas inclus dans le montant total et devront être payés séparément pendant votre séjour. Le nombre de lits bébé et de lits d'appoint disponibles dépend de l'option que vous choisissez. Veuillez consulter l'option sélectionnée pour obtenir plus d'informations. Tous les lits bébé et les lits d'appoint sont soumis à disponibilité.",2026-06-01 23:52:01.000685+01
469,c91024b0-e3c7-4194-b01a-b7d48965df12,1cfaca69-2d64-413a-8140-35766bf7ef67,fr,Restriction relative à l'âge,Les clients doivent avoir au moins 18 ans pour pouvoir s'enregistrer.,2026-06-01 23:52:01.003909+01
470,c91024b0-e3c7-4194-b01a-b7d48965df12,1cfaca69-2d64-413a-8140-35766bf7ef67,fr,Animaux domestiques,Les animaux de compagnie sont admis (un supplément peut s'appliquer).,2026-06-01 23:52:01.00639+01
471,c91024b0-e3c7-4194-b01a-b7d48965df12,1cfaca69-2d64-413a-8140-35766bf7ef67,fr,Groupes,Toute réservation de plus de 3 chambres peut entraîner des conditions particulières et des frais supplémentaires.,2026-06-01 23:52:01.009394+01
472,c91024b0-e3c7-4194-b01a-b7d48965df12,1cfaca69-2d64-413a-8140-35766bf7ef67,fr,Moyens de paiement acceptés,Espèces,2026-06-01 23:52:01.012241+01
505,02ef321f-edad-40d0-beaa-6ce9bc678b58,10ceacdd-830a-4534-b4cc-a2e8e1742da5,es,Entrada,Desde las 15:00,2026-06-01 23:56:14.821762+01
506,02ef321f-edad-40d0-beaa-6ce9bc678b58,10ceacdd-830a-4534-b4cc-a2e8e1742da5,es,Salida,Hasta las 12:00,2026-06-01 23:56:14.8248+01
507,02ef321f-edad-40d0-beaa-6ce9bc678b58,10ceacdd-830a-4534-b4cc-a2e8e1742da5,es,Cancelación /  prepago,Las condiciones de cancelación y de pago por adelantado pueden variar según el tipo de alojamiento. Introduce las fechas de tu estancia y consulta las condiciones de la opción que quieres reservar.,2026-06-01 23:56:14.829481+01
508,02ef321f-edad-40d0-beaa-6ce9bc678b58,10ceacdd-830a-4534-b4cc-a2e8e1742da5,es,Camas para niños,"Condiciones para estancias con niños Se pueden alojar niños de cualquier edad. Los niños a partir de 18 años pagan como adultos en este alojamiento. Para ver la información correcta sobre precios y ocupación, añade a la búsqueda el número de niños con los que viajas y sus edades. Condiciones sobre cunas y camas supletorias 0 - 2 años Cuna a petición Gratis Más de 4 años Cama supletoria a petición € 100 por persona y noche El precio de las cunas y las camas supletorias no está incluido en el precio total y se tiene que pagar por separado durante la estancia. El número de camas supletorias y cunas permitido depende de la opción que escojas. Consulta la opción que has escogido para saber más. Todas las cunas y camas supletorias están sujetas a disponibilidad. Condiciones para estancias con niños Condiciones sobre cunas y camas supletorias Se pueden alojar niños de cualquier edad. Los niños a partir de 18 años pagan como adultos en este alojamiento. Para ver la información correcta sobre precios y ocupación, añade a la búsqueda el número de niños con los que viajas y sus edades. El precio de las cunas y las camas supletorias no está incluido en el precio total y se tiene que pagar por separado durante la estancia. El número de camas supletorias y cunas permitido depende de la opción que escojas. Consulta la opción que has escogido para saber más. Todas las cunas y camas supletorias están sujetas a disponibilidad.",2026-06-01 23:56:14.835392+01
509,02ef321f-edad-40d0-beaa-6ce9bc678b58,10ceacdd-830a-4534-b4cc-a2e8e1742da5,es,No hay restricción por edad,No hay edad mínima para el check-in,2026-06-01 23:56:14.841731+01
510,02ef321f-edad-40d0-beaa-6ce9bc678b58,10ceacdd-830a-4534-b4cc-a2e8e1742da5,es,Mascotas,Se admiten. Se pueden aplicar suplementos.,2026-06-01 23:56:14.847499+01
511,02ef321f-edad-40d0-beaa-6ce9bc678b58,10ceacdd-830a-4534-b4cc-a2e8e1742da5,es,Grupos,"Al reservar más de 9 habitaciones, podrán aplicarse condiciones especiales y suplementos.",2026-06-01 23:56:14.852612+01
512,02ef321f-edad-40d0-beaa-6ce9bc678b58,10ceacdd-830a-4534-b4cc-a2e8e1742da5,es,Tarjetas aceptadas en este hotel,No se acepta efectivo,2026-06-01 23:56:14.858335+01
529,0ad2a1ca-0cf9-439b-baf4-eeb026db14f5,60db4ac8-9647-4717-a3a7-fa0b0bf774d6,it,Arrivo,Dalle 15:00 Dovrai comunicare in anticipo alla struttura il tuo orario di arrivo.,2026-06-01 23:57:46.174507+01
530,0ad2a1ca-0cf9-439b-baf4-eeb026db14f5,60db4ac8-9647-4717-a3a7-fa0b0bf774d6,it,Partenza,Alle 12:00,2026-06-01 23:57:46.178833+01
531,0ad2a1ca-0cf9-439b-baf4-eeb026db14f5,60db4ac8-9647-4717-a3a7-fa0b0bf774d6,it,Cancellazione / Pagamento anticipato,Le condizioni relative alla cancellazione e al pagamento anticipato variano a seconda della tipologia di alloggio. Inserisci le date del soggiorno e verifica le condizioni dell'opzione scelta.,2026-06-01 23:57:46.182026+01
532,0ad2a1ca-0cf9-439b-baf4-eeb026db14f5,60db4ac8-9647-4717-a3a7-fa0b0bf774d6,it,Bambini e letti,"Condizioni per i bambini I bambini di tutte le età sono i benvenuti. I bambini di 12 anni o più pagheranno quanto gli adulti presso questa struttura. Per vedere informazioni corrette relativamente a prezzi e occupazione, aggiungi alla ricerca il numero e l'età dei bambini che soggiorneranno. Condizioni per culle e letti aggiuntivi 0 - 2 anni Culla su richiesta Gratis Il numero di culle ammesse dipende dall'opzione che scegli. Controlla quella che hai selezionato per maggiori informazioni. In questa struttura non c'è disponibilità di letti supplementari. Le culle sono soggette a disponibilità. Condizioni per i bambini Condizioni per culle e letti aggiuntivi I bambini di tutte le età sono i benvenuti. I bambini di 12 anni o più pagheranno quanto gli adulti presso questa struttura. Per vedere informazioni corrette relativamente a prezzi e occupazione, aggiungi alla ricerca il numero e l'età dei bambini che soggiorneranno. Il numero di culle ammesse dipende dall'opzione che scegli. Controlla quella che hai selezionato per maggiori informazioni. In questa struttura non c'è disponibilità di letti supplementari. Le culle sono soggette a disponibilità.",2026-06-01 23:57:46.184834+01
533,0ad2a1ca-0cf9-439b-baf4-eeb026db14f5,60db4ac8-9647-4717-a3a7-fa0b0bf774d6,it,Nessuna età minima,Non è richiesta un'età minima per fare il check-in.,2026-06-01 23:57:46.187198+01
534,0ad2a1ca-0cf9-439b-baf4-eeb026db14f5,60db4ac8-9647-4717-a3a7-fa0b0bf774d6,it,Animali,Animali ammessi su richiesta. Potrebbe essere richiesto un supplemento.,2026-06-01 23:57:46.189666+01
535,0ad2a1ca-0cf9-439b-baf4-eeb026db14f5,60db4ac8-9647-4717-a3a7-fa0b0bf774d6,it,Gruppi,"Alle prenotazioni di oltre 4 camere, la struttura potrebbe applicare differenti condizioni e supplementi.",2026-06-01 23:57:46.193013+01
536,0ad2a1ca-0cf9-439b-baf4-eeb026db14f5,60db4ac8-9647-4717-a3a7-fa0b0bf774d6,it,Metodi di pagamento accettati,Contanti,2026-06-01 23:57:46.195763+01
1342,8f51b140-4ec4-4e06-ab75-041f1f33efca,19c8a801-4054-4a9e-94b4-6c8c8ab82b17,en,Children and beds,"Child policies Children of any age are welcome. To see correct prices and occupancy information, please add the number of children in your group and their ages to your search. Cot and extra bed policies 5 - 11 years Extra bed upon request Free The number of extra beds allowed is dependent on the option you choose. Please check your selected option for more information. There are no cots available at this property. All extra beds are subject to availability. Child policies Cot and extra bed policies Children of any age are welcome. To see correct prices and occupancy information, please add the number of children in your group and their ages to your search. The number of extra beds allowed is dependent on the option you choose. Please check your selected option for more information. There are no cots available at this property. All extra beds are subject to availability.",2026-06-02 01:01:58.44632+01
1343,8f51b140-4ec4-4e06-ab75-041f1f33efca,19c8a801-4054-4a9e-94b4-6c8c8ab82b17,en,Age restriction,The minimum age for check-in is 18,2026-06-02 01:01:58.448914+01
1344,8f51b140-4ec4-4e06-ab75-041f1f33efca,19c8a801-4054-4a9e-94b4-6c8c8ab82b17,en,Pets,Pets are allowed on request. Charges may be applicable.,2026-06-02 01:01:58.451196+01
1345,8f51b140-4ec4-4e06-ab75-041f1f33efca,19c8a801-4054-4a9e-94b4-6c8c8ab82b17,en,Groups,"When booking more than 7 rooms, different policies and additional supplements may apply.",2026-06-02 01:01:58.453378+01
492,647eb2dc-90dd-4c51-b75f-e7184d385e76,10ceacdd-830a-4534-b4cc-a2e8e1742da5,en,Children and beds,"Child policies Children of any age are welcome. Children 18 years and above will be charged as adults at this property. To see correct prices and occupancy information, please add the number of children in your group and their ages to your search. Cot and extra bed policies 0 - 2 years Cot upon request Free 4+ years Extra bed upon request € 100 per person, per night Prices for cots and extra beds are not included in the total price, and will have to be paid for separately during your stay. The number of extra beds and cots allowed is dependent on the option you choose. Please check your selected option for more information. All cots and extra beds are subject to availability. Child policies Cot and extra bed policies Children of any age are welcome. Children 18 years and above will be charged as adults at this property. To see correct prices and occupancy information, please add the number of children in your group and their ages to your search. Prices for cots and extra beds are not included in the total price, and will have to be paid for separately during your stay. The number of extra beds and cots allowed is dependent on the option you choose. Please check your selected option for more information. All cots and extra beds are subject to availability.",2026-06-01 23:54:57.653137+01
493,647eb2dc-90dd-4c51-b75f-e7184d385e76,10ceacdd-830a-4534-b4cc-a2e8e1742da5,en,No age restriction,There is no age requirement for check-in,2026-06-01 23:54:57.656124+01
494,647eb2dc-90dd-4c51-b75f-e7184d385e76,10ceacdd-830a-4534-b4cc-a2e8e1742da5,en,Pets,Pets are allowed. Charges may be applicable.,2026-06-01 23:54:57.659937+01
495,647eb2dc-90dd-4c51-b75f-e7184d385e76,10ceacdd-830a-4534-b4cc-a2e8e1742da5,en,Groups,"When booking more than 9 rooms, different policies and additional supplements may apply.",2026-06-01 23:54:57.663794+01
496,647eb2dc-90dd-4c51-b75f-e7184d385e76,10ceacdd-830a-4534-b4cc-a2e8e1742da5,en,Cards accepted at this hotel,Cash is not accepted,2026-06-01 23:54:57.66658+01
497,e21713d9-3776-4c60-a700-43838afffe28,60db4ac8-9647-4717-a3a7-fa0b0bf774d6,es,Entrada,Desde las 15:00 Tienes que decirle al alojamiento con antelación a qué hora vas a llegar.,2026-06-01 23:55:56.102708+01
498,e21713d9-3776-4c60-a700-43838afffe28,60db4ac8-9647-4717-a3a7-fa0b0bf774d6,es,Salida,Hasta las 12:00,2026-06-01 23:55:56.104808+01
499,e21713d9-3776-4c60-a700-43838afffe28,60db4ac8-9647-4717-a3a7-fa0b0bf774d6,es,Cancelación /  prepago,Las condiciones de cancelación y de pago por adelantado pueden variar según el tipo de alojamiento. Introduce las fechas de tu estancia y consulta las condiciones de la opción que quieres reservar.,2026-06-01 23:55:56.106534+01
500,e21713d9-3776-4c60-a700-43838afffe28,60db4ac8-9647-4717-a3a7-fa0b0bf774d6,es,Camas para niños,"Condiciones para estancias con niños Se pueden alojar niños de cualquier edad. Los niños a partir de 12 años pagan como adultos en este alojamiento. Para ver la información correcta sobre precios y ocupación, añade a la búsqueda el número de niños con los que viajas y sus edades. Condiciones sobre cunas y camas supletorias 0 - 2 años Cuna a petición Gratis El número de cunas permitido depende de la opción que escojas. Consulta la opción que has escogido para saber más. No hay camas supletorias disponibles en este alojamiento. Todas las cunas están sujetas a disponibilidad. Condiciones para estancias con niños Condiciones sobre cunas y camas supletorias Se pueden alojar niños de cualquier edad. Los niños a partir de 12 años pagan como adultos en este alojamiento. Para ver la información correcta sobre precios y ocupación, añade a la búsqueda el número de niños con los que viajas y sus edades. El número de cunas permitido depende de la opción que escojas. Consulta la opción que has escogido para saber más. No hay camas supletorias disponibles en este alojamiento. Todas las cunas están sujetas a disponibilidad.",2026-06-01 23:55:56.108354+01
501,e21713d9-3776-4c60-a700-43838afffe28,60db4ac8-9647-4717-a3a7-fa0b0bf774d6,es,No hay restricción por edad,No hay edad mínima para el check-in,2026-06-01 23:55:56.1102+01
502,e21713d9-3776-4c60-a700-43838afffe28,60db4ac8-9647-4717-a3a7-fa0b0bf774d6,es,Mascotas,Se admiten bajo petición. Se pueden aplicar suplementos.,2026-06-01 23:55:56.111955+01
503,e21713d9-3776-4c60-a700-43838afffe28,60db4ac8-9647-4717-a3a7-fa0b0bf774d6,es,Grupos,"Al reservar más de 4 habitaciones, podrán aplicarse condiciones especiales y suplementos.",2026-06-01 23:55:56.113739+01
504,e21713d9-3776-4c60-a700-43838afffe28,60db4ac8-9647-4717-a3a7-fa0b0bf774d6,es,Métodos de pago aceptados,Efectivo,2026-06-01 23:55:56.11591+01
521,e4954ddc-ade5-4476-99cc-4fad8944e41e,10ceacdd-830a-4534-b4cc-a2e8e1742da5,de,Anreise,Ab 15:00,2026-06-01 23:57:17.649082+01
522,e4954ddc-ade5-4476-99cc-4fad8944e41e,10ceacdd-830a-4534-b4cc-a2e8e1742da5,de,Abreise,Bis 12:00,2026-06-01 23:57:17.650836+01
523,e4954ddc-ade5-4476-99cc-4fad8944e41e,10ceacdd-830a-4534-b4cc-a2e8e1742da5,de,Stornierung/ Vorauszahlung,Die Stornierungs- und Vorauszahlungsrichtlinien ändern sich je nach Unterkunftskategorie. Bitte geben Sie Ihre Reisedaten ein und überprüfen Sie die Bedingungen Ihrer gewählten Option.,2026-06-01 23:57:17.652541+01
