id,hotel_id,url_id,language,fp,created_at,updated_at
f35d667f-3058-4db6-8ade-904993ba0c2d,7deaafa3-34cb-4e9f-ac0e-fbc6a68bc604,b1ad4163-d11e-456c-9a23-b6a638abb291,es,"<p> Please note  : As of November 1, 2025, payments made via Booking (or other external partners) can be made in cash or by card. We accept third-party vouchers (Wellcard, Webhotels, Steiermark Voucher, Thermalbad and Vulkanland Voucher, Bad Waltersdorf Voucher) exclusively for direct bookings.</p><p>Las personas menores de 18 años solo pueden alojarse si van acompañadas de alguno de sus progenitores o tutores legales.</p>",2026-05-03 06:16:15.566338+01,2026-05-03 06:16:15.566338+01
3a9bdf69-8b10-421d-9079-7cea6af7bdc0,b8ffe5a4-e741-4daa-babd-4b5a8c7da3dc,b1ad4163-d11e-456c-9a23-b6a638abb291,de,"<p> Bitte beachten: Ab dem 1. November 2025 können Zahlungen über Booking (oder andere externe Partnerunternehmen) bar oder mit Karte getätigt werden. Gutscheine von Drittanbietern (Wellcard, Webhotels, Steiermark-Gutschein, Thermalbad- und Vulkanland-Gutschein, Bad Waltersdorf-Gutschein) akzeptieren wir ausschließlich bei Direktbuchungen.</p><p>Gäste unter 18 Jahren können nur mit einem Elternteil oder gesetzlichen Vertreter einchecken.</p>",2026-05-03 06:17:43.846605+01,2026-05-03 06:17:43.846605+01
95424962-e5a1-453a-81b1-f4ebc840e884,1e1094a3-9ac9-4f64-8c32-b619588a7caf,b1ad4163-d11e-456c-9a23-b6a638abb291,it,"<p> Please note  : As of November 1, 2025, payments made via Booking (or other external partners) can be made in cash or by card. We accept third-party vouchers (Wellcard, Webhotels, Steiermark Voucher, Thermalbad and Vulkanland Voucher, Bad Waltersdorf Voucher) exclusively for direct bookings.</p><p>Gli ospiti di età inferiore ai 18 anni possono effettuare il check-in solo se accompagnati da un genitore o da un tutore legale.</p>",2026-05-03 06:19:31.308951+01,2026-05-03 06:19:31.308951+01
140a5861-2b22-4131-9e3f-804f7466e5ea,77dce775-190f-4452-aac8-01e3f4cf55a5,24e85f8e-bdff-44f5-a251-ea4cf1fae17e,es,"<p>Informa a Lachtalhaus con antelación de tu hora prevista de llegada. Para ello, puedes utilizar el apartado de peticiones especiales al hacer la reserva o ponerte en contacto directamente con el alojamiento. Los datos de contacto aparecen en la confirmación de la reserva.</p>",2026-05-03 06:24:19.183218+01,2026-05-03 06:24:19.183218+01
b18c8676-889d-4d81-9d87-2e1a8dd1aab5,2ef26957-69f7-4a9a-9fb5-794623ab78f9,24e85f8e-bdff-44f5-a251-ea4cf1fae17e,it,"<p>Siete pregati di comunicare in anticipo a Lachtalhaus l'orario in cui prevedete di arrivare. Potrete inserire questa informazione nella sezione Richieste Speciali al momento della prenotazione, o contattare la struttura utilizzando i recapiti riportati nella conferma della prenotazione.</p>",2026-05-03 06:25:57.33515+01,2026-05-03 06:25:57.33515+01
ccb0fa84-bb56-40f8-8923-acf9f4ab7c83,a420c3dc-88d1-4b7e-b3d5-5f7d380cb631,24e85f8e-bdff-44f5-a251-ea4cf1fae17e,fr,<p>Veuillez informer l'établissement Lachtalhaus à l'avance de l'heure à laquelle vous prévoyez d'arriver. Vous pouvez indiquer cette information dans la rubrique « Demandes spéciales » lors de la réservation ou contacter directement l'établissement. Ses coordonnées figurent sur votre confirmation de réservation.</p>,2026-05-03 06:27:29.687581+01,2026-05-03 06:27:29.687581+01
91d2f69a-4e2e-40a8-9bbb-b6d99ffac2c9,1eef414b-57a8-47db-bfff-9b586716e314,24e85f8e-bdff-44f5-a251-ea4cf1fae17e,pt,"<p>Por favor, informe Lachtalhaus antecipadamente sobre o seu horário de chegada. Para isso poderá utilizar a caixa de Pedidos Especiais durante o processo da reserva ou contactar a propriedade diretamente através dos dados para contacto providenciados na sua confirmação.</p>",2026-05-03 06:28:30.558723+01,2026-05-03 06:28:30.558723+01
062b22d9-3bed-4e64-9b96-c51e981f530e,49bf5fdb-f0b3-471f-8b7a-b3b513f5564e,525c146c-cff8-4079-90be-1b71e693fdbc,en,"<p>Please note on Tuesday &amp; Wednesday evening the restaurant is closed.</p><p>Please inform Weinrefugium Brolli in advance of your expected arrival time. You can use the Special Requests box when booking, or contact the property directly with the contact details provided in your confirmation.</p><p>In response to Coronavirus (COVID-19), additional safety and sanitation measures are in effect at this property.</p><p>Food &amp; beverage services at this property may be limited or unavailable due to Coronavirus (COVID-19).</p><p>As a result of Coronavirus (COVID-19), this property has temporarily suspended its shuttle services.</p><p>Due to Coronavirus (COVID-19), this property is taking steps to help protect the safety of guests and staff. Certain services and amenities may be reduced or unavailable as a result.</p><p>Due to Coronavirus (COVID-19), this property has reduced reception and service operating hours.</p><p>In accordance with government guidelines to minimise transmission of the Coronavirus (COVID-19), this property may request additional documentation from guests to validate identity, travel itinerary and other relevant information, during dates where such guidelines exist.</p>",2026-05-03 06:29:39.353369+01,2026-05-03 06:29:39.353369+01
e349f5c1-98e9-4ce6-878d-cc5c1ff4d2dd,eaf0000a-e865-4ef5-a3b7-fe35600b2914,3e9cfdd4-12cf-4415-9325-4833c9b1b4ce,en,"<p>In response to Coronavirus (COVID-19), additional safety and sanitation measures are in effect at this property.</p><p>Due to Coronavirus (COVID-19), this property is taking steps to help protect the safety of guests and staff. Certain services and amenities may be reduced or unavailable as a result.</p><p>In accordance with government guidelines to minimise transmission of the Coronavirus (COVID-19), this property may request additional documentation from guests to validate identity, travel itinerary and other relevant information, during dates where such guidelines exist.</p>",2026-05-03 06:29:54.04874+01,2026-05-03 06:29:54.04874+01
501e93f1-bce6-4519-91f6-b51f53aefc8b,cd30b218-b525-46be-9b05-05ae8ea29b88,525c146c-cff8-4079-90be-1b71e693fdbc,es,"<p>Please note on Tuesday &amp; Wednesday evening the restaurant is closed.</p><p>Informa a Weinrefugium Brolli con antelación de tu hora prevista de llegada. Para ello, puedes utilizar el apartado de peticiones especiales al hacer la reserva o ponerte en contacto directamente con el alojamiento. Los datos de contacto aparecen en la confirmación de la reserva.</p><p>En respuesta al coronavirus (COVID-19), el alojamiento aplica medidas sanitarias y de seguridad adicionales en estos momentos.</p><p>Los servicios de comida y bebida de este alojamiento pueden verse limitados o no estar disponibles a causa del coronavirus (COVID-19).</p><p>A causa del coronavirus (COVID-19), este alojamiento ha suspendido temporalmente su servicio de traslado.</p><p>A causa del coronavirus (COVID-19), este alojamiento está tomando medidas para garantizar la seguridad de los clientes y el personal. Por este motivo, algunos servicios e instalaciones pueden verse limitados o no estar disponibles.</p><p>A causa del coronavirus (COVID-19), este alojamiento ha reducido el horario de recepción y otros servicios.</p><p>Según las indicaciones del Gobierno para minimizar el contagio del coronavirus (COVID-19),  es posible que este alojamiento solicite documentación adicional a los clientes para comprobar su identidad, itinerario de viaje y otros datos relevantes mientras sigan vigentes dichas indicaciones.</p>",2026-05-03 06:30:55.010394+01,2026-05-03 06:30:55.010394+01
ab9d1c35-d0fa-4ad5-96e2-8f54b5207233,a39038c5-7e30-43c8-9baf-d745ebb8878b,3e9cfdd4-12cf-4415-9325-4833c9b1b4ce,es,"<p>En respuesta al coronavirus (COVID-19), el alojamiento aplica medidas sanitarias y de seguridad adicionales en estos momentos.</p><p>A causa del coronavirus (COVID-19), este alojamiento está tomando medidas para garantizar la seguridad de los clientes y el personal. Por este motivo, algunos servicios e instalaciones pueden verse limitados o no estar disponibles.</p><p>Según las indicaciones del Gobierno para minimizar el contagio del coronavirus (COVID-19),  es posible que este alojamiento solicite documentación adicional a los clientes para comprobar su identidad, itinerario de viaje y otros datos relevantes mientras sigan vigentes dichas indicaciones.</p>",2026-05-03 06:31:22.203836+01,2026-05-03 06:31:22.203836+01
1b4dcfad-8ce7-47ae-9ff8-dbefad2cce06,9a578abc-096d-425c-a00f-2d41602f3297,dcbfd60a-096a-4804-ad5c-6bfe1decca12,es,"<p>Informa a Gesundheits- &amp; Wellness Resort Oberzeiring con antelación de tu hora prevista de llegada. Para ello, puedes utilizar el apartado de peticiones especiales al hacer la reserva o ponerte en contacto directamente con el alojamiento. Los datos de contacto aparecen en la confirmación de la reserva.</p>",2026-05-03 06:45:16.760715+01,2026-05-03 06:45:16.760715+01
1d416ce0-24f0-44b7-8920-a5107d2a2ad5,d27e1b74-89ab-4597-9c75-e28c6cecd1a1,525c146c-cff8-4079-90be-1b71e693fdbc,de,"<p>Bitte beachten Sie, dass das Restaurant am Dienstag- und Mittwochabend geschlossen ist.</p><p>Bitte teilen Sie der Unterkunft Weinrefugium Brolli Ihre voraussichtliche Ankunftszeit im Voraus mit. Nutzen Sie hierfür bei der Buchung das Feld für besondere Anfragen oder kontaktieren Sie die Unterkunft direkt.</p><p>Wegen des Coronavirus (COVID-19) wurden in dieser Unterkunft zusätzliche Sicherheits- und Hygienemaßnahmen unternommen.</p><p>Wegen des Coronavirus (COVID-19) könnten Essens- und Getränkeangebote in dieser Unterkunft begrenzt oder überhaupt nicht verfügbar sein. </p><p>Wegen des Coronavirus (COVID-19) bietet diese Unterkunft vorübergehend keinen Shuttleservice an. </p><p>Wegen des Coronavirus (COVID-19) hat diese Unterkunft Maßnahmen unternommen, um die Sicherheit der Gäste und des Personals zu gewährleisten. Bestimmte Services und Einrichtungen könnten daher nicht oder nur eingeschränkt zur Verfügung stehen. </p><p>Wegen des Coronavirus (COVID-19) hat diese Unterkunft seine Service- und Rezeptionszeiten verringert.</p><p>Gemäß den Richtlinien der Regierung zur Eindämmung des Coronavirus (COVID-19) könnte diese Unterkunft während des Zeitraums, für den diese Richtlinien gelten, zusätzliche Dokumente der Gäste verlangen, um deren Identität, Reiseroute und andere relevante Informationen zu prüfen. </p>",2026-05-03 06:31:41.8485+01,2026-05-03 06:31:41.8485+01
1f262377-79ae-4222-b735-70543eaf3d82,8235035d-3499-4b1d-9925-efae32b25373,3e9cfdd4-12cf-4415-9325-4833c9b1b4ce,it,"<p>In risposta al Coronavirus (COVID-19) questa struttura ha adottato misure extra di sicurezza e igiene.</p><p>A causa del Coronavirus (COVID-19) questa struttura sta adottando misure per proteggere la salute degli ospiti e dello staff. Pertanto, alcuni servizi potrebbero essere ridotti o non disponibili, così come le dotazioni.</p><p>In conformità con le indicazioni del governo per ridurre la diffusione del Coronavirus (COVID-19), questa struttura potrebbe richiedere documentazione aggiuntiva che attesti l'identità, l'itinerario di viaggio e altre informazioni rilevanti, durante il periodo di validità di tali direttive.</p>",2026-05-03 06:33:10.816739+01,2026-05-03 06:33:10.816739+01
f0bfef5a-45fb-4d77-a09b-c935342130ed,39f04419-a05f-42e0-a26f-c02e7bea1e4e,525c146c-cff8-4079-90be-1b71e693fdbc,pt,"<p>Please note on Tuesday &amp; Wednesday evening the restaurant is closed.</p><p>Por favor, informe Weinrefugium Brolli antecipadamente sobre o seu horário de chegada. Para isso poderá utilizar a caixa de Pedidos Especiais durante o processo da reserva ou contactar a propriedade diretamente através dos dados para contacto providenciados na sua confirmação.</p><p>Em resposta ao Coronavírus (COVID-19), este alojamento está a tomar medidas de segurança e higienização adicionais.</p><p>Os serviços de comida e bebidas deste alojamento poderão estar limitados ou indisponíveis devido ao Coronavírus (COVID-19).</p><p>Por causa do Coronavírus (COVID-19), este alojamento suspendeu temporariamente o seu serviço de transfer.</p><p>Devido ao Coronavírus (COVID-19), este alojamento está a tomar precauções adicionais para proteger os seus hóspedes e funcionários. Consequentemente, alguns serviços e comodidades poderão estar reduzidos ou indisponíveis.</p><p>Devido ao Coronavírus (COVID-19), este alojamento reduziu o horário de funcionamento da receção e dos serviços.</p><p>De acordo com as diretrizes governamentais para minimizar a transmissão do Coronavírus (COVID-19), este alojamento poderá pedir documentação adicional aos seus hóspedes, para validar a identidade, o itinerário de viagem e outra informação relevante, durante as datas em que tais diretrizes existam. </p>",2026-05-03 06:35:19.225379+01,2026-05-03 06:35:19.225379+01
d3bad4b5-c175-4051-aae1-424cb34530f8,4d9191dd-2f20-4f6a-bfe0-2a74ff3c3d4d,1bc0c422-6e3d-43d4-bdd1-eda5c8a60b4f,pt,"<p>Please note that the hotel is accessible outside reception hours with a code. The reception is only available from Monday to Friday from 06:30 to 12:00 and from 14:30 to 22:00. On Saturdays, Sundays and public holidays, the reception is open from 07:00 to 12:00 and from 14:30 to 22:00</p><p>No momento do check-in, os hóspedes deverão apresentar um documento de identificação com fotografia e um cartão de crédito.  Por favor, observe que todos os Pedidos Especiais estão sujeitos à disponibilidade e que poderão acarretar custos adicionais.</p><p>Por favor, informe Ibis Budget Graz City antecipadamente sobre o seu horário de chegada. Para isso poderá utilizar a caixa de Pedidos Especiais durante o processo da reserva ou contactar a propriedade diretamente através dos dados para contacto providenciados na sua confirmação.</p>",2026-05-03 06:42:54.305644+01,2026-05-03 06:42:54.305644+01
96bf9e9d-bda1-4880-b559-db48514d4348,39d5359c-2842-469d-8aa8-f9a6272da91c,3e9cfdd4-12cf-4415-9325-4833c9b1b4ce,de,"<p>Wegen des Coronavirus (COVID-19) wurden in dieser Unterkunft zusätzliche Sicherheits- und Hygienemaßnahmen unternommen.</p><p>Wegen des Coronavirus (COVID-19) hat diese Unterkunft Maßnahmen unternommen, um die Sicherheit der Gäste und des Personals zu gewährleisten. Bestimmte Services und Einrichtungen könnten daher nicht oder nur eingeschränkt zur Verfügung stehen. </p><p>Gemäß den Richtlinien der Regierung zur Eindämmung des Coronavirus (COVID-19) könnte diese Unterkunft während des Zeitraums, für den diese Richtlinien gelten, zusätzliche Dokumente der Gäste verlangen, um deren Identität, Reiseroute und andere relevante Informationen zu prüfen. </p>",2026-05-03 06:32:30.834789+01,2026-05-03 06:32:30.834789+01
2111463f-227c-4e03-919f-02e9bbda1e6a,9432b8a1-b347-46af-8fa8-44bc605a6def,525c146c-cff8-4079-90be-1b71e693fdbc,fr,"<p>Please note on Tuesday &amp; Wednesday evening the restaurant is closed.</p><p>Veuillez informer l'établissement Weinrefugium Brolli à l'avance de l'heure à laquelle vous prévoyez d'arriver. Vous pouvez indiquer cette information dans la rubrique « Demandes spéciales » lors de la réservation ou contacter directement l'établissement. Ses coordonnées figurent sur votre confirmation de réservation.</p><p>Dans le cadre de la pandémie de coronavirus (COVID-19), cet établissement applique actuellement des mesures sanitaires supplémentaires.</p><p>Il est possible que les services de restauration de cet établissement soient réduits ou indisponibles en raison de la pandémie de coronavirus (COVID-19).</p><p>Du fait de la pandémie de coronavirus (COVID-19), cet établissement a suspendu temporairement son service de navette.</p><p>En raison de la pandémie de coronavirus (COVID-19), cet établissement prend des mesures pour assurer la sécurité de ses clients et de son personnel. Certains services et équipements peuvent donc être réduits ou indisponibles.</p><p>En raison de la pandémie de coronavirus (COVID-19), cet établissement a réduit les horaires de sa réception et de ses services.</p><p>Conformément aux mesures gouvernementales visant à limiter la propagation du coronavirus (COVID-19), cet établissement peut demander à ses clients de présenter des documents supplémentaires attestant de leur identité, de leur itinéraire de voyage ou comportant toute autre information pertinente, aux dates concernées par ces mesures.</p>",2026-05-03 06:34:11.487846+01,2026-05-03 06:34:11.487846+01
00140368-99f3-4cfa-95e9-f5f07e371b8c,28096aaf-5087-4626-b319-cb820dc820d7,1bc0c422-6e3d-43d4-bdd1-eda5c8a60b4f,en,"<p>Please note that the hotel is accessible outside reception hours with a code. The reception is only available from Monday to Friday from 06:30 to 12:00 and from 14:30 to 22:00. On Saturdays, Sundays and public holidays, the reception is open from 07:00 to 12:00 and from 14:30 to 22:00</p><p>Guests are required to show a photo identification and credit card upon check-in. Please note that all Special Requests are subject to availability and additional charges may apply.</p><p>Please inform Ibis Budget Graz City in advance of your expected arrival time. You can use the Special Requests box when booking, or contact the property directly with the contact details provided in your confirmation.</p>",2026-05-03 06:36:58.740289+01,2026-05-03 06:36:58.740289+01
7a43dfd4-9611-44cd-b0de-6f33a85a8a3f,e43f5697-6e97-42fd-b73a-762d38adcc93,8a1cc2d5-18c2-4cc3-a900-38e0d48c7f21,es,"<p>El acceso al aparcamiento en garaje se efectúa en la siguiente dirección: Calle Idlhofgasse, 7. Las llaves del garaje se pueden recoger en la recepción del establecimiento. No se permite aparcar en la calle situada frente al hotel (Annenstraße).</p>",2026-05-03 06:37:23.399594+01,2026-05-03 06:37:23.399594+01
c6d9965f-d03d-4c73-841f-97a859c20eb4,d6109d0d-f5d7-4b9c-89ab-b08f74131de0,1bc0c422-6e3d-43d4-bdd1-eda5c8a60b4f,de,"<p>Bitte beachten Sie, dass das Hotel außerhalb der Öffnungszeiten der Rezeption mit einem Code zugänglich ist. Die Rezeption ist nur montags bis freitags von 06:30 bis 12:00 Uhr und von 14:30 bis 22:00 Uhr geöffnet. An Samstagen sowie an Sonn- und Feiertagen ist die Rezeption von 07:00 bis 12:00 Uhr und von 14:30 bis 22:00 Uhr geöffnet.</p><p>Beim Check-in müssen Sie einen Lichtbildausweis sowie eine Kreditkarte vorlegen. Sonderwünsche unterliegen der Verfügbarkeit und sind gegebenenfalls mit einem Aufpreis verbunden.</p><p>Bitte teilen Sie der Unterkunft Ibis Budget Graz City Ihre voraussichtliche Ankunftszeit im Voraus mit. Nutzen Sie hierfür bei der Buchung das Feld für besondere Anfragen oder kontaktieren Sie die Unterkunft direkt.</p>",2026-05-03 06:39:01.887933+01,2026-05-03 06:39:01.887933+01
7374b494-5388-47b2-9e2b-bdfb89bb4617,d0fd24d6-2349-43e8-a75d-604d44b3665c,8a1cc2d5-18c2-4cc3-a900-38e0d48c7f21,fr,"<p>Veuillez noter que l'accès au garage s'effectue à l'adresse suivante : Idlhofgasse 7. Les clés du garage peuvent être récupérées à la réception. Par ailleurs, le stationnement en face de l'établissement (Annenstraße) n'est pas autorisé.</p>",2026-05-03 06:41:19.657681+01,2026-05-03 06:41:19.657681+01
9e802dd7-0f24-4362-bad0-c17e882ab999,8818a5b9-8bd1-4646-b398-e8f61f5cf975,dcbfd60a-096a-4804-ad5c-6bfe1decca12,de,<p>Bitte teilen Sie der Unterkunft Gesundheits- &amp; Wellness Resort Oberzeiring Ihre voraussichtliche Ankunftszeit im Voraus mit. Nutzen Sie hierfür bei der Buchung das Feld für besondere Anfragen oder kontaktieren Sie die Unterkunft direkt.</p>,2026-05-03 06:45:53.070738+01,2026-05-03 06:45:53.070738+01
6563fcf0-c1dc-4da4-b367-6732dbbb2083,72c02f9a-7a25-4c14-a421-ed8c8cf2dd63,dcbfd60a-096a-4804-ad5c-6bfe1decca12,fr,<p>Veuillez informer l'établissement Gesundheits- &amp; Wellness Resort Oberzeiring à l'avance de l'heure à laquelle vous prévoyez d'arriver. Vous pouvez indiquer cette information dans la rubrique « Demandes spéciales » lors de la réservation ou contacter directement l'établissement. Ses coordonnées figurent sur votre confirmation de réservation.</p>,2026-05-03 06:47:59.920633+01,2026-05-03 06:47:59.920633+01
c9cdabd0-12bb-4341-8b84-ed189d518757,b209f520-ff1f-4a73-865c-d9591ea09dda,70d1404a-f44e-4da4-b58b-8d71d969b929,de,,2026-05-03 06:54:33.201692+01,2026-05-03 06:54:33.201692+01
0937ffca-ddb2-4e4f-81d2-fa7f43eb5a6f,3d5b2078-6f01-4738-a105-0dcfdfdf6873,b20d32ac-8d8d-40d0-8fdc-31c1de18b530,it,"<p>Siete pregati di comunicare in anticipo a Hotel Drei Hasen l'orario in cui prevedete di arrivare. Potrete inserire questa informazione nella sezione Richieste Speciali al momento della prenotazione, o contattare la struttura utilizzando i recapiti riportati nella conferma della prenotazione.</p><p>In risposta al Coronavirus (COVID-19) questa struttura ha adottato misure extra di sicurezza e igiene.</p><p>In conformità con le indicazioni del governo per ridurre la diffusione del Coronavirus (COVID-19), questa struttura potrebbe richiedere documentazione aggiuntiva che attesti l'identità, l'itinerario di viaggio e altre informazioni rilevanti, durante il periodo di validità di tali direttive.</p><p>A causa del Coronavirus (COVID-19), la struttura applica rigide misure di distanziamento fisico.</p><p>A causa del Coronavirus (COVID-19) è obbligatorio indossare la mascherina in tutte le aree comuni interne.</p><p>Non è possibile soggiornare presso questa struttura a scopo di quarantena per Coronavirus (COVID-19).</p>",2026-05-03 06:56:00.869273+01,2026-05-03 06:56:00.869273+01
09e738ba-700a-4705-8276-a6ee6ba2adb5,85ed3228-caea-4d68-9fdf-3cee27a2a030,b20d32ac-8d8d-40d0-8fdc-31c1de18b530,pt,"<p>Por favor, informe Hotel Drei Hasen antecipadamente sobre o seu horário de chegada. Para isso poderá utilizar a caixa de Pedidos Especiais durante o processo da reserva ou contactar a propriedade diretamente através dos dados para contacto providenciados na sua confirmação.</p><p>Em resposta ao Coronavírus (COVID-19), este alojamento está a tomar medidas de segurança e higienização adicionais.</p><p>De acordo com as diretrizes governamentais para minimizar a transmissão do Coronavírus (COVID-19), este alojamento poderá pedir documentação adicional aos seus hóspedes, para validar a identidade, o itinerário de viagem e outra informação relevante, durante as datas em que tais diretrizes existam. </p><p>Devido ao Coronavírus (COVID-19), este alojamento segue medidas rigorosas de distanciamento físico.</p><p>Devido ao Coronavírus (COVID-19), o uso de máscara é obrigatório em todas as áreas comuns interiores.</p><p>Não é possível ficar neste alojamento para fins de quarentena devido ao Coronavírus (COVID-19).</p>",2026-05-03 06:57:58.993179+01,2026-05-03 06:57:58.993179+01
68bc7d52-ef13-4b79-a16e-5f9c4917c77f,1bc9eef6-e69e-4f5a-8ced-f77e22befa28,80bf336e-46c2-4cc0-a430-e50acbfd060d,en,,2026-05-03 06:59:53.156977+01,2026-05-03 06:59:53.156977+01
220b3de4-d8f5-49c1-b2de-0aa92ea5de75,63f567be-dac4-4a69-b856-d47a243e5fc4,525c146c-cff8-4079-90be-1b71e693fdbc,it,"<p>Please note on Tuesday &amp; Wednesday evening the restaurant is closed.</p><p>Siete pregati di comunicare in anticipo a Weinrefugium Brolli l'orario in cui prevedete di arrivare. Potrete inserire questa informazione nella sezione Richieste Speciali al momento della prenotazione, o contattare la struttura utilizzando i recapiti riportati nella conferma della prenotazione.</p><p>In risposta al Coronavirus (COVID-19) questa struttura ha adottato misure extra di sicurezza e igiene.</p><p>I servizi di ristorazione e somministrazione di bevande in questa struttura potrebbero essere limitati o sospesi a causa del Coronavirus (COVID-19).</p><p>A causa del Coronavirus (COVID-19) questa struttura ha sospeso temporaneamente il servizio navetta.</p><p>A causa del Coronavirus (COVID-19) questa struttura sta adottando misure per proteggere la salute degli ospiti e dello staff. Pertanto, alcuni servizi potrebbero essere ridotti o non disponibili, così come le dotazioni.</p><p>A causa del Coronavirus (COVID-19) questa struttura ha ridotto gli orari di servizio e reception.</p><p>In conformità con le indicazioni del governo per ridurre la diffusione del Coronavirus (COVID-19), questa struttura potrebbe richiedere documentazione aggiuntiva che attesti l'identità, l'itinerario di viaggio e altre informazioni rilevanti, durante il periodo di validità di tali direttive.</p>",2026-05-03 06:32:56.104935+01,2026-05-03 06:32:56.104935+01
89266cbb-bb2d-4b34-9b1e-7d09469b9f86,ef6045c4-8999-498a-995b-15e5b69a9019,3e9cfdd4-12cf-4415-9325-4833c9b1b4ce,fr,"<p>Dans le cadre de la pandémie de coronavirus (COVID-19), cet établissement applique actuellement des mesures sanitaires supplémentaires.</p><p>En raison de la pandémie de coronavirus (COVID-19), cet établissement prend des mesures pour assurer la sécurité de ses clients et de son personnel. Certains services et équipements peuvent donc être réduits ou indisponibles.</p><p>Conformément aux mesures gouvernementales visant à limiter la propagation du coronavirus (COVID-19), cet établissement peut demander à ses clients de présenter des documents supplémentaires attestant de leur identité, de leur itinéraire de voyage ou comportant toute autre information pertinente, aux dates concernées par ces mesures.</p>",2026-05-03 06:34:43.291701+01,2026-05-03 06:34:43.291701+01
