id,hotel_id,url_id,language,seo_description,keywords,created_at,updated_at
c95c3f79-bb19-4a35-8540-a33f27b8085e,78a38ffc-c500-4f29-86bf-dc8c1924c317,aecb480c-d2b8-446a-9915-6bc3a71cc17a,es,"SHOME Hotel Graz I Self-Check-In I Free Parking se encuentra en Graz, a 3,8 km de Merkur Arena y a 5,6 km de Casino Graz.",,2026-06-02 01:37:51.570186+01,2026-06-02 01:37:51.570186+01
ceaa1076-d317-4a2f-b618-30084af8e7d8,1ae243c9-4b44-46fc-afb7-72d8bc06dbb8,aecb480c-d2b8-446a-9915-6bc3a71cc17a,de,"Weniger als 3,8 km von Merkur Arena und 5,6 km von Casino Graz entfernt in Graz gelegen, bietet die Unterkunft SHOME Hotel Graz I Self-Check-In I Free Parking Übernachtungsmöglichkeiten mit einem Restaurant, kostenloses WLAN in der ganzen Unterkunft und einem kostenlosen Privatparkplatz für Gäste, die mit dem Auto anreisen.",,2026-06-02 01:39:20.128511+01,2026-06-02 01:39:20.128511+01
8443933f-e176-4294-b3a6-9e56a8ffe8ea,4e771cb6-0318-4c26-a61c-38e3f55b4b6e,aecb480c-d2b8-446a-9915-6bc3a71cc17a,pt,"SHOME Hotel Graz I Self-Check-In I Free Parking localiza-se em Graz, a 3,8 km de Merkur Arena e a 5,6 km de Casino de Graz.",,2026-06-02 01:41:42.228032+01,2026-06-02 01:41:42.228032+01
94637ccf-cab1-4a0c-a561-4bd1f5994289,b07553aa-359f-4f8c-b598-27e6ec2874e2,0a53a5ad-3fb4-4fdd-a333-7863536ff7ed,de,Dieses traditionsreiche Hotel liegt nur 3 Gehminuten vom Grazer Hauptbahnhof und einen 10-minütigen Spaziergang von der Altstadt entfernt.,,2026-06-02 01:45:39.931655+01,2026-06-02 01:45:39.931655+01
bf691d0d-0c44-44ee-aaed-d9010e45c7e4,747c8081-f590-4857-898b-a929c5b40a85,3f4fd583-a4ff-444b-b9f2-4fe3ec3b909c,fr,"Situé à Graz, l’établissement 4 étoiles IntercityHotel Graz possède un salon commun, une terrasse et un bar.",,2026-06-02 01:17:10.984411+01,2026-06-02 01:17:10.984411+01
501addbe-dfae-47c0-89b2-5f63e4a4da1c,3752e79f-6582-4c30-a781-230cb9a27762,3f4fd583-a4ff-444b-b9f2-4fe3ec3b909c,pt,"A 5 minutos a pé de Estação Central de Graz, IntercityHotel Graz dispõe de acomodações de 4 estrelas em Graz e apresenta um salão partilhado, um terraço e um bar.",,2026-06-02 01:17:42.665866+01,2026-06-02 01:17:42.665866+01
7013cf66-5982-49d3-967e-7119ca595540,0cc41c2b-1171-4a2a-9e01-7ce2f75cc9a5,a1f2eb45-8055-4796-a38d-e1c78cf0ff8c,es,Hotel B&B Graz-Hbf enjoys a central location only a 3-minute walk from Graz Main Train Station and a 10-minute walk from the Old Town and the Kunsthaus.,,2026-06-02 01:20:34.603372+01,2026-06-02 01:20:34.603372+01
e8f85cbc-c326-4c48-afc7-bb7341971fa9,bfe1c10b-6adf-4bcc-b31b-2d85b0f10883,6f1200ef-6b11-4280-9451-0615bee3b831,es,"The Palais-Hotel Erzherzog Johann is situated in the heart of the old town of Graz, in the immediate vicinity of the main square.",,2026-06-02 01:21:29.85735+01,2026-06-02 01:21:29.85735+01
9210cf88-325a-4474-8cee-93abcb5009f7,6b731a36-0ff2-4919-adc6-9eec4de082b1,6f1200ef-6b11-4280-9451-0615bee3b831,de,Das Palais-Hotel Erzherzog Johann liegt mitten in der Altstadt von Graz.,,2026-06-02 01:22:21.320672+01,2026-06-02 01:22:21.320672+01
faccab64-20bc-4d86-983a-c57f99492509,dfa12f57-a70e-482c-ba8c-b44cd2dc0724,a1f2eb45-8055-4796-a38d-e1c78cf0ff8c,it,Hotel B&B Graz-Hbf enjoys a central location only a 3-minute walk from Graz Main Train Station and a 10-minute walk from the Old Town and the Kunsthaus.,,2026-06-02 01:22:58.787609+01,2026-06-02 01:22:58.787609+01
4698e463-8183-4028-ba95-dccc56bc805b,f186f43e-67ff-45de-86da-ae3215781fda,a1f2eb45-8055-4796-a38d-e1c78cf0ff8c,fr,Hotel B&B Graz-Hbf enjoys a central location only a 3-minute walk from Graz Main Train Station and a 10-minute walk from the Old Town and the Kunsthaus.,,2026-06-02 01:23:49.422442+01,2026-06-02 01:23:49.422442+01
3fc59d8b-a0f6-43f2-bc8f-66423907c568,a817f8c1-8cc5-4744-afc8-f691440a56e0,6f1200ef-6b11-4280-9451-0615bee3b831,fr,"The Palais-Hotel Erzherzog Johann is situated in the heart of the old town of Graz, in the immediate vicinity of the main square.",,2026-06-02 01:24:02.659434+01,2026-06-02 01:24:02.659434+01
8b0a61ef-ee0a-4c1c-ab15-30d087b8f05a,031e028d-a040-4c14-9018-aefcdf8baeb6,97f417be-163f-46db-96ce-bf48f19fecb1,en,"The Mercure Graz City is ideally located just a few steps from Graz’s historic centre and only 400 meters from the Schlossberg, home to the city’s iconic clock tower.
Cultural highlights, including the Graz Opera House, the Kunsthaus Museum, and the Schauspielhaus Theatre, are all within a 15-minute walking distance.
Guests can relax and stay active in the hotel’s fitness and wellness area, or make use of the business corner in the lobby, which provides internet access for work-related needs.",,2026-06-02 01:27:12.986009+01,2026-06-02 01:27:12.986009+01
98232e6b-762a-4e28-accf-3dcc175225ba,76bf877c-7b1a-417c-a90b-d4df00411eb7,4956889a-ddeb-458c-9fe2-8c89db1a5175,en,"Well located in the City centre district of Graz, Motel One Graz is located 300 metres from Graz Opera House, 500 metres from Glockenspiel and 300 metres from Grazer Landhaus.",,2026-06-02 01:28:17.238061+01,2026-06-02 01:28:17.238061+01
a60a0261-bb28-465c-b239-b7b983eb4ba7,3a9f3322-b62f-4505-b976-d27a3932e309,4956889a-ddeb-458c-9fe2-8c89db1a5175,es,"Motel One Graz está muy bien situado en el barrio de Centro de la ciudad, Graz, a 3 min a pie de Ópera de Graz, a 500 metros de Glockenspiel y a 4 min a pie de Landeszeughaus.",,2026-06-02 01:29:13.054375+01,2026-06-02 01:29:13.054375+01
b7179583-fec5-41d9-a6bd-13a8edf13d73,469f8d4b-5503-42c1-a2b6-20682e8c1cd5,97f417be-163f-46db-96ce-bf48f19fecb1,it,"The Mercure Graz City is ideally located just a few steps from Graz’s historic centre and only 400 meters from the Schlossberg, home to the city’s iconic clock tower.
Cultural highlights, including the Graz Opera House, the Kunsthaus Museum, and the Schauspielhaus Theatre, are all within a 15-minute walking distance.
Guests can relax and stay active in the hotel’s fitness and wellness area, or make use of the business corner in the lobby, which provides internet access for work-related needs.",,2026-06-02 01:30:37.426307+01,2026-06-02 01:30:37.426307+01
74bf179e-6da8-4b30-a476-86ec593b8bb7,683a0834-8d48-41fa-86d4-9d9261f5af3c,97f417be-163f-46db-96ce-bf48f19fecb1,pt,"The Mercure Graz City is ideally located just a few steps from Graz’s historic centre and only 400 meters from the Schlossberg, home to the city’s iconic clock tower.
Cultural highlights, including the Graz Opera House, the Kunsthaus Museum, and the Schauspielhaus Theatre, are all within a 15-minute walking distance.
Guests can relax and stay active in the hotel’s fitness and wellness area, or make use of the business corner in the lobby, which provides internet access for work-related needs.",,2026-06-02 01:31:46.873972+01,2026-06-02 01:31:46.873972+01
2eca0376-e244-41e5-b30b-c6ecb352bbe3,ec5680f7-4351-44d3-a87c-68160f129490,8c33daff-a5a5-4af3-8b35-6c27b7d83b34,en,"Hotel Drei Raben is situated in the centre of Graz, an 8-minute walk from the Main Train Station and a 10-minute walk from the Kunsthaus and the Mur River.",,2026-06-02 01:35:17.994602+01,2026-06-02 01:35:17.994602+01
75f32a80-6070-436f-a7a8-c2f29aacdc06,2286c660-0033-453f-99fa-7d8a2d09442b,8c33daff-a5a5-4af3-8b35-6c27b7d83b34,es,"Hotel Drei Raben is situated in the centre of Graz, an 8-minute walk from the Main Train Station and a 10-minute walk from the Kunsthaus and the Mur River.",,2026-06-02 01:36:43.004718+01,2026-06-02 01:36:43.004718+01
79da05f7-68f2-45f4-8f4e-f51249ebe38d,d2f7ad3f-8eb4-4efa-8be3-73df750496d4,8c33daff-a5a5-4af3-8b35-6c27b7d83b34,it,"Hotel Drei Raben is situated in the centre of Graz, an 8-minute walk from the Main Train Station and a 10-minute walk from the Kunsthaus and the Mur River.",,2026-06-02 01:38:04.278771+01,2026-06-02 01:38:04.278771+01
0e6fc387-efab-4988-a329-192e9a39ae54,64535003-b3fd-4018-b24e-938a42975efc,8c33daff-a5a5-4af3-8b35-6c27b7d83b34,pt,"Hotel Drei Raben is situated in the centre of Graz, an 8-minute walk from the Main Train Station and a 10-minute walk from the Kunsthaus and the Mur River.",,2026-06-02 01:39:55.613407+01,2026-06-02 01:39:55.613407+01
15a14370-f38d-4bd8-ad7a-fae2f244fa65,bff68b6f-c34e-4865-8cc0-a6854c277700,aecb480c-d2b8-446a-9915-6bc3a71cc17a,fr,"L’établissement SHOME Hotel Graz I Self-Check-In I Free Parking se trouve à Graz, à respectivement 3,8 km et 5,6 km de ces lieux d’intérêt : Merkur Arena et Casino de Graz.",,2026-06-02 01:41:16.625711+01,2026-06-02 01:41:16.625711+01
2fd9ec2e-fdc1-45a3-b861-51a29200bd32,db6128de-2ae4-46d5-b85e-8d9256464c89,db8fa991-c455-48e5-b563-ed9e4a4c74e0,en,Zur Steirerstub´n in Graz is located at Lendplatz Square and has an award-winning restaurant.,,2026-06-02 01:44:04.832534+01,2026-06-02 01:44:04.832534+01
ecacf8f3-fd49-401e-bb82-2232c52c8fe0,341aa1c6-a3b0-4024-aadb-91a5f4ffd7db,db8fa991-c455-48e5-b563-ed9e4a4c74e0,es,El Zur Steirerstub´n está situado en la plaza Lendplatz de Graz.,,2026-06-02 01:44:50.06776+01,2026-06-02 01:44:50.06776+01
9053fe4b-fd95-4ae0-89d6-231cca8195f5,84487ced-3621-4435-ac9d-c6774bc80bf7,0a53a5ad-3fb4-4fdd-a333-7863536ff7ed,it,"Il tradizionale Hotel Strasser offre il WiFi gratuito e una reception operativa 24 ore su 24, il tutto a soli 3 minuti a piedi dalla principale Stazione Ferroviaria di Graz e a 10 minuti di cammino dal centro storico.
Alloggerete in luminose camere dotate di arredamenti contemporanei e moderno bagno con set di cortesia, e nella maggior parte dei casi disporrete di una TV a schermo piatto.
Al mattino gusterete una ricca colazione a buffet, mentre al bar ben fornito potrete rilassarvi con un drink.
Vi basterà una passeggiata di circa 5 minuti per raggiungere la più vicina fermata del tram, collegata a tutte le attrazioni e zone commerciali più importanti.
L'Hotel Strasser dista infine meno di 10 minuti di auto dalle autostrade A2 e A9.",,2026-06-02 01:46:11.200314+01,2026-06-02 01:46:11.200314+01
4da20533-bb38-491b-a2da-3e66c070b0d4,3749475d-08db-48e1-8366-af1143029e10,0a53a5ad-3fb4-4fdd-a333-7863536ff7ed,fr,"L'établissement traditionnel Hotel Strasser vous accueille à Graz, à seulement 3 minutes à pied de la gare centrale et à 10 minutes de marche de la vieille ville.",,2026-06-02 01:46:56.031228+01,2026-06-02 01:46:56.031228+01
d59d2a5b-e63f-44e3-a4a4-b8f2fc0f51f2,0beaa73c-a430-411f-9fa7-8d7094e13095,db8fa991-c455-48e5-b563-ed9e4a4c74e0,it,"Situato in piazza Lendplatz, il Zur Steirerstub´n in Graz vanta un ristorante premiato specializzato in cucina tradizionale dell'Austria e della Stiria, dove potrete gustare anche succhi di frutta freschi e vini.
Le sistemazioni dello Steirerstub'n comprendono un bagno, una TV satellitare a schermo piatto e, in un caso solo, una grande terrazza affacciata sulla piazza Lendplatz e un soggiorno con angolo cottura.",,2026-06-02 01:47:10.619937+01,2026-06-02 01:47:10.619937+01
ef342de4-73ae-4bdf-8e86-d20d36ad2a59,5f8dd649-edb5-4574-b3da-e19990c6f917,0a53a5ad-3fb4-4fdd-a333-7863536ff7ed,pt,Este hotel tradicional está apenas a 3 minutos a pé da Estação Ferroviária Central de Graz e a 10 minutos a pé do centro histórico.,,2026-06-02 01:47:29.790686+01,2026-06-02 01:47:29.790686+01
d198b6c7-becc-468c-bc4a-becfaae1c09e,20f84dcb-1ba2-4b30-85a6-f774352668de,db8fa991-c455-48e5-b563-ed9e4a4c74e0,fr,Le Zur Steirerstub'n de Graz est situé sur la place Lendplatz et dispose d'un restaurant primé.,,2026-06-02 01:48:01.244802+01,2026-06-02 01:48:01.244802+01
ca8e613d-b8ff-4c0f-beec-3271d38518e6,eec9a5cc-7c9a-4dc2-850c-400e3d8617bc,db8fa991-c455-48e5-b563-ed9e4a4c74e0,pt,Zur Steirerstub´n in Graz is located at Lendplatz Square and has an award-winning restaurant.,,2026-06-02 01:48:30.87242+01,2026-06-02 01:48:30.87242+01
b7adf5f8-71b3-4e28-bfc9-e7ea3b11fd9a,1cd3fd57-afee-4d8f-8de3-3af263059807,6f28b771-e19c-4120-a2e8-831fa30b90df,es,Ibis Styles Graz Messe está muy bien situado en el barrio de St.,,2026-06-02 01:59:31.4027+01,2026-06-02 01:59:31.4027+01
fdfacaa7-96a7-42d3-b8bc-99be04db7cc0,b4c34b61-5e36-4089-8162-aca713fa19cb,b5a74275-271a-47d8-9fec-4a7beaefa614,en,"Hotel Feichtinger is located in the centre of Graz, only a 5-minute walk away from Graz Art Museum and the historic old town.",,2026-06-02 01:50:03.65313+01,2026-06-02 01:50:03.65313+01
0ad8c87f-5fcb-4771-b439-702746ca65ec,aab4d6d3-3edb-4442-9adf-b0a0cb4cb84f,675bf232-9b7a-4070-a597-00cb35793ffc,es,This unusual 4-star boutique hotel in the picturesque Old Town of Graz is only a few steps from the Cathedral.,,2026-06-02 01:52:26.475102+01,2026-06-02 01:52:26.475102+01
ec9d5a32-785a-4ede-9191-40151f844ae7,1b093415-9774-47ae-a079-9047f15f8eff,b5a74275-271a-47d8-9fec-4a7beaefa614,it,"L’Hotel Feichtinger si trova nel centro di Graz, a soli 5 minuti a piedi dal Museo d’Arte di Graz e dal centro storico.",,2026-06-02 01:53:43.146721+01,2026-06-02 01:53:43.146721+01
45ef51ab-2f30-49e9-b9dc-7ccf649a74ee,66e402b8-ce38-4d17-a27b-35e379dcea40,675bf232-9b7a-4070-a597-00cb35793ffc,fr,This unusual 4-star boutique hotel in the picturesque Old Town of Graz is only a few steps from the Cathedral.,,2026-06-02 01:55:24.561421+01,2026-06-02 01:55:24.561421+01
dfdbd5b9-4c89-4cf6-ba01-e63aefb90cdb,ebddee89-d5a7-4cfb-8c5f-c16aa2a07ed9,45704589-d25e-4e5e-bda7-9b51e128b63e,en,"Decorated with antiquities and works of art, the Schlossberghotel enjoys a central location directly at the foot of the Schlossberg in the historic city centre of Graz.",,2026-06-02 01:57:42.152096+01,2026-06-02 01:57:42.152096+01
aa3810f8-4d64-4870-b29d-20b1e6b2727e,4ea980b7-5510-4942-ab78-60ad6b9028a2,ff6fbb0b-d454-4607-b27b-41605fa3da9a,es,"El Wasser Palast está bien comunicado con el centro de la ciudad de Graz, situado a 6 km, ya que hay una parada de autobús justo enfrente del edificio.
Las habitaciones del Wasser Palast disponen de baño con ducha, escritorio, 2 camas individuales, sofá cama para 1 persona, TV vía satélite, muebles de madera y obras de arte enmarcadas en la pared.",,2026-06-02 02:07:41.320307+01,2026-06-02 02:07:41.320307+01
0a2089a0-1459-451a-9aed-6ceef0154da4,83dddfe1-0d17-4a91-80dd-c62e0f1b6642,ff6fbb0b-d454-4607-b27b-41605fa3da9a,it,"Il Wasser Palast offre buoni collegamenti con il centro di Graz, a 6 km, con una fermata dell'autobus proprio di fronte all'edificio.
Le camere del Wasser Palast dispongono di bagno con doccia, scrivania, 2 letti singoli, divano-letto per 1, TV satellitare, arredi realizzati in legno e pareti decorate con opere incorniciate.",,2026-06-02 02:09:01.210519+01,2026-06-02 02:09:01.210519+01
ad64fb61-4545-492c-ab6e-953a6505e55d,f91cb29b-aae6-4e62-9ac0-533a783816bf,ff6fbb0b-d454-4607-b27b-41605fa3da9a,pt,"O Wasser Palast providencia boas ligações ao centro da cidade de Graz, a 6 km, com uma paragem de autocarro em frente ao edifício.
Os quartos do Wasser Palast incluem uma casa de banho com um chuveiro, uma secretária, 2 camas individuais, um sofá-cama para 1 pessoa e televisão por satélite.",,2026-06-02 02:11:02.394049+01,2026-06-02 02:11:02.394049+01
8e2068a3-cfb6-43e2-b917-cc3f21f39abb,3113d868-7920-4310-83e4-339e812dd3f8,675bf232-9b7a-4070-a597-00cb35793ffc,en,This unusual 4-star boutique hotel in the picturesque Old Town of Graz is only a few steps from the Cathedral.,,2026-06-02 01:51:13.749147+01,2026-06-02 01:51:13.749147+01
9758167f-54de-4345-b3d6-9ae6cd886b9c,d4811ac2-4d26-46b1-a1ef-2a2faf0cfa2b,675bf232-9b7a-4070-a597-00cb35793ffc,pt,This unusual 4-star boutique hotel in the picturesque Old Town of Graz is only a few steps from the Cathedral.,,2026-06-02 01:56:00.249886+01,2026-06-02 01:56:00.249886+01
0f0ae609-28a2-4d4b-8084-6376b0ab7a82,7aa02580-7b97-4612-aa88-b972e1cad29f,6f28b771-e19c-4120-a2e8-831fa30b90df,pt,Com uma localização conveniente na área de St.,,2026-06-02 02:04:19.139836+01,2026-06-02 02:04:19.139836+01
c3774284-94e6-4cb7-82b4-56ce698a8dfa,4ea7f26d-3e59-4f6c-a326-1fceb62a45cd,15c5f732-c5d7-4b89-95f5-e62ba464e66b,fr,"Situé à Graz, à 400 mètres de l'hôtel de ville, le Kai 36 - Hotel zwischen Fels und Fluss propose des hébergements avec un parking privé, un bar et un jardin.",,2026-06-02 02:11:20.799797+01,2026-06-02 02:11:20.799797+01
0073de40-b35c-4f7d-afd1-bdaea4a4c18e,e45243d7-15fb-4e61-b9d4-1ba4d32cd299,347f9304-0461-4e43-84ff-770ad73e24d8,es,"Radisson Hotel Graz se encuentra en Graz, a 5 min a pie de Estación de tren Graz Central, y ofrece centro de fitness, habitaciones libres de humo, wifi gratis en todo el alojamiento y bar.",,2026-06-02 02:16:09.046446+01,2026-06-02 02:16:09.046446+01
dc96e99c-7a0a-4594-891b-f124714e1481,94d61875-b981-498a-88ed-a5035fbe2e1f,b5a74275-271a-47d8-9fec-4a7beaefa614,es,"El Hotel Feichtinger se encuentra en el centro de Graz, a tan solo 5 minutos a pie del Museo de Arte de Graz y del centro histórico.",,2026-06-02 01:51:43.43439+01,2026-06-02 01:51:43.43439+01
58de7e6f-ace3-40a0-a7f1-d03fef862ad1,0ec291f5-6cf7-47c9-974b-4e8bb4070b5b,675bf232-9b7a-4070-a597-00cb35793ffc,de,Dieses ungewöhnliche 4-Sterne-Boutique-Hotel in der malerischen Altstadt von Graz liegt nur wenige Schritte vom Dom entfernt.,,2026-06-02 01:52:53.896539+01,2026-06-02 01:52:53.896539+01
990bdd50-8e05-486b-8aa5-327ef089e082,c6a1046a-2893-4032-9ebf-118e15977af6,b5a74275-271a-47d8-9fec-4a7beaefa614,fr,"L'Hotel Feichtinger est situé dans le centre de Graz, à seulement 5 minutes à pied du musée d'art et de la vieille ville historique.",,2026-06-02 01:54:40.19681+01,2026-06-02 01:54:40.19681+01
0a3a0d41-fe31-4054-b64d-6b8c3dcdda29,35f765a1-2a92-4918-b821-022df5328922,45704589-d25e-4e5e-bda7-9b51e128b63e,de,"Decorated with antiquities and works of art, the Schlossberghotel enjoys a central location directly at the foot of the Schlossberg in the historic city centre of Graz.",,2026-06-02 02:00:13.581145+01,2026-06-02 02:00:13.581145+01
24918f58-87c4-425a-ad1a-fd39fd9563fc,deac92e5-c6c7-4136-ac66-21f90389ce84,45704589-d25e-4e5e-bda7-9b51e128b63e,fr,"Decorated with antiquities and works of art, the Schlossberghotel enjoys a central location directly at the foot of the Schlossberg in the historic city centre of Graz.",,2026-06-02 02:01:45.81687+01,2026-06-02 02:01:45.81687+01
a3c6423d-3afb-4b30-9908-a4c5e5e148bc,0df42763-dd7a-417d-8819-ce538078ec33,ff6fbb0b-d454-4607-b27b-41605fa3da9a,de,"Das Hotel Wasser Palast mit Bushaltestelle direkt vor dem Gebäude bietet eine gute Anbindung in das 6 Kilometer entfernte Stadtzentrum von Graz.
Die Zimmer im Wasser Palast erwarten Sie mit einem Bad mit einer Dusche, einem Schreibtisch, 2 Einzelbetten, 1 Einzelschlafsofa und einem Sat-TV.",,2026-06-02 02:08:29.771511+01,2026-06-02 02:08:29.771511+01
df9162f6-5702-498f-a745-41880cc42970,3f863d67-ac97-4322-98c0-0fa914743ff6,ff6fbb0b-d454-4607-b27b-41605fa3da9a,fr,"Depuis le Wasser Palast, vous pourrez facilement rejoindre le centre-ville de Graz à 6 km, grâce à l'arrêt de bus placé juste en face.
Les chambres comprennent une salle de bains avec une douche, un bureau, 2 lits simples, un canapé-lit pour 1 personne et la télévision par satellite.",,2026-06-02 02:09:53.592211+01,2026-06-02 02:09:53.592211+01
2ff7edc5-bd30-47e9-b97a-fa508c3149bd,1e1701ff-f7ea-4d1e-8ac3-dc8573bf9c14,b5a74275-271a-47d8-9fec-4a7beaefa614,de,"Das Hotel Feichtinger erwartet Sie im Zentrum von Graz, nur 5 Gehminuten vom Kunsthaus Graz und der historischen Altstadt entfernt.",,2026-06-02 01:52:42.437568+01,2026-06-02 01:52:42.437568+01
129663ad-f3c4-4c6d-9b71-b4be11c8c872,bd7ba9cf-06da-4fd7-9f39-94969eca5a29,675bf232-9b7a-4070-a597-00cb35793ffc,it,This unusual 4-star boutique hotel in the picturesque Old Town of Graz is only a few steps from the Cathedral.,,2026-06-02 01:54:25.703457+01,2026-06-02 01:54:25.703457+01
83919c38-f85c-4a03-989e-e90f2217487e,775ad698-088b-49aa-aa5b-58a31003b018,b5a74275-271a-47d8-9fec-4a7beaefa614,pt,"O Hotel Feichtinger está localizado no centro de Graz, apenas a 5 minutos a pé do Museu de Arte de Graz e da histórica cidade velha.",,2026-06-02 01:55:43.425308+01,2026-06-02 01:55:43.425308+01
4fb49d03-8783-4dee-a4b4-9231a8b4ddac,9e903909-5b15-4daf-be71-c6a78be8c3c9,6f28b771-e19c-4120-a2e8-831fa30b90df,fr,L’établissement ibis Styles Graz Messe est idéalement placé dans le quartier St.,,2026-06-02 02:03:15.488416+01,2026-06-02 02:03:15.488416+01
3a4361c5-243b-44e5-9721-1c7b8a5e6441,f2462012-ec4b-42fc-9507-7a936205b828,15c5f732-c5d7-4b89-95f5-e62ba464e66b,es,"El Kai 36 - Hotel zwischen Fels und Fluss se encuentra en Graz, a 400 metros del ayuntamiento de Graz, y ofrece alojamiento con aparcamiento privado, bar y jardín.",,2026-06-02 02:07:28.834215+01,2026-06-02 02:07:28.834215+01
4c5a25ab-314c-4b0b-846a-d1ed39c282dc,8ce07405-0c72-438e-9425-75afd7589013,15c5f732-c5d7-4b89-95f5-e62ba464e66b,de,"Das Kai 36 - Hotel zwischen Fels und Fluss liegt in Graz, 400 m vom Grazer Rathaus entfernt und bietet Unterkünfte mit Privatparkplätzen, eine Bar und einen Garten.",,2026-06-02 02:08:43.771548+01,2026-06-02 02:08:43.771548+01
a81e67f3-d7f3-4c99-b153-073145669134,50cbbf6a-adfe-4197-9b26-eb7f1795fdd4,15c5f732-c5d7-4b89-95f5-e62ba464e66b,it,"Situato a Graz, a 400 m dal Municipio, il Kai 36 - Hotel zwischen Fels und Fluss offre un parcheggio privato, un bar e un giardino.",,2026-06-02 02:10:08.051584+01,2026-06-02 02:10:08.051584+01
361c6544-bcd1-4a4e-8d8c-28dac4b793d6,d6f4ac6a-1442-4cdb-8fbe-cdc6e26a975a,6f28b771-e19c-4120-a2e8-831fa30b90df,en,"Set 1.3 km from Graz Opera House, ibis Styles Graz Messe offers 3-star accommodation in Graz and has a bar.",,2026-06-02 01:58:29.194467+01,2026-06-02 01:58:29.194467+01
7c26f1b5-c8ff-4b29-af90-0d08f61d8010,b6975272-af63-4151-bda9-da50777625a4,45704589-d25e-4e5e-bda7-9b51e128b63e,es,"Decorated with antiquities and works of art, the Schlossberghotel enjoys a central location directly at the foot of the Schlossberg in the historic city centre of Graz.",,2026-06-02 01:59:18.599909+01,2026-06-02 01:59:18.599909+01
dd04cae2-60a6-419b-bf5d-087f95325999,ce7853cc-ed30-479f-b646-91839dc20546,6f28b771-e19c-4120-a2e8-831fa30b90df,de,Dieses Hotel – optimal gelegen im Bezirk St.,,2026-06-02 02:00:25.947158+01,2026-06-02 02:00:25.947158+01
88cdbcb9-2678-48a9-a43e-4415ffd245c7,0b00ab3b-f478-4cb4-b53c-19d450dc2d49,6f28b771-e19c-4120-a2e8-831fa30b90df,it,In posizione strategica nel quartiere St.,,2026-06-02 02:01:47.105922+01,2026-06-02 02:01:47.105922+01
d9448fce-e47c-4478-86b8-ebdbd016e283,e6160f55-9c8e-43d7-92af-b30fe97e4f08,45704589-d25e-4e5e-bda7-9b51e128b63e,it,"Decorated with antiquities and works of art, the Schlossberghotel enjoys a central location directly at the foot of the Schlossberg in the historic city centre of Graz.",,2026-06-02 02:00:47.464131+01,2026-06-02 02:00:47.464131+01
8b2c6ba8-5941-49d7-a709-8ff00f0ba9a0,9fe36bd3-6a93-4900-88c1-8bf9b65f7fa5,45704589-d25e-4e5e-bda7-9b51e128b63e,pt,"Decorated with antiquities and works of art, the Schlossberghotel enjoys a central location directly at the foot of the Schlossberg in the historic city centre of Graz.",,2026-06-02 02:02:56.572027+01,2026-06-02 02:02:56.572027+01
d6c70e8e-b5b0-48ab-99f6-eeda6495fcad,d62b7148-bbcb-48c2-a2a7-ba028644a614,15c5f732-c5d7-4b89-95f5-e62ba464e66b,en,"Located in Graz, 400 metres from Graz Town Hall, Kai 36 - Hotel zwischen Fels und Fluss provides accommodation with private parking, a bar and a garden.",,2026-06-02 02:06:01.929614+01,2026-06-02 02:06:01.929614+01
3d562546-379a-42de-8591-f7f3a2703e88,83523571-2d82-4bbc-8fd5-6e216beeb4c2,ff6fbb0b-d454-4607-b27b-41605fa3da9a,en,"Wasser Palast provides good connections to Graz city centre 6 km away, having a bus stop right in front of the building.
Rooms at the Wasser Palast have a bathroom with a shower, a work desk, 2 single beds, a sofa bed for 1, and satellite TV.",,2026-06-02 02:06:59.697209+01,2026-06-02 02:06:59.697209+01
014cda36-1acb-4376-97a1-a6be597ac558,f79fa4b9-aeb5-4e43-a9d7-36316b11c8d6,15c5f732-c5d7-4b89-95f5-e62ba464e66b,pt,"Localizado em Graz, a 400 metros da Câmara Municipal de Graz, o Kai 36 - Hotel zwischen Fels und Fluss disponibiliza acomodações com estacionamento privado, um bar e um jardim.",,2026-06-02 02:12:17.966861+01,2026-06-02 02:12:17.966861+01
fc493021-018e-4568-94ea-be475de12518,fbf792be-1f6f-438e-9dda-05ad61d42090,347f9304-0461-4e43-84ff-770ad73e24d8,en,"Set in Graz and with Graz Central Station reachable within 400 metres, Radisson Hotel Graz offers a fitness centre, non-smoking rooms, free WiFi throughout the property and a bar.",,2026-06-02 02:14:02.503076+01,2026-06-02 02:14:02.503076+01
