id,hotel_id,url_id,language,description,created_at,updated_at
f5549a1c-98ff-4137-b5d4-cc3671c57535,03a4a2e5-95bf-4aaf-ad49-87899a007eec,5a7878b2-6168-4e09-b50e-70b0c3232c2d,de,"In diesem familiengeführten, mit dem Qualitätsgütesiegel für Gesundheitstourismus ausgezeichneten Wellnesshotel ist Ihnen und Ihrer Familie ein unvergesslicher Aufenthalt sicher.

Das Hotel Edelweiß empfängt Sie mit einem angenehmen Ambiente, freundlichem Personal und einzigartigen Freizeiteinrichtungen. Eines der größten Hallenbäder der Region und ein weitläufiger Wellnessbereich gehören ebenso zum Angebot des Hotels, das in einem sonnigen Tal nahe dem Skigebiet Großarl liegt, wie das Servieren des Frühstücks auf Ihr Zimmer.

Ihren Kindern stehen ein Spielplatz und ein Tischtennistisch zur Verfügung, während Sie Ihren Nachmittagstee auf der Terrasse genießen. Gönnen Sie sich nach einem aufregenden Tag eine professionelle Massage oder einen Drink an der Bar. Auch für Meetings und Feierlichkeiten stellt das Hotel die passenden Räumlichkeiten zur Verfügung.",2026-06-12 07:42:56.649455+01,2026-06-12 07:42:56.649455+01
d168c6f4-e1c3-4777-a620-dfc81fc7e014,d5a5f5ce-a3a6-49ed-8bd6-b44de4a7a20a,3afa282d-455b-493e-8e88-3419671f10ea,pt,"Familien Natur Resort Moar Gut encontra-se em Grossarl, a 41 km de Eisriesenwelt Werfen, e apresenta acomodações com um salão partilhado, estacionamento privado gratuito, um restaurante e um bar. As comodidades deste alojamento incluem um clube infantil e serviço de quartos, assim como acesso Wi-Fi gratuito em toda a propriedade. Uma piscina exterior, comodidades para reuniões e banquetes, jardim,terraço,piscina interior, sauna e parque aquático estão à disposição dos hóspedes.

Todos os quartos têm ar condicionado, área de estar, televisão de ecrã plano com canais por satélite, cofre e uma casa de banho privativa com chuveiro, produtos de higiene pessoal gratuitos e um secador de cabelo. Os quartos incluem máquina de café, enquanto alguns têm pátio. No alojamento, os quartos incluem roupa de cama e toalhas.

O alojamento disponibiliza opções de pequeno-almoço buffet, continental ou americano.

Familien Natur Resort Moar Gut oferece acesso à área de bem-estar no local, que inclui banheira de hidromassagem e hammam. Pode jogar bilhar, ténis de mesa e dardos neste hotel de 5 estrelas, e a área é popular para caminhadas e esqui.

Os funcionários da receção falam alemão e inglês, e terão todo o prazer em ajudar a qualquer hora do dia.

Estação Ferroviária de Bischofshofen fica a 28 km de Familien Natur Resort Moar Gut, enquanto Saltos de Esqui Paul-Ausserleitner-Schanze está a 28 km da propriedade. O Aeroporto de Salzburgo - W. A. Mozart fica a 80 km de distância.",2026-06-12 07:43:12.939296+01,2026-06-12 07:43:12.940296+01
1a85a5a9-45a3-45e6-a6af-19f1fca38f98,f7af39ab-75cf-40ea-a281-1c2b531c2559,93d357f1-d315-4b06-bdd9-b45026f78099,en,"Set against the backdrop of the Totes Gebirge mountains, JUFA Hotel Grundlsee is located directly on the shore of the picturesque Grundlsee lake in the Styrian part of the Salzkammergut. It has a private beach, a sauna, a children’s playground with an Indian tepee, and a sun terrace. Table tennis is available.

The JUFA Grundlsee offers rooms with a bathroom and cable TV. Wi-Fi access is free of charge in public areas.

Cross-country skis, snowshoes and canoes can be rented. A lockable bicycle room and a storage room for diving equipment are available.

A rock-climbing centre with 15 different routes is 20 km away from JUFA Grundlsee. Please know that there is no Bicycle Rental",2026-06-12 07:48:14.456011+01,2026-06-12 07:48:14.456011+01
e85f642d-e29f-4fd3-a718-d60c609c47e7,53a9e530-d249-464f-aefd-c1ea21d9fdf6,119f376f-cd3a-4983-b560-7a04bd2d438a,es,"El TAUROA Seehotel Grundlsee está situado a orillas del lago y ofrece habitaciones con muebles de madera elegantes y TV de pantalla plana por cable. El hotel alberga un restaurante y un centro de bienestar con vistas panorámicas al lago y a la cordillera de Totes Gebirge.

Las habitaciones disponen de minibar y baño con artículos de aseo y secador de pelo. Algunas gozan de vistas al lago o tienen zona de estar o 1 sofá cama. Hay conexión a internet por cable gratuita en todas las habitaciones.

El restaurante SEEplatz'l sirve especialidades austriacas e internacionales elaboradas con productos locales. El TAUROA Seehotel Grundlsee sirve un desayuno todos los días, que puede tomarse en la habitación o en la terraza con vistas al lago en verano.

El hotel proporciona servicio de masajes y una zona de spa con sauna finlandesa, biosauna y cabina de infrarrojos hecha de madera de pino suizo. La zona de spa está situada en un embarcadero, justo al lado de la zona de playa privada, donde se puede tomar el sol después de bañarse en el lago.

El TAUROA Seehotel Grundlsee organiza excursiones al lago y paseos en barco tradicional de madera.

La estación de esquí de Zlaim está a 2 km y las estaciones de esquí de Altaussee-Loser y Tauplitz se hallan a 15-20 minutos en coche. El campo de golf de 9 hoyos, el Bad Aussee, y los baños termales de Narzissen Bad Aussee quedan a 5 km del hotel. Además, hay aparcamiento privado gratuito.",2026-06-12 07:48:40.304426+01,2026-06-12 07:48:40.304426+01
8dcb17ad-b45d-4362-982b-fbe1e526e876,a4cdd102-fd85-41ca-87c6-1d05c23fa055,93d357f1-d315-4b06-bdd9-b45026f78099,es,"Set against the backdrop of the Totes Gebirge mountains, JUFA Hotel Grundlsee is located directly on the shore of the picturesque Grundlsee lake in the Styrian part of the Salzkammergut. It has a private beach, a sauna, a children’s playground with an Indian tepee, and a sun terrace. Table tennis is available.

The JUFA Grundlsee offers rooms with a bathroom and cable TV. Wi-Fi access is free of charge in public areas.

Cross-country skis, snowshoes and canoes can be rented. A lockable bicycle room and a storage room for diving equipment are available.

A rock-climbing centre with 15 different routes is 20 km away from JUFA Grundlsee. Please know that there is no Bicycle Rental",2026-06-12 07:48:45.332962+01,2026-06-12 07:48:45.333961+01
f5f3335e-85cf-41ba-93fb-a0d7f01bb8b5,0f62461c-e2d5-465d-af46-7d874ab481c7,119f376f-cd3a-4983-b560-7a04bd2d438a,de,"Direkt am Seeufer bietet das TAUROA Seehotel Grundlsee Zimmer mit eleganten Holzmöbeln und einem Flachbild-Kabel-TV. Das Hotel erwartet Sie mit einem Restaurant und einem Wellnessbereich mit Panoramablick auf den See und das Tote Gebirge.

Alle Zimmer verfügen über eine Minibar und ein Badezimmer mit Pflegeprodukten sowie einem Haartrockner. Einige Zimmer liegen zum See oder bieten einen Sitzbereich oder ein Schlafsofa. In allen Zimmern nutzen Sie einen kostenfreien Internetzugang (LAN).

Das hauseigene Restaurant SEEplatz'l serviert Ihnen österreichische und internationale Spezialitäten mit Produkten aus der Region. Das im TAUROA Seehotel Grundlsee täglich servierte Frühstück genießen Sie auf Ihrem Zimmer oder im Sommer auf der Terrasse am See.

Sie können eine Massage buchen oder im Wellnessbereich mit einer finnischen Sauna, einer Bio-Sauna und einer Infrarotkabine aus schweizer Zirbenholz entspannen. Der Wellnessbereich befindet sich auf einem Steg direkt neben dem eigenen Strand, an dem Sie sich nach einem erfrischenden Bad im See sonnen können.

Das TAUROA Seehotel Grundlsee bietet Ausflüge mit traditionellen Holzbooten auf dem See.

Das Skigebiet Zlaim befindet sich 2 km entfernt und die Skigebiete Altaussee-Loser und Tauplitz erreichen Sie in 15 bis 20 Autominuten. Der 9-Loch-Golfplatz Bad Aussee und die Therme Narzissen Bad Aussee liegen beide 5 km vom Hotel entfernt. Kostenfreie Privatparkplätze stehen Ihnen an der Unterkunft zur Verfügung.",2026-06-12 07:48:58.870586+01,2026-06-12 07:48:58.870586+01
b3bb1c04-d331-447a-b993-244335354c86,61cb048d-c332-476e-a9a7-942e495bd50c,93d357f1-d315-4b06-bdd9-b45026f78099,de,"Set against the backdrop of the Totes Gebirge mountains, JUFA Hotel Grundlsee is located directly on the shore of the picturesque Grundlsee lake in the Styrian part of the Salzkammergut. It has a private beach, a sauna, a children’s playground with an Indian tepee, and a sun terrace. Table tennis is available.

The JUFA Grundlsee offers rooms with a bathroom and cable TV. Wi-Fi access is free of charge in public areas.

Cross-country skis, snowshoes and canoes can be rented. A lockable bicycle room and a storage room for diving equipment are available.

A rock-climbing centre with 15 different routes is 20 km away from JUFA Grundlsee. Please know that there is no Bicycle Rental",2026-06-12 07:49:27.151919+01,2026-06-12 07:49:27.151919+01
ae92695b-efc8-4612-ae21-734618127534,120ac606-16ee-44e2-b810-a5b215be43b4,119f376f-cd3a-4983-b560-7a04bd2d438a,en,"Located directly at the shore of the lake, TAUROA Seehotel Grundlsee offers rooms with elegant, wooden furniture and a flat-screen cable TV. The hotel features a restaurant and a wellness area with panoramic views of the lake and the Totes Gebirge Mountain Range.

All rooms are equipped with a minibar and have a bathroom with amenities and a hairdryer. Some rooms face the lake or come with a seating area or a sofa bed. Free wired internet is available in all rooms.

The on-site SEEplatz’l restaurant serves Austrian and international specialities made with local products. TAUROA Seehotel Grundlsee’s daily served breakfast can also be consumed in the rooms or on the lake-facing terrace during summer.

You can request a massage or relax in the spa area consisting of a Finnish sauna, a bio sauna and an infrared cabin made of Swiss stone pine wood. The spa area is located on a jetty, right next to the private beach area, where guests can sunbathe after a refreshing swim in the lake.

For exploring the lake, tours on traditional wooden boats are offered at TAUROA Seehotel Grundlsee.

The Zlaim Ski Area is 2 km away and the ski areas Altaussee-Loser and Tauplitz can be reached within a 15 to 20-minute drive. Bad Aussee, a 9-hole golf course, and the Narzissen Bad Aussee Thermal Baths are all within 5 km from the hotel, and free private parking is possible on site.",2026-06-12 07:47:19.373017+01,2026-06-12 07:47:19.374737+01
ce87c5f5-eb59-4dc2-8656-a2760fe99076,d54267d0-63da-482b-bd12-2105f1424348,cff3ad73-cdf6-4293-a83f-63b063dbcfcb,en,"Hotel Adler*** Garni is 200 metres from the centre of Hirschegg and Heuberg Ski Area in the Kleinwalsertal Valley, and it features a small library and a restaurant with breakfast.

All rooms at the Adler come with satellite TV and a bathroom with bath or shower. Most of the rooms boast a balcony.

The ski bus stops 5 metres away and leaves every 10 minutes. Ski storage and a ski boot dryer and a free hotel safe at the reception are provided.

From 01 May to 03 November, the Bergbahnticket, entitling to free use of the mountain railways in the region, is included.",2026-06-12 07:52:53.686192+01,2026-06-12 07:52:53.687206+01
52c9da88-195e-4f82-bfd2-c93ae26e3f04,3428015e-d0f4-491f-82d3-0d783f1db801,cff3ad73-cdf6-4293-a83f-63b063dbcfcb,de,"Das Hotel Adler Garni *** liegt 200 m vom Zentrum von Hirschegg und dem Skigebiet Heuberg im Kleinwalsertal entfernt und bietet eine kleine Bibliothek und ein Restaurant mit Frühstück.

Alle Zimmer im Adler sind mit Sat-TV und einem Badezimmer mit einer Badewanne oder einer Dusche ausgestattet. Die meisten Zimmer verfügen über einen Balkon.

In 5 m Entfernung hält ein alle 10 Minuten verkehrender Skibus. Ein Skiraum mit einem Skischuhtrockner sowie ein kostenfreier Hotelsafe an der Rezeption tragen zu Ihrem Komfort bei.

Bei Aufenthalten vom 01. Mai bis zum 03. November ist das Bergbahnticket inklusive, das Sie zur kostenfreien Nutzung der regionalen Bergbahnen berechtigt.",2026-06-12 07:54:48.27923+01,2026-06-12 07:54:48.280239+01
e9194041-f55a-4482-aab7-92c482404b71,dcc5143b-fbc5-4eed-a148-603aa5d27e62,47182cbd-7f47-49d3-bfda-f5ad1f04b8cf,es,"The A-ROSA Ifen Hotel Kleinwalsertal in Hirschegg in the Kleinwalsertal offers you air-conditioned rooms with balcony or terrace, a 2,500 m² spa area and free WiFi.
The SPA ROSA offers a large indoor pool, a 25 meter long outdoor infinity pool, a spacious sauna area and 15 treatment rooms.
There is also a children's playroom, 2 function rooms and an underground car park.
The Ifen Hotel has a total of 3 different restaurants including the star restaurant Kilian Stuba.
Walser regional cuisine is served in the Carnozet restaurant, and Theo's restaurant has a show kitchen and a terrace with mountain views. The hotel also offers a lounge and a bar.
The price for the overnight stay including breakfast always includes the Small IFEN Alpine Kitchen.
After breakfast, you can continue to enjoy small delicacies and snacks in various areas of the hotel until late in the afternoon.
The overnight price including breakfast and dinner also includes a 5-course dinner and corresponds to the Great IFEN Alpine Cuisine.
From the beginning of May to the beginning of November you can use the cable cars in the region free of charge.",2026-06-12 07:55:03.936436+01,2026-06-12 07:55:03.937647+01
8a50f2d6-c32b-4d9b-80e9-7f8b4f7c45e9,f4e90d26-0d5a-42dc-a381-ca185d0d803f,cff3ad73-cdf6-4293-a83f-63b063dbcfcb,it,"Situato nella Valle Kleinwalsertal, a 200 m dal centro del comprensorio sciistico di Hirschegg e Heuberg, l'Hotel Adler*** Garni offre una piccola biblioteca e un ristorante con colazione.

Tutte le sistemazioni dell'Adler sono dotate di TV satellitare e bagno con vasca o doccia. La maggior parte delle sistemazioni vanta un balcone.

Lo skibus ferma a 5 metri di distanza e parte ogni 10 minuti. A vostra disposizione un deposito sci con asciuga scarponi e una cassaforte gratuita presso la reception.

Dal 1° maggio al 3 novembre, il Bergbahnticket offre l'uso gratuito delle ferrovie di montagna della regione.",2026-06-12 07:55:16.127219+01,2026-06-12 07:55:16.127219+01
af82e354-bd80-42c2-9b07-b32e54d07b92,3106855d-22c1-453c-a83e-9d2b4f80c914,cff3ad73-cdf6-4293-a83f-63b063dbcfcb,fr,"L'Hotel Adler*** Garni vous accueille à 200 mètres du centre de Hirschegg et du domaine skiable de Heuberg, dans la vallée du Kleinwalsertal. Il dispose d'une petite bibliothèque et d'un restaurant servant le petit-déjeuner.

Toutes les chambres de l'Adler comprennent une télévision par satellite et une salle de bains avec baignoire ou douche. La plupart sont dotées d'un balcon.

Le ski-bus s'arrête à 5 mètres de l'Hotel Adler Garni et part toutes les 10 minutes. Un local à skis, un sèche-chaussures de ski et un coffre-fort gratuit à la réception sont mis à votre disposition.

Du 1er mai au 3 novembre, le Bergbahnticket, qui vous permettra d'emprunter gratuitement les lignes de chemin de fer de montagne dans la région, est inclus.",2026-06-12 07:55:46.984836+01,2026-06-12 07:55:46.984836+01
c5a6980c-e6b2-4700-83d8-3a6b0b7bcaa9,e1788bc0-a115-454e-912c-74ce058ccbe8,47182cbd-7f47-49d3-bfda-f5ad1f04b8cf,de,"Das A-ROSA Ifen Hotel Kleinwalsertal in Hirschegg im Kleinwalsertal bietet Ihnen klimatisierte Zimmer mit Balkon oder Terrasse, einen 2.500 m² großen Spabereich und kostenfreies WLAN.
Das SPA ROSA verfügt über einen großen Innenpool, einen 25 m langen Infinity-Außenpool, einen weitläufigen Saunabereich und 15 Anwendungsräume.
Auch ein Kinderspielzimmer, 2 Veranstaltungsräume und eine Tiefgarage sind vorhanden.
Das Ifen Hotel bietet insgesamt 3 verschiedene Restaurants, darunter das Sternerestaurant Kilian Stuba.
Regionale Walser Küche wird im Restaurant Carnozet serviert. Theo's Restaurant bietet Showküche und eine Terrasse mit Bergblick. Im Hotel gibt es auch eine Lounge und eine Bar.
Im Preis für die Übernachtung inklusive Frühstück ist immer auch die Kleine IFEN Alpenküche inbegriffen.
Nach dem Frühstück können Sie in verschiedenen Bereichen des Hotels weiterhin bis zum späten Nachmittag kleine Delikatessen und Snacks genießen.
Der Übernachtungspreis inklusive Frühstück und Abendessen beinhaltet auch ein 5-Gänge-Abendessen und entspricht der Großen IFEN Alpenküche.
Von Anfang Mai bis Anfang November können Sie die Bergbahnen in der Region kostenlos benutzen.",2026-06-12 07:55:55.198867+01,2026-06-12 07:55:55.199867+01
105ef392-a5fa-4788-853c-b369c20c4972,b11025c4-8a10-4e91-8540-8defd8685208,cff3ad73-cdf6-4293-a83f-63b063dbcfcb,pt,"O Hotel Adler*** Garni fica a 200 metros do centro de Hirschegg e da Área de Esqui Heuberg no Vale Kleinwalsertal, e possui uma pequena biblioteca e um restaurante com pequeno-almoço.

Todos os quartos do Adler incluem televisão por satélite e uma casa de banho com banheira ou chuveiro. A maioria dos quartos possui uma varanda.

O autocarro de esqui pára a 5 metros e parte a cada 10 minutos. Estão disponíveis armazenamento de equipamento de esqui, um secador de botas de esqui e um cofre gratuito na recepção.

De 01 de Maio a 03 de Novembro, o Bergbahnticket, que dá direito a utilizar gratuitamente as linhas ferroviárias da região, está incluído.",2026-06-12 07:56:09.809615+01,2026-06-12 07:56:09.810614+01
37452abf-f384-4233-9411-590612b81c27,688ca2f0-5587-4625-9133-dad8aa49ca00,119f376f-cd3a-4983-b560-7a04bd2d438a,it,"Situato proprio sulla riva del lago, il TAUROA Seehotel Grundlsee vi attende con camere eleganti provviste di mobili in legno e TV via cavo a schermo piatto, un ristorante e un'area benessere con vista panoramica sul lago e sui Monti Totes.

Tutte le sistemazioni vantano un minibar, un bagno con set di cortesia e asciugacapelli, la connessione gratuita a internet via cavo e, in alcuni casi, la vista sul lago, un'area salotto o un divano-letto.

Il ristorante in loco SEEplatz’l serve specialità austriache e internazionali preparate con prodotti locali. Inoltre ogni mattino il TAUROA Seehotel Grundlsee propone una colazione che potrete gustare anche in camera o, in estate, sulla terrazza affacciata sul lago.

Approfittatene per richiedere un massaggio o rilassarvi nell'area benessere fornita di sauna finlandese, sauna bio e cabina a infrarossi costruita con legno di pino cembro. La spa si trova su un molo proprio accanto alla spiaggia privata, dove vale la pena di prendere il sole dopo una nuotata rinfrescante nel lago.

Il TAUROA Seehotel Grundlsee propone gite in tipiche barche di legno per esplorare il lago.

Munita di un parcheggio privato gratuito, la struttura sorge infine a 2 km dal comprensorio stilistico di Zlaim e a circa 15-20 minuti di guida dai comprensori di Altaussee-Loser e Tauplitz. A circa 5 km di distanza troverete infine il campo da golf da 9 buche di Bad Aussee e lo stabilimento termale di Narzissen Bad Aussee.",2026-06-12 07:49:35.938818+01,2026-06-12 07:49:35.938818+01
8f85a4ad-cb8e-42cf-9f20-f4b276775477,da848f75-087d-49f9-82b2-a9cb2256198d,93d357f1-d315-4b06-bdd9-b45026f78099,it,"Set against the backdrop of the Totes Gebirge mountains, JUFA Hotel Grundlsee is located directly on the shore of the picturesque Grundlsee lake in the Styrian part of the Salzkammergut. It has a private beach, a sauna, a children’s playground with an Indian tepee, and a sun terrace. Table tennis is available.

The JUFA Grundlsee offers rooms with a bathroom and cable TV. Wi-Fi access is free of charge in public areas.

Cross-country skis, snowshoes and canoes can be rented. A lockable bicycle room and a storage room for diving equipment are available.

A rock-climbing centre with 15 different routes is 20 km away from JUFA Grundlsee. Please know that there is no Bicycle Rental",2026-06-12 07:49:57.193766+01,2026-06-12 07:49:57.194772+01
ecc3d84a-6e7b-4bd4-adda-7d7bb6096424,584cdeda-099f-41f5-b7d3-bf211af05f7a,119f376f-cd3a-4983-b560-7a04bd2d438a,fr,"Implanté sur la rive du lac, le TAUROA Seehotel Grundlsee propose des logements dotés d'un mobilier en bois élégant et d'une télévision par câble à écran plat. Il dispose d'un restaurant ainsi que d'un espace bien-être offrant une vue panoramique sur le lac et le massif mort.

Toutes les chambres comportent un minibar ainsi qu'une salle de bains pourvue d'un sèche-cheveux et d'articles de toilette. Certaines d'entre elles donnent sur le lac tandis que d'autres comprennent un coin salon ou un canapé-lit. Vous bénéficierez d'une connexion Internet par câble gratuite.

Le SEEplatz'l, le restaurant du TAUROA Seehotel Grundlsee, prépare des spécialités autrichiennes ainsi qu'internationales à base de produits locaux. Le petit-déjeuner y est servi tous les jours. Vous pourrez également le déguster dans votre chambre ou, en été, sur la terrasse surplombant le lac.

Vous aurez la possibilité de profiter d'un massage ou de vous détendre dans l'espace spa équipé d'un sauna finlandais, d'un sauna bio et une cabine infrarouge en bois de pin cembro. Le spa est situé sur une jetée, juste à côté du coin plage privé, où vous aurez l'occasion de prendre un bain de soleil après une baignade rafraîchissante dans le lac.

Le TAUROA Seehotel Grundlsee organise des excursions en bateau traditionnel en bois pour explorer le lac.

Le domaine skiable de Zlaim se trouve à 2 km.  Il vous faudra entre 15 et 20 minutes de route pour rejoindre ceux d'Altaussee-Loser ainsi que de Tauplitz. Le parcours de golf de 9 trous, Bad Aussee, et les thermes de Narzissen Bad Aussee sont à moins de 5 km de l'établissement. Par ailleurs, un parking privé gratuit est présent sur place.",2026-06-12 07:50:36.140749+01,2026-06-12 07:50:36.140749+01
763df6c8-59dc-486f-8cfd-d04b6ff05db8,0ee9cb99-6f16-44fa-81a2-ee3a6fb360ad,93d357f1-d315-4b06-bdd9-b45026f78099,fr,"Set against the backdrop of the Totes Gebirge mountains, JUFA Hotel Grundlsee is located directly on the shore of the picturesque Grundlsee lake in the Styrian part of the Salzkammergut. It has a private beach, a sauna, a children’s playground with an Indian tepee, and a sun terrace. Table tennis is available.

The JUFA Grundlsee offers rooms with a bathroom and cable TV. Wi-Fi access is free of charge in public areas.

Cross-country skis, snowshoes and canoes can be rented. A lockable bicycle room and a storage room for diving equipment are available.

A rock-climbing centre with 15 different routes is 20 km away from JUFA Grundlsee. Please know that there is no Bicycle Rental",2026-06-12 07:50:53.864719+01,2026-06-12 07:50:53.864719+01
9ca59353-330c-499e-afe6-13747a930263,88690860-f175-4d78-ab98-7b49a3393dba,119f376f-cd3a-4983-b560-7a04bd2d438a,pt,"Localizado directamente na margem do lago, o Seehotel Grundlsee apresenta quartos com mobiliário elegante em madeira e uma televisão de ecrã plano por cabo. O hotel dispõe de um restaurante e de uma área de bem-estar com vistas panorâmicas para o lago e para a Cordilheira de Totes Gebirge.

Todos os quartos estão equipados com um mini-bar e uma casa de banho com produtos de higiene pessoal e um secador de cabelo. Alguns quartos estão virados para o lago ou possuem uma área de estar ou um sofá-cama. O acesso gratuito à Internet por cabo está disponível em todos os quartos.

O Restaurante Seeplatz, no local, serve especialidades austríacas e internacionais confeccionadas com produtos locais. O pequeno-almoço diário do Seehotel Grundlsee é servido nos quartos ou no terraço virado para o lago, durante o Verão.

Poderá solicitar uma massagem ou relaxar na área de spa, composta por uma sauna finlandesa, uma bio-sauna e uma cabina de infravermelhos feita em madeira de pinheiro suíço. A área de spa está localizada num cais, ao lado da área de praia privada, onde os hóspedes podem apanhar banhos de sol depois de um mergulho refrescante no lago.

Para explorar o lago, os passeios em barcos de madeira tradicionais são providenciados no Seehotel Grundlsee.

A Área de Esqui Zlaim fica a 2 km e as áreas de esqui Altaussee-Loser e Tauplitz podem ser alcançadas em cerca de 15 a 20 minutos de carro. O hotel encontra-se a cerca de 5 km de Bad Aussee, de um campo de golfe de 9 buracos e dos Banhos Termais Narzissen Bad Aussee, bem como de estacionamento privado gratuito no local.",2026-06-12 07:51:04.429815+01,2026-06-12 07:51:04.430847+01
d37da1cf-2e93-45e7-8d10-8ad27a172b58,3de69c9d-6dd5-4109-92fe-1b340bcb2c7c,47182cbd-7f47-49d3-bfda-f5ad1f04b8cf,en,"The A-ROSA Ifen Hotel Kleinwalsertal in Hirschegg in the Kleinwalsertal offers you air-conditioned rooms with balcony or terrace, a 2,500 m² spa area and free WiFi.
The SPA ROSA offers a large indoor pool, a 25 meter long outdoor infinity pool, a spacious sauna area and 15 treatment rooms.
There is also a children's playroom, 2 function rooms and an underground car park.
The Ifen Hotel has a total of 3 different restaurants including the star restaurant Kilian Stuba.
Walser regional cuisine is served in the Carnozet restaurant, and Theo's restaurant has a show kitchen and a terrace with mountain views. The hotel also offers a lounge and a bar.
The price for the overnight stay including breakfast always includes the Small IFEN Alpine Kitchen.
After breakfast, you can continue to enjoy small delicacies and snacks in various areas of the hotel until late in the afternoon.
The overnight price including breakfast and dinner also includes a 5-course dinner and corresponds to the Great IFEN Alpine Cuisine.
From the beginning of May to the beginning of November you can use the cable cars in the region free of charge.",2026-06-12 07:53:56.027275+01,2026-06-12 07:53:56.028272+01
