id,hotel_id,url_id,language,description,created_at,updated_at
7fa0e8c3-f7fb-4578-950a-5407a06797a3,23ef0414-c61f-4d47-b022-9e7a04c8c53a,a4197450-6bcf-416e-a429-fadb83fa8e54,pt,"Situated directly at the Red Bull Ring in Spielberg bei Knittelfeld, TAUROA Schönberghof Spielberg features an à-la-carte restaurant and free Wi-Fi in the entire building. You can park your car for free on site.

Our stylish rooms are partially air-conditioned and feature a flat-screen TV with satellite channels. Each room includes a modern bathroom with a hairdryer and complimentary toiletries.

A buffet breakfast can be enjoyed every morning and the restaurant of TAUROA Schönberghof Spielberg serves typical Styrian specialities and international cuisine.

There is a large terrace overlooking the circuit and a playground for the children.

Around the TAUROA Schönberghof Spielberg/Enzingerhof there are a variety of activities with and without motor, invigorating and relaxing, indoors and outdoors - the surrounding, diverse nature of the Murtal offers all this, as does the immediately adjacent Red Bull Ring and the nearby AQUALUX Therme Fohnsdorf.",2026-05-02 03:46:09.279196+01,2026-05-02 03:46:09.279947+01
76a5a720-85f6-433e-b346-17ce60c48991,e44007c4-c788-4846-8c4b-60e59090d539,8952b65d-b67f-49d9-b07e-af50adcc6481,fr,"Hotel B&B Graz-Hbf enjoys a central location only a 3-minute walk from Graz Main Train Station and a 10-minute walk from the Old Town and the Kunsthaus. It offers rooms facing the street and rooms facing the park, free WiFi.
All of the stylish rooms at Hotel B&B Graz-Hbf have a private bathroom and a flat-screen TV.

A breakfast buffet is available in the on-site breakfast café.",2026-05-02 03:46:33.529484+01,2026-05-02 03:46:33.530106+01
3dece47b-ffd6-45a6-b7c0-f762baeaff6e,787bab99-a9b3-441b-b6d1-610947bb1885,703a3720-1be1-4af4-b485-c62e1a978aa8,de,"Die Unterkunft Almwelt Austria, die in Schladming, 20 km von Dachstein Skywalk entfernt gelegen ist, verfügt über Übernachtungsmöglichkeiten mit einem Garten, einem kostenlosen Privatparkplatz, einer Terrasse und einem Restaurant. Die Unterkunft bietet eine Skipass-Verkaufsstelle und einen direkten Zugang zur Skipiste sowie eine Bar und ein Spa- und Wellnesscenter. Dieses Hotel verfügt über kostenloses WLAN in der ganzen Unterkunft – außerdem bietet diese allergikerfreundliche Unterkunft eine Sauna und einen Nachtclub.

Alle Gästezimmer in der Unterkunft Almwelt Austria sind eingerichtet mit einem Flachbild-TV mit Kabelkanälen und einem Safe. Es gibt ein eigenes Badezimmer mit einer Dusche und kostenlosen Pflegeprodukten – einige Zimmer bieten den Gästen in der Unterkunft Almwelt Austria außerdem Stadtblick. Die Wohneinheiten haben einen Kleiderschrank.

Ein Frühstück wird angeboten und enthält als Buffet angebotene, kontinentale und vegetarische Optionen.

Die Unterkunft Almwelt Austria bietet ein türkisches Dampfbad. Sie können an diesem Hotel mit 4 Sternen Tischtennis spielen. Die Gegend ist beliebt zum Wandern und Skifahren.

Bahnhof Bischofshofen liegt 45 km von der Unterkunft Almwelt Austria entfernt, während Paul-Ausserleitner-Schanze 46 km von der Unterkunft entfernt ist. Der nächstgelegene Flughafen ist der Flughafen Salzburg, 90 km von der Unterkunft Almwelt Austria entfernt.",2026-05-02 03:51:09.134301+01,2026-05-02 03:51:09.13566+01
45499eff-10ca-4c0c-aceb-236c36414c81,728b541a-a6c9-4be9-bd08-9fee413fd2b4,a4197450-6bcf-416e-a429-fadb83fa8e54,it,"Situated directly at the Red Bull Ring in Spielberg bei Knittelfeld, TAUROA Schönberghof Spielberg features an à-la-carte restaurant and free Wi-Fi in the entire building. You can park your car for free on site.

Our stylish rooms are partially air-conditioned and feature a flat-screen TV with satellite channels. Each room includes a modern bathroom with a hairdryer and complimentary toiletries.

A buffet breakfast can be enjoyed every morning and the restaurant of TAUROA Schönberghof Spielberg serves typical Styrian specialities and international cuisine.

There is a large terrace overlooking the circuit and a playground for the children.

Around the TAUROA Schönberghof Spielberg/Enzingerhof there are a variety of activities with and without motor, invigorating and relaxing, indoors and outdoors - the surrounding, diverse nature of the Murtal offers all this, as does the immediately adjacent Red Bull Ring and the nearby AQUALUX Therme Fohnsdorf.",2026-05-02 03:44:34.026474+01,2026-05-02 03:44:34.027225+01
bc63abcd-f128-4ed8-8703-1c9063d82f92,642b63bd-8323-41c2-a201-652c972618f3,8952b65d-b67f-49d9-b07e-af50adcc6481,pt,"Hotel B&B Graz-Hbf enjoys a central location only a 3-minute walk from Graz Main Train Station and a 10-minute walk from the Old Town and the Kunsthaus. It offers rooms facing the street and rooms facing the park, free WiFi.
All of the stylish rooms at Hotel B&B Graz-Hbf have a private bathroom and a flat-screen TV.

A breakfast buffet is available in the on-site breakfast café.",2026-05-02 03:47:35.767253+01,2026-05-02 03:47:35.767953+01
01c9f611-32ce-446b-a682-cab37473b0cb,44144424-1ff8-46a7-8191-06d0d2bdfc9a,15e922aa-310b-4f52-9164-ee98489298bb,it,"Dotato della connessione WiFi gratuita e di una piscina coperta, l'albergo di design a 4 stelle Hotel Süd art gode di una posizione tranquilla a sud di Graz e a soli 20 minuti d'auto dal centro storico.

Provviste in alcuni casi dell'aria condizionata e di una cassaforte per computer portatile, le camere sono state rinnovate assieme ai bagni nel 2009 e nel 2010, e dispongono di scrivania, minibar e TV satellitare.

Le sistemazioni dell'Hotel Süd art includono degli accappatoi senza costi aggiuntivi, mentre l'area benessere ad uso gratuito comprende una sauna, una cabina a infrarossi e una sala fitness.

Ubicato a meno di 8 minuti di cammino da 4 diversi ristoranti, questo bed & breakfast ospita un bar con varie bevande, aperto fino alle 22:00, serve una ricca e variegata colazione giornaliera a buffet e prepara pranzi al sacco, utili se uscite di mattina presto.

Potrete usufruire dei posti auto pubblici gratuiti attorno all'hotel o utilizzare un parcheggio sotterraneo privato, soggetto a un supplemento. Inoltre, l'albergo vanta anche una stazione di ricarica per le auto elettriche.

L'Hotel Süd art sorge a 7 km dall'Aeroporto di Graz e a soli 2 km dalle uscite auostradali di Webling e Seiersberg, dove troverete 2 grandi centri commerciali.

In 2 minuti a piedi raggiungerete la fermata dell'autobus più vicina per il centro storico, distante 5 km.",2026-05-02 03:51:36.570873+01,2026-05-02 03:51:36.571751+01
e47f8bce-1f3e-4d3d-b626-1f27e20b056b,83a722d8-d5e5-4e3c-b420-101a483d31f8,9f972804-4a63-4cc9-9f40-db311df83f61,en,"Located in Ehrenhausen on the Mur River, the Georgi Schloss - Boutique Hotel is a 19th-century palace built in Tudor style. It offers suites in different buildings.

The Georgi Schloss’s large and elegant suites have wooden floors, a flat-screen satellite TV, a minibar, and a stylish bathroom with a hairdryer.

Guests benefit from free WiFi in public areas. A buffet breakfast is served every morning including local specialities and freshly prepared egg dishes. Several traditional restaurants are withing walking distance.

Free private parking is available on site. E-Bikes can be rented for €39 per day. Ehrenhausen is the starting point of the South Styrian Wine Road, and many restaurants and wine taverns are nearby. The property offers discounts on shuttle services to various winegrowers in the surrounding area.",2026-05-02 03:54:56.557465+01,2026-05-02 03:54:56.558213+01
2e5a1c04-09ee-454f-877b-1f9c7771fcce,4a4da2ff-0b79-4f4d-ba78-71be13843f80,9f972804-4a63-4cc9-9f40-db311df83f61,de,"Das Georgi Schloss - Boutique Hotel begrüßt Sie in Ehrenhausen an der Mur in einem im Tudor-Stil erbauten Palast aus dem 19. Jahrhundert. Es bietet Suiten in verschiedenen Gebäuden.

Die großen und eleganten Suiten im Georgi Schloss verfügen über Holzböden, einen Flachbild-Sat-TV, eine Minibar und ein stilvolles Bad mit einem Haartrockner.

WLAN nutzen Sie in den öffentlichen Bereichen kostenfrei. Ein Frühstücksbuffet mit regionalen Spezialitäten und frisch zubereiteten Eierspeisen wird jeden Morgen serviert. Mehrere traditionelle Restaurants erreichen Sie bequem zu Fuß.

Die Privatparkplätze an der Unterkunft nutzen Sie kostenfrei. E-Bikes können für 39 € pro Tag gemietet werden. Ehrenhausen ist der Ausgangspunkt der Südsteirischen Weinstraße und viele Restaurants und Weinstuben befinden sich in der Nähe. Die Unterkunft bietet Ermäßigungen auf den Shuttleservice zu verschiedenen Winzern in der Umgebung.",2026-05-02 03:58:00.530567+01,2026-05-02 03:58:00.532369+01
f25e2ad4-33c2-43ca-9f68-4e8daaaf1466,3564674d-348d-4f32-93a5-701980e6ad94,068ef1ef-490e-42d1-8954-8a4eb13d1a9a,en,"Featuring 1 restaurants and a terrace with views of the Kleinwalsertal Valley, this hotel offers spacious rooms with a balcony. Leisure facilities include an indoor pool, sauna.

All rooms at the Suitehotel Kleinwalsertal are decorated in bright tones and feature a flat-screen LCD TV with satellite channels, a fridge, and a modern private bathroom.

Guests can enjoy international and Austrian cuisine. Vegetarian dishes are available as well at the restaurants.

Guests can unwind to the fullest in the spa area and relaxation room. The outdoor terrace offers some fresh air afterwards.

The Hubertus Ski Lift is in the immediate vicinity of the Suitehotel Kleinwalsertal. Furthermore, the hotel is just 75 metres from the village’s ski school and only 100 metres from the ski bus to Kleinwalsertal.",2026-05-02 04:30:25.334598+01,2026-05-02 04:30:25.335117+01
7b55624a-af36-4100-a84c-021d30c0f97a,18e0bfa0-1f38-4c34-9779-146181a9f812,068ef1ef-490e-42d1-8954-8a4eb13d1a9a,es,"Featuring 1 restaurants and a terrace with views of the Kleinwalsertal Valley, this hotel offers spacious rooms with a balcony. Leisure facilities include an indoor pool, sauna.

All rooms at the Suitehotel Kleinwalsertal are decorated in bright tones and feature a flat-screen LCD TV with satellite channels, a fridge, and a modern private bathroom.

Guests can enjoy international and Austrian cuisine. Vegetarian dishes are available as well at the restaurants.

Guests can unwind to the fullest in the spa area and relaxation room. The outdoor terrace offers some fresh air afterwards.

The Hubertus Ski Lift is in the immediate vicinity of the Suitehotel Kleinwalsertal. Furthermore, the hotel is just 75 metres from the village’s ski school and only 100 metres from the ski bus to Kleinwalsertal.",2026-05-02 04:32:22.946254+01,2026-05-02 04:32:22.947427+01
d87d1095-bf88-4a37-be15-98f2909895e7,0850730d-bc9f-47df-bcfe-c777d16a7436,35dea577-fe44-401e-860a-a4b4948d939f,fr,"L'Hotel Kiwano est situé à Feldkirchen, à 10 minutes de route de Graz et à seulement 1 minute de l'aéroport de Graz ainsi que des autoroutes A2 et A9. Le restaurant dispose d'une terrasse bien exposée et sert des plats japonais. Une connexion Wi-Fi est disponible gratuitement dans les parties communes.

Les chambres du Kiwano Hotel & Restaurant disposent d'un coin salon, d'une télévision par câble et d'une salle de bains avec articles de toilette et sèche-cheveux. Certaines possèdent un balcon.

Un parking privé est disponible gratuitement sur place. Le centre commercial Seiersberg ainsi que le supermarché Kiwano Asia et le Schwarzl Freiheitszentrum avec ses piscines sont accessibles en respectivement 2 et 5 minutes de route.

Une piste cyclable à côté de la rivière Mur, qui mène au centre de Graz, se trouve à proximité du Kiwano.",2026-05-02 04:34:56.282256+01,2026-05-02 04:34:56.283061+01
6070c772-1faf-45d2-a38d-57d9940192ec,97be07c9-7705-45a1-ba26-75c86f656644,a4197450-6bcf-416e-a429-fadb83fa8e54,fr,"Situated directly at the Red Bull Ring in Spielberg bei Knittelfeld, TAUROA Schönberghof Spielberg features an à-la-carte restaurant and free Wi-Fi in the entire building. You can park your car for free on site.

Our stylish rooms are partially air-conditioned and feature a flat-screen TV with satellite channels. Each room includes a modern bathroom with a hairdryer and complimentary toiletries.

A buffet breakfast can be enjoyed every morning and the restaurant of TAUROA Schönberghof Spielberg serves typical Styrian specialities and international cuisine.

There is a large terrace overlooking the circuit and a playground for the children.

Around the TAUROA Schönberghof Spielberg/Enzingerhof there are a variety of activities with and without motor, invigorating and relaxing, indoors and outdoors - the surrounding, diverse nature of the Murtal offers all this, as does the immediately adjacent Red Bull Ring and the nearby AQUALUX Therme Fohnsdorf.",2026-05-02 03:45:19.17442+01,2026-05-02 03:45:19.174971+01
83ffc38e-4316-493e-a1b3-1f449e700f6f,839ec56e-b6d1-40ff-a351-f56814b2acb8,15e922aa-310b-4f52-9164-ee98489298bb,es,"Este hotel de diseño de 4 estrellas dispone de una ubicación tranquila en el sur de Graz, a escasos 20 minutos en coche del centro histórico. El Hotel Süd art ofrece conexión WiFi gratuita y piscina cubierta.

Las habitaciones están equipadas con escritorio, minibar y TV vía satélite. Todos los baños y habitaciones se reformaron en 2009 y 2010. Algunas habitaciones disponen de aire acondicionado y de caja fuerte para ordenador portátil.

La zona de spa, de uso gratuito, cuenta con sauna, cabina de infrarrojos y sala de fitness. Las habitaciones del Hotel Süd art incluyen albornoces gratuitos.

Todas las mañanas se sirve un completo desayuno buffet. También es posible encargar almuerzos para llevar a primera hora de la mañana. En el bar podrá disfrutar de diversas bebidas hasta las 22:00. Además, a 8 minutos a pie de este bed and breakfast encontrará 4 restaurantes.

El aparcamiento subterráneo privado del hotel está disponible por un suplemento y en las inmediaciones hay plazas de aparcamiento público gratuitas. El hotel también dispone de un punto de recarga para vehículos eléctricos.

El Hotel Süd art está a escasos 2 km de las salidas Webling y Seiersberg de la autopista. Junto a estas salidas hay 2 grandes centros comerciales. El aeropuerto de Graz se encuentra a 7 km.

La parada de autobús más cercana, situada a 2 minutos a pie, enlaza con el centro histórico, que dista 5 km.",2026-05-02 03:49:47.185184+01,2026-05-02 03:49:47.185881+01
f3dfefdd-2bf0-4140-9be5-ca9df491c95f,4928bbbb-113e-4b7a-a51e-99682db12e4a,703a3720-1be1-4af4-b485-c62e1a978aa8,it,"Ubicato a Schladming, a 20 km da Dachstein Skywalk, Almwelt Austria propone un giardino, un parcheggio privato gratuito, una terrazza e un ristorante. La struttura prevede un punto vendita di skipass e l’accesso diretto alle piste, oltre a un bar e un centro spa e benessere. Completo di il WiFi gratuito in tutta la struttura, questo hotel senza allergeni offre sauna e discoteca.

Presso questo hotel, le camere includono un armadio. Ogni camera dispone di un bagno privato completo di doccia e set di cortesia, mentre alcune camere includono una cucina con un frigorifero. Tutte le camere presso Almwelt Austria prevedono una TV a schermo piatto con canali via cavo e una cassaforte.

A colazione troverete opzioni a buffet, continentali o vegetariane.

Questa struttura offre un bagno turco. Potrete giocare a ping pong presso questo hotel a 4 stelle, mentre la zona è famosa per attività quali l’escursionismo e lo sci.

Stazione Ferroviaria di Bischofshofen è a 45 km da Almwelt Austria, mentre Paul-Ausserleitner-Schanze si trova a 46 km dalla struttura. Aeroporto di Salisburgo - W. A. Mozart si trova a 90 km di distanza.",2026-05-02 03:51:51.455697+01,2026-05-02 03:51:51.456194+01
2a32c7d7-7e66-42b7-8d0c-9a56460c0201,60463061-8416-4b78-a842-fcb289842f8a,9f972804-4a63-4cc9-9f40-db311df83f61,it,"Situato a Ehrenhausen sul fiume Mur, il Georgi Schloss - Boutique Hotel occupa un palazzo ottocentesco costruito in stile Tudor. Offre suite in diversi edifici.

Le ampie ed eleganti suite del Georgi Schloss dispongono di pavimenti in legno, TV satellitare a schermo piatto, minibar ed elegante bagno con asciugacapelli.

Il WiFi è fruibile gratuitamente nelle aree comuni. Ogni mattina vi attende una colazione a buffet con specialità locali e piatti a base di uova preparati al momento. A pochi passi troverete diversi ristoranti tradizionali.

Il parcheggio privato è gratuito. Le biciclette elettriche possono essere noleggiate al costo di EUR 39 al giorno. Ehrenhausen rappresenta il punto di partenza della Strada del Vino della Stiria meridionale e nelle vicinanze troverete numerosi ristoranti e taverne. La struttura offre sconti sui servizi navetta per vari viticoltori nella zona circostante.",2026-05-02 03:59:09.582862+01,2026-05-02 03:59:09.58346+01
7b9ab0f4-106a-4b96-8bfe-edf49c39f854,82ca175a-6432-44b1-9ff5-0ac98eb6359d,9f972804-4a63-4cc9-9f40-db311df83f61,pt,"Localizado em Ehrenhausen, no Rio Mur, o Georgi Schloss - Boutique Hotel é um palácio do século XIX construído em estilo Tudor. Dispõe de suites em edifícios diferentes.

As amplas e elegantes suites do Georgi Schloss têm pisos em madeira, uma televisão de ecrã plano por satélite, um mini-bar e uma elegante casa de banho com um secador de cabelo.

Os hóspedes beneficiam de acesso Wi-Fi gratuito nas áreas públicas. Um buffet de pequeno-almoço é servido todas as manhãs, incluindo especialidades locais e pratos de ovos preparados na hora. Existem vários restaurantes tradicionais a uma curta caminhada.

Está disponível estacionamento privado gratuito no local. Podem ser alugadas E-Bikes por EUR 39 por dia. Ehrenhausen é o ponto de partida da Rota do Vinho do Sul da Estíria, e existem muitos restaurantes e tabernas de vinho nas proximidades. A propriedade providencia descontos em serviços de transporte para vários vinicultores na área circundante.",2026-05-02 04:01:43.589897+01,2026-05-02 04:01:43.590591+01
f3df762e-d231-4efd-8ca0-600f8ac86a4d,304f3590-ef9e-45cd-8958-f06d39aeb556,703a3720-1be1-4af4-b485-c62e1a978aa8,fr,"L’établissement Almwelt Austria vous accueille à Schladming, à 20 km de ce lieu d’intérêt : Dachstein Skywalk. Il comprend un jardin, une terrasse, un restaurant et un parking privé gratuit. Il propose un point de vente de forfaits de ski, un accès skis aux pieds, un bar et un spa et centre de bien-être. Cet hôtel pour les personnes souffrant d'allergies possède une connexion Wi-Fi gratuite dans l’ensemble de ses locaux, un sauna et une discothèque.

Les hébergements possèdent une armoire. Vous bénéficierez d'une salle de bains privative possédant une douche et des articles de toilette gratuits. Certains hébergements possèdent également une cuisine équipée d’un réfrigérateur. Vous profiterez d'une télévision à écran plat avec les chaînes du câble et d’un coffre-fort.

Un petit-déjeuner buffet, continental ou végétarien est servi sur place.

L’établissement Almwelt Austria dispose d’un hammam. Vous pourrez jouer au ping-pong dans cet hôtel 4 étoiles, et la région est prisée des amateurs de randonnée et de ski.

Vous séjournerez à respectivement 45 km et 46 km de ces lieux d’intérêt : Gare de Bischofshofen et Paul-Ausserleitner-Schanze. L'aéroport le plus proche (Aéroport Wolfgang Amadeus Mozart de Salzbourg) est à 90 km.",2026-05-02 03:53:16.117877+01,2026-05-02 03:53:16.118623+01
ba63f162-c4c5-4f65-b7be-0bd8feaf5fe2,f44de098-ae06-41f7-a264-0bf158f17ebf,15e922aa-310b-4f52-9164-ee98489298bb,pt,"Este design hotel de 4 estrelas goza de uma localização tranquila, no Sul de Graz, apenas a 20 minutos de carro da cidade velha. O Hotel Süd art dispõe de acesso Wi-Fi gratuito e de uma piscina interior.

Os quartos estão equipados com uma secretária, um mini-bar e televisão por satélite. Todos os quartos e casas de banho foram renovados em 2009 e 2010. Alguns quartos têm ar condicionado e um cofre para computador portátil.

A área de spa pode ser utilizada de forma gratuita e inclui uma sauna, uma cabina de infravermelhos e uma sala de fitness. São fornecidos roupões de banho gratuitos em todos os quartos do Hotel Süd art.

Todas as manhãs é servido um rico e variado buffet de pequeno-almoço. São providenciados almoços embalados para os hóspedes que partam no início da manhã. Estão disponíveis várias bebidas no bar, que está aberto até às 22:00h. A cerca de 8 minutos a pé deste hotel de acomodação e pequeno-almoço existem 4 restaurantes diferentes.

É possível utilizar um parque de estacionamento subterrâneo privado, por um custo adicional. Estão disponíveis espaços de estacionamento público gratuitos em redor do hotel. O hotel dispõe ainda de uma estação de carga para carros eléctricos.

O Hotel Süd art fica apenas a 2 km das saídas da Auto-estrada Webling e Seiersberg. Nestas saídas é possível encontrar 2 grandes centros comerciais. O Aeroporto de Graz situa-se a 7 km.

A paragem de autocarro mais próxima, com ligação à cidade velha que fica a 5 km, está a 2 minutos a pé.",2026-05-02 03:53:45.318625+01,2026-05-02 03:53:45.319128+01
902f23ac-646d-49f0-8e48-22ea0856b896,693761d2-3e42-454a-ae21-da4fa40e834c,703a3720-1be1-4af4-b485-c62e1a978aa8,pt,"Almwelt Austria encontra-se em Schladming, a 20 km de Dachstein Skywalk, e apresenta acomodações com um jardim, estacionamento privado gratuito, um terraço e um restaurante. O alojamento fornece um ponto de venda de passes de esqui e acesso imediato às pistas de esqui, assim como um bar e um spa e centro de bem-estar. Este hotel antialérgico providencia acesso Wi-Fi gratuito em toda a propriedade, sauna e discoteca.

No alojamento, os quartos incluem roupeiro. Cada quarto tem uma casa de banho privativa dispondo de chuveiro e produtos de higiene pessoal gratuitos, enquanto alguns quartos incluem uma cozinha com um frigorífico. Todos os quartos do alojamento dispõem de televisão de ecrã plano com canais por cabo e cofre.

São oferecidas opções de pequeno-almoço buffet, continental e vegetariano.

Almwelt Austria possui um banho turco. Pode jogar ténis de mesa neste hotel de 4 estrelas, e a área é popular para caminhadas e esqui.

Estação Ferroviária de Bischofshofen fica a 45 km de Almwelt Austria, enquanto Saltos de Esqui Paul-Ausserleitner-Schanze está a 46 km da propriedade. O Aeroporto de Salzburgo - W. A. Mozart fica a 90 km de distância.",2026-05-02 03:54:03.534975+01,2026-05-02 03:54:03.535639+01
1359d58c-5931-4c89-9271-e0d961ccc572,fa2afcdc-afac-4ce0-81ba-8693d27c7b60,9f972804-4a63-4cc9-9f40-db311df83f61,es,"El Georgi Schloss - Boutique Hotel, situado junto al río Mur en Ehrenhausen, es un palacio del siglo XIX construido en estilo Tudor. Ofrece suites en diferentes edificios.

Las suites del Georgi Schloss son amplias y elegantes. Todas incluyen suelo de madera, TV vía satélite de pantalla plana, minibar y baño elegante con secador de pelo.

Hay conexión Wi-Fi gratuita en las zonas comunes. Todas las mañanas se sirve un desayuno bufé que incluye especialidades locales y platos de huevos recién preparados. A poca distancia a pie hay varios restaurantes tradicionales.

Hay aparcamiento privado gratuito. Las bicicletas eléctricas se pueden alquilar por EUR 39 al día. Ehrenhausen es el punto de partida de la ruta del vino del sur de Estiria y está cerca de muchos restaurantes y tabernas de vino. El establecimiento ofrece descuentos en servicios de traslado a varios viticultores de los alrededores.",2026-05-02 03:56:58.358044+01,2026-05-02 03:56:58.358558+01
460f2a70-75f7-47c0-9772-8bfc631b309b,541b6256-d4e2-4db6-b07a-28bc4b85c643,9f972804-4a63-4cc9-9f40-db311df83f61,fr,"Situé à Ehrenhausen, sur la rivière Mur, le Georgi Schloss - Boutique Hotel occupe un palais du XIXe siècle construit dans le style Tudor. Il propose des suites dans différents bâtiments.

Les suites spacieuses et élégantes du Georgi Schloss sont dotées de parquet, d'une télévision par satellite à écran plat, d'un minibar et d'une élégante salle de bains avec sèche-cheveux.

Vous bénéficierez d'une connexion Wi-Fi gratuite dans les parties communes. Un petit-déjeuner buffet composé de spécialités locales et de plats à base d'œufs fraîchement préparés est servi chaque matin. Plusieurs restaurants traditionnels sont accessibles à pied.

Un parking privé est disponible gratuitement sur place. Vous pourrez louer des vélos électriques moyennant 39 EUR par jour. Ehrenhausen est le point de départ de la route des vins du sud de la Styrie. Vous trouverez de nombreux restaurants et tavernes à proximité. L'établissement propose des réductions sur les services de navette pour divers viticulteurs des environs.",2026-05-02 04:00:31.692831+01,2026-05-02 04:00:31.694089+01
