id,hotel_id,url_id,language,policy_name,policy_details,created_at
459,07024d7f-59ba-492a-a024-3d5364dd3b86,771c5564-458e-40fb-be86-7066a3bda9e9,de,Haustiere,Haustiere sind auf Anfrage gestattet. Möglicherweise fallen Gebühren an.,2026-04-08 07:50:48.557061+01
460,07024d7f-59ba-492a-a024-3d5364dd3b86,771c5564-458e-40fb-be86-7066a3bda9e9,de,Gruppen,Bei einer Buchung von mehr als 2 Zimmern können abweichende Richtlinien und zusätzliche Aufpreise gelten.,2026-04-08 07:50:48.558474+01
461,07024d7f-59ba-492a-a024-3d5364dd3b86,771c5564-458e-40fb-be86-7066a3bda9e9,de,In dieser Unterkunft werden folgende Karten akzeptiert,Barzahlung nicht akzeptiert,2026-04-08 07:50:48.559875+01
462,07024d7f-59ba-492a-a024-3d5364dd3b86,771c5564-458e-40fb-be86-7066a3bda9e9,de,Partys,Partys/Veranstaltungen sind nicht erlaubt.,2026-04-08 07:50:48.561277+01
463,6e6ddc6f-0c42-409b-a2f5-c3227e2faa23,c1c45a0d-d962-4976-b2ca-8d22009dba1b,pt,Check-in,Das 15:00 às 00:00,2026-04-08 07:51:05.616302+01
464,6e6ddc6f-0c42-409b-a2f5-c3227e2faa23,c1c45a0d-d962-4976-b2ca-8d22009dba1b,pt,Check-out,Das 04:00 às 11:00,2026-04-08 07:51:05.618351+01
465,6e6ddc6f-0c42-409b-a2f5-c3227e2faa23,c1c45a0d-d962-4976-b2ca-8d22009dba1b,pt,Cancelamento/ pré-pagamento,"As condições de cancelamento e de pré-pagamento variam consoante o tipo de alojamento. Por favor, insira as datas da sua estadia e verifique as condições da opção que selecionou.",2026-04-08 07:51:05.619575+01
466,6e6ddc6f-0c42-409b-a2f5-c3227e2faa23,c1c45a0d-d962-4976-b2ca-8d22009dba1b,pt,Caução reembolsável,"É exigida uma caução de € 100 no momento da chegada. A caução será cobrada como um pagamento em numerário. O reembolso deverá ser feito durante o check-out. A sua caução será reembolsada na totalidade em numerário, após uma inspeção ao alojamento.",2026-04-08 07:51:05.620763+01
467,6e6ddc6f-0c42-409b-a2f5-c3227e2faa23,c1c45a0d-d962-4976-b2ca-8d22009dba1b,pt,Crianças e camas,"Condições de crianças Todas as crianças são bem-vindas. Para ver os preços corretos e a informação sobre a ocupação, por favor, adicione à sua pesquisa o número de crianças no seu grupo e as respetivas idades. Condições de berços e camas extra 0 - 3 anos Berço mediante pedido Gratuito 4 - 11 anos Cama extra mediante pedido € 38,65 por criança, por noite Mais de 12 anos Cama extra mediante pedido € 77,29 por pessoa, por noite Os preços para berços e camas extra não estão incluídos no preço total e têm se ser pagos separadamente durante a sua estadia. O número permitido de camas extra e de berços está dependente da opção que escolher. Por favor, verifique a sua opção selecionada para mais informações. Todos os berços e camas extra estão sujeitos a disponibilidade. Condições de crianças Condições de berços e camas extra Todas as crianças são bem-vindas. Para ver os preços corretos e a informação sobre a ocupação, por favor, adicione à sua pesquisa o número de crianças no seu grupo e as respetivas idades. Os preços para berços e camas extra não estão incluídos no preço total e têm se ser pagos separadamente durante a sua estadia. O número permitido de camas extra e de berços está dependente da opção que escolher. Por favor, verifique a sua opção selecionada para mais informações. Todos os berços e camas extra estão sujeitos a disponibilidade.",2026-04-08 07:51:05.621894+01
468,6e6ddc6f-0c42-409b-a2f5-c3227e2faa23,c1c45a0d-d962-4976-b2ca-8d22009dba1b,pt,Sem restrições de idade,Não há restrições de idade para fazer check-in,2026-04-08 07:51:05.623073+01
469,6e6ddc6f-0c42-409b-a2f5-c3227e2faa23,c1c45a0d-d962-4976-b2ca-8d22009dba1b,pt,Animais de estimação,Animais de estimação: não admitidos.,2026-04-08 07:51:05.624223+01
470,6e6ddc6f-0c42-409b-a2f5-c3227e2faa23,c1c45a0d-d962-4976-b2ca-8d22009dba1b,pt,Cartões aceites pelo alojamento,Não aceita dinheiro,2026-04-08 07:51:05.625364+01
471,6e6ddc6f-0c42-409b-a2f5-c3227e2faa23,c1c45a0d-d962-4976-b2ca-8d22009dba1b,pt,Festas,Não é permitido realizar festas/eventos,2026-04-08 07:51:05.626768+01
472,79fcbed4-2051-4b7b-9c57-720ec8a63975,771c5564-458e-40fb-be86-7066a3bda9e9,it,Arrivo,Dalle 14:00 alle 00:00 Dovrai comunicare in anticipo alla struttura il tuo orario di arrivo.,2026-04-08 07:51:46.265534+01
473,79fcbed4-2051-4b7b-9c57-720ec8a63975,771c5564-458e-40fb-be86-7066a3bda9e9,it,Partenza,Dalle 06:00 alle 12:00,2026-04-08 07:51:46.266808+01
474,79fcbed4-2051-4b7b-9c57-720ec8a63975,771c5564-458e-40fb-be86-7066a3bda9e9,it,Cancellazione / Pagamento anticipato,Le condizioni relative alla cancellazione e al pagamento anticipato variano a seconda della tipologia di alloggio. Inserisci le date del soggiorno e verifica le condizioni dell'opzione scelta.,2026-04-08 07:51:46.267989+01
475,79fcbed4-2051-4b7b-9c57-720ec8a63975,771c5564-458e-40fb-be86-7066a3bda9e9,it,Bambini e letti,"Condizioni per i bambini I bambini di tutte le età sono i benvenuti. I bambini di 17 anni o più pagheranno quanto gli adulti presso questa struttura. Per vedere informazioni corrette relativamente a prezzi e occupazione, aggiungi alla ricerca il numero e l'età dei bambini che soggiorneranno. Condizioni per culle e letti aggiuntivi 0 - 3 anni Culla sempre disponibile Gratis 4 - 12 anni Letto supplementare su richiesta € 210 per bambino, a notte 13 anni e oltre Letto supplementare su richiesta € 380 per persona, a notte Il prezzo delle culle e dei letti supplementari non è incluso nell'importo totale e dovrà essere pagato separatamente durante il soggiorno. Il numero di culle e letti supplementari ammessi dipende dall'opzione che scegli. Controlla quella che hai selezionato per maggiori informazioni. I letti extra sono soggetti a disponibilità. Condizioni per i bambini Condizioni per culle e letti aggiuntivi I bambini di tutte le età sono i benvenuti. I bambini di 17 anni o più pagheranno quanto gli adulti presso questa struttura. Per vedere informazioni corrette relativamente a prezzi e occupazione, aggiungi alla ricerca il numero e l'età dei bambini che soggiorneranno. Il prezzo delle culle e dei letti supplementari non è incluso nell'importo totale e dovrà essere pagato separatamente durante il soggiorno. Il numero di culle e letti supplementari ammessi dipende dall'opzione che scegli. Controlla quella che hai selezionato per maggiori informazioni. I letti extra sono soggetti a disponibilità.",2026-04-08 07:51:46.269105+01
476,79fcbed4-2051-4b7b-9c57-720ec8a63975,771c5564-458e-40fb-be86-7066a3bda9e9,it,Nessuna età minima,Non è richiesta un'età minima per fare il check-in.,2026-04-08 07:51:46.270252+01
477,79fcbed4-2051-4b7b-9c57-720ec8a63975,771c5564-458e-40fb-be86-7066a3bda9e9,it,Animali,Animali ammessi su richiesta. Potrebbe essere richiesto un supplemento.,2026-04-08 07:51:46.271391+01
484,a481171e-5c64-4be8-8af7-de16de99e310,771c5564-458e-40fb-be86-7066a3bda9e9,fr,Enfants et lits,"Conditions relatives aux enfants Tous les enfants sont les bienvenus. Les enfants âgés de plus de 17 ans seront facturés au tarif adulte dans cet établissement. Pour voir les tarifs et les informations associés à la taille de votre groupe, veuillez ajouter à votre recherche le nombre d'enfants avec qui vous voyagez ainsi que leur âge. Conditions relatives aux lits bébé et aux lits d'appoint 0 - 3 ans Lit bébé toujours disponible Gratuit 4 - 12 ans Lit d'appoint sur demande € 210 par enfant et par nuit Plus de 13 ans Lit d'appoint sur demande € 380 par personne et par nuit Les frais supplémentaires associés aux lits bébé et aux lits d'appoint ne sont pas inclus dans le montant total et devront être payés séparément pendant votre séjour. Le nombre de lits bébé et de lits d'appoint disponibles dépend de l'option que vous choisissez. Veuillez consulter l'option sélectionnée pour obtenir plus d'informations. Tous les lits d'appoint sont soumis à disponibilité. Conditions relatives aux enfants Conditions relatives aux lits bébé et aux lits d'appoint Tous les enfants sont les bienvenus. Les enfants âgés de plus de 17 ans seront facturés au tarif adulte dans cet établissement. Pour voir les tarifs et les informations associés à la taille de votre groupe, veuillez ajouter à votre recherche le nombre d'enfants avec qui vous voyagez ainsi que leur âge. Les frais supplémentaires associés aux lits bébé et aux lits d'appoint ne sont pas inclus dans le montant total et devront être payés séparément pendant votre séjour. Le nombre de lits bébé et de lits d'appoint disponibles dépend de l'option que vous choisissez. Veuillez consulter l'option sélectionnée pour obtenir plus d'informations. Tous les lits d'appoint sont soumis à disponibilité.",2026-04-08 07:52:18.360978+01
485,a481171e-5c64-4be8-8af7-de16de99e310,771c5564-458e-40fb-be86-7066a3bda9e9,fr,Aucune restriction d'âge,Aucune restriction relative à l'âge ne s'applique pour l'enregistrement.,2026-04-08 07:52:18.362559+01
486,a481171e-5c64-4be8-8af7-de16de99e310,771c5564-458e-40fb-be86-7066a3bda9e9,fr,Animaux domestiques,Les animaux de compagnie sont admis sur demande (un supplément peut s'appliquer).,2026-04-08 07:52:18.363976+01
487,a481171e-5c64-4be8-8af7-de16de99e310,771c5564-458e-40fb-be86-7066a3bda9e9,fr,Groupes,Toute réservation de plus de 2 chambres peut entraîner des conditions particulières et des frais supplémentaires.,2026-04-08 07:52:18.365034+01
488,a481171e-5c64-4be8-8af7-de16de99e310,771c5564-458e-40fb-be86-7066a3bda9e9,fr,Cartes acceptées par cet établissement,Les espèces ne sont pas acceptées,2026-04-08 07:52:18.366015+01
489,a481171e-5c64-4be8-8af7-de16de99e310,771c5564-458e-40fb-be86-7066a3bda9e9,fr,Fêtes,Les fêtes/événements ne sont pas autorisés.,2026-04-08 07:52:18.367007+01
521,7219449d-dc1d-4791-9123-1f41cd368fdf,2c4b97c3-18fd-42fa-a924-2e1e8b6fcf9f,es,Entrada,Desde las 14:00 Los clientes deben mostrar un documento de identidad con fotografía y una tarjeta de crédito en el momento de hacer el check-in,2026-04-08 07:55:13.520532+01
522,7219449d-dc1d-4791-9123-1f41cd368fdf,2c4b97c3-18fd-42fa-a924-2e1e8b6fcf9f,es,Salida,Hasta las 12:00,2026-04-08 07:55:13.522586+01
523,7219449d-dc1d-4791-9123-1f41cd368fdf,2c4b97c3-18fd-42fa-a924-2e1e8b6fcf9f,es,Cancelación /  prepago,Las condiciones de cancelación y de pago por adelantado pueden variar según el tipo de alojamiento. Introduce las fechas de tu estancia y consulta las condiciones de la opción que quieres reservar.,2026-04-08 07:55:13.524701+01
524,7219449d-dc1d-4791-9123-1f41cd368fdf,2c4b97c3-18fd-42fa-a924-2e1e8b6fcf9f,es,Camas para niños,"Condiciones para estancias con niños Se pueden alojar niños de cualquier edad. Los niños a partir de 9 años pagan como adultos en este alojamiento. Para ver la información correcta sobre precios y ocupación, añade a la búsqueda el número de niños con los que viajas y sus edades. Condiciones sobre cunas y camas supletorias En este alojamiento no hay cunas ni camas supletorias. Condiciones para estancias con niños Condiciones sobre cunas y camas supletorias Se pueden alojar niños de cualquier edad. Los niños a partir de 9 años pagan como adultos en este alojamiento. Para ver la información correcta sobre precios y ocupación, añade a la búsqueda el número de niños con los que viajas y sus edades. En este alojamiento no hay cunas ni camas supletorias.",2026-04-08 07:55:13.526476+01
525,7219449d-dc1d-4791-9123-1f41cd368fdf,2c4b97c3-18fd-42fa-a924-2e1e8b6fcf9f,es,Restricción por edad,Edad mínima para el check-in: 18,2026-04-08 07:55:13.527965+01
526,7219449d-dc1d-4791-9123-1f41cd368fdf,2c4b97c3-18fd-42fa-a924-2e1e8b6fcf9f,es,Mascotas,No se admiten.,2026-04-08 07:55:13.529203+01
527,7219449d-dc1d-4791-9123-1f41cd368fdf,2c4b97c3-18fd-42fa-a924-2e1e8b6fcf9f,es,Grupos,"Al reservar más de 5 habitaciones, podrán aplicarse condiciones especiales y suplementos.",2026-04-08 07:55:13.530392+01
528,7219449d-dc1d-4791-9123-1f41cd368fdf,2c4b97c3-18fd-42fa-a924-2e1e8b6fcf9f,es,Métodos de pago aceptados,Efectivo,2026-04-08 07:55:13.531539+01
490,0bfb5945-652e-4999-a432-f95e2c12bbae,771c5564-458e-40fb-be86-7066a3bda9e9,pt,Check-in,Das 14:00 às 00:00 Terá de informar a sua hora de chegada com antecedência ao alojamento.,2026-04-08 07:53:09.878238+01
491,0bfb5945-652e-4999-a432-f95e2c12bbae,771c5564-458e-40fb-be86-7066a3bda9e9,pt,Check-out,Das 06:00 às 12:00,2026-04-08 07:53:09.879655+01
492,0bfb5945-652e-4999-a432-f95e2c12bbae,771c5564-458e-40fb-be86-7066a3bda9e9,pt,Cancelamento/ pré-pagamento,"As condições de cancelamento e de pré-pagamento variam consoante o tipo de alojamento. Por favor, insira as datas da sua estadia e verifique as condições da opção que selecionou.",2026-04-08 07:53:09.880998+01
493,0bfb5945-652e-4999-a432-f95e2c12bbae,771c5564-458e-40fb-be86-7066a3bda9e9,pt,Crianças e camas,"Condições de crianças Todas as crianças são bem-vindas. As crianças com 17 ou mais anos terão de pagar as tarifas de adulto neste alojamento. Para ver os preços corretos e a informação sobre a ocupação, por favor, adicione à sua pesquisa o número de crianças no seu grupo e as respetivas idades. Condições de berços e camas extra 0 - 3 anos Berço sempre disponível Gratuito 4 - 12 anos Cama extra mediante pedido € 210 por criança, por noite Mais de 13 anos Cama extra mediante pedido € 380 por pessoa, por noite Os preços para berços e camas extra não estão incluídos no preço total e têm se ser pagos separadamente durante a sua estadia. O número permitido de camas extra e de berços está dependente da opção que escolher. Por favor, verifique a sua opção selecionada para mais informações. Todas as camas extra estão sujeitas a disponibilidade. Condições de crianças Condições de berços e camas extra Todas as crianças são bem-vindas. As crianças com 17 ou mais anos terão de pagar as tarifas de adulto neste alojamento. Para ver os preços corretos e a informação sobre a ocupação, por favor, adicione à sua pesquisa o número de crianças no seu grupo e as respetivas idades. Os preços para berços e camas extra não estão incluídos no preço total e têm se ser pagos separadamente durante a sua estadia. O número permitido de camas extra e de berços está dependente da opção que escolher. Por favor, verifique a sua opção selecionada para mais informações. Todas as camas extra estão sujeitas a disponibilidade.",2026-04-08 07:53:09.882235+01
494,0bfb5945-652e-4999-a432-f95e2c12bbae,771c5564-458e-40fb-be86-7066a3bda9e9,pt,Sem restrições de idade,Não há restrições de idade para fazer check-in,2026-04-08 07:53:09.883821+01
495,0bfb5945-652e-4999-a432-f95e2c12bbae,771c5564-458e-40fb-be86-7066a3bda9e9,pt,Animais de estimação,Animais de estimação: admitidos mediante pedido. Poderão aplicar-se custos adicionais.,2026-04-08 07:53:09.885446+01
496,0bfb5945-652e-4999-a432-f95e2c12bbae,771c5564-458e-40fb-be86-7066a3bda9e9,pt,Grupos,"Ao reservar mais de 2 quartos, poderão aplicar-se condições diferentes e custos adicionais.",2026-04-08 07:53:09.887021+01
497,0bfb5945-652e-4999-a432-f95e2c12bbae,771c5564-458e-40fb-be86-7066a3bda9e9,pt,Cartões aceites pelo alojamento,Não aceita dinheiro,2026-04-08 07:53:09.888272+01
498,0bfb5945-652e-4999-a432-f95e2c12bbae,771c5564-458e-40fb-be86-7066a3bda9e9,pt,Festas,Não é permitido realizar festas/eventos,2026-04-08 07:53:09.889656+01
529,a1324027-6ec7-405c-a10e-7f796d08a752,833a95b8-c17a-48c2-9e84-f86780093621,de,Anreise,Ab 15:00,2026-04-08 07:55:37.91729+01
530,a1324027-6ec7-405c-a10e-7f796d08a752,833a95b8-c17a-48c2-9e84-f86780093621,de,Abreise,Bis 12:00,2026-04-08 07:55:37.919038+01
531,a1324027-6ec7-405c-a10e-7f796d08a752,833a95b8-c17a-48c2-9e84-f86780093621,de,Stornierung/ Vorauszahlung,Die Stornierungs- und Vorauszahlungsrichtlinien ändern sich je nach Unterkunftskategorie. Bitte geben Sie Ihre Reisedaten ein und überprüfen Sie die Bedingungen Ihrer gewählten Option.,2026-04-08 07:55:37.920685+01
532,a1324027-6ec7-405c-a10e-7f796d08a752,833a95b8-c17a-48c2-9e84-f86780093621,de,Kinder und Betten,"Richtlinien für Kinder Kinder jeden Alters sind willkommen. Kinder im Alter von 18 Jahren oder älter zahlen in dieser Unterkunft den Erwachsenenpreis. Fügen Sie Ihrer Suche bitte die Anzahl der Kinder in Ihrer Gruppe und deren Alter hinzu, um die korrekten Preise und Belegungsinformationen zu sehen. Richtlinien zu Baby- und Zustellbetten 0 - 3 Jahre Babybett auf Anfrage Kostenfrei Die Anzahl an Babybetten ist von der von Ihnen gewählten Option abhängig. Bitte prüfen Sie Ihre ausgewählte Option für mehr Informationen. Zustellbetten sind in dieser Unterkunft nicht verfügbar. Alle Babybetten unterliegen der Verfügbarkeit. Richtlinien für Kinder Richtlinien zu Baby- und Zustellbetten Kinder jeden Alters sind willkommen. Kinder im Alter von 18 Jahren oder älter zahlen in dieser Unterkunft den Erwachsenenpreis. Fügen Sie Ihrer Suche bitte die Anzahl der Kinder in Ihrer Gruppe und deren Alter hinzu, um die korrekten Preise und Belegungsinformationen zu sehen. Die Anzahl an Babybetten ist von der von Ihnen gewählten Option abhängig. Bitte prüfen Sie Ihre ausgewählte Option für mehr Informationen. Zustellbetten sind in dieser Unterkunft nicht verfügbar. Alle Babybetten unterliegen der Verfügbarkeit.",2026-04-08 07:55:37.922207+01
533,a1324027-6ec7-405c-a10e-7f796d08a752,833a95b8-c17a-48c2-9e84-f86780093621,de,Keine Altersbeschränkung,Es gibt keine Altersbeschränkung für den Check-in.,2026-04-08 07:55:37.92448+01
534,a1324027-6ec7-405c-a10e-7f796d08a752,833a95b8-c17a-48c2-9e84-f86780093621,de,Haustiere,Haustiere sind auf Anfrage gestattet. Möglicherweise fallen Gebühren an.,2026-04-08 07:55:37.926154+01
535,a1324027-6ec7-405c-a10e-7f796d08a752,833a95b8-c17a-48c2-9e84-f86780093621,de,Akzeptierte Zahlungsmethoden,Barzahlung,2026-04-08 07:55:37.927708+01
501,e74ac455-353a-415d-a25c-7437801565de,833a95b8-c17a-48c2-9e84-f86780093621,en,Cancellation/ prepayment,Cancellation and prepayment policies vary according to accommodation type. Please enter the dates of your stay and check the conditions of your required option.,2026-04-08 07:53:51.041218+01
502,e74ac455-353a-415d-a25c-7437801565de,833a95b8-c17a-48c2-9e84-f86780093621,en,Children and beds,"Child policies Children of any age are welcome. Children 18 years and above will be charged as adults at this property. To see correct prices and occupancy information, please add the number of children in your group and their ages to your search. Cot and extra bed policies 0 - 3 years Cot upon request Free The number of cots allowed is dependent on the option you choose. Please check your selected option for more information. There are no extra beds available at this property. All cots are subject to availability. Child policies Cot and extra bed policies Children of any age are welcome. Children 18 years and above will be charged as adults at this property. To see correct prices and occupancy information, please add the number of children in your group and their ages to your search. The number of cots allowed is dependent on the option you choose. Please check your selected option for more information. There are no extra beds available at this property. All cots are subject to availability.",2026-04-08 07:53:51.043031+01
503,e74ac455-353a-415d-a25c-7437801565de,833a95b8-c17a-48c2-9e84-f86780093621,en,No age restriction,There is no age requirement for check-in,2026-04-08 07:53:51.044526+01
504,e74ac455-353a-415d-a25c-7437801565de,833a95b8-c17a-48c2-9e84-f86780093621,en,Pets,Pets are allowed on request. Charges may be applicable.,2026-04-08 07:53:51.046408+01
505,e74ac455-353a-415d-a25c-7437801565de,833a95b8-c17a-48c2-9e84-f86780093621,en,Accepted payment methods,Cash,2026-04-08 07:53:51.047836+01
506,17909530-f586-47b4-9461-bb3e4a8cbd94,2c4b97c3-18fd-42fa-a924-2e1e8b6fcf9f,en,Check-in,From 14:00 Guests are required to show a photo identification and credit card upon check-in,2026-04-08 07:54:08.235628+01
507,17909530-f586-47b4-9461-bb3e4a8cbd94,2c4b97c3-18fd-42fa-a924-2e1e8b6fcf9f,en,Check-out,Until 12:00,2026-04-08 07:54:08.237142+01
508,17909530-f586-47b4-9461-bb3e4a8cbd94,2c4b97c3-18fd-42fa-a924-2e1e8b6fcf9f,en,Cancellation/ prepayment,Cancellation and prepayment policies vary according to accommodation type. Please enter the dates of your stay and check the conditions of your required option.,2026-04-08 07:54:08.238649+01
509,17909530-f586-47b4-9461-bb3e4a8cbd94,2c4b97c3-18fd-42fa-a924-2e1e8b6fcf9f,en,Children and beds,"Child policies Children of any age are welcome. Children 9 years and above will be charged as adults at this property. To see correct prices and occupancy information, please add the number of children in your group and their ages to your search. Cot and extra bed policies Cots and extra beds are not available at this property. Child policies Cot and extra bed policies Children of any age are welcome. Children 9 years and above will be charged as adults at this property. To see correct prices and occupancy information, please add the number of children in your group and their ages to your search. Cots and extra beds are not available at this property.",2026-04-08 07:54:08.240033+01
510,17909530-f586-47b4-9461-bb3e4a8cbd94,2c4b97c3-18fd-42fa-a924-2e1e8b6fcf9f,en,Age restriction,The minimum age for check-in is 18,2026-04-08 07:54:08.241478+01
511,17909530-f586-47b4-9461-bb3e4a8cbd94,2c4b97c3-18fd-42fa-a924-2e1e8b6fcf9f,en,Pets,Pets are not allowed.,2026-04-08 07:54:08.242986+01
512,17909530-f586-47b4-9461-bb3e4a8cbd94,2c4b97c3-18fd-42fa-a924-2e1e8b6fcf9f,en,Groups,"When booking more than 5 rooms, different policies and additional supplements may apply.",2026-04-08 07:54:08.244282+01
513,17909530-f586-47b4-9461-bb3e4a8cbd94,2c4b97c3-18fd-42fa-a924-2e1e8b6fcf9f,en,Accepted payment methods,Cash,2026-04-08 07:54:08.245601+01
536,330ed39e-5bc1-418a-ba88-4461e31dfc71,2c4b97c3-18fd-42fa-a924-2e1e8b6fcf9f,de,Anreise,Ab 14:00 Gäste müssen einen Lichtbildausweis und eine Kreditkarte beim Check-in vorlegen,2026-04-08 07:55:44.409839+01
537,330ed39e-5bc1-418a-ba88-4461e31dfc71,2c4b97c3-18fd-42fa-a924-2e1e8b6fcf9f,de,Abreise,Bis 12:00,2026-04-08 07:55:44.411414+01
538,330ed39e-5bc1-418a-ba88-4461e31dfc71,2c4b97c3-18fd-42fa-a924-2e1e8b6fcf9f,de,Stornierung/ Vorauszahlung,Die Stornierungs- und Vorauszahlungsrichtlinien ändern sich je nach Unterkunftskategorie. Bitte geben Sie Ihre Reisedaten ein und überprüfen Sie die Bedingungen Ihrer gewählten Option.,2026-04-08 07:55:44.413179+01
539,330ed39e-5bc1-418a-ba88-4461e31dfc71,2c4b97c3-18fd-42fa-a924-2e1e8b6fcf9f,de,Kinder und Betten,"Richtlinien für Kinder Kinder jeden Alters sind willkommen. Kinder im Alter von 9 Jahren oder älter zahlen in dieser Unterkunft den Erwachsenenpreis. Fügen Sie Ihrer Suche bitte die Anzahl der Kinder in Ihrer Gruppe und deren Alter hinzu, um die korrekten Preise und Belegungsinformationen zu sehen. Richtlinien zu Baby- und Zustellbetten Baby- und Zustellbetten sind in dieser Unterkunft nicht verfügbar. Richtlinien für Kinder Richtlinien zu Baby- und Zustellbetten Kinder jeden Alters sind willkommen. Kinder im Alter von 9 Jahren oder älter zahlen in dieser Unterkunft den Erwachsenenpreis. Fügen Sie Ihrer Suche bitte die Anzahl der Kinder in Ihrer Gruppe und deren Alter hinzu, um die korrekten Preise und Belegungsinformationen zu sehen. Baby- und Zustellbetten sind in dieser Unterkunft nicht verfügbar.",2026-04-08 07:55:44.414658+01
540,330ed39e-5bc1-418a-ba88-4461e31dfc71,2c4b97c3-18fd-42fa-a924-2e1e8b6fcf9f,de,Altersbeschränkung,Das Mindestalter für den Check-in beträgt 18 Jahre,2026-04-08 07:55:44.415969+01
541,330ed39e-5bc1-418a-ba88-4461e31dfc71,2c4b97c3-18fd-42fa-a924-2e1e8b6fcf9f,de,Haustiere,Haustiere sind nicht gestattet.,2026-04-08 07:55:44.417249+01
542,330ed39e-5bc1-418a-ba88-4461e31dfc71,2c4b97c3-18fd-42fa-a924-2e1e8b6fcf9f,de,Gruppen,Bei einer Buchung von mehr als 5 Zimmern können abweichende Richtlinien und zusätzliche Aufpreise gelten.,2026-04-08 07:55:44.418539+01
543,330ed39e-5bc1-418a-ba88-4461e31dfc71,2c4b97c3-18fd-42fa-a924-2e1e8b6fcf9f,de,Akzeptierte Zahlungsmethoden,Barzahlung,2026-04-08 07:55:44.419931+01
514,679e8984-417e-4987-8012-a0802fe44092,833a95b8-c17a-48c2-9e84-f86780093621,es,Entrada,Desde las 15:00,2026-04-08 07:54:27.667773+01
515,679e8984-417e-4987-8012-a0802fe44092,833a95b8-c17a-48c2-9e84-f86780093621,es,Salida,Hasta las 12:00,2026-04-08 07:54:27.669703+01
516,679e8984-417e-4987-8012-a0802fe44092,833a95b8-c17a-48c2-9e84-f86780093621,es,Cancelación /  prepago,Las condiciones de cancelación y de pago por adelantado pueden variar según el tipo de alojamiento. Introduce las fechas de tu estancia y consulta las condiciones de la opción que quieres reservar.,2026-04-08 07:54:27.671515+01
