"id","hotel_id","url_id","language","policy_name","policy_details","created_at"
"1","bee1cce5-f42b-4f20-bc96-70a0bf1726df","32ff0590-e264-42f3-b475-e6fb68fe5287","es","Normas de la casa","Niyama Private Islands Maldives acepta peticiones especiales. ¡Añádelas en el siguiente paso! Ver disponibilidad Entrada Desde las 14:00 Los clientes deben mostrar un documento de identidad con fotografía y una tarjeta de crédito en el momento de hacer el check-in Tienes que decirle al alojamiento con antelación a qué hora vas a llegar. Salida Hasta las 12:00 Cancelación /  prepago Las condiciones de cancelación y de pago por adelantado pueden variar según el tipo de alojamiento. Introduce las fechas de tu estancia y consulta las condiciones de la opción que quieres reservar. Camas para niños Condiciones para estancias con niños Se pueden alojar niños de cualquier edad. Para ver la información correcta sobre precios y ocupación, añade a la búsqueda el número de niños con los que viajas y sus edades. Condiciones sobre cunas y camas supletorias 0 - 3 años Cuna a petición Gratis Más de 12 años Cama supletoria a petición US$261 por persona y noche El precio de las cunas y las camas supletorias no está incluido en el precio total y se tiene que pagar por separado durante la estancia. El número de camas supletorias y cunas permitido depende de la opción que escojas. Consulta la opción que has escogido para saber más. Todas las cunas y camas supletorias están sujetas a disponibilidad. No hay restricción por edad No hay edad mínima para el check-in Mascotas No se admiten. Métodos de pago aceptados Efectivo","2026-03-23 02:12:51.347927+00"
"2","2f98dc2e-72e4-4f67-bba4-992d96dbc77b","0685c131-5969-4b78-b02e-a76c6357c6bb","es","Normas de la casa","Centara Grand Lagoon Maldives - Free Round Trip Speedboat when stay 4 nights or more between 17 April - 15 October 2026 acepta peticiones especiales. ¡Añádelas en el siguiente paso! Ver disponibilidad Entrada Desde las 15:00 Salida Hasta las 12:00 Cancelación /  prepago Las condiciones de cancelación y de pago por adelantado pueden variar según el tipo de alojamiento. Introduce las fechas de tu estancia y consulta las condiciones de la opción que quieres reservar. Camas para niños Condiciones para estancias con niños Se pueden alojar niños de cualquier edad. Para ver la información correcta sobre precios y ocupación, añade a la búsqueda el número de niños con los que viajas y sus edades. Condiciones sobre cunas y camas supletorias En este alojamiento no hay cunas ni camas supletorias. No hay restricción por edad No hay edad mínima para el check-in Mascotas No se admiten. Tarjetas aceptadas en este alojamiento No se acepta efectivo Fiestas No se pueden celebrar fiestas/eventos","2026-03-23 02:14:10.722367+00"
"3","d0dc3b28-9a8e-44bb-8f11-54197e52fc69","32ff0590-e264-42f3-b475-e6fb68fe5287","en","House rules","Niyama Private Islands Maldives takes special requests - add in the next step! See availability Check-in From 14:00 Guests are required to show a photo identification and credit card upon check-in You'll need to let the property know in advance what time you'll arrive. Check-out Until 12:00 Cancellation/ prepayment Cancellation and prepayment policies vary according to accommodation type. Please enter the dates of your stay and check the conditions of your required option. Children and beds Child policies Children of any age are welcome. To see correct prices and occupancy information, please add the number of children in your group and their ages to your search. Cot and extra bed policies 0 - 3 years Cot upon request Free 12+ years Extra bed upon request US$261 per person, per night Prices for cots and extra beds are not included in the total price, and will have to be paid for separately during your stay. The number of extra beds and cots allowed is dependent on the option you choose. Please check your selected option for more information. All cots and extra beds are subject to availability. No age restriction There is no age requirement for check-in Pets Pets are not allowed. Accepted payment methods Cash","2026-03-23 02:17:01.668416+00"
"4","6c7f8422-cd3e-4467-90b8-2d7fc20dda67","0685c131-5969-4b78-b02e-a76c6357c6bb","en","House rules","Centara Grand Lagoon Maldives - Free Round Trip Speedboat when stay 4 nights or more between 17 April - 15 October 2026 takes special requests - add in the next step! See availability Check-in From 15:00 Check-out Until 12:00 Cancellation/ prepayment Cancellation and prepayment policies vary according to accommodation type. Please enter the dates of your stay and check the conditions of your required option. Children and beds Child policies Children of any age are welcome. To see correct prices and occupancy information, please add the number of children in your group and their ages to your search. Cot and extra bed policies Cots and extra beds are not available at this property. No age restriction There is no age requirement for check-in Pets Pets are not allowed. Cards accepted at this property Cash is not accepted Parties Parties/events are not allowed","2026-03-23 02:19:53.961548+00"
"5","86d0d126-165f-481a-bf35-31bac67544ba","32ff0590-e264-42f3-b475-e6fb68fe5287","de","Hausregeln","Die Unterkunft Niyama Private Islands Maldives nimmt besondere Anfragen an – im nächsten Schritt hinzufügen! Verfügbarkeit anzeigen Anreise Ab 14:00 Gäste müssen einen Lichtbildausweis und eine Kreditkarte beim Check-in vorlegen Bitte informieren Sie die Unterkunft im Voraus über Ihre Ankunftszeit. Abreise Bis 12:00 Stornierung/ Vorauszahlung Die Stornierungs- und Vorauszahlungsrichtlinien ändern sich je nach Unterkunftskategorie. Bitte geben Sie Ihre Reisedaten ein und überprüfen Sie die Bedingungen Ihrer gewählten Option. Kinder und Betten Richtlinien für Kinder Kinder jeden Alters sind willkommen. Fügen Sie Ihrer Suche bitte die Anzahl der Kinder in Ihrer Gruppe und deren Alter hinzu, um die korrekten Preise und Belegungsinformationen zu sehen. Richtlinien zu Baby- und Zustellbetten 0 - 3 Jahre Babybett auf Anfrage Kostenfrei über 12 Jahre Zustellbett auf Anfrage US$261 pro Person, pro Nacht Preise für Baby- und Zustellbetten sind nicht im Gesamtpreis enthalten und müssen separat während Ihres Aufenthaltes bezahlt werden. Die Anzahl an Zustell- und Babybetten ist von der von Ihnen gewählten Option abhängig. Bitte prüfen Sie Ihre ausgewählte Option für mehr Informationen. Alle Babybetten und Zustellbetten unterliegen der Verfügbarkeit. Keine Altersbeschränkung Es gibt keine Altersbeschränkung für den Check-in. Haustiere Haustiere sind nicht gestattet. Akzeptierte Zahlungsmethoden Barzahlung","2026-03-23 02:21:13.21403+00"
"6","f242370f-d1c9-463a-a149-99a2de652548","0685c131-5969-4b78-b02e-a76c6357c6bb","de","Hausregeln","Die Unterkunft Centara Grand Lagoon Maldives - Free Round Trip Speedboat when stay 4 nights or more between 17 April - 15 October 2026 nimmt besondere Anfragen an – im nächsten Schritt hinzufügen! Verfügbarkeit anzeigen Anreise Ab 15:00 Abreise Bis 12:00 Stornierung/ Vorauszahlung Die Stornierungs- und Vorauszahlungsrichtlinien ändern sich je nach Unterkunftskategorie. Bitte geben Sie Ihre Reisedaten ein und überprüfen Sie die Bedingungen Ihrer gewählten Option. Kinder und Betten Richtlinien für Kinder Kinder jeden Alters sind willkommen. Fügen Sie Ihrer Suche bitte die Anzahl der Kinder in Ihrer Gruppe und deren Alter hinzu, um die korrekten Preise und Belegungsinformationen zu sehen. Richtlinien zu Baby- und Zustellbetten Baby- und Zustellbetten sind in dieser Unterkunft nicht verfügbar. Keine Altersbeschränkung Es gibt keine Altersbeschränkung für den Check-in. Haustiere Haustiere sind nicht gestattet. In dieser Unterkunft werden folgende Karten akzeptiert Barzahlung nicht akzeptiert Partys Partys/Veranstaltungen sind nicht erlaubt.","2026-03-23 02:22:31.51046+00"
"7","d222ce26-2538-4767-a3eb-428047ff6a03","32ff0590-e264-42f3-b475-e6fb68fe5287","it","Regole della struttura","Niyama Private Islands Maldives accetta le richieste speciali. Aggiungile nel prossimo passaggio! Vedi disponibilità Arrivo Dalle 14:00 Al check-in gli ospiti devono esibire un documento di riconoscimento con foto e una carta di credito. Dovrai comunicare in anticipo alla struttura il tuo orario di arrivo. Partenza Alle 12:00 Cancellazione / Pagamento anticipato Le condizioni relative alla cancellazione e al pagamento anticipato variano a seconda della tipologia di alloggio. Inserisci le date del soggiorno e verifica le condizioni dell'opzione scelta. Bambini e letti Condizioni per i bambini I bambini di tutte le età sono i benvenuti. Per vedere informazioni corrette relativamente a prezzi e occupazione, aggiungi alla ricerca il numero e l'età dei bambini che soggiorneranno. Condizioni per culle e letti aggiuntivi 0 - 3 anni Culla su richiesta Gratis 12 anni e oltre Letto supplementare su richiesta US$261 per persona, a notte Il prezzo delle culle e dei letti supplementari non è incluso nell'importo totale e dovrà essere pagato separatamente durante il soggiorno. Il numero di culle e letti supplementari ammessi dipende dall'opzione che scegli. Controlla quella che hai selezionato per maggiori informazioni. Le culle e i letti supplementari sono soggetti a disponibilità. Nessuna età minima Non è richiesta un'età minima per fare il check-in. Animali Animali non ammessi. Metodi di pagamento accettati Contanti","2026-03-23 02:23:49.4879+00"
"12","e266eeb3-d7c3-41a4-ae52-bf2300a60f25","6eb4d038-07d4-4b93-9a69-7aa19c4586b5","en","House rules","South Bank takes special requests - add in the next step! See availability Check-in From 15:00 Guests are required to show a photo identification and credit card upon check-in You'll need to let the property know in advance what time you'll arrive. Check-out Until 11:00 Cancellation/ prepayment Cancellation and prepayment policies vary according to accommodation type. Please enter the dates of your stay and check the conditions of your required option. Children and beds Child policies Children of any age are welcome. Children 18 years and above will be charged as adults at this property. To see correct prices and occupancy information, please add the number of children in your group and their ages to your search. Cot and extra bed policies 0 - 2 years Cot upon request Free The number of cots allowed is dependent on the option you choose. Please check your selected option for more information. There are no extra beds available at this property. All cots are subject to availability. Age restriction The minimum age for check-in is 21 Pets Pets are not allowed. Accepted payment methods Cash Parties Parties/events are not allowed","2026-03-23 02:33:48.820369+00"
"13","089f88d7-d807-40c5-9d28-3632ec4b9424","82120e1b-3dd5-41a2-804b-86504d39fed6","de","Hausregeln","Die Unterkunft Mandarin Oriental, Canouan nimmt besondere Anfragen an – im nächsten Schritt hinzufügen! Verfügbarkeit anzeigen Anreise Ab 15:00 Gäste müssen einen Lichtbildausweis und eine Kreditkarte beim Check-in vorlegen Bitte informieren Sie die Unterkunft im Voraus über Ihre Ankunftszeit. Abreise Bis 12:00 Stornierung/ Vorauszahlung Die Stornierungs- und Vorauszahlungsrichtlinien ändern sich je nach Unterkunftskategorie. Bitte geben Sie Ihre Reisedaten ein und überprüfen Sie die Bedingungen Ihrer gewählten Option. Kinder und Betten Richtlinien für Kinder Kinder jeden Alters sind willkommen. Kinder im Alter von 12 Jahren oder älter zahlen in dieser Unterkunft den Erwachsenenpreis. Fügen Sie Ihrer Suche bitte die Anzahl der Kinder in Ihrer Gruppe und deren Alter hinzu, um die korrekten Preise und Belegungsinformationen zu sehen. Richtlinien zu Baby- und Zustellbetten Baby- und Zustellbetten sind in dieser Unterkunft nicht verfügbar. Keine Altersbeschränkung Es gibt keine Altersbeschränkung für den Check-in. Haustiere Haustiere sind nicht gestattet. Akzeptierte Zahlungsmethoden Barzahlung","2026-03-23 02:35:07.692806+00"
"14","a1cbd96a-dc10-41f3-81fa-4e72a22ada7e","6eb4d038-07d4-4b93-9a69-7aa19c4586b5","de","Hausregeln","Die Unterkunft South Bank nimmt besondere Anfragen an – im nächsten Schritt hinzufügen! Verfügbarkeit anzeigen Anreise Ab 15:00 Gäste müssen einen Lichtbildausweis und eine Kreditkarte beim Check-in vorlegen Bitte informieren Sie die Unterkunft im Voraus über Ihre Ankunftszeit. Abreise Bis 11:00 Stornierung/ Vorauszahlung Die Stornierungs- und Vorauszahlungsrichtlinien ändern sich je nach Unterkunftskategorie. Bitte geben Sie Ihre Reisedaten ein und überprüfen Sie die Bedingungen Ihrer gewählten Option. Kinder und Betten Richtlinien für Kinder Kinder jeden Alters sind willkommen. Kinder im Alter von 18 Jahren oder älter zahlen in dieser Unterkunft den Erwachsenenpreis. Fügen Sie Ihrer Suche bitte die Anzahl der Kinder in Ihrer Gruppe und deren Alter hinzu, um die korrekten Preise und Belegungsinformationen zu sehen. Richtlinien zu Baby- und Zustellbetten 0 - 2 Jahre Babybett auf Anfrage Kostenfrei Die Anzahl an Babybetten ist von der von Ihnen gewählten Option abhängig. Bitte prüfen Sie Ihre ausgewählte Option für mehr Informationen. Zustellbetten sind in dieser Unterkunft nicht verfügbar. Alle Babybetten unterliegen der Verfügbarkeit. Altersbeschränkung Das Mindestalter für den Check-in beträgt 21 Jahre Haustiere Haustiere sind nicht gestattet. Akzeptierte Zahlungsmethoden Barzahlung Partys Partys/Veranstaltungen sind nicht erlaubt.","2026-03-23 02:36:24.601515+00"
"15","59ec7400-56d1-4611-b6a1-540be2370fd1","82120e1b-3dd5-41a2-804b-86504d39fed6","it","Regole della struttura","Mandarin Oriental, Canouan accetta le richieste speciali. Aggiungile nel prossimo passaggio! Vedi disponibilità Arrivo Dalle 15:00 Al check-in gli ospiti devono esibire un documento di riconoscimento con foto e una carta di credito. Dovrai comunicare in anticipo alla struttura il tuo orario di arrivo. Partenza Alle 12:00 Cancellazione / Pagamento anticipato Le condizioni relative alla cancellazione e al pagamento anticipato variano a seconda della tipologia di alloggio. Inserisci le date del soggiorno e verifica le condizioni dell'opzione scelta. Bambini e letti Condizioni per i bambini I bambini di tutte le età sono i benvenuti. I bambini di 12 anni o più pagheranno quanto gli adulti presso questa struttura. Per vedere informazioni corrette relativamente a prezzi e occupazione, aggiungi alla ricerca il numero e l'età dei bambini che soggiorneranno. Condizioni per culle e letti aggiuntivi In questa struttura non c'è disponibilità di culle e letti supplementari. Nessuna età minima Non è richiesta un'età minima per fare il check-in. Animali Animali non ammessi. Metodi di pagamento accettati Contanti","2026-03-23 02:37:41.334573+00"
"37","5722a8c8-d6ac-4a23-923b-5772266693ad","3016cdeb-d26c-480f-8190-94db410648a6","en","House rules","Hotel Atlântico Rio takes special requests - add in the next step! See availability Check-in From 14:00 Guests are required to show a photo identification and credit card upon check-in Check-out Until 12:00 Cancellation/ prepayment Cancellation and prepayment policies vary according to accommodation type. Please enter the dates of your stay and check the conditions of your required option. Children and beds Child policies Children of any age are welcome. Children 9 years and above will be charged as adults at this property. To see correct prices and occupancy information, please add the number of children in your group and their ages to your search. Cot and extra bed policies Cots and extra beds are not available at this property. Age restriction The minimum age for check-in is 18 Pets Pets are not allowed. Groups When booking more than 5 rooms, different policies and additional supplements may apply. Accepted payment methods Cash","2026-03-23 03:46:25.264702+00"
"8","f0142bac-a2f0-4c87-85e4-0caa400018dd","0685c131-5969-4b78-b02e-a76c6357c6bb","it","Regole della struttura","Centara Grand Lagoon Maldives - Free Round Trip Speedboat when stay 4 nights or more between 17 April - 15 October 2026 accetta le richieste speciali. Aggiungile nel prossimo passaggio! Vedi disponibilità Arrivo Dalle 15:00 Partenza Alle 12:00 Cancellazione / Pagamento anticipato Le condizioni relative alla cancellazione e al pagamento anticipato variano a seconda della tipologia di alloggio. Inserisci le date del soggiorno e verifica le condizioni dell'opzione scelta. Bambini e letti Condizioni per i bambini I bambini di tutte le età sono i benvenuti. Per vedere informazioni corrette relativamente a prezzi e occupazione, aggiungi alla ricerca il numero e l'età dei bambini che soggiorneranno. Condizioni per culle e letti aggiuntivi In questa struttura non c'è disponibilità di culle e letti supplementari. Nessuna età minima Non è richiesta un'età minima per fare il check-in. Animali Animali non ammessi. Carte di credito accettate presso la struttura Non si accettano contanti Feste Non è permesso organizzare feste/eventi.","2026-03-23 02:25:22.513294+00"
"9","0282ab2f-29ad-4e42-8c5d-e2f921ec50df","82120e1b-3dd5-41a2-804b-86504d39fed6","es","Normas de la casa","Mandarin Oriental, Canouan acepta peticiones especiales. ¡Añádelas en el siguiente paso! Ver disponibilidad Entrada Desde las 15:00 Los clientes deben mostrar un documento de identidad con fotografía y una tarjeta de crédito en el momento de hacer el check-in Tienes que decirle al alojamiento con antelación a qué hora vas a llegar. Salida Hasta las 12:00 Cancelación /  prepago Las condiciones de cancelación y de pago por adelantado pueden variar según el tipo de alojamiento. Introduce las fechas de tu estancia y consulta las condiciones de la opción que quieres reservar. Camas para niños Condiciones para estancias con niños Se pueden alojar niños de cualquier edad. Los niños a partir de 12 años pagan como adultos en este alojamiento. Para ver la información correcta sobre precios y ocupación, añade a la búsqueda el número de niños con los que viajas y sus edades. Condiciones sobre cunas y camas supletorias En este alojamiento no hay cunas ni camas supletorias. No hay restricción por edad No hay edad mínima para el check-in Mascotas No se admiten. Métodos de pago aceptados Efectivo","2026-03-23 02:26:40.926033+00"
"10","fa86fb44-682c-4733-8112-db42b47f889e","6eb4d038-07d4-4b93-9a69-7aa19c4586b5","es","Normas de la casa","South Bank acepta peticiones especiales. ¡Añádelas en el siguiente paso! Ver disponibilidad Entrada Desde las 15:00 Los clientes deben mostrar un documento de identidad con fotografía y una tarjeta de crédito en el momento de hacer el check-in Tienes que decirle al alojamiento con antelación a qué hora vas a llegar. Salida Hasta las 11:00 Cancelación /  prepago Las condiciones de cancelación y de pago por adelantado pueden variar según el tipo de alojamiento. Introduce las fechas de tu estancia y consulta las condiciones de la opción que quieres reservar. Camas para niños Condiciones para estancias con niños Se pueden alojar niños de cualquier edad. Los niños a partir de 18 años pagan como adultos en este alojamiento. Para ver la información correcta sobre precios y ocupación, añade a la búsqueda el número de niños con los que viajas y sus edades. Condiciones sobre cunas y camas supletorias 0 - 2 años Cuna a petición Gratis El número de cunas permitido depende de la opción que escojas. Consulta la opción que has escogido para saber más. No hay camas supletorias disponibles en este alojamiento. Todas las cunas están sujetas a disponibilidad. Restricción por edad Edad mínima para el check-in: 21 Mascotas No se admiten. Métodos de pago aceptados Efectivo Fiestas No se pueden celebrar fiestas/eventos","2026-03-23 02:28:00.763597+00"
"11","fba956fa-cb25-49f2-b483-16c49eea3a23","82120e1b-3dd5-41a2-804b-86504d39fed6","en","House rules","Mandarin Oriental, Canouan takes special requests - add in the next step! See availability Check-in From 15:00 Guests are required to show a photo identification and credit card upon check-in You'll need to let the property know in advance what time you'll arrive. Check-out Until 12:00 Cancellation/ prepayment Cancellation and prepayment policies vary according to accommodation type. Please enter the dates of your stay and check the conditions of your required option. Children and beds Child policies Children of any age are welcome. Children 12 years and above will be charged as adults at this property. To see correct prices and occupancy information, please add the number of children in your group and their ages to your search. Cot and extra bed policies Cots and extra beds are not available at this property. No age restriction There is no age requirement for check-in Pets Pets are not allowed. Accepted payment methods Cash","2026-03-23 02:30:51.996246+00"
"16","a141bb25-8a07-4589-96e0-e8c04f1c3444","6eb4d038-07d4-4b93-9a69-7aa19c4586b5","it","Regole della struttura","South Bank accetta le richieste speciali. Aggiungile nel prossimo passaggio! Vedi disponibilità Arrivo Dalle 15:00 Al check-in gli ospiti devono esibire un documento di riconoscimento con foto e una carta di credito. Dovrai comunicare in anticipo alla struttura il tuo orario di arrivo. Partenza Alle 11:00 Cancellazione / Pagamento anticipato Le condizioni relative alla cancellazione e al pagamento anticipato variano a seconda della tipologia di alloggio. Inserisci le date del soggiorno e verifica le condizioni dell'opzione scelta. Bambini e letti Condizioni per i bambini I bambini di tutte le età sono i benvenuti. I bambini di 18 anni o più pagheranno quanto gli adulti presso questa struttura. Per vedere informazioni corrette relativamente a prezzi e occupazione, aggiungi alla ricerca il numero e l'età dei bambini che soggiorneranno. Condizioni per culle e letti aggiuntivi 0 - 2 anni Culla su richiesta Gratis Il numero di culle ammesse dipende dall'opzione che scegli. Controlla quella che hai selezionato per maggiori informazioni. In questa struttura non c'è disponibilità di letti supplementari. Le culle sono soggette a disponibilità. Età minima L'età minima per fare il check-in è 21 anni. Animali Animali non ammessi. Metodi di pagamento accettati Contanti Feste Non è permesso organizzare feste/eventi.","2026-03-23 02:39:12.102309+00"
"17","2b43fe4e-d4ac-4426-8f18-ad98a631b6ed","e577917d-6ee3-4c33-a6dc-2b4d5662f142","es","Normas de la casa","Grace Bay Club acepta peticiones especiales. ¡Añádelas en el siguiente paso! Ver disponibilidad Entrada Desde las 15:00 Los clientes deben mostrar un documento de identidad con fotografía y una tarjeta de crédito en el momento de hacer el check-in Tienes que decirle al alojamiento con antelación a qué hora vas a llegar. Salida Hasta las 11:00 Cancelación /  prepago Las condiciones de cancelación y de pago por adelantado pueden variar según el tipo de alojamiento. Introduce las fechas de tu estancia y consulta las condiciones de la opción que quieres reservar. Camas para niños Condiciones para estancias con niños Se pueden alojar niños de cualquier edad. Los niños a partir de 18 años pagan como adultos en este alojamiento. Para ver la información correcta sobre precios y ocupación, añade a la búsqueda el número de niños con los que viajas y sus edades. Condiciones sobre cunas y camas supletorias 0 - 2 años Cama supletoria a petición Gratis Cuna a petición Gratis Más de 3 años Cama supletoria a petición Gratis El número de camas supletorias y cunas permitido depende de la opción que escojas. Consulta la opción que has escogido para saber más. Todas las cunas y camas supletorias están sujetas a disponibilidad. No hay restricción por edad No hay edad mínima para el check-in Mascotas No se admiten. Métodos de pago aceptados Efectivo","2026-03-23 02:40:30.575807+00"
"18","9d49384c-5a2c-4172-9308-af9fd16fe214","1a54b67d-01db-4e6c-88fb-208392d58712","es","Normas de la casa","The Island Garden Hotel acepta peticiones especiales. ¡Añádelas en el siguiente paso! Ver disponibilidad Entrada De las 15:00 a las 18:00 Salida De las 8:00 a las 11:00 Cancelación /  prepago Las condiciones de cancelación y de pago por adelantado pueden variar según el tipo de alojamiento. Introduce las fechas de tu estancia y consulta las condiciones de la opción que quieres reservar. Depósito por daños reembolsable Se pedirá un depósito por daños de US$25 a la llegada. Equivale a € 21 aprox. Se efectuará en efectivo. Se te devolverá al hacer el check-out. El depósito se devolverá por completo en efectivo una vez revisado el alojamiento. Camas para niños Condiciones para estancias con niños Se pueden alojar niños de cualquier edad. Para ver la información correcta sobre precios y ocupación, añade a la búsqueda el número de niños con los que viajas y sus edades. Condiciones sobre cunas y camas supletorias En este alojamiento no hay cunas ni camas supletorias. No hay restricción por edad No hay edad mínima para el check-in Mascotas No se admiten. Métodos de pago aceptados Efectivo Fiestas No se pueden celebrar fiestas/eventos","2026-03-23 02:41:49.09271+00"
