id,hotel_id,url_id,language,description,created_at,updated_at
97046042-1829-4e20-8b5c-8b2ce230005a,d91b23c0-5822-4ae2-a073-389621a62e77,eced75a8-2de1-4f87-aafc-c3aecc19211b,it,"Accogliente struttura adatta alle famiglie, l'Hotel Aquamarin offre un ambiente rustico e romantico nella famosa città termale di Bad Mitterndorf, nella parte stiriana di Salzkammergut. Si trova proprio ai piedi della Tauplitz Alpenstraße, da dove partono gli autobus diretti alle piste sciistiche.

Ogni camera dell'Hotel Aquamarin è arredata con un bel balcone, che vi permetterà di godere di una splendida vista sulle montagne circostanti e respirare l'aria pura di montagna.

Potrete gustare piatti tradizionali della Stiria o cucina ungherese nel ristorante o sulla terrazza soleggiata. Sono inoltre disponibili cibi integrali, piatti vegetariani e pietanze speciali (senza glutine o senza lattosio).

La zona circostante è ideale per praticare numerose attività sportive e ricreative in ogni stagione. In estate potrete praticare escursionismo, ciclismo, mountain bike, equitazione, nuoto, tennis, golf e alpinismo. In inverno la regione offre condizioni ideali per ogni tipo di sport invernale ed è innevata fino a tarda stagione. I padroni di casa saranno lieti di fornirvi consigli e informazioni.",2026-05-02 05:52:49.146836+01,2026-05-02 05:52:49.147552+01
7175423d-1ac1-4fe0-9580-2252e3dc05fa,8c76ca3c-b434-47b8-9589-6eeb7068ca2c,40fb571d-e979-4ab8-8072-ccbe8afec986,es,"Gesundheits- & Wellness Resort Oberzeiring se encuentra en Oberzeiring, a 32 km de Circuito Red Bull Ring, y ofrece alojamiento con jardín, parking privado gratis, restaurante y bar. El alojamiento está a 48 km de Abadía de Admont, a 19 km de Planetarium Judenburg y a 42 km de VW Beetle Museum Gaal. El hotel dispone de piscina cubierta, sauna y mostrador de información turística.

En el hotel, las habitaciones disponen de armario. Las habitaciones de este alojamiento disponen de wifi gratis y de baño privado equipado con ducha y secador de pelo. Algunas de las habitaciones tienen balcón. En Gesundheits- & Wellness Resort Oberzeiring, todas las habitaciones están equipadas con TV de pantalla plana y caja fuerte.

KLH-Arena está a 42 km del alojamiento, y Seckau Abbey está a 44 km. El aeropuerto (Aeropuerto de Klagenfurt) está a 90 km.",2026-05-02 05:38:23.849223+01,2026-05-02 05:38:23.850086+01
d1bf44a4-fe9e-4839-bfec-3293cf5b12aa,c48af9cc-6542-445f-8ca6-86a3940e1893,673c8372-0997-428c-b6a6-0759c24946c0,es,"Heilmoorbad Schwanberg está en Schwanberg, a 48 km de Estación de tren Graz Central, y dispone de alojamiento con centro de fitness, parking privado gratis, jardín y salón de uso común. Ofrece terraza, restaurante y bar. El hotel ofrece piscina cubierta, sauna, ocio nocturno y servicio de habitaciones.

En el hotel, las habitaciones cuentan con escritorio, TV de pantalla plana, baño privado, ropa de cama y toallas. Todas las habitaciones tienen caja fuerte.

El desayuno está disponible e incluye opciones buffet, continentales o vegetarianas.

Heilmoorbad Schwanberg tiene una zona de bienestar equipada con hammam. Se puede jugar al ping-pong en el alojamiento, y la zona es ideal para practicar senderismo y esquí.

Casino Graz está a 48 km del alojamiento, y Palacio Eggenberg está a 48 km. El aeropuerto (Aeropuerto de Graz) está a 44 km.",2026-05-02 05:38:39.404936+01,2026-05-02 05:38:39.405567+01
3c51e660-8085-407c-be60-090269c78fc3,15867e59-29db-4634-9cca-bb64e2cd8901,673c8372-0997-428c-b6a6-0759c24946c0,it,"Ubicato a Schwanberg, a 48 km da Stazione di Graz Centrale, Heilmoorbad Schwanberg propone un centro fitness, un parcheggio privato gratuito, un giardino e una sala comune. I vari servizi di questa struttura includono una terrazza, un bar e un centro spa e benessere. L'hotel offre una piscina coperta, una sauna, un programma di intrattenimento serale e il servizo in camera.

Presso questo hotel, le camere includono una scrivania, una TV a schermo piatto, un bagno privato, le lenzuola e gli asciugamani. Tutte le camere hanno una cassaforte.

In struttura è disponibile una colazione a buffet, continentale o vegetariana. Presso Heilmoorbad Schwanberg troverete un ristorante che serve piatti italiani, piatti austriaci e piatti internazionali. Su richiesta sono disponibili anche opzioni vegetariane, senza latticini e vegan.

Questa struttura offre un bagno turco. Presso Heilmoorbad Schwanberg, potrete giocare a ping pong, mentre la zona è famosa per attività quali l’escursionismo e lo sci.

Casinò di Graz è a 48 km da questo hotel, mentre Castello Eggenberg si trova a 48 km dalla struttura. Aeroporto di Graz - Thalerhof si trova a 44 km di distanza.",2026-05-02 05:40:19.309+01,2026-05-02 05:40:19.309868+01
706395bc-3a53-4dc3-81e1-beca44126e5f,fec655a3-8f13-4765-aac3-c951fc964150,673c8372-0997-428c-b6a6-0759c24946c0,fr,"L’établissement Heilmoorbad Schwanberg vous accueille à Schwanberg, à 48 km de ce lieu d’intérêt : Gare centrale de Graz. Il comprend une salle de sport, un jardin, un salon commun et un parking privé gratuit. Il possède une terrasse, un bar et un spa et centre de bien-être. Cet hôtel possède une piscine intérieure, un sauna, des animations en soirée et un service d'étage.

Les hébergements possèdent un bureau, une télévision à écran plat, une salle de bains privative, du linge de lit et des serviettes. Les hébergements disposent d'une douche, et certains comprennent également un coin salon. Vous profiterez aussi d’un coffre-fort.

Un petit-déjeuner buffet, continental ou végétarien est servi sur place. Sur place, Vous pourrez dîner dans un restaurant qui propose des plats italiens, des plats autrichiens et des plats internationaux, ainsi que des options végétariennes, sans lactose et végétaliennes.

L’établissement Heilmoorbad Schwanberg dispose d’un hammam. Vous pourrez jouer au ping-pong sur place. La région est prisée des amateurs de randonnée et de ski.

Vous séjournerez à respectivement 48 km et 48 km de ces lieux d’intérêt : Casino de Graz et Château Eggenberg. L'aéroport le plus proche (Aéroport de Graz) est à 44 km.",2026-05-02 05:41:09.091991+01,2026-05-02 05:41:09.092741+01
bb26bb32-b4f2-4ce2-8cbd-98c81cc7534a,44bf37de-cb88-4092-8230-10e5f03232ae,75574501-53c2-4ff7-a9e5-9a90c7f2aa6d,es,"Hotel Drei Hasen tiene salón de uso común, terraza, restaurante y bar en Mariazell. Este hotel de 3 estrellas ofrece un punto de venta de forfaits, servicio de habitaciones y wifi gratis. Hay un centro de spa y bienestar con sauna, hammam y acceso a pie de pista.

Las habitaciones del alojamiento disponen de baño privado, y algunas tienen además zona de estar.

La clientela puede practicar actividades en Mariazell y alrededores, como senderismo, esquí y ciclismo.

Monte Hochschwab está a 32 km del alojamiento, y Pogusch está a 40 km. El aeropuerto (Aeropuerto de Graz) está a 123 km.",2026-05-02 05:45:13.948838+01,2026-05-02 05:45:13.94954+01
9e21bd54-c14d-483c-8421-664ffd0ac0eb,ad5f0bf3-b961-435c-b919-ab6a4f2fc2b1,6d4f4a7b-5d12-4167-9885-432b2544abc1,it,"Situata a Selzthal, a soli 400 m dalla stazione ferroviaria e a 7 km da Liezen, la Pension Eder offre un ristorante di cucina austriaca tradizionale. La connessione Wi-Fi è gratuita.

Tutte le camere della Pension Eder presentano una vista sulle montagne, un'area salotto, una TV a schermo piatto e un bagno.

Il parcheggio privato è gratuito. 6 km dal Castello di Strechau e 25 km dall'Abbazia di Admont. I comprensori sciistici Wurzeralm e Kaiserau distano entrambi 18 km.

Il ristorante è chiuso! Nelle vicinanze troverete una pizzeria e una locanda.",2026-05-02 05:46:33.987875+01,2026-05-02 05:46:33.988809+01
51b427ab-e547-4423-a08d-1f74283badd3,d02a9feb-88d1-4f8b-95c7-c86a9dd2dcbc,6d4f4a7b-5d12-4167-9885-432b2544abc1,fr,"Située à Selzthal, à seulement 400 mètres de la gare et à 7 km de Liezen, la Pension Eder dispose d'un restaurant servant une cuisine traditionnelle autrichienne. La connexion Wi-Fi est gratuite.

Offrant une vue sur la montagne, toutes les chambres de la Pension Eder comprennent un coin salon, une télévision à écran plat et une salle de bains.

Un parking privé est disponible gratuitement sur place. Le château de Strechau est à 6 km et l'abbaye d'Admont à 25 km. Les domaines skiables de Wurzeralm et de Kaiserau sont à 18 km.

Le restaurant est fermé ! Vous trouverez une pizzeria et une auberge à proximité.",2026-05-02 05:47:42.119914+01,2026-05-02 05:47:42.120598+01
78a18815-2077-4891-93c8-70aed9819c1d,9f76dbc8-513e-4827-a076-7a46d7375fd2,eced75a8-2de1-4f87-aafc-c3aecc19211b,en,"The cosy, family-friendly Hotel Aquamarin offers a rustic and romantic ambience in the famous spa town of Bad Mitterndorf in the Styrian part of the Salzkammergut. It is located directly at the foot of the Tauplitz Alpenstraße, from where buses take guests straight to the ski slopes.

Every room at Hotel Aquamarin is furnished with a nice balcony, allowing you to enjoy beautiful views of the surrounding mountains and inhale the healthy mountain air.

You can enjoy traditional Styrian dishes or Hungarian cuisine in the restaurant or on the sunny terrace. Whole foods, vegetarian dishes and special ways of preparation (gluten-free or lactose-free) are also available.

The vicinity of the hotel is suited for a wide range of sports and leisure options in every season. In summer you can enjoy hiking, cycling, mountain biking, horseback riding, swimming, tennis, golf, and mountaineering. In winter the region offers ideal conditions for every kind of winter sports and is snow-sure until late in the season. Your hosts are happy to provide tips and information.",2026-05-02 05:49:48.330409+01,2026-05-02 05:49:48.331659+01
cc6838c3-84c3-48e1-9b80-1f2b943d93bf,8cd7fae2-74d1-49b9-9b79-c958cae95910,75574501-53c2-4ff7-a9e5-9a90c7f2aa6d,fr,"Situé à Mariazell, l’établissement Hotel Drei Hasen possède un salon commun, une terrasse, un restaurant et un bar. Cet hôtel 3 étoiles propose un point de vente de forfaits de ski, un service d'étage et une connexion Wi-Fi gratuite. Vous pourrez profiter d'un accès skis aux pieds ainsi que du spa et centre de bien-être sur place avec son sauna et son hammam.

Les hébergements disposent d’une salle de bains privative. Certains comprennent également un coin salon.

Lors de votre séjour, vous pourrez pratiquer diverses activités à Mariazell et dans les environs, telles que la randonnée, le ski et le vélo.

Vous séjournerez à respectivement 32 km et 40 km de ces lieux d’intérêt : Hochschwab et Pogusch. L'aéroport le plus proche (Aéroport de Graz) est à 123 km.",2026-05-02 05:47:52.204856+01,2026-05-02 05:47:52.20578+01
211186ad-51a8-48b0-90f1-4d6b2cf71916,621d6d63-bd03-4970-b741-c59fe154bfd5,eced75a8-2de1-4f87-aafc-c3aecc19211b,es,"El acogedor Hotel Aquamarin, ideal para familias, ofrece un ambiente rústico y romántico en la famosa ciudad balneario de Bad Mitterndorf, en la parte estiria de Salzkammergut. El establecimiento está situado a los pies de la calle Tauplitz Alpenstraße, desde donde salen autobuses directos a las pistas de esquí.

Todas las habitaciones del Hotel Aquamarin están equipadas con un bonito balcón que le permitirá disfrutar de hermosas vistas a las montañas de los alrededores y respirar el saludable aire de montaña.

Podrá disfrutar de platos tradicionales de Estiria o de cocina húngara en el restaurante o en la soleada terraza. También se ofrecen alimentos integrales, platos vegetarianos y platos especiales (sin gluten o sin lactosa).

En las inmediaciones del hotel se puede practicar una amplia gama de deportes y actividades de ocio en cualquier época del año. En verano se puede practicar senderismo, ciclismo, ciclismo de montaña, equitación, natación, tenis, golf y montañismo. En invierno, la región ofrece condiciones ideales para todo tipo de deportes de invierno y nieve hasta altas horas de la temporada. Los anfitriones estarán encantados de proporcionarle información y consejos.",2026-05-02 05:51:06.596169+01,2026-05-02 05:51:06.596885+01
c2046882-34c8-44a6-aa3c-aeab9077cdf4,9558d63c-a2bc-4410-afd1-e40f8d5a22f2,b11856e1-9a41-427c-bc22-0526a7844a92,it,"Ubicato a Kleinsölk, a 23 km da Castello di Trautenfels, Pension Stieber propone una sala comune, un parcheggio privato gratuito e una terrazza. A circa 32 km da Kulm, la locanda offre il WiFi gratuito e dista 40 km da Dachstein Skywalk. Gli ospiti possono godersi la vista sulla montagna dalla camera.

Tutte le camere presso questa locanda prevedono un’area salotto e una TV a schermo piatto con canali satellitari. Ogni camera dispone di una macchina da caffè e un bagno privato con doccia, mentre alcune camere hanno una cucina che presenta un frigorifero. Presso Pension Stieber, le camere includono lenzuola e asciugamani.

Presso questa struttura potrete gustare una colazione continentale.

Gli ospiti di Pension Stieber potranno svagarsi con varie attività a Kleinsölk e dintorni, come l’escursionismo, lo sci e il ciclismo.

Aeroporto di Salisburgo - W. A. Mozart si trova a 117 km dalla struttura.",2026-05-02 05:53:15.675355+01,2026-05-02 05:53:15.676139+01
d1fa3189-725b-483e-b4b9-02bd78d3a4c0,b616d78c-e1dc-4ff5-bb78-c1d2e5f43de1,6250b7ac-53d8-4f78-b891-62955a6f0952,es,"The 4-star superior Spa Resort Styria - ADULTS ONLY enjoys a quiet location in Styria’s thermal region. The 2,500 m² wellness and pool area is included from arrival day at 3 p.m. till departure day 11 a.m. and features natural thermal water and healthy refreshments such as tea and fruits.

The spacious rooms all come with a balcony or loggia, air conditioning, a seating area, a minibar, , a safe, and a bathroom with a hairdryer. Free WiFi is available.


A variety of massages and beauty treatments await you at the GOLD SPA. The highlight in the sauna area is the unique earth sauna.

In the panorama restaurant you will be spoilt with regional specialities with an international touch. The spa bistro serves light snacks and a selection of drinks, pastries and smoothies. Half-board includes breakfast and a 6-course menu of your choice in the evening.

The next-door Bad Waltersdorf Golf Course, featuring Feng Shui elements, offers ideal conditions for beginners as well as advanced golfers. Hotel guests benefit from a discount on the green fees.",2026-05-02 05:56:39.172023+01,2026-05-02 05:56:39.172686+01
1da67a28-0515-4242-aba3-1bc53750fe51,7cb31e37-3d44-449e-a885-e5cd8af635d3,6250b7ac-53d8-4f78-b891-62955a6f0952,it,"The 4-star superior Spa Resort Styria - ADULTS ONLY enjoys a quiet location in Styria’s thermal region. The 2,500 m² wellness and pool area is included from arrival day at 3 p.m. till departure day 11 a.m. and features natural thermal water and healthy refreshments such as tea and fruits.

The spacious rooms all come with a balcony or loggia, air conditioning, a seating area, a minibar, , a safe, and a bathroom with a hairdryer. Free WiFi is available.


A variety of massages and beauty treatments await you at the GOLD SPA. The highlight in the sauna area is the unique earth sauna.

In the panorama restaurant you will be spoilt with regional specialities with an international touch. The spa bistro serves light snacks and a selection of drinks, pastries and smoothies. Half-board includes breakfast and a 6-course menu of your choice in the evening.

The next-door Bad Waltersdorf Golf Course, featuring Feng Shui elements, offers ideal conditions for beginners as well as advanced golfers. Hotel guests benefit from a discount on the green fees.",2026-05-02 05:59:12.042663+01,2026-05-02 05:59:12.043445+01
8ba54d5a-f38c-4471-9312-fae68ea37929,549566d5-bbd8-471f-a647-d32993bb4c35,c57a05db-8a37-45e8-a965-542072a3338b,de,"Die Unterkunft Hotel Restaurant Hesch, die in Gabersdorf, 32 km von Bahnhof Maribor entfernt gelegen ist, verfügt über Übernachtungsmöglichkeiten mit einem Garten, einem kostenlosen Privatparkplatz, einer Terrasse und einem Restaurant. Die Unterkunft bietet eine Bar und befindet sich weniger als 43 km von Hauptbahnhof Graz entfernt. Die Unterkunft bietet eine rund um die Uhr besetzte Rezeption, Flughafentransfers, einen Zimmerservice und kostenloses WLAN in der ganzen Unterkunft.

Die Unterkunft Hotel Restaurant Hesch bietet ein als Buffet angebotenes oder kontinentales Frühstück.

Die Unterkunft Hotel Restaurant Hesch bietet einen Kinderspielplatz. Die Gäste in der Unterkunft Hotel Restaurant Hesch können Aktivitäten wie Fahrradfahren in und um Gabersdorf genießen.

Casino Graz liegt 44 km von der Unterkunft Hotel Restaurant Hesch entfernt, während Grazer Uhrturm 44 km entfernt ist. Der nächstgelegene Flughafen ist der Flughafen Graz, 31 km von der Unterkunft Hotel Restaurant Hesch entfernt.",2026-05-02 06:05:18.145959+01,2026-05-02 06:05:18.146554+01
99132d1a-1dde-4df3-8858-f056ed177037,98fb6631-2441-4546-b873-4b8158ddf470,b11856e1-9a41-427c-bc22-0526a7844a92,en,"Comfortable Accommodations:Pension Stieber in Kleinsölk offers family rooms with private bathrooms, mountain views, and parquet floors. Each room includes a work desk, dining table, and seating area.Modern Facilities:Guests enjoy free WiFi, a sun terrace, and a lounge. Additional amenities include a coffee shop, bicycle parking, ski storage, and free on-site private parking.Dining Options:A continental breakfast is served daily. The inn also provides menus for special diets and a daily housekeeping service.Activities and Attractions:Activities available include skiing, walking tours, hiking, and cycling. Nearby attractions include Trautenfels Castle (2 km), Km km, and Dachstein Skywalk (40 km). Salzburg W. A. Mozart Airport is 117 km away.",2026-05-02 05:50:08.292826+01,2026-05-02 05:50:08.293403+01
2abe8293-ab84-4c02-9dd6-f32e16910975,60c0c3e4-e4ed-4c96-9e4e-e2a6d65ab367,eced75a8-2de1-4f87-aafc-c3aecc19211b,de,"Das gemütliche, familienfreundliche Hotel Aquamarin begrüßt Sie im bekannten Kurort Bad Mitterndorf im steirischen Teil des Salzkammerguts. Es bietet Ihnen ein romantisches Ambiente im Landhausstil und befindet sich direkt am Fuße der Tauplitzalm Alpenstraße. Dort starten Busse direkt zu den Skipisten.

Jedes Zimmer im Hotel Aquamarin verfügt über einen hübschen Balkon, von dem Sie die herrliche Aussicht auf die umliegenden Berge genießen und gesunde Bergluft atmen können.

Im Restaurant oder auf der sonnigen Terrasse werden Ihnen traditionelle steirische Gerichte oder ungarische Küche serviert. Vollwertkost, vegetarische Gerichte und spezielle Zubereitungsarten (glutenfrei oder laktosefrei) sind ebenfalls erhältlich.

Die Umgebung des Hotels eignet sich für eine breite Palette von Sport- und Freizeitmöglichkeiten zu jeder Jahreszeit. Im Sommer können Sie sich beim Wandern, Radfahren, Mountainbiking, Reiten, Schwimmen, Tennis, Golf und Bergsteigen erholen. Im Winter bietet die Region ideale Bedingungen für jede Art von Wintersport. Sie ist bis spät in die Saison schneesicher. Ihre Gastgeber versorgen Sie gern mit Tipps und Informationen.",2026-05-02 05:51:54.517146+01,2026-05-02 05:51:54.517995+01
17c914e3-6e8e-4e5d-94ee-82d4dda3f82b,4e7aad13-ea99-47d0-8803-670cc2bfd0ab,b11856e1-9a41-427c-bc22-0526a7844a92,fr,"L’établissement Pension Stieber vous accueille à Kleinsölk, à 23 km de ce lieu d’intérêt : Gare de Vienne-Meidling. Il comprend un salon commun, une terrasse et un parking privé gratuit. Disposant d’une connexion Wi-Fi gratuite, cette auberge est à respectivement 32 km et 40 km environ de : Kulm et Dachstein Skywalk. Vous pourrez admirer la vue sur la montagne.

Tous les hébergements disposent d’un coin salon et d’une télévision à écran plat avec les chaînes du satellite. Vous bénéficierez d'une machine à café et d'une salle de bains privative dotée d’une douche. Certains hébergements possèdent également une cuisine équipée d’un réfrigérateur. Des serviettes et du linge de lit sont fournis.

Un petit-déjeuner continental est servi sur place.

Lors de votre séjour, vous pourrez pratiquer diverses activités à Kleinsölk et dans les environs, telles que la randonnée, le ski et le vélo.

L'aéroport le plus proche (Aéroport Wolfgang Amadeus Mozart de Salzbourg) est à 117 km.",2026-05-02 05:54:09.078014+01,2026-05-02 05:54:09.078516+01
2118e8c1-efb7-46fe-8123-7f14bd1a27bc,aa05dcd7-622d-420d-b9f4-86b40280e6cb,9bc21457-4e36-4ffb-9506-0efb8de70a09,de,"Die Unterkunft JUFA Hotel Weiz hat einen Garten, eine Gemeinschaftslounge, eine Terrasse und ein Restaurant in Weiz. Dieses Hotel mit 3 Sternen bietet ein Spa-Erlebnis mit einer Sauna und einem türkischen Dampfbad. Dieses Hotel bietet Stadtblick, einen Kinderspielplatz und kostenloses WLAN ist verfügbar in der ganzen Unterkunft.

In der Unterkunft JUFA Hotel Weiz sind die Zimmer ausgestattet mit einem Schreibtisch, einem Flachbild-TV, einem eigenen Badezimmer, Bettwäsche und Handtüchern. Alle Gästezimmer haben einen Safe.

Ein Frühstück wird angeboten und enthält als Buffet angebotene, à la carte und kontinentale Optionen.

Die Gäste in der Unterkunft JUFA Hotel Weiz können Aktivitäten in und um Weiz wie Wandern, Skifahren und Fahrradfahren genießen.

Katharinenkirche und Mausoleum liegt 29 km von der Unterkunft JUFA Hotel Weiz entfernt, während Glockenspiel 30 km von der Unterkunft entfernt ist. Der nächstgelegene Flughafen ist der Flughafen Graz, 40 km von der Unterkunft JUFA Hotel Weiz entfernt.",2026-05-02 05:58:02.228558+01,2026-05-02 05:58:02.229387+01
023f2b95-6f54-4192-a711-aae5e5185bb4,b248650a-b419-4045-b986-3d4059aa5ef2,9bc21457-4e36-4ffb-9506-0efb8de70a09,pt,"JUFA Hotel Weiz tem um jardim, salão partilhado, um terraço e restaurante em Weiz. Todas as acomodações neste hotel de 3 estrelas têm vistas da cidade, sauna e hammam. Os hóspedes podem desfrutar de uma bebida no bar.

No alojamento, os quartos têm secretária, televisão de ecrã plano, casa de banho privativa, roupa de cama e toalhas. Todos os quartos têm um cofre.

Os hóspedes podem apreciar pequeno-almoço buffet, à carta ou continental no alojamento.

JUFA Hotel Weiz oferece um parque infantil. Os hóspedes de JUFA Hotel Weiz poderão desfrutar de atividades em Weiz e arredores, como caminhadas, esqui e ciclismo.

Catedral e Mausoléu fica a 29 km de JUFA Hotel Weiz, enquanto Carrilhão está a 30 km da propriedade. O Aeroporto de Graz fica a 40 km de distância.",2026-05-02 06:00:31.425144+01,2026-05-02 06:00:31.426037+01
032aaa23-f0ab-4734-8fa5-f0162f4972e5,d60ebf6d-d025-4d2f-81b0-3c97c8bc3816,6250b7ac-53d8-4f78-b891-62955a6f0952,pt,"The 4-star superior Spa Resort Styria - ADULTS ONLY enjoys a quiet location in Styria’s thermal region. The 2,500 m² wellness and pool area is included from arrival day at 3 p.m. till departure day 11 a.m. and features natural thermal water and healthy refreshments such as tea and fruits.

The spacious rooms all come with a balcony or loggia, air conditioning, a seating area, a minibar, , a safe, and a bathroom with a hairdryer. Free WiFi is available.


A variety of massages and beauty treatments await you at the GOLD SPA. The highlight in the sauna area is the unique earth sauna.

In the panorama restaurant you will be spoilt with regional specialities with an international touch. The spa bistro serves light snacks and a selection of drinks, pastries and smoothies. Half-board includes breakfast and a 6-course menu of your choice in the evening.

The next-door Bad Waltersdorf Golf Course, featuring Feng Shui elements, offers ideal conditions for beginners as well as advanced golfers. Hotel guests benefit from a discount on the green fees.",2026-05-02 06:01:16.011495+01,2026-05-02 06:01:16.012316+01
2dad1a01-c2f9-4ff3-b898-094313f5814e,5a4adde5-ab81-40c2-8df5-5ddfaee3f9ff,b11856e1-9a41-427c-bc22-0526a7844a92,es,"Pension Stieber está en Kleinsölk, a 23 km de Castillo de Trautenfels, y dispone de alojamiento con salón de uso común, parking privado gratis y terraza. La posada u hostería tiene wifi gratis y está a unos 32 km de Kulm y a 40 km de Paseo aéreo de Dachstein. Hay vistas a la montaña.

Todas las habitaciones de este alojamiento están equipadas con zona de estar y TV de pantalla plana con canales vía satélite. Las habitaciones tienen cafetera y baño privado con ducha, y algunas también ofrecen cocina con nevera. En la posada u hostería, las habitaciones cuentan con ropa de cama y toallas.

En Pension Stieber se puede disfrutar de un desayuno continental.

La clientela puede practicar actividades en Kleinsölk y alrededores, como senderismo, esquí y ciclismo.

El aeropuerto (Aeropuerto de Salzburgo - W. A. Mozart) está a 117 km.",2026-05-02 05:51:30.427969+01,2026-05-02 05:51:30.428478+01
