id,hotel_id,url_id,language,fp,created_at,updated_at
494457a5-70e9-485e-ad52-57fcafd39c1d,a6a203ce-c44b-4707-a169-43b0d7f85eab,d19cc98c-6bb9-41f2-a1ec-ed37fdea77ec,it,"<p>Al check-in gli ospiti devono esibire un documento d'identità con foto e una carta di credito. Siete pregati di notare che le Richieste Speciali sono soggette a disponibilità, e potrebbero comportare l'addebito di un supplemento.</p><p>Siete pregati di comunicare in anticipo a South Bank l'orario in cui prevedete di arrivare. Potrete inserire questa informazione nella sezione Richieste Speciali al momento della prenotazione, o contattare la struttura utilizzando i recapiti riportati nella conferma della prenotazione.</p><p>La struttura non è disponibile per feste di addio al nubilato/celibato o simili.</p>",2026-04-09 12:51:34.307415+01,2026-04-09 12:51:34.307415+01
2a8573ef-c74e-4c38-a43a-93e776b0ac79,f914c21b-077b-4f1d-880b-392373bdada7,8e3dc794-8586-4faf-9120-ca6d327ee3c9,pt,"<p>No momento do check-in, os hóspedes deverão apresentar um documento de identificação com fotografia e um cartão de crédito.  Por favor, observe que todos os Pedidos Especiais estão sujeitos à disponibilidade e que poderão acarretar custos adicionais.</p><p>Por favor, informe Grace Bay Club antecipadamente sobre o seu horário de chegada. Para isso poderá utilizar a caixa de Pedidos Especiais durante o processo da reserva ou contactar a propriedade diretamente através dos dados para contacto providenciados na sua confirmação.</p><p>Em resposta ao Coronavírus (COVID-19), este alojamento está a tomar medidas de segurança e higienização adicionais.</p>",2026-04-09 12:52:02.247599+01,2026-04-09 12:52:02.247599+01
eca7f408-fcb3-4938-afac-021f3ad161cb,8e4a58cf-bf53-4a0e-99f7-be1fd7bc1b95,c8ea8d5e-13aa-4cc4-b036-a117e6155965,fr,"<p>Vous devrez présenter une pièce d'identité avec photo et une carte de crédit lors de l'enregistrement. Veuillez noter que toutes les demandes spéciales seront satisfaites sous réserve de disponibilité et pourront entraîner des frais supplémentaires.</p><p>Les enterrements de vie de célibataire et autres fêtes de ce type sont interdits dans cet établissement.</p><p>Les clients âgés de moins de 18 ans doivent être accompagnés d'un parent ou d'un tuteur légal pour pouvoir s'enregistrer.</p><p>Un dépôt de garantie d'un montant de US$100 est demandé à l'arrivée. Il devra être payé en espèces. Le remboursement devrait être effectué le jour de votre départ. Le dépôt de garantie vous sera entièrement remboursé en espèces, si aucun dommage n'a été constaté par l'établissement.</p>",2026-04-09 12:57:16.89539+01,2026-04-09 12:57:16.89539+01
aba2bda5-efbf-44bd-96bc-19a126451b0b,392893c7-b2a3-4abd-ae23-800902313aad,c8ea8d5e-13aa-4cc4-b036-a117e6155965,pt,"<p>No momento do check-in, os hóspedes deverão apresentar um documento de identificação com fotografia e um cartão de crédito.  Por favor, observe que todos os Pedidos Especiais estão sujeitos à disponibilidade e que poderão acarretar custos adicionais.</p><p>Esta propriedade não permite a realização de festas de despedida de solteiros(as) e festas semelhantes.</p><p>Os hóspedes com menos de 18 anos só podem fazer o check-in se acompanhados por um dos pais ou tutor legal.</p><p>É exigida uma caução de US$100 no momento da chegada. A caução será cobrada como um pagamento em numerário. O reembolso deverá ser feito durante o check-out. A sua caução será reembolsada na totalidade em numerário, após uma inspeção ao alojamento.</p>",2026-04-09 12:57:46.459991+01,2026-04-09 12:57:46.459991+01
02f4ca8e-7cf5-4ac0-87b1-1926de967714,2e654638-610c-49b3-b862-84df004d7688,5f10f9ca-785b-4553-964f-9cce2050a6f4,pt,"<p>Esta propriedade não permite a realização de festas de despedida de solteiros(as) e festas semelhantes.</p><p>É exigida uma caução de US$200 no momento da chegada. A caução será cobrada como um pagamento em numerário. O reembolso deverá ser feito durante o check-out. A sua caução será reembolsada na totalidade em numerário, após uma inspeção ao alojamento.</p>",2026-04-09 12:57:02.682684+01,2026-04-09 12:57:02.682684+01
ddcc0020-4eb2-4ce7-ad1d-64a80422202d,a841e938-4649-4a5c-8c3f-9d3a12c529b5,892ba5bf-4bf3-4904-bb62-3371f5a4f00e,en,"<p>Please note that the playground will be renovated from September 1, 2025, to September 30, 2025. During this time, the indoor play area will remain open and fully accessible.</p><p>Please inform Cheval Blanc Seychelles in advance of your expected arrival time. You can use the Special Requests box when booking, or contact the property directly with the contact details provided in your confirmation.</p><p>This property will not accommodate hen, stag or similar parties.</p>",2026-04-09 12:58:53.011035+01,2026-04-09 12:58:53.011035+01
cccc3fb6-b6fe-4b95-a024-ada5e62b438b,f979b7af-02b8-480e-a5c5-b304d5897ec3,892ba5bf-4bf3-4904-bb62-3371f5a4f00e,es,"<p>Please note that the playground will be renovated from September 1, 2025, to September 30, 2025. During this time, the indoor play area will remain open and fully accessible.</p><p>Informa a Cheval Blanc Seychelles con antelación de tu hora prevista de llegada. Para ello, puedes utilizar el apartado de peticiones especiales al hacer la reserva o ponerte en contacto directamente con el alojamiento. Los datos de contacto aparecen en la confirmación de la reserva.</p><p>En este alojamiento no se pueden celebrar despedidas de soltero o soltera ni fiestas similares.</p>",2026-04-09 13:00:19.207545+01,2026-04-09 13:00:19.207545+01
6ee4ce05-9351-4cbb-8c72-5de2de989866,537db033-22b4-44c6-a69a-1f915b00ed63,fa35c861-a806-4337-8790-8647ab5833bb,de,"<p>Ein früher Check-in und ein später Check-out unterliegen der Verfügbarkeit.</p><p>Die Kosten betragen:</p><p>100 EUR für einen frühen Check-in</p><p>50 EUR für einen späten Check-out bis 14:00 Uhr</p><p>100 EUR für einen späten Check-out bis 18:00 Uhr</p><p>Bitte beachten Sie, dass der Privatstrand mit Sonnenliegen für die Gäste reserviert ist.</p><p>Bitte beachten Sie, dass Ihnen eine kurze, nur 1-minütige Buggy-Fahrt zum Strand angeboten wird.</p><p>In dieser Unterkunft sind weder Junggesellen-/Junggesellinnenabschiede noch ähnliche Feiern erlaubt. </p><p>Bei der Ankunft ist eine Schadenskaution von € 100 erforderlich. Diese wird in bar hinterlegt. Sie erhalten die Erstattung in der Regel bei Abreise. Die Schadenskaution wird Ihnen in voller Höhe in bar erstattet, nachdem die Unterkunft überprüft wurde und keine Schäden festgestellt wurden.</p>",2026-04-09 13:00:33.649097+01,2026-04-09 13:00:33.649097+01
dd60b149-1220-4680-a65f-42d53b65bc1f,4accbbc2-01d6-44a3-9a2d-ab7996f12639,892ba5bf-4bf3-4904-bb62-3371f5a4f00e,de,"<p>Please note that the playground will be renovated from September 1, 2025, to September 30, 2025. During this time, the indoor play area will remain open and fully accessible.</p><p>Bitte teilen Sie der Unterkunft Cheval Blanc Seychelles Ihre voraussichtliche Ankunftszeit im Voraus mit. Nutzen Sie hierfür bei der Buchung das Feld für besondere Anfragen oder kontaktieren Sie die Unterkunft direkt.</p><p>In dieser Unterkunft sind weder Junggesellen-/Junggesellinnenabschiede noch ähnliche Feiern erlaubt. </p>",2026-04-09 13:01:10.374168+01,2026-04-09 13:01:10.374168+01
ba8faf2a-9bf1-43ae-a59b-01e9d3aa3685,cbbcdde9-3b3f-47af-8384-c8fed013e397,fa35c861-a806-4337-8790-8647ab5833bb,it,<p>Il check-in anticipato e il check-out tardivo sono soggetti a disponibilità.</p><p>I costi sono i seguenti:</p><p>Check-in anticipato: 100 €</p><p>- Check-out posticipato fino alle 14:00: 50 €</p><p>- Check-out posticipato fino alle 18:00: 100 €</p><p>La spiaggia privata con i lettini è riservata agli ospiti.</p><p>La spiaggia può essere raggiunta con un breve tragitto in buggy di 1 minuto.</p><p>La struttura non è disponibile per feste di addio al nubilato/celibato o simili.</p><p>È richiesto un deposito cauzionale di € 100 all'arrivo. Dovrai pagarlo in contanti. Dovresti ricevere il rimborso al momento del check-out. Il deposito ti sarà rimborsato per intero in contanti dopo una verifica dello stato dell'alloggio.</p>,2026-04-09 13:01:30.676505+01,2026-04-09 13:01:30.676505+01
a5db137d-7bb5-417c-acab-3fc7d7be0b59,fef7dcc7-53fb-4c00-8522-4771bfb1308f,892ba5bf-4bf3-4904-bb62-3371f5a4f00e,it,"<p>Please note that the playground will be renovated from September 1, 2025, to September 30, 2025. During this time, the indoor play area will remain open and fully accessible.</p><p>Siete pregati di comunicare in anticipo a Cheval Blanc Seychelles l'orario in cui prevedete di arrivare. Potrete inserire questa informazione nella sezione Richieste Speciali al momento della prenotazione, o contattare la struttura utilizzando i recapiti riportati nella conferma della prenotazione.</p><p>La struttura non è disponibile per feste di addio al nubilato/celibato o simili.</p>",2026-04-09 13:01:44.291396+01,2026-04-09 13:01:44.291396+01
8b393f63-67da-41cc-a889-0a449a9a9160,be7b1124-291a-4f4c-ad5c-b5c366a97439,fa35c861-a806-4337-8790-8647ab5833bb,fr,"<p>Un enregistrement anticipé et un départ tardif sont possibles, sous réserve de disponibilité.</p><p>Les coûts sont les suivants :</p><p>Enregistrement anticipé : 100 €</p><p>Départ tardif jusqu’à 14h00 : 50 €</p><p>Départ tardif jusqu’à 18h00 : 100 €</p><p>Veuillez noter que la plage privée est pourvue de chaises longues réservées aux clients.</p><p>Veuillez noter que tous les clients peuvent se rendre rapidement à la plage en buggy en 1 minute.</p><p>Les enterrements de vie de célibataire et autres fêtes de ce type sont interdits dans cet établissement.</p><p>Un dépôt de garantie d'un montant de € 100 est demandé à l'arrivée. Il devra être payé en espèces. Le remboursement devrait être effectué le jour de votre départ. Le dépôt de garantie vous sera entièrement remboursé en espèces, si aucun dommage n'a été constaté par l'établissement.</p>",2026-04-09 13:02:21.573975+01,2026-04-09 13:02:21.573975+01
2f9997b6-cea7-48e2-99c8-22cca59fbbe8,e40209f8-7272-404d-9883-0059b09e7c33,892ba5bf-4bf3-4904-bb62-3371f5a4f00e,fr,"<p>Please note that the playground will be renovated from September 1, 2025, to September 30, 2025. During this time, the indoor play area will remain open and fully accessible.</p><p>Veuillez informer l'établissement Cheval Blanc Seychelles à l'avance de l'heure à laquelle vous prévoyez d'arriver. Vous pouvez indiquer cette information dans la rubrique « Demandes spéciales » lors de la réservation ou contacter directement l'établissement. Ses coordonnées figurent sur votre confirmation de réservation.</p><p>Les enterrements de vie de célibataire et autres fêtes de ce type sont interdits dans cet établissement.</p>",2026-04-09 13:02:49.251237+01,2026-04-09 13:02:49.251237+01
e2634e2c-4fb0-4f19-80b9-f523b264a124,b09eccf8-e776-4022-9a3f-114f86f2cc17,fa35c861-a806-4337-8790-8647ab5833bb,pt,"<p>Early check-in and late check-out are subject to availability.</p><p>The costs are as follows:</p><p>Early check-in – €100</p><p>Late check-out until 14:00 – €50</p><p>Late check-out until 18:00 – €100</p><p>Please note that the private beach are with sun loungers are reserved for the guests.</p><p>Please note that quick 1-minute buggy ride to the beach is available for all the guests.</p><p>Esta propriedade não permite a realização de festas de despedida de solteiros(as) e festas semelhantes.</p><p>É exigida uma caução de € 100 no momento da chegada. A caução será cobrada como um pagamento em numerário. O reembolso deverá ser feito durante o check-out. A sua caução será reembolsada na totalidade em numerário, após uma inspeção ao alojamento.</p>",2026-04-09 13:03:01.345036+01,2026-04-09 13:03:01.345036+01
0d1aa7c7-31d3-4274-bea5-98f5b039410f,a9c5b16e-9da4-42d8-bcd4-6eb4c616d9b6,892ba5bf-4bf3-4904-bb62-3371f5a4f00e,pt,"<p>Please note that the playground will be renovated from September 1, 2025, to September 30, 2025. During this time, the indoor play area will remain open and fully accessible.</p><p>Por favor, informe Cheval Blanc Seychelles antecipadamente sobre o seu horário de chegada. Para isso poderá utilizar a caixa de Pedidos Especiais durante o processo da reserva ou contactar a propriedade diretamente através dos dados para contacto providenciados na sua confirmação.</p><p>Esta propriedade não permite a realização de festas de despedida de solteiros(as) e festas semelhantes.</p>",2026-04-09 13:03:39.954623+01,2026-04-09 13:03:39.954623+01
079d7567-75fa-4a39-aae1-4f59a0ca082d,5fef733a-b379-4009-a306-bee7ee5e4d92,833dd6af-6fa5-4277-82b0-d3107345a7c2,en,"<p>Based on local tax laws, Uruguayan citizens may be charged value added tax (VAT 10%) from November 15 to the day after Easter. This fee is not automatically calculated in the total costs for the reservation.</p>",2026-04-09 13:04:21.169946+01,2026-04-09 13:04:21.169946+01
de36fbb4-38d0-4500-bffc-5e144b99569a,95b604c0-8e2e-4fbe-9a01-c77c95954dfe,833dd6af-6fa5-4277-82b0-d3107345a7c2,es,"<p>De conformidad con las leyes fiscales locales, se podrá cobrar a los ciudadanos uruguayos el impuesto sobre el valor añadido (10% de IVA) desde el 15 de noviembre hasta el día después de la Pascua. Este impuesto no se incluye de forma automática en el importe total de la reserva.</p>",2026-04-09 13:05:00.611479+01,2026-04-09 13:05:00.611479+01
ea89f4fd-af31-4ff9-b4a9-004d085f391e,d7dc75ca-1de0-4fb3-be4e-ae5a0a174481,1b7ef680-c853-4ae6-bc39-76b033b566c8,en,"<p>Please note that this property does not offer installment payments.</p><p>Guests are required to show a photo identification and credit card upon check-in. Please note that all Special Requests are subject to availability and additional charges may apply.</p><p>In the event of an early departure, the property will charge you the full amount for your stay.</p><p>Parking is subject to availability due to limited spaces.</p><p>In response to Coronavirus (COVID-19), additional safety and sanitation measures are in effect at this property.</p><p>Due to Coronavirus (COVID-19), this property is taking steps to help protect the safety of guests and staff. Certain services and amenities may be reduced or unavailable as a result.</p><p>Due to Coronavirus (COVID-19), wearing a face mask is mandatory in all indoor common areas.</p><p>Guests need to meet one or more requirements to stay in this property: proof of full Coronavirus (Covid-19) vaccination, a recent valid negative Coronavirus PCR test, or recent proof of Coronavirus recovery.</p>",2026-04-09 13:04:39.729577+01,2026-04-09 13:04:39.729577+01
d227d412-8da5-4f9d-bc12-1652b299cd3e,df910ad6-c3f2-4bf1-8cc5-2b417ee62dfc,833dd6af-6fa5-4277-82b0-d3107345a7c2,de,"<p>Based on local tax laws, Uruguayan citizens may be charged value added tax (VAT 10%) from November 15 to the day after Easter. This fee is not automatically calculated in the total costs for the reservation.</p>",2026-04-09 13:05:59.374133+01,2026-04-09 13:05:59.374133+01
7eac1a29-50b5-4b90-95d4-c9884f94fdc8,d94c67ee-25cd-4b9b-afa4-61f843ed0554,1b7ef680-c853-4ae6-bc39-76b033b566c8,fr,"<p>Veuillez noter que cet établissement ne propose pas de paiements échelonnés.</p><p>Vous devrez présenter une pièce d'identité avec photo et une carte de crédit lors de l'enregistrement. Veuillez noter que toutes les demandes spéciales seront satisfaites sous réserve de disponibilité et pourront entraîner des frais supplémentaires.</p><p>En cas de départ anticipé, l'établissement vous facturera le montant total de votre séjour.</p><p>Les places de parking sont soumises à disponibilité.</p><p>Dans le cadre de la pandémie de coronavirus (COVID-19), cet établissement applique actuellement des mesures sanitaires supplémentaires.</p><p>En raison de la pandémie de coronavirus (COVID-19), cet établissement prend des mesures pour assurer la sécurité de ses clients et de son personnel. Certains services et équipements peuvent donc être réduits ou indisponibles.</p><p>En raison du coronavirus (COVID-19), le port du masque est obligatoire dans toutes les parties communes situées à l'intérieur de l'établissement.</p><p>Pour séjourner dans cet établissement, les voyageurs doivent disposer d'au moins un des documents suivants : un certificat de vaccination complète contre le coronavirus (COVID-19), un test PCR négatif récent ou un justificatif récent de rétablissement.</p>",2026-04-09 13:08:48.77603+01,2026-04-09 13:08:48.77603+01
89e7fda1-f75e-4367-b03a-4390780eeff0,22348805-54dd-4444-beec-f99bbdc0772d,cd40647c-1c21-4a4e-a34a-cb707707ec51,en,"<p>Please inform Manaus Hotéis Millennium in advance of your expected arrival time. You can use the Special Requests box when booking, or contact the property directly with the contact details provided in your confirmation.</p><p>In response to Coronavirus (COVID-19), additional safety and sanitation measures are in effect at this property.</p><p>Due to Coronavirus (COVID-19), this property is taking steps to help protect the safety of guests and staff. Certain services and amenities may be reduced or unavailable as a result.</p>",2026-04-09 13:11:30.482761+01,2026-04-09 13:11:30.482761+01
144bbd69-5261-44d1-98f4-3b43c72db68c,390765eb-4aee-4d85-8fa9-34fdee971ee5,51eb4654-1692-4646-9d18-90154c48bd6b,de,"<p>Minderjährige unter 18 Jahren in Begleitung eines Elternteils/Erziehungsberechtigten müssen einen gültigen Personalausweis oder eine Geburtsurkunde vorlegen.</p><p>Minderjährige unter 18 Jahren, die alleine reisen oder in Begleitung eines Erwachsenen, bei dem es sich weder um ein Elternteil noch um einen Erziehungsberechtigten handelt, müssen eine beglaubigte Einverständniserklärung vorlegen.</p><p>Bitte beachten Sie, dass der Restbetrag beim Check-in zu zahlen ist.</p><p>Bitte beachten Sie, dass die Parkplätze nach Verfügbarkeit vergeben werden.</p>",2026-04-09 13:12:46.874477+01,2026-04-09 13:12:46.874477+01
c7e8b1e9-f5bc-49f7-9ff0-b1b84879d4c7,7357e7b1-cca0-4bfe-8fbd-f796191fb8ef,51eb4654-1692-4646-9d18-90154c48bd6b,fr,"<p>Les mineurs de moins de 18 ans accompagnés par un parent/tuteur devront fournir une pièce d'identité en cours de validité ou un extrait d'acte de naissance.</p><p>Les mineurs de moins de 18 ans voyageant seuls ou accompagnés par un adulte, autre qu'un parent ou un tuteur, devront fournir une lettre de consentement certifiée.</p><p>Le montant restant dû vous sera facturé à l'enregistrement.</p><p>Veuillez noter que le parking fonctionne avec des spots rotatifs.</p>",2026-04-09 13:14:11.881552+01,2026-04-09 13:14:11.881552+01
4f744a91-cbff-4188-bed5-71ee62148612,c9a2f3b9-cd56-4c31-aec2-450239b8352e,1b7ef680-c853-4ae6-bc39-76b033b566c8,es,"<p>En este alojamiento no se puede pagar a plazos.</p><p>Los huéspedes deberán mostrar un documento de identidad válido y una tarjeta de crédito al realizar el registro de entrada. Ten en cuenta que todas las peticiones especiales están sujetas a disponibilidad y pueden comportar suplementos.</p><p>En caso de salida anticipada, el alojamiento te cargará el importe total de la estancia.</p><p>El aparcamiento está sujeto a disponibilidad, ya que las plazas son limitadas.</p><p>En respuesta al coronavirus (COVID-19), el alojamiento aplica medidas sanitarias y de seguridad adicionales en estos momentos.</p><p>A causa del coronavirus (COVID-19), este alojamiento está tomando medidas para garantizar la seguridad de los clientes y el personal. Por este motivo, algunos servicios e instalaciones pueden verse limitados o no estar disponibles.</p><p>Debido al coronavirus (COVID-19), es obligatorio llevar mascarilla en todas las zonas comunes interiores.</p><p>Para quedarte en este alojamiento, tienes que cumplir uno o varios de estos requisitos: certificado de vacunación completa contra el coronavirus (COVID-19), un test PCR válido con resultado negativo en coronavirus reciente o un certificado de haber pasado el coronavirus.</p>",2026-04-09 13:05:40.328925+01,2026-04-09 13:05:40.328925+01
209c2f19-5633-41b9-9bc2-f6c8684f531e,c1468690-7295-4ff6-8963-550e6b1f18f4,833dd6af-6fa5-4277-82b0-d3107345a7c2,it,"<p>Based on local tax laws, Uruguayan citizens may be charged value added tax (VAT 10%) from November 15 to the day after Easter. This fee is not automatically calculated in the total costs for the reservation.</p>",2026-04-09 13:07:36.929345+01,2026-04-09 13:07:36.929345+01
311aa968-0305-4c7f-82ec-a10a4394eeb4,bb13f6a9-2cf3-4b33-a5c5-e56d75296288,51eb4654-1692-4646-9d18-90154c48bd6b,en,"<p>Minors under the age of 18 accompanied by parent/documented guardian must provide valid ID or birth certificate.</p><p>Minors under the age of 18 travelling alone or accompanied by an adult other than a parent or documented guardian, must provide a certified letter of consent.</p><p>Please note the remaining amount of the reservation will be charged at check-in.</p><p>Please note that Parking works with rotating spots.</p>",2026-04-09 13:11:07.805052+01,2026-04-09 13:11:07.805052+01
886e3d6b-ad6b-40c3-9f88-9fe90a639512,0ad0e5b3-e8d9-458b-9ec7-32e3f642b8d9,cd40647c-1c21-4a4e-a34a-cb707707ec51,es,"<p>Informa a Manaus Hotéis Millennium con antelación de tu hora prevista de llegada. Para ello, puedes utilizar el apartado de peticiones especiales al hacer la reserva o ponerte en contacto directamente con el alojamiento. Los datos de contacto aparecen en la confirmación de la reserva.</p><p>En respuesta al coronavirus (COVID-19), el alojamiento aplica medidas sanitarias y de seguridad adicionales en estos momentos.</p><p>A causa del coronavirus (COVID-19), este alojamiento está tomando medidas para garantizar la seguridad de los clientes y el personal. Por este motivo, algunos servicios e instalaciones pueden verse limitados o no estar disponibles.</p>",2026-04-09 13:12:30.755801+01,2026-04-09 13:12:30.755801+01
f7112daa-067b-4f86-bdd1-713467ea1be8,09db0685-b2ca-4ebf-8265-3cca1e9cfc6d,cd40647c-1c21-4a4e-a34a-cb707707ec51,it,"<p>Siete pregati di comunicare in anticipo a Manaus Hotéis Millennium l'orario in cui prevedete di arrivare. Potrete inserire questa informazione nella sezione Richieste Speciali al momento della prenotazione, o contattare la struttura utilizzando i recapiti riportati nella conferma della prenotazione.</p><p>In risposta al Coronavirus (COVID-19) questa struttura ha adottato misure extra di sicurezza e igiene.</p><p>A causa del Coronavirus (COVID-19) questa struttura sta adottando misure per proteggere la salute degli ospiti e dello staff. Pertanto, alcuni servizi potrebbero essere ridotti o non disponibili, così come le dotazioni.</p>",2026-04-09 13:13:57.508701+01,2026-04-09 13:13:57.508701+01
b9a57189-84d2-4e8e-80be-781ea618c257,b830f522-e6de-4baf-9568-c332a36720b2,1b7ef680-c853-4ae6-bc39-76b033b566c8,de,"<p>Bitte beachten Sie, dass diese Unterkunft keine Ratenzahlung anbietet.</p><p>Beim Check-in müssen Sie einen Lichtbildausweis sowie eine Kreditkarte vorlegen. Sonderwünsche unterliegen der Verfügbarkeit und sind gegebenenfalls mit einem Aufpreis verbunden.</p><p>Im Falle einer verfrühten Abreise wird Ihnen die Unterkunft den vollen Buchungsbetrag in Rechnung stellen. </p><p>Parkplätze sind begrenzt und unterliegen der Verfügbarkeit.</p><p>Wegen des Coronavirus (COVID-19) wurden in dieser Unterkunft zusätzliche Sicherheits- und Hygienemaßnahmen unternommen.</p><p>Wegen des Coronavirus (COVID-19) hat diese Unterkunft Maßnahmen unternommen, um die Sicherheit der Gäste und des Personals zu gewährleisten. Bestimmte Services und Einrichtungen könnten daher nicht oder nur eingeschränkt zur Verfügung stehen. </p><p>Aufgrund des Coronavirus (COVID-19) ist das Tragen einer Gesichtsmaske in allen Aufenthaltsbereichen in Innenräumen verpflichtend.</p><p>Gäste müssen einen oder mehrere der folgenden Nachweise erbringen, um in der Unterkunft zu übernachten: Nachweis einer vollständigen Impfung gegen das Coronavirus (COVID-19), gültiger negativer PCR-Test auf das Coronavirus oder Nachweis über die Genesung vom Coronavirus.</p>",2026-04-09 13:06:13.972248+01,2026-04-09 13:06:13.972248+01
9c70146e-1226-483b-aad9-f0a640eb9069,2eb936b5-d41c-4d1e-aa05-4f12283b417e,833dd6af-6fa5-4277-82b0-d3107345a7c2,fr,"<p>Based on local tax laws, Uruguayan citizens may be charged value added tax (VAT 10%) from November 15 to the day after Easter. This fee is not automatically calculated in the total costs for the reservation.</p>",2026-04-09 13:09:03.088743+01,2026-04-09 13:09:03.088743+01
e1ae7608-60c5-44b5-8c13-3e37f11e05e6,966cf2e1-eedb-4549-8609-c90d7d8c534c,cd40647c-1c21-4a4e-a34a-cb707707ec51,de,"<p>Bitte teilen Sie der Unterkunft Manaus Hotéis Millennium Ihre voraussichtliche Ankunftszeit im Voraus mit. Nutzen Sie hierfür bei der Buchung das Feld für besondere Anfragen oder kontaktieren Sie die Unterkunft direkt.</p><p>Wegen des Coronavirus (COVID-19) wurden in dieser Unterkunft zusätzliche Sicherheits- und Hygienemaßnahmen unternommen.</p><p>Wegen des Coronavirus (COVID-19) hat diese Unterkunft Maßnahmen unternommen, um die Sicherheit der Gäste und des Personals zu gewährleisten. Bestimmte Services und Einrichtungen könnten daher nicht oder nur eingeschränkt zur Verfügung stehen. </p>",2026-04-09 13:13:02.808682+01,2026-04-09 13:13:02.808682+01
