id,hotel_id,url_id,language,ask,answer,created_at
452,b654dd13-fbb0-477b-858a-0a7e62c84446,16ac9bf5-78fc-4a3e-9dd2-997276f66d53,de,Welche Aktivitäten bietet die Unterkunft TAUROA Seehotel Grundlsee?,Die Unterkunft TAUROA Seehotel Grundlsee bietet folgende Aktivitäten/Services (es könnten Gebühren anfallen): Spa & Wellnesscenter Sauna Radfahren Wandern Skifahren Angeln Tennisplatz Golfplatz (max. 3 km entfernt) am Strand Wellness Reiten Fahrradverleih Strand Wellnesslounge/Ruhebereich Privater Strand,2026-04-12 23:23:58.734363+01
453,b654dd13-fbb0-477b-858a-0a7e62c84446,16ac9bf5-78fc-4a3e-9dd2-997276f66d53,de,Wie weit ist die Unterkunft TAUROA Seehotel Grundlsee vom Zentrum von Grundlsee entfernt?,Die Unterkunft TAUROA Seehotel Grundlsee ist 200 m vom Zentrum von Grundlsee entfernt.,2026-04-12 23:23:58.734363+01
454,b4d90118-9ce1-4afa-ba0c-c517f8103c27,16ac9bf5-78fc-4a3e-9dd2-997276f66d53,it,Che tipo di colazione offre TAUROA Seehotel Grundlsee?,"Durante il soggiorno, TAUROA Seehotel Grundlsee propone una colazione molto apprezzata dagli ospiti (punteggio recensioni: 10). Colazione disponibile: continentale vegetariana vegana a buffet",2026-04-12 23:25:55.611156+01
455,b4d90118-9ce1-4afa-ba0c-c517f8103c27,16ac9bf5-78fc-4a3e-9dd2-997276f66d53,it,Che tipo di camere posso prenotare presso TAUROA Seehotel Grundlsee?,TAUROA Seehotel Grundlsee offre: Matrimoniale,2026-04-12 23:25:55.611156+01
456,b4d90118-9ce1-4afa-ba0c-c517f8103c27,16ac9bf5-78fc-4a3e-9dd2-997276f66d53,it,Che orari di check-in e check-out sono previsti presso TAUROA Seehotel Grundlsee?,"Presso TAUROA Seehotel Grundlsee, il check-in può essere effettuato dalle 15:00, mentre il check-out è fino alle 11:00.",2026-04-12 23:25:55.611156+01
457,b4d90118-9ce1-4afa-ba0c-c517f8103c27,16ac9bf5-78fc-4a3e-9dd2-997276f66d53,it,Quanto costa soggiornare presso TAUROA Seehotel Grundlsee?,"I prezzi di TAUROA Seehotel Grundlsee possono variare in base a vari fattori (per es. date, condizioni dell'hotel, ecc). Per vedere i prezzi, inserisci le date del soggiorno.",2026-04-12 23:25:55.611156+01
458,b4d90118-9ce1-4afa-ba0c-c517f8103c27,16ac9bf5-78fc-4a3e-9dd2-997276f66d53,it,TAUROA Seehotel Grundlsee dispone di un ristorante in loco?,TAUROA Seehotel Grundlsee offre 1 ristoranti: Seehotel Grundlsee,2026-04-12 23:25:55.611156+01
459,b4d90118-9ce1-4afa-ba0c-c517f8103c27,16ac9bf5-78fc-4a3e-9dd2-997276f66d53,it,Quali servizi/attività sono disponibili presso TAUROA Seehotel Grundlsee?,TAUROA Seehotel Grundlsee offre i seguenti servizi/attività (alcuni a pagamento): Spa & centro benessere Sauna Escursioni in bicicletta Escursionismo Sci Pesca Campo da tennis Campo da golf (nel raggio di 3 km) Fronte spiaggia Servizi spa Equitazione Noleggio biciclette Spiaggia Sala spa/area relax Spiaggia privata,2026-04-12 23:25:55.611156+01
460,b4d90118-9ce1-4afa-ba0c-c517f8103c27,16ac9bf5-78fc-4a3e-9dd2-997276f66d53,it,Quanto dista TAUROA Seehotel Grundlsee dal centro di Grundlsee?,TAUROA Seehotel Grundlsee si trova a 200 m dal centro di Grundlsee.,2026-04-12 23:25:55.611156+01
461,fbd5bfde-c4ee-4269-bb53-52f39a2bf14a,16ac9bf5-78fc-4a3e-9dd2-997276f66d53,fr,Quel type de petit-déjeuner l'établissement TAUROA Seehotel Grundlsee sert-il ?,Les clients ayant déjà séjourné à l'établissement TAUROA Seehotel Grundlsee ont attribué une très bonne note à son petit-déjeuner : 10. L'établissement sert les types de petit-déjeuner suivants : Continental Végétarien Végétalien Buffet,2026-04-12 23:27:19.368791+01
462,fbd5bfde-c4ee-4269-bb53-52f39a2bf14a,16ac9bf5-78fc-4a3e-9dd2-997276f66d53,fr,Quel type d'hébergement puis-je réserver à l'établissement TAUROA Seehotel Grundlsee ?,L'établissement TAUROA Seehotel Grundlsee propose les options d'hébergement suivantes : Double,2026-04-12 23:27:19.368791+01
463,fbd5bfde-c4ee-4269-bb53-52f39a2bf14a,16ac9bf5-78fc-4a3e-9dd2-997276f66d53,fr,Quels sont les horaires d'arrivée et de départ à l'établissement TAUROA Seehotel Grundlsee ?,L'enregistrement à l'établissement TAUROA Seehotel Grundlsee se fait à partir de 15:00 et le départ est possible jusqu'à 11:00.,2026-04-12 23:27:19.368791+01
736,3a463d5c-a9f6-4158-a2cd-9fd519872664,faf035aa-27c8-45c7-b979-73fe7bc0a05a,es,Fecha de entrada - Fecha de salida,"",2026-04-13 00:20:34.687108+01
464,fbd5bfde-c4ee-4269-bb53-52f39a2bf14a,16ac9bf5-78fc-4a3e-9dd2-997276f66d53,fr,Quel est le tarif d'un séjour à l'établissement TAUROA Seehotel Grundlsee ?,"Les tarifs fixés par l'établissement TAUROA Seehotel Grundlsee peuvent varier en fonction de votre séjour (par ex. les dates que vous avez sélectionnées, les conditions de l'hôtel, etc.). Indiquez vos dates pour voir les tarifs.",2026-04-12 23:27:19.368791+01
465,fbd5bfde-c4ee-4269-bb53-52f39a2bf14a,16ac9bf5-78fc-4a3e-9dd2-997276f66d53,fr,L'établissement TAUROA Seehotel Grundlsee dispose-t-il un restaurant sur place ?,L'établissement TAUROA Seehotel Grundlsee propose 1 restaurant : Seehotel Grundlsee,2026-04-12 23:27:19.368791+01
466,fbd5bfde-c4ee-4269-bb53-52f39a2bf14a,16ac9bf5-78fc-4a3e-9dd2-997276f66d53,fr,Quelles activités l'établissement TAUROA Seehotel Grundlsee propose-t-il ?,L'établissement TAUROA Seehotel Grundlsee propose les activités et les services suivants (des frais peuvent s'appliquer) : Spa et centre de bien-être Sauna Cyclisme Randonnée Ski Pêche Court de tennis Parcours de golf (à moins de 3 km) En bord de plage Spa Équitation Location de vélos Plage Coin spa/relaxation Plage privée,2026-04-12 23:27:19.368791+01
467,fbd5bfde-c4ee-4269-bb53-52f39a2bf14a,16ac9bf5-78fc-4a3e-9dd2-997276f66d53,fr,L'établissement TAUROA Seehotel Grundlsee est-il proche du centre (Grundlsee) ?,L'établissement TAUROA Seehotel Grundlsee se trouve à 200 m du centre (Grundlsee).,2026-04-12 23:27:19.368791+01
468,396d1ed5-c99d-4166-9c3c-129618f7b5d8,16ac9bf5-78fc-4a3e-9dd2-997276f66d53,pt,Que tipo de pequeno-almoço é servido em TAUROA Seehotel Grundlsee?,Os hóspedes em TAUROA Seehotel Grundlsee podem desfrutar de um pequeno-almoço com boa pontuação durante a sua estadia (pontuação de comentários: 10). As opções de pequeno-almoço incluem: Continental Vegetariano Vegan Buffet,2026-04-12 23:28:22.290495+01
469,396d1ed5-c99d-4166-9c3c-129618f7b5d8,16ac9bf5-78fc-4a3e-9dd2-997276f66d53,pt,Que tipo de quarto posso reservar em TAUROA Seehotel Grundlsee?,As opções de quarto em TAUROA Seehotel Grundlsee incluem: Duplo,2026-04-12 23:28:22.290495+01
470,396d1ed5-c99d-4166-9c3c-129618f7b5d8,16ac9bf5-78fc-4a3e-9dd2-997276f66d53,pt,Quais são os horários de check-in e check-out em TAUROA Seehotel Grundlsee?,"Em TAUROA Seehotel Grundlsee, o check-in é a partir das 15:00 e o check-out até às 11:00.",2026-04-12 23:28:22.290495+01
471,396d1ed5-c99d-4166-9c3c-129618f7b5d8,16ac9bf5-78fc-4a3e-9dd2-997276f66d53,pt,Quanto custa hospedar-me em TAUROA Seehotel Grundlsee?,"Os preços em TAUROA Seehotel Grundlsee podem variar de acordo com os parâmetros da sua estadia (ex.: as datas que seleciona, as condições do hotel, entre outros). Insira as suas datas e consulte os preços.",2026-04-12 23:28:22.290495+01
472,396d1ed5-c99d-4166-9c3c-129618f7b5d8,16ac9bf5-78fc-4a3e-9dd2-997276f66d53,pt,TAUROA Seehotel Grundlsee tem um restaurante no local?,TAUROA Seehotel Grundlsee tem 1 restaurantes: Seehotel Grundlsee,2026-04-12 23:28:22.290495+01
473,396d1ed5-c99d-4166-9c3c-129618f7b5d8,16ac9bf5-78fc-4a3e-9dd2-997276f66d53,pt,Que atividades há em TAUROA Seehotel Grundlsee?,TAUROA Seehotel Grundlsee disponibiliza as seguintes atividades/serviços (podem-se aplicar custos): Spa e centro de bem-estar Sauna Ciclismo Caminhadas Esqui Pesca Campo de Ténis Campo de golfe (a menos de 3 km) Frente à praia Comodidades de spa Equitação Aluguer de bicicleta Praia Sala de spa/área de relaxamento Área de praia privada,2026-04-12 23:28:22.290495+01
474,396d1ed5-c99d-4166-9c3c-129618f7b5d8,16ac9bf5-78fc-4a3e-9dd2-997276f66d53,pt,A que distância fica TAUROA Seehotel Grundlsee do centro de Grundlsee?,TAUROA Seehotel Grundlsee fica a 200 m do centro de Grundlsee.,2026-04-12 23:28:22.290495+01
475,04cea431-dd1b-4857-adab-d07883c41523,74385387-cb93-4b1d-ac15-bb3ce99c62f0,en,What kind of breakfast is served at biYou Ecoquartier in den Bergen?,Guests staying at biYou Ecoquartier in den Bergen can enjoy a highly-rated breakfast during their stay (guest review score: 9). Breakfast option(s) include: Continental Vegetarian Vegan Gluten-free Buffet,2026-04-12 23:58:46.643004+01
476,04cea431-dd1b-4857-adab-d07883c41523,74385387-cb93-4b1d-ac15-bb3ce99c62f0,en,What type of room can I book at biYou Ecoquartier in den Bergen?,Room options at biYou Ecoquartier in den Bergen include: Family Triple Apartment Single Double Chalet Twin/Double,2026-04-12 23:58:46.643004+01
477,04cea431-dd1b-4857-adab-d07883c41523,74385387-cb93-4b1d-ac15-bb3ce99c62f0,en,What are the check-in and check-out times at biYou Ecoquartier in den Bergen?,"Check-in at biYou Ecoquartier in den Bergen is from 15:00, and check-out is until 10:00.",2026-04-12 23:58:46.643004+01
478,04cea431-dd1b-4857-adab-d07883c41523,74385387-cb93-4b1d-ac15-bb3ce99c62f0,en,How much does it cost to stay at biYou Ecoquartier in den Bergen?,"The prices at biYou Ecoquartier in den Bergen may vary depending on your stay (e.g. dates you select, hotel's policy etc.). See the prices by entering your dates.",2026-04-12 23:58:46.643004+01
479,04cea431-dd1b-4857-adab-d07883c41523,74385387-cb93-4b1d-ac15-bb3ce99c62f0,en,What is there to do at biYou Ecoquartier in den Bergen?,biYou Ecoquartier in den Bergen offers the following activities / services (charges may apply): Sauna Massage Cycling Hiking Children's playground Skiing Table tennis Canoeing Golf course (within 3 km) Horse riding Personal trainer Back massage Spa lounge/relaxation area Full body massage Spa facilities Foot massage Spa/wellness packages Yoga classes,2026-04-12 23:58:46.643004+01
480,04cea431-dd1b-4857-adab-d07883c41523,74385387-cb93-4b1d-ac15-bb3ce99c62f0,en,How far is biYou Ecoquartier in den Bergen from the centre of Schladming?,biYou Ecoquartier in den Bergen is 1.8 km from the centre of Schladming.,2026-04-12 23:58:46.643004+01
481,8dec9fc4-041f-4ecf-be3c-89bb8544c51e,8506dc8a-65ed-4be4-ae39-6fbf90823db3,en,What kind of breakfast is served at Alpengasthof Tanzstatt?,Guests staying at Alpengasthof Tanzstatt can enjoy a highly-rated breakfast during their stay (guest review score: 8.5). Breakfast option(s) include: Buffet,2026-04-12 23:59:01.039174+01
482,8dec9fc4-041f-4ecf-be3c-89bb8544c51e,8506dc8a-65ed-4be4-ae39-6fbf90823db3,en,What type of room can I book at Alpengasthof Tanzstatt?,Room options at Alpengasthof Tanzstatt include: Double Quadruple Family Triple,2026-04-12 23:59:01.039174+01
483,8dec9fc4-041f-4ecf-be3c-89bb8544c51e,8506dc8a-65ed-4be4-ae39-6fbf90823db3,en,What are the check-in and check-out times at Alpengasthof Tanzstatt?,"Check-in at Alpengasthof Tanzstatt is from 15:00, and check-out is until 10:00.",2026-04-12 23:59:01.039174+01
484,8dec9fc4-041f-4ecf-be3c-89bb8544c51e,8506dc8a-65ed-4be4-ae39-6fbf90823db3,en,How much does it cost to stay at Alpengasthof Tanzstatt?,"The prices at Alpengasthof Tanzstatt may vary depending on your stay (e.g. dates you select, hotel's policy etc.). See the prices by entering your dates.",2026-04-12 23:59:01.039174+01
485,8dec9fc4-041f-4ecf-be3c-89bb8544c51e,8506dc8a-65ed-4be4-ae39-6fbf90823db3,en,Does Alpengasthof Tanzstatt have a restaurant on site?,Alpengasthof Tanzstatt has 1 restaurants: Restaurant #1,2026-04-12 23:59:01.039174+01
486,8dec9fc4-041f-4ecf-be3c-89bb8544c51e,8506dc8a-65ed-4be4-ae39-6fbf90823db3,en,What is there to do at Alpengasthof Tanzstatt?,Alpengasthof Tanzstatt offers the following activities / services (charges may apply): Sauna Hiking Skiing Games room Walking tours,2026-04-12 23:59:01.039174+01
487,8dec9fc4-041f-4ecf-be3c-89bb8544c51e,8506dc8a-65ed-4be4-ae39-6fbf90823db3,en,How far is Alpengasthof Tanzstatt from the centre of Lachtal?,Alpengasthof Tanzstatt is 300 m from the centre of Lachtal.,2026-04-12 23:59:01.039174+01
488,8dec9fc4-041f-4ecf-be3c-89bb8544c51e,8506dc8a-65ed-4be4-ae39-6fbf90823db3,en,Is Alpengasthof Tanzstatt popular with families?,"Yes, Alpengasthof Tanzstatt is popular with guests booking family stays.",2026-04-12 23:59:01.039174+01
489,07e8b98a-1c96-44aa-9013-d0f77cd6ae65,8506dc8a-65ed-4be4-ae39-6fbf90823db3,es,¿Qué tipo de desayuno se sirve en Alpengasthof Tanzstatt?,"Los clientes de Alpengasthof Tanzstatt podrán disfrutar durante su estancia de un desayuno con muy buena puntuación (8,5) Las opciones del desayuno son: Buffet",2026-04-13 00:00:14.839708+01
490,07e8b98a-1c96-44aa-9013-d0f77cd6ae65,8506dc8a-65ed-4be4-ae39-6fbf90823db3,es,¿Qué tipo de habitación puedo reservar en Alpengasthof Tanzstatt?,Las opciones de habitación en Alpengasthof Tanzstatt son: Doble Cuádruple Familiar Triple,2026-04-13 00:00:14.839708+01
491,07e8b98a-1c96-44aa-9013-d0f77cd6ae65,8506dc8a-65ed-4be4-ae39-6fbf90823db3,es,¿Cuál es el horario de entrada y salida de Alpengasthof Tanzstatt?,Podrás hacer el check-in en Alpengasthof Tanzstatt a partir de las 15:00 y el check-out hasta las 10:00.,2026-04-13 00:00:14.839708+01
492,07e8b98a-1c96-44aa-9013-d0f77cd6ae65,8506dc8a-65ed-4be4-ae39-6fbf90823db3,es,¿Cuánto cuesta alojarse en Alpengasthof Tanzstatt?,"Los precios en Alpengasthof Tanzstatt pueden variar en función de la estancia (fechas, condiciones del hotel, etc.). Elige tus fechas para ver el precio.",2026-04-13 00:00:14.839708+01
493,07e8b98a-1c96-44aa-9013-d0f77cd6ae65,8506dc8a-65ed-4be4-ae39-6fbf90823db3,es,¿Hay restaurante dentro de Alpengasthof Tanzstatt?,Alpengasthof Tanzstatt tiene 1 restaurantes: Restaurant #1,2026-04-13 00:00:14.839708+01
494,07e8b98a-1c96-44aa-9013-d0f77cd6ae65,8506dc8a-65ed-4be4-ae39-6fbf90823db3,es,¿Qué se puede hacer en Alpengasthof Tanzstatt?,Alpengasthof Tanzstatt ofrece las siguientes actividades y servicios (se pueden aplicar cargos): Sauna Senderismo Esquí Sala de juegos Tours a pie,2026-04-13 00:00:14.839708+01
495,07e8b98a-1c96-44aa-9013-d0f77cd6ae65,8506dc8a-65ed-4be4-ae39-6fbf90823db3,es,¿A qué distancia está Alpengasthof Tanzstatt del centro de Lachtal?,Alpengasthof Tanzstatt está a 300 m del centro de Lachtal.,2026-04-13 00:00:14.839708+01
496,07e8b98a-1c96-44aa-9013-d0f77cd6ae65,8506dc8a-65ed-4be4-ae39-6fbf90823db3,es,¿Alpengasthof Tanzstatt gusta a las familias?,"Sí, Alpengasthof Tanzstatt suele gustar a las familias.",2026-04-13 00:00:14.839708+01
497,3bbc4761-4012-4e3b-bb9c-b493be35b01f,74385387-cb93-4b1d-ac15-bb3ce99c62f0,es,¿Qué tipo de desayuno se sirve en biYou Ecoquartier in den Bergen?,Los clientes de biYou Ecoquartier in den Bergen podrán disfrutar durante su estancia de un desayuno con muy buena puntuación (9) Las opciones del desayuno son: Continental Vegetariano Vegano Sin gluten Buffet,2026-04-13 00:00:30.321+01
498,3bbc4761-4012-4e3b-bb9c-b493be35b01f,74385387-cb93-4b1d-ac15-bb3ce99c62f0,es,¿Qué tipo de habitación puedo reservar en biYou Ecoquartier in den Bergen?,Las opciones de habitación en biYou Ecoquartier in den Bergen son: Familiar Triple Apartamento Individual Doble Chalet de montaña Doble - 1 o 2 camas,2026-04-13 00:00:30.321+01
499,3bbc4761-4012-4e3b-bb9c-b493be35b01f,74385387-cb93-4b1d-ac15-bb3ce99c62f0,es,¿Cuál es el horario de entrada y salida de biYou Ecoquartier in den Bergen?,Podrás hacer el check-in en biYou Ecoquartier in den Bergen a partir de las 15:00 y el check-out hasta las 10:00.,2026-04-13 00:00:30.321+01
500,3bbc4761-4012-4e3b-bb9c-b493be35b01f,74385387-cb93-4b1d-ac15-bb3ce99c62f0,es,¿Cuánto cuesta alojarse en biYou Ecoquartier in den Bergen?,"Los precios en biYou Ecoquartier in den Bergen pueden variar en función de la estancia (fechas, condiciones del hotel, etc.). Elige tus fechas para ver el precio.",2026-04-13 00:00:30.321+01
501,3bbc4761-4012-4e3b-bb9c-b493be35b01f,74385387-cb93-4b1d-ac15-bb3ce99c62f0,es,¿Qué se puede hacer en biYou Ecoquartier in den Bergen?,biYou Ecoquartier in den Bergen ofrece las siguientes actividades y servicios (se pueden aplicar cargos): Sauna Masajes Ciclismo Senderismo Zona de juegos para niños Esquí Ping pong Piragüismo Campo de golf (a menos de 3 km) Equitación Entrenador personal Masaje de espalda Zona de spa / relajación Masaje corporal completo Instalaciones de spa Masaje de pies Paquetes de spa / bienestar Clases de yoga,2026-04-13 00:00:30.321+01
502,3bbc4761-4012-4e3b-bb9c-b493be35b01f,74385387-cb93-4b1d-ac15-bb3ce99c62f0,es,¿A qué distancia está biYou Ecoquartier in den Bergen del centro de Schladming?,"biYou Ecoquartier in den Bergen está a 1,8 km del centro de Schladming.",2026-04-13 00:00:30.321+01
503,f3450d6a-0fed-4ccf-a91e-2d463fb6f631,8506dc8a-65ed-4be4-ae39-6fbf90823db3,de,Welche Art von Frühstück wird in der Unterkunft Alpengasthof Tanzstatt serviert?,"Gäste, die in der Unterkunft Alpengasthof Tanzstatt übernachten, können während ihres Aufenthaltes ein gut bewertetes Frühstück genießen (Gästebewertungsergebnis: 8,5). Verfügbare Frühstücksoption(en): Buffet",2026-04-13 00:00:50.665939+01
504,f3450d6a-0fed-4ccf-a91e-2d463fb6f631,8506dc8a-65ed-4be4-ae39-6fbf90823db3,de,Welche Art von Zimmer kann ich in der Unterkunft Alpengasthof Tanzstatt buchen?,Zimmeroptionen der Unterkunft Alpengasthof Tanzstatt zählen: Doppelzimmer Vierbettzimmer Familienzimmer Dreibettzimmer,2026-04-13 00:00:50.665939+01
505,f3450d6a-0fed-4ccf-a91e-2d463fb6f631,8506dc8a-65ed-4be4-ae39-6fbf90823db3,de,Wie lauten die Check-in- und Check-out-Zeiten in der Unterkunft Alpengasthof Tanzstatt?,"Der Check-in in der Unterkunft Alpengasthof Tanzstatt ist ab 15:00, und der Check-out ist bis 10:00.",2026-04-13 00:00:50.665939+01
506,f3450d6a-0fed-4ccf-a91e-2d463fb6f631,8506dc8a-65ed-4be4-ae39-6fbf90823db3,de,Wieviel kostet der Aufenthalt in der Unterkunft Alpengasthof Tanzstatt?,"Die Preise an der Unterkunft Alpengasthof Tanzstatt könnten je nach Aufenthalt variieren (z.B. gewählter Zeitraum, Hotelrichtlinie usw.). Wenn Sie Ihre Daten eingeben, können Sie die Preise sehen.",2026-04-13 00:00:50.665939+01
507,f3450d6a-0fed-4ccf-a91e-2d463fb6f631,8506dc8a-65ed-4be4-ae39-6fbf90823db3,de,Hat die Unterkunft Alpengasthof Tanzstatt ein Restaurant vor Ort?,Die Unterkunft Alpengasthof Tanzstatt hat 1 Restaurants: Restaurant #1,2026-04-13 00:00:50.665939+01
508,f3450d6a-0fed-4ccf-a91e-2d463fb6f631,8506dc8a-65ed-4be4-ae39-6fbf90823db3,de,Welche Aktivitäten bietet die Unterkunft Alpengasthof Tanzstatt?,Die Unterkunft Alpengasthof Tanzstatt bietet folgende Aktivitäten/Services (es könnten Gebühren anfallen): Sauna Wandern Skifahren Spielzimmer Touren zu Fuß,2026-04-13 00:00:50.665939+01
509,f3450d6a-0fed-4ccf-a91e-2d463fb6f631,8506dc8a-65ed-4be4-ae39-6fbf90823db3,de,Wie weit ist die Unterkunft Alpengasthof Tanzstatt vom Zentrum von Lachtal entfernt?,Die Unterkunft Alpengasthof Tanzstatt ist 300 m vom Zentrum von Lachtal entfernt.,2026-04-13 00:00:50.665939+01
510,f3450d6a-0fed-4ccf-a91e-2d463fb6f631,8506dc8a-65ed-4be4-ae39-6fbf90823db3,de,Ist die Unterkunft Alpengasthof Tanzstatt bei Familien beliebt?,"Ja, die Unterkunft Alpengasthof Tanzstatt ist bei Gästen beliebt, die Familienaufenthalte buchen.",2026-04-13 00:00:50.665939+01
511,fab4fe83-39c4-4db7-a760-03f4f32d743a,74385387-cb93-4b1d-ac15-bb3ce99c62f0,de,Welche Art von Frühstück wird in der Unterkunft biYou Ecoquartier in den Bergen serviert?,"Gäste, die in der Unterkunft biYou Ecoquartier in den Bergen übernachten, können während ihres Aufenthaltes ein gut bewertetes Frühstück genießen (Gästebewertungsergebnis: 9). Verfügbare Frühstücksoption(en): Kontinental Vegetarisch Vegan Glutenfrei Buffet",2026-04-13 00:01:22.580531+01
512,fab4fe83-39c4-4db7-a760-03f4f32d743a,74385387-cb93-4b1d-ac15-bb3ce99c62f0,de,Welche Art von Zimmer kann ich in der Unterkunft biYou Ecoquartier in den Bergen buchen?,Zimmeroptionen der Unterkunft biYou Ecoquartier in den Bergen zählen: Familienzimmer Dreibettzimmer Ferienwohnung Einzelzimmer Doppelzimmer Chalet Doppel-/Zweibettzimmer,2026-04-13 00:01:22.580531+01
513,fab4fe83-39c4-4db7-a760-03f4f32d743a,74385387-cb93-4b1d-ac15-bb3ce99c62f0,de,Wie lauten die Check-in- und Check-out-Zeiten in der Unterkunft biYou Ecoquartier in den Bergen?,"Der Check-in in der Unterkunft biYou Ecoquartier in den Bergen ist ab 15:00, und der Check-out ist bis 10:00.",2026-04-13 00:01:22.580531+01
514,fab4fe83-39c4-4db7-a760-03f4f32d743a,74385387-cb93-4b1d-ac15-bb3ce99c62f0,de,Wieviel kostet der Aufenthalt in der Unterkunft biYou Ecoquartier in den Bergen?,"Die Preise an der Unterkunft biYou Ecoquartier in den Bergen könnten je nach Aufenthalt variieren (z.B. gewählter Zeitraum, Hotelrichtlinie usw.). Wenn Sie Ihre Daten eingeben, können Sie die Preise sehen.",2026-04-13 00:01:22.580531+01
515,fab4fe83-39c4-4db7-a760-03f4f32d743a,74385387-cb93-4b1d-ac15-bb3ce99c62f0,de,Welche Aktivitäten bietet die Unterkunft biYou Ecoquartier in den Bergen?,Die Unterkunft biYou Ecoquartier in den Bergen bietet folgende Aktivitäten/Services (es könnten Gebühren anfallen): Sauna Massage Radfahren Wandern Kinderspielplatz Skifahren Tischtennis Kanusport Golfplatz (max. 3 km entfernt) Reiten Persönlicher Trainer Rückenmassage Wellnesslounge/Ruhebereich Ganzkörpermassage Wellness Fußmassage Wellnessangebote Yogaunterricht,2026-04-13 00:01:22.580531+01
516,fab4fe83-39c4-4db7-a760-03f4f32d743a,74385387-cb93-4b1d-ac15-bb3ce99c62f0,de,Wie weit ist die Unterkunft biYou Ecoquartier in den Bergen vom Zentrum von Schladming entfernt?,"Die Unterkunft biYou Ecoquartier in den Bergen ist 1,8 km vom Zentrum von Schladming entfernt.",2026-04-13 00:01:22.580531+01
517,b08e00c7-a3f9-48d8-b386-458aeaea3d6f,8506dc8a-65ed-4be4-ae39-6fbf90823db3,it,Che tipo di colazione offre Alpengasthof Tanzstatt?,"Durante il soggiorno, Alpengasthof Tanzstatt propone una colazione molto apprezzata dagli ospiti (punteggio recensioni: 8,5). Colazione disponibile: a buffet",2026-04-13 00:02:02.812251+01
519,b08e00c7-a3f9-48d8-b386-458aeaea3d6f,8506dc8a-65ed-4be4-ae39-6fbf90823db3,it,Che orari di check-in e check-out sono previsti presso Alpengasthof Tanzstatt?,"Presso Alpengasthof Tanzstatt, il check-in può essere effettuato dalle 15:00, mentre il check-out è fino alle 10:00.",2026-04-13 00:02:02.812251+01
520,b08e00c7-a3f9-48d8-b386-458aeaea3d6f,8506dc8a-65ed-4be4-ae39-6fbf90823db3,it,Quanto costa soggiornare presso Alpengasthof Tanzstatt?,"I prezzi di Alpengasthof Tanzstatt possono variare in base a vari fattori (per es. date, condizioni dell'hotel, ecc). Per vedere i prezzi, inserisci le date del soggiorno.",2026-04-13 00:02:02.812251+01
521,b08e00c7-a3f9-48d8-b386-458aeaea3d6f,8506dc8a-65ed-4be4-ae39-6fbf90823db3,it,Alpengasthof Tanzstatt dispone di un ristorante in loco?,Alpengasthof Tanzstatt offre 1 ristoranti: Restaurant #1,2026-04-13 00:02:02.812251+01
522,b08e00c7-a3f9-48d8-b386-458aeaea3d6f,8506dc8a-65ed-4be4-ae39-6fbf90823db3,it,Quali servizi/attività sono disponibili presso Alpengasthof Tanzstatt?,Alpengasthof Tanzstatt offre i seguenti servizi/attività (alcuni a pagamento): Sauna Escursionismo Sci Sala giochi Tour a piedi,2026-04-13 00:02:02.812251+01
523,b08e00c7-a3f9-48d8-b386-458aeaea3d6f,8506dc8a-65ed-4be4-ae39-6fbf90823db3,it,Quanto dista Alpengasthof Tanzstatt dal centro di Schönberg-Lachtal?,Alpengasthof Tanzstatt si trova a 300 m dal centro di Schönberg-Lachtal.,2026-04-13 00:02:02.812251+01
524,b08e00c7-a3f9-48d8-b386-458aeaea3d6f,8506dc8a-65ed-4be4-ae39-6fbf90823db3,it,Alpengasthof Tanzstatt è adatta per le famiglie?,"Sì, Alpengasthof Tanzstatt è molto richiesta per soggiorni in famiglia.",2026-04-13 00:02:02.812251+01
525,5312efad-59de-4fde-a250-cc0a7b9866bc,74385387-cb93-4b1d-ac15-bb3ce99c62f0,it,Che tipo di colazione offre biYou Ecoquartier in den Bergen?,"Durante il soggiorno, biYou Ecoquartier in den Bergen propone una colazione molto apprezzata dagli ospiti (punteggio recensioni: 9). Colazione disponibile: continentale vegetariana vegana senza glutine a buffet",2026-04-13 00:02:09.270035+01
526,5312efad-59de-4fde-a250-cc0a7b9866bc,74385387-cb93-4b1d-ac15-bb3ce99c62f0,it,Che tipo di camere posso prenotare presso biYou Ecoquartier in den Bergen?,biYou Ecoquartier in den Bergen offre: Familiare Tripla Appartamento Singola Matrimoniale Chalet Matrimoniale/Doppia con Letti Singoli,2026-04-13 00:02:09.270035+01
527,5312efad-59de-4fde-a250-cc0a7b9866bc,74385387-cb93-4b1d-ac15-bb3ce99c62f0,it,Che orari di check-in e check-out sono previsti presso biYou Ecoquartier in den Bergen?,"Presso biYou Ecoquartier in den Bergen, il check-in può essere effettuato dalle 15:00, mentre il check-out è fino alle 10:00.",2026-04-13 00:02:09.270035+01
528,5312efad-59de-4fde-a250-cc0a7b9866bc,74385387-cb93-4b1d-ac15-bb3ce99c62f0,it,Quanto costa soggiornare presso biYou Ecoquartier in den Bergen?,"I prezzi di biYou Ecoquartier in den Bergen possono variare in base a vari fattori (per es. date, condizioni dell'hotel, ecc). Per vedere i prezzi, inserisci le date del soggiorno.",2026-04-13 00:02:09.270035+01
529,5312efad-59de-4fde-a250-cc0a7b9866bc,74385387-cb93-4b1d-ac15-bb3ce99c62f0,it,Quali servizi/attività sono disponibili presso biYou Ecoquartier in den Bergen?,biYou Ecoquartier in den Bergen offre i seguenti servizi/attività (alcuni a pagamento): Sauna Massaggi Escursioni in bicicletta Escursionismo Area giochi Sci Ping-pong Canoa Campo da golf (nel raggio di 3 km) Equitazione Personal trainer Massaggi schiena Sala spa/area relax Massaggi corpo Servizi spa Massaggi piedi Pacchetti spa/benessere Lezioni di yoga,2026-04-13 00:02:09.270035+01
530,5312efad-59de-4fde-a250-cc0a7b9866bc,74385387-cb93-4b1d-ac15-bb3ce99c62f0,it,Quanto dista biYou Ecoquartier in den Bergen dal centro di Schladming?,"biYou Ecoquartier in den Bergen si trova a 1,8 km dal centro di Schladming.",2026-04-13 00:02:09.270035+01
