id,hotel_id,url_id,language,policy_name,policy_details,created_at
1524,747c8081-f590-4857-898b-a929c5b40a85,3f4fd583-a4ff-444b-b9f2-4fe3ec3b909c,fr,Enfants et lits,"Conditions relatives aux enfants Tous les enfants sont les bienvenus. Les enfants âgés de plus de 13 ans seront facturés au tarif adulte dans cet établissement. Pour voir les tarifs et les informations associés à la taille de votre groupe, veuillez ajouter à votre recherche le nombre d'enfants avec qui vous voyagez ainsi que leur âge. Conditions relatives aux lits bébé et aux lits d'appoint 0 - 3 ans Lit bébé sur demande Gratuit Plus de 4 ans Lit d'appoint sur demande € 25 par personne et par nuit Les frais supplémentaires associés aux lits bébé et aux lits d'appoint ne sont pas inclus dans le montant total et devront être payés séparément pendant votre séjour. Le nombre de lits bébé et de lits d'appoint disponibles dépend de l'option que vous choisissez. Veuillez consulter l'option sélectionnée pour obtenir plus d'informations. Tous les lits bébé et les lits d'appoint sont soumis à disponibilité. Conditions relatives aux enfants Conditions relatives aux lits bébé et aux lits d'appoint Tous les enfants sont les bienvenus. Les enfants âgés de plus de 13 ans seront facturés au tarif adulte dans cet établissement. Pour voir les tarifs et les informations associés à la taille de votre groupe, veuillez ajouter à votre recherche le nombre d'enfants avec qui vous voyagez ainsi que leur âge. Les frais supplémentaires associés aux lits bébé et aux lits d'appoint ne sont pas inclus dans le montant total et devront être payés séparément pendant votre séjour. Le nombre de lits bébé et de lits d'appoint disponibles dépend de l'option que vous choisissez. Veuillez consulter l'option sélectionnée pour obtenir plus d'informations. Tous les lits bébé et les lits d'appoint sont soumis à disponibilité.",2026-06-02 01:17:10.525974+01
1525,747c8081-f590-4857-898b-a929c5b40a85,3f4fd583-a4ff-444b-b9f2-4fe3ec3b909c,fr,Aucune restriction d'âge,Aucune restriction relative à l'âge ne s'applique pour l'enregistrement.,2026-06-02 01:17:10.531013+01
1526,747c8081-f590-4857-898b-a929c5b40a85,3f4fd583-a4ff-444b-b9f2-4fe3ec3b909c,fr,Animaux domestiques,Les animaux de compagnie sont admis (un supplément peut s'appliquer).,2026-06-02 01:17:10.534356+01
1527,747c8081-f590-4857-898b-a929c5b40a85,3f4fd583-a4ff-444b-b9f2-4fe3ec3b909c,fr,Groupes,Toute réservation de plus de 3 chambres peut entraîner des conditions particulières et des frais supplémentaires.,2026-06-02 01:17:10.538603+01
1528,747c8081-f590-4857-898b-a929c5b40a85,3f4fd583-a4ff-444b-b9f2-4fe3ec3b909c,fr,Moyens de paiement acceptés,Espèces,2026-06-02 01:17:10.542408+01
1532,3752e79f-6582-4c30-a781-230cb9a27762,3f4fd583-a4ff-444b-b9f2-4fe3ec3b909c,pt,Crianças e camas,"Condições de crianças Todas as crianças são bem-vindas. As crianças com 13 ou mais anos terão de pagar as tarifas de adulto neste alojamento. Para ver os preços corretos e a informação sobre a ocupação, por favor, adicione à sua pesquisa o número de crianças no seu grupo e as respetivas idades. Condições de berços e camas extra 0 - 3 anos Berço mediante pedido Gratuito Mais de 4 anos Cama extra mediante pedido € 25 por pessoa, por noite Os preços para berços e camas extra não estão incluídos no preço total e têm se ser pagos separadamente durante a sua estadia. O número permitido de camas extra e de berços está dependente da opção que escolher. Por favor, verifique a sua opção selecionada para mais informações. Todos os berços e camas extra estão sujeitos a disponibilidade. Condições de crianças Condições de berços e camas extra Todas as crianças são bem-vindas. As crianças com 13 ou mais anos terão de pagar as tarifas de adulto neste alojamento. Para ver os preços corretos e a informação sobre a ocupação, por favor, adicione à sua pesquisa o número de crianças no seu grupo e as respetivas idades. Os preços para berços e camas extra não estão incluídos no preço total e têm se ser pagos separadamente durante a sua estadia. O número permitido de camas extra e de berços está dependente da opção que escolher. Por favor, verifique a sua opção selecionada para mais informações. Todos os berços e camas extra estão sujeitos a disponibilidade.",2026-06-02 01:17:42.216178+01
1533,3752e79f-6582-4c30-a781-230cb9a27762,3f4fd583-a4ff-444b-b9f2-4fe3ec3b909c,pt,Sem restrições de idade,Não há restrições de idade para fazer check-in,2026-06-02 01:17:42.218298+01
1534,3752e79f-6582-4c30-a781-230cb9a27762,3f4fd583-a4ff-444b-b9f2-4fe3ec3b909c,pt,Animais de estimação,Animais de estimação: admitidos. Poderão aplicar-se custos adicionais.,2026-06-02 01:17:42.22064+01
1535,3752e79f-6582-4c30-a781-230cb9a27762,3f4fd583-a4ff-444b-b9f2-4fe3ec3b909c,pt,Grupos,"Ao reservar mais de 3 quartos, poderão aplicar-se condições diferentes e custos adicionais.",2026-06-02 01:17:42.223097+01
1536,3752e79f-6582-4c30-a781-230cb9a27762,3f4fd583-a4ff-444b-b9f2-4fe3ec3b909c,pt,Métodos de pagamento aceites,Dinheiro,2026-06-02 01:17:42.225391+01
1564,bfe1c10b-6adf-4bcc-b31b-2d85b0f10883,6f1200ef-6b11-4280-9451-0615bee3b831,es,Camas para niños,"Condiciones para estancias con niños Se pueden alojar niños de cualquier edad. Para ver la información correcta sobre precios y ocupación, añade a la búsqueda el número de niños con los que viajas y sus edades. Condiciones sobre cunas y camas supletorias 0 - 2 años Cuna a petición € 15 por niño y noche 3 - 14 años Cama supletoria a petición € 20 por niño y noche El precio de las cunas y las camas supletorias no está incluido en el precio total y se tiene que pagar por separado durante la estancia. El número de camas supletorias y cunas permitido depende de la opción que escojas. Consulta la opción que has escogido para saber más. Todas las cunas y camas supletorias están sujetas a disponibilidad. Condiciones para estancias con niños Condiciones sobre cunas y camas supletorias Se pueden alojar niños de cualquier edad. Para ver la información correcta sobre precios y ocupación, añade a la búsqueda el número de niños con los que viajas y sus edades. El precio de las cunas y las camas supletorias no está incluido en el precio total y se tiene que pagar por separado durante la estancia. El número de camas supletorias y cunas permitido depende de la opción que escojas. Consulta la opción que has escogido para saber más. Todas las cunas y camas supletorias están sujetas a disponibilidad.",2026-06-02 01:21:29.516168+01
1565,bfe1c10b-6adf-4bcc-b31b-2d85b0f10883,6f1200ef-6b11-4280-9451-0615bee3b831,es,No hay restricción por edad,No hay edad mínima para el check-in,2026-06-02 01:21:29.519312+01
1566,bfe1c10b-6adf-4bcc-b31b-2d85b0f10883,6f1200ef-6b11-4280-9451-0615bee3b831,es,Mascotas,Se admiten bajo petición. Se pueden aplicar suplementos.,2026-06-02 01:21:29.522509+01
1567,bfe1c10b-6adf-4bcc-b31b-2d85b0f10883,6f1200ef-6b11-4280-9451-0615bee3b831,es,Grupos,"Al reservar más de 5 habitaciones, podrán aplicarse condiciones especiales y suplementos.",2026-06-02 01:21:29.525417+01
1568,bfe1c10b-6adf-4bcc-b31b-2d85b0f10883,6f1200ef-6b11-4280-9451-0615bee3b831,es,Métodos de pago aceptados,Efectivo,2026-06-02 01:21:29.529461+01
1585,dfa12f57-a70e-482c-ba8c-b44cd2dc0724,a1f2eb45-8055-4796-a38d-e1c78cf0ff8c,it,Arrivo,Dalle 15:00 alle 22:00 Dovrai comunicare in anticipo alla struttura il tuo orario di arrivo.,2026-06-02 01:22:58.491256+01
1586,dfa12f57-a70e-482c-ba8c-b44cd2dc0724,a1f2eb45-8055-4796-a38d-e1c78cf0ff8c,it,Partenza,Dalle 06:30 alle 12:00,2026-06-02 01:22:58.497473+01
1587,dfa12f57-a70e-482c-ba8c-b44cd2dc0724,a1f2eb45-8055-4796-a38d-e1c78cf0ff8c,it,Cancellazione / Pagamento anticipato,Le condizioni relative alla cancellazione e al pagamento anticipato variano a seconda della tipologia di alloggio. Inserisci le date del soggiorno e verifica le condizioni dell'opzione scelta.,2026-06-02 01:22:58.502286+01
1588,dfa12f57-a70e-482c-ba8c-b44cd2dc0724,a1f2eb45-8055-4796-a38d-e1c78cf0ff8c,it,Bambini e letti,"Condizioni per i bambini I bambini di tutte le età sono i benvenuti. I bambini di 18 anni o più pagheranno quanto gli adulti presso questa struttura. Per vedere informazioni corrette relativamente a prezzi e occupazione, aggiungi alla ricerca il numero e l'età dei bambini che soggiorneranno. Condizioni per culle e letti aggiuntivi In questa struttura non c'è disponibilità di culle e letti supplementari. Condizioni per i bambini Condizioni per culle e letti aggiuntivi I bambini di tutte le età sono i benvenuti. I bambini di 18 anni o più pagheranno quanto gli adulti presso questa struttura. Per vedere informazioni corrette relativamente a prezzi e occupazione, aggiungi alla ricerca il numero e l'età dei bambini che soggiorneranno. In questa struttura non c'è disponibilità di culle e letti supplementari.",2026-06-02 01:22:58.5078+01
1589,dfa12f57-a70e-482c-ba8c-b44cd2dc0724,a1f2eb45-8055-4796-a38d-e1c78cf0ff8c,it,Età minima,L'età minima per fare il check-in è 18 anni.,2026-06-02 01:22:58.512664+01
1590,dfa12f57-a70e-482c-ba8c-b44cd2dc0724,a1f2eb45-8055-4796-a38d-e1c78cf0ff8c,it,Animali,Animali ammessi. Potrebbe essere richiesto un supplemento.,2026-06-02 01:22:58.517005+01
1591,dfa12f57-a70e-482c-ba8c-b44cd2dc0724,a1f2eb45-8055-4796-a38d-e1c78cf0ff8c,it,Gruppi,"Alle prenotazioni di oltre 4 camere, la struttura potrebbe applicare differenti condizioni e supplementi.",2026-06-02 01:22:58.522254+01
1592,dfa12f57-a70e-482c-ba8c-b44cd2dc0724,a1f2eb45-8055-4796-a38d-e1c78cf0ff8c,it,Metodi di pagamento accettati,Contanti,2026-06-02 01:22:58.52628+01
1580,6b731a36-0ff2-4919-adc6-9eec4de082b1,6f1200ef-6b11-4280-9451-0615bee3b831,de,Kinder und Betten,"Richtlinien für Kinder Kinder jeden Alters sind willkommen. Fügen Sie Ihrer Suche bitte die Anzahl der Kinder in Ihrer Gruppe und deren Alter hinzu, um die korrekten Preise und Belegungsinformationen zu sehen. Richtlinien zu Baby- und Zustellbetten 0 - 2 Jahre Babybett auf Anfrage € 15 pro Kind, pro Nacht 3 - 14 Jahre Zustellbett auf Anfrage € 20 pro Kind, pro Nacht Preise für Baby- und Zustellbetten sind nicht im Gesamtpreis enthalten und müssen separat während Ihres Aufenthaltes bezahlt werden. Die Anzahl an Zustell- und Babybetten ist von der von Ihnen gewählten Option abhängig. Bitte prüfen Sie Ihre ausgewählte Option für mehr Informationen. Alle Babybetten und Zustellbetten unterliegen der Verfügbarkeit. Richtlinien für Kinder Richtlinien zu Baby- und Zustellbetten Kinder jeden Alters sind willkommen. Fügen Sie Ihrer Suche bitte die Anzahl der Kinder in Ihrer Gruppe und deren Alter hinzu, um die korrekten Preise und Belegungsinformationen zu sehen. Preise für Baby- und Zustellbetten sind nicht im Gesamtpreis enthalten und müssen separat während Ihres Aufenthaltes bezahlt werden. Die Anzahl an Zustell- und Babybetten ist von der von Ihnen gewählten Option abhängig. Bitte prüfen Sie Ihre ausgewählte Option für mehr Informationen. Alle Babybetten und Zustellbetten unterliegen der Verfügbarkeit.",2026-06-02 01:22:19.364174+01
1581,6b731a36-0ff2-4919-adc6-9eec4de082b1,6f1200ef-6b11-4280-9451-0615bee3b831,de,Keine Altersbeschränkung,Es gibt keine Altersbeschränkung für den Check-in.,2026-06-02 01:22:21.049993+01
1582,6b731a36-0ff2-4919-adc6-9eec4de082b1,6f1200ef-6b11-4280-9451-0615bee3b831,de,Haustiere,Haustiere sind auf Anfrage gestattet. Möglicherweise fallen Gebühren an.,2026-06-02 01:22:21.052258+01
1583,6b731a36-0ff2-4919-adc6-9eec4de082b1,6f1200ef-6b11-4280-9451-0615bee3b831,de,Gruppen,Bei einer Buchung von mehr als 5 Zimmern können abweichende Richtlinien und zusätzliche Aufpreise gelten.,2026-06-02 01:22:21.055202+01
1584,6b731a36-0ff2-4919-adc6-9eec4de082b1,6f1200ef-6b11-4280-9451-0615bee3b831,de,Akzeptierte Zahlungsmethoden,Barzahlung,2026-06-02 01:22:21.05872+01
1596,39fe3759-0b20-4aba-bfd1-61d8c7620200,6f1200ef-6b11-4280-9451-0615bee3b831,it,Bambini e letti,"Condizioni per i bambini I bambini di tutte le età sono i benvenuti. Per vedere informazioni corrette relativamente a prezzi e occupazione, aggiungi alla ricerca il numero e l'età dei bambini che soggiorneranno. Condizioni per culle e letti aggiuntivi 0 - 2 anni Culla su richiesta € 15 per bambino, a notte 3 - 14 anni Letto supplementare su richiesta € 20 per bambino, a notte Il prezzo delle culle e dei letti supplementari non è incluso nell'importo totale e dovrà essere pagato separatamente durante il soggiorno. Il numero di culle e letti supplementari ammessi dipende dall'opzione che scegli. Controlla quella che hai selezionato per maggiori informazioni. Le culle e i letti supplementari sono soggetti a disponibilità. Condizioni per i bambini Condizioni per culle e letti aggiuntivi I bambini di tutte le età sono i benvenuti. Per vedere informazioni corrette relativamente a prezzi e occupazione, aggiungi alla ricerca il numero e l'età dei bambini che soggiorneranno. Il prezzo delle culle e dei letti supplementari non è incluso nell'importo totale e dovrà essere pagato separatamente durante il soggiorno. Il numero di culle e letti supplementari ammessi dipende dall'opzione che scegli. Controlla quella che hai selezionato per maggiori informazioni. Le culle e i letti supplementari sono soggetti a disponibilità.",2026-06-02 01:23:11.489027+01
1597,39fe3759-0b20-4aba-bfd1-61d8c7620200,6f1200ef-6b11-4280-9451-0615bee3b831,it,Nessuna età minima,Non è richiesta un'età minima per fare il check-in.,2026-06-02 01:23:11.491713+01
1598,39fe3759-0b20-4aba-bfd1-61d8c7620200,6f1200ef-6b11-4280-9451-0615bee3b831,it,Animali,Animali ammessi su richiesta. Potrebbe essere richiesto un supplemento.,2026-06-02 01:23:11.494069+01
1599,39fe3759-0b20-4aba-bfd1-61d8c7620200,6f1200ef-6b11-4280-9451-0615bee3b831,it,Gruppi,"Alle prenotazioni di oltre 5 camere, la struttura potrebbe applicare differenti condizioni e supplementi.",2026-06-02 01:23:11.496253+01
1600,39fe3759-0b20-4aba-bfd1-61d8c7620200,6f1200ef-6b11-4280-9451-0615bee3b831,it,Metodi di pagamento accettati,Contanti,2026-06-02 01:23:11.498454+01
1604,f186f43e-67ff-45de-86da-ae3215781fda,a1f2eb45-8055-4796-a38d-e1c78cf0ff8c,fr,Enfants et lits,"Conditions relatives aux enfants Tous les enfants sont les bienvenus. Les enfants âgés de plus de 18 ans seront facturés au tarif adulte dans cet établissement. Pour voir les tarifs et les informations associés à la taille de votre groupe, veuillez ajouter à votre recherche le nombre d'enfants avec qui vous voyagez ainsi que leur âge. Conditions relatives aux lits bébé et aux lits d'appoint Aucun lit d'appoint/bébé n'est disponible dans cet établissement. Conditions relatives aux enfants Conditions relatives aux lits bébé et aux lits d'appoint Tous les enfants sont les bienvenus. Les enfants âgés de plus de 18 ans seront facturés au tarif adulte dans cet établissement. Pour voir les tarifs et les informations associés à la taille de votre groupe, veuillez ajouter à votre recherche le nombre d'enfants avec qui vous voyagez ainsi que leur âge. Aucun lit d'appoint/bébé n'est disponible dans cet établissement.",2026-06-02 01:23:49.090561+01
1605,f186f43e-67ff-45de-86da-ae3215781fda,a1f2eb45-8055-4796-a38d-e1c78cf0ff8c,fr,Restriction relative à l'âge,Les clients doivent avoir au moins 18 ans pour pouvoir s'enregistrer.,2026-06-02 01:23:49.094315+01
1606,f186f43e-67ff-45de-86da-ae3215781fda,a1f2eb45-8055-4796-a38d-e1c78cf0ff8c,fr,Animaux domestiques,Les animaux de compagnie sont admis (un supplément peut s'appliquer).,2026-06-02 01:23:49.097006+01
1607,f186f43e-67ff-45de-86da-ae3215781fda,a1f2eb45-8055-4796-a38d-e1c78cf0ff8c,fr,Groupes,Toute réservation de plus de 4 chambres peut entraîner des conditions particulières et des frais supplémentaires.,2026-06-02 01:23:49.099192+01
1608,f186f43e-67ff-45de-86da-ae3215781fda,a1f2eb45-8055-4796-a38d-e1c78cf0ff8c,fr,Moyens de paiement acceptés,Espèces,2026-06-02 01:23:49.101054+01
1641,76bf877c-7b1a-417c-a90b-d4df00411eb7,4956889a-ddeb-458c-9fe2-8c89db1a5175,en,Check-in,From 15:00 to 00:00,2026-06-02 01:28:17.008769+01
1642,76bf877c-7b1a-417c-a90b-d4df00411eb7,4956889a-ddeb-458c-9fe2-8c89db1a5175,en,Check-out,Until 12:00,2026-06-02 01:28:17.0115+01
1643,76bf877c-7b1a-417c-a90b-d4df00411eb7,4956889a-ddeb-458c-9fe2-8c89db1a5175,en,Cancellation/ prepayment,Cancellation and prepayment policies vary according to accommodation type. Please enter the dates of your stay and check the conditions of your required option.,2026-06-02 01:28:17.013647+01
1644,76bf877c-7b1a-417c-a90b-d4df00411eb7,4956889a-ddeb-458c-9fe2-8c89db1a5175,en,Children and beds,"Child policies Children of any age are welcome. To see correct prices and occupancy information, please add the number of children in your group and their ages to your search. Cot and extra bed policies 0 - 3 years Cot upon request Free The number of cots allowed is dependent on the option you choose. Please check your selected option for more information. There are no extra beds available at this property. All cots are subject to availability. Child policies Cot and extra bed policies Children of any age are welcome. To see correct prices and occupancy information, please add the number of children in your group and their ages to your search. The number of cots allowed is dependent on the option you choose. Please check your selected option for more information. There are no extra beds available at this property. All cots are subject to availability.",2026-06-02 01:28:17.016004+01
1645,76bf877c-7b1a-417c-a90b-d4df00411eb7,4956889a-ddeb-458c-9fe2-8c89db1a5175,en,Age restriction,The minimum age for check-in is 18,2026-06-02 01:28:17.018131+01
1646,76bf877c-7b1a-417c-a90b-d4df00411eb7,4956889a-ddeb-458c-9fe2-8c89db1a5175,en,Pets,Pets are allowed. Charges may be applicable.,2026-06-02 01:28:17.020666+01
1647,76bf877c-7b1a-417c-a90b-d4df00411eb7,4956889a-ddeb-458c-9fe2-8c89db1a5175,en,Groups,"When booking more than 7 rooms, different policies and additional supplements may apply.",2026-06-02 01:28:17.023577+01
1648,76bf877c-7b1a-417c-a90b-d4df00411eb7,4956889a-ddeb-458c-9fe2-8c89db1a5175,en,Accepted payment methods,Cash,2026-06-02 01:28:17.026267+01
1657,3a9f3322-b62f-4505-b976-d27a3932e309,4956889a-ddeb-458c-9fe2-8c89db1a5175,es,Entrada,De las 15:00 a las 0:00,2026-06-02 01:29:12.842781+01
1658,3a9f3322-b62f-4505-b976-d27a3932e309,4956889a-ddeb-458c-9fe2-8c89db1a5175,es,Salida,Hasta las 12:00,2026-06-02 01:29:12.84484+01
1659,3a9f3322-b62f-4505-b976-d27a3932e309,4956889a-ddeb-458c-9fe2-8c89db1a5175,es,Cancelación /  prepago,Las condiciones de cancelación y de pago por adelantado pueden variar según el tipo de alojamiento. Introduce las fechas de tu estancia y consulta las condiciones de la opción que quieres reservar.,2026-06-02 01:29:12.846835+01
1660,3a9f3322-b62f-4505-b976-d27a3932e309,4956889a-ddeb-458c-9fe2-8c89db1a5175,es,Camas para niños,"Condiciones para estancias con niños Se pueden alojar niños de cualquier edad. Para ver la información correcta sobre precios y ocupación, añade a la búsqueda el número de niños con los que viajas y sus edades. Condiciones sobre cunas y camas supletorias 0 - 3 años Cuna a petición Gratis El número de cunas permitido depende de la opción que escojas. Consulta la opción que has escogido para saber más. No hay camas supletorias disponibles en este alojamiento. Todas las cunas están sujetas a disponibilidad. Condiciones para estancias con niños Condiciones sobre cunas y camas supletorias Se pueden alojar niños de cualquier edad. Para ver la información correcta sobre precios y ocupación, añade a la búsqueda el número de niños con los que viajas y sus edades. El número de cunas permitido depende de la opción que escojas. Consulta la opción que has escogido para saber más. No hay camas supletorias disponibles en este alojamiento. Todas las cunas están sujetas a disponibilidad.",2026-06-02 01:29:12.848742+01
1661,3a9f3322-b62f-4505-b976-d27a3932e309,4956889a-ddeb-458c-9fe2-8c89db1a5175,es,Restricción por edad,Edad mínima para el check-in: 18,2026-06-02 01:29:12.851223+01
1662,3a9f3322-b62f-4505-b976-d27a3932e309,4956889a-ddeb-458c-9fe2-8c89db1a5175,es,Mascotas,Se admiten. Se pueden aplicar suplementos.,2026-06-02 01:29:12.85395+01
1663,3a9f3322-b62f-4505-b976-d27a3932e309,4956889a-ddeb-458c-9fe2-8c89db1a5175,es,Grupos,"Al reservar más de 7 habitaciones, podrán aplicarse condiciones especiales y suplementos.",2026-06-02 01:29:12.856033+01
1664,3a9f3322-b62f-4505-b976-d27a3932e309,4956889a-ddeb-458c-9fe2-8c89db1a5175,es,Métodos de pago aceptados,Efectivo,2026-06-02 01:29:12.857914+01
1681,469f8d4b-5503-42c1-a2b6-20682e8c1cd5,97f417be-163f-46db-96ce-bf48f19fecb1,it,Arrivo,Dalle 15:00,2026-06-02 01:30:37.141682+01
1682,469f8d4b-5503-42c1-a2b6-20682e8c1cd5,97f417be-163f-46db-96ce-bf48f19fecb1,it,Partenza,Alle 12:00,2026-06-02 01:30:37.144374+01
1683,469f8d4b-5503-42c1-a2b6-20682e8c1cd5,97f417be-163f-46db-96ce-bf48f19fecb1,it,Cancellazione / Pagamento anticipato,Le condizioni relative alla cancellazione e al pagamento anticipato variano a seconda della tipologia di alloggio. Inserisci le date del soggiorno e verifica le condizioni dell'opzione scelta.,2026-06-02 01:30:37.146984+01
1684,469f8d4b-5503-42c1-a2b6-20682e8c1cd5,97f417be-163f-46db-96ce-bf48f19fecb1,it,Bambini e letti,"Condizioni per i bambini I bambini di tutte le età sono i benvenuti. I bambini di 12 anni o più pagheranno quanto gli adulti presso questa struttura. Per vedere informazioni corrette relativamente a prezzi e occupazione, aggiungi alla ricerca il numero e l'età dei bambini che soggiorneranno. Condizioni per culle e letti aggiuntivi 0 - 2 anni Culla su richiesta Gratis Il numero di culle ammesse dipende dall'opzione che scegli. Controlla quella che hai selezionato per maggiori informazioni. In questa struttura non c'è disponibilità di letti supplementari. Le culle sono soggette a disponibilità. Condizioni per i bambini Condizioni per culle e letti aggiuntivi I bambini di tutte le età sono i benvenuti. I bambini di 12 anni o più pagheranno quanto gli adulti presso questa struttura. Per vedere informazioni corrette relativamente a prezzi e occupazione, aggiungi alla ricerca il numero e l'età dei bambini che soggiorneranno. Il numero di culle ammesse dipende dall'opzione che scegli. Controlla quella che hai selezionato per maggiori informazioni. In questa struttura non c'è disponibilità di letti supplementari. Le culle sono soggette a disponibilità.",2026-06-02 01:30:37.149376+01
1685,469f8d4b-5503-42c1-a2b6-20682e8c1cd5,97f417be-163f-46db-96ce-bf48f19fecb1,it,Nessuna età minima,Non è richiesta un'età minima per fare il check-in.,2026-06-02 01:30:37.152069+01
1686,469f8d4b-5503-42c1-a2b6-20682e8c1cd5,97f417be-163f-46db-96ce-bf48f19fecb1,it,Animali,Animali ammessi. Potrebbe essere richiesto un supplemento.,2026-06-02 01:30:37.155036+01
1611,a817f8c1-8cc5-4744-afc8-f691440a56e0,6f1200ef-6b11-4280-9451-0615bee3b831,fr,Annulation / Prépaiement,Les conditions d'annulation et de prépaiement varient en fonction du type d'hébergement. Veuillez saisir les dates de votre séjour et consulter les conditions de l'option choisie.,2026-06-02 01:24:02.336725+01
1612,a817f8c1-8cc5-4744-afc8-f691440a56e0,6f1200ef-6b11-4280-9451-0615bee3b831,fr,Enfants et lits,"Conditions relatives aux enfants Tous les enfants sont les bienvenus. Pour voir les tarifs et les informations associés à la taille de votre groupe, veuillez ajouter à votre recherche le nombre d'enfants avec qui vous voyagez ainsi que leur âge. Conditions relatives aux lits bébé et aux lits d'appoint 0 - 2 ans Lit bébé sur demande € 15 par enfant et par nuit 3 - 14 ans Lit d'appoint sur demande € 20 par enfant et par nuit Les frais supplémentaires associés aux lits bébé et aux lits d'appoint ne sont pas inclus dans le montant total et devront être payés séparément pendant votre séjour. Le nombre de lits bébé et de lits d'appoint disponibles dépend de l'option que vous choisissez. Veuillez consulter l'option sélectionnée pour obtenir plus d'informations. Tous les lits bébé et les lits d'appoint sont soumis à disponibilité. Conditions relatives aux enfants Conditions relatives aux lits bébé et aux lits d'appoint Tous les enfants sont les bienvenus. Pour voir les tarifs et les informations associés à la taille de votre groupe, veuillez ajouter à votre recherche le nombre d'enfants avec qui vous voyagez ainsi que leur âge. Les frais supplémentaires associés aux lits bébé et aux lits d'appoint ne sont pas inclus dans le montant total et devront être payés séparément pendant votre séjour. Le nombre de lits bébé et de lits d'appoint disponibles dépend de l'option que vous choisissez. Veuillez consulter l'option sélectionnée pour obtenir plus d'informations. Tous les lits bébé et les lits d'appoint sont soumis à disponibilité.",2026-06-02 01:24:02.339011+01
1613,a817f8c1-8cc5-4744-afc8-f691440a56e0,6f1200ef-6b11-4280-9451-0615bee3b831,fr,Aucune restriction d'âge,Aucune restriction relative à l'âge ne s'applique pour l'enregistrement.,2026-06-02 01:24:02.341211+01
1614,a817f8c1-8cc5-4744-afc8-f691440a56e0,6f1200ef-6b11-4280-9451-0615bee3b831,fr,Animaux domestiques,Les animaux de compagnie sont admis sur demande (un supplément peut s'appliquer).,2026-06-02 01:24:02.34409+01
1615,a817f8c1-8cc5-4744-afc8-f691440a56e0,6f1200ef-6b11-4280-9451-0615bee3b831,fr,Groupes,Toute réservation de plus de 5 chambres peut entraîner des conditions particulières et des frais supplémentaires.,2026-06-02 01:24:02.346454+01
