id,hotel_id,url_id,language,description,created_at,updated_at
222b6fe8-45e6-4cca-9e0b-b6870668b92b,e61ae182-a66c-496b-b0bf-6ec8b1c23d06,57bbd9a4-9e6a-4849-9234-979f0428872f,pt,"Offering a sun terrace and spa centre, Sun Lodge Schladming is situated in Schladming in the Styria Region, 800 metres from Planai Bahn. Planai West is 1.4 km away. The 280m² spa area with an indoor pool, a sauna, a steam bath is available free of charge.

All units feature a dining area and a seating area with a cable flat-screen TV. Some units have a balcony and/or patio with mountain views. There is also a kitchen, fitted with a dishwasher, oven and toaster. A fridge and stovetop are also available, as well as a coffee machine and a kettle. Each unit features a private bathroom with a bath or shower.

The property has a ski pass sales point and ski storage space and bike hire is available. Car hire is available at the property and the area is popular for skiing. Congress Schladming is 600 metres from Sun Lodge Schladming, while Planai 1 is 800 metres from the property.

From mid-May to end-October, the Schladming-Dachstein Summer Card is included in the rate. This card offers many free benefits and discounts, including free use of local cable cars and buses.",2026-05-02 02:42:14.071684+01,2026-05-02 02:42:14.072151+01
693ec606-837b-44ee-a827-166e8c3861be,64dbe232-eace-4837-89c3-268ee7ec1aef,022eb309-b2e9-408a-b013-bc3c0ebc741e,en,"Comfortable Accommodations:JUFA Hotel Pöllau in Pöllau offers family rooms with private bathrooms, garden views, and modern amenities. Each room includes a work desk, TV, and wardrobe, ensuring a pleasant stay.Dining and Leisure:Guests can enjoy Austrian cuisine at the on-site restaurant or unwind at the bar. The hotel features a sun terrace, garden, and outdoor seating areas, perfect for relaxation. Free WiFi is available throughout the property.Convenient Location:Located 61 km from Graz Airport and 44 km from Schlaining Castle, the hotel provides easy access to local attractions. Skiing, hiking, and cycling activities are nearby, enhancing the guest experience.",2026-05-02 02:43:06.146862+01,2026-05-02 02:43:06.147593+01
4aaf51c6-1237-42b7-af19-5eee10fef59a,667eb1dc-bc61-413a-95d2-a833e450e1dc,022eb309-b2e9-408a-b013-bc3c0ebc741e,es,"JUFA Hotel Pöllau está en Pöllau, a 44 km de Castillo Schlaining, y dispone de alojamiento con jardín, parking privado, salón de uso común y terraza. Este hotel de 3 estrellas tiene wifi gratis, restaurante y bar. El cafetería es ideal para tomar algo.

En el hotel, las habitaciones cuentan con escritorio, TV de pantalla plana, baño privado, ropa de cama y toallas. Todas las habitaciones tienen caja fuerte, y algunas también ofrecen vistas a la ciudad. Las unidades tienen armario.

En el alojamiento se puede disfrutar de un desayuno buffet, continental o vegetariano.

JUFA Hotel Pöllau ofrece zona de juegos infantil. La clientela puede practicar actividades en Pöllau y alrededores, como senderismo, esquí y ciclismo.

El aeropuerto (Aeropuerto de Graz) está a 61 km.",2026-05-02 02:44:42.740945+01,2026-05-02 02:44:42.742807+01
804ae6ae-7211-4ef1-acc2-0c079b43cc22,1280644c-56d4-4a59-8955-147175fc53e5,022eb309-b2e9-408a-b013-bc3c0ebc741e,fr,"L’établissement JUFA Hotel Pöllau vous accueille à Pöllau, à 44 km de ce lieu d’intérêt : Château de Burg Schlaining. Il comprend un jardin, un salon commun, une terrasse et un parking privé. Cet hôtel 3 étoiles propose une connexion Wi-Fi gratuite, un restaurant et un bar. Vous pourrez prendre un verre au snack-bar sur place.

Les hébergements possèdent un bureau, une télévision à écran plat, une salle de bains privative, du linge de lit et des serviettes. Vous bénéficierez d'un coffre-fort. Certains hébergements possèdent également une vue sur la ville. Vous profiterez aussi d’une armoire.

Un petit-déjeuner buffet, continental ou végétarien est servi sur place.

Cet établissement dispose d’une aire de jeux pour enfants. Lors de votre séjour, vous pourrez pratiquer diverses activités à Pöllau et dans les environs, telles que la randonnée, le ski et le vélo.

L'aéroport le plus proche (Aéroport de Graz) est à 61 km.",2026-05-02 02:46:48.525833+01,2026-05-02 02:46:48.526361+01
955b7315-20cd-4b81-bf7f-eb2c395bbd8d,2448dec7-099d-480a-bff9-76d80b86c22c,af1e5e05-032f-4c11-8adf-3835fca61bf4,es,"Motel One Graz está muy bien situado en el barrio de Centro de la ciudad, Graz, a 3 min a pie de Ópera de Graz, a 500 metros de Glockenspiel y a 4 min a pie de Landeszeughaus. Este hotel de 3 estrellas ofrece bar y habitaciones con aire acondicionado, wifi gratis y baño privado. El alojamiento está a 600 metros del centro de la ciudad y a 7 min a pie de Catedral y Mausoleo.

Las habitaciones del alojamiento están equipadas con TV de pantalla plana y secador de pelo.

En el hotel se puede disfrutar de un desayuno buffet.

En la recepción 24 horas se habla alemán y inglés, y el personal estará encantado de ayudar en cualquier momento.

Cerca del alojamiento hay puntos de interés como Casino Graz, Torre del reloj de Graz y Ayuntamiento de Graz. El aeropuerto (Aeropuerto de Graz) está a 11 km.",2026-05-02 02:50:01.383003+01,2026-05-02 02:50:01.383817+01
5451cf86-1974-4440-8b3f-52c30f8df566,daa57ac8-1400-45ab-8655-8706a69e1fc4,af1e5e05-032f-4c11-8adf-3835fca61bf4,it,"In un’ottima zona nel quartiere Innere Stadt di Graz, Motel One Graz è situato a 300 metri da Opera di Graz, 500 metri da Carillon e 300 metri da Landhaus di Graz. Con un bar, l'hotel a 3 stelle presenta camere climatizzate con WiFi gratuito e bagno privato. La struttura dista 600 metri dal centro città e 600 metri da Cattedrale e Mausoleo.

Le camere presso questo hotel dispongono di TV a schermo piatto e asciugacapelli.

Presso Motel One Graz potrete gustare una colazione a buffet.

Lo staff della reception 24 ore su 24 è a disposizione in qualsiasi momento della giornata e parla tedesco e inglese.

I luoghi di interesse più famosi nei dintorni di questa struttura includono Casinò di Graz, Torre dell’Orologio di Graz e Municipio di Graz. Aeroporto di Graz - Thalerhof si trova a 11 km di distanza.",2026-05-02 02:52:33.900206+01,2026-05-02 02:52:33.901109+01
a88d9f06-a700-4c91-870c-81b2ff654def,9b975f4a-de72-4b70-89a7-bd5c2615cac0,922b0d89-7c94-4bf0-ab79-a823efb0d060,es,"Waldschlössl Gasthof se encuentra en Sankt Lorenzen ob Murau, a 28 km de Krakautal, y ofrece alojamiento con terraza, parking privado gratis, restaurante y bar. El hotel está a unos 7,1 km de KLH-Arena y a 41 km de Mauterndorf Castle. El hotel dispone de sauna y servicio de conserjería.

Todas las unidades de este alojamiento están equipadas con TV de pantalla plana con canales por cable. Las habitaciones de este alojamiento disponen de wifi gratis y de baño privado con ducha y secador de pelo. En el hotel, todas las habitaciones cuentan con ropa de cama y toallas.

En Waldschlössl Gasthof se sirve un desayuno buffet.

La zona es ideal para practicar senderismo y esquí, y hay alquiler de bicicletas eneste hotel de 3 estrellas.

El aeropuerto (Aeropuerto de Klagenfurt) está a 88 km.",2026-05-02 03:08:12.827107+01,2026-05-02 03:08:12.82794+01
5d4ec03b-85b8-4274-ac07-c05441fbd1df,600317ee-d5af-4c09-8e5d-eaa0acd15780,57bbd9a4-9e6a-4849-9234-979f0428872f,en,"Offering a sun terrace and spa centre, Sun Lodge Schladming is situated in Schladming in the Styria Region, 800 metres from Planai Bahn. Planai West is 1.4 km away. The 280m² spa area with an indoor pool, a sauna, a steam bath is available free of charge.

All units feature a dining area and a seating area with a cable flat-screen TV. Some units have a balcony and/or patio with mountain views. There is also a kitchen, fitted with a dishwasher, oven and toaster. A fridge and stovetop are also available, as well as a coffee machine and a kettle. Each unit features a private bathroom with a bath or shower.

The property has a ski pass sales point and ski storage space and bike hire is available. Car hire is available at the property and the area is popular for skiing. Congress Schladming is 600 metres from Sun Lodge Schladming, while Planai 1 is 800 metres from the property.

From mid-May to end-October, the Schladming-Dachstein Summer Card is included in the rate. This card offers many free benefits and discounts, including free use of local cable cars and buses.",2026-05-02 02:34:32.543466+01,2026-05-02 02:34:32.544571+01
a85c366c-3919-4990-b39b-d777eb72c453,3a057c96-10c8-4552-99e3-f0e6511d2100,a2fa730d-aacd-488a-8ef0-ed045c41ad6e,en,"Completely renovated in 2015, Hotel Aton is situated in a historic building in a residential area of Graz, about a 10-minute walk from the centre. The banks of the Mur River and the Augarten park with its public outdoor pool can be reached on foot in 5 minutes. Free WiFi is available in all areas and garage parking is available on site.

The rooms include a microwave oven, a refrigerator, a flat-screen TV and come with a private bathroom.

Stadthalle Graz is 700 metres from Hotel Aton, while Graz Opera House is 800 metres away. The nearest airport is Graz Airport, 13 km from the property.",2026-05-02 02:34:43.554551+01,2026-05-02 02:34:43.555314+01
52352ac4-3e51-4f53-be3d-5c805efbe5a1,885a9bae-7734-4f25-ab39-ce8cd268c071,a2fa730d-aacd-488a-8ef0-ed045c41ad6e,es,"El Hotel Aton ha sido reformado en su totalidad en 2015 y ocupa un edificio histórico de una zona residencial de Graz, ubicada a 10 minutos a pie del centro. La orilla del río Mura y la piscina pública al aire libre del parque Augarten quedan a 5 minutos a pie. Hay WiFi gratuita en todas las dependencias y aparcamiento en el garaje.

Las habitaciones incluyen horno microondas, nevera, TV de pantalla plana y baño privado.

El Hotel Aton se encuentra a 700 metros del estadio Stadthalle Graz, a 800 metros de la Ópera de Graz y a 13 km del aeropuerto de Graz, el más cercano.",2026-05-02 02:37:24.517464+01,2026-05-02 02:37:24.518656+01
40879791-f61c-44f7-b312-9fe422b1f989,152b81e1-f876-4041-8b04-19ff38e3fb4b,57bbd9a4-9e6a-4849-9234-979f0428872f,es,"Offering a sun terrace and spa centre, Sun Lodge Schladming is situated in Schladming in the Styria Region, 800 metres from Planai Bahn. Planai West is 1.4 km away. The 280m² spa area with an indoor pool, a sauna, a steam bath is available free of charge.

All units feature a dining area and a seating area with a cable flat-screen TV. Some units have a balcony and/or patio with mountain views. There is also a kitchen, fitted with a dishwasher, oven and toaster. A fridge and stovetop are also available, as well as a coffee machine and a kettle. Each unit features a private bathroom with a bath or shower.

The property has a ski pass sales point and ski storage space and bike hire is available. Car hire is available at the property and the area is popular for skiing. Congress Schladming is 600 metres from Sun Lodge Schladming, while Planai 1 is 800 metres from the property.

From mid-May to end-October, the Schladming-Dachstein Summer Card is included in the rate. This card offers many free benefits and discounts, including free use of local cable cars and buses.",2026-05-02 02:38:48.793881+01,2026-05-02 02:38:48.795875+01
76e6c019-faa9-4b4c-8627-28de71cdaeae,3308e480-8c5b-4822-8bc1-c31ebc9a8e1a,a2fa730d-aacd-488a-8ef0-ed045c41ad6e,fr,"Entièrement rénové en 2015, l'Hotel Aton occupe un bâtiment historique situé dans un quartier résidentiel de Graz, à environ 10 minutes à pied du centre-ville. Les rives de la Mur et le parc Augarten avec sa piscine extérieure publique sont accessibles en 5 minutes de marche. Vous bénéficierez d'une connexion Wi-Fi gratuite et d'un garage sur place.

Les chambres comprennent un micro-ondes, un réfrigérateur, une télévision à écran plat et une salle de bains privative.

La Stadthalle Graz se trouve à 700 mètres, tandis que l'opéra de Graz est à 800 mètres. L'aéroport le plus proche, celui de Graz, se tient, quant à lui, à 13 km.",2026-05-02 02:40:08.568681+01,2026-05-02 02:40:08.569373+01
2763e44a-ca0b-414d-92e2-30eed95a5589,fbc620ab-e40d-492e-8350-e5970b19b5f5,a2fa730d-aacd-488a-8ef0-ed045c41ad6e,pt,"Completamente renovado em 2015, o Hotel Aton está situado num edifício histórico numa área residencial de Graz, a cerca de 10 minutos a pé do centro. As margens do Rio Mur e o Parque Augarten, com a sua piscina exterior pública, podem ser alcançados em 5 minutos a pé. O acesso Wi-Fi gratuito está disponível em todas as áreas e o estacionamento na garagem está disponível no local.

Os quartos incluem um micro-ondas, um frigorífico, uma televisão de ecrã plano e uma casa de banho privativa.

O Hotel Aton está a 700 metros da Stadthalle Graz e a 800 metros da Ópera de Graz. O aeroporto mais próximo é o Aeroporto de Graz, a 13 km da propriedade.",2026-05-02 02:41:05.492008+01,2026-05-02 02:41:05.493322+01
737a7701-ea9c-4193-9c76-80fafac002fa,92ecaece-3ff4-4bec-8137-0bb3ca9d756e,57bbd9a4-9e6a-4849-9234-979f0428872f,fr,"Offering a sun terrace and spa centre, Sun Lodge Schladming is situated in Schladming in the Styria Region, 800 metres from Planai Bahn. Planai West is 1.4 km away. The 280m² spa area with an indoor pool, a sauna, a steam bath is available free of charge.

All units feature a dining area and a seating area with a cable flat-screen TV. Some units have a balcony and/or patio with mountain views. There is also a kitchen, fitted with a dishwasher, oven and toaster. A fridge and stovetop are also available, as well as a coffee machine and a kettle. Each unit features a private bathroom with a bath or shower.

The property has a ski pass sales point and ski storage space and bike hire is available. Car hire is available at the property and the area is popular for skiing. Congress Schladming is 600 metres from Sun Lodge Schladming, while Planai 1 is 800 metres from the property.

From mid-May to end-October, the Schladming-Dachstein Summer Card is included in the rate. This card offers many free benefits and discounts, including free use of local cable cars and buses.",2026-05-02 02:41:21.58299+01,2026-05-02 02:41:21.583717+01
37c278d0-c038-4832-9bbb-3a270b3d72e9,4288d548-a9d1-4380-a19d-aa5ad29421a0,12e5cabd-f750-453f-862d-a78ea97e8d4e,en,"This modern design hotel is a 2-minute walk from the Graz Messe Exhibition Centre and a 15-minute walk from the city centre. WiFi and wired internet are available free of charge. Lake Schwarzl is 17 km away.

The bright and modern rooms at  PLAZA INN Graz Messe are air-conditioned and feature a flat-screen TV, a safe, and a bathroom.

There is a bar and a lounge at the PLAZA INN Graz Messe. Buffet breakfast is available.

The Fröhlichgasse Tram Stop is right outside, and the Ostbahnhof Train Station is 200 metres away. The motorway is a 5-minute drive from the property, while Graz Airport can be reached in a 15-minute drive.",2026-05-02 02:43:29.99167+01,2026-05-02 02:43:29.992398+01
942fcd59-65d8-4e77-a111-2370486b6392,1280fa0a-fe48-4d83-b9a1-dcfc76eeddac,12e5cabd-f750-453f-862d-a78ea97e8d4e,es,"This modern design hotel is a 2-minute walk from the Graz Messe Exhibition Centre and a 15-minute walk from the city centre. WiFi and wired internet are available free of charge. Lake Schwarzl is 17 km away.

The bright and modern rooms at  PLAZA INN Graz Messe are air-conditioned and feature a flat-screen TV, a safe, and a bathroom.

There is a bar and a lounge at the PLAZA INN Graz Messe. Buffet breakfast is available.

The Fröhlichgasse Tram Stop is right outside, and the Ostbahnhof Train Station is 200 metres away. The motorway is a 5-minute drive from the property, while Graz Airport can be reached in a 15-minute drive.",2026-05-02 02:44:54.939012+01,2026-05-02 02:44:54.939955+01
66081962-13ee-4e90-9e28-70159effe22e,13bcc681-8d68-4f91-99a3-78b0b35efe6b,57bbd9a4-9e6a-4849-9234-979f0428872f,de,"Die Sun Lodge Schladming begrüßt Sie mit einer Sonnenterrasse und einem Spa in Schladming in der Steiermark, 800 m von der Plana Bahn entfernt. Hier wohnen Sie 1,4 km von der Talstation Planai West entfernt. Der 280 m² große Wellnessbereich mit Innenpool, Sauna sowie Dampfbad steht Ihnen kostenlos zur Verfügung.

Alle Wohneinheiten verfügen über einen Essbereich und einen Sitzbereich mit einem Flachbild-Kabel-TV. Einige bieten einen Balkon und/oder einen Patio mit Bergblick. Zur weiteren Ausstattung zählt eine Küche mit einem Geschirrspüler, einem Backofen, einem Toaster, einem Kühlschrank und einem Kochfeld. Eine Kaffeemaschine und ein Wasserkocher sind ebenfalls vorhanden. Jede Wohneinheit verfügt über ein eigenes Bad mit einer Badewanne oder einer Dusche.

Zu den weiteren Einrichtungen der Unterkunft gehören eine Verkaufsstelle für Skipässe, eine Skiaufbewahrung und ein Fahrradverleih. Außerdem arrangiert die Unterkunft gerne einen Mietwagen für Sie. Die Region eignet sich hervorragend zum Skifahren. Das Veranstaltungszentrum Congress Schladming liegt 600 m von der Sun Lodge Schladming entfernt, und den Skilift Planai 1 erreichen Sie nach 800 m.

Von Mitte Mai bis Ende Oktober ist die Schladming-Dachstein Sommercard im Preis inbegriffen. Diese Karte bietet Ihnen viele kostenlose Vorteile und Ermäßigungen, darunter die kostenlose Nutzung der regionalen Seilbahnen und Busse.",2026-05-02 02:39:51.280762+01,2026-05-02 02:39:51.281611+01
09ecbac4-4479-4a62-a680-51fca8229053,2b1e80c3-55cb-4286-9b8d-59a711264e8b,022eb309-b2e9-408a-b013-bc3c0ebc741e,de,"Die Unterkunft JUFA Hotel Pöllau, die in Pöllau, 44 km von Burg Schlaining entfernt gelegen ist, verfügt über Übernachtungsmöglichkeiten mit einem Garten, einem Privatparkplatz, einer Gemeinschaftslounge und einer Terrasse. Dieses Hotel mit 3 Sternen und kostenlosem WLAN verfügt über ein Restaurant und eine Bar. An der Snackbar können Sie bei einem Drink verweilen.

In der Unterkunft JUFA Hotel Pöllau sind die Zimmer ergänzt mit einem Schreibtisch, einem Flachbild-TV, einem eigenen Badezimmer, Bettwäsche und Handtüchern. Hier sind die Zimmer ausgestattet mit einem Safe – ausgewählte Zimmer sind zusätzlich belebt mit Stadtblick. Alle Gästezimmer haben einen Kleiderschrank.

Ein Frühstück wird angeboten und enthält als Buffet angebotene, kontinentale und vegetarische Optionen.

Die Unterkunft JUFA Hotel Pöllau bietet einen Kinderspielplatz. Die Gäste in der Unterkunft JUFA Hotel Pöllau können Aktivitäten in und um Pöllau wie Wandern, Skifahren und Fahrradfahren genießen.

Der nächstgelegene Flughafen ist der Flughafen Graz, 61 km von der Unterkunft JUFA Hotel Pöllau entfernt.",2026-05-02 02:45:34.802645+01,2026-05-02 02:45:34.803568+01
ae6611f1-eec4-4958-b65c-a2a0733ff9e4,16bf1085-e263-4c28-9b93-ce7c1d1ceda8,022eb309-b2e9-408a-b013-bc3c0ebc741e,pt,"JUFA Hotel Pöllau encontra-se em Pöllau, a 44 km de Castelo Schlaining, e apresenta acomodações com um jardim, estacionamento privado, um salão partilhado e um terraço. Este hotel de 3 estrelas dispõe de acesso Wi-Fi gratuito, um restaurante e um bar. Os hóspedes podem desfrutar de uma bebida no snack-bar.

No alojamento, os quartos incluem secretária, televisão de ecrã plano, casa de banho privativa, roupa de cama e toalhas. Os quartos estão equipados com um cofre e alguns quartos também possuem vistas da cidade. Todos os quartos têm roupeiro.

O alojamento disponibiliza opções de pequeno-almoço buffet, continental ou vegetariano.

JUFA Hotel Pöllau oferece um parque infantil. Os hóspedes de JUFA Hotel Pöllau poderão desfrutar de atividades em Pöllau e arredores, como caminhadas, esqui e ciclismo.

O Aeroporto de Graz fica a 61 km da propriedade.",2026-05-02 02:47:21.906352+01,2026-05-02 02:47:21.90712+01
568ffc25-02cd-46aa-88a7-d94abd8865bd,5bb651aa-97fa-4c1c-a1ee-35b9d2a6be92,12e5cabd-f750-453f-862d-a78ea97e8d4e,fr,"This modern design hotel is a 2-minute walk from the Graz Messe Exhibition Centre and a 15-minute walk from the city centre. WiFi and wired internet are available free of charge. Lake Schwarzl is 17 km away.

The bright and modern rooms at  PLAZA INN Graz Messe are air-conditioned and feature a flat-screen TV, a safe, and a bathroom.

There is a bar and a lounge at the PLAZA INN Graz Messe. Buffet breakfast is available.

The Fröhlichgasse Tram Stop is right outside, and the Ostbahnhof Train Station is 200 metres away. The motorway is a 5-minute drive from the property, while Graz Airport can be reached in a 15-minute drive.",2026-05-02 02:47:55.532413+01,2026-05-02 02:47:55.533023+01
b4594755-e202-495a-b011-9798abeada73,76e9f3af-e2fa-490d-bdf3-b8c011dde456,af1e5e05-032f-4c11-8adf-3835fca61bf4,de,"Dieses Hotel – sehr gut gelegen im Bezirk Innere Stadt – befindet sich 300 m von Opernhaus Graz, 500 m von Glockenspiel und 300 m von Grazer Landhaus entfernt. Dieses Hotel mit 3 Sternen besticht durch eine Bar und klimatisierte Zimmer mit kostenlosem WLAN, jedes mit einem eigenen Badezimmer. Die Unterkunft ist 600 m vom Zentrum der Stadt und 600 m von Katharinenkirche und Mausoleum entfernt.

Die Gästezimmer in der Unterkunft Motel One Graz sind ausgestattet mit einem Flachbild-TV und einem Haartrockner.

Ein als Buffet angebotenes Frühstück wird in der Unterkunft Motel One Graz angeboten.

Die Mitarbeitenden an der rund um die Uhr besetzten Rezeption, die Deutsch und Englisch sprechen, stehen Gästen jederzeit zur Verfügung.

In der Nähe der Unterkunft Motel One Graz finden Sie die interessanten Orte Casino Graz, Grazer Uhrturm und Rathaus Graz. Der nächstgelegene Flughafen ist der Flughafen Graz, 11 km von der Unterkunft Motel One Graz entfernt.",2026-05-02 02:51:08.47719+01,2026-05-02 02:51:08.478173+01
72744259-e37a-489d-8693-7a9525894838,713ef0f7-33d7-418b-a786-85258d723ed8,af1e5e05-032f-4c11-8adf-3835fca61bf4,fr,"L’établissement Motel One Graz se trouve dans le centre de Graz, à respectivement 600 mètres et 300 mètres de ces lieux d’intérêt : Cathédrale Saint-Gilles et mausolée et Opéra de Graz. Cet hôtel 3 étoiles propose un bar ainsi que des hébergements dotés de la climatisation, d’une connexion Wi-Fi gratuite et d’une salle de bains privative. Cet établissement non-fumeurs vous accueille à 500 mètres de : Glockenspiel.

Vous profiterez d'une télévision à écran plat et d'un sèche-cheveux.

Un petit-déjeuner buffet est servi sur place.

Le personnel de la réception parle allemand et anglais.

Vous séjournerez à proximité de ces lieux d’intérêt : Grazer Landhaus, Casino de Graz et Tour de l'Horloge de Graz. L'aéroport le plus proche (Aéroport de Graz) est à 11 km.",2026-05-02 02:53:25.997449+01,2026-05-02 02:53:25.998236+01
ca928939-b6a9-456e-b1d9-6d1fe61b0d31,356b46e8-4c97-4c8a-8fd0-15704099263b,ed5951dc-98de-4e70-9ce8-5e0a1f385542,it,"Situato a Tauplitzalm a un'altitudine di 1.650 metri sul livello del mare, l'Hotel Tauplitzalm occupa una posizione ideale all'interno del comprensorio sciistico di Tauplitz, accanto a percorsi da sci di fondo e a piste sciistiche.

Le camere sono tutte dotate di bagno privato e letti king-size, mentre alcune vantano un balcone con vista sulle montagne.

Presso il ristorante del Tauplitzalm potrete gustare specialità austriache. Il trattamento di mezza pensione comprende la prima colazione e la cena, che potrete gustare al coperto o sulla terrazza, ammirando la vista mozzafiato sul Monte Dachstein.

Durante il vostro soggiorno avrete modo di rilassarvi nella sauna o di sorseggiare un drink al bar. Provvista di freccette e ping pong, la struttura organizza inoltre serate di bingo ed escursioni notturne con le fiaccole.

Il Berghof Tauplitzalm si trova in una zona adatta alle escursioni estive,nelle vicinanze di 6 laghi alpini, di cui uno di proprietà dell'albergo e ideale per la pesca.",2026-05-02 02:57:35.670985+01,2026-05-02 02:57:35.671675+01
3d342e72-753a-41ee-80fa-f64e2a2c00a9,a499036a-4066-47e2-ada8-63e24502e48f,022eb309-b2e9-408a-b013-bc3c0ebc741e,it,"Ubicato a Pöllau, a 44 km da Castello di Schlaining, JUFA Hotel Pöllau propone un giardino, un parcheggio privato, una sala comune e una terrazza. Con WiFi gratuito, questo hotel a 3 stelle offre un ristorante e un bar. Gli ospiti possono rilassarsi sorseggiando un drink allo snack bar.

Presso questo hotel, le camere includono una scrivania, una TV a schermo piatto, un bagno privato, le lenzuola e gli asciugamani. Le camere sono dotate di una cassaforte e alcune camere vantano inoltre la vista sulla città. Tutte le camere hanno un armadio.

In struttura è disponibile una colazione a buffet, continentale o vegetariana.

JUFA Hotel Pöllau offre un’area giochi per bambini. Gli ospiti di questa struttura potranno svagarsi con varie attività a Pöllau e dintorni, come l’escursionismo, lo sci e il ciclismo.

Aeroporto di Graz - Thalerhof si trova a 61 km dalla struttura.",2026-05-02 02:46:18.882111+01,2026-05-02 02:46:18.883107+01
