id,hotel_id,url_id,language,description,created_at,updated_at
328997e1-5b32-4bbf-bd82-ec192d40835d,32f64db2-86bd-4050-84b7-1f125a4660c1,f2251410-f91e-4a8d-a96f-137d86228b17,en,"Wasser Palast provides good connections to Graz city centre 6 km away, having a bus stop right in front of the building.

Rooms at the Wasser Palast have a bathroom with a shower, a work desk, 2 single beds, a sofa bed for 1, and satellite TV. Furnishings are made from wood and framed art decorates the walls. Wi-Fi is available free of charge.

Many sites can be visited in Graz. Amongst these are the city’s Old Town, which is on the UNESCO World Heritage List. The town hall, opera house, and the Kunsthaus Museum of Modern Art are several other popular places to visit.

Private parking is available at the Wasser Palast free of charge, and the Mur River and Magna Car Factory are both just 300 metres away. The local supermarket can be reached on foot in 7 minutes.

2 motorway exits are just 1 km away, and the Murpark Shopping Mall and the Liebenau Football Stadium are both 3 km away.",2026-05-02 01:02:35.476479+01,2026-05-02 01:02:35.477849+01
df33352a-7a93-4393-93a0-9c270e4479e4,a9b0a675-14a3-4b72-b3e4-bfcf972ec65d,f2251410-f91e-4a8d-a96f-137d86228b17,es,"El Wasser Palast está bien comunicado con el centro de la ciudad de Graz, situado a 6 km, ya que hay una parada de autobús justo enfrente del edificio.

Las habitaciones del Wasser Palast disponen de baño con ducha, escritorio, 2 camas individuales, sofá cama para 1 persona, TV vía satélite, muebles de madera y obras de arte enmarcadas en la pared. Se ofrece WiFi gratis.

Entre los muchos lugares de interés de Graz se encuentran el centro histórico, declarado Patrimonio de la Humanidad por la UNESCO, el ayuntamiento, el teatro de la ópera y el Museo de Arte Moderno.

El Wasser Palast ofrece aparcamiento privado gratuito y se encuentra a 300 metros del río Mura y de la fábrica de coches Magna. Hay un supermercado a 7 minutos a pie.

El establecimiento está a solo 1 km de 2 salidas de autopista y a 3 km del centro comercial Murpark y del estadio de fútbol Liebenau.",2026-05-02 01:03:37.301677+01,2026-05-02 01:03:37.302442+01
fbf89e77-ea7f-4054-b19e-a3363fa59210,bd947f96-076f-4d7f-a43e-b28267874fe8,f2251410-f91e-4a8d-a96f-137d86228b17,de,"Das Hotel Wasser Palast mit Bushaltestelle direkt vor dem Gebäude bietet eine gute Anbindung in das 6 Kilometer entfernte Stadtzentrum von Graz.

Die Zimmer im Wasser Palast erwarten Sie mit einem Bad mit einer Dusche, einem Schreibtisch, 2 Einzelbetten, 1 Einzelschlafsofa und einem Sat-TV. Die mit Holzmöbeln eingerichteten Zimmer bestechen durch ihre Gestaltung mit gerahmten Bildern an den Wänden. WLAN nutzen Sie kostenfrei.

Freuen Sie sich auf die zahlreichen Sehenswürdigkeiten der Stadt Graz. Erkunden Sie die Grazer Altstadt, die zum Weltkulturerbe der UNESCO gehört. Zu den beliebtesten Sehenswürdigkeiten zählen das Rathaus, die Oper und das Kunsthaus.

Privatparkplätze stehen Ihnen am Hotel Wasser Palast kostenfrei zur Verfügung. Vom Fluss Mur und der Fabrik Magna Car trennen Sie jeweils nur 300 m. Einen lokalen Supermarkt erreichen Sie nach einem 7-minütigen Spaziergang.

Insgesamt 2 Autobahnausfahrten befinden sich nur 1 km entfernt. Zur Shoppingmall Murpark und zum Fußballstadion Liebenau gelangen Sie jeweils nach 3 km.",2026-05-02 01:04:43.792284+01,2026-05-02 01:04:43.79296+01
c7acc595-9c29-4943-9007-8ac528f94601,5fef893f-d2d6-4841-8231-7a18d438cb0e,f2251410-f91e-4a8d-a96f-137d86228b17,it,"Il Wasser Palast offre buoni collegamenti con il centro di Graz, a 6 km, con una fermata dell'autobus proprio di fronte all'edificio.

Le camere del Wasser Palast dispongono di bagno con doccia, scrivania, 2 letti singoli, divano-letto per 1, TV satellitare, arredi realizzati in legno e pareti decorate con opere incorniciate. Il WiFi è gratuito.

Graz ospita numerosi siti d'interesse, tra cui il centro storico, Patrimonio dell'Umanità dell'UNESCO, il municipio, il teatro dell'opera e il museo d'arte Kunsthaus.

Con un parcheggio privato gratuito, il Wasser Palast dista appena 300 metri dal fiume Mur e dalla Magna Car Factory, e 7 minuti a piedi dal supermercato locale.

A 1 km si trovano 2 uscite autostradali, mentre il centro commerciale Murpark e lo Stadion Graz-Liebenau sono ubicati a 3 km.",2026-05-02 01:06:01.960408+01,2026-05-02 01:06:01.961194+01
f2d7dd5d-6460-45d2-aade-2bfb83c90f65,1ba1f1dc-5e35-4d09-9ea7-8b69924c77ff,f2251410-f91e-4a8d-a96f-137d86228b17,fr,"Depuis le Wasser Palast, vous pourrez facilement rejoindre le centre-ville de Graz à 6 km, grâce à l'arrêt de bus placé juste en face.

Les chambres comprennent une salle de bains avec une douche, un bureau, 2 lits simples, un canapé-lit pour 1 personne et la télévision par satellite. Les meubles sont en bois et les murs sont ornés de cadres. Une connexion Wi-Fi est accessible gratuitement.

Lors de votre séjour, vous pourrez visiter de nombreux sites d'intérêt à Graz, dont la vieille ville, qui est classée au patrimoine mondial de l'UNESCO, l'hôtel de ville, l'opéra et le musée d'Art moderne Kunsthaus.

Un parking privé est disponible gratuitement sur place. La rivière Mur et l'usine d'assemblage de véhicules Magna ne sont qu'à 300 mètres. Le supermarché local se tient quant à lui à 7 minutes à pied.

Vous trouverez 2 sorties d'autoroute à seulement 1 km du Wasser Palast. Enfin, il vous faudra parcourir 3 km pour rejoindre le centre commercial Murpark et le stade de football Liebenau.",2026-05-02 01:06:59.735232+01,2026-05-02 01:06:59.735955+01
5e5bc169-a9d5-45a6-8d50-62d910287838,acc15ae1-d144-4caa-9680-37bda45b007d,f2251410-f91e-4a8d-a96f-137d86228b17,pt,"O Wasser Palast providencia boas ligações ao centro da cidade de Graz, a 6 km, com uma paragem de autocarro em frente ao edifício.

Os quartos do Wasser Palast incluem uma casa de banho com um chuveiro, uma secretária, 2 camas individuais, um sofá-cama para 1 pessoa e televisão por satélite. O mobiliário é feito de madeira e arte emoldurada a decorar as paredes. O acesso Wi-Fi está disponível gratuitamente.

Muitos locais podem ser visitados em Graz. Entre estes são a Cidade Velha da cidade, considerada Património Mundial da UNESCO. A Câmara Municipal, a ópera e o Museu Kunsthaus de Arte Moderna são outros locais populares para visitar.

O estacionamento privado está disponível no Wasser Palast gratuitamente, e o Rio Mur e a Fábrica de Carros Magna ficam apenas a 300 metros. O supermercado local pode ser alcançado em 7 minutos a pé.

As 2 saídas de auto-estradas estão apenas a 1 km, enquanto o Centro Comercial Murpark e o Estádio de Futebol Liebenau ficam a 3 km.",2026-05-02 01:08:12.183162+01,2026-05-02 01:08:12.183918+01
384b4c26-3d30-4093-803e-f93c44d00dee,328e8cdd-b288-48f6-8ae3-c4e1faf0a075,a767469e-71b3-434c-9b1f-1f779028dee8,en,"Located in Spielberg bei Knittelfeld, just 3 km from the Red Bull Ring, a motorsport circuit, Art Hotel Spielberg offers modern rooms and free WiFi access. The city of Knittelfeld is 2 km away.

The rooms all come with a desk, a flat-screen TV and a bathroom with shower and toilet. Each room can be used as a single, double or twin room.

Breakfast is served every morning at the Art Hotel Spielberg, and a vending machine is also on site. A pizza delivery service to the hotel is possible as well. Further facilities include a shared lounge, meeting rooms and a dry room for motorbike gear.

In summer, golfing is possible at the Golfclub Murtal which is 5 km away, and horse riding is possible 4 km from the hotel. The Murradweg, a cycling track, is 2 km away. An indoor kart racing track is 500 metres away.

In winter, the Gaal Ski Area can be reached in 16 km, while the Lachtal Ski Area is within 44 km. The Aqualux Thermal Bath is 13 km away.

Hotel best Sleep is a partner of the Alpine Freizeitgestaltung, a tour operator offering activities such as igloo building, ice fishing, snow shoe hiking, cycling and hiking tours and much more.

The property offers free parking. Graz Airport is 85 km away.",2026-05-02 01:36:07.535652+01,2026-05-02 01:36:07.53637+01
3ddf1631-267c-4112-ba2b-02d5f19dfadd,6edbcf7f-11c1-4fd9-a937-fe88d9c4e5dd,dab56161-4329-4fcb-b77e-0f7be5ed8146,en,"Comfortable Accommodation:Villa Dvor in Ohrid offers a guest house with a sun terrace, garden, and free WiFi. Guests enjoy private bathrooms with walk-in showers, air-conditioning, and soundproofing.Convenient Facilities:The property features a shared kitchen, coffee shop, outdoor seating area, and express check-in and check-out services. Additional amenities include a work desk, wardrobe, and free toiletries.Local Attractions:Saraiste Beach is a 4-minute walk away, Port Ohrid 700 metres nearby, and the Early Christian Basilica a 6-minute walk. Other points of interest include the Church of St. John at Kaneo and the Upper Gate.Activities and Surroundings:Guests can enjoy fishing, hiking, and cycling. The surrounding area offers lake and garden views, with quiet streets and inner courtyards. Ohrid Airport is 9 km from the property.",2026-05-02 01:36:37.565429+01,2026-05-02 01:36:37.565918+01
caa5273e-17b8-4778-b854-06456f305339,a42f39cd-fb08-4e84-8657-b5815d1772e5,dab56161-4329-4fcb-b77e-0f7be5ed8146,de,"Weniger als 300 m von Strand Saraiste und 700 m von Hafen von Ohrid entfernt in Ohrid gelegen, bietet die Unterkunft Villa Dvor Übernachtungsmöglichkeiten mit einem Garten. Diese Unterkunft verfügt über eine Gemeinschaftsküche und bietet Gästen außerdem eine Sonnenterrasse. Die allergikerfreundliche Unterkunft ist 500 m von Plaošnik entfernt gelegen.

In der Unterkunft Villa Dvor sind alle Zimmer ausgestattet mit einem Schreibtisch. Neben einem eigenen Badezimmer ausgestattet mit einer Dusche und kostenlosen Pflegeprodukten bieten die Zimmer in der Unterkunft Villa Dvor außerdem kostenloses WLAN – ausgewählte Zimmer sind ausgestattet mit einer Veranda / Patio. In der Unterkunft Villa Dvor sind alle Zimmer versehen mit Bettwäsche und Handtüchern.

Die Gäste in der Unterkunft Villa Dvor können Aktivitäten in und um Ohrid wie Wandern, Angeln und Fahrradfahren genießen.

In der Nähe der Unterkunft Villa Dvor finden Sie die interessanten Orte Church of St. John at Kaneo, Upper Gate und Icons Gallery. Der nächstgelegene Flughafen ist der Flughafen Ohrid, 9 km von der Unterkunft Villa Dvor entfernt.",2026-05-02 01:37:59.27348+01,2026-05-02 01:37:59.27409+01
fe351c7c-be72-4198-8e8c-2faa7e536184,e33ec5ad-4124-4095-ab18-97a440a20880,dab56161-4329-4fcb-b77e-0f7be5ed8146,it,"Con un giardino per gli ospiti, Villa Dvor offre camere a Ohrid a 300 metri da Spiaggia di Saraiste e 700 metri da Porto di Ocrida. Dotata di una cucina in comune, questa struttura offre ai propri ospiti anche una terrazza solarium. L'alloggio è interamente senza allergeni ed è situato a 500 metri da Complesso delle Basiliche Paleocristiane.

Presso questo affittacamere, tutte le camere sono dotate di una scrivania. Dotate di un bagno privato con doccia e set di cortesia, le camere di Villa Dvor offrono anche il WiFi gratuito, mentre alcune camere hanno un patio. Presso questa struttura, tutte le camere comprendono lenzuola e asciugamani.

Gli ospiti di Villa Dvor potranno svagarsi con varie attività a Ohrid e dintorni, come l’escursionismo, la pesca e il ciclismo.

I luoghi di interesse più famosi nei dintorni di questo affittacamere includono Church of St. John at Kaneo, Upper Gate e Icons Gallery. Aeroporto San Paolo Apostolo di Ocrida si trova a 9 km di distanza.",2026-05-02 01:39:13.425856+01,2026-05-02 01:39:13.426545+01
413e7817-7801-4447-b2be-33fcca3018e8,e950f314-3663-4a23-be93-9670b462cf73,dab56161-4329-4fcb-b77e-0f7be5ed8146,fr,"Proposant un jardin, l’établissement Villa Dvor vous accueille à Ohrid, à respectivement 300 mètres et 700 mètres de ces lieux d’intérêt : Plage Saraiste et Port de plaisance d’Ohrid. Il comprend une cuisine commune et une terrasse bien exposée. Cet établissement pour les personnes souffrant d'allergies se trouve à 500 mètres de : Monastère Saint-Pantaleimon.

Tous les hébergements possèdent un bureau. Les hébergements disposent d’une connexion Wi-Fi gratuite ainsi que d’une salle de bains privative dotée d’une douche et d'articles de toilette gratuits. Certains possèdent également un patio. Des serviettes et du linge de lit sont fournis.

Lors de votre séjour, vous pourrez pratiquer diverses activités à Ohrid et dans les environs, telles que la randonnée, la pêche et le vélo.

Vous séjournerez à proximité de ces lieux d’intérêt : Church of St. John at Kaneo, Upper Gate et Icons Gallery. L'aéroport le plus proche (Aéroport Saint-Paul l'Apôtre d'Ohrid) est à 9 km.",2026-05-02 01:40:20.783236+01,2026-05-02 01:40:20.784451+01
c737d93f-5e46-47bf-a45c-acf3ec346d39,64c1a3ec-4bbf-4261-a274-2fa8054b0096,dab56161-4329-4fcb-b77e-0f7be5ed8146,pt,"Apresentando um jardim, Villa Dvor disponibiliza quartos em Ohrid, a 4 minutos a pé de Praia Saraiste e 700 m de Porto Ohrid. Apresentando uma cozinha partilhada, este alojamento também dispõe de terraço para banhos de sol. Este alojamento antialérgico localiza-se a 6 minutos a pé de Basílica Paleocristã.

No alojamento, todos os quartos estão equipados com secretária. Apresentando uma casa de banho privativa com chuveiro e produtos de higiene pessoal gratuitos, os quartos do alojamento também disponibilizam acesso Wi-Fi gratuito, enquanto quartos selecionados têm pátio. No alojamento, todos os quartos incluem roupa de cama e toalhas.

Os hóspedes de Villa Dvor poderão desfrutar de atividades em Ohrid e arredores, como caminhadas, pesca e ciclismo.

Villa Dvor tem vários pontos de interesse populares nas suas proximidades, incluindo Church of St. John at Kaneo, Upper Gate e Icons Gallery. O Aeroporto de Ohrid fica a 9 km de distância.",2026-05-02 01:41:16.350699+01,2026-05-02 01:41:16.351438+01
b5f2f207-779e-4198-88f6-c6a4b27eae44,33fb5ad3-e207-46ae-a312-f402bac94b10,86397161-8ece-4a72-af8f-7600c591d453,en,"Hotel Adler*** Garni is 200 metres from the centre of Hirschegg and Heuberg Ski Area in the Kleinwalsertal Valley, and it features a small library and a restaurant with breakfast.

All rooms at the Adler come with satellite TV and a bathroom with bath or shower. Most of the rooms boast a balcony.

The ski bus stops 5 metres away and leaves every 10 minutes. Ski storage and a ski boot dryer and a free hotel safe at the reception are provided.

From 01 May to 03 November, the Bergbahnticket, entitling to free use of the mountain railways in the region, is included.",2026-05-02 01:42:05.321593+01,2026-05-02 01:42:05.322634+01
54d2f5de-6393-493b-9d1c-7209d599294d,05b7bedc-f1ab-454d-96fe-842e20ddc2f4,86397161-8ece-4a72-af8f-7600c591d453,de,"Das Hotel Adler Garni *** liegt 200 m vom Zentrum von Hirschegg und dem Skigebiet Heuberg im Kleinwalsertal entfernt und bietet eine kleine Bibliothek und ein Restaurant mit Frühstück.

Alle Zimmer im Adler sind mit Sat-TV und einem Badezimmer mit einer Badewanne oder einer Dusche ausgestattet. Die meisten Zimmer verfügen über einen Balkon.

In 5 m Entfernung hält ein alle 10 Minuten verkehrender Skibus. Ein Skiraum mit einem Skischuhtrockner sowie ein kostenfreier Hotelsafe an der Rezeption tragen zu Ihrem Komfort bei.

Bei Aufenthalten vom 01. Mai bis zum 03. November ist das Bergbahnticket inklusive, das Sie zur kostenfreien Nutzung der regionalen Bergbahnen berechtigt.",2026-05-02 01:43:57.153028+01,2026-05-02 01:43:57.153661+01
ce8f0641-471c-4d3c-9110-9c4add2183ee,bc5dcd36-99b2-406a-94d2-8892962ae413,5f0c9d39-8652-471b-bc6e-161d0a0f773a,it,"Situato a Spital am Semmering, a 26 km da Gruppo Montuoso del Rax, Hotel Sonnenalm Stuhleck prevede una piscina all’aperto stagionale, un parcheggio privato gratuito, un giardino e una sala comune. Provvisto di un ristorante, l’alloggio dispone anche di una terrazza, oltre a una sauna e una vasca idromassaggio. Gli ospiti possono usufruire di un bar.

Le camere presso questo hotel dispongono di una TV a schermo piatto con canali satellitari. Dotate di un bagno privato con doccia e set di cortesia, le camere di Hotel Sonnenalm Stuhleck offrono anche il WiFi gratuito, mentre alcune camere sono dotate di una vista piscina. Presso questa struttura, ogni camera prevede lenzuola e asciugamani.

Presso Hotel Sonnenalm Stuhleck potrete gustare una colazione a buffet.

La zona è famosa per attività quali l’escursionismo e lo sci, mentre presso questo hotel a 4 stelle è disponibile un servizio di noleggio dell’attrezzatura sciistica.

Pogusch è a 44 km da questo hotel, mentre Castello di Kapfenberg si trova a 46 km di distanza. Aeroporto di Vienna - Schwechat si trova a 105 km dalla struttura.",2026-05-02 01:45:23.232823+01,2026-05-02 01:45:23.233814+01
3a6dc4c9-76d9-4673-bf1c-b5eedf9183a2,1dbe358c-23eb-4a04-a4b7-a97bb469e695,dab56161-4329-4fcb-b77e-0f7be5ed8146,es,"Villa Dvor, que tiene jardín, ofrece habitaciones en Ohrid, a 4 min a pie de Playa de Saraiste y a 700 metros de Puerto de Ohrid. Este alojamiento, que cuenta con cocina compartida, también ofrece terraza solárium. Este alojamiento hipoalergénico se encuentra a 6 min a pie de Basílica Paleocristiana.

En el hostal o pensión, todas las habitaciones están equipadas con escritorio. Las habitaciones del alojamiento tienen wifi gratis y baño privado con ducha y artículos de aseo gratuitos. Algunas de las habitaciones tienen patio. En Villa Dvor, cada habitación incluye ropa de cama y toallas.

La clientela puede practicar actividades en Ohrid y alrededores, como senderismo, pesca y ciclismo.

Cerca del alojamiento hay puntos de interés como Church of St. John at Kaneo, Upper Gate y Icons Gallery. El aeropuerto (Aeropuerto de Ohrid) está a 9 km.",2026-05-02 01:37:34.166185+01,2026-05-02 01:37:34.166995+01
ff835c7c-e0fe-4015-9074-8426121d10c5,9c9a2bc9-ec52-455c-bcd0-436b8bda0c1c,a767469e-71b3-434c-9b1f-1f779028dee8,de,"Das Art Hotel Spielberg begrüßt Sie in Spielberg bei Knittelfeld, nur 3 km von der Motorsport-Rennstrecke Red Bull Ring entfernt. Es bietet Ihnen moderne Zimmer und kostenfreies WLAN. Die Stadt Knittelfeld liegt 2 km entfernt.

Alle Zimmer verfügen über einen Schreibtisch, einen Flachbild-TV und ein Badezimmer mit einer Dusche und einem WC. Jedes Zimmer kann als Einzel-, Doppel- oder Zweibettzimmer genutzt werden.

Im Art Hotel Spielberg wird Ihnen jeden Morgen ein Frühstück serviert und einen Verkaufsautomat finden Sie ebenfalls in der Unterkunft. Nutzen Sie auch einen Pizza-Lieferservice zum Hotel. Zur weiteren Ausstattung gehören eine Gemeinschaftslounge, Konferenzeinrichtungen und ein Trockenraum für Motorradbekleidung.

Im Sommer können Sie im 5 km entfernten Golfclub Murtal eine Partie Golf spielen. Reitmöglichkeiten befinden sich 4 km vom Hotel entfernt. Der Murradweg liegt 2 km entfernt. Von einer Indoor-Kartbahn trennen Sie 500 m.

Im Winter erreichen Sie das Skigebiet Gaal nach 16 km und das Skigebiet Lachtal nach 44 km. Zum Thermalbad Aqualux gelangen Sie nach 13 km.

Das Hotel best Sleep ist ein Partner des Veranstalters Alpine Freizeitgestaltung, der Ihnen Aktivitäten wie Iglubau, Eisfischen, Schneeschuhwandern, Rad- und Wandertouren sowie vieles mehr anbietet.

Die Parkplätze der Unterkunft nutzen Sie kostenfrei. Zum Flughafen Graz gelangen Sie nach 85 km.",2026-05-02 01:38:58.238093+01,2026-05-02 01:38:58.239087+01
95a0c483-36a4-4cc7-a4b0-b325b69bdcf0,d9431f98-008a-4793-a64c-da6de9427d0c,a767469e-71b3-434c-9b1f-1f779028dee8,fr,"Situé à Spielberg bei Knittelfeld, à seulement 3 km du circuit automobile Red Bull Ring, le Art Hotel Spielberg propose des chambres modernes et une connexion Wi-Fi gratuite. La ville de Knittelfeld est à 2 km.

Les chambres sont toutes dotées d'un bureau, d'une télévision à écran plat ainsi que d'une salle de bains avec une douche et des toilettes. Elles peuvent être aménagées avec un lit simple, un lit double ou des lits jumeaux.

Le petit-déjeuner est servi tous les matins au Art Hotel Spielberg et un distributeur automatique est à votre disposition sur place. Vous pourrez aussi vous faire livrer une pizza. L'hôtel compte également un salon commun, des salles de réunion et une salle de séchage pour les vêtements de moto.

En été, vous pourrez faire du golf au Golf Club Murtal, à 5 km, et de l'équitation à 4 km de l'hôtel. La piste cyclable Murradweg est à 2 km. Une piste de karting intérieur vous attend à 500 mètres.

En hiver, vous pourrez rejoindre le domaine skiable de Gaal, à 16 km, ou celui de Lachtal, à moins de 44 km. Les thermes Aqualux sont à 13 km.

L'Hotel best Sleep est partenaire du voyagiste Alpine Freizeitgestaltung qui organise des activités telles que la construction d'un igloo, la pêche sur glace ainsi que des randonnées pédestre, à vélo ou en raquettes, et bien plus encore.

Le stationnement est gratuit. L'aéroport de Graz est situé à 85 km.",2026-05-02 01:40:01.617937+01,2026-05-02 01:40:01.618668+01
ffded46b-7fcf-41f6-ac94-5808efd0fa4e,4ab63643-672d-4a95-aac9-c9d27ca02b9e,5f0c9d39-8652-471b-bc6e-161d0a0f773a,en,"Comfortable Accommodations:Hotel Sonnenalm Stuhleck in Spital am Semmering offers family rooms with private bathrooms, mountain views, and modern amenities. Each room includes a refrigerator, free toiletries, minibar, and TV.Exceptional Facilities:Guests enjoy ski-to-door access, a swimming pool with a view, sauna, sun terrace, and garden. Additional facilities include a spa, hot tub, and electric vehicle charging station. Free WiFi is available throughout the property.Dining Experience:The modern restaurant serves Italian cuisine for dinner and cocktails. A buffet breakfast is provided each morning. Outdoor seating and a coffee shop enhance the dining experience.Activities and Surroundings:The hotel is situated 105 km from Vienna International Airport and near winter sports attractions such as Neuberg Abbey (19 km) and Peter Rosegger Museum (19 km). Activities include skiing, hiking, and cycling.",2026-05-02 01:42:20.313795+01,2026-05-02 01:42:20.314414+01
08cc33b6-1ec8-439e-9df8-b7ae1c5be697,9ef0c7c0-27ae-4960-93fa-4c5e8fa2e7a3,5f0c9d39-8652-471b-bc6e-161d0a0f773a,es,"Hotel Sonnenalm Stuhleck se encuentra en Spital am Semmering, a 26 km de Rax, y ofrece alojamiento con piscina de temporada al aire libre, parking privado gratis, jardín y salón de uso común. El alojamiento cuenta con restaurante y también tiene terraza, sauna y bañera de hidromasaje. Hay bar.

Las habitaciones de este alojamiento están equipadas con TV de pantalla plana con canales vía satélite. Las habitaciones del alojamiento tienen baño privado con ducha y artículos de aseo gratuitos. También ofrecen wifi gratis, y algunas habitaciones están equipadas con vistas a la piscina. En el hotel, cada habitación está equipada con ropa de cama y toallas.

En Hotel Sonnenalm Stuhleck se puede disfrutar de un desayuno buffet.

La zona es ideal para practicar senderismo y esquí, y hay alquiler de equipamiento de esquí eneste hotel de 4 estrellas.

Pogusch está a 44 km del alojamiento, y Castillo de Kapfenberg está a 46 km. El aeropuerto (Aeropuerto internacional de Viena) está a 105 km.",2026-05-02 01:43:33.346288+01,2026-05-02 01:43:33.347652+01
aecb934a-84ad-4715-a5ac-103ed28dd14e,6052df23-8711-4f2a-95a9-ac9be8c0e322,86397161-8ece-4a72-af8f-7600c591d453,it,"Situato nella Valle Kleinwalsertal, a 200 m dal centro del comprensorio sciistico di Hirschegg e Heuberg, l'Hotel Adler*** Garni offre una piccola biblioteca e un ristorante con colazione.

Tutte le sistemazioni dell'Adler sono dotate di TV satellitare e bagno con vasca o doccia. La maggior parte delle sistemazioni vanta un balcone.

Lo skibus ferma a 5 metri di distanza e parte ogni 10 minuti. A vostra disposizione un deposito sci con asciuga scarponi e una cassaforte gratuita presso la reception.

Dal 1° maggio al 3 novembre, il Bergbahnticket offre l'uso gratuito delle ferrovie di montagna della regione.",2026-05-02 01:44:55.558359+01,2026-05-02 01:44:55.559434+01
e0d41d43-23de-4beb-a4ba-dbd91e3a67ea,4192fe1c-8bc2-4755-925f-11c4f3a9b7c2,5f0c9d39-8652-471b-bc6e-161d0a0f773a,fr,"L’établissement Hotel Sonnenalm Stuhleck se trouve à Spital am Semmering, à 26 km de ce lieu d’intérêt : Rax. Il propose une piscine extérieure ouverte en saison, un jardin, un salon commun et un parking privé gratuit. Il possède un restaurant, une terrasse, un sauna et un bain à remous. Vous pourrez profiter d'un bar.

Les hébergements disposent d’une télévision à écran plat avec les chaînes du satellite. Les hébergements disposent d’une connexion Wi-Fi gratuite ainsi que d’une salle de bains privative dotée d’une douche et d'articles de toilette gratuits. Certains offrent également une vue sur la piscine. Des serviettes et du linge de lit sont fournis.

Un petit-déjeuner buffet est servi sur place.

La région est prisée des amateurs de randonnée et de ski, et cet hôtel 4 étoiles assure un service de location d’équipement de ski.

Vous séjournerez à respectivement 44 km et 46 km de ces lieux d’intérêt : Pogusch et Château de Kapfenberg. L'aéroport le plus proche (Aéroport de Vienne-Schwechat) est à 105 km.",2026-05-02 01:46:14.9122+01,2026-05-02 01:46:14.91283+01
