id,hotel_id,url_id,language,fp,created_at,updated_at
289068b4-0973-4d61-8ae4-397449698e92,2301180b-0d59-4c49-b99a-55e1929f3254,cd40647c-1c21-4a4e-a34a-cb707707ec51,fr,"<p>Veuillez informer l'établissement Manaus Hotéis Millennium à l'avance de l'heure à laquelle vous prévoyez d'arriver. Vous pouvez indiquer cette information dans la rubrique « Demandes spéciales » lors de la réservation ou contacter directement l'établissement. Ses coordonnées figurent sur votre confirmation de réservation.</p><p>Dans le cadre de la pandémie de coronavirus (COVID-19), cet établissement applique actuellement des mesures sanitaires supplémentaires.</p><p>En raison de la pandémie de coronavirus (COVID-19), cet établissement prend des mesures pour assurer la sécurité de ses clients et de son personnel. Certains services et équipements peuvent donc être réduits ou indisponibles.</p>",2026-04-09 13:14:31.922551+01,2026-04-09 13:14:31.922551+01
12a3613c-6635-4516-9184-1b3724d9da3c,115b8971-ee9f-4f44-af2b-aba5dc784d34,1b7ef680-c853-4ae6-bc39-76b033b566c8,it,"<p>Please note that this property does not offer installment payments.</p><p>Al check-in gli ospiti devono esibire un documento d'identità con foto e una carta di credito. Siete pregati di notare che le Richieste Speciali sono soggette a disponibilità, e potrebbero comportare l'addebito di un supplemento.</p><p>In caso di partenza anticipata, la struttura addebiterà l'intero importo del soggiorno.</p><p>Il parcheggio non offre molti posti e per questo è soggetto a disponibilità.</p><p>In risposta al Coronavirus (COVID-19) questa struttura ha adottato misure extra di sicurezza e igiene.</p><p>A causa del Coronavirus (COVID-19) questa struttura sta adottando misure per proteggere la salute degli ospiti e dello staff. Pertanto, alcuni servizi potrebbero essere ridotti o non disponibili, così come le dotazioni.</p><p>A causa del Coronavirus (COVID-19) è obbligatorio indossare la mascherina in tutte le aree comuni interne.</p><p>Per soggiornare in questa struttura è necessario mostrare almeno uno dei seguenti documenti: attestato di vaccinazione completa contro il Coronavirus (Covid-19), tampone molecolare recente negativo al Coronavirus, prova recente di avvenuta guarigione dal Covid-19.</p>",2026-04-09 13:07:21.086419+01,2026-04-09 13:07:21.086419+01
db7b8989-29f1-4cf3-855c-e5cd70a05352,60e2be0f-9016-48f3-be93-9927e9deb571,1b7ef680-c853-4ae6-bc39-76b033b566c8,pt,"<p>Por favor, note que esta propriedade não permite pagamentos em prestações.</p><p>No momento do check-in, os hóspedes deverão apresentar um documento de identificação com fotografia e um cartão de crédito.  Por favor, observe que todos os Pedidos Especiais estão sujeitos à disponibilidade e que poderão acarretar custos adicionais.</p><p>Em caso de partida antecipada, a propriedade cobrará o valor total da sua estadia.</p><p>O estacionamento está sujeito à disponibilidade pois os lugares são limitados.</p><p>Em resposta ao Coronavírus (COVID-19), este alojamento está a tomar medidas de segurança e higienização adicionais.</p><p>Devido ao Coronavírus (COVID-19), este alojamento está a tomar precauções adicionais para proteger os seus hóspedes e funcionários. Consequentemente, alguns serviços e comodidades poderão estar reduzidos ou indisponíveis.</p><p>Devido ao Coronavírus (COVID-19), o uso de máscara é obrigatório em todas as áreas comuns interiores.</p><p>Os hóspedes têm de cumprir com, pelo menos, um requisito para se hospedarem neste alojamento: certificado de vacinação completa contra o Coronavírus (COVID-19), teste PCR recente e válido com resultado negativo, ou certificado de recuperação recente do Coronavírus (COVID-19).</p>",2026-04-09 13:09:20.735685+01,2026-04-09 13:09:20.735685+01
25593c09-10e6-451d-a3c9-e6e276f980d2,6c62ec9a-0fe9-4eb1-a645-425610dc4894,833dd6af-6fa5-4277-82b0-d3107345a7c2,pt,"<p>Based on local tax laws, Uruguayan citizens may be charged value added tax (VAT 10%) from November 15 to the day after Easter. This fee is not automatically calculated in the total costs for the reservation.</p>",2026-04-09 13:10:27.126433+01,2026-04-09 13:10:27.126433+01
85555676-bf87-4698-999c-cb74d21de3e5,bf1fd4d7-edb5-47fe-951a-89a648e566b4,51eb4654-1692-4646-9d18-90154c48bd6b,es,<p>Los menores de 18 años que viajen acompañados por uno de sus padres o por su tutor legal deberán aportar un documento de identificación válido o un certificado de nacimiento.</p><p>Los menores de 18 años que viajen solos o acompañados por un adulto que no sea uno de sus padres o tutor legal deberán presentar una carta de autorización certificada.</p><p>El importe restante de la reserva se abona en efectivo al hacer el registro de entrada.</p><p>Las plazas de aparcamiento son por rotación.</p>,2026-04-09 13:11:51.121576+01,2026-04-09 13:11:51.121576+01
20c8a747-7c68-4a9c-b0e5-90c94caa955e,bc1d4d4e-a7c9-49f2-b3b9-823e7acc4a9f,51eb4654-1692-4646-9d18-90154c48bd6b,it,<p>I minori di 18 anni accompagnati da genitore/tutore autorizzato sono tenuti a fornire un documento d'identità valido o il certificato di nascita.</p><p>I minori di 18 anni che viaggiano da soli o accompagnati da un adulto che non sia un genitore o un tutore autorizzato devono fornire una lettera di consenso autenticata.</p><p>L'intero importo della prenotazione verrà addebitato al momento del check-in.</p><p>Il parcheggio funziona a rotazione.</p>,2026-04-09 13:13:33.509872+01,2026-04-09 13:13:33.509872+01
29a66f0d-ff56-46fd-a214-3d6905e7733c,8267594d-fbf9-42f3-8c4b-e223895495c8,51eb4654-1692-4646-9d18-90154c48bd6b,pt,<p>Os hóspedes com menos de 18 anos acompanhados pelos pais / tutor oficial têm de fornecer um documento de identificação válido ou a certidão de nascimento.</p><p>Os hóspedes com menos de 18 anos que viajam sozinhos ou acompanhados por um adulto que não seja um dos pais ou o responsável documentado têm de fornecer uma carta de consentimento autenticada.</p><p>O valor remanescente da reserva será cobrado no check-in.</p><p>O estacionamento funciona com lugares rotativos.</p>,2026-04-09 13:15:10.070491+01,2026-04-09 13:15:10.070491+01
99c799db-ec84-4d01-8cf7-eb714f60f79b,8277fdd8-7073-46e5-83ac-0d8ab170c523,cd40647c-1c21-4a4e-a34a-cb707707ec51,pt,"<p>Por favor, informe Manaus Hotéis Millennium antecipadamente sobre o seu horário de chegada. Para isso poderá utilizar a caixa de Pedidos Especiais durante o processo da reserva ou contactar a propriedade diretamente através dos dados para contacto providenciados na sua confirmação.</p><p>Em resposta ao Coronavírus (COVID-19), este alojamento está a tomar medidas de segurança e higienização adicionais.</p><p>Devido ao Coronavírus (COVID-19), este alojamento está a tomar precauções adicionais para proteger os seus hóspedes e funcionários. Consequentemente, alguns serviços e comodidades poderão estar reduzidos ou indisponíveis.</p>",2026-04-09 13:15:15.322271+01,2026-04-09 13:15:15.322271+01
