id,hotel_id,url_id,language,ask,answer,created_at
286,4b5d8376-1db0-4e0a-a32b-37cf46048fe6,ead8e09d-e4dd-42d1-984f-5be41c497521,en,How far is The Island Garden Hotel from the centre of Nassau?,The Island Garden Hotel is 4.8 mi from the centre of Nassau.,2026-04-09 07:45:32.760549+01
287,4b5d8376-1db0-4e0a-a32b-37cf46048fe6,ead8e09d-e4dd-42d1-984f-5be41c497521,en,How close to the beach is The Island Garden Hotel?,The nearest beach is just 100 yd from The Island Garden Hotel.,2026-04-09 07:45:32.760549+01
288,dc0a961b-4c67-4a48-bfd9-dbff968305d5,8a64dd65-cae4-4662-90e1-a1a05b7ce3d6,es,¿Qué tipo de desayuno se sirve en Hôtel Le Roy?,"Los clientes de Hôtel Le Roy podrán disfrutar durante su estancia de un desayuno con muy buena puntuación (5,6) Las opciones del desayuno son: A la carta",2026-04-09 07:45:49.441834+01
289,dc0a961b-4c67-4a48-bfd9-dbff968305d5,8a64dd65-cae4-4662-90e1-a1a05b7ce3d6,es,¿Hay piscina en Hôtel Le Roy?,"Sí, el hotel tiene piscina. En esta página encontrarás más info sobre la piscina y otras instalaciones.",2026-04-09 07:45:49.441834+01
290,dc0a961b-4c67-4a48-bfd9-dbff968305d5,8a64dd65-cae4-4662-90e1-a1a05b7ce3d6,es,¿Qué tipo de habitación puedo reservar en Hôtel Le Roy?,Las opciones de habitación en Hôtel Le Roy son: Doble Suite,2026-04-09 07:45:49.441834+01
291,dc0a961b-4c67-4a48-bfd9-dbff968305d5,8a64dd65-cae4-4662-90e1-a1a05b7ce3d6,es,¿Cuál es el horario de entrada y salida de Hôtel Le Roy?,Podrás hacer el check-in en Hôtel Le Roy a partir de las 16:00 y el check-out hasta las 12:00.,2026-04-09 07:45:49.441834+01
292,dc0a961b-4c67-4a48-bfd9-dbff968305d5,8a64dd65-cae4-4662-90e1-a1a05b7ce3d6,es,¿Cuánto cuesta alojarse en Hôtel Le Roy?,"Los precios en Hôtel Le Roy pueden variar en función de la estancia (fechas, condiciones del hotel, etc.). Elige tus fechas para ver el precio.",2026-04-09 07:45:49.441834+01
293,dc0a961b-4c67-4a48-bfd9-dbff968305d5,8a64dd65-cae4-4662-90e1-a1a05b7ce3d6,es,¿Hay restaurante dentro de Hôtel Le Roy?,Hôtel Le Roy tiene 1 restaurantes: Boucan,2026-04-09 07:45:49.441834+01
294,dc0a961b-4c67-4a48-bfd9-dbff968305d5,8a64dd65-cae4-4662-90e1-a1a05b7ce3d6,es,¿Qué se puede hacer en Hôtel Le Roy?,Hôtel Le Roy ofrece las siguientes actividades y servicios (se pueden aplicar cargos): Snorkel Submarinismo Pesca Piragüismo Windsurf Situado frente a la playa Instalaciones de spa Equitación Playa Piscina,2026-04-09 07:45:49.441834+01
295,dc0a961b-4c67-4a48-bfd9-dbff968305d5,8a64dd65-cae4-4662-90e1-a1a05b7ce3d6,es,¿A qué distancia está Hôtel Le Roy del centro de Christ Church?,Hôtel Le Roy está a 7 km del centro de Christ Church.,2026-04-09 07:45:49.441834+01
296,dc0a961b-4c67-4a48-bfd9-dbff968305d5,8a64dd65-cae4-4662-90e1-a1a05b7ce3d6,es,¿A qué distancia está Hôtel Le Roy de la playa?,La playa más cercana está a solo 50 m de Hôtel Le Roy.,2026-04-09 07:45:49.441834+01
297,c08927f1-af6e-466d-9e61-5a7cc8c69ac2,ead8e09d-e4dd-42d1-984f-5be41c497521,es,¿Hay piscina en The Island Garden Hotel?,"Sí, el hotel tiene piscina. En esta página encontrarás más info sobre la piscina y otras instalaciones.",2026-04-09 07:46:25.762825+01
298,c08927f1-af6e-466d-9e61-5a7cc8c69ac2,ead8e09d-e4dd-42d1-984f-5be41c497521,es,¿Qué tipo de habitación puedo reservar en The Island Garden Hotel?,Las opciones de habitación en The Island Garden Hotel son: Doble - 2 camas Doble,2026-04-09 07:46:25.762825+01
299,c08927f1-af6e-466d-9e61-5a7cc8c69ac2,ead8e09d-e4dd-42d1-984f-5be41c497521,es,¿Cuál es el horario de entrada y salida de The Island Garden Hotel?,Podrás hacer el check-in en The Island Garden Hotel a partir de las 15:00 y el check-out hasta las 11:00.,2026-04-09 07:46:25.762825+01
300,c08927f1-af6e-466d-9e61-5a7cc8c69ac2,ead8e09d-e4dd-42d1-984f-5be41c497521,es,¿Cuánto cuesta alojarse en The Island Garden Hotel?,"Los precios en The Island Garden Hotel pueden variar en función de la estancia (fechas, condiciones del hotel, etc.). Elige tus fechas para ver el precio.",2026-04-09 07:46:25.762825+01
301,c08927f1-af6e-466d-9e61-5a7cc8c69ac2,ead8e09d-e4dd-42d1-984f-5be41c497521,es,¿Hay restaurante dentro de The Island Garden Hotel?,The Island Garden Hotel tiene 1 restaurantes: Solis Garden Bar And Resturant,2026-04-09 07:46:25.762825+01
302,c08927f1-af6e-466d-9e61-5a7cc8c69ac2,ead8e09d-e4dd-42d1-984f-5be41c497521,es,¿Qué se puede hacer en The Island Garden Hotel?,The Island Garden Hotel ofrece las siguientes actividades y servicios (se pueden aplicar cargos): Karaoke Entretenimiento nocturno Piscina,2026-04-09 07:46:25.762825+01
303,c08927f1-af6e-466d-9e61-5a7cc8c69ac2,ead8e09d-e4dd-42d1-984f-5be41c497521,es,¿A qué distancia está The Island Garden Hotel del centro de Nassau?,The Island Garden Hotel está a 8 km del centro de Nassau.,2026-04-09 07:46:25.762825+01
304,c08927f1-af6e-466d-9e61-5a7cc8c69ac2,ead8e09d-e4dd-42d1-984f-5be41c497521,es,¿A qué distancia está The Island Garden Hotel de la playa?,La playa más cercana está a solo 100 m de The Island Garden Hotel.,2026-04-09 07:46:25.762825+01
305,1f2e2db3-4237-4d57-a77e-bd02d2b574b8,8a64dd65-cae4-4662-90e1-a1a05b7ce3d6,de,Welche Art von Frühstück wird in der Unterkunft Hôtel Le Roy serviert?,"Gäste, die in der Unterkunft Hôtel Le Roy übernachten, können während ihres Aufenthaltes ein gut bewertetes Frühstück genießen (Gästebewertungsergebnis: 5,6). Verfügbare Frühstücksoption(en): À la carte",2026-04-09 07:46:48.190872+01
306,1f2e2db3-4237-4d57-a77e-bd02d2b574b8,8a64dd65-cae4-4662-90e1-a1a05b7ce3d6,de,Hat die Unterkunft Hôtel Le Roy einen Pool?,"Ja, dieses Hotel hat einen Pool. Erfahren Sie Einzelheiten zum Pool und anderen Ausstattungen auf dieser Seite.",2026-04-09 07:46:48.190872+01
307,1f2e2db3-4237-4d57-a77e-bd02d2b574b8,8a64dd65-cae4-4662-90e1-a1a05b7ce3d6,de,Welche Art von Zimmer kann ich in der Unterkunft Hôtel Le Roy buchen?,Zimmeroptionen der Unterkunft Hôtel Le Roy zählen: Doppelzimmer Suite,2026-04-09 07:46:48.190872+01
308,1f2e2db3-4237-4d57-a77e-bd02d2b574b8,8a64dd65-cae4-4662-90e1-a1a05b7ce3d6,de,Wie lauten die Check-in- und Check-out-Zeiten in der Unterkunft Hôtel Le Roy?,"Der Check-in in der Unterkunft Hôtel Le Roy ist ab 16:00, und der Check-out ist bis 12:00.",2026-04-09 07:46:48.190872+01
309,1f2e2db3-4237-4d57-a77e-bd02d2b574b8,8a64dd65-cae4-4662-90e1-a1a05b7ce3d6,de,Wieviel kostet der Aufenthalt in der Unterkunft Hôtel Le Roy?,"Die Preise an der Unterkunft Hôtel Le Roy könnten je nach Aufenthalt variieren (z.B. gewählter Zeitraum, Hotelrichtlinie usw.). Wenn Sie Ihre Daten eingeben, können Sie die Preise sehen.",2026-04-09 07:46:48.190872+01
310,1f2e2db3-4237-4d57-a77e-bd02d2b574b8,8a64dd65-cae4-4662-90e1-a1a05b7ce3d6,de,Hat die Unterkunft Hôtel Le Roy ein Restaurant vor Ort?,Die Unterkunft Hôtel Le Roy hat 1 Restaurants: Boucan,2026-04-09 07:46:48.190872+01
311,1f2e2db3-4237-4d57-a77e-bd02d2b574b8,8a64dd65-cae4-4662-90e1-a1a05b7ce3d6,de,Welche Aktivitäten bietet die Unterkunft Hôtel Le Roy?,Die Unterkunft Hôtel Le Roy bietet folgende Aktivitäten/Services (es könnten Gebühren anfallen): Schnorcheln Tauchen Angeln Kanusport Windsurfen am Strand Wellness Reiten Strand Pool,2026-04-09 07:46:48.190872+01
312,1f2e2db3-4237-4d57-a77e-bd02d2b574b8,8a64dd65-cae4-4662-90e1-a1a05b7ce3d6,de,Wie weit ist die Unterkunft Hôtel Le Roy vom Zentrum von Christchurch entfernt?,Die Unterkunft Hôtel Le Roy ist 7 km vom Zentrum von Christchurch entfernt.,2026-04-09 07:46:48.190872+01
313,1f2e2db3-4237-4d57-a77e-bd02d2b574b8,8a64dd65-cae4-4662-90e1-a1a05b7ce3d6,de,Wie weit ist der Strand von der Unterkunft Hôtel Le Roy?,Der nächste Strand ist nur 50 m von der Unterkunft Hôtel Le Roy entfernt.,2026-04-09 07:46:48.190872+01
314,968f8b7f-b1f7-4a81-9bb4-ea47611a52b9,ead8e09d-e4dd-42d1-984f-5be41c497521,de,Hat die Unterkunft The Island Garden Hotel einen Pool?,"Ja, dieses Hotel hat einen Pool. Erfahren Sie Einzelheiten zum Pool und anderen Ausstattungen auf dieser Seite.",2026-04-09 07:46:55.451532+01
315,968f8b7f-b1f7-4a81-9bb4-ea47611a52b9,ead8e09d-e4dd-42d1-984f-5be41c497521,de,Welche Art von Zimmer kann ich in der Unterkunft The Island Garden Hotel buchen?,Zimmeroptionen der Unterkunft The Island Garden Hotel zählen: Zweibettzimmer Doppelzimmer,2026-04-09 07:46:55.451532+01
316,968f8b7f-b1f7-4a81-9bb4-ea47611a52b9,ead8e09d-e4dd-42d1-984f-5be41c497521,de,Wie lauten die Check-in- und Check-out-Zeiten in der Unterkunft The Island Garden Hotel?,"Der Check-in in der Unterkunft The Island Garden Hotel ist ab 15:00, und der Check-out ist bis 11:00.",2026-04-09 07:46:55.451532+01
317,968f8b7f-b1f7-4a81-9bb4-ea47611a52b9,ead8e09d-e4dd-42d1-984f-5be41c497521,de,Wieviel kostet der Aufenthalt in der Unterkunft The Island Garden Hotel?,"Die Preise an der Unterkunft The Island Garden Hotel könnten je nach Aufenthalt variieren (z.B. gewählter Zeitraum, Hotelrichtlinie usw.). Wenn Sie Ihre Daten eingeben, können Sie die Preise sehen.",2026-04-09 07:46:55.451532+01
318,968f8b7f-b1f7-4a81-9bb4-ea47611a52b9,ead8e09d-e4dd-42d1-984f-5be41c497521,de,Hat die Unterkunft The Island Garden Hotel ein Restaurant vor Ort?,Die Unterkunft The Island Garden Hotel hat 1 Restaurants: Solis Garden Bar And Resturant,2026-04-09 07:46:55.451532+01
350,8b63f4a4-bf5d-49f0-a242-07bb796340b6,8a64dd65-cae4-4662-90e1-a1a05b7ce3d6,fr,Quels sont les horaires d'arrivée et de départ à l'établissement Hôtel Le Roy ?,L'enregistrement à l'établissement Hôtel Le Roy se fait à partir de 16:00 et le départ est possible jusqu'à 12:00.,2026-04-09 07:48:53.686264+01
319,968f8b7f-b1f7-4a81-9bb4-ea47611a52b9,ead8e09d-e4dd-42d1-984f-5be41c497521,de,Welche Aktivitäten bietet die Unterkunft The Island Garden Hotel?,Die Unterkunft The Island Garden Hotel bietet folgende Aktivitäten/Services (es könnten Gebühren anfallen): Karaoke Abendunterhaltung Pool,2026-04-09 07:46:55.451532+01
320,968f8b7f-b1f7-4a81-9bb4-ea47611a52b9,ead8e09d-e4dd-42d1-984f-5be41c497521,de,Wie weit ist die Unterkunft The Island Garden Hotel vom Zentrum von Nassau entfernt?,Die Unterkunft The Island Garden Hotel ist 8 km vom Zentrum von Nassau entfernt.,2026-04-09 07:46:55.451532+01
321,968f8b7f-b1f7-4a81-9bb4-ea47611a52b9,ead8e09d-e4dd-42d1-984f-5be41c497521,de,Wie weit ist der Strand von der Unterkunft The Island Garden Hotel?,Der nächste Strand ist nur 100 m von der Unterkunft The Island Garden Hotel entfernt.,2026-04-09 07:46:55.451532+01
322,1df2fc85-ddae-4d42-9b5b-a0f0961ca923,ead8e09d-e4dd-42d1-984f-5be41c497521,it,The Island Garden Hotel dispone di una piscina?,Sì. Trovi maggiori informazioni sulla piscina e sugli altri servizi in questa pagina.,2026-04-09 07:47:44.972248+01
323,1df2fc85-ddae-4d42-9b5b-a0f0961ca923,ead8e09d-e4dd-42d1-984f-5be41c497521,it,Che tipo di camere posso prenotare presso The Island Garden Hotel?,The Island Garden Hotel offre: Doppia con Letti Singoli Matrimoniale,2026-04-09 07:47:44.972248+01
324,1df2fc85-ddae-4d42-9b5b-a0f0961ca923,ead8e09d-e4dd-42d1-984f-5be41c497521,it,Che orari di check-in e check-out sono previsti presso The Island Garden Hotel?,"Presso The Island Garden Hotel, il check-in può essere effettuato dalle 15:00, mentre il check-out è fino alle 11:00.",2026-04-09 07:47:44.972248+01
325,1df2fc85-ddae-4d42-9b5b-a0f0961ca923,ead8e09d-e4dd-42d1-984f-5be41c497521,it,Quanto costa soggiornare presso The Island Garden Hotel?,"I prezzi di The Island Garden Hotel possono variare in base a vari fattori (per es. date, condizioni dell'hotel, ecc). Per vedere i prezzi, inserisci le date del soggiorno.",2026-04-09 07:47:44.972248+01
326,1df2fc85-ddae-4d42-9b5b-a0f0961ca923,ead8e09d-e4dd-42d1-984f-5be41c497521,it,The Island Garden Hotel dispone di un ristorante in loco?,The Island Garden Hotel offre 1 ristoranti: Solis Garden Bar And Resturant,2026-04-09 07:47:44.972248+01
327,1df2fc85-ddae-4d42-9b5b-a0f0961ca923,ead8e09d-e4dd-42d1-984f-5be41c497521,it,Quali servizi/attività sono disponibili presso The Island Garden Hotel?,The Island Garden Hotel offre i seguenti servizi/attività (alcuni a pagamento): Karaoke Intrattenimento serale Piscina,2026-04-09 07:47:44.972248+01
328,1df2fc85-ddae-4d42-9b5b-a0f0961ca923,ead8e09d-e4dd-42d1-984f-5be41c497521,it,Quanto dista The Island Garden Hotel dal centro di Nassau?,The Island Garden Hotel si trova a 8 km dal centro di Nassau.,2026-04-09 07:47:44.972248+01
329,1df2fc85-ddae-4d42-9b5b-a0f0961ca923,ead8e09d-e4dd-42d1-984f-5be41c497521,it,Quanto dista The Island Garden Hotel dalla spiaggia?,La spiaggia più vicina dista solo 100 m da The Island Garden Hotel.,2026-04-09 07:47:44.972248+01
330,1f6adaf3-2d2c-4eb8-8c26-5bba6ee93b75,8a64dd65-cae4-4662-90e1-a1a05b7ce3d6,it,Che tipo di colazione offre Hôtel Le Roy?,"Durante il soggiorno, Hôtel Le Roy propone una colazione molto apprezzata dagli ospiti (punteggio recensioni: 5,6). Colazione disponibile: alla carta",2026-04-09 07:47:59.37542+01
331,1f6adaf3-2d2c-4eb8-8c26-5bba6ee93b75,8a64dd65-cae4-4662-90e1-a1a05b7ce3d6,it,Hôtel Le Roy dispone di una piscina?,Sì. Trovi maggiori informazioni sulla piscina e sugli altri servizi in questa pagina.,2026-04-09 07:47:59.37542+01
332,1f6adaf3-2d2c-4eb8-8c26-5bba6ee93b75,8a64dd65-cae4-4662-90e1-a1a05b7ce3d6,it,Che tipo di camere posso prenotare presso Hôtel Le Roy?,Hôtel Le Roy offre: Matrimoniale Suite,2026-04-09 07:47:59.37542+01
333,1f6adaf3-2d2c-4eb8-8c26-5bba6ee93b75,8a64dd65-cae4-4662-90e1-a1a05b7ce3d6,it,Che orari di check-in e check-out sono previsti presso Hôtel Le Roy?,"Presso Hôtel Le Roy, il check-in può essere effettuato dalle 16:00, mentre il check-out è fino alle 12:00.",2026-04-09 07:47:59.37542+01
334,1f6adaf3-2d2c-4eb8-8c26-5bba6ee93b75,8a64dd65-cae4-4662-90e1-a1a05b7ce3d6,it,Quanto costa soggiornare presso Hôtel Le Roy?,"I prezzi di Hôtel Le Roy possono variare in base a vari fattori (per es. date, condizioni dell'hotel, ecc). Per vedere i prezzi, inserisci le date del soggiorno.",2026-04-09 07:47:59.37542+01
335,1f6adaf3-2d2c-4eb8-8c26-5bba6ee93b75,8a64dd65-cae4-4662-90e1-a1a05b7ce3d6,it,Hôtel Le Roy dispone di un ristorante in loco?,Hôtel Le Roy offre 1 ristoranti: Boucan,2026-04-09 07:47:59.37542+01
336,1f6adaf3-2d2c-4eb8-8c26-5bba6ee93b75,8a64dd65-cae4-4662-90e1-a1a05b7ce3d6,it,Quali servizi/attività sono disponibili presso Hôtel Le Roy?,Hôtel Le Roy offre i seguenti servizi/attività (alcuni a pagamento): Snorkeling Immersioni subacquee Pesca Canoa Windsurf Fronte spiaggia Servizi spa Equitazione Spiaggia Piscina,2026-04-09 07:47:59.37542+01
337,1f6adaf3-2d2c-4eb8-8c26-5bba6ee93b75,8a64dd65-cae4-4662-90e1-a1a05b7ce3d6,it,Quanto dista Hôtel Le Roy dal centro di Christ Church?,Hôtel Le Roy si trova a 7 km dal centro di Christ Church.,2026-04-09 07:47:59.37542+01
338,1f6adaf3-2d2c-4eb8-8c26-5bba6ee93b75,8a64dd65-cae4-4662-90e1-a1a05b7ce3d6,it,Quanto dista Hôtel Le Roy dalla spiaggia?,La spiaggia più vicina dista solo 50 m da Hôtel Le Roy.,2026-04-09 07:47:59.37542+01
339,81806866-6562-474e-9620-56db74e4650a,ead8e09d-e4dd-42d1-984f-5be41c497521,fr,L'établissement The Island Garden Hotel dispose-t-il d'une piscine ?,"Oui, cet hôtel propose une piscine. Vous trouverez plus de détails sur la piscine et les autres équipements de l'établissement sur cette page.",2026-04-09 07:48:12.979029+01
340,81806866-6562-474e-9620-56db74e4650a,ead8e09d-e4dd-42d1-984f-5be41c497521,fr,Quel type d'hébergement puis-je réserver à l'établissement The Island Garden Hotel ?,L'établissement The Island Garden Hotel propose les options d'hébergement suivantes : Lits Jumeaux Double,2026-04-09 07:48:12.979029+01
341,81806866-6562-474e-9620-56db74e4650a,ead8e09d-e4dd-42d1-984f-5be41c497521,fr,Quels sont les horaires d'arrivée et de départ à l'établissement The Island Garden Hotel ?,L'enregistrement à l'établissement The Island Garden Hotel se fait à partir de 15:00 et le départ est possible jusqu'à 11:00.,2026-04-09 07:48:12.979029+01
342,81806866-6562-474e-9620-56db74e4650a,ead8e09d-e4dd-42d1-984f-5be41c497521,fr,Quel est le tarif d'un séjour à l'établissement The Island Garden Hotel ?,"Les tarifs fixés par l'établissement The Island Garden Hotel peuvent varier en fonction de votre séjour (par ex. les dates que vous avez sélectionnées, les conditions de l'hôtel, etc.). Indiquez vos dates pour voir les tarifs.",2026-04-09 07:48:12.979029+01
343,81806866-6562-474e-9620-56db74e4650a,ead8e09d-e4dd-42d1-984f-5be41c497521,fr,L'établissement The Island Garden Hotel dispose-t-il un restaurant sur place ?,L'établissement The Island Garden Hotel propose 1 restaurant : Solis Garden Bar And Resturant,2026-04-09 07:48:12.979029+01
344,81806866-6562-474e-9620-56db74e4650a,ead8e09d-e4dd-42d1-984f-5be41c497521,fr,Quelles activités l'établissement The Island Garden Hotel propose-t-il ?,L'établissement The Island Garden Hotel propose les activités et les services suivants (des frais peuvent s'appliquer) : Karaoké Animations en soirée Piscine,2026-04-09 07:48:12.979029+01
345,81806866-6562-474e-9620-56db74e4650a,ead8e09d-e4dd-42d1-984f-5be41c497521,fr,L'établissement The Island Garden Hotel est-il proche du centre (Nassau) ?,L'établissement The Island Garden Hotel se trouve à 8 km du centre (Nassau).,2026-04-09 07:48:12.979029+01
346,81806866-6562-474e-9620-56db74e4650a,ead8e09d-e4dd-42d1-984f-5be41c497521,fr,L'établissement The Island Garden Hotel est-il proche de la plage ?,La plage la plus proche se trouve à seulement 100 m de l'établissement The Island Garden Hotel.,2026-04-09 07:48:12.979029+01
347,8b63f4a4-bf5d-49f0-a242-07bb796340b6,8a64dd65-cae4-4662-90e1-a1a05b7ce3d6,fr,Quel type de petit-déjeuner l'établissement Hôtel Le Roy sert-il ?,"Les clients ayant déjà séjourné à l'établissement Hôtel Le Roy ont attribué une très bonne note à son petit-déjeuner : 5,6. L'établissement sert les types de petit-déjeuner suivants : À la carte",2026-04-09 07:48:53.686264+01
348,8b63f4a4-bf5d-49f0-a242-07bb796340b6,8a64dd65-cae4-4662-90e1-a1a05b7ce3d6,fr,L'établissement Hôtel Le Roy dispose-t-il d'une piscine ?,"Oui, cet hôtel propose une piscine. Vous trouverez plus de détails sur la piscine et les autres équipements de l'établissement sur cette page.",2026-04-09 07:48:53.686264+01
349,8b63f4a4-bf5d-49f0-a242-07bb796340b6,8a64dd65-cae4-4662-90e1-a1a05b7ce3d6,fr,Quel type d'hébergement puis-je réserver à l'établissement Hôtel Le Roy ?,L'établissement Hôtel Le Roy propose les options d'hébergement suivantes : Double Suite,2026-04-09 07:48:53.686264+01
351,8b63f4a4-bf5d-49f0-a242-07bb796340b6,8a64dd65-cae4-4662-90e1-a1a05b7ce3d6,fr,Quel est le tarif d'un séjour à l'établissement Hôtel Le Roy ?,"Les tarifs fixés par l'établissement Hôtel Le Roy peuvent varier en fonction de votre séjour (par ex. les dates que vous avez sélectionnées, les conditions de l'hôtel, etc.). Indiquez vos dates pour voir les tarifs.",2026-04-09 07:48:53.686264+01
352,8b63f4a4-bf5d-49f0-a242-07bb796340b6,8a64dd65-cae4-4662-90e1-a1a05b7ce3d6,fr,L'établissement Hôtel Le Roy dispose-t-il un restaurant sur place ?,L'établissement Hôtel Le Roy propose 1 restaurant : Boucan,2026-04-09 07:48:53.686264+01
353,8b63f4a4-bf5d-49f0-a242-07bb796340b6,8a64dd65-cae4-4662-90e1-a1a05b7ce3d6,fr,Quelles activités l'établissement Hôtel Le Roy propose-t-il ?,L'établissement Hôtel Le Roy propose les activités et les services suivants (des frais peuvent s'appliquer) : Plongée avec tuba Plongée sous-marine Pêche Canoë-kayak Planche à voile En bord de plage Spa Équitation Plage Piscine,2026-04-09 07:48:53.686264+01
354,8b63f4a4-bf5d-49f0-a242-07bb796340b6,8a64dd65-cae4-4662-90e1-a1a05b7ce3d6,fr,L'établissement Hôtel Le Roy est-il proche du centre (Christ Church) ?,L'établissement Hôtel Le Roy se trouve à 7 km du centre (Christ Church).,2026-04-09 07:48:53.686264+01
355,8b63f4a4-bf5d-49f0-a242-07bb796340b6,8a64dd65-cae4-4662-90e1-a1a05b7ce3d6,fr,L'établissement Hôtel Le Roy est-il proche de la plage ?,La plage la plus proche se trouve à seulement 50 m de l'établissement Hôtel Le Roy.,2026-04-09 07:48:53.686264+01
356,bbca518f-a651-44fa-a288-5908a9edf4f3,ead8e09d-e4dd-42d1-984f-5be41c497521,pt,The Island Garden Hotel tem piscina?,"Sim, este hotel tem uma piscina. Veja mais informações sobre a piscina e outras comodidades nesta página.",2026-04-09 07:49:10.201623+01
357,bbca518f-a651-44fa-a288-5908a9edf4f3,ead8e09d-e4dd-42d1-984f-5be41c497521,pt,Que tipo de quarto posso reservar em The Island Garden Hotel?,As opções de quarto em The Island Garden Hotel incluem: Twin Duplo,2026-04-09 07:49:10.201623+01
358,bbca518f-a651-44fa-a288-5908a9edf4f3,ead8e09d-e4dd-42d1-984f-5be41c497521,pt,Quais são os horários de check-in e check-out em The Island Garden Hotel?,"Em The Island Garden Hotel, o check-in é a partir das 15:00 e o check-out até às 11:00.",2026-04-09 07:49:10.201623+01
359,bbca518f-a651-44fa-a288-5908a9edf4f3,ead8e09d-e4dd-42d1-984f-5be41c497521,pt,Quanto custa hospedar-me em The Island Garden Hotel?,"Os preços em The Island Garden Hotel podem variar de acordo com os parâmetros da sua estadia (ex.: as datas que seleciona, as condições do hotel, entre outros). Insira as suas datas e consulte os preços.",2026-04-09 07:49:10.201623+01
360,bbca518f-a651-44fa-a288-5908a9edf4f3,ead8e09d-e4dd-42d1-984f-5be41c497521,pt,The Island Garden Hotel tem um restaurante no local?,The Island Garden Hotel tem 1 restaurantes: Solis Garden Bar And Resturant,2026-04-09 07:49:10.201623+01
361,bbca518f-a651-44fa-a288-5908a9edf4f3,ead8e09d-e4dd-42d1-984f-5be41c497521,pt,Que atividades há em The Island Garden Hotel?,The Island Garden Hotel disponibiliza as seguintes atividades/serviços (podem-se aplicar custos): Karaoke Entretenimento noturno Piscina,2026-04-09 07:49:10.201623+01
362,bbca518f-a651-44fa-a288-5908a9edf4f3,ead8e09d-e4dd-42d1-984f-5be41c497521,pt,A que distância fica The Island Garden Hotel do centro de Nassau?,The Island Garden Hotel fica a 8 km do centro de Nassau.,2026-04-09 07:49:10.201623+01
363,bbca518f-a651-44fa-a288-5908a9edf4f3,ead8e09d-e4dd-42d1-984f-5be41c497521,pt,A que distância da praia fica The Island Garden Hotel?,A praia mais próxima fica apenas a 100 m de The Island Garden Hotel.,2026-04-09 07:49:10.201623+01
364,0d9c9bbc-89cd-4fd6-b23b-261b8a202d88,8a64dd65-cae4-4662-90e1-a1a05b7ce3d6,pt,Que tipo de pequeno-almoço é servido em Hôtel Le Roy?,"Os hóspedes em Hôtel Le Roy podem desfrutar de um pequeno-almoço com boa pontuação durante a sua estadia (pontuação de comentários: 5,6). As opções de pequeno-almoço incluem: À carta",2026-04-09 07:49:24.419145+01
365,0d9c9bbc-89cd-4fd6-b23b-261b8a202d88,8a64dd65-cae4-4662-90e1-a1a05b7ce3d6,pt,Hôtel Le Roy tem piscina?,"Sim, este hotel tem uma piscina. Veja mais informações sobre a piscina e outras comodidades nesta página.",2026-04-09 07:49:24.419145+01
366,0d9c9bbc-89cd-4fd6-b23b-261b8a202d88,8a64dd65-cae4-4662-90e1-a1a05b7ce3d6,pt,Que tipo de quarto posso reservar em Hôtel Le Roy?,As opções de quarto em Hôtel Le Roy incluem: Duplo Suite,2026-04-09 07:49:24.419145+01
367,0d9c9bbc-89cd-4fd6-b23b-261b8a202d88,8a64dd65-cae4-4662-90e1-a1a05b7ce3d6,pt,Quais são os horários de check-in e check-out em Hôtel Le Roy?,"Em Hôtel Le Roy, o check-in é a partir das 16:00 e o check-out até às 12:00.",2026-04-09 07:49:24.419145+01
368,0d9c9bbc-89cd-4fd6-b23b-261b8a202d88,8a64dd65-cae4-4662-90e1-a1a05b7ce3d6,pt,Quanto custa hospedar-me em Hôtel Le Roy?,"Os preços em Hôtel Le Roy podem variar de acordo com os parâmetros da sua estadia (ex.: as datas que seleciona, as condições do hotel, entre outros). Insira as suas datas e consulte os preços.",2026-04-09 07:49:24.419145+01
369,0d9c9bbc-89cd-4fd6-b23b-261b8a202d88,8a64dd65-cae4-4662-90e1-a1a05b7ce3d6,pt,Hôtel Le Roy tem um restaurante no local?,Hôtel Le Roy tem 1 restaurantes: Boucan,2026-04-09 07:49:24.419145+01
370,0d9c9bbc-89cd-4fd6-b23b-261b8a202d88,8a64dd65-cae4-4662-90e1-a1a05b7ce3d6,pt,Que atividades há em Hôtel Le Roy?,Hôtel Le Roy disponibiliza as seguintes atividades/serviços (podem-se aplicar custos): Snorkelling Mergulho Pesca Canoagem Windsurf Frente à praia Comodidades de spa Equitação Praia Piscina,2026-04-09 07:49:24.419145+01
371,0d9c9bbc-89cd-4fd6-b23b-261b8a202d88,8a64dd65-cae4-4662-90e1-a1a05b7ce3d6,pt,A que distância fica Hôtel Le Roy do centro de Christ Church?,Hôtel Le Roy fica a 7 km do centro de Christ Church.,2026-04-09 07:49:24.419145+01
372,0d9c9bbc-89cd-4fd6-b23b-261b8a202d88,8a64dd65-cae4-4662-90e1-a1a05b7ce3d6,pt,A que distância da praia fica Hôtel Le Roy?,A praia mais próxima fica apenas a 50 m de Hôtel Le Roy.,2026-04-09 07:49:24.419145+01
373,804e9602-360e-4970-a377-1487236f6532,c694025a-8a7f-4c32-918e-d035bdc7748b,en,What kind of breakfast is served at Gardens Hill Resort & Spa?,Guests staying at Gardens Hill Resort & Spa can enjoy a highly-rated breakfast during their stay (guest review score: 8.4). Breakfast option(s) include: Continental Vegetarian Vegan Buffet Breakfast to go,2026-04-09 07:50:05.128622+01
374,804e9602-360e-4970-a377-1487236f6532,c694025a-8a7f-4c32-918e-d035bdc7748b,en,Does Gardens Hill Resort & Spa have a pool?,"Yes, this hotel has a pool. Find out the details about the pool and other facilities on this page.",2026-04-09 07:50:05.128622+01
375,804e9602-360e-4970-a377-1487236f6532,c694025a-8a7f-4c32-918e-d035bdc7748b,en,What type of room can I book at Gardens Hill Resort & Spa?,Room options at Gardens Hill Resort & Spa include: Family Villa,2026-04-09 07:50:05.128622+01
376,804e9602-360e-4970-a377-1487236f6532,c694025a-8a7f-4c32-918e-d035bdc7748b,en,What are the check-in and check-out times at Gardens Hill Resort & Spa?,"Check-in at Gardens Hill Resort & Spa is from 15:00, and check-out is until 11:00.",2026-04-09 07:50:05.128622+01
