id,hotel_id,url_id,language,ask,answer,created_at
703,bda8b9ee-2d5b-4a58-8bb7-3a9ec26fe2c8,c4ae1ab2-9661-43ab-9347-9bb3a8eb0797,fr,Quel type de petit-déjeuner l'établissement Hotel Adler Garni sert-il ?,"Les clients ayant déjà séjourné à l'établissement Hotel Adler Garni ont attribué une très bonne note à son petit-déjeuner : 9,1. L'établissement sert les types de petit-déjeuner suivants : Buffet",2026-04-13 00:17:15.975436+01
704,bda8b9ee-2d5b-4a58-8bb7-3a9ec26fe2c8,c4ae1ab2-9661-43ab-9347-9bb3a8eb0797,fr,Quel type d'hébergement puis-je réserver à l'établissement Hotel Adler Garni ?,L'établissement Hotel Adler Garni propose les options d'hébergement suivantes : Double Simple,2026-04-13 00:17:15.975436+01
705,bda8b9ee-2d5b-4a58-8bb7-3a9ec26fe2c8,c4ae1ab2-9661-43ab-9347-9bb3a8eb0797,fr,Quels sont les horaires d'arrivée et de départ à l'établissement Hotel Adler Garni ?,L'enregistrement à l'établissement Hotel Adler Garni se fait à partir de 15:00 et le départ est possible jusqu'à 10:00.,2026-04-13 00:17:15.975436+01
706,bda8b9ee-2d5b-4a58-8bb7-3a9ec26fe2c8,c4ae1ab2-9661-43ab-9347-9bb3a8eb0797,fr,Quel est le tarif d'un séjour à l'établissement Hotel Adler Garni ?,"Les tarifs fixés par l'établissement Hotel Adler Garni peuvent varier en fonction de votre séjour (par ex. les dates que vous avez sélectionnées, les conditions de l'hôtel, etc.). Indiquez vos dates pour voir les tarifs.",2026-04-13 00:17:15.975436+01
707,bda8b9ee-2d5b-4a58-8bb7-3a9ec26fe2c8,c4ae1ab2-9661-43ab-9347-9bb3a8eb0797,fr,Quelles activités l'établissement Hotel Adler Garni propose-t-il ?,L'établissement Hotel Adler Garni propose les activités et les services suivants (des frais peuvent s'appliquer) : Cyclisme Randonnée Ski Balades à pied,2026-04-13 00:17:15.975436+01
708,bda8b9ee-2d5b-4a58-8bb7-3a9ec26fe2c8,c4ae1ab2-9661-43ab-9347-9bb3a8eb0797,fr,L'établissement Hotel Adler Garni est-il proche du centre (Hirschegg) ?,L'établissement Hotel Adler Garni se trouve à 200 m du centre (Hirschegg).,2026-04-13 00:17:15.975436+01
709,6d732e83-5118-4b6a-9216-0b7383ec39fe,fd12b179-cfc5-493d-8504-93a9e415cb66,fr,Quel type de petit-déjeuner l'établissement IntercityHotel Graz sert-il ?,"Les clients ayant déjà séjourné à l'établissement IntercityHotel Graz ont attribué une très bonne note à son petit-déjeuner : 8,2. L'établissement sert les types de petit-déjeuner suivants : Buffet",2026-04-13 00:17:44.751041+01
710,6d732e83-5118-4b6a-9216-0b7383ec39fe,fd12b179-cfc5-493d-8504-93a9e415cb66,fr,Quel type d'hébergement puis-je réserver à l'établissement IntercityHotel Graz ?,L'établissement IntercityHotel Graz propose les options d'hébergement suivantes : Double Lits Jumeaux,2026-04-13 00:17:44.751041+01
711,6d732e83-5118-4b6a-9216-0b7383ec39fe,fd12b179-cfc5-493d-8504-93a9e415cb66,fr,Quels sont les horaires d'arrivée et de départ à l'établissement IntercityHotel Graz ?,L'enregistrement à l'établissement IntercityHotel Graz se fait à partir de 15:00 et le départ est possible jusqu'à 12:00.,2026-04-13 00:17:44.751041+01
712,6d732e83-5118-4b6a-9216-0b7383ec39fe,fd12b179-cfc5-493d-8504-93a9e415cb66,fr,Quel est le tarif d'un séjour à l'établissement IntercityHotel Graz ?,"Les tarifs fixés par l'établissement IntercityHotel Graz peuvent varier en fonction de votre séjour (par ex. les dates que vous avez sélectionnées, les conditions de l'hôtel, etc.). Indiquez vos dates pour voir les tarifs.",2026-04-13 00:17:44.751041+01
713,6d732e83-5118-4b6a-9216-0b7383ec39fe,fd12b179-cfc5-493d-8504-93a9e415cb66,fr,Quelles activités l'établissement IntercityHotel Graz propose-t-il ?,L'établissement IntercityHotel Graz propose les activités et les services suivants (des frais peuvent s'appliquer) : Centre de remise en forme Cyclisme Randonnée Billard Bowling Plongée sous-marine Tennis de table Pêche Court de tennis Canoë-kayak Minigolf Fléchettes Planche à voile Parcours de golf (à moins de 3 km) Squash Happy hour Balades à pied Fitness Tir à l'arc Équitation Installations de sports nautiques sur place Concerts/Spectacles Galeries d'art temporaires Aérobic Visites à vélo Visite ou cours autour de la culture locale Diffusion d'événements sportifs,2026-04-13 00:17:44.751041+01
714,6d732e83-5118-4b6a-9216-0b7383ec39fe,fd12b179-cfc5-493d-8504-93a9e415cb66,fr,L'établissement IntercityHotel Graz est-il proche du centre (Graz) ?,"L'établissement IntercityHotel Graz se trouve à 1,6 km du centre (Graz).",2026-04-13 00:17:44.751041+01
727,dec4aeb3-0e72-44a2-81d1-554ff6ec08a1,3a4fa7a5-b167-456d-9106-f52b89b8ec9e,en,What type of room can I book at Hotel-Gasthof Restaurant Murblick?,Room options at Hotel-Gasthof Restaurant Murblick include: Double Single Apartment,2026-04-13 00:19:09.852099+01
728,dec4aeb3-0e72-44a2-81d1-554ff6ec08a1,3a4fa7a5-b167-456d-9106-f52b89b8ec9e,en,What are the check-in and check-out times at Hotel-Gasthof Restaurant Murblick?,"Check-in at Hotel-Gasthof Restaurant Murblick is from 15:00, and check-out is until 11:00.",2026-04-13 00:19:09.852099+01
729,dec4aeb3-0e72-44a2-81d1-554ff6ec08a1,3a4fa7a5-b167-456d-9106-f52b89b8ec9e,en,How much does it cost to stay at Hotel-Gasthof Restaurant Murblick?,"The prices at Hotel-Gasthof Restaurant Murblick may vary depending on your stay (e.g. dates you select, hotel's policy etc.). See the prices by entering your dates.",2026-04-13 00:19:09.852099+01
735,3a463d5c-a9f6-4158-a2cd-9fd519872664,faf035aa-27c8-45c7-b979-73fe7bc0a05a,es,2 adultos · 0 niños · 1 habitación,"",2026-04-13 00:20:34.687108+01
691,85eab94a-e80c-4a83-be32-ccd342e1aa3a,c4ae1ab2-9661-43ab-9347-9bb3a8eb0797,it,Che tipo di colazione offre Hotel Adler Garni?,"Durante il soggiorno, Hotel Adler Garni propone una colazione molto apprezzata dagli ospiti (punteggio recensioni: 9,1). Colazione disponibile: a buffet",2026-04-13 00:16:15.638044+01
692,85eab94a-e80c-4a83-be32-ccd342e1aa3a,c4ae1ab2-9661-43ab-9347-9bb3a8eb0797,it,Che tipo di camere posso prenotare presso Hotel Adler Garni?,Hotel Adler Garni offre: Matrimoniale Singola,2026-04-13 00:16:15.638044+01
693,85eab94a-e80c-4a83-be32-ccd342e1aa3a,c4ae1ab2-9661-43ab-9347-9bb3a8eb0797,it,Che orari di check-in e check-out sono previsti presso Hotel Adler Garni?,"Presso Hotel Adler Garni, il check-in può essere effettuato dalle 15:00, mentre il check-out è fino alle 10:00.",2026-04-13 00:16:15.638044+01
694,85eab94a-e80c-4a83-be32-ccd342e1aa3a,c4ae1ab2-9661-43ab-9347-9bb3a8eb0797,it,Quanto costa soggiornare presso Hotel Adler Garni?,"I prezzi di Hotel Adler Garni possono variare in base a vari fattori (per es. date, condizioni dell'hotel, ecc). Per vedere i prezzi, inserisci le date del soggiorno.",2026-04-13 00:16:15.638044+01
695,85eab94a-e80c-4a83-be32-ccd342e1aa3a,c4ae1ab2-9661-43ab-9347-9bb3a8eb0797,it,Quali servizi/attività sono disponibili presso Hotel Adler Garni?,Hotel Adler Garni offre i seguenti servizi/attività (alcuni a pagamento): Escursioni in bicicletta Escursionismo Sci Tour a piedi,2026-04-13 00:16:15.638044+01
696,85eab94a-e80c-4a83-be32-ccd342e1aa3a,c4ae1ab2-9661-43ab-9347-9bb3a8eb0797,it,Quanto dista Hotel Adler Garni dal centro di Hirschegg?,Hotel Adler Garni si trova a 200 m dal centro di Hirschegg.,2026-04-13 00:16:15.638044+01
715,0131ab03-d87e-4108-a377-eb530d31f451,c4ae1ab2-9661-43ab-9347-9bb3a8eb0797,pt,Que tipo de pequeno-almoço é servido em Hotel Adler Garni?,"Os hóspedes em Hotel Adler Garni podem desfrutar de um pequeno-almoço com boa pontuação durante a sua estadia (pontuação de comentários: 9,1). As opções de pequeno-almoço incluem: Buffet",2026-04-13 00:17:59.677238+01
716,0131ab03-d87e-4108-a377-eb530d31f451,c4ae1ab2-9661-43ab-9347-9bb3a8eb0797,pt,Que tipo de quarto posso reservar em Hotel Adler Garni?,As opções de quarto em Hotel Adler Garni incluem: Duplo Individual,2026-04-13 00:17:59.677238+01
717,0131ab03-d87e-4108-a377-eb530d31f451,c4ae1ab2-9661-43ab-9347-9bb3a8eb0797,pt,Quais são os horários de check-in e check-out em Hotel Adler Garni?,"Em Hotel Adler Garni, o check-in é a partir das 15:00 e o check-out até às 10:00.",2026-04-13 00:17:59.677238+01
718,0131ab03-d87e-4108-a377-eb530d31f451,c4ae1ab2-9661-43ab-9347-9bb3a8eb0797,pt,Quanto custa hospedar-me em Hotel Adler Garni?,"Os preços em Hotel Adler Garni podem variar de acordo com os parâmetros da sua estadia (ex.: as datas que seleciona, as condições do hotel, entre outros). Insira as suas datas e consulte os preços.",2026-04-13 00:17:59.677238+01
719,0131ab03-d87e-4108-a377-eb530d31f451,c4ae1ab2-9661-43ab-9347-9bb3a8eb0797,pt,Que atividades há em Hotel Adler Garni?,Hotel Adler Garni disponibiliza as seguintes atividades/serviços (podem-se aplicar custos): Ciclismo Caminhadas Esqui Excursões a pé,2026-04-13 00:17:59.677238+01
720,0131ab03-d87e-4108-a377-eb530d31f451,c4ae1ab2-9661-43ab-9347-9bb3a8eb0797,pt,A que distância fica Hotel Adler Garni do centro de Hirschegg?,Hotel Adler Garni fica a 200 m do centro de Hirschegg.,2026-04-13 00:17:59.677238+01
721,e1d77320-7c7a-4be4-bee5-0e849f520096,fd12b179-cfc5-493d-8504-93a9e415cb66,pt,Que tipo de pequeno-almoço é servido em IntercityHotel Graz?,"Os hóspedes em IntercityHotel Graz podem desfrutar de um pequeno-almoço com boa pontuação durante a sua estadia (pontuação de comentários: 8,2). As opções de pequeno-almoço incluem: Buffet",2026-04-13 00:18:20.981233+01
722,e1d77320-7c7a-4be4-bee5-0e849f520096,fd12b179-cfc5-493d-8504-93a9e415cb66,pt,Que tipo de quarto posso reservar em IntercityHotel Graz?,As opções de quarto em IntercityHotel Graz incluem: Duplo Twin,2026-04-13 00:18:20.981233+01
723,e1d77320-7c7a-4be4-bee5-0e849f520096,fd12b179-cfc5-493d-8504-93a9e415cb66,pt,Quais são os horários de check-in e check-out em IntercityHotel Graz?,"Em IntercityHotel Graz, o check-in é a partir das 15:00 e o check-out até às 12:00.",2026-04-13 00:18:20.981233+01
724,e1d77320-7c7a-4be4-bee5-0e849f520096,fd12b179-cfc5-493d-8504-93a9e415cb66,pt,Quanto custa hospedar-me em IntercityHotel Graz?,"Os preços em IntercityHotel Graz podem variar de acordo com os parâmetros da sua estadia (ex.: as datas que seleciona, as condições do hotel, entre outros). Insira as suas datas e consulte os preços.",2026-04-13 00:18:20.981233+01
725,e1d77320-7c7a-4be4-bee5-0e849f520096,fd12b179-cfc5-493d-8504-93a9e415cb66,pt,Que atividades há em IntercityHotel Graz?,IntercityHotel Graz disponibiliza as seguintes atividades/serviços (podem-se aplicar custos): Centro de fitness Ciclismo Caminhadas Bilhar Bowling Mergulho Ténis de mesa Pesca Campo de Ténis Canoagem Minigolfe Setas Windsurf Campo de golfe (a menos de 3 km) Squash Happy hour Excursões a pé Fitness Arco e flecha Equitação Comodidades para desportos aquáticos no local Atuações/música ao vivo Galerias de arte temporárias Aeróbica Excursões de bicicleta Passeio ou aula sobre a cultura local Eventos desportivos (transmissão),2026-04-13 00:18:20.981233+01
726,e1d77320-7c7a-4be4-bee5-0e849f520096,fd12b179-cfc5-493d-8504-93a9e415cb66,pt,A que distância fica IntercityHotel Graz do centro de Graz?,"IntercityHotel Graz fica a 1,6 km do centro de Graz.",2026-04-13 00:18:20.981233+01
738,a771a4e9-1d4d-4d29-aca0-3e8e793f7b87,3a4fa7a5-b167-456d-9106-f52b89b8ec9e,es,¿Qué tipo de habitación puedo reservar en Hotel-Gasthof Restaurant Murblick?,Las opciones de habitación en Hotel-Gasthof Restaurant Murblick son: Doble Individual Apartamento,2026-04-13 00:21:10.480465+01
739,a771a4e9-1d4d-4d29-aca0-3e8e793f7b87,3a4fa7a5-b167-456d-9106-f52b89b8ec9e,es,¿Cuál es el horario de entrada y salida de Hotel-Gasthof Restaurant Murblick?,Podrás hacer el check-in en Hotel-Gasthof Restaurant Murblick a partir de las 15:00 y el check-out hasta las 11:00.,2026-04-13 00:21:10.480465+01
740,a771a4e9-1d4d-4d29-aca0-3e8e793f7b87,3a4fa7a5-b167-456d-9106-f52b89b8ec9e,es,¿Cuánto cuesta alojarse en Hotel-Gasthof Restaurant Murblick?,"Los precios en Hotel-Gasthof Restaurant Murblick pueden variar en función de la estancia (fechas, condiciones del hotel, etc.). Elige tus fechas para ver el precio.",2026-04-13 00:21:10.480465+01
741,a771a4e9-1d4d-4d29-aca0-3e8e793f7b87,3a4fa7a5-b167-456d-9106-f52b89b8ec9e,es,¿Hay restaurante dentro de Hotel-Gasthof Restaurant Murblick?,Hotel-Gasthof Restaurant Murblick tiene 1 restaurantes: Restaurant #1,2026-04-13 00:21:10.480465+01
742,a771a4e9-1d4d-4d29-aca0-3e8e793f7b87,3a4fa7a5-b167-456d-9106-f52b89b8ec9e,es,¿Qué se puede hacer en Hotel-Gasthof Restaurant Murblick?,Hotel-Gasthof Restaurant Murblick ofrece las siguientes actividades y servicios (se pueden aplicar cargos): Ciclismo Senderismo Esquí Alquiler de bicicletas,2026-04-13 00:21:10.480465+01
743,a771a4e9-1d4d-4d29-aca0-3e8e793f7b87,3a4fa7a5-b167-456d-9106-f52b89b8ec9e,es,¿A qué distancia está Hotel-Gasthof Restaurant Murblick del centro de Judenburg?,Hotel-Gasthof Restaurant Murblick está a 500 m del centro de Judenburg.,2026-04-13 00:21:10.480465+01
755,138d4685-06a1-4b77-bf6e-deb0b48e70e9,faf035aa-27c8-45c7-b979-73fe7bc0a05a,fr,2 adultes · 0 enfant · 1 chambre,"",2026-04-13 00:22:42.405794+01
756,138d4685-06a1-4b77-bf6e-deb0b48e70e9,faf035aa-27c8-45c7-b979-73fe7bc0a05a,fr,Les incontournables de : Graz Cliquez ici pour consulter plus d'hôtels et d'autres hébergements proches de sites d'intérêt à : Graz,"",2026-04-13 00:22:42.405794+01
786,a2a3a58a-d7f3-4c79-8d29-e29587f15c16,2a5cadc3-50f6-4403-9bce-6b1d17ce4f84,en,What kind of breakfast is served at Hotel Mariahilf?,Guests staying at Hotel Mariahilf can enjoy a highly-rated breakfast during their stay (guest review score: 8.9). Breakfast option(s) include: Continental Vegetarian Vegan Gluten-free Buffet,2026-04-13 00:26:06.742279+01
787,a2a3a58a-d7f3-4c79-8d29-e29587f15c16,2a5cadc3-50f6-4403-9bce-6b1d17ce4f84,en,What type of room can I book at Hotel Mariahilf?,Room options at Hotel Mariahilf include: Single Double Triple Suite,2026-04-13 00:26:06.742279+01
788,a2a3a58a-d7f3-4c79-8d29-e29587f15c16,2a5cadc3-50f6-4403-9bce-6b1d17ce4f84,en,What are the check-in and check-out times at Hotel Mariahilf?,"Check-in at Hotel Mariahilf is from 14:00, and check-out is until 11:00.",2026-04-13 00:26:06.742279+01
789,a2a3a58a-d7f3-4c79-8d29-e29587f15c16,2a5cadc3-50f6-4403-9bce-6b1d17ce4f84,en,How much does it cost to stay at Hotel Mariahilf?,"The prices at Hotel Mariahilf may vary depending on your stay (e.g. dates you select, hotel's policy etc.). See the prices by entering your dates.",2026-04-13 00:26:06.742279+01
697,fcabcfb1-c16a-4b43-a182-fa6a7e49a7c9,fd12b179-cfc5-493d-8504-93a9e415cb66,it,Che tipo di colazione offre IntercityHotel Graz?,"Durante il soggiorno, IntercityHotel Graz propone una colazione molto apprezzata dagli ospiti (punteggio recensioni: 8,2). Colazione disponibile: a buffet",2026-04-13 00:16:53.635199+01
698,fcabcfb1-c16a-4b43-a182-fa6a7e49a7c9,fd12b179-cfc5-493d-8504-93a9e415cb66,it,Che tipo di camere posso prenotare presso IntercityHotel Graz?,IntercityHotel Graz offre: Matrimoniale Doppia con Letti Singoli,2026-04-13 00:16:53.635199+01
699,fcabcfb1-c16a-4b43-a182-fa6a7e49a7c9,fd12b179-cfc5-493d-8504-93a9e415cb66,it,Che orari di check-in e check-out sono previsti presso IntercityHotel Graz?,"Presso IntercityHotel Graz, il check-in può essere effettuato dalle 15:00, mentre il check-out è fino alle 12:00.",2026-04-13 00:16:53.635199+01
700,fcabcfb1-c16a-4b43-a182-fa6a7e49a7c9,fd12b179-cfc5-493d-8504-93a9e415cb66,it,Quanto costa soggiornare presso IntercityHotel Graz?,"I prezzi di IntercityHotel Graz possono variare in base a vari fattori (per es. date, condizioni dell'hotel, ecc). Per vedere i prezzi, inserisci le date del soggiorno.",2026-04-13 00:16:53.635199+01
701,fcabcfb1-c16a-4b43-a182-fa6a7e49a7c9,fd12b179-cfc5-493d-8504-93a9e415cb66,it,Quali servizi/attività sono disponibili presso IntercityHotel Graz?,IntercityHotel Graz offre i seguenti servizi/attività (alcuni a pagamento): Palestra Escursioni in bicicletta Escursionismo Biliardo Bowling Immersioni subacquee Ping-pong Pesca Campo da tennis Canoa Minigolf Freccette Windsurf Campo da golf (nel raggio di 3 km) Squash Happy hour Tour a piedi Fitness Tiro con l'arco Equitazione Attrezzature per sport acquatici sul posto Spettacolo/musica dal vivo Mostre d'arte temporanee Aerobica Tour in bicicletta Tour o lezioni sulla cultura locale Trasmissione di eventi sportivi in diretta,2026-04-13 00:16:53.635199+01
702,fcabcfb1-c16a-4b43-a182-fa6a7e49a7c9,fd12b179-cfc5-493d-8504-93a9e415cb66,it,Quanto dista IntercityHotel Graz dal centro di Graz?,"IntercityHotel Graz si trova a 1,6 km dal centro di Graz.",2026-04-13 00:16:53.635199+01
744,4d0dcd41-0c9b-4d82-b396-d163d1885127,faf035aa-27c8-45c7-b979-73fe7bc0a05a,de,2 Erwachsene · 0 Kinder · 1 Zimmer,"",2026-04-13 00:21:35.637055+01
745,4d0dcd41-0c9b-4d82-b396-d163d1885127,faf035aa-27c8-45c7-b979-73fe7bc0a05a,de,Anreisedatum - Abreisedatum,"",2026-04-13 00:21:35.637055+01
746,4d0dcd41-0c9b-4d82-b396-d163d1885127,faf035aa-27c8-45c7-b979-73fe7bc0a05a,de,"Das Beste von Graz Klicken Sie hier, um mehr Hotels und Unterkünfte in der Nähe von bekannten Sehenswürdigkeiten in Graz zu sehen","",2026-04-13 00:21:35.637055+01
757,5338262f-cee8-4714-8833-d6fcd25a302b,3a4fa7a5-b167-456d-9106-f52b89b8ec9e,it,Che tipo di camere posso prenotare presso Hotel-Gasthof Restaurant Murblick?,Hotel-Gasthof Restaurant Murblick offre: Matrimoniale Singola Appartamento,2026-04-13 00:23:01.271548+01
758,5338262f-cee8-4714-8833-d6fcd25a302b,3a4fa7a5-b167-456d-9106-f52b89b8ec9e,it,Che orari di check-in e check-out sono previsti presso Hotel-Gasthof Restaurant Murblick?,"Presso Hotel-Gasthof Restaurant Murblick, il check-in può essere effettuato dalle 15:00, mentre il check-out è fino alle 11:00.",2026-04-13 00:23:01.271548+01
759,5338262f-cee8-4714-8833-d6fcd25a302b,3a4fa7a5-b167-456d-9106-f52b89b8ec9e,it,Quanto costa soggiornare presso Hotel-Gasthof Restaurant Murblick?,"I prezzi di Hotel-Gasthof Restaurant Murblick possono variare in base a vari fattori (per es. date, condizioni dell'hotel, ecc). Per vedere i prezzi, inserisci le date del soggiorno.",2026-04-13 00:23:01.271548+01
760,5338262f-cee8-4714-8833-d6fcd25a302b,3a4fa7a5-b167-456d-9106-f52b89b8ec9e,it,Hotel-Gasthof Restaurant Murblick dispone di un ristorante in loco?,Hotel-Gasthof Restaurant Murblick offre 1 ristoranti: Restaurant #1,2026-04-13 00:23:01.271548+01
761,5338262f-cee8-4714-8833-d6fcd25a302b,3a4fa7a5-b167-456d-9106-f52b89b8ec9e,it,Quali servizi/attività sono disponibili presso Hotel-Gasthof Restaurant Murblick?,Hotel-Gasthof Restaurant Murblick offre i seguenti servizi/attività (alcuni a pagamento): Escursioni in bicicletta Escursionismo Sci Noleggio biciclette,2026-04-13 00:23:01.271548+01
762,5338262f-cee8-4714-8833-d6fcd25a302b,3a4fa7a5-b167-456d-9106-f52b89b8ec9e,it,Quanto dista Hotel-Gasthof Restaurant Murblick dal centro di Judenburg?,Hotel-Gasthof Restaurant Murblick si trova a 500 m dal centro di Judenburg.,2026-04-13 00:23:01.271548+01
730,dec4aeb3-0e72-44a2-81d1-554ff6ec08a1,3a4fa7a5-b167-456d-9106-f52b89b8ec9e,en,Does Hotel-Gasthof Restaurant Murblick have a restaurant on site?,Hotel-Gasthof Restaurant Murblick has 1 restaurants: Restaurant #1,2026-04-13 00:19:09.852099+01
731,dec4aeb3-0e72-44a2-81d1-554ff6ec08a1,3a4fa7a5-b167-456d-9106-f52b89b8ec9e,en,What is there to do at Hotel-Gasthof Restaurant Murblick?,Hotel-Gasthof Restaurant Murblick offers the following activities / services (charges may apply): Cycling Hiking Skiing Bicycle rental,2026-04-13 00:19:09.852099+01
732,dec4aeb3-0e72-44a2-81d1-554ff6ec08a1,3a4fa7a5-b167-456d-9106-f52b89b8ec9e,en,How far is Hotel-Gasthof Restaurant Murblick from the centre of Judenburg?,Hotel-Gasthof Restaurant Murblick is 500 m from the centre of Judenburg.,2026-04-13 00:19:09.852099+01
733,07d8352f-4f23-4f9d-bb00-eaa9d58d1c7c,faf035aa-27c8-45c7-b979-73fe7bc0a05a,en,2 adults · 0 children · 1 room,"",2026-04-13 00:19:16.231303+01
734,07d8352f-4f23-4f9d-bb00-eaa9d58d1c7c,faf035aa-27c8-45c7-b979-73fe7bc0a05a,en,The best of Graz Click here to see more hotels and accommodation near popular landmarks in Graz,"",2026-04-13 00:19:16.231303+01
747,32931cae-49de-41ca-98c9-01ee7fa91245,3a4fa7a5-b167-456d-9106-f52b89b8ec9e,de,Welche Art von Zimmer kann ich in der Unterkunft Hotel-Gasthof Restaurant Murblick buchen?,Zimmeroptionen der Unterkunft Hotel-Gasthof Restaurant Murblick zählen: Doppelzimmer Einzelzimmer Ferienwohnung,2026-04-13 00:21:46.053044+01
748,32931cae-49de-41ca-98c9-01ee7fa91245,3a4fa7a5-b167-456d-9106-f52b89b8ec9e,de,Wie lauten die Check-in- und Check-out-Zeiten in der Unterkunft Hotel-Gasthof Restaurant Murblick?,"Der Check-in in der Unterkunft Hotel-Gasthof Restaurant Murblick ist ab 15:00, und der Check-out ist bis 11:00.",2026-04-13 00:21:46.053044+01
749,32931cae-49de-41ca-98c9-01ee7fa91245,3a4fa7a5-b167-456d-9106-f52b89b8ec9e,de,Wieviel kostet der Aufenthalt in der Unterkunft Hotel-Gasthof Restaurant Murblick?,"Die Preise an der Unterkunft Hotel-Gasthof Restaurant Murblick könnten je nach Aufenthalt variieren (z.B. gewählter Zeitraum, Hotelrichtlinie usw.). Wenn Sie Ihre Daten eingeben, können Sie die Preise sehen.",2026-04-13 00:21:46.053044+01
750,32931cae-49de-41ca-98c9-01ee7fa91245,3a4fa7a5-b167-456d-9106-f52b89b8ec9e,de,Hat die Unterkunft Hotel-Gasthof Restaurant Murblick ein Restaurant vor Ort?,Die Unterkunft Hotel-Gasthof Restaurant Murblick hat 1 Restaurants: Restaurant #1,2026-04-13 00:21:46.053044+01
751,32931cae-49de-41ca-98c9-01ee7fa91245,3a4fa7a5-b167-456d-9106-f52b89b8ec9e,de,Welche Aktivitäten bietet die Unterkunft Hotel-Gasthof Restaurant Murblick?,Die Unterkunft Hotel-Gasthof Restaurant Murblick bietet folgende Aktivitäten/Services (es könnten Gebühren anfallen): Radfahren Wandern Skifahren Fahrradverleih,2026-04-13 00:21:46.053044+01
752,32931cae-49de-41ca-98c9-01ee7fa91245,3a4fa7a5-b167-456d-9106-f52b89b8ec9e,de,Wie weit ist die Unterkunft Hotel-Gasthof Restaurant Murblick vom Zentrum von Judenburg entfernt?,Die Unterkunft Hotel-Gasthof Restaurant Murblick ist 500 m vom Zentrum von Judenburg entfernt.,2026-04-13 00:21:46.053044+01
763,edebaf3b-4f2a-43a7-9874-99158fed77a7,faf035aa-27c8-45c7-b979-73fe7bc0a05a,pt,2 adultos · 0 criança · 1 quarto,"",2026-04-13 00:23:19.365583+01
764,edebaf3b-4f2a-43a7-9874-99158fed77a7,faf035aa-27c8-45c7-b979-73fe7bc0a05a,pt,Data de check-in - Data de check-out,"",2026-04-13 00:23:19.365583+01
765,edebaf3b-4f2a-43a7-9874-99158fed77a7,faf035aa-27c8-45c7-b979-73fe7bc0a05a,pt,O melhor de: Graz Clique aqui para ver mais hotéis e alojamentos perto de locais de interesse populares em Graz,"",2026-04-13 00:23:19.365583+01
766,9109a2ae-af99-48ef-8895-41ca5015409b,3a4fa7a5-b167-456d-9106-f52b89b8ec9e,fr,Quel type d'hébergement puis-je réserver à l'établissement Hotel-Gasthof Restaurant Murblick ?,L'établissement Hotel-Gasthof Restaurant Murblick propose les options d'hébergement suivantes : Double Simple Appartement,2026-04-13 00:24:14.137647+01
767,9109a2ae-af99-48ef-8895-41ca5015409b,3a4fa7a5-b167-456d-9106-f52b89b8ec9e,fr,Quels sont les horaires d'arrivée et de départ à l'établissement Hotel-Gasthof Restaurant Murblick ?,L'enregistrement à l'établissement Hotel-Gasthof Restaurant Murblick se fait à partir de 15:00 et le départ est possible jusqu'à 11:00.,2026-04-13 00:24:14.137647+01
768,9109a2ae-af99-48ef-8895-41ca5015409b,3a4fa7a5-b167-456d-9106-f52b89b8ec9e,fr,Quel est le tarif d'un séjour à l'établissement Hotel-Gasthof Restaurant Murblick ?,"Les tarifs fixés par l'établissement Hotel-Gasthof Restaurant Murblick peuvent varier en fonction de votre séjour (par ex. les dates que vous avez sélectionnées, les conditions de l'hôtel, etc.). Indiquez vos dates pour voir les tarifs.",2026-04-13 00:24:14.137647+01
769,9109a2ae-af99-48ef-8895-41ca5015409b,3a4fa7a5-b167-456d-9106-f52b89b8ec9e,fr,L'établissement Hotel-Gasthof Restaurant Murblick dispose-t-il un restaurant sur place ?,L'établissement Hotel-Gasthof Restaurant Murblick propose 1 restaurant : Restaurant #1,2026-04-13 00:24:14.137647+01
770,9109a2ae-af99-48ef-8895-41ca5015409b,3a4fa7a5-b167-456d-9106-f52b89b8ec9e,fr,Quelles activités l'établissement Hotel-Gasthof Restaurant Murblick propose-t-il ?,L'établissement Hotel-Gasthof Restaurant Murblick propose les activités et les services suivants (des frais peuvent s'appliquer) : Cyclisme Randonnée Ski Location de vélos,2026-04-13 00:24:14.137647+01
771,9109a2ae-af99-48ef-8895-41ca5015409b,3a4fa7a5-b167-456d-9106-f52b89b8ec9e,fr,L'établissement Hotel-Gasthof Restaurant Murblick est-il proche du centre (Judenburg) ?,L'établissement Hotel-Gasthof Restaurant Murblick se trouve à 500 m du centre (Judenburg).,2026-04-13 00:24:14.137647+01
737,3a463d5c-a9f6-4158-a2cd-9fd519872664,faf035aa-27c8-45c7-b979-73fe7bc0a05a,es,Lo mejor de Graz Haz clic aquí para ver más hoteles y alojamientos cerca de los sitios de interés más visitados de Graz,"",2026-04-13 00:20:34.687108+01
753,9c28566f-12d8-4dc4-9242-6579f2495385,faf035aa-27c8-45c7-b979-73fe7bc0a05a,it,2 adulti · 0 bambini · 1 camera,"",2026-04-13 00:22:07.484702+01
754,9c28566f-12d8-4dc4-9242-6579f2495385,faf035aa-27c8-45c7-b979-73fe7bc0a05a,it,Il meglio di Graz Clicca qui per vedere altri hotel e alloggi vicino alle attrazioni più famose di Graz,"",2026-04-13 00:22:07.484702+01
772,c5610c43-65ee-4bfa-9926-68f22c3a1a28,3a4fa7a5-b167-456d-9106-f52b89b8ec9e,pt,Que tipo de quarto posso reservar em Hotel-Gasthof Restaurant Murblick?,As opções de quarto em Hotel-Gasthof Restaurant Murblick incluem: Duplo Individual Apartamento,2026-04-13 00:25:06.319752+01
