id,hotel_id,url_id,language,fp,created_at,updated_at
509535a8-4bdd-44ef-ab0b-f1b7c4f8d071,29c14071-babb-4134-b082-f0eb91efa505,e1ed6a33-3e3f-4b7b-a985-92cfcedfec05,es,"<p>Informa a Manaus Hotéis Millennium con antelación de tu hora prevista de llegada. Para ello, puedes utilizar el apartado de peticiones especiales al hacer la reserva o ponerte en contacto directamente con el alojamiento. Los datos de contacto aparecen en la confirmación de la reserva.</p><p>En respuesta al coronavirus (COVID-19), el alojamiento aplica medidas sanitarias y de seguridad adicionales en estos momentos.</p><p>A causa del coronavirus (COVID-19), este alojamiento está tomando medidas para garantizar la seguridad de los clientes y el personal. Por este motivo, algunos servicios e instalaciones pueden verse limitados o no estar disponibles.</p>",2026-04-06 15:55:41.543262+01,2026-04-06 15:55:41.543262+01
fdcb6ecf-580a-4c9d-9a98-07dd69cc1a4f,de36c489-ce61-4413-8a35-09e633badaa9,3a95aa9d-7926-4d3d-9e5f-e30a51b43efa,de,"<p>Minderjährige unter 18 Jahren in Begleitung eines Elternteils/Erziehungsberechtigten müssen einen gültigen Personalausweis oder eine Geburtsurkunde vorlegen.</p><p>Minderjährige unter 18 Jahren, die alleine reisen oder in Begleitung eines Erwachsenen, bei dem es sich weder um ein Elternteil noch um einen Erziehungsberechtigten handelt, müssen eine beglaubigte Einverständniserklärung vorlegen.</p><p>Bitte beachten Sie, dass der Restbetrag beim Check-in zu zahlen ist.</p><p>Bitte beachten Sie, dass die Parkplätze nach Verfügbarkeit vergeben werden.</p>",2026-04-06 15:55:52.783387+01,2026-04-06 15:55:52.783387+01
27c942ec-a6dc-4b11-af96-99ea58e616df,fc21dbaf-7866-4434-a970-39a22b4348bd,e1ed6a33-3e3f-4b7b-a985-92cfcedfec05,de,"<p>Bitte teilen Sie der Unterkunft Manaus Hotéis Millennium Ihre voraussichtliche Ankunftszeit im Voraus mit. Nutzen Sie hierfür bei der Buchung das Feld für besondere Anfragen oder kontaktieren Sie die Unterkunft direkt.</p><p>Wegen des Coronavirus (COVID-19) wurden in dieser Unterkunft zusätzliche Sicherheits- und Hygienemaßnahmen unternommen.</p><p>Wegen des Coronavirus (COVID-19) hat diese Unterkunft Maßnahmen unternommen, um die Sicherheit der Gäste und des Personals zu gewährleisten. Bestimmte Services und Einrichtungen könnten daher nicht oder nur eingeschränkt zur Verfügung stehen. </p>",2026-04-06 15:56:10.817421+01,2026-04-06 15:56:10.817421+01
3fe56add-f7fe-46e4-beaa-516b24860f13,3ff56b75-10cc-455c-b52a-35056eeaf499,3a95aa9d-7926-4d3d-9e5f-e30a51b43efa,it,<p>I minori di 18 anni accompagnati da genitore/tutore autorizzato sono tenuti a fornire un documento d'identità valido o il certificato di nascita.</p><p>I minori di 18 anni che viaggiano da soli o accompagnati da un adulto che non sia un genitore o un tutore autorizzato devono fornire una lettera di consenso autenticata.</p><p>L'intero importo della prenotazione verrà addebitato al momento del check-in.</p><p>Il parcheggio funziona a rotazione.</p>,2026-04-06 15:57:03.93093+01,2026-04-06 15:57:03.93093+01
f78c293a-8e11-4102-bc64-b3d841644a72,bd40b03d-83ba-46c6-8ba8-0b233471255c,e1ed6a33-3e3f-4b7b-a985-92cfcedfec05,it,"<p>Siete pregati di comunicare in anticipo a Manaus Hotéis Millennium l'orario in cui prevedete di arrivare. Potrete inserire questa informazione nella sezione Richieste Speciali al momento della prenotazione, o contattare la struttura utilizzando i recapiti riportati nella conferma della prenotazione.</p><p>In risposta al Coronavirus (COVID-19) questa struttura ha adottato misure extra di sicurezza e igiene.</p><p>A causa del Coronavirus (COVID-19) questa struttura sta adottando misure per proteggere la salute degli ospiti e dello staff. Pertanto, alcuni servizi potrebbero essere ridotti o non disponibili, così come le dotazioni.</p>",2026-04-06 15:57:27.611927+01,2026-04-06 15:57:27.611927+01
f146a6d6-95d0-4901-ab8f-fb0e4e7a221c,c7fd093a-4116-46f8-8ded-609ded533b22,3a95aa9d-7926-4d3d-9e5f-e30a51b43efa,fr,"<p>Les mineurs de moins de 18 ans accompagnés par un parent/tuteur devront fournir une pièce d'identité en cours de validité ou un extrait d'acte de naissance.</p><p>Les mineurs de moins de 18 ans voyageant seuls ou accompagnés par un adulte, autre qu'un parent ou un tuteur, devront fournir une lettre de consentement certifiée.</p><p>Le montant restant dû vous sera facturé à l'enregistrement.</p><p>Veuillez noter que le parking fonctionne avec des spots rotatifs.</p>",2026-04-06 15:57:44.23773+01,2026-04-06 15:57:44.23773+01
27658a6d-d09d-4688-b3e5-fee2d468f957,7977ea59-3db0-41df-99e2-5b63849372c5,3a95aa9d-7926-4d3d-9e5f-e30a51b43efa,pt,<p>Os hóspedes com menos de 18 anos acompanhados pelos pais / tutor oficial têm de fornecer um documento de identificação válido ou a certidão de nascimento.</p><p>Os hóspedes com menos de 18 anos que viajam sozinhos ou acompanhados por um adulto que não seja um dos pais ou o responsável documentado têm de fornecer uma carta de consentimento autenticada.</p><p>O valor remanescente da reserva será cobrado no check-in.</p><p>O estacionamento funciona com lugares rotativos.</p>,2026-04-06 15:58:32.841356+01,2026-04-06 15:58:32.841356+01
