id,hotel_id,url_id,language,fp,created_at,updated_at
3346483e-3719-490b-a33f-98a3f855cd2e,516b88d4-938b-4e9d-b037-dc58f8a01b68,4a5822d2-4c85-4978-9486-2684ca3f1eb5,en,"<p>Canouan Airport is the closest airport. The hotel offers a Airport Shuttle.</p><p>Guests are required to show a photo identification and credit card upon check-in. Please note that all Special Requests are subject to availability and additional charges may apply.</p><p>Please inform Mandarin Oriental, Canouan in advance of your expected arrival time. You can use the Special Requests box when booking, or contact the property directly with the contact details provided in your confirmation.</p>",2026-04-06 15:24:12.43684+01,2026-04-06 15:24:12.43684+01
d1ebfe1f-d3c9-49ff-873a-e38ac1ac87fc,55a001e1-2be8-45b4-98bb-88dbab510f3e,4a5822d2-4c85-4978-9486-2684ca3f1eb5,es,"<p>El aeropuerto de Canouan es el más cercano. El hotel ofrece un servicio de enlace con el aeropuerto.</p><p>Los huéspedes deberán mostrar un documento de identidad válido y una tarjeta de crédito al realizar el registro de entrada. Ten en cuenta que todas las peticiones especiales están sujetas a disponibilidad y pueden comportar suplementos.</p><p>Informa a Mandarin Oriental, Canouan con antelación de tu hora prevista de llegada. Para ello, puedes utilizar el apartado de peticiones especiales al hacer la reserva o ponerte en contacto directamente con el alojamiento. Los datos de contacto aparecen en la confirmación de la reserva.</p>",2026-04-06 15:25:17.113987+01,2026-04-06 15:25:17.113987+01
0344c389-9cad-4eca-8445-55651f0a0f55,cacf5048-565c-4c58-8726-8dd7727bcfb3,2c312f00-9e66-462a-aa75-50be8cca96c9,es,"<p>The property can be reached by seaplanes and domestic flights.</p><p>Seaplane transfer takes 45 minutes from Male International Airport.</p><p>Standard Transfer Times: Daylight hours.</p><p>Domestic flight transfer takes 25 minutes from Male International Airport, followed by a 5-minute speedboat transfer from Dhaalu Airport to the resort.</p><p>Children eat for free based on the rules and meal plan accompanied by an adult, excluding alcoholic beverages from the special set kids menu only.</p><p>Additional child in the room is charged at USD 61 per night and is added to the total cost separately.</p><p>Daily dinner is based on a three-course meal per person, excluding beverages, at selected restaurants. Supplementary charges may apply to special items on the menu.</p><p>Transfer options:</p><p>Seaplane transfer</p><p>From now to 31 December 2027</p><p>- Adult: USD 780</p><p>- Child (2-11): USD 390</p><p>Domestic flight transfer</p><p>From now to 31 December 2027</p><p>- Adult: USD 550</p><p>- Child (2-11): USD 275</p><p>Los huéspedes deberán mostrar un documento de identidad válido y una tarjeta de crédito al realizar el registro de entrada. Ten en cuenta que todas las peticiones especiales están sujetas a disponibilidad y pueden comportar suplementos.</p><p>Informa a Niyama Private Islands Maldives con antelación de tu hora prevista de llegada. Para ello, puedes utilizar el apartado de peticiones especiales al hacer la reserva o ponerte en contacto directamente con el alojamiento. Los datos de contacto aparecen en la confirmación de la reserva.</p>",2026-04-06 15:25:32.362222+01,2026-04-06 15:25:32.362222+01
8d879dff-579d-48a7-ad75-c646b6532e0d,3b587959-b458-4104-bc9d-d58c931b9a2c,4a5822d2-4c85-4978-9486-2684ca3f1eb5,de,"<p>Der Canouan Airport ist der nächstgelegene Flughafen. Das Hotel bietet einen Flughafentransfer.</p><p>Beim Check-in müssen Sie einen Lichtbildausweis sowie eine Kreditkarte vorlegen. Sonderwünsche unterliegen der Verfügbarkeit und sind gegebenenfalls mit einem Aufpreis verbunden.</p><p>Bitte teilen Sie der Unterkunft Mandarin Oriental, Canouan Ihre voraussichtliche Ankunftszeit im Voraus mit. Nutzen Sie hierfür bei der Buchung das Feld für besondere Anfragen oder kontaktieren Sie die Unterkunft direkt.</p>",2026-04-06 15:25:46.003518+01,2026-04-06 15:25:46.003518+01
4f3d6cbd-7659-4115-9c00-153c4b244460,bd05d668-875f-4321-8ad2-8d446bf8d9a3,2c312f00-9e66-462a-aa75-50be8cca96c9,de,"<p>Die Unterkunft ist per Wasserflugzeug und Inlandsflug erreichbar.</p><p>Der Transfer mit dem Wasserflugzeug vom internationalen Flughafen Malé aus dauert 45 Minuten.</p><p>Reguläre Transferzeiten: bei Tageslicht.</p><p>Der Transfer per Inlandsflug vom internationalen Flughafen Malé aus dauert 25 Minuten, gefolgt von einer 5-minütigen Fahrt mit dem Schnellboot vom Flughafen Dhaalu zum Resort.</p><p>Kinder speisen in Begleitung eines/einer Erwachsenen kostenlos, entsprechend denselben Vorgaben und des gewählten Verpflegungsplans. Alkoholische Getränke sind von der speziellen Kinderkarte ausgenommen.</p><p>Für ein zusätzliches Kind im Zimmer werden 61 USD pro Nacht zu den Gesamtkosten hinzugerechnet.</p><p>Das tägliche Abendessen besteht aus einem 3-Gänge-Menü pro Person (ohne Getränke) in ausgewählten Restaurants. Für spezielle Menüoptionen können Aufpreise anfallen.</p><p>Transfermöglichkeiten:</p><p>Transfer mit dem Wasserflugzeug</p><p>Von jetzt bis 31. Dezember 2027</p><p>- Erwachsene: 780 USD</p><p>- Kinder (2 bis 11 Jahre): 390 USD</p><p>Transfer per Inlandsflug</p><p>Von jetzt bis 31. Dezember 2027</p><p>- Erwachsene: 550 USD</p><p>- Kinder (2 bis 11 Jahre): 275 USD</p><p>Beim Check-in müssen Sie einen Lichtbildausweis sowie eine Kreditkarte vorlegen. Sonderwünsche unterliegen der Verfügbarkeit und sind gegebenenfalls mit einem Aufpreis verbunden.</p><p>Bitte teilen Sie der Unterkunft Niyama Private Islands Maldives Ihre voraussichtliche Ankunftszeit im Voraus mit. Nutzen Sie hierfür bei der Buchung das Feld für besondere Anfragen oder kontaktieren Sie die Unterkunft direkt.</p>",2026-04-06 15:26:20.289816+01,2026-04-06 15:26:20.289816+01
544e976e-8dff-4d59-b681-ff2213cf18b6,7e8a1556-d2c9-4a83-a9ac-99e81fd5587d,4a5822d2-4c85-4978-9486-2684ca3f1eb5,it,"<p>L'aeroporto di Canouan è il più vicino ed è raggiungibile tramite un servizio navetta organizzato dall'hotel.</p><p>Al check-in gli ospiti devono esibire un documento d'identità con foto e una carta di credito. Siete pregati di notare che le Richieste Speciali sono soggette a disponibilità, e potrebbero comportare l'addebito di un supplemento.</p><p>Siete pregati di comunicare in anticipo a Mandarin Oriental, Canouan l'orario in cui prevedete di arrivare. Potrete inserire questa informazione nella sezione Richieste Speciali al momento della prenotazione, o contattare la struttura utilizzando i recapiti riportati nella conferma della prenotazione.</p>",2026-04-06 15:26:51.681035+01,2026-04-06 15:26:51.681035+01
ed4aa349-4bf0-4d5d-a83f-17c575051532,17ce776a-d4b2-4fbb-90f7-21cdefd30d62,2c312f00-9e66-462a-aa75-50be8cca96c9,it,"<p>The property can be reached by seaplanes and domestic flights.</p><p>Seaplane transfer takes 45 minutes from Male International Airport.</p><p>Standard Transfer Times: Daylight hours.</p><p>Domestic flight transfer takes 25 minutes from Male International Airport, followed by a 5-minute speedboat transfer from Dhaalu Airport to the resort.</p><p>Children eat for free based on the rules and meal plan accompanied by an adult, excluding alcoholic beverages from the special set kids menu only.</p><p>Additional child in the room is charged at USD 61 per night and is added to the total cost separately.</p><p>Daily dinner is based on a three-course meal per person, excluding beverages, at selected restaurants. Supplementary charges may apply to special items on the menu.</p><p>Transfer options:</p><p>Seaplane transfer</p><p>From now to 31 December 2027</p><p>- Adult: USD 780</p><p>- Child (2-11): USD 390</p><p>Domestic flight transfer</p><p>From now to 31 December 2027</p><p>- Adult: USD 550</p><p>- Child (2-11): USD 275</p><p>Al check-in gli ospiti devono esibire un documento d'identità con foto e una carta di credito. Siete pregati di notare che le Richieste Speciali sono soggette a disponibilità, e potrebbero comportare l'addebito di un supplemento.</p><p>Siete pregati di comunicare in anticipo a Niyama Private Islands Maldives l'orario in cui prevedete di arrivare. Potrete inserire questa informazione nella sezione Richieste Speciali al momento della prenotazione, o contattare la struttura utilizzando i recapiti riportati nella conferma della prenotazione.</p>",2026-04-06 15:27:14.65348+01,2026-04-06 15:27:14.65348+01
30e5c52f-b2e7-4877-91fc-0498fd0aac4f,5a8aa157-e5fc-4cb5-91fb-5eb719393f7c,4a5822d2-4c85-4978-9486-2684ca3f1eb5,fr,"<p>L'aéroport de Canouan est le plus proche. L'hôtel propose une navette aéroport.</p><p>Vous devrez présenter une pièce d'identité avec photo et une carte de crédit lors de l'enregistrement. Veuillez noter que toutes les demandes spéciales seront satisfaites sous réserve de disponibilité et pourront entraîner des frais supplémentaires.</p><p>Veuillez informer l'établissement Mandarin Oriental, Canouan à l'avance de l'heure à laquelle vous prévoyez d'arriver. Vous pouvez indiquer cette information dans la rubrique « Demandes spéciales » lors de la réservation ou contacter directement l'établissement. Ses coordonnées figurent sur votre confirmation de réservation.</p>",2026-04-06 15:27:28.293768+01,2026-04-06 15:27:28.293768+01
e2e4fe32-84c1-4b55-90eb-ac7b605b0819,97834255-270f-4305-b546-2f4cd565b994,2c312f00-9e66-462a-aa75-50be8cca96c9,fr,"<p>The property can be reached by seaplanes and domestic flights.</p><p>Seaplane transfer takes 45 minutes from Male International Airport.</p><p>Standard Transfer Times: Daylight hours.</p><p>Domestic flight transfer takes 25 minutes from Male International Airport, followed by a 5-minute speedboat transfer from Dhaalu Airport to the resort.</p><p>Children eat for free based on the rules and meal plan accompanied by an adult, excluding alcoholic beverages from the special set kids menu only.</p><p>Additional child in the room is charged at USD 61 per night and is added to the total cost separately.</p><p>Daily dinner is based on a three-course meal per person, excluding beverages, at selected restaurants. Supplementary charges may apply to special items on the menu.</p><p>Transfer options:</p><p>Seaplane transfer</p><p>From now to 31 December 2027</p><p>- Adult: USD 780</p><p>- Child (2-11): USD 390</p><p>Domestic flight transfer</p><p>From now to 31 December 2027</p><p>- Adult: USD 550</p><p>- Child (2-11): USD 275</p><p>Vous devrez présenter une pièce d'identité avec photo et une carte de crédit lors de l'enregistrement. Veuillez noter que toutes les demandes spéciales seront satisfaites sous réserve de disponibilité et pourront entraîner des frais supplémentaires.</p><p>Veuillez informer l'établissement Niyama Private Islands Maldives à l'avance de l'heure à laquelle vous prévoyez d'arriver. Vous pouvez indiquer cette information dans la rubrique « Demandes spéciales » lors de la réservation ou contacter directement l'établissement. Ses coordonnées figurent sur votre confirmation de réservation.</p>",2026-04-06 15:28:05.214415+01,2026-04-06 15:28:05.214415+01
7e1852f0-2513-482d-9592-6dbc1804104b,8a6e1854-5320-473f-9380-2e87fbcad680,4a5822d2-4c85-4978-9486-2684ca3f1eb5,pt,"<p>O Canouan Airport é o aeroporto mais próximo. O hotel disponibiliza um serviço de transporte para o aeroporto.</p><p>No momento do check-in, os hóspedes deverão apresentar um documento de identificação com fotografia e um cartão de crédito.  Por favor, observe que todos os Pedidos Especiais estão sujeitos à disponibilidade e que poderão acarretar custos adicionais.</p><p>Por favor, informe Mandarin Oriental, Canouan antecipadamente sobre o seu horário de chegada. Para isso poderá utilizar a caixa de Pedidos Especiais durante o processo da reserva ou contactar a propriedade diretamente através dos dados para contacto providenciados na sua confirmação.</p>",2026-04-06 15:28:21.875903+01,2026-04-06 15:28:21.875903+01
c7f1ced0-1bec-4b98-9e1a-849eb62245dc,416ccb45-3338-452e-8209-b9d6808fed25,94a215cc-e236-4b99-9efd-7fa5e0f41b18,es,"<p>Los huéspedes deberán mostrar un documento de identidad válido y una tarjeta de crédito al realizar el registro de entrada. Ten en cuenta que todas las peticiones especiales están sujetas a disponibilidad y pueden comportar suplementos.</p><p>Informa a Grace Bay Club con antelación de tu hora prevista de llegada. Para ello, puedes utilizar el apartado de peticiones especiales al hacer la reserva o ponerte en contacto directamente con el alojamiento. Los datos de contacto aparecen en la confirmación de la reserva.</p><p>En respuesta al coronavirus (COVID-19), el alojamiento aplica medidas sanitarias y de seguridad adicionales en estos momentos.</p>",2026-04-06 15:30:52.674892+01,2026-04-06 15:30:52.674892+01
e47d551f-5c8b-4ba4-855f-b5a46619312b,2ce4a3be-a4b6-4766-9187-dd88ddb623de,c858fd3a-2959-4d3a-b1e2-57bfc3f2bc1f,es,"<p>Los huéspedes deberán mostrar un documento de identidad válido y una tarjeta de crédito al realizar el registro de entrada. Ten en cuenta que todas las peticiones especiales están sujetas a disponibilidad y pueden comportar suplementos.</p><p>Informa a South Bank con antelación de tu hora prevista de llegada. Para ello, puedes utilizar el apartado de peticiones especiales al hacer la reserva o ponerte en contacto directamente con el alojamiento. Los datos de contacto aparecen en la confirmación de la reserva.</p><p>En este alojamiento no se pueden celebrar despedidas de soltero o soltera ni fiestas similares.</p>",2026-04-06 15:31:17.57544+01,2026-04-06 15:31:17.57544+01
a180a8f3-7c2f-4358-a30e-25a7870152fb,4b27a0e5-a988-4390-a16d-84e7cf5896f8,94a215cc-e236-4b99-9efd-7fa5e0f41b18,de,<p>Beim Check-in müssen Sie einen Lichtbildausweis sowie eine Kreditkarte vorlegen. Sonderwünsche unterliegen der Verfügbarkeit und sind gegebenenfalls mit einem Aufpreis verbunden.</p><p>Bitte teilen Sie der Unterkunft Grace Bay Club Ihre voraussichtliche Ankunftszeit im Voraus mit. Nutzen Sie hierfür bei der Buchung das Feld für besondere Anfragen oder kontaktieren Sie die Unterkunft direkt.</p><p>Wegen des Coronavirus (COVID-19) wurden in dieser Unterkunft zusätzliche Sicherheits- und Hygienemaßnahmen unternommen.</p>,2026-04-06 15:31:34.167708+01,2026-04-06 15:31:34.167708+01
432e0531-34b3-4fa8-a430-00ef4f3419a1,72cd01d8-11f4-4dd5-8fa0-05c6345bd7f1,c858fd3a-2959-4d3a-b1e2-57bfc3f2bc1f,de,<p>Beim Check-in müssen Sie einen Lichtbildausweis sowie eine Kreditkarte vorlegen. Sonderwünsche unterliegen der Verfügbarkeit und sind gegebenenfalls mit einem Aufpreis verbunden.</p><p>Bitte teilen Sie der Unterkunft South Bank Ihre voraussichtliche Ankunftszeit im Voraus mit. Nutzen Sie hierfür bei der Buchung das Feld für besondere Anfragen oder kontaktieren Sie die Unterkunft direkt.</p><p>In dieser Unterkunft sind weder Junggesellen-/Junggesellinnenabschiede noch ähnliche Feiern erlaubt. </p>,2026-04-06 15:32:05.922502+01,2026-04-06 15:32:05.922502+01
78479e8e-55df-4690-8d92-c177289105f1,9749c01e-a10b-4546-84b9-5c63345e7402,94a215cc-e236-4b99-9efd-7fa5e0f41b18,it,"<p>Al check-in gli ospiti devono esibire un documento d'identità con foto e una carta di credito. Siete pregati di notare che le Richieste Speciali sono soggette a disponibilità, e potrebbero comportare l'addebito di un supplemento.</p><p>Siete pregati di comunicare in anticipo a Grace Bay Club l'orario in cui prevedete di arrivare. Potrete inserire questa informazione nella sezione Richieste Speciali al momento della prenotazione, o contattare la struttura utilizzando i recapiti riportati nella conferma della prenotazione.</p><p>In risposta al Coronavirus (COVID-19) questa struttura ha adottato misure extra di sicurezza e igiene.</p>",2026-04-06 15:32:35.545335+01,2026-04-06 15:32:35.545335+01
2f0e6f8a-f71f-4b4d-baac-63b5e77a50d8,3f68a148-fc18-4c4a-848f-fe5bd77800ae,c858fd3a-2959-4d3a-b1e2-57bfc3f2bc1f,it,"<p>Al check-in gli ospiti devono esibire un documento d'identità con foto e una carta di credito. Siete pregati di notare che le Richieste Speciali sono soggette a disponibilità, e potrebbero comportare l'addebito di un supplemento.</p><p>Siete pregati di comunicare in anticipo a South Bank l'orario in cui prevedete di arrivare. Potrete inserire questa informazione nella sezione Richieste Speciali al momento della prenotazione, o contattare la struttura utilizzando i recapiti riportati nella conferma della prenotazione.</p><p>La struttura non è disponibile per feste di addio al nubilato/celibato o simili.</p>",2026-04-06 15:32:50.088514+01,2026-04-06 15:32:50.088514+01
f43ec266-7550-4cf3-b1cf-07de526dddb5,ff0fdcf1-4b3a-4745-8acf-551577aa3c96,a5bb65c5-2823-4441-bf45-80b9d3afdbaa,es,<p>En este alojamiento no se pueden celebrar despedidas de soltero o soltera ni fiestas similares.</p><p>Se pedirá un depósito por daños de US$25 a la llegada. Se efectuará en efectivo. Se te devolverá al hacer el check-out. El depósito se devolverá por completo en efectivo una vez revisado el alojamiento.</p>,2026-04-06 15:37:13.171615+01,2026-04-06 15:37:13.171615+01
ae410755-9de5-42b9-a5d2-7889718132b0,ff45aefb-f10b-491b-bc29-4e6c5f3178e7,94a215cc-e236-4b99-9efd-7fa5e0f41b18,fr,"<p>Vous devrez présenter une pièce d'identité avec photo et une carte de crédit lors de l'enregistrement. Veuillez noter que toutes les demandes spéciales seront satisfaites sous réserve de disponibilité et pourront entraîner des frais supplémentaires.</p><p>Veuillez informer l'établissement Grace Bay Club à l'avance de l'heure à laquelle vous prévoyez d'arriver. Vous pouvez indiquer cette information dans la rubrique « Demandes spéciales » lors de la réservation ou contacter directement l'établissement. Ses coordonnées figurent sur votre confirmation de réservation.</p><p>Dans le cadre de la pandémie de coronavirus (COVID-19), cet établissement applique actuellement des mesures sanitaires supplémentaires.</p>",2026-04-06 15:33:37.335328+01,2026-04-06 15:33:37.335328+01
9cd8ecb6-141d-4d1e-88e4-cfdbc0045500,c1b54243-47f0-4078-b5fd-e72712b4150b,c858fd3a-2959-4d3a-b1e2-57bfc3f2bc1f,fr,<p>Vous devrez présenter une pièce d'identité avec photo et une carte de crédit lors de l'enregistrement. Veuillez noter que toutes les demandes spéciales seront satisfaites sous réserve de disponibilité et pourront entraîner des frais supplémentaires.</p><p>Veuillez informer l'établissement South Bank à l'avance de l'heure à laquelle vous prévoyez d'arriver. Vous pouvez indiquer cette information dans la rubrique « Demandes spéciales » lors de la réservation ou contacter directement l'établissement. Ses coordonnées figurent sur votre confirmation de réservation.</p><p>Les enterrements de vie de célibataire et autres fêtes de ce type sont interdits dans cet établissement.</p>,2026-04-06 15:33:53.664118+01,2026-04-06 15:33:53.664118+01
93ca7570-4250-4606-905c-182c483bd19c,16fe17e2-308c-47e0-aab4-1312e3a3d295,94a215cc-e236-4b99-9efd-7fa5e0f41b18,pt,"<p>No momento do check-in, os hóspedes deverão apresentar um documento de identificação com fotografia e um cartão de crédito.  Por favor, observe que todos os Pedidos Especiais estão sujeitos à disponibilidade e que poderão acarretar custos adicionais.</p><p>Por favor, informe Grace Bay Club antecipadamente sobre o seu horário de chegada. Para isso poderá utilizar a caixa de Pedidos Especiais durante o processo da reserva ou contactar a propriedade diretamente através dos dados para contacto providenciados na sua confirmação.</p><p>Em resposta ao Coronavírus (COVID-19), este alojamento está a tomar medidas de segurança e higienização adicionais.</p>",2026-04-06 15:34:09.0378+01,2026-04-06 15:34:09.0378+01
e1ff26d5-f272-469e-bf2b-c1ad7821b059,e57ad0f6-5c89-4663-92b8-eb4bccb601fa,e77db1c9-e1ae-4fb3-9b62-0a830315b1c3,en,"<p>Early check-in and late check-out are subject to availability.</p><p>The costs are as follows:</p><p>Early check-in – €100</p><p>Late check-out until 14:00 – €50</p><p>Late check-out until 18:00 – €100</p><p>Please note that the private beach are with sun loungers are reserved for the guests.</p><p>Please note that quick 1-minute buggy ride to the beach is available for all the guests.</p><p>This property will not accommodate hen, stag or similar parties.</p><p>A damage deposit of € 100 is required on arrival. This will be collected as a cash payment. You should be reimbursed on check-out. Your deposit will be refunded in full in cash, subject to an inspection of the property.</p>",2026-04-06 15:41:10.571564+01,2026-04-06 15:41:10.571564+01
0b64c206-0c98-4585-b97d-2462982eb65e,19049079-db1e-4071-b88d-29319a02e7d9,44f21413-72a3-4658-9984-41870f6dc492,en,"<p>Please note that the playground will be renovated from September 1, 2025, to September 30, 2025. During this time, the indoor play area will remain open and fully accessible.</p><p>Please inform Cheval Blanc Seychelles in advance of your expected arrival time. You can use the Special Requests box when booking, or contact the property directly with the contact details provided in your confirmation.</p><p>This property will not accommodate hen, stag or similar parties.</p>",2026-04-06 15:41:41.612581+01,2026-04-06 15:41:41.612581+01
c26210ac-1574-40fc-a3a3-11650758a609,48c27609-416a-4720-88aa-19cfc943f95f,c858fd3a-2959-4d3a-b1e2-57bfc3f2bc1f,pt,"<p>No momento do check-in, os hóspedes deverão apresentar um documento de identificação com fotografia e um cartão de crédito.  Por favor, observe que todos os Pedidos Especiais estão sujeitos à disponibilidade e que poderão acarretar custos adicionais.</p><p>Por favor, informe South Bank antecipadamente sobre o seu horário de chegada. Para isso poderá utilizar a caixa de Pedidos Especiais durante o processo da reserva ou contactar a propriedade diretamente através dos dados para contacto providenciados na sua confirmação.</p><p>Esta propriedade não permite a realização de festas de despedida de solteiros(as) e festas semelhantes.</p>",2026-04-06 15:34:48.159265+01,2026-04-06 15:34:48.159265+01
eb529b51-89c8-46a0-ab3f-0b9b7bceab2a,da10aa3f-38f1-4996-a1d4-9ca2bcdf474a,a5bb65c5-2823-4441-bf45-80b9d3afdbaa,en,"<p>This property will not accommodate hen, stag or similar parties.</p><p>A damage deposit of US$25 is required on arrival. This will be collected as a cash payment. You should be reimbursed on check-out. Your deposit will be refunded in full in cash, subject to an inspection of the property.</p>",2026-04-06 15:36:07.321557+01,2026-04-06 15:36:07.321557+01
cce1765d-67be-46d2-8442-a43af31a69f5,89a4e45f-558b-40e4-a528-89c04c725935,a5bb65c5-2823-4441-bf45-80b9d3afdbaa,pt,"<p>Esta propriedade não permite a realização de festas de despedida de solteiros(as) e festas semelhantes.</p><p>É exigida uma caução de US$25 no momento da chegada. A caução será cobrada como um pagamento em numerário. O reembolso deverá ser feito durante o check-out. A sua caução será reembolsada na totalidade em numerário, após uma inspeção ao alojamento.</p>",2026-04-06 15:40:14.816141+01,2026-04-06 15:40:14.816141+01
39c959fe-80ce-4cb2-a2f8-b1d5cace4a8e,cc354eb0-0c4d-4a32-9500-c0315c79767a,abdfd305-40fa-4e37-9f96-ab7cd973a49e,de,"<p>In dieser Unterkunft sind weder Junggesellen-/Junggesellinnenabschiede noch ähnliche Feiern erlaubt. </p><p>Bei der Ankunft ist eine Schadenskaution von US$200 erforderlich. Diese wird in bar hinterlegt. Sie erhalten die Erstattung in der Regel bei Abreise. Die Schadenskaution wird Ihnen in voller Höhe in bar erstattet, nachdem die Unterkunft überprüft wurde und keine Schäden festgestellt wurden.</p>",2026-04-06 15:37:23.554294+01,2026-04-06 15:37:23.554294+01
2f3c65d3-d093-4189-9412-bc2c5aec65e1,4e83d7ae-537b-4f7b-9880-ef7fbdca1c83,a5bb65c5-2823-4441-bf45-80b9d3afdbaa,de,"<p>In dieser Unterkunft sind weder Junggesellen-/Junggesellinnenabschiede noch ähnliche Feiern erlaubt. </p><p>Bei der Ankunft ist eine Schadenskaution von US$25 erforderlich. Diese wird in bar hinterlegt. Sie erhalten die Erstattung in der Regel bei Abreise. Die Schadenskaution wird Ihnen in voller Höhe in bar erstattet, nachdem die Unterkunft überprüft wurde und keine Schäden festgestellt wurden.</p>",2026-04-06 15:37:43.347152+01,2026-04-06 15:37:43.347152+01
1d0a3071-c64b-410b-a58c-d5f343ee0e0b,72e2ff08-a025-42fa-9f5f-5e76785c03b2,abdfd305-40fa-4e37-9f96-ab7cd973a49e,it,<p>La struttura non è disponibile per feste di addio al nubilato/celibato o simili.</p><p>È richiesto un deposito cauzionale di US$200 all'arrivo. Dovrai pagarlo in contanti. Dovresti ricevere il rimborso al momento del check-out. Il deposito ti sarà rimborsato per intero in contanti dopo una verifica dello stato dell'alloggio.</p>,2026-04-06 15:38:26.769458+01,2026-04-06 15:38:26.769458+01
e3d51d0f-0d82-4d62-baf0-ac2932b3243b,9dc0af2d-2982-4762-8dd2-7bf12a7bdc60,a5bb65c5-2823-4441-bf45-80b9d3afdbaa,it,<p>La struttura non è disponibile per feste di addio al nubilato/celibato o simili.</p><p>È richiesto un deposito cauzionale di US$25 all'arrivo. Dovrai pagarlo in contanti. Dovresti ricevere il rimborso al momento del check-out. Il deposito ti sarà rimborsato per intero in contanti dopo una verifica dello stato dell'alloggio.</p>,2026-04-06 15:38:49.110175+01,2026-04-06 15:38:49.110175+01
