"id","hotel_id","url_id","language","policy_name","policy_details","created_at"
"19","3e3ed7cb-e0d5-4170-ba42-edbcf19a3f45","e577917d-6ee3-4c33-a6dc-2b4d5662f142","en","House rules","Grace Bay Club takes special requests - add in the next step! See availability Check-in From 15:00 Guests are required to show a photo identification and credit card upon check-in You'll need to let the property know in advance what time you'll arrive. Check-out Until 11:00 Cancellation/ prepayment Cancellation and prepayment policies vary according to accommodation type. Please enter the dates of your stay and check the conditions of your required option. Children and beds Child policies Children of any age are welcome. Children 18 years and above will be charged as adults at this property. To see correct prices and occupancy information, please add the number of children in your group and their ages to your search. Cot and extra bed policies 0 - 2 years Extra bed upon request Free Cot upon request Free 3+ years Extra bed upon request Free The number of extra beds and cots allowed is dependent on the option you choose. Please check your selected option for more information. All cots and extra beds are subject to availability. No age restriction There is no age requirement for check-in Pets Pets are not allowed. Accepted payment methods Cash","2026-03-23 02:44:44.637805+00"
"20","b243f790-9c5a-45f1-a17c-947d21e7a8f7","1a54b67d-01db-4e6c-88fb-208392d58712","en","House rules","The Island Garden Hotel takes special requests - add in the next step! See availability Check-in From 15:00 to 18:00 Check-out From 08:00 to 11:00 Cancellation/ prepayment Cancellation and prepayment policies vary according to accommodation type. Please enter the dates of your stay and check the conditions of your required option. Refundable damage deposit A damage deposit of US$25 is required on arrival. That's about € 21. This will be collected as a cash payment. You should be reimbursed on check-out. Your deposit will be refunded in full in cash, subject to an inspection of the property. Children and beds Child policies Children of any age are welcome. To see correct prices and occupancy information, please add the number of children in your group and their ages to your search. Cot and extra bed policies Cots and extra beds are not available at this property. No age restriction There is no age requirement for check-in Pets Pets are not allowed. Accepted payment methods Cash Parties Parties/events are not allowed","2026-03-23 02:47:35.737495+00"
"24","6863239e-f60f-4a91-a9f0-4f3bdf588960","1a54b67d-01db-4e6c-88fb-208392d58712","it","Regole della struttura","The Island Garden Hotel accetta le richieste speciali. Aggiungile nel prossimo passaggio! Vedi disponibilità Arrivo Dalle 15:00 alle 18:00 Partenza Dalle 08:00 alle 11:00 Cancellazione / Pagamento anticipato Le condizioni relative alla cancellazione e al pagamento anticipato variano a seconda della tipologia di alloggio. Inserisci le date del soggiorno e verifica le condizioni dell'opzione scelta. Deposito cauzionale rimborsabile È richiesto un deposito cauzionale di US$25 all'arrivo. L'importo corrisponde a circa € 21. Dovrai pagarlo in contanti. Dovresti ricevere il rimborso al momento del check-out. Il deposito ti sarà rimborsato per intero in contanti dopo una verifica dello stato dell'alloggio. Bambini e letti Condizioni per i bambini I bambini di tutte le età sono i benvenuti. Per vedere informazioni corrette relativamente a prezzi e occupazione, aggiungi alla ricerca il numero e l'età dei bambini che soggiorneranno. Condizioni per culle e letti aggiuntivi In questa struttura non c'è disponibilità di culle e letti supplementari. Nessuna età minima Non è richiesta un'età minima per fare il check-in. Animali Animali non ammessi. Metodi di pagamento accettati Contanti Feste Non è permesso organizzare feste/eventi.","2026-03-23 02:53:02.218277+00"
"21","98738cee-4f89-449f-b455-47b809ea2e88","e577917d-6ee3-4c33-a6dc-2b4d5662f142","de","Hausregeln","Die Unterkunft Grace Bay Club nimmt besondere Anfragen an – im nächsten Schritt hinzufügen! Verfügbarkeit anzeigen Anreise Ab 15:00 Gäste müssen einen Lichtbildausweis und eine Kreditkarte beim Check-in vorlegen Bitte informieren Sie die Unterkunft im Voraus über Ihre Ankunftszeit. Abreise Bis 11:00 Stornierung/ Vorauszahlung Die Stornierungs- und Vorauszahlungsrichtlinien ändern sich je nach Unterkunftskategorie. Bitte geben Sie Ihre Reisedaten ein und überprüfen Sie die Bedingungen Ihrer gewählten Option. Kinder und Betten Richtlinien für Kinder Kinder jeden Alters sind willkommen. Kinder im Alter von 18 Jahren oder älter zahlen in dieser Unterkunft den Erwachsenenpreis. Fügen Sie Ihrer Suche bitte die Anzahl der Kinder in Ihrer Gruppe und deren Alter hinzu, um die korrekten Preise und Belegungsinformationen zu sehen. Richtlinien zu Baby- und Zustellbetten 0 - 2 Jahre Zustellbett auf Anfrage Kostenfrei Babybett auf Anfrage Kostenfrei über 3 Jahre Zustellbett auf Anfrage Kostenfrei Die Anzahl an Zustell- und Babybetten ist von der von Ihnen gewählten Option abhängig. Bitte prüfen Sie Ihre ausgewählte Option für mehr Informationen. Alle Babybetten und Zustellbetten unterliegen der Verfügbarkeit. Keine Altersbeschränkung Es gibt keine Altersbeschränkung für den Check-in. Haustiere Haustiere sind nicht gestattet. Akzeptierte Zahlungsmethoden Barzahlung","2026-03-23 02:48:53.83484+00"
"22","496b0a5c-8883-41f9-9692-db73af1ef113","1a54b67d-01db-4e6c-88fb-208392d58712","de","Hausregeln","Die Unterkunft The Island Garden Hotel nimmt besondere Anfragen an – im nächsten Schritt hinzufügen! Verfügbarkeit anzeigen Anreise Von 15:00 bis 18:00 Uhr Abreise Von 08:00 bis 11:00 Uhr Stornierung/ Vorauszahlung Die Stornierungs- und Vorauszahlungsrichtlinien ändern sich je nach Unterkunftskategorie. Bitte geben Sie Ihre Reisedaten ein und überprüfen Sie die Bedingungen Ihrer gewählten Option. Erstattungsfähige Schadenskaution Bei der Ankunft ist eine Schadenskaution von US$25 erforderlich. Das sind ungefähr € 21. Diese wird in bar hinterlegt. Sie erhalten die Erstattung in der Regel bei Abreise. Die Schadenskaution wird Ihnen in voller Höhe in bar erstattet, nachdem die Unterkunft überprüft wurde und keine Schäden festgestellt wurden. Kinder und Betten Richtlinien für Kinder Kinder jeden Alters sind willkommen. Fügen Sie Ihrer Suche bitte die Anzahl der Kinder in Ihrer Gruppe und deren Alter hinzu, um die korrekten Preise und Belegungsinformationen zu sehen. Richtlinien zu Baby- und Zustellbetten Baby- und Zustellbetten sind in dieser Unterkunft nicht verfügbar. Keine Altersbeschränkung Es gibt keine Altersbeschränkung für den Check-in. Haustiere Haustiere sind nicht gestattet. Akzeptierte Zahlungsmethoden Barzahlung Partys Partys/Veranstaltungen sind nicht erlaubt.","2026-03-23 02:50:11.629423+00"
"23","0c60b055-b828-4814-bf1f-cdb9638eac42","e577917d-6ee3-4c33-a6dc-2b4d5662f142","it","Regole della struttura","Grace Bay Club accetta le richieste speciali. Aggiungile nel prossimo passaggio! Vedi disponibilità Arrivo Dalle 15:00 Al check-in gli ospiti devono esibire un documento di riconoscimento con foto e una carta di credito. Dovrai comunicare in anticipo alla struttura il tuo orario di arrivo. Partenza Alle 11:00 Cancellazione / Pagamento anticipato Le condizioni relative alla cancellazione e al pagamento anticipato variano a seconda della tipologia di alloggio. Inserisci le date del soggiorno e verifica le condizioni dell'opzione scelta. Bambini e letti Condizioni per i bambini I bambini di tutte le età sono i benvenuti. I bambini di 18 anni o più pagheranno quanto gli adulti presso questa struttura. Per vedere informazioni corrette relativamente a prezzi e occupazione, aggiungi alla ricerca il numero e l'età dei bambini che soggiorneranno. Condizioni per culle e letti aggiuntivi 0 - 2 anni Letto supplementare su richiesta Gratis Culla su richiesta Gratis 3 anni e oltre Letto supplementare su richiesta Gratis Il numero di culle e letti supplementari ammessi dipende dall'opzione che scegli. Controlla quella che hai selezionato per maggiori informazioni. Le culle e i letti supplementari sono soggetti a disponibilità. Nessuna età minima Non è richiesta un'età minima per fare il check-in. Animali Animali non ammessi. Metodi di pagamento accettati Contanti","2026-03-23 02:51:31.055722+00"
"28","267ec270-1aee-41c5-94b0-5d2548d46a2c","40cc1aa4-9785-4ec8-94e3-9d4b07107567","de","Hausregeln","Die Unterkunft Hôtel Le Roy nimmt besondere Anfragen an – im nächsten Schritt hinzufügen! Verfügbarkeit anzeigen Anreise Von 16:00 bis 23:00 Uhr Abreise Von 07:00 bis 12:00 Uhr Stornierung/ Vorauszahlung Die Stornierungs- und Vorauszahlungsrichtlinien ändern sich je nach Unterkunftskategorie. Bitte geben Sie Ihre Reisedaten ein und überprüfen Sie die Bedingungen Ihrer gewählten Option. Erstattungsfähige Schadenskaution Bei der Ankunft ist eine Schadenskaution von US$200 erforderlich. Das sind ungefähr € 173. Diese wird in bar hinterlegt. Sie erhalten die Erstattung in der Regel bei Abreise. Die Schadenskaution wird Ihnen in voller Höhe in bar erstattet, nachdem die Unterkunft überprüft wurde und keine Schäden festgestellt wurden. Kinder und Betten Richtlinien für Kinder Kinder jeden Alters sind willkommen. Kinder im Alter von 18 Jahren oder älter zahlen in dieser Unterkunft den Erwachsenenpreis. Fügen Sie Ihrer Suche bitte die Anzahl der Kinder in Ihrer Gruppe und deren Alter hinzu, um die korrekten Preise und Belegungsinformationen zu sehen. Richtlinien zu Baby- und Zustellbetten Die Anzahl an Zustellbetten ist von der von Ihnen gewählten Option abhängig. Bitte prüfen Sie Ihre ausgewählte Option für mehr Informationen. Babybetten sind in dieser Unterkunft nicht verfügbar. Alle Zustellbetten unterliegen der Verfügbarkeit. Keine Altersbeschränkung Es gibt keine Altersbeschränkung für den Check-in. Haustiere Haustiere sind nicht gestattet. In diesem Hotel werden folgende Karten akzeptiert Barzahlung nicht akzeptiert Partys Partys/Veranstaltungen sind nicht erlaubt.","2026-03-23 03:04:40.854308+00"
"25","43e52e4c-866c-48ba-b552-092cda24608a","40cc1aa4-9785-4ec8-94e3-9d4b07107567","es","Normas de la casa","Hôtel Le Roy acepta peticiones especiales. ¡Añádelas en el siguiente paso! Ver disponibilidad Entrada De las 16:00 a las 23:00 Salida De las 7:00 a las 12:00 Cancelación /  prepago Las condiciones de cancelación y de pago por adelantado pueden variar según el tipo de alojamiento. Introduce las fechas de tu estancia y consulta las condiciones de la opción que quieres reservar. Depósito por daños reembolsable Se pedirá un depósito por daños de US$200 a la llegada. Equivale a € 173 aprox. Se efectuará en efectivo. Se te devolverá al hacer el check-out. El depósito se devolverá por completo en efectivo una vez revisado el alojamiento. Camas para niños Condiciones para estancias con niños Se pueden alojar niños de cualquier edad. Los niños a partir de 18 años pagan como adultos en este alojamiento. Para ver la información correcta sobre precios y ocupación, añade a la búsqueda el número de niños con los que viajas y sus edades. Condiciones sobre cunas y camas supletorias El número de camas supletorias permitido depende de la opción que escojas. Consulta la opción que has escogido para saber más. No hay cunas disponibles en este alojamiento. Todas las camas supletorias están sujetas a disponibilidad. No hay restricción por edad No hay edad mínima para el check-in Mascotas No se admiten. Tarjetas aceptadas en este hotel No se acepta efectivo Fiestas No se pueden celebrar fiestas/eventos","2026-03-23 02:54:19.088891+00"
"26","9fde18f6-9f20-4b91-b8a2-2b8ab4f177f3","738af1b4-cc53-4b9c-b66a-6dd80b0168d2","es","Normas de la casa","Cheval Blanc Seychelles acepta peticiones especiales. ¡Añádelas en el siguiente paso! Ver disponibilidad Entrada De las 14:00 a las 0:00 Tienes que decirle al alojamiento con antelación a qué hora vas a llegar. Salida De las 6:00 a las 12:00 Cancelación /  prepago Las condiciones de cancelación y de pago por adelantado pueden variar según el tipo de alojamiento. Introduce las fechas de tu estancia y consulta las condiciones de la opción que quieres reservar. Camas para niños Condiciones para estancias con niños Se pueden alojar niños de cualquier edad. Los niños a partir de 17 años pagan como adultos en este alojamiento. Para ver la información correcta sobre precios y ocupación, añade a la búsqueda el número de niños con los que viajas y sus edades. Condiciones sobre cunas y camas supletorias 0 - 3 años Cuna siempre disponible Gratis 4 - 12 años Cama supletoria a petición € 210 por niño y noche Más de 13 años Cama supletoria a petición € 380 por persona y noche El precio de las cunas y las camas supletorias no está incluido en el precio total y se tiene que pagar por separado durante la estancia. El número de camas supletorias y cunas permitido depende de la opción que escojas. Consulta la opción que has escogido para saber más. Todas las camas supletorias están sujetas a disponibilidad. No hay restricción por edad No hay edad mínima para el check-in Mascotas Se admiten bajo petición. Se pueden aplicar suplementos. Grupos Al reservar más de 2 habitaciones, podrán aplicarse condiciones especiales y suplementos. Tarjetas aceptadas en este alojamiento No se acepta efectivo Fiestas No se pueden celebrar fiestas/eventos","2026-03-23 02:55:36.553642+00"
"27","1892bd25-91b3-4695-acd8-3d7165fca0b2","40cc1aa4-9785-4ec8-94e3-9d4b07107567","en","House rules","Hôtel Le Roy takes special requests - add in the next step! See availability Check-in From 16:00 to 23:00 Check-out From 07:00 to 12:00 Cancellation/ prepayment Cancellation and prepayment policies vary according to accommodation type. Please enter the dates of your stay and check the conditions of your required option. Refundable damage deposit A damage deposit of US$200 is required on arrival. That's about € 173. This will be collected as a cash payment. You should be reimbursed on check-out. Your deposit will be refunded in full in cash, subject to an inspection of the property. Children and beds Child policies Children of any age are welcome. Children 18 years and above will be charged as adults at this property. To see correct prices and occupancy information, please add the number of children in your group and their ages to your search. Cot and extra bed policies The number of extra beds allowed is dependent on the option you choose. Please check your selected option for more information. There are no cots available at this property. All extra beds are subject to availability. No age restriction There is no age requirement for check-in Pets Pets are not allowed. Cards accepted at this hotel Cash is not accepted Parties Parties/events are not allowed","2026-03-23 02:58:30.425818+00"
"29","c2c8f6dc-d355-4d3b-896e-bf3059f7e65f","40cc1aa4-9785-4ec8-94e3-9d4b07107567","it","Regole della struttura","Hôtel Le Roy accetta le richieste speciali. Aggiungile nel prossimo passaggio! Vedi disponibilità Arrivo Dalle 16:00 alle 23:00 Partenza Dalle 07:00 alle 12:00 Cancellazione / Pagamento anticipato Le condizioni relative alla cancellazione e al pagamento anticipato variano a seconda della tipologia di alloggio. Inserisci le date del soggiorno e verifica le condizioni dell'opzione scelta. Deposito cauzionale rimborsabile È richiesto un deposito cauzionale di US$200 all'arrivo. L'importo corrisponde a circa € 173. Dovrai pagarlo in contanti. Dovresti ricevere il rimborso al momento del check-out. Il deposito ti sarà rimborsato per intero in contanti dopo una verifica dello stato dell'alloggio. Bambini e letti Condizioni per i bambini I bambini di tutte le età sono i benvenuti. I bambini di 18 anni o più pagheranno quanto gli adulti presso questa struttura. Per vedere informazioni corrette relativamente a prezzi e occupazione, aggiungi alla ricerca il numero e l'età dei bambini che soggiorneranno. Condizioni per culle e letti aggiuntivi Il numero di letti supplementari ammessi dipende dall'opzione che scegli. Controlla quella che hai selezionato per maggiori informazioni. In questa struttura non c'è disponibilità di culle. I letti supplementari sono soggetti a disponibilità. Nessuna età minima Non è richiesta un'età minima per fare il check-in. Animali Animali non ammessi. Carte di credito accettate presso questo hotel Non si accettano contanti Feste Non è permesso organizzare feste/eventi.","2026-03-23 03:10:53.64332+00"
"30","98d53a28-45fa-4fb5-bd98-c2cdcff80863","b134f561-ad2c-40b6-b858-9b9ad18f13e2","es","Normas de la casa","Gardens Hill Resort & Spa acepta peticiones especiales. ¡Añádelas en el siguiente paso! Ver disponibilidad Entrada De las 15:00 a las 0:00 Salida De las 4:00 a las 11:00 Cancelación /  prepago Las condiciones de cancelación y de pago por adelantado pueden variar según el tipo de alojamiento. Introduce las fechas de tu estancia y consulta las condiciones de la opción que quieres reservar. Depósito por daños reembolsable Se pedirá un depósito por daños de € 100 a la llegada. Se efectuará en efectivo. Se te devolverá al hacer el check-out. El depósito se devolverá por completo en efectivo una vez revisado el alojamiento. Camas para niños Condiciones para estancias con niños Se pueden alojar niños de cualquier edad. Para ver la información correcta sobre precios y ocupación, añade a la búsqueda el número de niños con los que viajas y sus edades. Condiciones sobre cunas y camas supletorias 0 - 3 años Cuna a petición Gratis 4 - 11 años Cama supletoria a petición € 38,65 por niño y noche Más de 12 años Cama supletoria a petición € 77,29 por persona y noche El precio de las cunas y las camas supletorias no está incluido en el precio total y se tiene que pagar por separado durante la estancia. El número de camas supletorias y cunas permitido depende de la opción que escojas. Consulta la opción que has escogido para saber más. Todas las cunas y camas supletorias están sujetas a disponibilidad. No hay restricción por edad No hay edad mínima para el check-in Mascotas No se admiten. Tarjetas aceptadas en este alojamiento No se acepta efectivo Fiestas No se pueden celebrar fiestas/eventos","2026-03-23 03:17:10.97889+00"
"31","9c0f9103-6e28-4989-ac4a-c3f07c8b234d","b134f561-ad2c-40b6-b858-9b9ad18f13e2","en","House rules","Gardens Hill Resort & Spa takes special requests - add in the next step! See availability Check-in From 15:00 to 00:00 Check-out From 04:00 to 11:00 Cancellation/ prepayment Cancellation and prepayment policies vary according to accommodation type. Please enter the dates of your stay and check the conditions of your required option. Refundable damage deposit A damage deposit of € 100 is required on arrival. That's about SEK 1,080. This will be collected as a cash payment. You should be reimbursed on check-out. Your deposit will be refunded in full in cash, subject to an inspection of the property. Children and beds Child policies Children of any age are welcome. To see correct prices and occupancy information, please add the number of children in your group and their ages to your search. Cot and extra bed policies 0 - 3 years Cot upon request Free 4 - 11 years Extra bed upon request € 38.65 per child, per night 12+ years Extra bed upon request € 77.29 per person, per night Prices for cots and extra beds are not included in the total price, and will have to be paid for separately during your stay. The number of extra beds and cots allowed is dependent on the option you choose. Please check your selected option for more information. All cots and extra beds are subject to availability. No age restriction There is no age requirement for check-in Pets Pets are not allowed. Cards accepted at this property Cash is not accepted Parties Parties/events are not allowed","2026-03-23 03:25:06.799468+00"
"32","f155789a-338f-4a38-b96b-a8159651b3f5","b134f561-ad2c-40b6-b858-9b9ad18f13e2","de","Hausregeln","Die Unterkunft Gardens Hill Resort & Spa nimmt besondere Anfragen an – im nächsten Schritt hinzufügen! Verfügbarkeit anzeigen Anreise Von 15:00 bis 00:00 Uhr Abreise Von 04:00 bis 11:00 Uhr Stornierung/ Vorauszahlung Die Stornierungs- und Vorauszahlungsrichtlinien ändern sich je nach Unterkunftskategorie. Bitte geben Sie Ihre Reisedaten ein und überprüfen Sie die Bedingungen Ihrer gewählten Option. Erstattungsfähige Schadenskaution Bei der Ankunft ist eine Schadenskaution von € 100 erforderlich. Das sind ungefähr SEK 1.080. Diese wird in bar hinterlegt. Sie erhalten die Erstattung in der Regel bei Abreise. Die Schadenskaution wird Ihnen in voller Höhe in bar erstattet, nachdem die Unterkunft überprüft wurde und keine Schäden festgestellt wurden. Kinder und Betten Richtlinien für Kinder Kinder jeden Alters sind willkommen. Fügen Sie Ihrer Suche bitte die Anzahl der Kinder in Ihrer Gruppe und deren Alter hinzu, um die korrekten Preise und Belegungsinformationen zu sehen. Richtlinien zu Baby- und Zustellbetten 0 - 3 Jahre Babybett auf Anfrage Kostenfrei 4 - 11 Jahre Zustellbett auf Anfrage € 38,65 pro Kind, pro Nacht über 12 Jahre Zustellbett auf Anfrage € 77,29 pro Person, pro Nacht Preise für Baby- und Zustellbetten sind nicht im Gesamtpreis enthalten und müssen separat während Ihres Aufenthaltes bezahlt werden. Die Anzahl an Zustell- und Babybetten ist von der von Ihnen gewählten Option abhängig. Bitte prüfen Sie Ihre ausgewählte Option für mehr Informationen. Alle Babybetten und Zustellbetten unterliegen der Verfügbarkeit. Keine Altersbeschränkung Es gibt keine Altersbeschränkung für den Check-in. Haustiere Haustiere sind nicht gestattet. In dieser Unterkunft werden folgende Karten akzeptiert Barzahlung nicht akzeptiert Partys Partys/Veranstaltungen sind nicht erlaubt.","2026-03-23 03:31:30.034919+00"
"34","c5e3bfae-5f5c-4a63-919e-7f51fa6f21cf","78b1b319-2fbf-4d1e-a4b3-81aa324836d8","es","Normas de la casa","Golden Beach Resort & Spa acepta peticiones especiales. ¡Añádelas en el siguiente paso! Ver disponibilidad Entrada Desde las 15:00 Salida Hasta las 12:00 Cancelación /  prepago Las condiciones de cancelación y de pago por adelantado pueden variar según el tipo de alojamiento. Introduce las fechas de tu estancia y consulta las condiciones de la opción que quieres reservar. Camas para niños Condiciones para estancias con niños Se pueden alojar niños de cualquier edad. Los niños a partir de 18 años pagan como adultos en este alojamiento. Para ver la información correcta sobre precios y ocupación, añade a la búsqueda el número de niños con los que viajas y sus edades. Condiciones sobre cunas y camas supletorias 0 - 3 años Cuna a petición Gratis El número de cunas permitido depende de la opción que escojas. Consulta la opción que has escogido para saber más. No hay camas supletorias disponibles en este alojamiento. Todas las cunas están sujetas a disponibilidad. No hay restricción por edad No hay edad mínima para el check-in Mascotas Se admiten bajo petición. Se pueden aplicar suplementos. Métodos de pago aceptados Efectivo","2026-03-23 03:39:02.831368+00"
"35","50187b26-21a8-4028-81ef-d6090c3d1af8","3016cdeb-d26c-480f-8190-94db410648a6","es","Normas de la casa","Hotel Atlântico Rio acepta peticiones especiales. ¡Añádelas en el siguiente paso! Ver disponibilidad Entrada Desde las 14:00 Los clientes deben mostrar un documento de identidad con fotografía y una tarjeta de crédito en el momento de hacer el check-in Salida Hasta las 12:00 Cancelación /  prepago Las condiciones de cancelación y de pago por adelantado pueden variar según el tipo de alojamiento. Introduce las fechas de tu estancia y consulta las condiciones de la opción que quieres reservar. Camas para niños Condiciones para estancias con niños Se pueden alojar niños de cualquier edad. Los niños a partir de 9 años pagan como adultos en este alojamiento. Para ver la información correcta sobre precios y ocupación, añade a la búsqueda el número de niños con los que viajas y sus edades. Condiciones sobre cunas y camas supletorias En este alojamiento no hay cunas ni camas supletorias. Restricción por edad Edad mínima para el check-in: 18 Mascotas No se admiten. Grupos Al reservar más de 5 habitaciones, podrán aplicarse condiciones especiales y suplementos. Métodos de pago aceptados Efectivo","2026-03-23 03:40:41.544323+00"
"36","deeb5cb1-5d3e-4911-8adc-5ae2abc7afe6","78b1b319-2fbf-4d1e-a4b3-81aa324836d8","en","House rules","Golden Beach Resort & Spa takes special requests - add in the next step! See availability Check-in From 15:00 Check-out Until 12:00 Cancellation/ prepayment Cancellation and prepayment policies vary according to accommodation type. Please enter the dates of your stay and check the conditions of your required option. Children and beds Child policies Children of any age are welcome. Children 18 years and above will be charged as adults at this property. To see correct prices and occupancy information, please add the number of children in your group and their ages to your search. Cot and extra bed policies 0 - 3 years Cot upon request Free The number of cots allowed is dependent on the option you choose. Please check your selected option for more information. There are no extra beds available at this property. All cots are subject to availability. No age restriction There is no age requirement for check-in Pets Pets are allowed on request. Charges may be applicable. Accepted payment methods Cash","2026-03-23 03:43:33.007745+00"
