id,id_photo,hotel_id,orientation,photo_width,photo_height,alt,created_at_photo,created_at
8e096f6b-61c5-4a0a-a3c7-37087b8d97b5,818927212,408f191d-041f-43aa-9a43-bdcfb3a1e2e9,landscape,5472,3648,a mural in a bar with two chairs in a lobby at Motel One Graz in Graz,2026-02-06 21:09:44+00,2026-04-12 22:47:12.628132+01
895c6a38-b155-4e23-8f2a-43537bb5af8d,818983208,408f191d-041f-43aa-9a43-bdcfb3a1e2e9,landscape,2880,1920,a buffet of food on a table in a restaurant at Motel One Graz in Graz,2026-02-07 02:41:10+00,2026-04-12 22:47:12.632469+01
0d0b613f-abdc-4058-8a3d-0bf0eb5ba944,818983199,408f191d-041f-43aa-9a43-bdcfb3a1e2e9,landscape,2880,1920,a living room with a yellow couch and chairs at Motel One Graz in Graz,2026-02-07 02:40:59+00,2026-04-12 22:47:12.63492+01
b707c00e-cec2-4b96-8bc4-a763d2dc22df,818983159,408f191d-041f-43aa-9a43-bdcfb3a1e2e9,landscape,2880,1920,a living room with chairs and a table and a chandelier at Motel One Graz in Graz,2026-02-07 02:40:40+00,2026-04-12 22:47:12.636992+01
0789fb50-32e1-49e3-9eaa-e36a8d924b4e,818927639,408f191d-041f-43aa-9a43-bdcfb3a1e2e9,landscape,2880,1920,a yellow couch in a room with a table at Motel One Graz in Graz,2026-02-06 21:11:38+00,2026-04-12 22:47:12.639076+01
0a823f6f-b742-4f5e-9067-33746f9f8431,818983206,408f191d-041f-43aa-9a43-bdcfb3a1e2e9,portrait,2880,4320,a room with some glass on the wall at Motel One Graz in Graz,2026-02-07 02:41:07+00,2026-04-12 22:47:12.640985+01
ea5e53d8-2116-4ea5-9f5e-044933cbf6b7,818927549,408f191d-041f-43aa-9a43-bdcfb3a1e2e9,landscape,2880,1920,a display case with a bunch of different colored tapes at Motel One Graz in Graz,2026-02-06 21:11:03+00,2026-04-12 22:47:12.6428+01
06ff23e2-7761-401a-9fa3-5ddf05b84168,818927622,408f191d-041f-43aa-9a43-bdcfb3a1e2e9,landscape,2880,1920,a room with chairs and tables in front of a mural at Motel One Graz in Graz,2026-02-06 21:11:30+00,2026-04-12 22:47:12.644366+01
058f3618-eaff-4754-ab44-525eb91c3e83,818983130,408f191d-041f-43aa-9a43-bdcfb3a1e2e9,landscape,2880,1920,a group of glass doors in a building at Motel One Graz in Graz,2026-02-07 02:40:24+00,2026-04-12 22:47:12.645956+01
34387e0a-ff61-43c5-a0d7-a19846d5df30,818927588,408f191d-041f-43aa-9a43-bdcfb3a1e2e9,landscape,2880,1920,a bar in a restaurant with green chairs and tables at Motel One Graz in Graz,2026-02-06 21:11:13+00,2026-04-12 22:47:12.647776+01
ce32e094-d26a-47a1-8287-c7ef217debe7,818983193,408f191d-041f-43aa-9a43-bdcfb3a1e2e9,landscape,2880,1920,a bar in a restaurant with a wooden counter at Motel One Graz in Graz,2026-02-07 02:40:55+00,2026-04-12 22:47:12.649663+01
5a86b472-ce1a-450a-86c9-1253ed3e08c4,818927166,408f191d-041f-43aa-9a43-bdcfb3a1e2e9,portrait,2880,4320,a shelf filled with different types of bread and pastries at Motel One Graz in Graz,2026-02-06 21:09:32+00,2026-04-12 22:47:12.651162+01
f00fa761-4ec6-4696-a8bd-d0eacaad47bd,818983204,408f191d-041f-43aa-9a43-bdcfb3a1e2e9,landscape,2880,1920,a lobby with a purple couch and chairs at Motel One Graz in Graz,2026-02-07 02:41:04+00,2026-04-12 22:47:12.652481+01
e3852d8b-8cda-4559-833e-90f851119ee2,818927617,408f191d-041f-43aa-9a43-bdcfb3a1e2e9,landscape,2880,1921,a bar with a row of stools in a room at Motel One Graz in Graz,2026-02-06 21:11:29+00,2026-04-12 22:47:12.653815+01
53620ca0-30e3-4fc8-81e6-a2dc647909f5,818927616,408f191d-041f-43aa-9a43-bdcfb3a1e2e9,landscape,2880,1921,a restaurant with tables and chairs and booths at Motel One Graz in Graz,2026-02-06 21:11:28+00,2026-04-12 22:47:12.655242+01
5d00eec4-39c1-4d26-a183-ebbda9104ced,818927607,408f191d-041f-43aa-9a43-bdcfb3a1e2e9,landscape,2880,1921,a lobby with chairs and tables and a chandelier at Motel One Graz in Graz,2026-02-06 21:11:24+00,2026-04-12 22:47:12.656548+01
716e62d2-6a90-4c3f-8f9f-74b747b543e7,818927610,408f191d-041f-43aa-9a43-bdcfb3a1e2e9,portrait,2880,4319,a dining room with a large wooden table and chairs at Motel One Graz in Graz,2026-02-06 21:11:26+00,2026-04-12 22:47:12.657853+01
c319152b-1301-49a3-b472-565afb08defd,818927186,408f191d-041f-43aa-9a43-bdcfb3a1e2e9,landscape,2880,1921,a restaurant with a bar with chairs and a table at Motel One Graz in Graz,2026-02-06 21:09:36+00,2026-04-12 22:47:12.659239+01
ac55b366-785c-42b4-9043-a5ff9ab234ee,818983203,408f191d-041f-43aa-9a43-bdcfb3a1e2e9,landscape,2880,1921,a bar with a wooden counter with pendant lights at Motel One Graz in Graz,2026-02-07 02:41:03+00,2026-04-12 22:47:12.660677+01
c1ebce2c-361b-454b-a884-f896d2ba9dac,818983210,408f191d-041f-43aa-9a43-bdcfb3a1e2e9,landscape,2880,1920,a building with a modified one sign on it at Motel One Graz in Graz,2026-02-07 02:41:12+00,2026-04-12 22:47:12.662082+01
b5d1f871-cf13-4c46-bc04-df6ceaa512dc,818983175,408f191d-041f-43aa-9a43-bdcfb3a1e2e9,portrait,2880,4320,a large white building with windows on a street at Motel One Graz in Graz,2026-02-07 02:40:48+00,2026-04-12 22:47:12.664252+01
70dd4ab8-1201-4db9-a3ae-f59c508024cb,818927614,408f191d-041f-43aa-9a43-bdcfb3a1e2e9,landscape,2880,1920,a building with a lot of windows on a street at Motel One Graz in Graz,2026-02-06 21:11:27+00,2026-04-12 22:47:12.667379+01
683f5b8a-f96c-4f71-a660-9a799dfb9eb9,818927651,408f191d-041f-43aa-9a43-bdcfb3a1e2e9,portrait,3648,5472,a building with the words hotel on it at Motel One Graz in Graz,2026-02-06 21:11:44+00,2026-04-12 22:47:12.671487+01
2bf0dff7-c3c1-4e9e-ba88-4493f926c3bc,818927652,408f191d-041f-43aa-9a43-bdcfb3a1e2e9,landscape,2880,1867,a hotel room with a bed and a large window at Motel One Graz in Graz,2026-02-06 21:11:44+00,2026-04-12 22:47:12.673438+01
7ab5f316-e3e5-4d25-9e76-888e665ebcfe,818983133,408f191d-041f-43aa-9a43-bdcfb3a1e2e9,landscape,2880,1920,a bedroom with a large white bed with blue pillows at Motel One Graz in Graz,2026-02-07 02:40:28+00,2026-04-12 22:47:12.674883+01
d39af09b-ed2a-47c2-ad9a-4b8cde35fca8,818927510,408f191d-041f-43aa-9a43-bdcfb3a1e2e9,landscape,2880,1921,a bedroom with a large white bed and a window at Motel One Graz in Graz,2026-02-06 21:10:56+00,2026-04-12 22:47:12.676264+01
1cf417fb-b7b6-48c6-a51e-29ddfcd3e239,818927602,408f191d-041f-43aa-9a43-bdcfb3a1e2e9,landscape,2880,1920,two beds in a hotel room with a window at Motel One Graz in Graz,2026-02-06 21:11:21+00,2026-04-12 22:47:12.677801+01
7527b5d8-a23f-4802-8b97-9673b4120327,818927521,408f191d-041f-43aa-9a43-bdcfb3a1e2e9,landscape,2880,1920,a bedroom with two white beds and blue pillows at Motel One Graz in Graz,2026-02-06 21:10:57+00,2026-04-12 22:47:12.679461+01
1dcea0b7-8765-42c7-bc4f-9fb339d16e6d,818983186,408f191d-041f-43aa-9a43-bdcfb3a1e2e9,landscape,2880,1921,a bedroom with a large white bed with blue pillows at Motel One Graz in Graz,2026-02-07 02:40:51+00,2026-04-12 22:47:12.682838+01
d31b7a84-0947-4cd2-a5fd-ff05b51a8e24,818983207,408f191d-041f-43aa-9a43-bdcfb3a1e2e9,landscape,2880,1920,a bedroom with a large white bed with blue pillows at Motel One Graz in Graz,2026-02-07 02:41:09+00,2026-04-12 22:47:12.687069+01
4d85b815-c7c2-49b6-a398-a4eff0a18553,818927239,408f191d-041f-43aa-9a43-bdcfb3a1e2e9,landscape,2880,1920,a bedroom with a large bed and a large window at Motel One Graz in Graz,2026-02-06 21:09:54+00,2026-04-12 22:47:12.688886+01
4f68709a-02e0-4245-a6a8-61a176ca79e7,818927623,408f191d-041f-43aa-9a43-bdcfb3a1e2e9,landscape,2880,1920,a bed with a view of a city from a window at Motel One Graz in Graz,2026-02-06 21:11:32+00,2026-04-12 22:47:12.690478+01
2edff880-c616-415a-895c-17f883f986f6,818983138,408f191d-041f-43aa-9a43-bdcfb3a1e2e9,landscape,2880,1920,a bathroom with two sinks and a mirror at Motel One Graz in Graz,2026-02-07 02:40:32+00,2026-04-12 22:47:12.69202+01
b4e7d368-6ace-4537-8ac7-2d5914128bd3,818983202,408f191d-041f-43aa-9a43-bdcfb3a1e2e9,landscape,2880,1919,a shower in a bathroom with a bottle of soap at Motel One Graz in Graz,2026-02-07 02:41:02+00,2026-04-12 22:47:12.693578+01
333c1dcc-8205-4bf4-9898-413f95da4443,818983143,408f191d-041f-43aa-9a43-bdcfb3a1e2e9,landscape,2880,1916,a close up of a shower head with white towels at Motel One Graz in Graz,2026-02-07 02:40:36+00,2026-04-12 22:47:12.694974+01
c597bafc-a6e4-4b64-9b86-b3d3d9799945,209498435,2c0e506d-9617-4450-acd4-907200cfa0ed,landscape,5000,3337,a living room with two chairs and a table at Stadtvilla Schladming Boutiquehotel in Schladming,2019-07-14 13:14:22+01,2026-04-12 22:47:27.325252+01
4269822f-0e11-4f57-bd62-0149ec40a3a9,209498426,2c0e506d-9617-4450-acd4-907200cfa0ed,landscape,5000,3335,a clock on a wall with flowers on it at Stadtvilla Schladming Boutiquehotel in Schladming,2019-07-14 13:14:16+01,2026-04-12 22:47:27.327962+01
f461d6d7-8874-4a2b-aae8-9a51490ed751,206904385,2c0e506d-9617-4450-acd4-907200cfa0ed,landscape,5000,3335,a building with a tree in front of it at Stadtvilla Schladming Boutiquehotel in Schladming,2019-06-29 20:46:20+01,2026-04-12 22:47:27.329794+01
c5ccc268-a8c9-4a38-8b4e-93cc73aa95d0,209498439,2c0e506d-9617-4450-acd4-907200cfa0ed,landscape,5000,3489,a lobby with a table and a chair and a plant at Stadtvilla Schladming Boutiquehotel in Schladming,2019-07-14 13:14:26+01,2026-04-12 22:47:27.331945+01
0f6eb7e2-3911-4c0a-85a8-14694552f473,209505634,2c0e506d-9617-4450-acd4-907200cfa0ed,landscape,5000,3335,a hotel room with a bed and a living room at Stadtvilla Schladming Boutiquehotel in Schladming,2019-07-14 14:11:28+01,2026-04-12 22:47:27.33377+01
b80aec55-97df-4c31-9010-6a1798b34b8b,209500163,2c0e506d-9617-4450-acd4-907200cfa0ed,landscape,5000,3335,a kitchen and dining room with a wooden table and chairs at Stadtvilla Schladming Boutiquehotel in Schladming,2019-07-14 13:25:51+01,2026-04-12 22:47:27.335632+01
045e9392-19b0-4c6e-acb3-68b260fa2e15,209500101,2c0e506d-9617-4450-acd4-907200cfa0ed,landscape,5000,3335,a dining room with a table and chairs at Stadtvilla Schladming Boutiquehotel in Schladming,2019-07-14 13:25:38+01,2026-04-12 22:47:27.337467+01
3e0ade57-9c2b-4d91-8199-e3378d01d9f7,209505616,2c0e506d-9617-4450-acd4-907200cfa0ed,landscape,5000,3337,a living room with a couch and a table at Stadtvilla Schladming Boutiquehotel in Schladming,2019-07-14 14:11:21+01,2026-04-12 22:47:27.33913+01
9803a6b4-96ab-43af-8a75-1218c46cd810,206904407,2c0e506d-9617-4450-acd4-907200cfa0ed,landscape,5000,3335,a building with a balcony on top of it at Stadtvilla Schladming Boutiquehotel in Schladming,2019-06-29 20:46:30+01,2026-04-12 22:47:27.340762+01
19cd193d-d69d-45ea-8cfd-35056a55a518,236453193,2c0e506d-9617-4450-acd4-907200cfa0ed,landscape,5000,3610,a dining room with a table and a window at Stadtvilla Schladming Boutiquehotel in Schladming,2020-01-01 12:41:00+00,2026-04-12 22:47:27.342335+01
d61335fb-61a9-4f1d-bc02-725256bdb597,209505610,2c0e506d-9617-4450-acd4-907200cfa0ed,landscape,5000,3337,a room with a glass door and a bedroom at Stadtvilla Schladming Boutiquehotel in Schladming,2019-07-14 14:11:19+01,2026-04-12 22:47:27.345205+01
d3988e6b-e5ea-4b1a-9645-a378f9bc4222,206904340,2c0e506d-9617-4450-acd4-907200cfa0ed,landscape,5000,3335,a view from a balcony of a town with a church at Stadtvilla Schladming Boutiquehotel in Schladming,2019-06-29 20:46:08+01,2026-04-12 22:47:27.347052+01
3f9764ce-9b01-4915-8569-835b693fa4be,209500133,2c0e506d-9617-4450-acd4-907200cfa0ed,landscape,5000,3335,a restaurant with tables and chairs and windows at Stadtvilla Schladming Boutiquehotel in Schladming,2019-07-14 13:25:45+01,2026-04-12 22:47:27.348657+01
94d4cedd-15db-434e-9da3-bc6eb5c3ed39,206904374,2c0e506d-9617-4450-acd4-907200cfa0ed,landscape,5000,3335,an apartment building with a balcony and a tree at Stadtvilla Schladming Boutiquehotel in Schladming,2019-06-29 20:46:17+01,2026-04-12 22:47:27.350241+01
22867f25-7a32-48ac-8696-bda25685e7d6,206904279,2c0e506d-9617-4450-acd4-907200cfa0ed,landscape,5000,3335,a hotel room with two beds and a flat screen tv at Stadtvilla Schladming Boutiquehotel in Schladming,2019-06-29 20:45:45+01,2026-04-12 22:47:27.351752+01
85bb9025-98a7-4164-8007-4bdfdb0b9795,209497805,2c0e506d-9617-4450-acd4-907200cfa0ed,landscape,5000,3335,a kitchen with a counter with plates and glasses at Stadtvilla Schladming Boutiquehotel in Schladming,2019-07-14 13:09:39+01,2026-04-12 22:47:27.353276+01
47ad266a-0e2c-4d1e-ac01-c3df28ebca65,236453184,2c0e506d-9617-4450-acd4-907200cfa0ed,landscape,5000,3335,a room with two sa showers in a wooden wall at Stadtvilla Schladming Boutiquehotel in Schladming,2020-01-01 12:40:48+00,2026-04-12 22:47:27.354815+01
c3dee520-86e0-483c-ac3c-52fb64439d3e,565172488,2c0e506d-9617-4450-acd4-907200cfa0ed,landscape,3500,2335,an apartment building with a balcony and a tree at Stadtvilla Schladming Boutiquehotel in Schladming,2024-06-03 15:45:03+01,2026-04-12 22:47:27.356475+01
2208237b-0d71-4964-9c0a-5a143500476e,209500154,2c0e506d-9617-4450-acd4-907200cfa0ed,landscape,5000,3335,a group of lights hanging from the ceiling at Stadtvilla Schladming Boutiquehotel in Schladming,2019-07-14 13:25:48+01,2026-04-12 22:47:27.358113+01
df660835-067c-4353-94fc-45c301257abc,209498431,2c0e506d-9617-4450-acd4-907200cfa0ed,landscape,5000,3335,a living room with a chair and a table and a fireplace at Stadtvilla Schladming Boutiquehotel in Schladming,2019-07-14 13:14:19+01,2026-04-12 22:47:27.359682+01
911bed5d-d4e8-4e43-915a-efd5ca0a8790,209497823,2c0e506d-9617-4450-acd4-907200cfa0ed,landscape,5000,3335,a large room with aasteryasteryasteryasteryasteryasteryasteryasteryasteryasteryastery at Stadtvilla Schladming Boutiquehotel in Schladming,2019-07-14 13:09:47+01,2026-04-12 22:47:27.361215+01
0e0e3d77-fa79-4660-98b3-8dd729169ab5,209505605,2c0e506d-9617-4450-acd4-907200cfa0ed,landscape,5000,3335,a hotel room with a view of a mountain at Stadtvilla Schladming Boutiquehotel in Schladming,2019-07-14 14:11:16+01,2026-04-12 22:47:27.362848+01
669fcc6a-1253-438b-86ec-145ff9da7736,236453178,2c0e506d-9617-4450-acd4-907200cfa0ed,landscape,5000,3335,a room with two bunk beds and a table at Stadtvilla Schladming Boutiquehotel in Schladming,2020-01-01 12:40:39+00,2026-04-12 22:47:27.364694+01
0bcd8aed-4aa4-42e9-af81-4afc3640946d,209500174,2c0e506d-9617-4450-acd4-907200cfa0ed,landscape,5000,3335,a dining room with a wooden table and chairs at Stadtvilla Schladming Boutiquehotel in Schladming,2019-07-14 13:25:53+01,2026-04-12 22:47:27.366308+01
dad69485-30d4-4ed5-a808-f752ddd1f2b7,209497817,2c0e506d-9617-4450-acd4-907200cfa0ed,landscape,5000,3335,a bar in a restaurant with a window at Stadtvilla Schladming Boutiquehotel in Schladming,2019-07-14 13:09:45+01,2026-04-12 22:47:27.367889+01
dd72f66b-de0a-4c56-bf5f-f7cb981ec715,209505625,2c0e506d-9617-4450-acd4-907200cfa0ed,landscape,5000,3337,a bathroom with a walk in shower and a sink at Stadtvilla Schladming Boutiquehotel in Schladming,2019-07-14 14:11:24+01,2026-04-12 22:47:27.36936+01
dac16d8e-6130-438d-8c8d-5708600913a7,236453180,2c0e506d-9617-4450-acd4-907200cfa0ed,landscape,5000,3335,a living room with two beds and a mirror at Stadtvilla Schladming Boutiquehotel in Schladming,2020-01-01 12:40:44+00,2026-04-12 22:47:27.37098+01
a77f39f6-7e2d-4d16-afa4-dcf836cd2273,209505603,2c0e506d-9617-4450-acd4-907200cfa0ed,landscape,5000,3335,a bedroom with two beds with white sheets and pillows at Stadtvilla Schladming Boutiquehotel in Schladming,2019-07-14 14:11:13+01,2026-04-12 22:47:27.372563+01
4786f6c9-5767-413b-a128-d5cd487610dc,209497795,2c0e506d-9617-4450-acd4-907200cfa0ed,landscape,5000,3335,a buffet line with many trays of fruits and vegetables at Stadtvilla Schladming Boutiquehotel in Schladming,2019-07-14 13:09:34+01,2026-04-12 22:47:27.374143+01
730f1f63-0a3e-48e3-ae5a-497579e8d456,209500182,2c0e506d-9617-4450-acd4-907200cfa0ed,landscape,5000,3335,a conference room with a table and chairs at Stadtvilla Schladming Boutiquehotel in Schladming,2019-07-14 13:25:55+01,2026-04-12 22:47:27.375679+01
ce6b3c00-dbcf-4738-a483-28691e7d07c6,236453189,2c0e506d-9617-4450-acd4-907200cfa0ed,landscape,5000,3337,a hallway with a pivot door in a house at Stadtvilla Schladming Boutiquehotel in Schladming,2020-01-01 12:40:55+00,2026-04-12 22:47:27.377151+01
e2918f1b-0f13-4bb7-a42d-23cc7e4b3b85,206904271,2c0e506d-9617-4450-acd4-907200cfa0ed,landscape,5000,3335,a bathroom with a sink and a shower at Stadtvilla Schladming Boutiquehotel in Schladming,2019-06-29 20:45:37+01,2026-04-12 22:47:27.378634+01
9c829634-5e32-41d0-8b97-6a2c2bfdb517,236453177,2c0e506d-9617-4450-acd4-907200cfa0ed,landscape,5000,3335,two beds in a room with wooden walls at Stadtvilla Schladming Boutiquehotel in Schladming,2020-01-01 12:40:38+00,2026-04-12 22:47:27.380622+01
c3037e58-0ce5-43a3-935d-bea67aa24a0e,209500191,2c0e506d-9617-4450-acd4-907200cfa0ed,landscape,5000,3335,a restaurant with wooden walls and tables and chairs at Stadtvilla Schladming Boutiquehotel in Schladming,2019-07-14 13:25:58+01,2026-04-12 22:47:27.382533+01
139389a4-cc50-4ca0-8093-cb3967cb3d49,236453192,2c0e506d-9617-4450-acd4-907200cfa0ed,landscape,5000,3337,a room with wooden benches and a large window at Stadtvilla Schladming Boutiquehotel in Schladming,2020-01-01 12:40:57+00,2026-04-12 22:47:27.384378+01
83f173ab-fb37-43ce-9715-645125a78913,236453165,2c0e506d-9617-4450-acd4-907200cfa0ed,landscape,5000,3335,a tray with two glasses of water and a drink at Stadtvilla Schladming Boutiquehotel in Schladming,2020-01-01 12:40:31+00,2026-04-12 22:47:27.385995+01
e17b9e17-a74e-4cc5-8aa7-b88bdb295123,209505607,2c0e506d-9617-4450-acd4-907200cfa0ed,landscape,5000,3337,a living room with a couch and a table at Stadtvilla Schladming Boutiquehotel in Schladming,2019-07-14 14:11:17+01,2026-04-12 22:47:27.387734+01
18d52f8d-0872-4294-b5af-871fb0ef5e2e,209497788,2c0e506d-9617-4450-acd4-907200cfa0ed,portrait,3335,5000,a display of jars of food with spoons in them at Stadtvilla Schladming Boutiquehotel in Schladming,2019-07-14 13:09:32+01,2026-04-12 22:47:27.38934+01
50bea5ed-bac8-4e3f-9c80-55b2d6c931d1,236453158,2c0e506d-9617-4450-acd4-907200cfa0ed,landscape,5000,3335,a bathroom with a sink and a bowl on a counter at Stadtvilla Schladming Boutiquehotel in Schladming,2020-01-01 12:40:27+00,2026-04-12 22:47:27.39092+01
7fc6c0c5-c397-4057-819b-87339bc4485f,209505622,2c0e506d-9617-4450-acd4-907200cfa0ed,landscape,5000,3335,a bathroom with a sink and a shower at Stadtvilla Schladming Boutiquehotel in Schladming,2019-07-14 14:11:22+01,2026-04-12 22:47:27.392448+01
1818b3d7-9006-46dc-925f-ca4a3db3041e,209500122,2c0e506d-9617-4450-acd4-907200cfa0ed,landscape,5000,3335,a restaurant with tables and chairs and windows at Stadtvilla Schladming Boutiquehotel in Schladming,2019-07-14 13:25:43+01,2026-04-12 22:47:27.393975+01
31b0cdc2-6e38-419b-8118-14b06ab5e522,209505630,2c0e506d-9617-4450-acd4-907200cfa0ed,landscape,5000,3337,a room with a bed and a desk with a television at Stadtvilla Schladming Boutiquehotel in Schladming,2019-07-14 14:11:26+01,2026-04-12 22:47:27.39553+01
92a7f31b-44ab-4778-bee0-4f3ec6a182e0,236453174,2c0e506d-9617-4450-acd4-907200cfa0ed,landscape,5000,3335,two beds in a room with wooden walls and windows at Stadtvilla Schladming Boutiquehotel in Schladming,2020-01-01 12:40:36+00,2026-04-12 22:47:27.397133+01
5417b717-b405-4969-bec2-e0062aec4839,565172480,2c0e506d-9617-4450-acd4-907200cfa0ed,landscape,3500,2335,a view from a balcony of a town with a church at Stadtvilla Schladming Boutiquehotel in Schladming,2024-06-03 15:45:02+01,2026-04-12 22:47:27.398661+01
ecbc914f-ffbd-4de3-9cfb-4415d62425c5,209500110,2c0e506d-9617-4450-acd4-907200cfa0ed,landscape,5000,3335,a dining room with a table and chairs at Stadtvilla Schladming Boutiquehotel in Schladming,2019-07-14 13:25:41+01,2026-04-12 22:47:27.400233+01
fe520c19-fb90-427e-ad52-9162aed4c473,206904266,2c0e506d-9617-4450-acd4-907200cfa0ed,,,,,,2026-04-12 22:47:27.40193+01
ff06c246-32d0-459e-bfa7-2650b8771460,565172315,2c0e506d-9617-4450-acd4-907200cfa0ed,,,,,,2026-04-12 22:47:27.403945+01
ac2ca83b-bac0-4b2e-8fc4-13181ef8e714,565172485,2c0e506d-9617-4450-acd4-907200cfa0ed,,,,,,2026-04-12 22:47:27.405673+01
dd431f6d-23f4-4233-9e73-39f2ae1e0594,565173949,2c0e506d-9617-4450-acd4-907200cfa0ed,,,,,,2026-04-12 22:47:27.407202+01
1949e4bf-0c6e-465e-98be-3d98e61f23c2,565175544,2c0e506d-9617-4450-acd4-907200cfa0ed,,,,,,2026-04-12 22:47:27.409031+01
b7ba2074-0b65-4551-a1ad-43aaad00c556,236453153,2c0e506d-9617-4450-acd4-907200cfa0ed,,,,,,2026-04-12 22:47:27.410801+01
d6402c5c-35ca-4f0a-b682-d186850870be,236453179,2c0e506d-9617-4450-acd4-907200cfa0ed,,,,,,2026-04-12 22:47:27.412725+01
8b30b37a-8f67-4399-8b1e-d09c5bc1ea04,206904411,2c0e506d-9617-4450-acd4-907200cfa0ed,,,,,,2026-04-12 22:47:27.414371+01
27ce9a14-1a81-4b0f-9d7d-4a552df40966,565172306,2c0e506d-9617-4450-acd4-907200cfa0ed,,,,,,2026-04-12 22:47:27.415966+01
c50d3efa-482c-41f2-92fd-9936fb9c532c,206904311,2c0e506d-9617-4450-acd4-907200cfa0ed,,,,,,2026-04-12 22:47:27.417938+01
13709896-d481-4418-ba5f-18a8d0c198a0,565168788,2c0e506d-9617-4450-acd4-907200cfa0ed,,,,,,2026-04-12 22:47:27.419645+01
d3e3b3e6-e7e7-49b5-b7c2-184f6ff8b32e,236453186,2c0e506d-9617-4450-acd4-907200cfa0ed,,,,,,2026-04-12 22:47:27.421309+01
e7a97685-f3fe-42a7-975d-a1071bca7786,565175550,2c0e506d-9617-4450-acd4-907200cfa0ed,,,,,,2026-04-12 22:47:27.422904+01
1ced9e68-a479-4e83-89ca-99121c66d9fb,565168803,2c0e506d-9617-4450-acd4-907200cfa0ed,,,,,,2026-04-12 22:47:27.424486+01
1268e82f-9ded-4128-8c13-52a03aa8f3ab,206904304,2c0e506d-9617-4450-acd4-907200cfa0ed,,,,,,2026-04-12 22:47:27.426005+01
fac9d348-36ef-4741-981e-e2791758aed1,206904402,2c0e506d-9617-4450-acd4-907200cfa0ed,,,,,,2026-04-12 22:47:27.42752+01
8b808b36-451f-4572-b436-8747e948ae99,206904352,2c0e506d-9617-4450-acd4-907200cfa0ed,,,,,,2026-04-12 22:47:27.429106+01
a3a2121f-40f3-49b2-acce-7a99b3626568,206904264,2c0e506d-9617-4450-acd4-907200cfa0ed,,,,,,2026-04-12 22:47:27.430706+01
1a583bae-4618-47f9-9bb7-0ded5b06cc22,565173614,2c0e506d-9617-4450-acd4-907200cfa0ed,,,,,,2026-04-12 22:47:27.43236+01
fbec4d74-8feb-4c07-8a2a-a5915f8bf10a,206904362,2c0e506d-9617-4450-acd4-907200cfa0ed,,,,,,2026-04-12 22:47:27.434225+01
b6cc21a1-7994-4412-9fd5-daffa437da11,565176030,2c0e506d-9617-4450-acd4-907200cfa0ed,,,,,,2026-04-12 22:47:27.436105+01
20d6da39-6b6b-46c3-af1f-e70bb733ec03,236453187,2c0e506d-9617-4450-acd4-907200cfa0ed,,,,,,2026-04-12 22:47:27.437851+01
c03b6c6c-c093-46a0-8a32-c941053d4351,565172310,2c0e506d-9617-4450-acd4-907200cfa0ed,,,,,,2026-04-12 22:47:27.439593+01
f84d9b2c-c3ab-49c1-a0ef-b193ef7a494c,206904274,2c0e506d-9617-4450-acd4-907200cfa0ed,,,,,,2026-04-12 22:47:27.441073+01
1aef3c0b-48a7-46f2-b816-1764cd8d3b07,565168777,2c0e506d-9617-4450-acd4-907200cfa0ed,,,,,,2026-04-12 22:47:27.442573+01
b03b52ce-0a9a-4aa4-91e2-3c81f7796914,206904270,2c0e506d-9617-4450-acd4-907200cfa0ed,,,,,,2026-04-12 22:47:27.444136+01
82cc43aa-9bd5-449f-89f7-21123a6eef96,206904282,2c0e506d-9617-4450-acd4-907200cfa0ed,,,,,,2026-04-12 22:47:27.445895+01
88895a81-05fa-4364-a10b-5f901a440907,206904285,2c0e506d-9617-4450-acd4-907200cfa0ed,,,,,,2026-04-12 22:47:27.447562+01
a7fbb440-835f-4d64-aa96-88c0a91400c9,206904299,2c0e506d-9617-4450-acd4-907200cfa0ed,,,,,,2026-04-12 22:47:27.449155+01
0284f350-e20f-496f-9f7a-4af7c8f78529,565168794,2c0e506d-9617-4450-acd4-907200cfa0ed,,,,,,2026-04-12 22:47:27.451112+01
1e065be6-5d0e-4c3e-ad96-e79f01b97dd2,206904320,2c0e506d-9617-4450-acd4-907200cfa0ed,,,,,,2026-04-12 22:47:27.453044+01
dcf00b26-b13f-4a4f-9481-05d257458456,209497829,2c0e506d-9617-4450-acd4-907200cfa0ed,,,,,,2026-04-12 22:47:27.4548+01
307d287b-ea2a-4ab7-a3f9-95aedf032ad2,565172472,2c0e506d-9617-4450-acd4-907200cfa0ed,,,,,,2026-04-12 22:47:27.456555+01
c25ded59-4810-4a42-815d-687111b5ac61,565172304,2c0e506d-9617-4450-acd4-907200cfa0ed,,,,,,2026-04-12 22:47:27.458344+01
6a929195-2c36-41ed-a642-878227261d67,206904272,2c0e506d-9617-4450-acd4-907200cfa0ed,,,,,,2026-04-12 22:47:27.460023+01
3f7718d5-3a50-4b03-a27b-0a1f6ee147eb,206904345,2c0e506d-9617-4450-acd4-907200cfa0ed,,,,,,2026-04-12 22:47:27.461702+01
57b99b54-6c5d-4afd-bfbf-b8568bbc3a2b,565168801,2c0e506d-9617-4450-acd4-907200cfa0ed,,,,,,2026-04-12 22:47:27.463437+01
09ca0d3f-cbcd-4732-8fc4-61de0a9188b4,206904292,2c0e506d-9617-4450-acd4-907200cfa0ed,,,,,,2026-04-12 22:47:27.465023+01
a2625184-b9e0-4379-88fa-0cdd275bdebd,206904284,2c0e506d-9617-4450-acd4-907200cfa0ed,,,,,,2026-04-12 22:47:27.466894+01
1817b664-b66e-46fe-911d-944f078e393e,565168791,2c0e506d-9617-4450-acd4-907200cfa0ed,,,,,,2026-04-12 22:47:27.468767+01
e9671664-add0-4069-82fa-0f3adcee6275,209497801,2c0e506d-9617-4450-acd4-907200cfa0ed,,,,,,2026-04-12 22:47:27.4704+01
cc4bfc2e-890c-4c88-bcde-4403a93aedee,209498437,2c0e506d-9617-4450-acd4-907200cfa0ed,,,,,,2026-04-12 22:47:27.471942+01
3bc233e6-a953-4d46-a24e-91387c6b449a,565168796,2c0e506d-9617-4450-acd4-907200cfa0ed,,,,,,2026-04-12 22:47:27.473591+01
fec7a266-9c7f-499e-b6da-992757dbd25f,565172320,2c0e506d-9617-4450-acd4-907200cfa0ed,,,,,,2026-04-12 22:47:27.475134+01
81b959b1-0c9e-4da2-bfe5-e3dba1933980,565172486,2c0e506d-9617-4450-acd4-907200cfa0ed,,,,,,2026-04-12 22:47:27.476677+01
4f2c6512-71cf-41dd-8249-4b92e1561c93,206904287,2c0e506d-9617-4450-acd4-907200cfa0ed,,,,,,2026-04-12 22:47:27.478353+01
62fdd822-cced-4812-ab19-d90c27b80d06,206904392,2c0e506d-9617-4450-acd4-907200cfa0ed,,,,,,2026-04-12 22:47:27.480622+01
376b0ef3-e1d0-4317-b93a-0221d1e76f81,565172317,2c0e506d-9617-4450-acd4-907200cfa0ed,,,,,,2026-04-12 22:47:27.482971+01
513d957e-875e-450b-9ac2-c155f886a4d7,206904409,2c0e506d-9617-4450-acd4-907200cfa0ed,,,,,,2026-04-12 22:47:27.484867+01
651fa840-c6f3-46d7-8c72-97f89e411f32,206904331,2c0e506d-9617-4450-acd4-907200cfa0ed,,,,,,2026-04-12 22:47:27.486597+01
01f641ce-1633-4b5d-8904-24c1668f60ab,206904396,2c0e506d-9617-4450-acd4-907200cfa0ed,,,,,,2026-04-12 22:47:27.488089+01
e5f1d88c-e20f-4a99-89f7-1389a1aa6696,565168773,2c0e506d-9617-4450-acd4-907200cfa0ed,,,,,,2026-04-12 22:47:27.489616+01
20f07df0-a6f9-4f88-842d-58e422406138,209497810,2c0e506d-9617-4450-acd4-907200cfa0ed,,,,,,2026-04-12 22:47:27.490925+01
