id,hotel_id,url_id,language,seo_description,keywords,created_at,updated_at
f078484d-9bc6-4985-8bc5-b06d448936a8,296fe965-919f-44d9-9dc9-9770b8bfe03d,d832cd69-7a7e-42b4-99d8-16113a905e21,it,"Il tradizionale Hotel Sacher sorge nel cuore di Vienna, di fronte al Teatro dell'Opera e proprio accanto alla Kärntner Straße, e dista solo 2 minuti a piedi dallo svincolo dei trasporti di Karlsplatz, che offre collegamenti con tutte le zone di Vienna.
I ristoranti Rote Bar e Grüne Bar servono piatti della cucina internazionale e tradizionale viennese, e il Blaue Bar è un noto luogo d'incontro.",,2026-06-02 00:34:28.737545+01,2026-06-02 00:34:28.737545+01
76143c25-07d3-41a5-a0c4-b937e943870c,ba6f782c-5c40-482c-bbac-99644edfe9c6,d832cd69-7a7e-42b4-99d8-16113a905e21,pt,"O tradicional Hotel Sacher está localizado no centro de Viena, em frente à Ópera Estatal e ao lado da Kärntner Straße (rua comercial).",,2026-06-02 00:36:12.287225+01,2026-06-02 00:36:12.287225+01
8c29fba5-6d5e-4b7e-b9e9-31aa3e2c7b34,7580dc4a-d080-49a6-b884-577f5e0ef7cb,39913540-8073-42e5-b229-faeff8fa9831,en,The 5 Star Superior Anantara Palais Hansen Vienna - A Leading Hotel of the World is located in the city center of Vienna and offers luxurious life style in a historic landmark building.,,2026-06-02 00:39:08.083093+01,2026-06-02 00:39:08.083093+01
ad1d602c-c616-44e0-9e3c-ad38ad17869f,54d2f88d-bc28-408e-bc2a-867f6ce37610,40faf329-7cff-4928-83c6-cd8e3aef2caa,es,"Rosewood Vienna está en Viena, a pocos pasos de Iglesia católica de San Pedro, y dispone de alojamiento con centro de fitness, parking privado, terraza y restaurante.",,2026-06-02 00:39:31.437549+01,2026-06-02 00:39:31.437549+01
6c27cf5f-aca0-45b5-ab1a-d752d717739f,cfeac3e6-2c82-4e67-92ba-4c12c9db10de,39913540-8073-42e5-b229-faeff8fa9831,de,Das 5-Sterne-Superior-Hotel Anantara Palais Hansen Vienna - A Leading Hotel of the World liegt im Stadtzentrum von Wien und bietet luxuriösen Lebensstil in einem historischen Wahrzeichengebäude.,,2026-06-02 00:41:33.673936+01,2026-06-02 00:41:33.673936+01
feb39460-1322-4b41-a1ea-f5f7269fc770,74f76285-58e3-4c51-a484-93e7a34943a0,40faf329-7cff-4928-83c6-cd8e3aef2caa,fr,"L’établissement Rosewood Vienna se situe à Vienne, à quelques pas de ce lieu d’intérêt : Église Saint-Pierre de Vienne.",,2026-06-02 00:43:18.995497+01,2026-06-02 00:43:18.995497+01
067f46fd-4ecb-4b55-96aa-adacb41240bc,c7df3986-1c5c-4524-9813-c41e2c264822,1ca78737-1301-4605-a40c-5aae576c0eec,en,"Located in Vienna and with House of Music reachable within 400 metres, Almanac Palais Vienna provides concierge services, allergy-free rooms, a restaurant, free WiFi throughout the property and a bar.",,2026-06-02 00:47:54.17018+01,2026-06-02 00:47:54.17018+01
faf88646-b5d7-43c9-b53c-86a5b90c67f2,5da5d445-6af2-4311-90f6-eee3be6dac2f,5a7dc8b9-d6ae-4707-b4ad-d549397a699e,de,Das Park Hyatt Vienna begrüßt Sie in einem ehemaligen Bankgebäude aus dem frühen 20.,,2026-06-02 00:49:49.160765+01,2026-06-02 00:49:49.160765+01
4a1fedbf-edaa-4d63-bf06-4bc5592b58d9,2a28fe34-f6cc-479e-a1f5-e27c144f27d6,1ca78737-1301-4605-a40c-5aae576c0eec,it,"Situato a Vienna e distante 400 metri da Casa della Musica, Almanac Palais Vienna prevede il servizio concierge, camere senza allergeni, un ristorante, il WiFi gratuito in tutta la struttura e un bar.",,2026-06-02 00:51:15.144856+01,2026-06-02 00:51:15.144856+01
9d06cccb-7a24-46de-bbd2-78ee1c29edfd,82178221-109f-45eb-9e55-16a2731ff316,5a7dc8b9-d6ae-4707-b4ad-d549397a699e,pt,"The Park Hyatt Vienna is located in the city centre's Golden Quarter, in a former bank building dating back to the early 1900s and combines luxury with Viennese elegance.",,2026-06-02 00:52:46.669698+01,2026-06-02 00:52:46.669698+01
fb903055-7005-49e2-bb5b-6c069624f2d6,f762f0e5-a168-40cc-a9b6-acdc539e00ad,69532e92-5eb0-456b-b84b-4d1d3b1bb34a,es,Palais Coburg is a 5-star luxury hotel in a historic building in the centre of Vienna.,,2026-06-02 00:55:59.809323+01,2026-06-02 00:55:59.809323+01
d3901bc4-e024-4c92-8e60-d006b2d004d8,0fb3a27e-e869-407b-811e-8c24f58be6e1,69532e92-5eb0-456b-b84b-4d1d3b1bb34a,it,Palais Coburg is a 5-star luxury hotel in a historic building in the centre of Vienna.,,2026-06-02 00:57:18.416771+01,2026-06-02 00:57:18.416771+01
371eb9b9-d71e-4b16-b872-c135ddb2c0bf,83882156-5b2c-4cd5-bb52-cdbe925b1ebf,6b790cad-596f-43de-b5bd-34e3d650741b,it,"The Amauris Vienna - Relais & Châteaux is an elegant and modern design hotel, situated right in the city centre on the famous Ringstraße boulevard, 200 metres from the State Opera.",,2026-06-02 00:58:46.085909+01,2026-06-02 00:58:46.085909+01
217bcec5-94ae-4a3b-a500-3639fef7ddc8,3375342a-3d55-4473-84e8-6cfd16fea28c,d832cd69-7a7e-42b4-99d8-16113a905e21,en,"The traditional Hotel Sacher is located in the heart of Vienna, opposite the State Opera and right next to the Kärntner Straße.",,2026-06-02 00:31:50.398948+01,2026-06-02 00:31:50.398948+01
7b6b9bd8-9f93-4fab-9f56-450715029b39,742a54e4-6c7b-4a17-8cf6-ef5fadb05e12,d832cd69-7a7e-42b4-99d8-16113a905e21,es,"El Hotel Sacher es de estilo tradicional y se encuentra en pleno centro de Viena, frente de la ópera estatal y justo al lado de la calle Kärntner.",,2026-06-02 00:32:58.334367+01,2026-06-02 00:32:58.334367+01
62530a9f-a878-4af2-9a17-1af4fb16d121,6a69eadf-7fcd-42b2-a7ea-5fb5231259ba,03fc6cbc-60a8-4748-91a6-901f33813497,it,"The luxurious, renowned 5-star Hotel Imperial is set directly on the Ringstraße boulevard in the heart of Vienna and takes you back to the times of the Austro-Hungarian Empire.",,2026-06-02 00:34:13.360085+01,2026-06-02 00:34:13.360085+01
887139b7-fe8e-4195-a2b4-1d38fbf39202,f251ccd1-9a54-4443-84d4-8040fafd5898,d832cd69-7a7e-42b4-99d8-16113a905e21,fr,"L’Hotel Sacher Wien est un établissement traditionnel situé en plain centre de Vienne, en face de l’opéra national et juste à côté de la rue commerçante Kärntner Straße.",,2026-06-02 00:35:36.158483+01,2026-06-02 00:35:36.158483+01
fe2929ac-9421-4e9e-badd-465576413328,71f4aefd-a4ea-427d-bf55-99682b579476,03fc6cbc-60a8-4748-91a6-901f33813497,pt,"The luxurious, renowned 5-star Hotel Imperial is set directly on the Ringstraße boulevard in the heart of Vienna and takes you back to the times of the Austro-Hungarian Empire.",,2026-06-02 00:36:28.090004+01,2026-06-02 00:36:28.090004+01
52721c40-1a21-45f8-934e-8c77d405c237,b33a4c63-8e34-4fdf-b98f-5552ead33581,40faf329-7cff-4928-83c6-cd8e3aef2caa,en,"Set in Vienna, a few steps from St.",,2026-06-02 00:38:03.524935+01,2026-06-02 00:38:03.524935+01
3ca119fc-d3a4-4bb4-8dd6-8d3458030165,94aba45b-a4b6-4977-9a5b-aee1b86a7931,39913540-8073-42e5-b229-faeff8fa9831,es,"El Anantara Palais Hansen Vienna - A Leading Hotel of the World, de 5 estrellas superior, está situado en el centro de Viena y ofrece una estancia de lujo en un edificio histórico.",,2026-06-02 00:40:31.663025+01,2026-06-02 00:40:31.663025+01
779e672e-7f49-4b04-9754-a3f956ba83cd,86c0cb0c-e1bb-4709-bcb5-a1e5df9ac493,40faf329-7cff-4928-83c6-cd8e3aef2caa,it,"Posizionato a Vienna, a 40 metri da Chiesa di San Pietro, Rosewood Vienna mette a disposizione un centro fitness, un parcheggio privato, una terrazza e un ristorante.",,2026-06-02 00:41:52.599605+01,2026-06-02 00:41:52.599605+01
61d9d10d-623b-465b-92c8-06760239b795,d88f4f30-a490-4ae1-8a36-b3058a672763,39913540-8073-42e5-b229-faeff8fa9831,fr,L’Anantara Palais Hansen Vienna - A Leading Hotel of the World se trouve dans le centre de Vienne.,,2026-06-02 00:43:45.506148+01,2026-06-02 00:43:45.506148+01
600eb9a2-a482-4360-a266-ae7daedec4e8,07486371-25d4-4750-a044-7142bf1d9500,39913540-8073-42e5-b229-faeff8fa9831,pt,The 5 Star Superior Anantara Palais Hansen Vienna - A Leading Hotel of the World is located in the city center of Vienna and offers luxurious life style in a historic landmark building.,,2026-06-02 00:45:12.883254+01,2026-06-02 00:45:12.883254+01
b74f3c05-7d14-403d-b656-fefa5d039dd2,f2a0b270-995c-456e-ac79-83acdd219466,5a7dc8b9-d6ae-4707-b4ad-d549397a699e,es,"El Park Hyatt Vienna se encuentra en el céntrico barrio de Goldenes Quartier, en el edificio de un antiguo banco de principios de la década de 1900, y combina el lujo con la elegancia vienesa.",,2026-06-02 00:48:38.866683+01,2026-06-02 00:48:38.866683+01
5535b767-59b2-4424-b8dc-104c49be8025,983ea4a8-87f5-408c-bf07-febb164597bd,1ca78737-1301-4605-a40c-5aae576c0eec,de,"Die Unterkunft Almanac Palais Vienna, die in Wien gelegen ist und von der aus Haus der Musik in weniger als 400 m erreichbar ist, bietet einen Conciergeservice, allergikerfreundliche Zimmer, ein Restaurant, kostenloses WLAN in der ganzen Unterkunft und eine Bar.",,2026-06-02 00:50:02.163098+01,2026-06-02 00:50:02.163098+01
3f8f3b4d-4b88-46b6-9820-ee20e9986683,3bc1bdc8-256f-4b65-81dd-5ad061fbc529,5a7dc8b9-d6ae-4707-b4ad-d549397a699e,fr,"Alliant le luxe à l’élégance viennoise, le Park Hyatt Vienna vous accueille dans le quartier Goldenes du centre-ville, dans une ancienne banque datant du début des années 1900.",,2026-06-02 00:51:53.097729+01,2026-06-02 00:51:53.097729+01
f2ceacb4-091f-4167-9188-ed3e7062bd53,0cd9406a-bfb9-4af5-9d58-39747758f930,6b790cad-596f-43de-b5bd-34e3d650741b,es,"The Amauris Vienna - Relais & Châteaux is an elegant and modern design hotel, situated right in the city centre on the famous Ringstraße boulevard, 200 metres from the State Opera.",,2026-06-02 00:57:01.502216+01,2026-06-02 00:57:01.502216+01
368be93e-c890-4c77-8c94-6b78771889f3,94f33927-f2cf-44f0-8188-9ba2d8f7c869,69532e92-5eb0-456b-b84b-4d1d3b1bb34a,fr,Palais Coburg is a 5-star luxury hotel in a historic building in the centre of Vienna.,,2026-06-02 00:58:24.065591+01,2026-06-02 00:58:24.065591+01
3b02da4b-6788-4718-8054-79d37f3bcd8d,01ced206-a90e-4d46-8332-a03e51719e56,69532e92-5eb0-456b-b84b-4d1d3b1bb34a,pt,Palais Coburg is a 5-star luxury hotel in a historic building in the centre of Vienna.,,2026-06-02 00:59:46.081469+01,2026-06-02 00:59:46.081469+01
f098d048-48ae-4b3c-a61e-de12a618741a,8f51b140-4ec4-4e06-ab75-041f1f33efca,19c8a801-4054-4a9e-94b4-6c8c8ab82b17,en,"Located a 5-minute walk from the centre of Graz, Ibis Budget Graz City offers family rooms and free WiFi in all areas.",,2026-06-02 01:01:58.626411+01,2026-06-02 01:01:58.626411+01
9bf52984-7766-4266-bcec-6ba4333dee06,ca69f6c2-284f-4877-b8c9-347e26aa9d7c,d8e0dcf3-f9e4-4b2e-af95-a50cc20a149b,en,"Located in Vienna, 500 metres from Museum of Military History, Hyatt Regency Vienna provides accommodation with a fitness centre, private parking, a terrace and a restaurant.",,2026-06-02 01:03:11.746162+01,2026-06-02 01:03:11.746162+01
63fc4c0f-2275-473f-ab2e-a33504140af2,d61a4534-ee5d-40f1-9964-04c41b16428f,19c8a801-4054-4a9e-94b4-6c8c8ab82b17,es,"Located a 5-minute walk from the centre of Graz, Ibis Budget Graz City offers family rooms and free WiFi in all areas.",,2026-06-02 01:03:25.570521+01,2026-06-02 01:03:25.570521+01
37ab3a67-803e-46dd-b375-5697490a5975,e806c73d-49f5-4282-ab9d-dad6d19536b1,19c8a801-4054-4a9e-94b4-6c8c8ab82b17,de,Das nur 5 Gehminuten vom Zentrum von Graz entfernte Ibis Budget Graz City bietet Ihnen Familienzimmer und kostenlos in allen Bereichen verfügbares WLAN.,,2026-06-02 01:04:30.458838+01,2026-06-02 01:04:30.458838+01
31e977e9-9396-4a93-bc73-b1d9f70fe172,c5ee1279-55fa-4be4-81be-57831dcf088b,d8e0dcf3-f9e4-4b2e-af95-a50cc20a149b,es,"Hyatt Regency Vienna se encuentra en Viena, a 6 min a pie de Museo de la Historia Militar, y ofrece alojamiento con centro de fitness, parking privado, terraza y restaurante.",,2026-06-02 01:04:54.857798+01,2026-06-02 01:04:54.857798+01
f7807660-58b7-445a-813d-f6773b019b84,073c88a1-ecb4-44de-9ebd-d6613b74d55d,19c8a801-4054-4a9e-94b4-6c8c8ab82b17,it,"Situato a 5 minuti a piedi dal centro di Graz, l'Ibis Budget Graz City offre camere familiari e la connessione WiFi gratuita in tutte le aree.",,2026-06-02 01:05:12.951032+01,2026-06-02 01:05:12.951032+01
549ea750-745d-4bff-af0b-869a5cc1dd75,d58e334d-43fa-4db5-b1cd-5b0df4c09b73,d8e0dcf3-f9e4-4b2e-af95-a50cc20a149b,de,"Die Unterkunft Hyatt Regency Vienna, die in Wien, 500 m von Heeresgeschichtliches Museum entfernt gelegen ist, verfügt über Übernachtungsmöglichkeiten mit einem Fitnesscenter, einem Privatparkplatz, einer Terrasse und einem Restaurant.",,2026-06-02 01:06:00.352812+01,2026-06-02 01:06:00.352812+01
20a28bae-037f-44b3-a2bb-535d87d536c4,40384dc0-d185-482f-9d93-3cc1827f021d,19c8a801-4054-4a9e-94b4-6c8c8ab82b17,fr,"Located a 5-minute walk from the centre of Graz, Ibis Budget Graz City offers family rooms and free WiFi in all areas.",,2026-06-02 01:06:14.216895+01,2026-06-02 01:06:14.216895+01
3d164a3c-deff-4b07-a859-f4d8bc2c5864,99b49c1e-d7af-47a1-ac5f-8039343156f2,19c8a801-4054-4a9e-94b4-6c8c8ab82b17,pt,"Located a 5-minute walk from the centre of Graz, Ibis Budget Graz City offers family rooms and free WiFi in all areas.",,2026-06-02 01:06:47.54078+01,2026-06-02 01:06:47.54078+01
71b308fa-ad77-48ee-86f5-d7e75b1c0fa3,e521a768-3b84-4563-acb2-dc7c8ee2bc85,d8e0dcf3-f9e4-4b2e-af95-a50cc20a149b,it,"Situato a Vienna, a 500 metri da Museo di Storia Militare, Hyatt Regency Vienna prevede un centro fitness, un parcheggio privato, una terrazza e un ristorante.",,2026-06-02 01:07:14.203064+01,2026-06-02 01:07:14.203064+01
840c0e7c-6089-449e-a9d1-bc5a056e3c3e,c39ceb77-df92-4e67-93e8-b9d19191ce08,d8e0dcf3-f9e4-4b2e-af95-a50cc20a149b,fr,"L’établissement Hyatt Regency Vienna se trouve à Vienne, à 500 mètres de ce lieu d’intérêt : Musée d'histoire militaire.",,2026-06-02 01:08:14.703013+01,2026-06-02 01:08:14.703013+01
115346cd-1e25-4c45-9067-ee23b400f7f4,6a0cf073-e7be-469b-8bfa-d7d3b0f8504b,d8e0dcf3-f9e4-4b2e-af95-a50cc20a149b,pt,"Hyatt Regency Vienna localiza-se em Viena, a 6 minutos a pé de Museu da História Militar, e fornece acomodações com um centro de fitness, estacionamento privado, um terraço e um restaurante.",,2026-06-02 01:09:14.163472+01,2026-06-02 01:09:14.163472+01
7b524b9d-ef58-40c8-956d-7f6167d1f762,9dcd3c65-89d8-46e1-bdf9-601ad982c590,11914a52-a984-4574-a8fb-43d2898bf718,en,"Hotel Mariahilf is located in a pedestrian street in the heart of Graz, facing the Schlossberg Mountain.",,2026-06-02 01:10:48.128776+01,2026-06-02 01:10:48.128776+01
5d6a680e-3e37-4c34-a2ea-ca2f432334f1,4ac67211-ebfe-42af-8909-0cd9d1e7f41b,3f4fd583-a4ff-444b-b9f2-4fe3ec3b909c,en,"Set 400 metres from Graz Central Station, IntercityHotel Graz offers 4-star accommodation in Graz and has a shared lounge, a terrace and a bar.",,2026-06-02 01:11:43.635864+01,2026-06-02 01:11:43.635864+01
80c86984-1a09-48e4-a7ac-c4fba84bb2d6,344192f2-cf1e-45e2-80ce-38a1c29f6aee,11914a52-a984-4574-a8fb-43d2898bf718,es,El Hotel Mariahilf se encuentra en una calle peatonal del centro de Graz y ofrece vistas al monte Schlossberg.,,2026-06-02 01:13:23.502118+01,2026-06-02 01:13:23.502118+01
876634d5-b15d-4f37-a783-48987e5044e4,fb4c6ea4-15be-42ea-985c-6a653ff53538,3f4fd583-a4ff-444b-b9f2-4fe3ec3b909c,es,"IntercityHotel Graz es un alojamiento de 4 estrellas que está en Graz, a 5 min a pie de Estación de tren Graz Central, y que tiene salón de uso común, terraza y bar.",,2026-06-02 01:13:46.514165+01,2026-06-02 01:13:46.514165+01
4ce0f713-25ea-4de9-a48a-0dfe3c22cb50,f8de155e-831c-44c0-8eeb-3d946f3d29b5,11914a52-a984-4574-a8fb-43d2898bf718,de,Das Hotel Mariahilf erwartet Sie in einer Fußgängerzone im Herzen von Graz und bietet Aussicht auf den Schlossberg.,,2026-06-02 01:14:02.297566+01,2026-06-02 01:14:02.297566+01
fd66132f-bbcd-4c38-8611-abecd6542258,fb60f81c-96a7-41a5-ad2a-484b802e0396,11914a52-a984-4574-a8fb-43d2898bf718,fr,"L'Hotel Mariahilf est situé le long d'une rue piétonne, en plein cœur de Graz, en face de la colline du Schloßberg.",,2026-06-02 01:15:14.196401+01,2026-06-02 01:15:14.196401+01
0c82d7c8-a417-4832-aaaa-ccbda3e881dc,97d5504a-ad39-45af-8f4d-e90698851cf8,6f1200ef-6b11-4280-9451-0615bee3b831,en,"The Palais-Hotel Erzherzog Johann is situated in the heart of the old town of Graz, in the immediate vicinity of the main square.",,2026-06-02 01:20:06.803356+01,2026-06-02 01:20:06.803356+01
6fade35d-428c-4a04-8152-8e6b127e3297,df1eb9b1-d627-494c-8ab9-85a143341a3d,4956889a-ddeb-458c-9fe2-8c89db1a5175,pt,"Com uma boa localização na área de Innere Stadt, em Graz, Motel One Graz localiza-se a 3 minutos a pé de Ópera de Graz, a 500 m de Carrilhão e a 4 minutos a pé de Parlamento Regional de Graz.",,2026-06-02 01:33:49.267338+01,2026-06-02 01:33:49.267338+01
032435e9-cf11-404e-83f5-7156c274844d,1f9f74c7-6499-4a4f-9e0f-68df155e1e14,8c33daff-a5a5-4af3-8b35-6c27b7d83b34,de,"Das Hotel Drei Raben begrüßt Sie im Zentrum von Graz, nur 8 Gehminuten vom Hauptbahnhof und einen 10-minütigen Spaziergang vom Kunsthaus und der Mur entfernt.",,2026-06-02 01:37:33.852956+01,2026-06-02 01:37:33.852956+01
ee708ddc-bb54-441d-aa72-3cfe873e1ef4,578ae552-954b-4ccc-9839-787ef7c0ece6,8c33daff-a5a5-4af3-8b35-6c27b7d83b34,fr,"Hotel Drei Raben is situated in the centre of Graz, an 8-minute walk from the Main Train Station and a 10-minute walk from the Kunsthaus and the Mur River.",,2026-06-02 01:39:00.199471+01,2026-06-02 01:39:00.199471+01
c1c0ef87-2b64-4712-92ff-55568bc728a9,41e7a4af-ea1e-4061-bb28-c8815a6438eb,0a53a5ad-3fb4-4fdd-a333-7863536ff7ed,en,This traditional hotel is only 3 minute-walk from Graz Main Train Station and a 10-minute walk from the Old Town.,,2026-06-02 01:43:09.482113+01,2026-06-02 01:43:09.482113+01
af7cdb72-3a59-41f7-8c3e-a3dc8c4f637d,59c47728-656c-4b8a-8e1c-cb7cc6983781,11914a52-a984-4574-a8fb-43d2898bf718,it,"Situato in una strada pedonale nel cuore di Graz, di fronte al monte Schlossberg e a pochi passi dal fiume Mura, dal Museo d'Arte di Graz e dal Centro Congressi, l'Hotel Mariahilf offre un abbondante colazione a buffet e il WiFi gratuito nell'intera struttura.
Provviste di bagno e TV, tutte le camere dell'hotel sono per non fumatori.
Durante il soggiorno all’Hotel Mariahilf godrete di tariffe scontate presso un parcheggio in garage situato nelle vicinanze, e potrete visitare la piazza principale di Graz, raggiungibile con una breve passeggiata che attraversa il fiume, oppure i numerosi negozi, ristoranti e bar del quartiere alla moda di Lend.",,2026-06-02 01:14:38.678696+01,2026-06-02 01:14:38.678696+01
b4936d7f-f97e-4caa-9691-419d1d47fcef,e4ec21aa-3d81-4782-9994-b64beb2a4a34,11914a52-a984-4574-a8fb-43d2898bf718,pt,"O Hotel Mariahilf está situado numa rua pedonal no coração de Graz, de frente para a Montanha Schlossberg e a uma curta distância a pé do Rio Mur, do Museu de Arte de Graz e do Centro de Congressos.",,2026-06-02 01:15:59.934464+01,2026-06-02 01:15:59.934464+01
5d306967-1ff8-496d-a626-7053e99ec87b,5d002c32-189b-4fdb-94aa-c40ea21f160d,97f417be-163f-46db-96ce-bf48f19fecb1,es,"The Mercure Graz City is ideally located just a few steps from Graz’s historic centre and only 400 meters from the Schlossberg, home to the city’s iconic clock tower.
Cultural highlights, including the Graz Opera House, the Kunsthaus Museum, and the Schauspielhaus Theatre, are all within a 15-minute walking distance.
Guests can relax and stay active in the hotel’s fitness and wellness area, or make use of the business corner in the lobby, which provides internet access for work-related needs.",,2026-06-02 01:29:00.615708+01,2026-06-02 01:29:00.615708+01
fb5474b3-c7e7-4378-8651-a3f646ab2a0e,8a4a15b4-9491-46ff-bcd4-818513050bda,4956889a-ddeb-458c-9fe2-8c89db1a5175,de,"Dieses Hotel – sehr gut gelegen im Bezirk Innere Stadt – befindet sich 300 m von Opernhaus Graz, 500 m von Glockenspiel und 300 m von Grazer Landhaus entfernt.",,2026-06-02 01:30:24.315232+01,2026-06-02 01:30:24.315232+01
7a20d153-cf54-48f7-b138-94f2cb9430db,50d006b4-e755-48b9-b18d-461f1ee8209b,4956889a-ddeb-458c-9fe2-8c89db1a5175,it,"In un’ottima zona nel quartiere Innere Stadt di Graz, Motel One Graz è situato a 300 metri da Opera di Graz, 500 metri da Carillon e 300 metri da Landhaus di Graz.",,2026-06-02 01:31:28.640063+01,2026-06-02 01:31:28.640063+01
328d568e-581a-4a4b-a11e-ef694a44df82,d5a85893-7628-4dfa-a7c1-b1169733ba0e,aecb480c-d2b8-446a-9915-6bc3a71cc17a,it,"Situato a Graz, a 3,8 km da Merkur Arena e 5,6 km da Casinò di Graz, SHOME Hotel Graz I Self-Check-In I Free Parking prevede un ristorante e il WiFi gratuito in tutta la struttura, oltre a un parcheggio privato gratuito per chi viaggia in auto.",,2026-06-02 01:40:22.457951+01,2026-06-02 01:40:22.457951+01
b6771a72-f48b-4f74-8994-0f11d097aef7,0a1550d8-dc78-4c3c-b32a-18647e0c19de,0a53a5ad-3fb4-4fdd-a333-7863536ff7ed,es,"Este hotel tradicional, situado a solo 3 minutos a pie de la estación de tren principal de Graz y a 10 minutos a pie del centro histórico, ofrece conexión WiFi gratuita y recepción las 24 horas.
El Hotel Strasser ofrece habitaciones luminosas con muebles modernos y baño moderno con artículos de aseo gratuitos.",,2026-06-02 01:44:41.415752+01,2026-06-02 01:44:41.415752+01
e1a925c7-6c9c-4cce-9417-a56088beb6dc,f65f7ffa-5de1-4737-b5a8-a1e69458ef7f,db8fa991-c455-48e5-b563-ed9e4a4c74e0,de,"Die Zur Steirerstub'n in Graz empfängt Sie am Lendplatz mit einem preisgekrönten Restaurant, das Ihnen traditionelle steirische und österreichische Gerichte serviert.",,2026-06-02 01:45:58.274705+01,2026-06-02 01:45:58.274705+01
e3b7fcab-5910-498f-aa91-b04f61cea483,1f181400-c889-4420-b2c8-3340b31121bc,3f4fd583-a4ff-444b-b9f2-4fe3ec3b909c,de,"Die Unterkunft IntercityHotel Graz mit 4 Sternen, die in Graz, 400 m von Hauptbahnhof Graz entfernt gelegen ist, bietet Übernachtungsmöglichkeiten in Graz und hat eine Gemeinschaftslounge, eine Terrasse und eine Bar.",,2026-06-02 01:14:59.023967+01,2026-06-02 01:14:59.023967+01
9e1b4b4d-3e47-4cd2-ac8c-78a98f6ea66e,cf3e0192-c802-4547-9a97-90db942aa8d5,3f4fd583-a4ff-444b-b9f2-4fe3ec3b909c,it,"Posizionato a 400 metri da Stazione di Graz Centrale, IntercityHotel Graz offre alloggi a 4 stelle a Graz e offre una sala comune, una terrazza e un bar.",,2026-06-02 01:16:20.374426+01,2026-06-02 01:16:20.374426+01
db1900d4-e6f5-4bba-b049-54f536e12d62,aeed15b1-2d6e-4aa6-a718-90e960db3dc6,a1f2eb45-8055-4796-a38d-e1c78cf0ff8c,en,Hotel B&B Graz-Hbf enjoys a central location only a 3-minute walk from Graz Main Train Station and a 10-minute walk from the Old Town and the Kunsthaus.,,2026-06-02 01:19:09.18077+01,2026-06-02 01:19:09.18077+01
e78c9233-9c26-4114-b0a7-328c840b2b3c,fd3d8602-6051-4a60-b1be-7680f7a3b7bb,a1f2eb45-8055-4796-a38d-e1c78cf0ff8c,de,"Das Hotel B&B Graz-Hbf empfängt Sie in zentraler Lage, nur 3 Gehminuten vom Grazer Hauptbahnhof sowie 10 Gehminuten von der Altstadt und dem Kunsthaus entfernt.",,2026-06-02 01:21:41.448543+01,2026-06-02 01:21:41.448543+01
8c5dfccd-810b-4917-988f-971fee221c58,39fe3759-0b20-4aba-bfd1-61d8c7620200,6f1200ef-6b11-4280-9451-0615bee3b831,it,"The Palais-Hotel Erzherzog Johann is situated in the heart of the old town of Graz, in the immediate vicinity of the main square.",,2026-06-02 01:23:11.72648+01,2026-06-02 01:23:11.72648+01
791a8d3f-9e46-4123-80d7-0265a3b56037,30fc2d39-654b-4fad-be93-21ae5f729f20,a1f2eb45-8055-4796-a38d-e1c78cf0ff8c,pt,Hotel B&B Graz-Hbf enjoys a central location only a 3-minute walk from Graz Main Train Station and a 10-minute walk from the Old Town and the Kunsthaus.,,2026-06-02 01:24:31.87983+01,2026-06-02 01:24:31.87983+01
1764da5e-5933-49e1-9879-e9cfeedd729e,e72768ef-de79-4844-ab7f-303d566f25c0,6f1200ef-6b11-4280-9451-0615bee3b831,pt,"The Palais-Hotel Erzherzog Johann is situated in the heart of the old town of Graz, in the immediate vicinity of the main square.",,2026-06-02 01:24:58.81245+01,2026-06-02 01:24:58.81245+01
7d9f843a-1ce8-4b62-b6c7-956d97a06cc3,2a299adb-7fd5-4706-a10c-b7f08c05e6fc,97f417be-163f-46db-96ce-bf48f19fecb1,de,"Das Mercure Graz City ist ideal gelegen, nur wenige Schritte vom historischen Zentrum von Graz und nur 400 Meter vom Schlossberg entfernt, wo sich der ikonische Uhrturm der Stadt befindet.
Kulturelle Höhepunkte wie die Grazer Oper, das Kunsthaus und das Schauspielhaus sind alle innerhalb von 15 Gehminuten erreichbar.
Sie können sich im Fitness- und Wellnessbereich des Hotels entspannen und aktiv bleiben oder die Business-Ecke in der Lobby nutzen, die Internetzugang für berufliche Zwecke bietet.",,2026-06-02 01:29:54.504147+01,2026-06-02 01:29:54.504147+01
fe5ba21c-0c45-45e5-893c-4bd0c25ded98,1255bd40-6e64-43d3-b8c3-7f525e503afd,97f417be-163f-46db-96ce-bf48f19fecb1,fr,"The Mercure Graz City is ideally located just a few steps from Graz’s historic centre and only 400 meters from the Schlossberg, home to the city’s iconic clock tower.
Cultural highlights, including the Graz Opera House, the Kunsthaus Museum, and the Schauspielhaus Theatre, are all within a 15-minute walking distance.
Guests can relax and stay active in the hotel’s fitness and wellness area, or make use of the business corner in the lobby, which provides internet access for work-related needs.",,2026-06-02 01:31:19.532488+01,2026-06-02 01:31:19.532488+01
3348c953-049f-4666-b5a4-a182a6391dc4,3f66eb38-abf1-4ded-9a04-56621a99f1bf,4956889a-ddeb-458c-9fe2-8c89db1a5175,fr,"L’établissement Motel One Graz se trouve dans le centre de Graz, à respectivement 600 mètres et 300 mètres de ces lieux d’intérêt : Cathédrale Saint-Gilles et mausolée et Opéra de Graz.",,2026-06-02 01:32:37.106522+01,2026-06-02 01:32:37.106522+01
3b332204-2a34-46ed-9cd8-de5bd5c54964,47814751-e89a-48ef-b9b4-99fa582f22ed,aecb480c-d2b8-446a-9915-6bc3a71cc17a,en,"Located in Graz, within 3.8 km of Merkur Arena and 5.6 km of Casino Graz, SHOME Hotel Graz I Self-Check-In I Free Parking provides accommodation with a restaurant and free WiFi throughout the property as well as free private parking for guests who drive.",,2026-06-02 01:36:11.449736+01,2026-06-02 01:36:11.449736+01
