id,hotel_id,url_id,language,description,created_at,updated_at
16dedcb2-3231-485a-97b4-253faf4142e9,34353fc2-63f6-4e28-8ddc-bf522d4cf63d,0e24591d-0fe5-494c-8e95-b0134d92037a,en,"Comfortable Accommodations:Waldschlössl Gasthof in Sankt Lorenzen ob Murau offers family rooms with private bathrooms, hairdryers, showers, TVs, and private entrances. Each room includes a private bathroom, ensuring a pleasant stay.Exceptional Facilities:Guests can enjoy a sauna, sun terrace, restaurant, bar, and free WiFi. Additional amenities include a child-friendly buffet, bicycle parking, bike hire, tour desk, and luggage storage.Dining Experience:The family-friendly restaurant serves Austrian and Hungarian cuisine with vegetarian, gluten-free, and dairy-free options. Breakfast includes local specialities, warm dishes, fresh pastries, cheese, and juice.Activities and Location:Located 28 km from Krakautal, 7 km from KLH-Arena, and 41 km from Mauterndorf Castle. Winter sports are available nearby. Klagenfurt Airport is 88 km away.",2026-06-11 23:56:58.733893+01,2026-06-11 23:56:58.734892+01
f5ae7b3a-047d-45a0-a393-3170abb9d810,f6c9a8e1-b6fc-4f92-953e-949bc353faaf,f2e84f9e-d0ac-4913-ac08-b6af45e621cc,en,"Comfortable Accommodations:Hotel Auszeit St Lambrecht in Sankt Lambrecht offers family rooms with private bathrooms, balconies, and garden or mountain views. Each room includes a work desk, TV, and free WiFi.Wellness and Leisure:Guests can enjoy spa facilities, a swimming pool with a view, sauna, fitness centre, and indoor swimming pool. Additional amenities include a fitness centre, sun terrace, and games room.Dining Experience:The modern restaurant serves local and European cuisines with vegetarian, vegan, gluten-free, and dairy-free options. A buffet breakfast is provided daily.Location and Activities:Located 37 km from Krakautal and 69 km from Klagenfurt Airport, the hotel is ideal for winter sports enthusiasts. Nearby attractions include the Winter Sports Museum.",2026-06-11 23:58:14.677159+01,2026-06-11 23:58:14.677159+01
bcc3a490-e898-4f74-80da-1f6cf558d6e2,07be6bd3-53e4-4360-878f-d8e7a72831fc,0e24591d-0fe5-494c-8e95-b0134d92037a,es,"Waldschlössl Gasthof se encuentra en Sankt Lorenzen ob Murau, a 28 km de Krakautal, y ofrece alojamiento con terraza, parking privado gratis, restaurante y bar. El hotel está a unos 7,1 km de KLH-Arena y a 41 km de Mauterndorf Castle. El hotel dispone de sauna y servicio de conserjería.

Todas las unidades de este alojamiento están equipadas con TV de pantalla plana con canales por cable. Las habitaciones de este alojamiento disponen de wifi gratis y de baño privado con ducha y secador de pelo. En el hotel, todas las habitaciones cuentan con ropa de cama y toallas.

En Waldschlössl Gasthof se sirve un desayuno buffet.

La zona es ideal para practicar senderismo y esquí, y hay alquiler de bicicletas eneste hotel de 3 estrellas.

El aeropuerto (Aeropuerto de Klagenfurt) está a 88 km.",2026-06-11 23:58:44.736323+01,2026-06-11 23:58:44.737323+01
ed9cc3a9-997f-41e0-a0e6-0ceda9c3146e,423a4f2b-29c2-4657-a90f-4af68f469e7f,f2e84f9e-d0ac-4913-ac08-b6af45e621cc,es,"Hotel Auszeit St Lambrecht se encuentra en Sankt Lambrecht, a 37 km de Krakautal, y ofrece alojamiento con salón de uso común, parking privado, terraza y restaurante. Este alojamiento ofrece bar y guardaesquíes. El hotel libre de humo ofrece wifi gratis en todo el alojamiento.

En el hotel, todas las habitaciones tienen zona de estar, TV de pantalla plana con canales vía satélite, caja fuerte y baño privado con secador de pelo y albornoces. En Hotel Auszeit St Lambrecht, las habitaciones disponen de ropa de cama y toallas.

En el alojamiento se puede disfrutar de un desayuno buffet.

La clientela puede relajarse en el centro de spa y bienestar, que cuenta con piscina cubierta, centro de fitness y sauna, o en el jardín. Se puede jugar al ping-pong en este hotel de 4 estrellas, y la zona es ideal para practicar senderismo y esquí.

El aeropuerto (Aeropuerto de Klagenfurt) está a 69 km.",2026-06-11 23:58:55.737901+01,2026-06-11 23:58:55.737901+01
9f2144d7-e5c0-41de-8b70-98075502e9a0,0b2035aa-0531-4a56-9a8d-55bc7c78233a,0e24591d-0fe5-494c-8e95-b0134d92037a,de,"Die Unterkunft Waldschlössl Gasthof, die in Sankt Lorenzen ob Murau, 28 km von Krakautal entfernt gelegen ist, verfügt über Übernachtungsmöglichkeiten mit einer Terrasse, einem kostenlosen Privatparkplatz, einem Restaurant und einer Bar. Dieses Hotel bietet eine Sauna und einen Conciergeservice.

Die Zimmer in der Unterkunft Waldschlössl Gasthof sind ausgestattet mit einem Flachbild-TV mit Kabelkanälen. Es gibt ein eigenes Badezimmer mit einer Dusche und einem Haartrockner – Zimmer bieten den Gästen in der Unterkunft Waldschlössl Gasthof außerdem kostenloses WLAN. In der Unterkunft Waldschlössl Gasthof sind alle Zimmer ausgestattet mit Bettwäsche und Handtüchern.

Gäste der Unterkunft Waldschlössl Gasthof können ein als Buffet angebotenes Frühstück genießen.

Die Gegend ist beliebt zum Wandern und Skifahren. Ein Fahrradverleih ist an diesem Hotel mit 3-Sterne verfügbar.

KLH-Arena liegt 7,1 km von der Unterkunft Waldschlössl Gasthof entfernt, während Burg Mauterndorf 41 km entfernt ist. Der nächstgelegene Flughafen ist der Flughafen Klagenfurt, 88 km von der Unterkunft Waldschlössl Gasthof entfernt.",2026-06-11 23:59:09.515108+01,2026-06-11 23:59:09.515108+01
cde638b5-87d9-4f87-933d-d0d6a4affb77,9592f003-94d1-48f7-a5ad-0ccf6ca97e24,f2e84f9e-d0ac-4913-ac08-b6af45e621cc,de,"Die Unterkunft Hotel Auszeit St Lambrecht, die in Sankt Lambrecht, 37 km von Krakautal entfernt gelegen ist, verfügt über Übernachtungsmöglichkeiten mit einer Gemeinschaftslounge, einem Privatparkplatz, einer Terrasse und einem Restaurant. Zu den verschiedenen Einrichtungen dieser Unterkunft gehören eine Bar und ein Abstellraum für Skier. Gäste können das Spa- und Wellnesscenter mit einem Innenpool, einem Fitnessraum sowie einer Sauna und außerdem einen Garten nutzen.

Alle Wohneinheiten in der Unterkunft Hotel Auszeit St Lambrecht sind versehen mit einem Sitzbereich, einem Flachbild-TV mit Satellitenkanälen, einem Safe und einem eigenen Badezimmer mit einem Haartrockner und Bademänteln. Kostenloses WLAN ist verfügbar für alle Gäste, einige Zimmer sind ausgestattet mit einem Balkon. In der Unterkunft Hotel Auszeit St Lambrecht sind die Zimmer versehen mit Bettwäsche und Handtüchern.

Ein als Buffet angebotenes Frühstück wird in der Unterkunft Hotel Auszeit St Lambrecht angeboten.

Sie können an diesem Hotel mit 4 Sternen Tischtennis spielen. Die Gegend ist beliebt zum Wandern und Skifahren.

Der nächstgelegene Flughafen ist der Flughafen Klagenfurt, 69 km von der Unterkunft Hotel Auszeit St Lambrecht entfernt.",2026-06-11 23:59:40.020881+01,2026-06-11 23:59:40.021881+01
e69fcf30-fae8-44b4-b114-e9570384a12c,981fa675-1484-4b7d-89fe-0778c7d7d29a,0e24591d-0fe5-494c-8e95-b0134d92037a,it,"Situato a Sankt Lorenzen ob Murau, a 28 km da Krakautal, Waldschlössl Gasthof prevede una terrazza, un parcheggio privato gratuito, un ristorante e un bar. Questo hotel mette a disposizione una sauna e un servizio concierge.

Le camere presso questo hotel dispongono di una TV a schermo piatto con canali via cavo. Dotate di un bagno privato con doccia e asciugacapelli, le camere di Waldschlössl Gasthof comprendono anche il WiFi gratuito. Presso questa struttura, tutte le camere dispongono di lenzuola e asciugamani.

Waldschlössl Gasthof offre una colazione a buffet.

La zona è famosa per attività quali l’escursionismo e lo sci, mentre presso questo hotel a 3 stelle è disponibile un servizio di noleggio biciclette.

KLH-Arena è a 7,1 km da questo hotel, mentre Mauterndorf Castle si trova a 41 km di distanza. Aeroporto di Klagenfurt si trova a 88 km dalla struttura.",2026-06-11 23:59:49.930113+01,2026-06-11 23:59:49.931113+01
ad592716-0361-41e1-8071-1ddf58a5c868,99c22752-aed2-4db0-ae38-661792460ac3,2b692ba3-8ded-4803-9190-c01c7ead06ba,pt,"Vidimo se localiza-se em Selzthal, a 23 km de Mosteiro de Admont, e fornece acomodações com um terraço, estacionamento privado gratuito e um restaurante. O alojamento está a cerca de 24 km de Castelo Trautenfels, a 33 km de Kulm e a 35 km de Monte Hochtor. Cada quarto está equipado com uma televisão de ecrã plano com canais por satélite.

O acesso Wi-Fi gratuito é providenciado a todos os hóspedes, enquanto alguns quartos estão equipados com varanda. As acomodações providenciam roupa de cama e toalhas.

Der Wilde Berg - Wildpark Mautern fica a 45 km de vidimo se. O Aeroporto de Linz fica a 105 km de distância.",2026-06-12 00:30:10.367467+01,2026-06-12 00:30:10.367467+01
270d1561-9395-4906-867c-c08d88ed4bcd,f35eb709-d2d1-4cde-a366-1813f33d7e35,f2e84f9e-d0ac-4913-ac08-b6af45e621cc,it,"Posizionato a Sankt Lambrecht, a 37 km da Krakautal, Hotel Auszeit St Lambrecht mette a disposizione una sala comune, un parcheggio privato, una terrazza e un ristorante. I vari servizi di questa struttura includono un bar e un deposito sci. Certe unità della struttura presentano un balcone con vista città.

Presso questo hotel, le camere comprendono un’area salotto, una TV a schermo piatto con canali satellitari, la cassaforte e un bagno privato con asciugacapelli e accappatoi. Presso Hotel Auszeit St Lambrecht, le camere sono dotate di lenzuola e asciugamani.

Presso questa struttura potrete gustare una colazione a buffet.

Potrete rilassarvi nell’area benessere che include una piscina coperta, una sala fitness e una sauna, oppure in giardino. Potrete giocare a ping pong presso questo hotel a 4 stelle, mentre la zona è famosa per attività quali l’escursionismo e lo sci.

Aeroporto di Klagenfurt si trova a 69 km di distanza.",2026-06-12 00:01:27.330007+01,2026-06-12 00:01:27.331003+01
3f127bd2-c187-4e4e-9f70-19e89c6f5866,2b5c5ebf-53d1-4b6b-9175-4c95c9c08922,0e24591d-0fe5-494c-8e95-b0134d92037a,fr,"L’établissement Waldschlössl Gasthof se trouve à Sankt Lorenzen ob Murau, à 28 km de ce lieu d’intérêt : Krakautal. Il propose une terrasse, un restaurant, un bar et un parking privé gratuit. Cet hôtel est à respectivement 7,1 km et 41 km environ de : KLH-Arena et Mauterndorf Castle. Cet hôtel possède un sauna et un service de concierge.

Les hébergements disposent d’une télévision à écran plat avec les chaînes du câble. Les hébergements sont pourvus d’une salle de bains privative dotée d’une douche et d'un sèche-cheveux. Ils comportent également une connexion Wi-Fi gratuite. Des serviettes et du linge de lit sont fournis.

Un petit-déjeuner buffet est servi sur place.

La région est prisée des amateurs de randonnée et de ski, et cet hôtel 3 étoiles assure un service de location de vélos.

L'aéroport le plus proche (Aéroport de Klagenfurt) est à 88 km.",2026-06-12 00:01:45.722806+01,2026-06-12 00:01:45.722806+01
e9b97aa9-ee3f-4c41-b8ce-c4c8c0cc9771,0e5e6037-5231-47b7-8f94-6b276ecbb132,f2e84f9e-d0ac-4913-ac08-b6af45e621cc,fr,"L’établissement Hotel Auszeit St Lambrecht se situe à Sankt Lambrecht, à 37 km de ce lieu d’intérêt : Krakautal. Il possède un salon commun, une terrasse, un restaurant et un parking privé. De nombreuses installations sont proposées sur place, notamment un bar et un local à skis. Certains hébergements sont dotés d’un balcon offrant une vue sur la ville.

Tous les hébergements proposent un coin salon, une télévision à écran plat avec les chaînes du satellite, un coffre-fort ainsi qu’une salle de bains privative avec un sèche-cheveux et des peignoirs. Des serviettes et du linge de lit sont fournis.

Un petit-déjeuner buffet est servi sur place.

Vous pourrez vous détendre dans le jardin ou dans l’espace bien-être contenant une piscine intérieure, une salle de sport et un sauna. Vous pourrez jouer au ping-pong dans cet hôtel 4 étoiles, et la région est prisée des amateurs de randonnée et de ski.

L'aéroport le plus proche (Aéroport de Klagenfurt) est à 69 km.",2026-06-12 00:01:49.328038+01,2026-06-12 00:01:49.329041+01
2ba7cea9-5775-4fc1-99e0-df1986619a3d,3b7bb318-d78c-48fa-be60-18e1cb65d18d,18bcdc98-74a0-4f39-818b-104cbe5c8969,en,"Comfortable Accommodations:Wild & Bolz eMotel in Trieben offers rooms with private bathrooms, mountain views, and parquet floors. Each room includes a work desk, seating area, TV, and wardrobe.Modern Facilities:Guests enjoy free WiFi, a lounge, lift, and electric vehicle charging station. Free on-site private parking is available.Convenient Location:Located 15 km from Admont Abbey, 26 km from Hochtor, and 108 km from Graz Airport. Nearby attractions include Der Wilde Berg and Trautenfels Castle.Guest Satisfaction:Highly rated for room cleanliness, convenient location, and room comfort.",2026-06-12 00:08:00.874627+01,2026-06-12 00:08:00.877343+01
7b3262e9-1839-4986-b432-736fe66a1d79,11de682d-5e8b-4273-8477-05e194269c57,a9465ec4-1896-4553-8a12-3961e2f6365e,en,"Comfortable Accommodation:Villa Dvor in Ohrid offers a guest house with a sun terrace, garden, and free WiFi. Guests enjoy private bathrooms with walk-in showers, air-conditioning, and soundproofing.Convenient Facilities:The property features a shared kitchen, coffee shop, outdoor seating area, and express check-in and check-out services. Additional amenities include a work desk, wardrobe, and free toiletries.Local Attractions:Saraiste Beach is a 4-minute walk away, Port Ohrid 700 metres nearby, and the Early Christian Basilica a 6-minute walk. Other points of interest include the Church of St. John at Kaneo and the Upper Gate.Activities:Guests can enjoy fishing, hiking, and cycling. The Ohrid airport is 9 km from the property.",2026-06-12 00:09:07.583697+01,2026-06-12 00:09:07.583697+01
faa6c8f3-d077-4874-9597-c418a68517fd,a2cc9aa1-a888-493b-83c5-308d40c10724,18bcdc98-74a0-4f39-818b-104cbe5c8969,es,"Wild & bolz eMotel se encuentra en Trieben, a 15 km de Abadía de Admont y a 26 km de Hochtor. Ofrece alojamiento con salón de uso común y wifi gratis en todo el alojamiento, además de parking privado gratis. El hotel está a unos 38 km de Castillo de Trautenfels y a 47 km de Kulm. Este alojamiento libre de humo está a 31 km de Der Wilde Berg - Wildpark Mautern.

En el hotel, todas las habitaciones disponen de escritorio, TV de pantalla plana, baño privado, ropa de cama y toallas. Todas las unidades disponen de armario.

El aeropuerto (Aeropuerto de Graz) está a 108 km.",2026-06-12 00:09:24.775673+01,2026-06-12 00:09:24.776675+01
17fb2a31-2fa6-426e-a0bc-14d49c165b0c,dcf98a59-8ca0-4071-89f5-d53600684df0,a9465ec4-1896-4553-8a12-3961e2f6365e,es,"Villa Dvor, que tiene jardín, ofrece habitaciones en Ohrid, a 4 min a pie de Playa de Saraiste y a 700 metros de Puerto de Ohrid. Este alojamiento, que cuenta con cocina compartida, también ofrece terraza solárium. Este alojamiento hipoalergénico se encuentra a 6 min a pie de Basílica Paleocristiana.

En el hostal o pensión, todas las habitaciones están equipadas con escritorio. Las habitaciones del alojamiento tienen wifi gratis y baño privado con ducha y artículos de aseo gratuitos. Algunas de las habitaciones tienen patio. En Villa Dvor, cada habitación incluye ropa de cama y toallas.

La clientela puede practicar actividades en Ohrid y alrededores, como senderismo, pesca y ciclismo.

Cerca del alojamiento hay puntos de interés como Church of St. John at Kaneo, Upper Gate y Icons Gallery. El aeropuerto (Aeropuerto de Ohrid) está a 9 km.",2026-06-12 00:09:47.872356+01,2026-06-12 00:09:47.872356+01
f55fb671-7f11-4d3d-924b-60a936de1ff6,ad2dd78e-ef00-4700-a368-5ff26a215390,18bcdc98-74a0-4f39-818b-104cbe5c8969,de,"Weniger als 15 km von Stift Admont und 26 km von Hochtor entfernt in Trieben gelegen, bietet die Unterkunft wild & bolz eMotel Übernachtungsmöglichkeiten mit einer Gemeinschaftslounge, kostenloses WLAN in der ganzen Unterkunft und einem kostenlosen Privatparkplatz für Gäste, die mit dem Auto anreisen. Die Nichtraucher Unterkunft ist 31 km von Der Wilde Berg - Wildpark Mautern entfernt gelegen.

In der Unterkunft wild & bolz eMotel sind die Zimmer versehen mit einem Schreibtisch, einem Flachbild-TV, einem eigenen Badezimmer, Bettwäsche und Handtüchern. Alle Wohneinheiten verfügen über einen Kleiderschrank.

Schloss Trautenfels liegt 38 km von der Unterkunft wild & bolz eMotel entfernt, während Der Kulm 47 km entfernt ist. Der nächstgelegene Flughafen ist der Flughafen Graz, 108 km von der Unterkunft wild & bolz eMotel entfernt.",2026-06-12 00:09:58.066062+01,2026-06-12 00:09:58.066062+01
1c87790c-b2b5-4ac2-a586-20abed772840,c36e7a78-7d0e-4a3c-b2f9-596b7a621d2a,a9465ec4-1896-4553-8a12-3961e2f6365e,de,"Weniger als 300 m von Strand Saraiste und 700 m von Hafen von Ohrid entfernt in Ohrid gelegen, bietet die Unterkunft Villa Dvor Übernachtungsmöglichkeiten mit einem Garten. Diese Unterkunft verfügt über eine Gemeinschaftsküche und bietet Gästen außerdem eine Sonnenterrasse. Die allergikerfreundliche Unterkunft ist 500 m von Plaošnik entfernt gelegen.

In der Unterkunft Villa Dvor sind alle Zimmer ausgestattet mit einem Schreibtisch. Neben einem eigenen Badezimmer ausgestattet mit einer Dusche und kostenlosen Pflegeprodukten bieten die Zimmer in der Unterkunft Villa Dvor außerdem kostenloses WLAN – ausgewählte Zimmer sind ausgestattet mit einer Veranda / Patio. In der Unterkunft Villa Dvor sind alle Zimmer versehen mit Bettwäsche und Handtüchern.

Die Gäste in der Unterkunft Villa Dvor können Aktivitäten in und um Ohrid wie Wandern, Angeln und Fahrradfahren genießen.

In der Nähe der Unterkunft Villa Dvor finden Sie die interessanten Orte Church of St. John at Kaneo, Upper Gate und Icons Gallery. Der nächstgelegene Flughafen ist der Flughafen Ohrid, 9 km von der Unterkunft Villa Dvor entfernt.",2026-06-12 00:10:39.864247+01,2026-06-12 00:10:39.864247+01
924b4bf5-b424-48ec-af0b-215faf0cbc91,81ef6942-b3ed-4434-b65a-f4e32708b187,18bcdc98-74a0-4f39-818b-104cbe5c8969,it,"Posizionato a Trieben, a 15 km da Abbazia di Admont e 26 km da Hochtor, wild & bolz eMotel mette a disposizione una sala comune e il WiFi gratuito in tutta la struttura, oltre a un parcheggio privato gratuito per chi viaggia in auto. A circa 38 km da Castello di Trautenfels, l'hotel è anche a 47 km di distanza da Kulm. L'alloggio è interamente non fumatori ed è ubicato a 31 km da Der Wilde Berg - Wildpark Mautern.

Presso questo hotel, le camere sono provviste di una scrivania, una TV a schermo piatto, un bagno privato, le lenzuola e gli asciugamani. Tutte le unità presentano un armadio.

Aeroporto di Graz - Thalerhof si trova a 108 km di distanza.",2026-06-12 00:10:49.105547+01,2026-06-12 00:10:49.106822+01
184fa8d4-54a8-4e0a-b270-593ae42b1184,31c61965-7954-45df-b317-f3f631147c42,18bcdc98-74a0-4f39-818b-104cbe5c8969,fr,"L’établissement wild & bolz eMotel se situe à Trieben, à respectivement 15 km et 26 km de ces lieux d’intérêt : Abbaye d'Admont et Hochtor. Il met à votre disposition un salon commun, un parking privé gratuit ainsi qu’une connexion Wi-Fi gratuite dans l’ensemble de ses locaux. Cet hôtel est à respectivement 38 km et 47 km environ de : Gare de Vienne-Meidling et Kulm. Cet établissement non-fumeurs vous accueille à 31 km de : Der Wilde Berg - Wildpark Mautern.

Tous les hébergements proposent un bureau, une télévision à écran plat, une salle de bains privative, du linge de lit et des serviettes. Vous profiterez aussi d’une armoire.

L'aéroport le plus proche (Aéroport de Graz) est à 108 km.",2026-06-12 00:11:26.791876+01,2026-06-12 00:11:26.791876+01
db68cc04-be91-4ff4-8e8c-6e16cdca475d,05a6d54d-8eba-4b30-87b7-9f93ea5393c3,a9465ec4-1896-4553-8a12-3961e2f6365e,it,"Con un giardino per gli ospiti, Villa Dvor offre camere a Ohrid a 300 metri da Spiaggia di Saraiste e 700 metri da Porto di Ocrida. Dotata di una cucina in comune, questa struttura offre ai propri ospiti anche una terrazza solarium. L'alloggio è interamente senza allergeni ed è situato a 500 metri da Complesso delle Basiliche Paleocristiane.

Presso questo affittacamere, tutte le camere sono dotate di una scrivania. Dotate di un bagno privato con doccia e set di cortesia, le camere di Villa Dvor offrono anche il WiFi gratuito, mentre alcune camere hanno un patio. Presso questa struttura, tutte le camere comprendono lenzuola e asciugamani.

Gli ospiti di Villa Dvor potranno svagarsi con varie attività a Ohrid e dintorni, come l’escursionismo, la pesca e il ciclismo.

I luoghi di interesse più famosi nei dintorni di questo affittacamere includono Church of St. John at Kaneo, Upper Gate e Icons Gallery. Aeroporto San Paolo Apostolo di Ocrida si trova a 9 km di distanza.",2026-06-12 00:11:37.716696+01,2026-06-12 00:11:37.717914+01
0eae0010-e771-4ab5-8c3c-dbd785551fc6,38c30c20-1f0b-4141-af70-b610f82fea57,18bcdc98-74a0-4f39-818b-104cbe5c8969,pt,"Wild & bolz eMotel situa-se em Trieben, a 15 km de Mosteiro de Admont e a 26 km de Monte Hochtor. O alojamento dispõe de acomodações com um salão partilhado e acesso Wi-Fi gratuito em toda a propriedade, assim como estacionamento privado gratuito. Este hotel está a cerca de 38 km de Castelo Trautenfels e a 47 km de Kulm. Este alojamento não fumador encontra-se a 31 km de Der Wilde Berg - Wildpark Mautern.

No alojamento, os quartos estão equipados com secretária, televisão de ecrã plano, casa de banho privativa, roupa de cama e toalhas. Todas as unidades apresentam roupeiro.

O Aeroporto de Graz fica a 108 km de distância.",2026-06-12 00:11:57.879044+01,2026-06-12 00:11:57.880043+01
39ed2f78-74da-4de9-b11f-d81d17a414cd,5a93f735-fcb6-407f-be71-f9b74216f1b8,a9465ec4-1896-4553-8a12-3961e2f6365e,fr,"Proposant un jardin, l’établissement Villa Dvor vous accueille à Ohrid, à respectivement 300 mètres et 700 mètres de ces lieux d’intérêt : Plage Saraiste et Port de plaisance d’Ohrid. Il comprend une cuisine commune et une terrasse bien exposée. Cet établissement pour les personnes souffrant d'allergies se trouve à 500 mètres de : Monastère Saint-Pantaleimon.

Tous les hébergements possèdent un bureau. Les hébergements disposent d’une connexion Wi-Fi gratuite ainsi que d’une salle de bains privative dotée d’une douche et d'articles de toilette gratuits. Certains possèdent également un patio. Des serviettes et du linge de lit sont fournis.

Lors de votre séjour, vous pourrez pratiquer diverses activités à Ohrid et dans les environs, telles que la randonnée, la pêche et le vélo.

Vous séjournerez à proximité de ces lieux d’intérêt : Church of St. John at Kaneo, Upper Gate et Icons Gallery. L'aéroport le plus proche (Aéroport Saint-Paul l'Apôtre d'Ohrid) est à 9 km.",2026-06-12 00:12:23.183845+01,2026-06-12 00:12:23.183845+01
ebb62d25-155c-4850-b3a5-a0866730697e,66685d08-0d73-4c69-a48d-bd5e198b7cc9,a9465ec4-1896-4553-8a12-3961e2f6365e,pt,"Apresentando um jardim, Villa Dvor disponibiliza quartos em Ohrid, a 4 minutos a pé de Praia Saraiste e 700 m de Porto Ohrid. Apresentando uma cozinha partilhada, este alojamento também dispõe de terraço para banhos de sol. Este alojamento antialérgico localiza-se a 6 minutos a pé de Basílica Paleocristã.

No alojamento, todos os quartos estão equipados com secretária. Apresentando uma casa de banho privativa com chuveiro e produtos de higiene pessoal gratuitos, os quartos do alojamento também disponibilizam acesso Wi-Fi gratuito, enquanto quartos selecionados têm pátio. No alojamento, todos os quartos incluem roupa de cama e toalhas.

Os hóspedes de Villa Dvor poderão desfrutar de atividades em Ohrid e arredores, como caminhadas, pesca e ciclismo.

Villa Dvor tem vários pontos de interesse populares nas suas proximidades, incluindo Church of St. John at Kaneo, Upper Gate e Icons Gallery. O Aeroporto de Ohrid fica a 9 km de distância.",2026-06-12 00:12:47.902124+01,2026-06-12 00:12:47.903124+01
b89aa940-2971-4ef3-bf88-d3f06039878d,e6d60c77-2b33-4b73-abbe-ad3aa89ca381,1a82dcb0-09f9-4374-8e39-bb4770378ed6,en,"The luxurious Hotel Ambassador is located on the Kärntner Straße shopping street in the centre of Vienna, just 200 metres from the Stephansplatz and Karlsplatz Underground Stations. It offers a restaurant and free WiFi.

Opened in 1898, the Ambassador Hotel has hosted famous guests such as Marlene Dietrich and Mark Twain. It is within a short walking distance from major sights such as St. Stephen’s Cathedral, the Hofburg Imperial Palace, and the State Opera.

Hotel Ambassador’s spacious and elegant rooms are individually decorated with select antiquities. They include adjustable air conditioning, satellite TV, a minibar, and a safe.

The restaurant serves Austrian cuisine and seasonal dishes. The winter garden overlooks the historic Neuer Markt square. The atrium bar serves cocktails, coffee and snacks. In summer, guests can relax in the open-air café on Kärntner Straße.

The Hofburg Congress and Event Centre is a 10-minute walk away.",2026-06-12 00:26:10.260321+01,2026-06-12 00:26:10.261321+01
