id,hotel_id,url_id,language,fp,created_at,updated_at
e1d62da1-083c-4d27-bb1d-8cc22f37a987,95b35b52-3ab9-4194-99ca-c3acb0003a49,2b426d00-13a4-4994-b76d-7779a8d932b1,fr,"<p>Veuillez noter que le Gästehaus Enzinger se trouve à 100 mètres du Landhotel Schönberghof.</p><p>Veuillez noter que le petit-déjeuner est servi dans le bâtiment principal (au Landhotel Schönberghof).</p><p>Veuillez informer l'établissement TAUROA Schönberghof Spielberg à l'avance de l'heure à laquelle vous prévoyez d'arriver. Vous pouvez indiquer cette information dans la rubrique « Demandes spéciales » lors de la réservation ou contacter directement l'établissement. Ses coordonnées figurent sur votre confirmation de réservation.</p><p>Dans le cadre de la pandémie de coronavirus (COVID-19), cet établissement applique actuellement des mesures sanitaires supplémentaires.</p><p>Il est possible que les services de restauration de cet établissement soient réduits ou indisponibles en raison de la pandémie de coronavirus (COVID-19).</p><p>Du fait de la pandémie de coronavirus (COVID-19), cet établissement a suspendu temporairement son service de navette.</p><p>En raison de la pandémie de coronavirus (COVID-19), cet établissement prend des mesures pour assurer la sécurité de ses clients et de son personnel. Certains services et équipements peuvent donc être réduits ou indisponibles.</p><p>En raison de la pandémie de coronavirus (COVID-19), cet établissement a réduit les horaires de sa réception et de ses services.</p><p>Le spa et la salle de sport de cet établissement sont actuellement fermés en raison de la pandémie de coronavirus (COVID-19).</p><p>En raison du coronavirus (COVID-19), cet établissement applique des mesures strictes en matière de distanciation physique.</p><p>Au vu des circonstances actuelles liées au coronavirus (COVID-19), veuillez vous assurer que cette réservation respecte les recommandations des autorités locales de votre destination. Celles-ci peuvent notamment porter sur le motif de votre voyage et la taille de votre groupe.</p><p>En raison du coronavirus (COVID-19), le port du masque est obligatoire dans toutes les parties communes situées à l'intérieur de l'établissement.</p><p>Vous ne pouvez pas effectuer votre quarantaine liée au coronavirus (COVID-19) dans cet établissement.</p>",2026-05-03 04:34:09.921147+01,2026-05-03 04:34:09.921147+01
617ed9d2-6c3d-49de-99db-5b3170c1c73a,2e088db5-4448-41ad-ba69-6e84bd5f33ec,c98c2cde-97f0-4784-bbc4-107516f66551,en,"<p>Please note that bed linen and towels are not included in the room rate. Guests can rent them at the property or bring their own.</p><p>Please inform Almwelt Austria in advance of your expected arrival time. You can use the Special Requests box when booking, or contact the property directly with the contact details provided in your confirmation.</p>",2026-05-03 04:37:02.728364+01,2026-05-03 04:37:02.728364+01
26d00283-e113-461a-9e19-e2f060c8d261,4478cdc2-e52f-4581-900e-b0d384159888,37223c6b-734f-492c-9216-4e908f28df8f,de,<p>Ein später Check-in ist gegen Aufpreis und nach vorheriger Bestätigung durch die Unterkunft möglich. Die Kontaktdaten entnehmen Sie Ihrer Buchungsbestätigung.</p><p>Beim Check-in müssen Sie einen Lichtbildausweis sowie eine Kreditkarte vorlegen. Sonderwünsche unterliegen der Verfügbarkeit und sind gegebenenfalls mit einem Aufpreis verbunden.</p><p>Bitte teilen Sie der Unterkunft Georgi Schloss - Boutique Hotel Ihre voraussichtliche Ankunftszeit im Voraus mit. Nutzen Sie hierfür bei der Buchung das Feld für besondere Anfragen oder kontaktieren Sie die Unterkunft direkt.</p><p>Wegen des Coronavirus (COVID-19) wurden in dieser Unterkunft zusätzliche Sicherheits- und Hygienemaßnahmen unternommen.</p>,2026-05-03 04:47:10.131208+01,2026-05-03 04:47:10.131208+01
2567dae1-2d02-4491-927b-6153bd2cffe4,2f30e235-e58a-46a3-a05e-88b4f02fc4e0,37223c6b-734f-492c-9216-4e908f28df8f,pt,"<p>Late check-in is possible for an additional charge upon prior confirmation by the property. Contact details are stated in the booking confirmation.</p><p>No momento do check-in, os hóspedes deverão apresentar um documento de identificação com fotografia e um cartão de crédito.  Por favor, observe que todos os Pedidos Especiais estão sujeitos à disponibilidade e que poderão acarretar custos adicionais.</p><p>Por favor, informe Georgi Schloss - Boutique Hotel antecipadamente sobre o seu horário de chegada. Para isso poderá utilizar a caixa de Pedidos Especiais durante o processo da reserva ou contactar a propriedade diretamente através dos dados para contacto providenciados na sua confirmação.</p><p>Em resposta ao Coronavírus (COVID-19), este alojamento está a tomar medidas de segurança e higienização adicionais.</p>",2026-05-03 04:52:00.677974+01,2026-05-03 04:52:00.677974+01
c3f8cd54-7f96-432d-9a19-a07e2a918050,44d156ee-f051-41ac-876c-4a031e0ef36e,2113865e-6c54-4b2b-bb46-dbcfa0f891c5,es,"<p>Informa a Suitehotel Kleinwalsertal con antelación de tu hora prevista de llegada. Para ello, puedes utilizar el apartado de peticiones especiales al hacer la reserva o ponerte en contacto directamente con el alojamiento. Los datos de contacto aparecen en la confirmación de la reserva.</p><p>En caso de salida anticipada, el alojamiento te cargará el importe total de la estancia.</p><p>Las bebidas no están incluidas en el régimen de media pensión.</p>",2026-05-03 05:24:37.78754+01,2026-05-03 05:24:37.78754+01
818768ff-efc0-4b52-aa0d-3a4fbed9ee56,2912413f-145a-4bc3-89a5-29fcc06ae0af,bbcdb7c2-681e-4c67-90c2-99f412f8f8d1,it,"<p>Please note that you cannot park your car in front of the hotel for check-in (Annenstraße 60). Instead, use the address Metahofgasse 21, 8020 Graz for check-in when arriving by car, or else head directly for the parking garage (subject to a surcharge) at Traungauergasse 15, 8020 Graz. You can get a parking ticket at the hotel reception.</p><p>The reception is open Monday-Saturday from 07:00 to 22:00. On Sunday/bankholidays from 07:00h-12:00h and 17:00h - 22:00h.</p><p>On the phone number stated on your booking confirmation, reception staff is available around the clock.</p><p>When booking more than 9 rooms, different policies and additional supplements may apply.</p><p>Guests are required to show a photo identification and debit card/credit card of the person stated on the booking confirmation upon check-in. Otherwise check-in is not possible.</p><p>If you arrive outside reception opening hours, you can check in at the modern self-check-in terminal. This requires a credit or debit card and the last name of the booker.</p><p>Please note that the amount of your reservation will be charged from your credit card on the day of arrival. This does not apply to non-refundable rates or if you choose your preferred alternative payment method during booking.</p><p>When booking more than 6 rooms, different policies and additional supplements may apply.</p><p>Siete pregati di comunicare in anticipo a B&amp;B Hotel Graz-Hbf l'orario in cui prevedete di arrivare. Potrete inserire questa informazione nella sezione Richieste Speciali al momento della prenotazione, o contattare la struttura utilizzando i recapiti riportati nella conferma della prenotazione.</p><p>In risposta al Coronavirus (COVID-19) questa struttura ha adottato misure extra di sicurezza e igiene.</p><p>I servizi di ristorazione e somministrazione di bevande in questa struttura potrebbero essere limitati o sospesi a causa del Coronavirus (COVID-19).</p><p>A causa del Coronavirus (COVID-19) questa struttura ha ridotto gli orari di servizio e reception.</p>",2026-05-03 04:33:40.503902+01,2026-05-03 04:33:40.503902+01
74462e2a-ebf0-4a24-bc91-44a12b563dd1,af31bd44-1318-42af-bc5b-60855eba7189,2b426d00-13a4-4994-b76d-7779a8d932b1,pt,"<p>Por favor, note que o Landhotel Schönberghof está situado a 100 metros do Gästehaus Enzinger.</p><p>Por favor, note que o pequeno-almoço é servido no edifício principal (Landhotel Schönberghof).</p><p>Por favor, informe TAUROA Schönberghof Spielberg antecipadamente sobre o seu horário de chegada. Para isso poderá utilizar a caixa de Pedidos Especiais durante o processo da reserva ou contactar a propriedade diretamente através dos dados para contacto providenciados na sua confirmação.</p><p>Em resposta ao Coronavírus (COVID-19), este alojamento está a tomar medidas de segurança e higienização adicionais.</p><p>Os serviços de comida e bebidas deste alojamento poderão estar limitados ou indisponíveis devido ao Coronavírus (COVID-19).</p><p>Por causa do Coronavírus (COVID-19), este alojamento suspendeu temporariamente o seu serviço de transfer.</p><p>Devido ao Coronavírus (COVID-19), este alojamento está a tomar precauções adicionais para proteger os seus hóspedes e funcionários. Consequentemente, alguns serviços e comodidades poderão estar reduzidos ou indisponíveis.</p><p>Devido ao Coronavírus (COVID-19), este alojamento reduziu o horário de funcionamento da receção e dos serviços.</p><p>As comodidades de spa e ginásio deste alojamento estão indisponíveis devido ao Coronavírus (COVID-19).</p><p>Devido ao Coronavírus (COVID-19), este alojamento segue medidas rigorosas de distanciamento físico.</p><p>Devido ao Coronavírus (COVID-19), por favor, garanta que está a reservar esta propriedade apenas se cumpre as diretrizes governamentais do destino, incluindo mas não se limitando ao propósito da viagem e ao tamanho máximo do grupo.</p><p>Devido ao Coronavírus (COVID-19), o uso de máscara é obrigatório em todas as áreas comuns interiores.</p><p>Não é possível ficar neste alojamento para fins de quarentena devido ao Coronavírus (COVID-19).</p>",2026-05-03 04:35:05.58153+01,2026-05-03 04:35:05.58153+01
f46e4299-1355-4908-a1a4-9bce765f9bde,0a4e1e2f-0865-4d3d-8ffe-6585918edd36,c98c2cde-97f0-4784-bbc4-107516f66551,es,"<p>La ropa de cama y las toallas no están incluidas en la tarifa. Los huéspedes podrán alquilarlas en el establecimiento o traer las suyas.</p><p>Informa a Almwelt Austria con antelación de tu hora prevista de llegada. Para ello, puedes utilizar el apartado de peticiones especiales al hacer la reserva o ponerte en contacto directamente con el alojamiento. Los datos de contacto aparecen en la confirmación de la reserva.</p>",2026-05-03 04:39:39.580202+01,2026-05-03 04:39:39.580202+01
78f98d83-9ab8-4fea-8360-6709b30a8c3a,a6dc058a-4a58-4342-adb0-096c43254971,c98c2cde-97f0-4784-bbc4-107516f66551,it,"<p>La tariffa non include la biancheria da letto e gli asciugamani, che potrete portare da casa o noleggiare in loco.</p><p>Siete pregati di comunicare in anticipo a Almwelt Austria l'orario in cui prevedete di arrivare. Potrete inserire questa informazione nella sezione Richieste Speciali al momento della prenotazione, o contattare la struttura utilizzando i recapiti riportati nella conferma della prenotazione.</p>",2026-05-03 04:41:15.730879+01,2026-05-03 04:41:15.730879+01
293a0e28-bd80-428e-805e-135bbaeb9b26,daef870d-bdcb-477c-a566-7d772780ac07,bc1653b3-6651-48a2-bb43-726592e83cbd,pt,"<p>Please note that the reception is open from Monday to Saturday from 07:00 to 22:30 and on Sundays from 07:00 to 22:00. If you expect to arrive outside reception opening hours, please inform the property in advance.</p><p>Following credit cards are accepted for payment: Visa, Mastercard and Diners.</p><p>If you arrive with children, please inform the property about their number and age. You can use the Special Requests box when booking or contact the property directly.</p><p>No momento do check-in, os hóspedes deverão apresentar um documento de identificação com fotografia e um cartão de crédito.  Por favor, observe que todos os Pedidos Especiais estão sujeitos à disponibilidade e que poderão acarretar custos adicionais.</p><p>Por favor, informe Hotel Süd Graz antecipadamente sobre o seu horário de chegada. Para isso poderá utilizar a caixa de Pedidos Especiais durante o processo da reserva ou contactar a propriedade diretamente através dos dados para contacto providenciados na sua confirmação.</p><p>Em resposta ao Coronavírus (COVID-19), este alojamento está a tomar medidas de segurança e higienização adicionais.</p>",2026-05-03 04:42:54.61607+01,2026-05-03 04:42:54.61607+01
fb542bce-5f6a-4453-8f50-45e1b280ad57,b966fb64-3e34-4f06-84ce-bf3136f12587,53d62bf7-cb27-4715-b082-d6d1f961efac,en,"<p>Please inform Hotel Kiwano Graz in advance of your expected arrival time. You can use the Special Requests box when booking, or contact the property directly with the contact details provided in your confirmation.</p><p>In response to Coronavirus (COVID-19), additional safety and sanitation measures are in effect at this property.</p><p>Food &amp; beverage services at this property may be limited or unavailable due to Coronavirus (COVID-19).</p><p>In accordance with government guidelines to minimise transmission of the Coronavirus (COVID-19), this property can only accept bookings from essential workers/permitted travellers, during dates where such guidelines exist. Reasonable evidence must be provided on arrival. If it isn't provided, your booking will be cancelled on arrival.</p><p>As a result of Coronavirus (COVID-19), this property has temporarily suspended its shuttle services.</p><p>Due to Coronavirus (COVID-19), this property is taking steps to help protect the safety of guests and staff. Certain services and amenities may be reduced or unavailable as a result.</p><p>In accordance with government guidelines to minimise transmission of the Coronavirus (COVID-19), this property may request additional documentation from guests to validate identity, travel itinerary and other relevant information, during dates where such guidelines exist.</p>",2026-05-03 05:22:59.684456+01,2026-05-03 05:22:59.684456+01
4d10361a-9fea-4956-b0e3-15f9cc85bbf2,04742bf3-e3ae-42a1-9e4a-f21cee04e8da,bbcdb7c2-681e-4c67-90c2-99f412f8f8d1,pt,"<p>Please note that you cannot park your car in front of the hotel for check-in (Annenstraße 60). Instead, use the address Metahofgasse 21, 8020 Graz for check-in when arriving by car, or else head directly for the parking garage (subject to a surcharge) at Traungauergasse 15, 8020 Graz. You can get a parking ticket at the hotel reception.</p><p>The reception is open Monday-Saturday from 07:00 to 22:00. On Sunday/bankholidays from 07:00h-12:00h and 17:00h - 22:00h.</p><p>On the phone number stated on your booking confirmation, reception staff is available around the clock.</p><p>When booking more than 9 rooms, different policies and additional supplements may apply.</p><p>Guests are required to show a photo identification and debit card/credit card of the person stated on the booking confirmation upon check-in. Otherwise check-in is not possible.</p><p>If you arrive outside reception opening hours, you can check in at the modern self-check-in terminal. This requires a credit or debit card and the last name of the booker.</p><p>Please note that the amount of your reservation will be charged from your credit card on the day of arrival. This does not apply to non-refundable rates or if you choose your preferred alternative payment method during booking.</p><p>When booking more than 6 rooms, different policies and additional supplements may apply.</p><p>Por favor, informe B&amp;B Hotel Graz-Hbf antecipadamente sobre o seu horário de chegada. Para isso poderá utilizar a caixa de Pedidos Especiais durante o processo da reserva ou contactar a propriedade diretamente através dos dados para contacto providenciados na sua confirmação.</p><p>Em resposta ao Coronavírus (COVID-19), este alojamento está a tomar medidas de segurança e higienização adicionais.</p><p>Os serviços de comida e bebidas deste alojamento poderão estar limitados ou indisponíveis devido ao Coronavírus (COVID-19).</p><p>Devido ao Coronavírus (COVID-19), este alojamento reduziu o horário de funcionamento da receção e dos serviços.</p>",2026-05-03 04:35:44.524997+01,2026-05-03 04:35:44.524997+01
b2c99196-0e87-475c-b02f-0a85e6403ae0,a521a831-ba39-4049-8ce5-6117e2181db7,c98c2cde-97f0-4784-bbc4-107516f66551,de,"<p>Bitte beachten Sie, dass Bettwäsche und Handtücher nicht im Zimmerpreis inbegriffen sind. Diese können Sie im Hotel mieten oder selbst mitbringen.</p><p>Bitte teilen Sie der Unterkunft Almwelt Austria Ihre voraussichtliche Ankunftszeit im Voraus mit. Nutzen Sie hierfür bei der Buchung das Feld für besondere Anfragen oder kontaktieren Sie die Unterkunft direkt.</p>",2026-05-03 04:40:27.283743+01,2026-05-03 04:40:27.283743+01
3c4eb411-7cd3-4333-93e6-0cf983ad88a3,895efc69-8d00-4a7c-a056-2a958d400e43,bc1653b3-6651-48a2-bb43-726592e83cbd,fr,"<p>Veuillez noter que la réception est ouverte du lundi au samedi de 7h00 à 22h30, et le dimanche de 7h00 à 22h00. Si vous prévoyez d’arriver en dehors des horaires d’ouverture de la réception, veuillez en informer l’établissement à l’avance.</p><p>Les cartes de crédit suivantes sont acceptées pour le paiement : Visa, Mastercard et Diners.</p><p>Si vous voyagez avec des enfants, veuillez communiquer à l’établissement leur nombre et leur âge. Vous pourrez l’indiquer dans la rubrique « Demandes spéciales » du formulaire de réservation ou contacter directement l’établissement.</p><p>Vous devrez présenter une pièce d'identité avec photo et une carte de crédit lors de l'enregistrement. Veuillez noter que toutes les demandes spéciales seront satisfaites sous réserve de disponibilité et pourront entraîner des frais supplémentaires.</p><p>Veuillez informer l'établissement Hotel Süd Graz à l'avance de l'heure à laquelle vous prévoyez d'arriver. Vous pouvez indiquer cette information dans la rubrique « Demandes spéciales » lors de la réservation ou contacter directement l'établissement. Ses coordonnées figurent sur votre confirmation de réservation.</p><p>Dans le cadre de la pandémie de coronavirus (COVID-19), cet établissement applique actuellement des mesures sanitaires supplémentaires.</p>",2026-05-03 04:41:58.70735+01,2026-05-03 04:41:58.70735+01
92c8f754-1a8b-42f5-8247-5b2f9c0d99d1,1a9b57a7-4cd5-4cab-ae1f-784478637633,bc1653b3-6651-48a2-bb43-726592e83cbd,de,"<p>Bitte beachten Sie, dass die Rezeption von Montag bis Samstag von 07:00 bis 22:30 Uhr und am Sonntag von 07:00 bis 22:00 Uhr geöffnet ist. Falls Sie außerhalb der Rezeptionszeiten anreisen, informieren Sie die Unterkunft bitte im Voraus.</p><p>Folgende Kreditkarten werden als Zahlungsmittel akzeptiert: Visa, Mastercard und Diners Club.</p><p>Wenn Sie mit Kindern anreisen, informieren Sie die Unterkunft bitte im Voraus über die Anzahl und das Alter der mitreisenden Kinder. Nutzen Sie hierfür bei der Buchung bitte das Feld für besondere Anfragen oder setzen Sie sich mit der Unterkunft direkt in Verbindung.</p><p>Beim Check-in müssen Sie einen Lichtbildausweis sowie eine Kreditkarte vorlegen. Sonderwünsche unterliegen der Verfügbarkeit und sind gegebenenfalls mit einem Aufpreis verbunden.</p><p>Bitte teilen Sie der Unterkunft Hotel Süd Graz Ihre voraussichtliche Ankunftszeit im Voraus mit. Nutzen Sie hierfür bei der Buchung das Feld für besondere Anfragen oder kontaktieren Sie die Unterkunft direkt.</p><p>Wegen des Coronavirus (COVID-19) wurden in dieser Unterkunft zusätzliche Sicherheits- und Hygienemaßnahmen unternommen.</p>",2026-05-03 04:39:21.932081+01,2026-05-03 04:39:21.932081+01
27ebcfb1-cfcf-4b0f-baeb-b46268cf7a64,10be5262-ab29-41ab-b232-c137fdabd137,bc1653b3-6651-48a2-bb43-726592e83cbd,it,"<p>Please note that the reception is open from Monday to Saturday from 07:00 to 22:30 and on Sundays from 07:00 to 22:00. If you expect to arrive outside reception opening hours, please inform the property in advance.</p><p>Following credit cards are accepted for payment: Visa, Mastercard and Diners.</p><p>If you arrive with children, please inform the property about their number and age. You can use the Special Requests box when booking or contact the property directly.</p><p>Al check-in gli ospiti devono esibire un documento d'identità con foto e una carta di credito. Siete pregati di notare che le Richieste Speciali sono soggette a disponibilità, e potrebbero comportare l'addebito di un supplemento.</p><p>Siete pregati di comunicare in anticipo a Hotel Süd Graz l'orario in cui prevedete di arrivare. Potrete inserire questa informazione nella sezione Richieste Speciali al momento della prenotazione, o contattare la struttura utilizzando i recapiti riportati nella conferma della prenotazione.</p><p>In risposta al Coronavirus (COVID-19) questa struttura ha adottato misure extra di sicurezza e igiene.</p>",2026-05-03 04:40:46.404015+01,2026-05-03 04:40:46.404015+01
ff0cbe06-f36d-40ec-9c4c-c602bb69b57d,ca147da6-c1ef-438a-a236-5bc79bf6cce1,c98c2cde-97f0-4784-bbc4-107516f66551,fr,<p>Veuillez noter que le linge de lit et les serviettes ne sont pas compris dans le tarif de la chambre. Vous pourrez en louer sur place ou apporter les vôtres.</p><p>Veuillez informer l'établissement Almwelt Austria à l'avance de l'heure à laquelle vous prévoyez d'arriver. Vous pouvez indiquer cette information dans la rubrique « Demandes spéciales » lors de la réservation ou contacter directement l'établissement. Ses coordonnées figurent sur votre confirmation de réservation.</p>,2026-05-03 04:42:32.596429+01,2026-05-03 04:42:32.596429+01
33ec04f6-81bc-4357-a390-5e1b39ee56d5,2999f525-6db8-444b-91a9-459b84ac280d,c98c2cde-97f0-4784-bbc4-107516f66551,pt,"<p>Please note that bed linen and towels are not included in the room rate. Guests can rent them at the property or bring their own.</p><p>Por favor, informe Almwelt Austria antecipadamente sobre o seu horário de chegada. Para isso poderá utilizar a caixa de Pedidos Especiais durante o processo da reserva ou contactar a propriedade diretamente através dos dados para contacto providenciados na sua confirmação.</p>",2026-05-03 04:43:44.845098+01,2026-05-03 04:43:44.845098+01
9f72086b-a57c-4d34-8f86-4776ea01e599,64e79d48-6726-481f-ba1a-bddf2bb5c552,37223c6b-734f-492c-9216-4e908f28df8f,en,"<p>Late check-in is possible for an additional charge upon prior confirmation by the property. Contact details are stated in the booking confirmation.</p><p>Guests are required to show a photo identification and credit card upon check-in. Please note that all Special Requests are subject to availability and additional charges may apply.</p><p>Please inform Georgi Schloss - Boutique Hotel in advance of your expected arrival time. You can use the Special Requests box when booking, or contact the property directly with the contact details provided in your confirmation.</p><p>In response to Coronavirus (COVID-19), additional safety and sanitation measures are in effect at this property.</p>",2026-05-03 04:44:37.992202+01,2026-05-03 04:44:37.992202+01
6dafd345-e294-48e4-8fd2-56b4512eab03,2d10352b-d8ee-4d71-8206-40882ac1a36f,37223c6b-734f-492c-9216-4e908f28df8f,it,"<p>Il check-in tardivo è possibile a un supplemento e previa conferma da parte della struttura. I recapiti sono riportati nella conferma della prenotazione.</p><p>Al check-in gli ospiti devono esibire un documento d'identità con foto e una carta di credito. Siete pregati di notare che le Richieste Speciali sono soggette a disponibilità, e potrebbero comportare l'addebito di un supplemento.</p><p>Siete pregati di comunicare in anticipo a Georgi Schloss - Boutique Hotel l'orario in cui prevedete di arrivare. Potrete inserire questa informazione nella sezione Richieste Speciali al momento della prenotazione, o contattare la struttura utilizzando i recapiti riportati nella conferma della prenotazione.</p><p>In risposta al Coronavirus (COVID-19) questa struttura ha adottato misure extra di sicurezza e igiene.</p>",2026-05-03 04:48:52.885371+01,2026-05-03 04:48:52.885371+01
3383f630-5a01-43d9-8521-df0f9b99d3aa,67231019-fb9f-478b-9ec6-cf6648297749,2113865e-6c54-4b2b-bb46-dbcfa0f891c5,pt,"<p>Por favor, informe Suitehotel Kleinwalsertal antecipadamente sobre o seu horário de chegada. Para isso poderá utilizar a caixa de Pedidos Especiais durante o processo da reserva ou contactar a propriedade diretamente através dos dados para contacto providenciados na sua confirmação.</p><p>Em caso de partida antecipada, a propriedade cobrará o valor total da sua estadia.</p><p>Se fizer uma reserva com regime de meia pensão, note que as bebidas não estão incluídas.</p>",2026-05-03 05:29:53.514826+01,2026-05-03 05:29:53.514826+01
10f02871-2b5d-4fb8-98ce-837545070316,fd8f759f-e3a3-4b15-bf7f-7d11bb8a69f2,eca35284-164a-4904-8d31-b934242ade30,en,<p>Please inform the property in advance if you will be arriving outside reception opening hours. You can then pick up your key from the key safe.</p>,2026-05-03 05:30:53.210272+01,2026-05-03 05:30:53.210272+01
16a18446-bf8e-46fc-9c3c-f530331e2939,bbdd8f34-9b93-4f48-bc44-a7220d497142,916b0469-6c29-4ac7-98dd-5d7ef31d4fd6,en,<p>Please note that the property is closed on Sundays and public holidays. The property will provide you with check-in instructions for these days after booking.</p>,2026-05-03 05:31:25.297672+01,2026-05-03 05:31:25.297672+01
0518872b-efe5-4ca0-ae61-35804af89339,aafffca1-5c27-4afc-bf1a-790a57535309,916b0469-6c29-4ac7-98dd-5d7ef31d4fd6,de,"<p>Bitte beachten Sie, dass die Unterkunft an Sonn- und Feiertagen geschlossen ist. Die Unterkunft wird Ihnen nach der Buchung Anweisungen für den Check-in an diesen Tagen zukommen lassen.</p>",2026-05-03 05:33:26.714058+01,2026-05-03 05:33:26.714058+01
