id,hotel_id,url_id,language,description,created_at,updated_at
3048d869-2eb0-4c49-b779-08b8a3a40f75,42415fa2-de21-4b6c-a2e3-6157b8aff0aa,12538fd2-838e-4667-98fd-b363854316fd,de,"Das luxuriöse und berühmte 5-Sterne-Hotel Imperial liegt direkt an der Ringstraße im Herzen von Wien und versetzt Sie zurück in die Zeit der österreichisch-ungarischen Monarchie. Es verfügt über exklusive Hotelzimmer und ein rund um die Uhr geöffnetes Fitnesscenter auf der Dachterrasse mit Sauna. Das Hotel wurde im Jahr 1873 von Kaiser Franz Joseph als Palais Württemberg eingeweiht.

Die Zimmer und Suiten des Hotel Imperial, a Luxury Collection Hotel, Vienna sind mit wertvollen Antiquitäten, Seidenwänden und historischen Elementen gestaltet und bieten moderne Annehmlichkeiten wie eine Klimaanlage, ein Soundsystem und einen besonders großen TV. Bademäntel und Hausschuhe liegen in den geräumigen Marmorbädern ebenfalls für Sie bereit. In den Suiten wird ein persönlicher Butlerservice angeboten.

Im Café Imperial können Sie einen klassischen Wiener Kaffee und Gebäck genießen, darunter die berühmte Imperialtorte. In der Imperial Bar werden eine große Auswahl an Cocktails und anderen Getränken sowie Live-Klaviermusik angeboten. 

Das Businesscenter in der Unterkunft umfasst moderne Tagungsräume und elegante Konferenzsalons mit hochmoderner Technologie. Der historische und sorgfältig restaurierte Festsaal und der Marmorsaal bieten einen idealen Ort für Veranstaltungen.

Das Konzerthaus des Wiener Musikvereins, in dem alljährlich das Neujahrskonzert der Wiener Philharmoniker stattfindet, befindet sich direkt hinter dem Hotel Imperial. Die U-Bahn-Station Karlsplatz, die Staatsoper und die Einkaufsstraße Kärntner Straße erreichen Sie nach einem 5-minütigen Spaziergang.",2026-06-12 01:19:54.438509+01,2026-06-12 01:19:54.439508+01
0c41c6ed-db69-4ccb-97c0-1f8f5b97cbf6,f167a499-7a4e-4448-a58a-9771c7bafb9f,24a962a6-d168-46cc-9bd8-8a4c33a23ca0,de,"Das traditionsreiche Hotel Sacher erwartet Sie mitten im Herzen von Wien, gegenüber der Staatsoper und direkt an der Kärntner Straße. Der Verkehrsknotenpunkt Karlsplatz mit Verbindungen in alle Teile von Wien befindet sich nur 2 Gehminuten entfernt.

Die Restaurants Rote Bar und Grüne Bar servieren internationale und traditionelle Wiener Küche. Die Blaue Bar ist ein beliebter Treffpunkt. Klassischer Wiener Kaffee und die originale Sacher-Torte sind im Café Sacher erhältlich.

Kaffee- und Teezubehör ist in jedem Zimmer vorhanden. Alle alkoholfreien Getränke aus der Minibar sind kostenfrei.

Das im Jahr 1876 eröffnete Hotel ist mit wertvollen Antiquitäten, eleganten Möbeln und einer berühmten Gemäldesammlung eingerichtet. Die individuell gestalteten Zimmer sind mit edelsten Materialien gestaltet.

Im Spa des Sacher entspannen Sie bei einer der zahlreichen Massagen, Wellness- und Schönheitsanwendungen.

Die Kärntner Straße ist die wichtigste Einkaufsstraße und Fußgängerzone im Zentrum von Wien. Die Ringstraße, das Albertina-Museum, der Stephansdom und die Hofburg mit ihrem Kongress- und Veranstaltungszentrum liegen nur 5 bis 10 Gehminuten vom Hotel Sacher Wien entfernt.",2026-06-12 01:20:36.367717+01,2026-06-12 01:20:36.36823+01
13ccdacb-79eb-4a40-ae13-eaaa87f2d74e,ce881096-8a55-440c-a853-77d35f457119,12538fd2-838e-4667-98fd-b363854316fd,it,"The luxurious, renowned 5-star Hotel Imperial is set directly on the Ringstraße boulevard in the heart of Vienna and takes you back to the times of the Austro-Hungarian Empire. It features exclusive hotel rooms and a 24-hour rooftop fitness centre with a sauna. It was inaugurated in 1873 by Emperor Francis Joseph as the Palais Württemberg.

Decorated with precious antiques, silk walls and historical details, the rooms and suites of Hotel Imperial, a Luxury Collection Hotel, Vienna offer modern comforts such as air conditioning, a sound system and an extra-large TV. Bathrobes and slippers are available in the spacious marble bathrooms. For guests of the suites, a personal butler service is available.

Guests can enjoy a classic Viennese coffee and pastries, including the famous Imperialtorte (cake), at Café Imperial. At the  Imperial Bar, a wide range of cocktails and other drinks, as well as live piano music, are offered. 

The on-site business centre comprises modern meeting rooms and elegant conference salons equipped with state-of-the-art technology.  The historic and carefully restored Festsaal and Marmorsaal are an ideal location for events.

The Musikverein (concert hall), site of the Vienna Philharmonic Orchestra’s New Year’s Concert, is right behind Hotel Imperial. Karlsplatz Underground Station, the State Opera, and the Kärntner Straße shopping street can be reached in a 5-minute walk.",2026-06-12 01:20:43.160926+01,2026-06-12 01:20:43.160926+01
75744755-57ee-4782-84be-af0e09b15729,c4a04fc5-76f1-4c16-b93a-c41b4c77acaf,b7af4e64-647f-4c00-9f02-05f77ace6593,pt,"The Palais-Hotel Erzherzog Johann is situated in the heart of the old town of Graz, in the immediate vicinity of the main square. Free Wi-Fi is provided.

This traditional family-run hotel offers easy access to all main sights of Graz, which are only steps away.

For drinks and refreshments you can be pampered in the popular cocktail bar ""Ernst Fuchs Bar"" which is also located in the hotel.

All the individually furnished rooms reflect the elegant atmosphere of the former baroque palace. A sauna with sun deck, a infrared cabin and a fitness room complete the range of facilities. No bicycle storage room available.",2026-06-12 02:02:28.15071+01,2026-06-12 02:02:28.15071+01
389f36d3-5ff0-4177-a6a6-0e3ae6276f0e,ca658200-8098-4741-9859-24e9636633f6,24a962a6-d168-46cc-9bd8-8a4c33a23ca0,it,"Il tradizionale Hotel Sacher sorge nel cuore di Vienna, di fronte al Teatro dell'Opera e proprio accanto alla Kärntner Straße, e dista solo 2 minuti a piedi dallo svincolo dei trasporti di Karlsplatz, che offre collegamenti con tutte le zone di Vienna.

I ristoranti Rote Bar e Grüne Bar servono piatti della cucina internazionale e tradizionale viennese, e il Blaue Bar è un noto luogo d'incontro. Il Café Sacher serve caffè classico viennese e l'originale Sacher-Torte.

Tutte le sistemazioni sono dotate di set per la preparazione di tè e caffè e tutte le bevande analcoliche del minibar sono gratuite.

Inaugurato nel 1876, l'Hotel Sacher Wien è arredato con preziosi pezzi d'antiquariato, mobili eleganti e una famosa collezione di dipinti, e le camere sono arredate individualmente con pezzi preziosi.

La Sacher Spa propone un’ampia gamma di massaggi e trattamenti benessere ed estetici.

La Kärntner Straße è la via dello shopping e la zona pedonale più importante del centro di Vienna. La Ringstraße, il Museo Albertina, la Cattedrale di Santo Stefano e il Palazzo Imperiale Hofburg con il suo centro congressi ed eventi distano solo 5-10 minuti a piedi dall'Hotel Sacher Wien.",2026-06-12 01:21:17.046575+01,2026-06-12 01:21:17.051197+01
76f470a6-e891-4558-9567-ddcf3db88aca,3e4a59c3-b812-46e8-9c90-458ba029691d,12538fd2-838e-4667-98fd-b363854316fd,fr,"Luxueux et jouissant d’une grande réputation, l’Hotel Imperial est un établissement 5 étoiles situé sur le Ring, au cœur de Vienne. Cet établissement, qui rappelle l’époque de l’Empire austro-hongrois, vous accueille dans un cadre parfaitement équipé. L’établissement propose des hébergements exclusifs et une salle de sport sur le toit ouverte 24h/24, qui comprend un sauna. L’hôtel a été inauguré en 1873 par l’empereur François-Joseph Ier. Il était alors connu sous le nom de palais Württemberg.

Ornées de précieuses antiquités, de revêtements muraux en soie et riches en détails historiques, les chambres et suites de l’hôtel offrent un confort moderne avec climatisation, enceinte et télévision à écran géant. Des peignoirs et des chaussons sont disponibles dans les grandes salles de bains en marbre. Pour les séjours en suite, un majordome personnel se tient à votre disposition.

Vous pourrez déguster un café viennois et des pâtisseries typiques de Vienne, notamment le célèbre Imperial torte au Café Imperial. L’Imperial Bar propose une large sélection de cocktails et de boissons à savourer en écoutant de la musique live au piano. 

Le centre d’affaires sur place comporte des salles de réunion modernes ainsi que des salles de conférence élégantes et ultramodernes. Le Festsaal et le Marmorsaal, 2 salles historiques soigneusement restaurées, se prêtent parfaitement à l’organisation de vos réceptions.

La salle de concert de Musikverein, qui accueille le concert du Nouvel An de l’orchestre philharmonique de Vienne, se situe juste derrière l’hôtel. La station de métro Karlsplatz, l’opéra d’État et la rue commerçante Kärntner Straße se trouvent à 5 minutes de marche.",2026-06-12 01:21:44.003373+01,2026-06-12 01:21:44.004374+01
91158fc2-eca0-43dc-847e-6bcd350179e7,59f423b9-10c5-49c0-988a-8eae8fd284d1,24a962a6-d168-46cc-9bd8-8a4c33a23ca0,fr,"L’Hotel Sacher Wien est un établissement traditionnel situé en plain centre de Vienne, en face de l’opéra national et juste à côté de la rue commerçante Kärntner Straße. Accessible en moins de 5 minutes à pied, la place Karlsplatz est desservie par de nombreux transports en commun vous permettant de rejoindre tous les quartiers de Vienne.

Les restaurants Rote Bar et Grüne Bar vous serviront une cuisine viennoise traditionnelle et internationale. Le bar Blaue est un lieu de rencontre populaire. Le Café Sacher vous proposera un café viennois classique ainsi qu’une véritable Sachertorte, préparée selon la recette originale.

Chaque chambre dispose d’un plateau/bouilloire. Toutes les boissons sans alcool du minibar sont gratuites.

Ouvert en 1876, l’Hotel Sacher Wien est doté d’antiquités précieuses, de meubles élégants et d’une magnifique collection de tableaux. Les logements sont meublés de manière personnalisée, avec des matériaux précieux.

Le spa Sacher propose un vaste éventail de massages ainsi que des soins esthétiques et de bien-être.

Kärntner Straße est la rue commerçante et piétonne la plus importante du centre de Vienne. La Ringstrasse, le musée Albertina, la cathédrale Saint-Étienne ainsi que le palais impérial de la Hofburg avec son centre des congrès et d’événements se trouvent à seulement 5 à 10 minutes à pied de l’Hotel Sacher Wien.",2026-06-12 01:21:59.076693+01,2026-06-12 01:21:59.076693+01
cd1265ee-5db0-4960-aa3c-a5e087bf5f8e,9c6d7948-e2b7-4175-8f71-8f91b4147391,12538fd2-838e-4667-98fd-b363854316fd,pt,"The luxurious, renowned 5-star Hotel Imperial is set directly on the Ringstraße boulevard in the heart of Vienna and takes you back to the times of the Austro-Hungarian Empire. It features exclusive hotel rooms and a 24-hour rooftop fitness centre with a sauna. It was inaugurated in 1873 by Emperor Francis Joseph as the Palais Württemberg.

Decorated with precious antiques, silk walls and historical details, the rooms and suites of Hotel Imperial, a Luxury Collection Hotel, Vienna offer modern comforts such as air conditioning, a sound system and an extra-large TV. Bathrobes and slippers are available in the spacious marble bathrooms. For guests of the suites, a personal butler service is available.

Guests can enjoy a classic Viennese coffee and pastries, including the famous Imperialtorte (cake), at Café Imperial. At the  Imperial Bar, a wide range of cocktails and other drinks, as well as live piano music, are offered. 

The on-site business centre comprises modern meeting rooms and elegant conference salons equipped with state-of-the-art technology.  The historic and carefully restored Festsaal and Marmorsaal are an ideal location for events.

The Musikverein (concert hall), site of the Vienna Philharmonic Orchestra’s New Year’s Concert, is right behind Hotel Imperial. Karlsplatz Underground Station, the State Opera, and the Kärntner Straße shopping street can be reached in a 5-minute walk.",2026-06-12 01:22:07.950392+01,2026-06-12 01:22:07.950392+01
89c31556-3168-48b3-87a7-30c489165684,35471bc5-4c9b-483a-a14d-9924f995b146,881a8466-91ac-443d-8d24-2f9684bd1486,en,"Prime City Centre Location:Rosewood Vienna in Vienna offers a central setting with St. Peter's Catholic Church just metres away and St. Stephen's Cathedral a short walk. The Vienna State Opera and Hofburg are within 1 km, while Vienna International Airport lies 18 km from the hotel.Exceptional Facilities:Guests enjoy spa and wellness facilities, a sauna, fitness centre, sun terrace, restaurant, bar, and free WiFi. Additional amenities include private check-in and check-out, a 24-hour front desk, concierge service, and electric vehicle charging.Comfortable Accommodations:Rooms feature private bathrooms, city views, hairdryers, and slippers. The modern restaurant serves lunch and dinner, while the bar offers a stylish setting for relaxation.Nearby Attractions:Nearby attractions include Vienna Volksgarten, House of Music, and an ice-skating rink. Boating is available in the surrounding area.",2026-06-12 01:24:23.549439+01,2026-06-12 01:24:23.55045+01
e80b3a35-7ded-4b13-a791-dce1644e8537,99796a84-804c-461d-8183-bbaf21f3ec9e,4511e4ea-3a3e-4e37-ba50-62ad5bbe80bc,en,"Central Location:Motel One Graz in Graz offers a central location with attractions such as the Cathedral and Mausoleum a 7-minute walk away, Graz Opera House 300 metres nearby, and Grazer Landhaus 300 washingry dryer, walk-in shower, and TV.Comfortable Accommodations:Rooms include air-conditioning, private bathrooms, hairdryers, walk-in showers include amentions include carpeted floors and TVs.Facilities and Services:Guests enjoy a bar, free WiFi, lift, 24-hour front desk, daily housekeeping, child-friendly buffet, coffee shop, bicycle parking, express check-in and check-out, and luggage storage.Breakfast:A buffet breakfast is served with juice, fresh pastries, cheese, and fruits.Nearby Attractions:The Graz Clock Tower is 1 km away, Graz Central Station 3.9 km.",2026-06-12 02:05:21.070217+01,2026-06-12 02:05:21.070217+01
c821679e-691c-45bd-bbe0-4dceaac8b19c,890b39bc-c209-40c8-a2ae-9c1db2eff5b4,091798aa-6712-4efd-b493-dbc23bf5a4dd,en,"The 5 Star Superior Anantara Palais Hansen Vienna - A Leading Hotel of the World is located in the city center of Vienna and offers luxurious life style in a historic landmark building. Right on Vienna’s famous Ringstraße boulevard it is only a short walk away from St. Stephen's Cathedral, the imperial palace (“Hofburg”) as well as most other touristic attractions within the city center. It features an 800 m2 luxury spa with hydro pool and several saunas and fitness center as well as a Michelin Star restaurant.

The spacious rooms at the Anantara Palais Hansen Vienna - A Leading Hotel of the World are decorated with high-quality fabrics and carpets and are equipped with a Nespresso coffee machine and an in-room tablet. The rooms offer views of the surrounding historic buildings or the inner courtyard. All rooms are non-smoking. Free WIFI and air condition in the entire hotel.

A wide range of typical Viennese specialties, as well as dishes from all over the world are served in the 2 hotel's restaurants, as well as in the impressive Lobby area, famous for its Apple Strudel and typical Viennese pastries. Exquisite breakfast including a la carte dishes and a bar serving delicious cocktails as well as a Sushi Restaurant are rounding up the food experience.

Spa and fitness facilities include a sauna area with four different saunas, 6 treatment rooms, a hydro pool and state-of-the-art equipment for your workout. Sufficient parking spaces are available on site.

Within a 5-minute walk, you can reach the Sigmund Freud Museum and the Danube Canal. The Baroque-style Augarten Park is 10 minutes away. Schönbrunn Palace is easily reachable by metro from the nearby Schottenring Metro Station.",2026-06-12 01:25:26.916497+01,2026-06-12 01:25:26.917257+01
c0375acd-7aee-4ad4-ad14-434556d59801,ad8c6fcc-0b91-4c9c-9d9f-3d7c452c2786,881a8466-91ac-443d-8d24-2f9684bd1486,es,"Rosewood Vienna está en Viena, a pocos pasos de Iglesia católica de San Pedro, y dispone de alojamiento con centro de fitness, parking privado, terraza y restaurante. Este hotel de 5 estrellas tiene wifi gratis, servicio de habitaciones y recepción 24 horas. El alojamiento está a 3 min a pie de Catedral de San Esteban y a 200 metros del centro de la ciudad.

Las habitaciones están equipadas con baño privado con secador de pelo, y algunas tienen vistas a la ciudad.

En el hotel se sirve un desayuno a la carta.

Rosewood Vienna ofrece acceso al centro de spa y bienestar que hay en el alojamiento, que incluye sauna.

Cerca del alojamiento hay puntos de interés como Jardines Volksgarten de Viena, Casa de la Música y Palacio Imperial de Hofburg. El aeropuerto (Aeropuerto internacional de Viena) está a 18 km.",2026-06-12 01:25:37.603105+01,2026-06-12 01:25:37.604136+01
fd8e8efc-fbe7-4b7b-833a-9e6605d88c6d,3ea21252-3c54-4530-ae47-20afc0692502,881a8466-91ac-443d-8d24-2f9684bd1486,de,"Die Unterkunft Rosewood Vienna, die in Wien, 40 m von Peterskirche entfernt gelegen ist, verfügt über Übernachtungsmöglichkeiten mit einem Fitnesscenter, einem Privatparkplatz, einer Terrasse und einem Restaurant. Dieses Hotel mit 5 Sternen und kostenlosem WLAN bietet einen Zimmerservice und eine rund um die Uhr besetzte Rezeption. Die Unterkunft befindet sich 300 m von Stephansdom und weniger als 200 m vom Zentrum der Stadt entfernt.

Hier sind die Zimmer versehen mit einem eigenen Badezimmer mit einem Haartrockner, einige hingegen bieten Stadtblick.

Ein à la carte Frühstück wird in der Unterkunft Rosewood Vienna angeboten.

Gäste der Unterkunft Rosewood Vienna haben Zugang zum Wellness-Bereich vor Ort. Dort gibt es eine Sauna.

In der Nähe der Unterkunft Rosewood Vienna finden Sie die interessanten Orte Volksgarten Wien, Haus der Musik und Hofburg. Der nächstgelegene Flughafen ist der Flughafen Wien-Schwechat, 18 km von der Unterkunft Rosewood Vienna entfernt.",2026-06-12 01:26:28.210324+01,2026-06-12 01:26:28.211323+01
72451677-7eaa-49c1-9923-8669b9c89907,bd0d73f0-e157-4417-a215-da8a3e15462a,091798aa-6712-4efd-b493-dbc23bf5a4dd,es,"El Anantara Palais Hansen Vienna - A Leading Hotel of the World, de 5 estrellas superior, está situado en el centro de Viena y ofrece una estancia de lujo en un edificio histórico. Se encuentra en el famoso bulevar Ringstraße de Viena, a poca distancia a pie de la catedral de San Esteban, el Palacio Imperial (Hofburg) y otros lugares de interés turístico del centro de la ciudad. Cuenta con un spa de lujo de 800 m² con piscina de hidromasaje y varias saunas, un centro de fitness y un restaurante con estrella Michelin.

Las amplias habitaciones del Anantara Palais Hansen Vienna - A Leading Hotel of the World están decoradas con tejidos y alfombras de alta calidad y disponen de cafetera Nespresso y tablet. Las habitaciones ofrecen vistas a los edificios históricos de los alrededores o al patio interior. Está prohibido fumar en todas las habitaciones. Hay WiFi gratuita y aire acondicionado en todo el hotel.

En la impresionante zona del vestíbulo y en los 2 restaurantes del hotel se sirven especialidades típicas de Viena y platos internacionales. Además, en el vestíbulo también se ofrece repostería típica de Viena y el famoso Apple Strudel. El establecimiento sirve un desayuno que incluye platos a la carta. También hay un bar de cócteles y un restaurante de sushi.

Entre las instalaciones de spa y fitness se incluyen una zona con 4 saunas diferentes, 6 salas de tratamientos, una piscina de hidromasaje y máquinas de ejercicio de última generación. El hotel cuenta con numerosas plazas de aparcamiento.

El hotel está situado a 5 minutos a pie del Museo Sigmund Freud y del canal del Danubio. El establecimiento se halla a 10 minutos del parque Augarten, de estilo barroco. El hotel está ubicado a poca distancia de la parada de metro Schottenring, que ofrece conexiones rápidas con el Palacio de Schönbrunn.",2026-06-12 01:26:39.291765+01,2026-06-12 01:26:39.291765+01
7551a6ee-cfe1-4d60-8669-5c09eb9f6197,6afe18d1-81b2-4deb-973d-d358acf14ed9,881a8466-91ac-443d-8d24-2f9684bd1486,it,"Posizionato a Vienna, a 40 metri da Chiesa di San Pietro, Rosewood Vienna mette a disposizione un centro fitness, un parcheggio privato, una terrazza e un ristorante. Con WiFi gratuito, questo hotel a 5 stelle offre il servizo in camera e una reception 24 ore su 24. La struttura dista 300 metri da Duomo di Santo Stefano ed è a 200 metri dal centro cittadino.

Le camere sono provviste di un bagno privato con asciugacapelli, mentre alcune vantano la vista sulla città.

Questo hotel offre una colazione à la carte.

Come ospiti presso Rosewood Vienna, potrete accedere al centro spa e benessere in loco che include una sauna.

I luoghi di interesse più famosi nei dintorni di questa struttura includono Giardino Botanico Volksgarten, Casa della Musica e Hofburg - Residenza Imperiale. Aeroporto di Vienna - Schwechat si trova a 18 km dalla struttura.",2026-06-12 01:27:00.333427+01,2026-06-12 01:27:00.334614+01
6beace3a-3bd5-4445-a43d-03aa36fb5cc8,5a7a4edc-0648-405d-a54e-cdd131b0532f,cae75113-876d-430a-8f52-883112195149,pt,"Em Viena, a cerca de 4 minutos a pé de Casa da Música, Almanac Palais Vienna fornece serviços de concierge, quartos antialérgico, um restaurante, acesso Wi-Fi gratuito em toda a propriedade e um bar. Este hotel de 5 estrelas dispõe de serviço de quartos e uma receção aberta 24 horas. Existe um spa e centro de bem-estar com um terraço, piscina interior e centro de fitness, assim como sauna.

Os quartos incluem ar condicionado, área de estar, televisão de ecrã plano com canais por satélite, cofre e uma casa de banho privativa com chuveiro, produtos de higiene pessoal gratuitos e um secador de cabelo. O alojamento apresenta algumas unidades com vistas da cidade, e os quartos estão equipados com máquina de café. Todos os quartos providenciam roupa de cama e toalhas.

São oferecidas opções de pequeno-almoço vegetariano, vegan e sem glúten.

Almanac Palais Vienna tem vários pontos de interesse populares nas suas proximidades, incluindo Musikverein (Casa da Música), Ópera de Viena e Catedral de Santo Estevão. O Aeroporto Internacional de Viena fica a 17 km de distância, e o alojamento oferece um serviço de transfer do aeroporto por um custo adicional.",2026-06-12 01:35:13.497117+01,2026-06-12 01:35:13.497117+01
8483f367-205e-448d-abf1-d5dd371f01e5,5bc6079c-3a68-4482-9600-00059955dd76,091798aa-6712-4efd-b493-dbc23bf5a4dd,de,"Das 5-Sterne-Superior-Hotel Anantara Palais Hansen Vienna - A Leading Hotel of the World liegt im Stadtzentrum von Wien und bietet luxuriösen Lebensstil in einem historischen Wahrzeichengebäude. Hier wohnen Sie direkt an der berühmten Wiener Ringstraße und nur einen kurzen Spaziergang vom Stephansdom, der Hofburg sowie den meisten anderen touristischen Attraktionen im Stadtzentrum entfernt. Freuen Sie sich auf ein 800 m2 großes Luxus-Spa mit Hydropool und mehreren Saunen sowie Fitnesscenter sowie ein Michelin-Sterne-Restaurant.

Die geräumigen Zimmer im Anantara Palais Hansen Vienna - A Leading Hotel of the World sind mit hochwertigen Stoffen und Teppichen dekoriert und mit einer Nespresso-Kaffeemaschine und einem Tablet im Zimmer ausgestattet. Die Zimmer bieten Aussicht auf die umliegenden historischen Gebäude oder den Innenhof. Alle Zimmer sind Nichtraucherzimmer. Kostenloses WLAN und Klimaanlage erwarten Sie im gesamten Hotel.

Eine große Auswahl an typischen Wiener Spezialitäten sowie Gerichte aus aller Welt werden in den 2 Hotelrestaurants sowie im beeindruckenden Lobbybereich serviert, der für seinen Apfelstrudel und das typische Wiener Gebäck bekannt ist. Ein exquisites Frühstück mit À-la-carte-Gerichten, eine Bar mit köstlichen Cocktails und ein Sushi-Restaurant runden das kulinarische Erlebnis ab.

Zu den Spa- und Fitnesseinrichtungen gehören ein Saunabereich mit 4 verschiedenen Saunen, 6 Behandlungsräume, ein Hydropool und modernste Geräte für Ihr Training. Am Hotel stehen ausreichend Parkplätze zur Verfügung.

Innerhalb von 5 Gehminuten erreichen Sie das Sigmund Freud Museum und den Donaukanal. Den barocken Augarten erreichen Sie nach 10 Minuten. Das Schloss Schönbrunn ist vom nahe gelegenen U-Bahnhof Schottenring aus mit der U-Bahn leicht zu erreichen.",2026-06-12 01:27:27.200253+01,2026-06-12 01:27:27.200253+01
aaf1e365-6245-4a5d-b2b1-2c40f676166e,953133b8-518c-4e6f-9e1c-23d6de380c51,881a8466-91ac-443d-8d24-2f9684bd1486,fr,"L’établissement Rosewood Vienna se situe à Vienne, à quelques pas de ce lieu d’intérêt : Église Saint-Pierre de Vienne. Il possède une salle de sport, une terrasse, un restaurant et un parking privé. Cet hôtel 5 étoiles propose un service d'étage, une réception ouverte 24h/24 et une connexion Wi-Fi gratuite. Cet hôtel possède un sauna et un service de concierge.

Vous bénéficierez d'une salle de bains privative dotée d'un sèche-cheveux. Certains hébergements possèdent également une vue sur la ville.

Un petit-déjeuner à la carte est servi sur place.

L’établissement Rosewood Vienna dispose d’un spa.

Vous séjournerez à proximité de ces lieux d’intérêt : Cathédrale Saint-Étienne de Vienne, Parc Volksgarten et Maison de la Musique. L'aéroport le plus proche (Aéroport de Vienne-Schwechat) est à 18 km.",2026-06-12 01:27:37.588199+01,2026-06-12 01:27:37.588199+01
