id,id_photo,hotel_id,orientation,photo_width,photo_height,alt,created_at_photo,created_at
35593d39-5dd3-4dd7-bacd-38542cd0e9ff,80425184,50cb540c-1ebf-4f9b-b442-ce674652b5ed,landscape,3264,2448,a small bathroom with a sink and a mirror at Hotel Aton in Graz,2016-10-06 10:51:51+01,2026-04-12 23:00:21.902115+01
3592e2d3-170a-44ee-9f85-73305b2f18c4,80425182,50cb540c-1ebf-4f9b-b442-ce674652b5ed,landscape,3264,2448,a bathroom with a sink and a toilet and a mirror at Hotel Aton in Graz,2016-10-06 10:51:50+01,2026-04-12 23:00:21.903912+01
cd0d002c-4d62-43eb-922c-0119538ae9e5,80425237,50cb540c-1ebf-4f9b-b442-ce674652b5ed,landscape,3264,2448,a bedroom with a bed and a table and chairs at Hotel Aton in Graz,2016-10-06 10:52:09+01,2026-04-12 23:00:21.905591+01
f6fc7f86-c293-4bbb-aa0f-69e880c9b698,80425238,50cb540c-1ebf-4f9b-b442-ce674652b5ed,landscape,3264,2448,a bedroom with a large bed with white sheets at Hotel Aton in Graz,2016-10-06 10:52:09+01,2026-04-12 23:00:21.907336+01
b0a9e25f-8677-44f6-b8c6-499d280459eb,80425248,50cb540c-1ebf-4f9b-b442-ce674652b5ed,landscape,3264,2448,a bedroom with a bed in a room at Hotel Aton in Graz,2016-10-06 10:52:17+01,2026-04-12 23:00:21.908743+01
89c6b001-cfd9-4ad9-83e4-6fcebd84b451,80425249,50cb540c-1ebf-4f9b-b442-ce674652b5ed,landscape,3264,2448,a bedroom with a white bed and a table at Hotel Aton in Graz,2016-10-06 10:52:18+01,2026-04-12 23:00:21.910359+01
c24e2b18-9378-48d7-bcd6-f27a4cd96d68,80425251,50cb540c-1ebf-4f9b-b442-ce674652b5ed,landscape,3264,2448,a bedroom with a bed and a table and chairs at Hotel Aton in Graz,2016-10-06 10:52:18+01,2026-04-12 23:00:21.912457+01
6605b61a-bb57-4ec7-b73e-9edfb6dd1891,80425259,50cb540c-1ebf-4f9b-b442-ce674652b5ed,landscape,3264,2448,a small bed in a room with a mirror at Hotel Aton in Graz,2016-10-06 10:52:25+01,2026-04-12 23:00:21.914425+01
d67e867d-c4f0-4127-bed0-568ce76377a9,80425214,50cb540c-1ebf-4f9b-b442-ce674652b5ed,landscape,3264,2448,a stairway leading up to a building with trees at Hotel Aton in Graz,2016-10-06 10:52:01+01,2026-04-12 23:00:21.916627+01
c4f4493d-0542-4e75-9f77-262df0e170e2,80425199,50cb540c-1ebf-4f9b-b442-ce674652b5ed,landscape,3264,2448,an overhead view of a backyard with a golf course at Hotel Aton in Graz,2016-10-06 10:51:57+01,2026-04-12 23:00:21.918763+01
1303cb5f-0235-4ed5-94eb-e720a24895fa,77553028,50cb540c-1ebf-4f9b-b442-ce674652b5ed,landscape,5312,2988,a room with a bed and a table and chairs at Hotel Aton in Graz,2016-08-19 17:14:27+01,2026-04-12 23:00:21.920902+01
c1721aed-f846-449d-a990-c22b667d391b,80425273,50cb540c-1ebf-4f9b-b442-ce674652b5ed,landscape,3264,2448,an outside view of a house with a patio at Hotel Aton in Graz,2016-10-06 10:52:35+01,2026-04-12 23:00:21.923538+01
6ca07867-d63a-4063-9bea-13fb54378c03,80425276,50cb540c-1ebf-4f9b-b442-ce674652b5ed,landscape,3264,2448,a room with two beds and a table and chairs at Hotel Aton in Graz,2016-10-06 10:52:38+01,2026-04-12 23:00:21.925908+01
25654c04-7b02-46a4-b4b6-4a9943939dbf,80425277,50cb540c-1ebf-4f9b-b442-ce674652b5ed,landscape,3264,2448,a hotel room with three beds with a cell phone on them at Hotel Aton in Graz,2016-10-06 10:52:39+01,2026-04-12 23:00:21.928688+01
77ccb09a-4135-48e0-a5e8-2ced14293813,80425618,50cb540c-1ebf-4f9b-b442-ce674652b5ed,landscape,3264,2448,a kitchen with a sink and a flat screen tv at Hotel Aton in Graz,2016-10-06 10:57:00+01,2026-04-12 23:00:21.931408+01
69d0e3ec-5ee0-4b72-9b23-823d7863ef03,80425622,50cb540c-1ebf-4f9b-b442-ce674652b5ed,landscape,3264,2448,a hotel room with a bed and a television at Hotel Aton in Graz,2016-10-06 10:57:01+01,2026-04-12 23:00:21.933459+01
6f735fed-570d-4abe-9c9c-809dd8d49cc2,80425624,50cb540c-1ebf-4f9b-b442-ce674652b5ed,landscape,3264,2448,a small bathroom with a sink and a bed at Hotel Aton in Graz,2016-10-06 10:57:02+01,2026-04-12 23:00:21.935428+01
4bf9b491-7de7-45a9-9306-b8ac70b09aea,80425625,50cb540c-1ebf-4f9b-b442-ce674652b5ed,landscape,3264,2448,a room with a bed and a desk and a table at Hotel Aton in Graz,2016-10-06 10:57:03+01,2026-04-12 23:00:21.937723+01
2bd912fe-e510-4ba7-a8f6-fb93a0634ad6,80425189,50cb540c-1ebf-4f9b-b442-ce674652b5ed,,,,,,2026-04-12 23:00:21.941098+01
9f699175-4ab9-4721-bea8-ed0fe2c5f9e5,80425628,50cb540c-1ebf-4f9b-b442-ce674652b5ed,,,,,,2026-04-12 23:00:21.943477+01
c7faf029-9e9e-4296-b4d1-20acf06202a3,80425630,50cb540c-1ebf-4f9b-b442-ce674652b5ed,,,,,,2026-04-12 23:00:21.945788+01
a316d72c-7bab-4e94-b92e-fe9ecb4ad4b5,80425227,50cb540c-1ebf-4f9b-b442-ce674652b5ed,,,,,,2026-04-12 23:00:21.948404+01
21043652-b174-4cd1-b555-16ed75c79793,80425220,50cb540c-1ebf-4f9b-b442-ce674652b5ed,,,,,,2026-04-12 23:00:21.951756+01
bb051906-8649-413e-91a5-a07ed1b0e0c9,80425226,50cb540c-1ebf-4f9b-b442-ce674652b5ed,,,,,,2026-04-12 23:00:21.954526+01
8848f6f0-683f-4028-be6c-c8006a45622b,80425626,50cb540c-1ebf-4f9b-b442-ce674652b5ed,,,,,,2026-04-12 23:00:21.956608+01
18d123c1-c54b-4117-8874-032a01d8c5dd,582171973,00c573fd-6e74-485c-bc47-abfafaef5ace,landscape,2880,1536,a bedroom with a large bed and a bathroom at PLAZA INN Graz Messe in Graz,2024-07-19 10:12:26+01,2026-04-12 23:00:54.044744+01
1bb1c110-8cc6-4be7-a6da-efdb4a9352d2,625575474,00c573fd-6e74-485c-bc47-abfafaef5ace,landscape,2880,1536,a bathroom with a sink and a shower at PLAZA INN Graz Messe in Graz,2024-12-15 05:51:56+00,2026-04-12 23:00:54.046229+01
7a50e273-e9ca-4c13-b746-dabf5d95072c,625576939,00c573fd-6e74-485c-bc47-abfafaef5ace,,,,,,2026-04-12 23:00:54.102034+01
dedafa2e-92f5-4ea3-b0d9-5181bda18b36,625576965,00c573fd-6e74-485c-bc47-abfafaef5ace,landscape,2880,1536,a building with a sign on the side of it at PLAZA INN Graz Messe in Graz,2024-12-15 06:05:39+00,2026-04-12 23:00:54.047261+01
17d62c19-8ceb-4420-b66b-811c481ab7f7,625576944,00c573fd-6e74-485c-bc47-abfafaef5ace,landscape,2880,1536,a gym with several treadmills and cardio machines at PLAZA INN Graz Messe in Graz,2024-12-15 06:05:35+00,2026-04-12 23:00:54.048355+01
5453b7d0-d384-49b9-914f-1a9a0dfca1bc,625576952,00c573fd-6e74-485c-bc47-abfafaef5ace,landscape,2880,1536,a store lobby with a cisco sign on the wall at PLAZA INN Graz Messe in Graz,2024-12-15 06:05:36+00,2026-04-12 23:00:54.049712+01
cfd43d36-bdcf-4e3a-83c9-763f55b4dd28,625575476,00c573fd-6e74-485c-bc47-abfafaef5ace,landscape,2880,1536,two beds in a bedroom with blue curtains and flowers at PLAZA INN Graz Messe in Graz,2024-12-15 05:51:56+00,2026-04-12 23:00:54.05089+01
3fc5faf1-079a-475e-8a95-517bd4dfa4e1,625576948,00c573fd-6e74-485c-bc47-abfafaef5ace,landscape,2880,1536,a cafeteria with tables and chairs and windows at PLAZA INN Graz Messe in Graz,2024-12-15 06:05:36+00,2026-04-12 23:00:54.051827+01
98243888-cb84-4870-b5a8-5f4d5355395d,625576958,00c573fd-6e74-485c-bc47-abfafaef5ace,landscape,2880,1536,a table with plates of food and plates of pastries at PLAZA INN Graz Messe in Graz,2024-12-15 06:05:38+00,2026-04-12 23:00:54.052777+01
22427a8b-f2d3-49e0-964b-043f549eb6a1,625576956,00c573fd-6e74-485c-bc47-abfafaef5ace,landscape,2880,1536,a buffet with various fruits and vegetables on display at PLAZA INN Graz Messe in Graz,2024-12-15 06:05:37+00,2026-04-12 23:00:54.053815+01
30b38a3a-70ca-4f63-a4be-cd43fc98de76,625576033,00c573fd-6e74-485c-bc47-abfafaef5ace,landscape,2880,1536,a living room with two beds and a flat screen tv at PLAZA INN Graz Messe in Graz,2024-12-15 05:55:53+00,2026-04-12 23:00:54.055248+01
dd3980d3-001d-4fe6-9a32-ae0496a8fc8c,625576031,00c573fd-6e74-485c-bc47-abfafaef5ace,landscape,2880,1536,a purple and white bedroom with two beds at PLAZA INN Graz Messe in Graz,2024-12-15 05:55:52+00,2026-04-12 23:00:54.0568+01
5bcd23bd-17d6-426b-86bb-d01b06416669,582172290,00c573fd-6e74-485c-bc47-abfafaef5ace,landscape,2880,1536,a living room with a table and a pink couch at PLAZA INN Graz Messe in Graz,2024-07-19 10:13:31+01,2026-04-12 23:00:54.058478+01
7dbf63e7-df7e-4093-bad5-cfd227cabe5e,582172354,00c573fd-6e74-485c-bc47-abfafaef5ace,landscape,2880,1536,a hallway with a coat hanging on a door at PLAZA INN Graz Messe in Graz,2024-07-19 10:13:38+01,2026-04-12 23:00:54.05955+01
19f11ae2-49c3-4d14-9d28-c7baf6d929c6,625576959,00c573fd-6e74-485c-bc47-abfafaef5ace,landscape,2880,1536,a room with red chairs and a table and windows at PLAZA INN Graz Messe in Graz,2024-12-15 06:05:38+00,2026-04-12 23:00:54.060508+01
b6076f62-9705-4a34-af45-373819cbde7c,582172375,00c573fd-6e74-485c-bc47-abfafaef5ace,landscape,2880,1536,a bathroom with two sinks and a large mirror at PLAZA INN Graz Messe in Graz,2024-07-19 10:13:43+01,2026-04-12 23:00:54.061453+01
53590582-a0dd-43fc-8538-733be91da545,582171993,00c573fd-6e74-485c-bc47-abfafaef5ace,landscape,2880,1536,a kitchen with white cabinets and a sink at PLAZA INN Graz Messe in Graz,2024-07-19 10:12:31+01,2026-04-12 23:00:54.062383+01
e1fc3bf1-b443-43ae-b6c8-0fadcc7ba729,582170382,00c573fd-6e74-485c-bc47-abfafaef5ace,landscape,2880,1536,a dining room with a wooden table and chairs at PLAZA INN Graz Messe in Graz,2024-07-19 10:08:21+01,2026-04-12 23:00:54.063399+01
8aec4996-2899-4003-9376-59e45bba5268,582171979,00c573fd-6e74-485c-bc47-abfafaef5ace,landscape,2880,1536,a room with a desk and a bed with a window at PLAZA INN Graz Messe in Graz,2024-07-19 10:12:29+01,2026-04-12 23:00:54.064398+01
4120c7e3-abc2-4e81-95d0-bfd5d30bf032,582172144,00c573fd-6e74-485c-bc47-abfafaef5ace,landscape,2880,1536,a living room with a pink couch and a desk at PLAZA INN Graz Messe in Graz,2024-07-19 10:13:04+01,2026-04-12 23:00:54.065545+01
46394481-22e7-45fb-8ee0-5b7a346366fc,582172395,00c573fd-6e74-485c-bc47-abfafaef5ace,landscape,2880,1536,a bathroom with two sinks and two mirrors at PLAZA INN Graz Messe in Graz,2024-07-19 10:13:46+01,2026-04-12 23:00:54.06656+01
ada3fa26-8ace-4b7e-a269-e6d742555a2a,625576955,00c573fd-6e74-485c-bc47-abfafaef5ace,landscape,2880,1536,a buffet line with fruits and vegetables on display at PLAZA INN Graz Messe in Graz,2024-12-15 06:05:37+00,2026-04-12 23:00:54.067525+01
6b57c4cd-9c29-4643-aa9c-64f24f006503,625576940,00c573fd-6e74-485c-bc47-abfafaef5ace,landscape,2880,1536,a room with a gym with several exercise equipment at PLAZA INN Graz Messe in Graz,2024-12-15 06:05:34+00,2026-04-12 23:00:54.068498+01
125b7a6c-9a62-478c-9744-56529a995ad7,625577010,00c573fd-6e74-485c-bc47-abfafaef5ace,landscape,2880,1536,a restaurant with tables and chairs and red curtains at PLAZA INN Graz Messe in Graz,2024-12-15 06:06:18+00,2026-04-12 23:00:54.06949+01
1e323e6b-8e6d-45fa-9312-351966696cea,625577003,00c573fd-6e74-485c-bc47-abfafaef5ace,landscape,2880,1536,a conference room with a large wooden table and chairs at PLAZA INN Graz Messe in Graz,2024-12-15 06:06:18+00,2026-04-12 23:00:54.070465+01
9e92ea73-93a8-4475-b691-34e8d235fd0c,582172414,00c573fd-6e74-485c-bc47-abfafaef5ace,landscape,2880,1536,a bathroom with a sink and a mirror at PLAZA INN Graz Messe in Graz,2024-07-19 10:13:48+01,2026-04-12 23:00:54.071389+01
dfcad9b7-2491-4e41-a1fd-8278122e6f6f,625575245,00c573fd-6e74-485c-bc47-abfafaef5ace,landscape,2880,1536,a small bathroom with a table and a shower at PLAZA INN Graz Messe in Graz,2024-12-15 05:50:14+00,2026-04-12 23:00:54.073125+01
9945bcf3-a623-4b8f-bd6d-e46be55c9b36,625575475,00c573fd-6e74-485c-bc47-abfafaef5ace,landscape,2880,1536,a bedroom with a white bed and a desk in it at PLAZA INN Graz Messe in Graz,2024-12-15 05:51:56+00,2026-04-12 23:00:54.07483+01
b9d3d8fd-3f90-43b6-bbc7-de727efa0e87,625575477,00c573fd-6e74-485c-bc47-abfafaef5ace,landscape,2880,1536,a bedroom with a bed and a window with blue curtains at PLAZA INN Graz Messe in Graz,2024-12-15 05:51:56+00,2026-04-12 23:00:54.076343+01
cddf2283-fdd7-4c41-a48d-0979b3e39ead,625576032,00c573fd-6e74-485c-bc47-abfafaef5ace,landscape,2880,1536,a white bathroom with a shower and a sink at PLAZA INN Graz Messe in Graz,2024-12-15 05:55:52+00,2026-04-12 23:00:54.077484+01
e52c9997-6638-4876-a61d-99ff9015bcca,625576034,00c573fd-6e74-485c-bc47-abfafaef5ace,landscape,2880,1536,a bathroom with a toilet and a shower at PLAZA INN Graz Messe in Graz,2024-12-15 05:55:53+00,2026-04-12 23:00:54.07851+01
7f96258e-70dd-4f37-854b-4833ba8109b8,625576035,00c573fd-6e74-485c-bc47-abfafaef5ace,landscape,2880,1536,a bathroom with pink and gray walls and wooden floors at PLAZA INN Graz Messe in Graz,2024-12-15 05:55:53+00,2026-04-12 23:00:54.079486+01
8f04bf3c-1812-43c4-b435-8b3183cfb861,625576455,00c573fd-6e74-485c-bc47-abfafaef5ace,landscape,2880,1536,a bathroom with a sink and a shower at PLAZA INN Graz Messe in Graz,2024-12-15 05:59:33+00,2026-04-12 23:00:54.080459+01
5740ea30-2b8e-4c91-af89-72b741971a83,625576457,00c573fd-6e74-485c-bc47-abfafaef5ace,landscape,2880,1536,a hotel room with two beds and a television at PLAZA INN Graz Messe in Graz,2024-12-15 05:59:33+00,2026-04-12 23:00:54.081621+01
0b671e39-c07b-412a-9370-d29c7f278b9e,625576459,00c573fd-6e74-485c-bc47-abfafaef5ace,landscape,2880,1536,a bedroom with a large white bed with a window at PLAZA INN Graz Messe in Graz,2024-12-15 05:59:33+00,2026-04-12 23:00:54.082665+01
3e33a123-f783-487d-a764-d951f3332b2f,625576772,00c573fd-6e74-485c-bc47-abfafaef5ace,landscape,2880,1536,two beds in a bedroom with white sheets and flowers at PLAZA INN Graz Messe in Graz,2024-12-15 06:02:41+00,2026-04-12 23:00:54.083809+01
32ecc2ec-4622-4976-beee-c44968341c43,625576773,00c573fd-6e74-485c-bc47-abfafaef5ace,landscape,2880,1536,a bedroom with a large white bed and a window at PLAZA INN Graz Messe in Graz,2024-12-15 06:02:41+00,2026-04-12 23:00:54.084888+01
a0b3af27-c68e-4308-963d-1f812829e174,625576771,00c573fd-6e74-485c-bc47-abfafaef5ace,landscape,2880,1536,a bathroom with a sink and a shower at PLAZA INN Graz Messe in Graz,2024-12-15 06:02:40+00,2026-04-12 23:00:54.085882+01
4108350a-76f7-41d4-8b97-d67bf1ab55be,625576774,00c573fd-6e74-485c-bc47-abfafaef5ace,landscape,2880,1536,a small room with a table and a stool at PLAZA INN Graz Messe in Graz,2024-12-15 06:02:41+00,2026-04-12 23:00:54.086864+01
ddb7aa2d-eb15-4cad-8260-92508e59d8d8,625576458,00c573fd-6e74-485c-bc47-abfafaef5ace,landscape,2880,1536,a bedroom with a white bed with green curtains at PLAZA INN Graz Messe in Graz,2024-12-15 05:59:33+00,2026-04-12 23:00:54.088048+01
4e7c4c72-c445-4cee-9721-36c963a7e33b,625576957,00c573fd-6e74-485c-bc47-abfafaef5ace,landscape,2880,1536,a restaurant with tables and chairs and large windows at PLAZA INN Graz Messe in Graz,2024-12-15 06:05:37+00,2026-04-12 23:00:54.08945+01
187f1bb4-6c9a-40fb-91f5-e74936194af2,625576942,00c573fd-6e74-485c-bc47-abfafaef5ace,landscape,2880,1536,a lobby with a green and white counter and chairs at PLAZA INN Graz Messe in Graz,2024-12-15 06:05:35+00,2026-04-12 23:00:54.09086+01
b8777e99-8bf6-42e2-9830-7ed499382587,625576963,00c573fd-6e74-485c-bc47-abfafaef5ace,landscape,2880,1536,a large white building with trees in front of it at PLAZA INN Graz Messe in Graz,2024-12-15 06:05:38+00,2026-04-12 23:00:54.092255+01
02417310-d560-4509-9256-beb07c7cce4c,625576941,00c573fd-6e74-485c-bc47-abfafaef5ace,landscape,2880,1536,a group of jars filled with seeds on a table at PLAZA INN Graz Messe in Graz,2024-12-15 06:05:35+00,2026-04-12 23:00:54.093565+01
1e7cb7fe-eee5-4999-b056-e6374e1ee803,625576962,00c573fd-6e74-485c-bc47-abfafaef5ace,landscape,2880,1536,a table with a basket of pastries and orange juice at PLAZA INN Graz Messe in Graz,2024-12-15 06:05:38+00,2026-04-12 23:00:54.094941+01
b4e06859-beee-4c94-a699-75774d3b2e43,625576953,00c573fd-6e74-485c-bc47-abfafaef5ace,landscape,2880,1536,a kitchen with a counter in a room at PLAZA INN Graz Messe in Graz,2024-12-15 06:05:37+00,2026-04-12 23:00:54.096298+01
bb3ee3bb-f96f-40cd-94a3-57ae46db6d30,625576945,00c573fd-6e74-485c-bc47-abfafaef5ace,,,,,,2026-04-12 23:00:54.097755+01
824f5fc4-2147-4828-a286-f7c88016f05c,625576943,00c573fd-6e74-485c-bc47-abfafaef5ace,,,,,,2026-04-12 23:00:54.09933+01
ecca6ddc-83e8-4fe0-9758-effd39983335,625577007,00c573fd-6e74-485c-bc47-abfafaef5ace,,,,,,2026-04-12 23:00:54.103587+01
f39b54bf-a19e-4504-a814-249e99669c55,625576951,00c573fd-6e74-485c-bc47-abfafaef5ace,,,,,,2026-04-12 23:00:54.105157+01
c5adcde1-1cc3-4710-ab1b-05efd6ab1588,625576947,00c573fd-6e74-485c-bc47-abfafaef5ace,,,,,,2026-04-12 23:00:54.106557+01
56d38c45-340f-40b7-bf02-3bcdb13a81cb,625577004,00c573fd-6e74-485c-bc47-abfafaef5ace,,,,,,2026-04-12 23:00:54.10795+01
5c8f1cbd-fcf6-4843-9fd2-e2f11912d87e,625665357,00c573fd-6e74-485c-bc47-abfafaef5ace,,,,,,2026-04-12 23:00:54.109178+01
a86abe26-3e4d-460f-b17f-4cf3263a07ae,625576966,00c573fd-6e74-485c-bc47-abfafaef5ace,,,,,,2026-04-12 23:00:54.110563+01
bf03484a-b599-42c4-bd3e-ceee6b855ff2,625577006,00c573fd-6e74-485c-bc47-abfafaef5ace,,,,,,2026-04-12 23:00:54.111914+01
14556992-aac4-445c-a99f-6d4964783b81,625577001,00c573fd-6e74-485c-bc47-abfafaef5ace,,,,,,2026-04-12 23:00:54.113257+01
c043210c-8249-4682-bd72-3db0cdd2334a,625577005,00c573fd-6e74-485c-bc47-abfafaef5ace,,,,,,2026-04-12 23:00:54.114675+01
cf60c0a9-2456-4ecf-96c9-964f096ec977,625665358,00c573fd-6e74-485c-bc47-abfafaef5ace,,,,,,2026-04-12 23:00:54.116087+01
420d5538-1919-4dd1-b0f3-fad6585e9397,582170392,00c573fd-6e74-485c-bc47-abfafaef5ace,,,,,,2026-04-12 23:00:54.11719+01
133159e5-b480-4510-b9c8-f12cddf04a60,625576950,00c573fd-6e74-485c-bc47-abfafaef5ace,,,,,,2026-04-12 23:00:54.11828+01
7c8ef710-379c-45dc-9ab3-6ace90b2fcd7,625577008,00c573fd-6e74-485c-bc47-abfafaef5ace,,,,,,2026-04-12 23:00:54.119524+01
47b7f4c3-7cb8-44da-b36f-267954be443d,625576964,00c573fd-6e74-485c-bc47-abfafaef5ace,,,,,,2026-04-12 23:00:54.120865+01
942fe788-868d-4b1d-89eb-afa6248a84a2,346708576,55aa6d82-f9e4-404f-b552-2a4b9c10180b,landscape,4000,3000,an aerial view of a resort in the mountains at A-ROSA Ifen Hotel Kleinwalsertal in Hirschegg,2022-03-16 12:32:03+00,2026-04-12 23:06:34.892795+01
5ad1eaae-f33d-47d7-a901-5c7c54d244af,26893404,55aa6d82-f9e4-404f-b552-2a4b9c10180b,landscape,2048,1536,a lobby with a chandelier and a table with candles at A-ROSA Ifen Hotel Kleinwalsertal in Hirschegg,2014-02-17 11:22:31+00,2026-04-12 23:06:34.904323+01
7ba1c1bd-ae9c-4ae8-9fcd-24e2a6a81653,320062758,55aa6d82-f9e4-404f-b552-2a4b9c10180b,landscape,5464,3640,a person standing on the edge of a pool at a resort at A-ROSA Ifen Hotel Kleinwalsertal in Hirschegg,2021-09-17 23:11:28+01,2026-04-12 23:06:34.905642+01
493ac0e5-b7d2-442c-b6e5-175b2f93d572,175435246,55aa6d82-f9e4-404f-b552-2a4b9c10180b,landscape,4928,3280,a restaurant with wooden ceilings and tables and chairs at A-ROSA Ifen Hotel Kleinwalsertal in Hirschegg,2018-12-29 14:17:08+00,2026-04-12 23:06:34.906831+01
ead27f8b-c154-41ce-b17c-59ae1205e419,155917354,55aa6d82-f9e4-404f-b552-2a4b9c10180b,landscape,4000,3000,a hotel room with a large bed and a television at A-ROSA Ifen Hotel Kleinwalsertal in Hirschegg,2018-08-02 12:48:52+01,2026-04-12 23:06:34.90794+01
8d2b0fe9-2a58-4b58-96e5-67f8adc69f31,665007014,55aa6d82-f9e4-404f-b552-2a4b9c10180b,landscape,3870,3284,a little girl sitting on a balcony looking at the mountains at A-ROSA Ifen Hotel Kleinwalsertal in Hirschegg,2025-03-26 16:21:16+00,2026-04-12 23:06:34.909757+01
90c2fb64-bf53-4622-9cec-932561febc8a,419641894,55aa6d82-f9e4-404f-b552-2a4b9c10180b,landscape,4207,2810,a person standing on the edge of a body of water at A-ROSA Ifen Hotel Kleinwalsertal in Hirschegg,2023-01-10 15:09:08+00,2026-04-12 23:06:34.911824+01
c76f53c7-8981-43f0-840f-a89aed4989c1,26893399,55aa6d82-f9e4-404f-b552-2a4b9c10180b,landscape,2048,1536,two lounge chairs and a table with a view of mountains at A-ROSA Ifen Hotel Kleinwalsertal in Hirschegg,2014-02-17 11:22:26+00,2026-04-12 23:06:34.913398+01
aa343000-78a4-49a1-be2b-5b997c8e9eeb,157571916,55aa6d82-f9e4-404f-b552-2a4b9c10180b,landscape,1800,1200,a balcony of a house with a view of mountains at A-ROSA Ifen Hotel Kleinwalsertal in Hirschegg,2018-08-15 20:15:32+01,2026-04-12 23:06:34.914514+01
3eac068d-88b5-462f-b2af-0cdc27f41f41,36068634,55aa6d82-f9e4-404f-b552-2a4b9c10180b,landscape,2048,1536,a swimming pool in the middle of a hotel at A-ROSA Ifen Hotel Kleinwalsertal in Hirschegg,2014-09-16 15:01:53+01,2026-04-12 23:06:34.915545+01
aaaabe0f-ba62-400f-9bba-4e043a8b9167,175435261,55aa6d82-f9e4-404f-b552-2a4b9c10180b,landscape,4928,3280,a restaurant with tables and chairs and a fireplace at A-ROSA Ifen Hotel Kleinwalsertal in Hirschegg,2018-12-29 14:17:19+00,2026-04-12 23:06:34.916583+01
d52cdd1f-85d1-4331-9063-564520f050ef,175435239,55aa6d82-f9e4-404f-b552-2a4b9c10180b,landscape,4928,3280,a restaurant with tables and chairs in a room at A-ROSA Ifen Hotel Kleinwalsertal in Hirschegg,2018-12-29 14:17:03+00,2026-04-12 23:06:34.917629+01
af4ef485-50db-4b8c-9ee5-bc17c21cf969,346708566,55aa6d82-f9e4-404f-b552-2a4b9c10180b,landscape,4000,3000,a wooden table with wine glasses and a vase of flowers at A-ROSA Ifen Hotel Kleinwalsertal in Hirschegg,2022-03-16 12:32:02+00,2026-04-12 23:06:34.919174+01
2645c266-2358-4984-8f0f-f2dbc7b619ff,175435252,55aa6d82-f9e4-404f-b552-2a4b9c10180b,landscape,4928,3280,a restaurant with tables and chairs and a fireplace at A-ROSA Ifen Hotel Kleinwalsertal in Hirschegg,2018-12-29 14:17:14+00,2026-04-12 23:06:34.920876+01
a74513bd-7ead-479d-ba53-04b76331c2cc,175435275,55aa6d82-f9e4-404f-b552-2a4b9c10180b,landscape,4928,3280,a bar with chairs and a large wall of liquor bottles at A-ROSA Ifen Hotel Kleinwalsertal in Hirschegg,2018-12-29 14:17:25+00,2026-04-12 23:06:34.922001+01
13fa3c62-e2e5-4ff0-bbfc-779a1ef57a3d,171797164,55aa6d82-f9e4-404f-b552-2a4b9c10180b,landscape,1800,1200,a balcony with a table and chairs and mountains at A-ROSA Ifen Hotel Kleinwalsertal in Hirschegg,2018-11-30 18:44:26+00,2026-04-12 23:06:34.923005+01
15981bab-26b1-4e57-8251-c27e373ff2b6,320064290,55aa6d82-f9e4-404f-b552-2a4b9c10180b,landscape,1800,1200,a dining room with a wooden table and two chairs at A-ROSA Ifen Hotel Kleinwalsertal in Hirschegg,2021-09-17 23:25:34+01,2026-04-12 23:06:34.924052+01
8dafe1b5-ce55-46ee-88ca-438be08d7f82,419645212,55aa6d82-f9e4-404f-b552-2a4b9c10180b,landscape,2000,1333,a bedroom with a large bed with white sheets and pillows at A-ROSA Ifen Hotel Kleinwalsertal in Hirschegg,2023-01-10 15:20:24+00,2026-04-12 23:06:34.925508+01
5ba332c3-3610-4790-879b-6720a76b3b7e,419659481,55aa6d82-f9e4-404f-b552-2a4b9c10180b,landscape,6000,4000,a room with a chair and a table and a window at A-ROSA Ifen Hotel Kleinwalsertal in Hirschegg,2023-01-10 16:18:48+00,2026-04-12 23:06:34.926675+01
2a851c16-c1c4-41d1-9d8c-301ba56905a9,421863063,55aa6d82-f9e4-404f-b552-2a4b9c10180b,landscape,1800,1200,a man laying on a couch taking a picture at A-ROSA Ifen Hotel Kleinwalsertal in Hirschegg,2023-01-19 09:44:19+00,2026-04-12 23:06:34.92786+01
db501675-fc4e-48d3-ba4a-3976cfe295fb,458301153,55aa6d82-f9e4-404f-b552-2a4b9c10180b,landscape,2632,1240,a small room with a bunk bed and a desk at A-ROSA Ifen Hotel Kleinwalsertal in Hirschegg,2023-05-12 08:09:38+01,2026-04-12 23:06:34.928901+01
b91e484c-f533-4baf-85f8-097f0545dba3,458301234,55aa6d82-f9e4-404f-b552-2a4b9c10180b,landscape,2632,1240,a bathroom with a shower and a sink at A-ROSA Ifen Hotel Kleinwalsertal in Hirschegg,2023-05-12 08:09:59+01,2026-04-12 23:06:34.929893+01
3914bd5f-f065-4b70-b6c8-e2004ed39351,419646474,55aa6d82-f9e4-404f-b552-2a4b9c10180b,landscape,6000,4000,a balcony with a view of mountains at A-ROSA Ifen Hotel Kleinwalsertal in Hirschegg,2023-01-10 15:26:01+00,2026-04-12 23:06:34.930926+01
1521662c-9da3-46e5-80da-a90db05dca0c,26893453,55aa6d82-f9e4-404f-b552-2a4b9c10180b,landscape,2048,1536,a bathroom with a shower and a walk in shower at A-ROSA Ifen Hotel Kleinwalsertal in Hirschegg,2014-02-17 11:24:00+00,2026-04-12 23:06:34.931957+01
6fc431a6-4742-4a64-b6de-b98074f7acd1,346708533,55aa6d82-f9e4-404f-b552-2a4b9c10180b,landscape,4000,3000,a living room with a couch and some chairs at A-ROSA Ifen Hotel Kleinwalsertal in Hirschegg,2022-03-16 12:31:54+00,2026-04-12 23:06:34.933002+01
80f29d3f-e0eb-4492-8917-7f1311cb2ede,148476643,55aa6d82-f9e4-404f-b552-2a4b9c10180b,landscape,5616,3744,a group of three people walking on a mountain at A-ROSA Ifen Hotel Kleinwalsertal in Hirschegg,2018-06-15 20:15:39+01,2026-04-12 23:06:34.934243+01
264f7e12-f9c0-41b9-bf0f-6da8eccbc075,148476452,55aa6d82-f9e4-404f-b552-2a4b9c10180b,landscape,5184,3456,a man riding a bike on a mountain trail at A-ROSA Ifen Hotel Kleinwalsertal in Hirschegg,2018-06-15 20:14:52+01,2026-04-12 23:06:34.935449+01
542a6a79-49be-4833-8d44-77837da44eff,320063371,55aa6d82-f9e4-404f-b552-2a4b9c10180b,landscape,1800,1200,two women doing a yoga pose in a room at A-ROSA Ifen Hotel Kleinwalsertal in Hirschegg,2021-09-17 23:18:23+01,2026-04-12 23:06:34.93709+01
2ca2db87-d91b-4a16-9518-ef763a1b6216,419431225,55aa6d82-f9e4-404f-b552-2a4b9c10180b,landscape,3500,2333,a bowl of food on a table with a plate of food at A-ROSA Ifen Hotel Kleinwalsertal in Hirschegg,2023-01-09 17:02:05+00,2026-04-12 23:06:34.938351+01
028d1399-850b-4b29-9af3-f18d6e456ecc,419646741,55aa6d82-f9e4-404f-b552-2a4b9c10180b,landscape,4742,3161,a person is holding a drink in a glass at A-ROSA Ifen Hotel Kleinwalsertal in Hirschegg,2023-01-10 15:29:03+00,2026-04-12 23:06:34.939404+01
1683e413-0f22-46e0-a554-a0993ab9161a,346708574,55aa6d82-f9e4-404f-b552-2a4b9c10180b,landscape,4000,3000,a woman sitting on a yoga mat on the floor at A-ROSA Ifen Hotel Kleinwalsertal in Hirschegg,2022-03-16 12:32:03+00,2026-04-12 23:06:34.940417+01
6e3e7b09-ba5b-40ff-92aa-b966be420ab2,346708572,55aa6d82-f9e4-404f-b552-2a4b9c10180b,landscape,4000,3000,a person holding a plate of food on a table at A-ROSA Ifen Hotel Kleinwalsertal in Hirschegg,2022-03-16 12:32:03+00,2026-04-12 23:06:34.941587+01
3f3b9b22-394c-466d-9c50-e156bd32b9e1,419429865,55aa6d82-f9e4-404f-b552-2a4b9c10180b,landscape,2000,1333,a wooden cutting board filled with different types of fruit at A-ROSA Ifen Hotel Kleinwalsertal in Hirschegg,2023-01-09 16:55:39+00,2026-04-12 23:06:34.943269+01
