id,hotel_id,url_id,language,policy_name,policy_details,created_at
866,20c2dfbc-f964-47d1-8c35-e927235a3410,b049bdb7-d9eb-409f-afd8-cb6e3e840299,en,Check-out,Until 12:00,2026-06-02 00:23:26.769956+01
867,20c2dfbc-f964-47d1-8c35-e927235a3410,b049bdb7-d9eb-409f-afd8-cb6e3e840299,en,Cancellation/ prepayment,Cancellation and prepayment policies vary according to accommodation type. Please enter the dates of your stay and check the conditions of your required option.,2026-06-02 00:23:26.773371+01
868,20c2dfbc-f964-47d1-8c35-e927235a3410,b049bdb7-d9eb-409f-afd8-cb6e3e840299,en,Children and beds,"Child policies Children of any age are welcome. Children 12 years and above will be charged as adults at this property. To see correct prices and occupancy information, please add the number of children in your group and their ages to your search. Cot and extra bed policies 0 - 2 years Extra bed upon request Free Cot always available Free 3 - 11 years Extra bed upon request Free 12+ years Extra bed upon request € 100 per person, per night Prices for cots and extra beds are not included in the total price, and will have to be paid for separately during your stay. The number of extra beds and cots allowed is dependent on the option you choose. Please check your selected option for more information. All extra beds are subject to availability. Child policies Cot and extra bed policies Children of any age are welcome. Children 12 years and above will be charged as adults at this property. To see correct prices and occupancy information, please add the number of children in your group and their ages to your search. Prices for cots and extra beds are not included in the total price, and will have to be paid for separately during your stay. The number of extra beds and cots allowed is dependent on the option you choose. Please check your selected option for more information. All extra beds are subject to availability.",2026-06-02 00:23:26.776012+01
869,20c2dfbc-f964-47d1-8c35-e927235a3410,b049bdb7-d9eb-409f-afd8-cb6e3e840299,en,Age restriction,The minimum age for check-in is 18,2026-06-02 00:23:26.778972+01
870,20c2dfbc-f964-47d1-8c35-e927235a3410,b049bdb7-d9eb-409f-afd8-cb6e3e840299,en,Pets,Pets are allowed on request. Charges may be applicable.,2026-06-02 00:23:26.78098+01
871,20c2dfbc-f964-47d1-8c35-e927235a3410,b049bdb7-d9eb-409f-afd8-cb6e3e840299,en,Groups,"When booking more than 3 rooms, different policies and additional supplements may apply.",2026-06-02 00:23:26.782793+01
872,20c2dfbc-f964-47d1-8c35-e927235a3410,b049bdb7-d9eb-409f-afd8-cb6e3e840299,en,Cards accepted at this hotel,Cash is not accepted,2026-06-02 00:23:26.784768+01
889,af99177e-3fe3-4f04-ad25-28f24c3b9389,35d7aacd-9ecc-4817-ae4f-938ad32ff9b7,es,Entrada,Desde las 15:00 Los clientes deben mostrar un documento de identidad con fotografía y una tarjeta de crédito en el momento de hacer el check-in Tienes que decirle al alojamiento con antelación a qué hora vas a llegar.,2026-06-02 00:25:22.662498+01
890,af99177e-3fe3-4f04-ad25-28f24c3b9389,35d7aacd-9ecc-4817-ae4f-938ad32ff9b7,es,Salida,Hasta las 12:00,2026-06-02 00:25:22.665454+01
891,af99177e-3fe3-4f04-ad25-28f24c3b9389,35d7aacd-9ecc-4817-ae4f-938ad32ff9b7,es,Cancelación /  prepago,Las condiciones de cancelación y de pago por adelantado pueden variar según el tipo de alojamiento. Introduce las fechas de tu estancia y consulta las condiciones de la opción que quieres reservar.,2026-06-02 00:25:22.667886+01
892,af99177e-3fe3-4f04-ad25-28f24c3b9389,35d7aacd-9ecc-4817-ae4f-938ad32ff9b7,es,Camas para niños,"Condiciones para estancias con niños Se pueden alojar niños de cualquier edad. Los niños a partir de 13 años pagan como adultos en este alojamiento. Para ver la información correcta sobre precios y ocupación, añade a la búsqueda el número de niños con los que viajas y sus edades. Condiciones sobre cunas y camas supletorias 1 - 2 años Cuna a petición Gratis 3 - 12 años Cama supletoria a petición € 50 por niño y noche El precio de las cunas y las camas supletorias no está incluido en el precio total y se tiene que pagar por separado durante la estancia. El número de camas supletorias y cunas permitido depende de la opción que escojas. Consulta la opción que has escogido para saber más. Todas las cunas y camas supletorias están sujetas a disponibilidad. Condiciones para estancias con niños Condiciones sobre cunas y camas supletorias Se pueden alojar niños de cualquier edad. Los niños a partir de 13 años pagan como adultos en este alojamiento. Para ver la información correcta sobre precios y ocupación, añade a la búsqueda el número de niños con los que viajas y sus edades. El precio de las cunas y las camas supletorias no está incluido en el precio total y se tiene que pagar por separado durante la estancia. El número de camas supletorias y cunas permitido depende de la opción que escojas. Consulta la opción que has escogido para saber más. Todas las cunas y camas supletorias están sujetas a disponibilidad.",2026-06-02 00:25:22.67038+01
893,af99177e-3fe3-4f04-ad25-28f24c3b9389,35d7aacd-9ecc-4817-ae4f-938ad32ff9b7,es,Restricción por edad,Edad mínima para el check-in: 18,2026-06-02 00:25:22.673221+01
894,af99177e-3fe3-4f04-ad25-28f24c3b9389,35d7aacd-9ecc-4817-ae4f-938ad32ff9b7,es,Mascotas,No se admiten.,2026-06-02 00:25:22.675482+01
895,af99177e-3fe3-4f04-ad25-28f24c3b9389,35d7aacd-9ecc-4817-ae4f-938ad32ff9b7,es,Grupos,"Al reservar más de 5 habitaciones, podrán aplicarse condiciones especiales y suplementos.",2026-06-02 00:25:22.678075+01
896,af99177e-3fe3-4f04-ad25-28f24c3b9389,35d7aacd-9ecc-4817-ae4f-938ad32ff9b7,es,Métodos de pago aceptados,Efectivo,2026-06-02 00:25:22.680994+01
913,f0585ef0-ae98-43c5-9e33-9b39f8665ee2,b049bdb7-d9eb-409f-afd8-cb6e3e840299,it,Arrivo,Dalle 15:00 alle 00:00 Al check-in gli ospiti devono esibire un documento di riconoscimento con foto e una carta di credito. Dovrai comunicare in anticipo alla struttura il tuo orario di arrivo.,2026-06-02 00:26:41.634912+01
914,f0585ef0-ae98-43c5-9e33-9b39f8665ee2,b049bdb7-d9eb-409f-afd8-cb6e3e840299,it,Partenza,Alle 12:00,2026-06-02 00:26:41.636927+01
915,f0585ef0-ae98-43c5-9e33-9b39f8665ee2,b049bdb7-d9eb-409f-afd8-cb6e3e840299,it,Cancellazione / Pagamento anticipato,Le condizioni relative alla cancellazione e al pagamento anticipato variano a seconda della tipologia di alloggio. Inserisci le date del soggiorno e verifica le condizioni dell'opzione scelta.,2026-06-02 00:26:41.638597+01
916,f0585ef0-ae98-43c5-9e33-9b39f8665ee2,b049bdb7-d9eb-409f-afd8-cb6e3e840299,it,Bambini e letti,"Condizioni per i bambini I bambini di tutte le età sono i benvenuti. I bambini di 12 anni o più pagheranno quanto gli adulti presso questa struttura. Per vedere informazioni corrette relativamente a prezzi e occupazione, aggiungi alla ricerca il numero e l'età dei bambini che soggiorneranno. Condizioni per culle e letti aggiuntivi 0 - 2 anni Letto supplementare su richiesta Gratis Culla sempre disponibile Gratis 3 - 11 anni Letto supplementare su richiesta Gratis 12 anni e oltre Letto supplementare su richiesta € 100 per persona, a notte Il prezzo delle culle e dei letti supplementari non è incluso nell'importo totale e dovrà essere pagato separatamente durante il soggiorno. Il numero di culle e letti supplementari ammessi dipende dall'opzione che scegli. Controlla quella che hai selezionato per maggiori informazioni. I letti extra sono soggetti a disponibilità. Condizioni per i bambini Condizioni per culle e letti aggiuntivi I bambini di tutte le età sono i benvenuti. I bambini di 12 anni o più pagheranno quanto gli adulti presso questa struttura. Per vedere informazioni corrette relativamente a prezzi e occupazione, aggiungi alla ricerca il numero e l'età dei bambini che soggiorneranno. Il prezzo delle culle e dei letti supplementari non è incluso nell'importo totale e dovrà essere pagato separatamente durante il soggiorno. Il numero di culle e letti supplementari ammessi dipende dall'opzione che scegli. Controlla quella che hai selezionato per maggiori informazioni. I letti extra sono soggetti a disponibilità.",2026-06-02 00:26:41.640055+01
917,f0585ef0-ae98-43c5-9e33-9b39f8665ee2,b049bdb7-d9eb-409f-afd8-cb6e3e840299,it,Età minima,L'età minima per fare il check-in è 18 anni.,2026-06-02 00:26:41.641485+01
1097,cfeac3e6-2c82-4e67-92ba-4c12c9db10de,39913540-8073-42e5-b229-faeff8fa9831,de,Anreise,Ab 15:00,2026-06-02 00:41:33.342733+01
901,d59c9b9d-472c-4dab-ab80-c8a555c83af1,b049bdb7-d9eb-409f-afd8-cb6e3e840299,de,Altersbeschränkung,Das Mindestalter für den Check-in beträgt 18 Jahre,2026-06-02 00:25:54.579923+01
902,d59c9b9d-472c-4dab-ab80-c8a555c83af1,b049bdb7-d9eb-409f-afd8-cb6e3e840299,de,Haustiere,Haustiere sind auf Anfrage gestattet. Möglicherweise fallen Gebühren an.,2026-06-02 00:25:54.583758+01
903,d59c9b9d-472c-4dab-ab80-c8a555c83af1,b049bdb7-d9eb-409f-afd8-cb6e3e840299,de,Gruppen,Bei einer Buchung von mehr als 3 Zimmern können abweichende Richtlinien und zusätzliche Aufpreise gelten.,2026-06-02 00:25:54.585916+01
904,d59c9b9d-472c-4dab-ab80-c8a555c83af1,b049bdb7-d9eb-409f-afd8-cb6e3e840299,de,In diesem Hotel werden folgende Karten akzeptiert,Barzahlung nicht akzeptiert,2026-06-02 00:25:54.587688+01
1382,073c88a1-ecb4-44de-9ebd-d6613b74d55d,19c8a801-4054-4a9e-94b4-6c8c8ab82b17,it,Bambini e letti,"Condizioni per i bambini I bambini di tutte le età sono i benvenuti. Per vedere informazioni corrette relativamente a prezzi e occupazione, aggiungi alla ricerca il numero e l'età dei bambini che soggiorneranno. Condizioni per culle e letti aggiuntivi 5 - 11 anni Letto supplementare su richiesta Gratis Il numero di letti supplementari ammessi dipende dall'opzione che scegli. Controlla quella che hai selezionato per maggiori informazioni. In questa struttura non c'è disponibilità di culle. I letti supplementari sono soggetti a disponibilità. Condizioni per i bambini Condizioni per culle e letti aggiuntivi I bambini di tutte le età sono i benvenuti. Per vedere informazioni corrette relativamente a prezzi e occupazione, aggiungi alla ricerca il numero e l'età dei bambini che soggiorneranno. Il numero di letti supplementari ammessi dipende dall'opzione che scegli. Controlla quella che hai selezionato per maggiori informazioni. In questa struttura non c'è disponibilità di culle. I letti supplementari sono soggetti a disponibilità.",2026-06-02 01:05:12.657619+01
1383,073c88a1-ecb4-44de-9ebd-d6613b74d55d,19c8a801-4054-4a9e-94b4-6c8c8ab82b17,it,Età minima,L'età minima per fare il check-in è 18 anni.,2026-06-02 01:05:12.662919+01
1384,073c88a1-ecb4-44de-9ebd-d6613b74d55d,19c8a801-4054-4a9e-94b4-6c8c8ab82b17,it,Animali,Animali ammessi su richiesta. Potrebbe essere richiesto un supplemento.,2026-06-02 01:05:12.667221+01
1385,073c88a1-ecb4-44de-9ebd-d6613b74d55d,19c8a801-4054-4a9e-94b4-6c8c8ab82b17,it,Gruppi,"Alle prenotazioni di oltre 7 camere, la struttura potrebbe applicare differenti condizioni e supplementi.",2026-06-02 01:05:12.670974+01
1386,073c88a1-ecb4-44de-9ebd-d6613b74d55d,19c8a801-4054-4a9e-94b4-6c8c8ab82b17,it,Metodi di pagamento accettati,Contanti,2026-06-02 01:05:12.674275+01
1436,9dcd3c65-89d8-46e1-bdf9-601ad982c590,11914a52-a984-4574-a8fb-43d2898bf718,en,Check-out,From 06:00 to 11:00,2026-06-02 01:10:47.708749+01
1437,9dcd3c65-89d8-46e1-bdf9-601ad982c590,11914a52-a984-4574-a8fb-43d2898bf718,en,Cancellation/ prepayment,Cancellation and prepayment policies vary according to accommodation type. Please enter the dates of your stay and check the conditions of your required option.,2026-06-02 01:10:47.709902+01
1438,9dcd3c65-89d8-46e1-bdf9-601ad982c590,11914a52-a984-4574-a8fb-43d2898bf718,en,Curfew,Entry to the property will be closed between the hours of 22:00 and 06:00,2026-06-02 01:10:47.712176+01
1439,9dcd3c65-89d8-46e1-bdf9-601ad982c590,11914a52-a984-4574-a8fb-43d2898bf718,en,Children and beds,"Child policies Children of any age are welcome. To see correct prices and occupancy information, please add the number of children in your group and their ages to your search. Cot and extra bed policies 0 - 5 years Extra bed upon request € 50 per child, per night Cot upon request Free 6 - 15 years Extra bed upon request € 50 per child, per night Prices for cots and extra beds are not included in the total price, and will have to be paid for separately during your stay. The number of extra beds and cots allowed is dependent on the option you choose. Please check your selected option for more information. All cots and extra beds are subject to availability. Child policies Cot and extra bed policies Children of any age are welcome. To see correct prices and occupancy information, please add the number of children in your group and their ages to your search. Prices for cots and extra beds are not included in the total price, and will have to be paid for separately during your stay. The number of extra beds and cots allowed is dependent on the option you choose. Please check your selected option for more information. All cots and extra beds are subject to availability.",2026-06-02 01:10:47.714987+01
1440,9dcd3c65-89d8-46e1-bdf9-601ad982c590,11914a52-a984-4574-a8fb-43d2898bf718,en,No age restriction,There is no age requirement for check-in,2026-06-02 01:10:47.717072+01
1441,9dcd3c65-89d8-46e1-bdf9-601ad982c590,11914a52-a984-4574-a8fb-43d2898bf718,en,Pets,Pets are allowed on request. Charges may be applicable.,2026-06-02 01:10:47.719033+01
1442,9dcd3c65-89d8-46e1-bdf9-601ad982c590,11914a52-a984-4574-a8fb-43d2898bf718,en,Groups,"When booking more than 5 rooms, different policies and additional supplements may apply.",2026-06-02 01:10:47.720608+01
1443,9dcd3c65-89d8-46e1-bdf9-601ad982c590,11914a52-a984-4574-a8fb-43d2898bf718,en,Accepted payment methods,Cash,2026-06-02 01:10:47.72271+01
1456,344192f2-cf1e-45e2-80ce-38a1c29f6aee,11914a52-a984-4574-a8fb-43d2898bf718,es,Camas para niños,"Condiciones para estancias con niños Se pueden alojar niños de cualquier edad. Para ver la información correcta sobre precios y ocupación, añade a la búsqueda el número de niños con los que viajas y sus edades. Condiciones sobre cunas y camas supletorias 0 - 5 años Cama supletoria a petición € 50 por niño y noche Cuna a petición Gratis 6 - 15 años Cama supletoria a petición € 50 por niño y noche El precio de las cunas y las camas supletorias no está incluido en el precio total y se tiene que pagar por separado durante la estancia. El número de camas supletorias y cunas permitido depende de la opción que escojas. Consulta la opción que has escogido para saber más. Todas las cunas y camas supletorias están sujetas a disponibilidad. Condiciones para estancias con niños Condiciones sobre cunas y camas supletorias Se pueden alojar niños de cualquier edad. Para ver la información correcta sobre precios y ocupación, añade a la búsqueda el número de niños con los que viajas y sus edades. El precio de las cunas y las camas supletorias no está incluido en el precio total y se tiene que pagar por separado durante la estancia. El número de camas supletorias y cunas permitido depende de la opción que escojas. Consulta la opción que has escogido para saber más. Todas las cunas y camas supletorias están sujetas a disponibilidad.",2026-06-02 01:13:23.086235+01
1457,344192f2-cf1e-45e2-80ce-38a1c29f6aee,11914a52-a984-4574-a8fb-43d2898bf718,es,No hay restricción por edad,No hay edad mínima para el check-in,2026-06-02 01:13:23.089267+01
1458,344192f2-cf1e-45e2-80ce-38a1c29f6aee,11914a52-a984-4574-a8fb-43d2898bf718,es,Mascotas,Se admiten bajo petición. Se pueden aplicar suplementos.,2026-06-02 01:13:23.093067+01
1459,344192f2-cf1e-45e2-80ce-38a1c29f6aee,11914a52-a984-4574-a8fb-43d2898bf718,es,Grupos,"Al reservar más de 5 habitaciones, podrán aplicarse condiciones especiales y suplementos.",2026-06-02 01:13:23.095742+01
1460,344192f2-cf1e-45e2-80ce-38a1c29f6aee,11914a52-a984-4574-a8fb-43d2898bf718,es,Métodos de pago aceptados,Efectivo,2026-06-02 01:13:23.098033+01
1478,59c47728-656c-4b8a-8e1c-cb7cc6983781,11914a52-a984-4574-a8fb-43d2898bf718,it,Arrivo,Dalle 14:00 alle 22:00 Al check-in gli ospiti devono esibire un documento di riconoscimento con foto e una carta di credito.,2026-06-02 01:14:38.425881+01
1479,59c47728-656c-4b8a-8e1c-cb7cc6983781,11914a52-a984-4574-a8fb-43d2898bf718,it,Partenza,Dalle 06:00 alle 11:00,2026-06-02 01:14:38.427621+01
1480,59c47728-656c-4b8a-8e1c-cb7cc6983781,11914a52-a984-4574-a8fb-43d2898bf718,it,Cancellazione / Pagamento anticipato,Le condizioni relative alla cancellazione e al pagamento anticipato variano a seconda della tipologia di alloggio. Inserisci le date del soggiorno e verifica le condizioni dell'opzione scelta.,2026-06-02 01:14:38.429901+01
1481,59c47728-656c-4b8a-8e1c-cb7cc6983781,11914a52-a984-4574-a8fb-43d2898bf718,it,Chiusura notturna,L'accesso alla struttura non sarà possibile dalle 22:00 alle 06:00.,2026-06-02 01:14:38.432014+01
1559,0cc41c2b-1171-4a2a-9e01-7ce2f75cc9a5,a1f2eb45-8055-4796-a38d-e1c78cf0ff8c,es,Grupos,"Al reservar más de 4 habitaciones, podrán aplicarse condiciones especiales y suplementos.",2026-06-02 01:20:34.242013+01
1560,0cc41c2b-1171-4a2a-9e01-7ce2f75cc9a5,a1f2eb45-8055-4796-a38d-e1c78cf0ff8c,es,Métodos de pago aceptados,Efectivo,2026-06-02 01:20:34.244981+01
908,7438843a-16ac-41c3-aea4-2dd44b5e35cf,35d7aacd-9ecc-4817-ae4f-938ad32ff9b7,de,Kinder und Betten,"Richtlinien für Kinder Kinder jeden Alters sind willkommen. Kinder im Alter von 13 Jahren oder älter zahlen in dieser Unterkunft den Erwachsenenpreis. Fügen Sie Ihrer Suche bitte die Anzahl der Kinder in Ihrer Gruppe und deren Alter hinzu, um die korrekten Preise und Belegungsinformationen zu sehen. Richtlinien zu Baby- und Zustellbetten 1 - 2 Jahre Babybett auf Anfrage Kostenfrei 3 - 12 Jahre Zustellbett auf Anfrage € 50 pro Kind, pro Nacht Preise für Baby- und Zustellbetten sind nicht im Gesamtpreis enthalten und müssen separat während Ihres Aufenthaltes bezahlt werden. Die Anzahl an Zustell- und Babybetten ist von der von Ihnen gewählten Option abhängig. Bitte prüfen Sie Ihre ausgewählte Option für mehr Informationen. Alle Babybetten und Zustellbetten unterliegen der Verfügbarkeit. Richtlinien für Kinder Richtlinien zu Baby- und Zustellbetten Kinder jeden Alters sind willkommen. Kinder im Alter von 13 Jahren oder älter zahlen in dieser Unterkunft den Erwachsenenpreis. Fügen Sie Ihrer Suche bitte die Anzahl der Kinder in Ihrer Gruppe und deren Alter hinzu, um die korrekten Preise und Belegungsinformationen zu sehen. Preise für Baby- und Zustellbetten sind nicht im Gesamtpreis enthalten und müssen separat während Ihres Aufenthaltes bezahlt werden. Die Anzahl an Zustell- und Babybetten ist von der von Ihnen gewählten Option abhängig. Bitte prüfen Sie Ihre ausgewählte Option für mehr Informationen. Alle Babybetten und Zustellbetten unterliegen der Verfügbarkeit.",2026-06-02 00:26:19.44808+01
909,7438843a-16ac-41c3-aea4-2dd44b5e35cf,35d7aacd-9ecc-4817-ae4f-938ad32ff9b7,de,Altersbeschränkung,Das Mindestalter für den Check-in beträgt 18 Jahre,2026-06-02 00:26:19.450124+01
910,7438843a-16ac-41c3-aea4-2dd44b5e35cf,35d7aacd-9ecc-4817-ae4f-938ad32ff9b7,de,Haustiere,Haustiere sind nicht gestattet.,2026-06-02 00:26:19.452004+01
911,7438843a-16ac-41c3-aea4-2dd44b5e35cf,35d7aacd-9ecc-4817-ae4f-938ad32ff9b7,de,Gruppen,Bei einer Buchung von mehr als 5 Zimmern können abweichende Richtlinien und zusätzliche Aufpreise gelten.,2026-06-02 00:26:19.453785+01
912,7438843a-16ac-41c3-aea4-2dd44b5e35cf,35d7aacd-9ecc-4817-ae4f-938ad32ff9b7,de,Akzeptierte Zahlungsmethoden,Barzahlung,2026-06-02 00:26:19.455357+01
921,ebaf85b7-692d-4baa-af26-c9ce2a9d311f,b049bdb7-d9eb-409f-afd8-cb6e3e840299,fr,Arrivée,De 15:00 à 00:00 Vous devrez présenter une pièce d'identité avec photo et une carte de crédit lors de l'enregistrement. Vous devrez indiquer à l'avance votre heure d'arrivée à l'établissement.,2026-06-02 00:27:25.508725+01
922,ebaf85b7-692d-4baa-af26-c9ce2a9d311f,b049bdb7-d9eb-409f-afd8-cb6e3e840299,fr,Départ,Jusqu'à 12:00,2026-06-02 00:27:25.533331+01
923,ebaf85b7-692d-4baa-af26-c9ce2a9d311f,b049bdb7-d9eb-409f-afd8-cb6e3e840299,fr,Annulation / Prépaiement,Les conditions d'annulation et de prépaiement varient en fonction du type d'hébergement. Veuillez saisir les dates de votre séjour et consulter les conditions de l'option choisie.,2026-06-02 00:27:25.536811+01
924,ebaf85b7-692d-4baa-af26-c9ce2a9d311f,b049bdb7-d9eb-409f-afd8-cb6e3e840299,fr,Enfants et lits,"Conditions relatives aux enfants Tous les enfants sont les bienvenus. Les enfants âgés de plus de 12 ans seront facturés au tarif adulte dans cet établissement. Pour voir les tarifs et les informations associés à la taille de votre groupe, veuillez ajouter à votre recherche le nombre d'enfants avec qui vous voyagez ainsi que leur âge. Conditions relatives aux lits bébé et aux lits d'appoint 0 - 2 ans Lit d'appoint sur demande Gratuit Lit bébé toujours disponible Gratuit 3 - 11 ans Lit d'appoint sur demande Gratuit Plus de 12 ans Lit d'appoint sur demande € 100 par personne et par nuit Les frais supplémentaires associés aux lits bébé et aux lits d'appoint ne sont pas inclus dans le montant total et devront être payés séparément pendant votre séjour. Le nombre de lits bébé et de lits d'appoint disponibles dépend de l'option que vous choisissez. Veuillez consulter l'option sélectionnée pour obtenir plus d'informations. Tous les lits d'appoint sont soumis à disponibilité. Conditions relatives aux enfants Conditions relatives aux lits bébé et aux lits d'appoint Tous les enfants sont les bienvenus. Les enfants âgés de plus de 12 ans seront facturés au tarif adulte dans cet établissement. Pour voir les tarifs et les informations associés à la taille de votre groupe, veuillez ajouter à votre recherche le nombre d'enfants avec qui vous voyagez ainsi que leur âge. Les frais supplémentaires associés aux lits bébé et aux lits d'appoint ne sont pas inclus dans le montant total et devront être payés séparément pendant votre séjour. Le nombre de lits bébé et de lits d'appoint disponibles dépend de l'option que vous choisissez. Veuillez consulter l'option sélectionnée pour obtenir plus d'informations. Tous les lits d'appoint sont soumis à disponibilité.",2026-06-02 00:27:25.540774+01
925,ebaf85b7-692d-4baa-af26-c9ce2a9d311f,b049bdb7-d9eb-409f-afd8-cb6e3e840299,fr,Restriction relative à l'âge,Les clients doivent avoir au moins 18 ans pour pouvoir s'enregistrer.,2026-06-02 00:27:25.544081+01
926,ebaf85b7-692d-4baa-af26-c9ce2a9d311f,b049bdb7-d9eb-409f-afd8-cb6e3e840299,fr,Animaux domestiques,Les animaux de compagnie sont admis sur demande (un supplément peut s'appliquer).,2026-06-02 00:27:25.546992+01
927,ebaf85b7-692d-4baa-af26-c9ce2a9d311f,b049bdb7-d9eb-409f-afd8-cb6e3e840299,fr,Groupes,Toute réservation de plus de 3 chambres peut entraîner des conditions particulières et des frais supplémentaires.,2026-06-02 00:27:25.549515+01
928,ebaf85b7-692d-4baa-af26-c9ce2a9d311f,b049bdb7-d9eb-409f-afd8-cb6e3e840299,fr,Cartes acceptées par cet hôtel,Les espèces ne sont pas acceptées,2026-06-02 00:27:25.552371+01
929,022fbf1a-d2a1-4ebc-8da7-4b564dfde6d6,35d7aacd-9ecc-4817-ae4f-938ad32ff9b7,it,Arrivo,Dalle 15:00 Al check-in gli ospiti devono esibire un documento di riconoscimento con foto e una carta di credito. Dovrai comunicare in anticipo alla struttura il tuo orario di arrivo.,2026-06-02 00:27:38.964428+01
930,022fbf1a-d2a1-4ebc-8da7-4b564dfde6d6,35d7aacd-9ecc-4817-ae4f-938ad32ff9b7,it,Partenza,Alle 12:00,2026-06-02 00:27:38.967327+01
931,022fbf1a-d2a1-4ebc-8da7-4b564dfde6d6,35d7aacd-9ecc-4817-ae4f-938ad32ff9b7,it,Cancellazione / Pagamento anticipato,Le condizioni relative alla cancellazione e al pagamento anticipato variano a seconda della tipologia di alloggio. Inserisci le date del soggiorno e verifica le condizioni dell'opzione scelta.,2026-06-02 00:27:38.969342+01
932,022fbf1a-d2a1-4ebc-8da7-4b564dfde6d6,35d7aacd-9ecc-4817-ae4f-938ad32ff9b7,it,Bambini e letti,"Condizioni per i bambini I bambini di tutte le età sono i benvenuti. I bambini di 13 anni o più pagheranno quanto gli adulti presso questa struttura. Per vedere informazioni corrette relativamente a prezzi e occupazione, aggiungi alla ricerca il numero e l'età dei bambini che soggiorneranno. Condizioni per culle e letti aggiuntivi 1 - 2 anni Culla su richiesta Gratis 3 - 12 anni Letto supplementare su richiesta € 50 per bambino, a notte Il prezzo delle culle e dei letti supplementari non è incluso nell'importo totale e dovrà essere pagato separatamente durante il soggiorno. Il numero di culle e letti supplementari ammessi dipende dall'opzione che scegli. Controlla quella che hai selezionato per maggiori informazioni. Le culle e i letti supplementari sono soggetti a disponibilità. Condizioni per i bambini Condizioni per culle e letti aggiuntivi I bambini di tutte le età sono i benvenuti. I bambini di 13 anni o più pagheranno quanto gli adulti presso questa struttura. Per vedere informazioni corrette relativamente a prezzi e occupazione, aggiungi alla ricerca il numero e l'età dei bambini che soggiorneranno. Il prezzo delle culle e dei letti supplementari non è incluso nell'importo totale e dovrà essere pagato separatamente durante il soggiorno. Il numero di culle e letti supplementari ammessi dipende dall'opzione che scegli. Controlla quella che hai selezionato per maggiori informazioni. Le culle e i letti supplementari sono soggetti a disponibilità.",2026-06-02 00:27:38.971586+01
933,022fbf1a-d2a1-4ebc-8da7-4b564dfde6d6,35d7aacd-9ecc-4817-ae4f-938ad32ff9b7,it,Età minima,L'età minima per fare il check-in è 18 anni.,2026-06-02 00:27:38.973912+01
